"cond-mat/0107402","Hiroshi Imamura","Saburo Takahashi, Taro Yamashita, Hiroshi Imamura and Sadamichi
  Maekawa","Spin-relaxation and magnetoresistance in FM/SC/FM tunnel junctions","3 pages, 2 figures, to appear in Journal of Magnetism and Magnetic
  Materials (proceedings of the 4th International Symposium on Metallic
  Multilayers, MML'01, Aachen, June 24-29, 2001)",,"10.1016/S0304-8853(01)00714-4",,"cond-mat.mes-hall cond-mat.supr-con",,"  The effect of spin relaxation on tunnel magnetoresistance (TMR) in a
ferromagnet/superconductor/ferromagnet (FM/SC/FM) double tunnel junction is
theoretically studied. The spin accumulation in SC is determined by balancing
of the spin-injection rate and the spin-relaxation rate. In the superconducting
state, the spin-relaxation time becomes longer with decreasing temperature,
resulting in a rapid increase of TMR. The TMR of FM/SC/FM junctions provides a
useful probe to extract information about spin-relaxation in superconductors.
","[{""version"":""v1"",""created"":""Thu, 19 Jul 2001 11:01:56 GMT""}]","2009-11-07"
"cond-mat/0107403","Ian D. Lawrie","Dominic J. Lee and Ian D. Lawrie","Critical-point scaling function for the specific heat of a
  Ginzburg-Landau superconductor","20 pages; 4 figures",,"10.1103/PhysRevB.64.184506",,"cond-mat.supr-con",,"  If the zero-field transition in high temperature superconductors such as
YBa_2Cu_3O_7-\delta is a critical point in the universality class of the
3-dimensional XY model, then the general theory of critical phenomena predicts
the existence of a critical region in which thermodynamic functions have a
characteristic scaling form. We report the first attempt to calculate the
universal scaling function associated with the specific heat, for which
experimental data have become available in recent years. Scaling behaviour is
extracted from a renormalization-group analysis, and the 1/N expansion is
adopted as a means of approximation. The estimated scaling function is
qualitatively similar to that observed experimentally, and also to the
lowest-Landau-level scaling function used by some authors to provide an
alternative interpretation of the same data. Unfortunately, the 1/N expansion
is not sufficiently reliable at small values of N for a quantitative fit to be
feasible.
","[{""version"":""v1"",""created"":""Thu, 19 Jul 2001 11:03:27 GMT""}]","2009-11-07"
"cond-mat/0107404","Alexandre Rosas","Alexandre Rosas and S\'ergio Coutinho","The Random Field Ising Model on Hierarchical Lattices I: Phase Diagram
  and Thermodynamics","8 pages, revtex4",,,,"cond-mat.dis-nn",,"  The phase diagram and the thermodynamics of the random field Ising model
(RFIM) defined on a family of diamond hierarchical lattices of arbitrary
dimension and scaling factor $b=2$ is investigated. The phase diagram is
studied considering the flow of the renormalized joint probability
distributions of couplings and fields. A continuous (Gaussian) and a discrete
(delta-bimodal) initial symmetric probability distributions for the random
fields with variance $H_{0}$ are particularly considered. The thermodynamics
properties (energy, specific heat and magnetization) are obtained by an exact
recurrence procedure and analyzed as function of the temperature and the random
field. Close and above the paramagnetic-ferromagnetic transition evidences of
the formation of rare but large field induced correlated clusters of reversed
spins are observed. For all studied properties no strong qualitative distinct
behavior is found whenever the continuous or the discrete distribution of
random fields are considered.
","[{""version"":""v1"",""created"":""Thu, 19 Jul 2001 12:59:00 GMT""}]","2007-05-23"
"cond-mat/0107405","Peixun Luo","Peixun Luo and K. Y. Michael Wong","The Cavity Approach to Noisy Learning in Nonlinear Perceptrons","13 figures, one table",,"10.1103/PhysRevE.64.061912",,"cond-mat.dis-nn cond-mat.stat-mech",,"  We analyze the learning of noisy teacher-generated examples by nonlinear and
differentiable student perceptrons using the cavity method. The generic
activation of an example is a function of the cavity activation of the example,
which is its activation in the perceptron that learns without the example. Mean
field equations for the macroscopic parameters and the stability condition
yield results consistent with the replica method. When a single value of the
cavity activation maps to multiple values of the generic activation, there is a
competition in learning strategy between preferentially learning an example and
sacrificing it in favor of the background adjustment. We find parameter regimes
in which examples are learned preferentially or sacrificially, leading to a gap
in the activation distribution. Full phase diagrams of this complex system are
presented, and the theory predicts the existence of a phase transition from
poor to good generalization states in the system. Simulation results confirm
the theoretical predictions.
","[{""version"":""v1"",""created"":""Thu, 19 Jul 2001 13:17:13 GMT""}]","2009-11-07"
"cond-mat/0107406","John A. Skinta","J. A. Skinta, T. R. Lemberger (Ohio State University), E. Wertz, K.
  Wu, and Q. Li (Pennsylvania State University)","Fluctuations Indicate Strong Interlayer Coupling in Cuprate
  Superconductors","6 pages, 2 figures, submitted to Phys. Rev. Lett",,,,"cond-mat.supr-con",,"  From study of the Kosterlitz-Thouless-Berezinskii (KTB) transition in the
superfluid density, n_s(T), of ultrathin c-axis oriented
YBa_{2}Cu_{3}O_{7-\delta} (YBCO) films, we find that interlayer coupling is
unexpectedly strong. The KTB transition occurs at a high temperature, as if the
films were isotropic rather than quasi-two-dimensional. This result agrees with
a comparison of the superfluid density of YBCO with Bi_{2}Sr_{2}CaCu_{2}O_{8}
and with numerical simulations of Josephson junction arrays, and challenges the
thermal phase fluctuation interpretation of critical behavior near T_c in YBCO.
","[{""version"":""v1"",""created"":""Thu, 19 Jul 2001 13:19:16 GMT""}]","2007-05-23"
"cond-mat/0107407","Alexandre Rosas","Alexandre Rosas and S\'ergio Coutinho","The Random Field Ising Model on Hierarchical Lattices II: Ground State
  Critical Properties","revtex4",,,,"cond-mat.dis-nn",,"  The ground state critical properties of the Random Field Ising Model (RFIM)
on the diamond hierarchical lattice are investigated via a combining method
encompassing real space renormalization group and an exact recurrence
procedure. The local magnetization and the nearest neighbors pair correlation
function are exactly calculated. The fixed-point joint probability distribution
of couplings and local fields are numerically obtained and analyzed, indicating
that the critical behavior of the model is governed by the zero temperature
disorder fixed point. The critical exponents associated with the order
parameter and correlation length are estimated showing an universal behavior
regarding the choice of the initial probability distribution for initial local
fields being the symmetric continuous Gaussian or discrete delta-bimodal.
","[{""version"":""v1"",""created"":""Thu, 19 Jul 2001 13:37:43 GMT""}]","2007-05-23"
"cond-mat/0107408","Deblock","Y. Noat, R. Deblock, B. Reulet and H. Bouchiat","Magneto-polarisability of mesoscopic systems","12 pages, 10 figures, revtex","Phys. Rev. B 65, 075305 (2002)","10.1103/PhysRevB.65.075305",,"cond-mat.mes-hall",,"  In order to understand how screening is modified by electronic interferences
in a mesoscopic isolated system, we have computed both analytically and
numerically the average thermodynamic and time dependent polarisabilities of
two dimensional mesoscopic samples in the presence of an Aharonov-Bohm flux.
Two geometries have been considered: rings and squares. Mesoscopic correction
to screening are taken into account in a self consistent way, using the
response function formalism. The role of the statistical ensemble (canonical
and grand canonical), disorder and frequency have been investigated. We have
also computed first order corrections to the polarisability due to
electron-electron interactions. Our main results concern the diffusive regime.
In the canonical ensemble, there is no flux dependence polarisability when the
frequency is smaller than the level spacing. On the other hand, in the grand
canonical ensemble for frequencies larger than the mean broadening of the
energy levels (but still small compared to the level spacing), the
polarisability oscillates with flux, with the periodicity $h/2e$. The order of
magnitude of the effect is given by $\delta \alpha/\alpha \propto
(\lambda_s/Wg)$, where $\lambda$ is the Thomas Fermi screening length, $W$ the
width of the rings or the size of the squares and $g$ their average
dimensionless conductance. This magnetopolarisability of Aharonov-Bohm rings
has been recently measured experimentally \cite{PRL_deblock00} and is in good
agreement with our grand canonical result.
","[{""version"":""v1"",""created"":""Thu, 19 Jul 2001 13:56:21 GMT""}]","2009-11-07"
"cond-mat/0107409","Semjon Stepanow","Semjon Stepanow","Adsorption of a semiflexible polymer onto interfaces and surfaces","9 pages, 2 figures","J.Chem.Phys. 115, 1565 (2001)","10.1063/1.1379533",,"cond-mat.soft cond-mat.stat-mech",,"  We consider the adsorption of a semiflexible polymer chain onto interfaces
and surfaces by using the differential equation of the distribution function
$G(R,L)$ of the end-to-end distance $R$, which is associated with the moment
expansion of the latter. We present the results of the approximative treatment
consisting of taking into account the 2nd and 4th moments in the differential
equation for $G(R,L)$. The essential features of adsorption of the semiflexible
polymer are: {\it i}) the existence of a new local length scale, which results
in two-exponential decay of the monomer density of adsorbed polymer; {\it ii})
the binding of the semiflexible polymer is weaker than that for flexible one
for both interface and wall. The approximative theory presented is restricted
to the regime of weak adsorption, where the effect of the rodlike behavior of
the polymer on small scales is weak.
","[{""version"":""v1"",""created"":""Thu, 19 Jul 2001 14:01:21 GMT""}]","2009-11-07"
"cond-mat/0107410","Milorad Milosevic","M.V.Milosevic, S.V.Yampolskii, and F.M.Peeters","Vortex structure of thin mesoscopic disks in the presence of an
  inhomogeneous magnetic field","17 pages, 23 figures. Submitted to PRB","Phys. Rev. B 66, 024515 (2002)","10.1103/PhysRevB.66.024515",,"cond-mat.supr-con",,"  The vortex states in a thin mesoscopic disk are investigated within the
phenomenological Ginzburg-Landau theory in the presence of different ''model''
magnetic field profiles with zero average field which may result from a
ferromagnetic disk or circulating currents in a loop near the superconductor.
We calculated the dependences of both the ground and metastable states on the
magnitude and shape of the magnetic field profile for different values of the
order parameter angular moment, i.e. the vorticity. The regions of existence of
the multi-vortex state and the giant vortex state are found. We analysed the
phase transitions between these states and studied the contribution from
ring-shaped vortices. A new transition between different multi-vortex
configurations as the ground state is found. Furthermore, we found a vortex
state consisting of a central giant vortex surrounded by a collection of
anti-vortices which are located in a ring around this giant vortex. The limit
to a disk with an infinite radius, i.e. a film, will also be discussed. We also
extended our results to ''real'' magnetic field profiles and to the case in
which an external homogeneous magnetic field is present.
","[{""version"":""v1"",""created"":""Thu, 19 Jul 2001 14:11:22 GMT""},{""version"":""v2"",""created"":""Fri, 28 Sep 2001 12:32:33 GMT""},{""version"":""v3"",""created"":""Thu, 1 Nov 2001 11:26:34 GMT""}]","2009-11-07"
"cond-mat/0107411","Sergio L. A. de Queiroz","S. L. A. de Queiroz, M. Bahiana","Finite driving rates in interface models of Barkhausen noise","7 pages, 6 figures, RevTeX, final version to be published in Phys.
  Rev. E","Physical Review E 64, article # 066127 (2001)","10.1103/PhysRevE.64.066127",,"cond-mat.stat-mech cond-mat.dis-nn",,"  We consider a single-interface model for the description of Barkhausen noise
in soft ferromagnetic materials. Previously, the model had been used only in
the adiabatic regime of infinitely slow field ramping. We introduce finite
driving rates and analyze the scaling of event sizes and durations for
different regimes of the driving rate. Coexistence of intermittency, with
non-trivial scaling laws, and finite-velocity interface motion is observed for
high enough driving rates. Power spectra show a decay $\sim \omega^{-t}$, with
$t<2$ for finite driving rates, revealing the influence of the internal
structure of avalanches.
","[{""version"":""v1"",""created"":""Thu, 19 Jul 2001 14:12:51 GMT""},{""version"":""v2"",""created"":""Fri, 5 Oct 2001 21:19:44 GMT""}]","2009-11-07"
"cs/0107025","Daumas","Sylvie Boldo, Marc Daumas, Claire Moreau-Finot, Laurent Thery","Computer validated proofs of a toolset for adaptable arithmetic","21 pages, web links",,,,"cs.MS",,"  Most existing implementations of multiple precision arithmetic demand that
the user sets the precision {\em a priori}. Some libraries are said adaptable
in the sense that they dynamically change the precision of each intermediate
operation individually to deliver the target accuracy according to the actual
inputs. We present in this text a new adaptable numeric core inspired both from
floating point expansions and from on-line arithmetic.
  The numeric core is cut down to four tools. The tool that contains arithmetic
operations is proved to be correct. The proofs have been formally checked by
the Coq assistant. Developing the proofs, we have formally proved many results
published in the literature and we have extended a few of them. This work may
let users (i) develop application specific adaptable libraries based on the
toolset and / or (ii) write new formal proofs based on the set of validated
facts.
","[{""version"":""v1"",""created"":""Thu, 19 Jul 2001 13:18:31 GMT""},{""version"":""v2"",""created"":""Tue, 30 Oct 2001 16:11:45 GMT""}]","2007-05-23"
"cs/0107026","Miroslaw Truszczynski","Victor Marek, Inna Pivkina, Miroslaw Truszczynski","Annotated revision programs","30 pages, to appear in Artificial Intelligence Journal","Artificial Intelligence Journal, 138 (2002), pp. 149-180.",,,"cs.AI cs.LO",,"  Revision programming is a formalism to describe and enforce updates of belief
sets and databases. That formalism was extended by Fitting who assigned
annotations to revision atoms. Annotations provide a way to quantify the
confidence (probability) that a revision atom holds. The main goal of our paper
is to reexamine the work of Fitting, argue that his semantics does not always
provide results consistent with intuition, and to propose an alternative
treatment of annotated revision programs. Our approach differs from that
proposed by Fitting in two key aspects: we change the notion of a model of a
program and we change the notion of a justified revision. We show that under
this new approach fundamental properties of justified revisions of standard
revision programs extend to the annotated case.
","[{""version"":""v1"",""created"":""Thu, 19 Jul 2001 15:41:36 GMT""}]","2007-05-23"
"cs/0107027","Miroslaw Truszczynski","Zbigniew Lonc, Miroslaw Truszczynski","Fixed-parameter complexity of semantics for logic programs","Submission to ACM TOCL; full version of the paper published in the
  Proceedings of ICLP 2001 (Springer Verlag)","ACM Transactions on Computational Logic, 4 (2003), pp. 91-119.",,,"cs.LO cs.AI",,"  A decision problem is called parameterized if its input is a pair of strings.
One of these strings is referred to as a parameter. The problem: given a
propositional logic program P and a non-negative integer k, decide whether P
has a stable model of size no more than k, is an example of a parameterized
decision problem with k serving as a parameter. Parameterized problems that are
NP-complete often become solvable in polynomial time if the parameter is fixed.
The problem to decide whether a program P has a stable model of size no more
than k, where k is fixed and not a part of input, can be solved in time
O(mn^k), where m is the size of P and n is the number of atoms in P. Thus, this
problem is in the class P. However, algorithms with the running time given by a
polynomial of order k are not satisfactory even for relatively small values of
k.
  The key question then is whether significantly better algorithms (with the
degree of the polynomial not dependent on k) exist. To tackle it, we use the
framework of fixed-parameter complexity. We establish the fixed-parameter
complexity for several parameterized decision problems involving models,
supported models and stable models of logic programs. We also establish the
fixed-parameter complexity for variants of these problems resulting from
restricting attention to Horn programs and to purely negative programs. Most of
the problems considered in the paper have high fixed-parameter complexity.
Thus, it is unlikely that fixing bounds on models (supported models, stable
models) will lead to fast algorithms to decide the existence of such models.
","[{""version"":""v1"",""created"":""Thu, 19 Jul 2001 15:52:54 GMT""},{""version"":""v2"",""created"":""Tue, 31 Jul 2001 13:33:36 GMT""}]","2007-05-23"
"gr-qc/0107064","Spyros S. Kouris","Spyros S. Kouris","The Weyl tensor two-point function in de Sitter spacetime","9 pages, no figures","Class.Quant.Grav. 18 (2001) 4961-4968","10.1088/0264-9381/18/22/316",,"gr-qc",,"  We present an expression for the Weyl-Weyl two-point function in de Sitter
spacetime, based on a recently calculated covariant graviton two-point function
with one gauge parameter. We find that the Weyl-Weyl two-point function falls
off with distance like r^{-4}, where r is spacelike coordinate separation
between the two points.
","[{""version"":""v1"",""created"":""Wed, 18 Jul 2001 20:17:43 GMT""}]","2009-11-07"
"gr-qc/0107065","Eugen Radu","J.J. van der Bij, Eugen Radu (Faculty of Physics,
  Albert-Ludwigs-University, Freiburg, Germany)","New hairy black holes with negative cosmological constant","14 pages, 6 Encapsulated PostScript figures, references added","Phys.Lett. B536 (2002) 107-113","10.1016/S0370-2693(02)01808-7","Freiburg-THEP 01/12","gr-qc",,"  Black hole solutions with nonspherical event horizon topology are shown to
exist in an Einstein-Yang-Mills theory with negative cosmological constant. The
main characteristics of the solutions are presented and differences with
respect to the spherically symmetric case are studied. The stability of these
configurations is also addressed.
","[{""version"":""v1"",""created"":""Wed, 18 Jul 2001 18:11:48 GMT""},{""version"":""v2"",""created"":""Thu, 19 Jul 2001 16:47:42 GMT""}]","2009-11-07"
"gr-qc/0107066","Gaetano Lambiase","G. Lambiase","Neutrino Oscillations Induced by Gravitational Recoil Effects","5 pages, LaTex file","Gen.Rel.Grav.33:2151-2156,2001","10.1023/A:1015237615390",,"gr-qc hep-ph",,"  Quantum gravitational fluctuations of the space-time background, described by
virtual D branes, may induce neutrino oscillations if a tiny violation of the
Lorentz invariance (or a violation of the equivalence principle) is imposed. In
this framework, the oscillation length of massless neutrinos turns out to be
proportional to M/E^2, where E is the neutrino energy and M is the mass scale
characterizing the topological fluctuations in the vacuum. Such a functional
dependence on the energy is the same obtained in the framework of loop quantum
gravity.
","[{""version"":""v1"",""created"":""Wed, 18 Jul 2001 18:15:02 GMT""}]","2014-11-17"
"gr-qc/0107067","Duncan Noltingk","Duncan Noltingk","Classical History Theory of Vector Fields","26 pages","J.Math.Phys. 43 (2002) 3036-3052","10.1063/1.1473218",,"gr-qc",,"  We consider the extension of classical history theory to the massive vector
field and electromagnetism. It is argued that the action of the two Poincare
groups introduced by Savvidou suggests that the history fields should have five
components. The extra degrees of freedom introduced to make the fields
five-dimensional result in an extra pair of second class constraints in the
case of the massive vector field, and in an extended gauge group in the case of
electromagnetism. The total gauge transformations depend on two arbitrary
parameters, and contain `internal' and `external' U(1) gauge transformations as
subgroups.
","[{""version"":""v1"",""created"":""Thu, 19 Jul 2001 13:55:11 GMT""}]","2015-06-25"
"hep-ex/0107044","Andreas S. Kronfeld","Paul F. Derwent, Bogdan A. Dobrescu, Andreas S. Kronfeld, Heather E.
  Logan, Konstantin T. Matchev, Adam Para, David L. Rainwater, Slawomir
  Tkaczyk, and William C. Wester III","Linear Collider Physics","58 pp. Report prepared for Fermilab Directorate",,,"FERMILAB-FN-701","hep-ex hep-ph physics.acc-ph",,"  We report on a study of the physics potential of linear $e^+e^-$ colliders.
Although a linear collider (LC) would support a broad physics program, we focus
on the contributions that could help elucidate the origin of electroweak
symmetry breaking. Many extensions of the standard model have a decoupling
limit, with a Higgs boson similar to the standard one and other, higher-mass
states. Mindful of such possibilities, we survey the physics of a (nearly)
standard Higgs boson, as a function of its mass. We also review how
measurements from an LC could help verify several well-motivated extensions of
the standard model. For supersymmetry, we compare the strengths of an LC with
the LHC. Also, assuming the lightest superpartner explains the missing dark
matter in the universe, we examine other places to search for a signal of
supersymmetry. We compare the signatures of several scenarios with extra
spatial dimensions. We also explore the possibility that the Higgs is a
composite, concentrating on models that (unlike technicolor) have a Higgs boson
with mass of a few hundred GeV or less. Where appropriate, we mention the
importance of high luminosity, for example to measure branching ratios of the
Higgs, and the importance of multi-TeV energies, for example to explore the
full spectrum of superpartners.
","[{""version"":""v1"",""created"":""Wed, 18 Jul 2001 16:45:26 GMT""}]","2007-05-23"
"hep-ex/0107045","Leo Bellantoni","L. Bellantoni (for the KTeV collaboration)","Recent Results from KTeV","Proceedings for 2001 Moriond Electroweak and Unified Theory",,,"Fermilab-Conf-01/220-E","hep-ex",,"  Recent results are presented for (1) the charge asymmetry in semielectronic
kaon decay; (2) the charge radius of the neutral kaon; (3) the decay Klong ->
pi0 pi0 e+e-; (4) constraints on rho(CKM) from kaon decays; (5) lepton flavor
violation. A few words about future kaon physics work at Fermilab are included.
","[{""version"":""v1"",""created"":""Wed, 18 Jul 2001 23:05:20 GMT""}]","2019-08-14"
"hep-lat/0107014","Tom Degrand","Thomas DeGrand (MILC collaboration)","Another determination of the quark condensate from an overlap action","3 pages, Revtex, 1 postscript figure. References added. COLO-HEP-471","Phys.Rev.D64:117501,2001","10.1103/PhysRevD.64.117501",,"hep-lat",,"  I use the technique of Hernandez, et al (hep-lat/0106011) to convert a recent
calculation of the lattice-regulated quark condensate from an overlap action to
a continuum-regulated number. I find Sigma(MSbar)(mu = 2 GeV) = (282(6)
MeV)-cubed times (a-inverse/1766 MeV)-cubed from a calculation with the Wilson
gauge action at beta=5.9.
","[{""version"":""v1"",""created"":""Wed, 18 Jul 2001 17:05:11 GMT""},{""version"":""v2"",""created"":""Tue, 24 Jul 2001 19:20:37 GMT""}]","2008-11-26"
"hep-lat/0107015","Zdzislaw Burda","L.Bogacz, Z.Burda, C.Petersen, B.Petersson","Spectrum of the Dirac operator coupled to two-dimensional quantum
  gravity","26 pages, Latex + 23 eps figs, extended analysis of the spectrum,
  added figures","Nucl.Phys. B630 (2002) 339-358","10.1016/S0550-3213(02)00180-3","BI-TP 2001/14","hep-lat",,"  We implement fermions on dynamical random triangulation and determine
numerically the spectrum of the Dirac-Wilson operator D for the system of
Majorana fermions coupled to two-dimensional Euclidean quantum gravity. We
study the dependence of the spectrum of the operator (epsilon D) on the hopping
parameter. We find that the distributions of the lowest eigenvalues become
discrete when the hopping parameter approaches the value 1/sqrt{3}. We show
that this phenomenon is related to the behavior of the system in the
'antiferromagnetic' phase of the corresponding Ising model. Using finite size
analysis we determine critical exponents controlling the scaling of the lowest
eigenvalue of the spectrum including the Hausdorff dimension d_H and the
exponent kappa which tells us how fast the pseudo-critical value of the hopping
parameter approaches its infinite volume limit.
","[{""version"":""v1"",""created"":""Thu, 19 Jul 2001 11:58:58 GMT""},{""version"":""v2"",""created"":""Tue, 19 Mar 2002 12:45:21 GMT""}]","2009-11-07"
