"hep-lat/0107016","Christof Gattringer","Christof Gattringer, Meinulf Goeckeler, P.E.L. Rakow, Stefan Schaefer
  and Andreas Schaefer","Properties of near-zero modes and chiral symmetry breaking","Minor changes in the discussion, references added. To appear in
  Nuclear Physics B","Nucl.Phys.B617:101-116,2001","10.1016/S0550-3213(01)00478-3",,"hep-lat hep-ph",,"  We study localization and chirality properties of eigenvectors of the lattice
Dirac operator. In particular we focus on the dependence of our observables on
the size of the corresponding eigenvalue, which allows us to study the
transition of a near-zero mode into a bulk mode. We analyze ensembles of
quenched SU(3) configurations using a Dirac operator which is a systematic
expansion in path length of a solution of the Ginsparg-Wilson equation. Our
results support the interpretation of the excitations relevant for chiral
symmetry breaking as interacting instantons and anti-instantons.
","[{""version"":""v1"",""created"":""Thu, 19 Jul 2001 12:16:53 GMT""},{""version"":""v2"",""created"":""Wed, 7 Nov 2001 13:52:01 GMT""}]","2008-11-26"
"hep-ph/0107196","Mustafa Savci","T. M. aliev, A. Ozpineci, M. Savci","The magnetic moments of 'Lambda_b' and 'Lambda_c' baryons in light cone
  QCD sum rules","14 pp, 6 figures (postscript formatted), LaTex formatted","Phys.Rev. D65 (2002) 056008","10.1103/PhysRevD.65.056008","metu-phys-hep-ph-01-31","hep-ph",,"  Using the most general form of the interpolating currents of heavy baryons,
the magnetic moments of heavy baryons ""Lambda_Q (Q=b,c)"" are calculated in
framework of the light cone QCD sum rules. A comparison of our results on
magnetic moments with the existing theoretical results calculated in various
other frameworks are presented.
","[{""version"":""v1"",""created"":""Wed, 18 Jul 2001 20:09:44 GMT""},{""version"":""v2"",""created"":""Thu, 4 Oct 2001 14:33:48 GMT""},{""version"":""v3"",""created"":""Mon, 3 Mar 2003 17:51:32 GMT""}]","2009-11-07"
"hep-ph/0107199","U. Meissner","Bastian Kubis and Ulf-G. Mei{\ss}ner","Isospin violation in pion-kaon scattering","23 pp, 3 figs. (uses epsf), error corrected, version to appear in
  Nuclear Physics A","Nucl.Phys. A699 (2002) 709-731","10.1016/S0375-9474(01)01318-5","FZJ-IKP(TH)-2001-11","hep-ph hep-ex nucl-th",,"  We consider strong and electromagnetic isospin violation in near-threshold
pion-kaon scattering. At tree level, such effects are small for all physical
channels. We work out the complete one-loop corrections to the process pi^- K^+
-> pi^0 K^0. They come out rather small. We also show that the corresponding
radiative cross section is highly suppressed at threshold.
","[{""version"":""v1"",""created"":""Wed, 18 Jul 2001 16:35:02 GMT""},{""version"":""v2"",""created"":""Wed, 1 Aug 2001 13:55:25 GMT""},{""version"":""v3"",""created"":""Wed, 19 Dec 2001 14:12:25 GMT""}]","2009-11-07"
"hep-ph/0107200","Hendrik van Hees","H. Hees, J. Knoll","Renormalization in Self-Consistent Approximations schemes at Finite
  Temperature I: Theory","22 Pages 1 figure, uses RevTeX4. The Revision concerns the correction
  of some minor typos, a clarification concerning the real-time contour
  structure of renormalization parts and some comments concerning symmetries in
  the conclusions and outlook","Phys.Rev. D65 (2002) 025010","10.1103/PhysRevD.65.025010",,"hep-ph cond-mat nucl-th",,"  Within finite temperature field theory, we show that truncated
non-perturbative self-consistent Dyson resummation schemes can be renormalized
with local counter-terms defined at the vacuum level. The requirements are that
the underlying theory is renormalizable and that the self-consistent scheme
follows Baym''s $\Phi$-derivable concept. The scheme generates both, the
renormalized self-consistent equations of motion and the closed equations for
the infinite set of counter terms. At the same time the corresponding
2PI-generating functional and the thermodynamical potential can be
renormalized, in consistency with the equations of motion. This guarantees the
standard $\Phi$-derivable properties like thermodynamic consistency and exact
conservation laws also for the renormalized approximation schemes to hold. The
proof uses the techniques of BPHZ-renormalization to cope with the explicit and
the hidden overlapping vacuum divergences.
","[{""version"":""v1"",""created"":""Wed, 18 Jul 2001 20:59:15 GMT""},{""version"":""v2"",""created"":""Wed, 29 Aug 2001 14:09:14 GMT""}]","2009-11-07"
"hep-ph/0107201","Luca Silvestrini","A. Masiero, C.A. Scrucca, M. Serone and L. Silvestrini","Non-local symmetry breaking in Kaluza-Klein theories","v2: Wilson loop contributions and generalization to SU(N) included;
  references added. v3: version to appear in Phys. Rev. Lett","Phys.Rev.Lett.87:251601,2001","10.1103/PhysRevLett.87.251601","CERN-TH/2001-193, ROMA-1319/01, SISSA-58/2001/EP","hep-ph hep-th",,"  Scherk-Schwarz gauge symmetry breaking of a D-dimensional field theory model
compactified on a circle is analyzed. It is explicitly shown that forbidden
couplings in the unbroken theory appear in the one-loop effective action only
in a non-local way, implying that they are finite at all orders in perturbation
theory. This result can be understood as a consequence of the local gauge
symmetry, but it holds true also in the global limit.
","[{""version"":""v1"",""created"":""Wed, 18 Jul 2001 18:00:43 GMT""},{""version"":""v2"",""created"":""Fri, 27 Jul 2001 15:45:51 GMT""},{""version"":""v3"",""created"":""Fri, 30 Nov 2001 17:35:21 GMT""}]","2010-05-28"
"hep-ph/0107202","Stanislaw Tatur","Jan Bartelski, Stanislaw Tatur","Comparison of the fits to data on polarised structure functions and spin
  asymmetries","16 pages, latex, 2 figures","Phys.Rev. D65 (2002) 034002","10.1103/PhysRevD.65.034002",,"hep-ph",,"  In order to obtain polarised parton densities we have made next to leading
order QCD fit using experimental data on deep inelastic structure functions on
nucleons. This fit is compared with the updated fit to coresponding spin
asymmetries. We get very similar results for all fits also for different data
samples. It seems that only polarised parton densities for non-strange quarks
$\Delta u$ and $\Delta d$ are relatively well determined from the present deep
inelastic experiments. Inegrated gluon contribution at $Q^{2}=1 {\rm GeV^{2}}$
is, as in our previous fits, very small.
","[{""version"":""v1"",""created"":""Wed, 18 Jul 2001 18:52:45 GMT""}]","2009-11-07"
"hep-ph/0107203","Ernest Ma","Ernest Ma (UC Riverside) and G. Rajasekaran (IMSC, Chennai)","Light Unstable Sterile Neutrino","Discussion and references added","Phys.Rev. D64 (2001) 117303","10.1103/PhysRevD.64.117303","UCRHEP-T312 (July 2001)","hep-ph",,"  The three massless active (doublet) neutrinos may mix with two heavy and one
\underline {light} sterile (singlet) neutrinos so that the induced masses and
mixings among the former are able to explain the present data on atmospheric
and solar neutrino oscillations. If the LSND result is also to be explained,
one active neutrino mass eigenstate must mix with the light sterile neutrino. A
specific model is proposed with the spontaneous and soft explicit breaking of a
new global $U(1)_S$ symmetry so that a sterile neutrino will decay into an
active antineutrino and a nearly massless pseudo-Majoron.
","[{""version"":""v1"",""created"":""Wed, 18 Jul 2001 19:57:41 GMT""},{""version"":""v2"",""created"":""Thu, 26 Jul 2001 20:55:19 GMT""}]","2009-11-07"
"hep-ph/0107204","Rishikesh Vaidya","Anjan S. Joshipura, Rishikesh D. Vaidya and Sudhir K. Vempati","Neutrino Anomalies in Gauge Mediated Model with Trilinear R violation","26 pages Latex, 2 figures, certain sections rewritten, improved
  discussion about derivations added. To appear in Physical Review D","Phys.Rev. D65 (2002) 053018","10.1103/PhysRevD.65.053018","TIFR/TH/01-26","hep-ph",,"  The structure of neutrino masses and mixing resulting from trilinear $R$
violating interactions is studied in the presence of the gauge mediated
supersymmetry breaking. Neutrino masses arise in this model at tree level
through the RG-induced vacuum expectation values of the sneutrinos and also
through direct contribution at 1-loop. The relative importance of these
contributions is determined by the values of the strong and weak coupling
constants. In case of purely $\lambda'$ couplings, the tree contribution
dominates over the 1-loop diagram. In this case, one simultaneously obtains
atmospheric neutrino oscillations and quasi-vacuum oscillations of the solar
neutrinos if all the $\l'$ couplings are assumed to be of similar magnitudes.
If R parity violation arises from the trilinear $\l$ couplings, then the loop
induced contribution dominates over the tree level. One cannot simultaneously
explain the solar and atmospheric deficit in this case if all the $\l$
couplings are of similar magnitude. This however becomes possible with
hierarchical $\l$ and we give a specific example of this.
","[{""version"":""v1"",""created"":""Thu, 19 Jul 2001 06:47:12 GMT""},{""version"":""v2"",""created"":""Mon, 5 Nov 2001 07:18:19 GMT""}]","2009-11-07"
"hep-ph/0107206","Satoshi Mishima","S. Mishima","Understanding the penguin amplitude in $B \to \phi K$ decays","7 pages, 2 figures, version to appear in PLB","Phys.Lett. B521 (2001) 252-258","10.1016/S0370-2693(01)01206-0","DPNU-01-15","hep-ph",,"  We calculate branching ratios for pure penguin decay modes, $B\to \phi K$
decays using perturbative QCD approach. Our results of branching ratios are
consistent with the experimental data and larger than those obtained from the
naive factorization assumption and the QCD-improved factorization approach.
This is due to a dynamical penguin enhancement in perturbative QCD approach.
","[{""version"":""v1"",""created"":""Thu, 19 Jul 2001 08:23:13 GMT""},{""version"":""v2"",""created"":""Fri, 20 Jul 2001 06:02:28 GMT""},{""version"":""v3"",""created"":""Fri, 16 Nov 2001 14:31:00 GMT""}]","2009-11-07"
"hep-ph/0107207","Peschanski","H. Navelet and R. Peschanski","Unifying approach to hard diffraction","4pages, 1 figure, letter submitted for publication","Phys.Rev.Lett.87:252002,2001","10.1103/PhysRevLett.87.252002","T01/079 (Saclay)","hep-ph",,"  We find a consistency between two different approaches of hard diffraction,
namely the QCD dipole model and the Soft Colour Interaction approach. A
theoretical interpretation in terms of S-Matrix and perturbative QCD properties
in the small $x_{Bj}$ regime is proposed.
","[{""version"":""v1"",""created"":""Thu, 19 Jul 2001 13:57:41 GMT""},{""version"":""v2"",""created"":""Wed, 26 Sep 2001 15:29:01 GMT""}]","2008-11-26"
"hep-ph/0107208","Jean-Marc Laget","J.-M. Laget","The photoproduction of vector mesons","10 pages; 9 figures; Invited talk at the ""Third International
  Conference on Perspectives in Hadronic Physics"", Trieste (Italy), 7--11 May
  2001; Nucl. Phys. A, in press","Nucl.Phys. A699 (2002) 184-191","10.1016/S0375-9474(01)01492-0",,"hep-ph",,"  At high energy, the photoproduction or electroproduction of Vector Mesons
allow to prepare a beam of quark-antiquark pairs of a given flavor. At high
momentum transfer, the study of the scattering of these pairs on a nucleon
opens up an original window on the quark-gluon structure of hadronic matter,
which may eventually shed light on its gluonic content, on correlations between
quarks and on the van der Walls part of the interaction between hadrons.
","[{""version"":""v1"",""created"":""Thu, 19 Jul 2001 14:14:52 GMT""}]","2009-11-07"
"hep-ph/0107209","Yuichiro Kiyo","Y. Kiyo","Top quark mass determination near t\bar{t} threshold at lepton colliders","8 pages(LaTex), 3 figures. To appear in the proceedings of ``Theory
  Meeting on Physics at Linear Colliders'', Mar 15-17, 2001, KEK,Tsukuba, Japan",,,"TU-626","hep-ph",,"  Future e^+ e^- linear colliders will enable us to determine the top quark
mass with high accuracy from the measurement of the 1S peak position of
(remnant of) toponium. The estimated statistical error in this measurement is
about 50 MeV with integrated luminosity of 30 ${\rm fb^{-1}}$. We calculate
${\cal O}(\alpha_s^5 m)$ corrections to the quarkonium 1S energy spectrum in
the large-$\beta_0$ approximation to reduce theoretical uncertainties below the
corresponding experimental error. We discuss the significance of the ${\cal
O}(\alpha_s^5 m)$ corrections and estimate theoretical uncertainties of our
prediction.
","[{""version"":""v1"",""created"":""Thu, 19 Jul 2001 14:17:55 GMT""}]","2007-05-23"
"hep-ph/0107210","Liliana Micu","L.Micu","Relativistic covariance and the bound state wave function","6 pages, RevteX",,,,"hep-ph",,"  We establish a relation between the solution of a relativistic bound state
equation in quantum mechanics and the field representation of a bound state
with the aid of creation and annihilation operators. We show that a bound
system can be represented by a gas of free constituents and a classical
effective field representing the countless quantum fluctuations generating the
binding potential. The distribution function of the internal momenta is given
by the projection of the free states on the solution of a relativistic bound
state equation in the rest frame of the bound system. In this approach Lorentz
covariance, mass-shell constraints and single particle normalizability of the
bound state function are simultaneously and explicitly satisfied. The
discussion is made for a two particle bound state and can be easily generalized
to the case of three or more particles.
","[{""version"":""v1"",""created"":""Thu, 19 Jul 2001 15:18:24 GMT""}]","2007-05-23"
"hep-th/0107151","Philippe Pouliot","Philippe Pouliot","Spectroscopy of Gauge Theories Based on Exceptional Lie Groups","36 pages, no figures; version 2: 3 footnotes and 3 references added","J.Phys.A34:8631-8658,2001","10.1088/0305-4470/34/41/317","UTTG-10-01","hep-th math-ph math.MP math.RA",,"  We generate by computer a basis of invariants for the fundamental
representations of the exceptional Lie groups E(6) and E(7), up to degree 18.
We discuss the relevance of this calculation for the study of supersymmetric
gauge theories, and revisit the self-dual exceptional models. We study the
chiral ring of G(2) to degree 13, as well as a few classical groups. The
homological dimension of a ring is a natural estimator of its complexity and
provides a guideline for identifying theories that have a good chance to be
amenable to a solution.
","[{""version"":""v1"",""created"":""Wed, 18 Jul 2001 17:43:43 GMT""},{""version"":""v2"",""created"":""Wed, 25 Jul 2001 13:51:27 GMT""}]","2010-05-28"
"hep-th/0107152","Frederik Denef","Frederik Denef","(Dis)assembling Special Lagrangians","35 pages, 12 figures, v2: references added, expanded discussion",,,,"hep-th",,"  We explain microscopically why split attractor flows, known to underlie
certain stationary BPS solutions of four dimensional N=2 supergravity, are the
relevant data to describe wrapped D-branes in Calabi-Yau compactifications of
type II string theory. We work entirely in the context of the classical
geometry of A-branes, i.e. special Lagrangian submanifolds, avoiding both the
use of homological algebra and explicit constructions of special Lagrangians.
Our results provide a way to disassemble and assemble arbitrary special
Lagrangians to and from more simple building blocks, giving a concrete way to
determine for example marginal stability walls and deformation moduli spaces.
","[{""version"":""v1"",""created"":""Wed, 18 Jul 2001 19:35:06 GMT""},{""version"":""v2"",""created"":""Mon, 13 Aug 2001 22:49:31 GMT""}]","2007-05-23"
"hep-th/0107153","Troost Jan","Amihay Hanany and Jan Troost","Orientifold planes, affine algebras and magnetic monopoles","23 pages, 7 figures, references added","JHEP 0108:021,2001","10.1088/1126-6708/2001/08/021","MIT-CTP-3163","hep-th",,"  We analyze string theory backgrounds that include different kinds of
orientifold planes and map out a natural correspondence to (twisted) affine
Kac-Moody algebras. The low-energy description of specific BPS states in these
backgrounds leads to a construction of explicit twisted magnetic monopole
solutions on R^3 x S^1. These backgrounds yield new low-energy field theories
with twisted boundary conditions and the link with affine algebras yields a
natural guess for the superpotentials of the corresponding pure N=1, and N=1*
gauge theories.
","[{""version"":""v1"",""created"":""Wed, 18 Jul 2001 19:47:18 GMT""},{""version"":""v2"",""created"":""Thu, 26 Jul 2001 14:18:32 GMT""}]","2010-02-03"
"hep-th/0107154","Ricardo Moritz Cavalcanti","Luiz C. de Albuquerque and R. M. Cavalcanti","Comment on ``Casimir force in compact non-commutative extra dimensions
  and radius stabilization''","6 pages, LaTeX, uses JHEP.cls","JHEP 0107:025,2001","10.1088/1126-6708/2001/07/025",,"hep-th",,"  We call attention to a series of mistakes in a paper by S. Nam [JHEP 10
(2000) 044, hep-th/0008083].
","[{""version"":""v1"",""created"":""Wed, 18 Jul 2001 21:29:18 GMT""}]","2010-02-03"
"hep-th/0107156","DaeKil Park","D. K. Park, Hungsoo Kim, Yan-Gang Miao, H. J. W. M\""uller-Kirsten","Randall-Sundrum Scenario at Nonzero Temperature","10 pages, no figure, will appear in PLB","Phys.Lett. B519 (2001) 159-163","10.1016/S0370-2693(01)01101-7",,"hep-th",,"  The effect of temperature is investigated in the Randall-Sundrum brane-world
scenario. It is shown that for a spacetime ansatz motivated by similarity with
AdS/CFT correspondence several features of the model, such as its $Z_2$
symmetry, are not maintained at nonzero temperatures.
","[{""version"":""v1"",""created"":""Thu, 19 Jul 2001 04:05:38 GMT""},{""version"":""v2"",""created"":""Mon, 10 Sep 2001 02:41:07 GMT""}]","2009-11-07"
"hep-th/0107157",,"Anatoly Konechny and O. Teoman Turgut","Supergrassmannian and large N limit of quantum field theory with bosons
  and fermions","24 pages, Latex; v.3 appendix added, typos corrected, to appear in
  JMP","J.Math.Phys. 43 (2002) 2988-3010","10.1063/1.1477936","UCB-PTH-02/02","hep-th",,"  We study a large N_{c} limit of a two-dimensional Yang-Mills theory coupled
to bosons and fermions in the fundamental representation. Extending an approach
due to Rajeev we show that the limiting theory can be described as a classical
Hamiltonian system whose phase space is an infinite-dimensional
supergrassmannian. The linear approximation to the equations of motion and the
constraint yields the 't Hooft equations for the mesonic spectrum. Two other
approximation schemes to the exact equations are discussed.
","[{""version"":""v1"",""created"":""Thu, 19 Jul 2001 05:47:04 GMT""},{""version"":""v2"",""created"":""Thu, 26 Jul 2001 00:00:44 GMT""},{""version"":""v3"",""created"":""Fri, 1 Mar 2002 21:03:20 GMT""}]","2015-06-26"
"hep-th/0107158","Paolo Budinich","Paolo Budinich","From the Geometry of Pure Spinors with their Division Algebras to
  Fermion's Physics","42 pages Latex","Found.Phys. 32 (2002) 1347-1398","10.1023/A:1020307822626",,"hep-th",,"  The Cartan's equations definig simple spinors (renamed pure by C. Chevalley)
are interpreted as equations of motion in momentum spaces, in a constructive
approach in which at each step the dimesions of spinor space are doubled while
those momentum space increased by two. The construction is possible only in the
frame of geometry of simple or pure spinors, which imposes contraint equations
on spinors with more than four components, and the momentum spaces result
compact, isomorphic toinvariant-mass-spheres imbedded in each other, since the
signatures appear to be unambiguously defined and result steadily lorentzian;
up to dimension ten with Clifford algebra Cl(1,9), where the construction
naturally ends. The equations of motion met in the construction are most of
those traditionally postulated ad hoc for multicomponent fermions. The 3
division algebras: complex numbers, quaternions and octonions appear to be
strictly correlated with this spinor geometry, from which they appear to
gradually emerge in the construction, where they play a basic role for the
physical interpretation. In fact they seem then to be at the origin of
electroweak and strong charges, of the 3 families and of the groups of the
standard model. In this approach there seems to be no need of higher
dimensional (>4) space-time, here generated merely by Poincare translations,
and dimensional reduction from Cl(1,9) to Cl(1,3) is equivalent to decoupling
of the equations of motion.
","[{""version"":""v1"",""created"":""Thu, 19 Jul 2001 09:55:11 GMT""}]","2022-10-12"
"math-ph/0107016","David W. Dreisigmeyer","David W. Dreisigmeyer and Peter M. Young","Feynman's Path Integrals as Evolutionary Semigroups","23 pages",,,,"math-ph math.FA math.MP",,"  We show that, for a class of systems described by a Lagrangian L(x,\dot{x},t)
= 1/2\dot{x}^{2} - V(x,t) the propagator can be reduced via Noether's Theorem
to a standard path integral multiplied by a phase factor. Using Henstock's
integration technique, this path integral is given a firm mathematical basis.
Finally, we recast the propagator as an evolutionary semigroup.
","[{""version"":""v1"",""created"":""Thu, 19 Jul 2001 03:36:18 GMT""}]","2007-05-23"
"math/0107130","Aaron D. Jaggard","Aaron D. Jaggard","Subsequence containment by involutions","Added section 3.1 on classifying permutations using subsequence
  containment by involutions, revised history of related work. 14 pages, 1
  figure, 5 tables",,,,"math.CO",,"  Inspired by work of McKay, Morse, and Wilf, we give an exact count of the
involutions in S_n which contain a given permutation \tau in S_k as a
subsequence; this number depends on the patterns of the first j values of \tau
for 1<=j<=k. We then use this to define a partition of S_k, analogous to
Wilf-classes in the study of pattern avoidance, and examine properties of this
equivalence. In the process, we show that a permutation \tau_1...\tau_k is
layered iff, for 1<=j<=k, the pattern of \tau_1...\tau_j is an involution. We
also obtain a result of Sagan and Stanley counting the standard Young tableaux
of size $n$ which contain a fixed tableau of size $k$ as a subtableau.
","[{""version"":""v1"",""created"":""Wed, 18 Jul 2001 18:43:42 GMT""},{""version"":""v2"",""created"":""Thu, 2 Sep 2004 16:13:05 GMT""}]","2007-05-23"
"math/0107131","Tara S. Holm","Rebecca Goldin, Tara S. Holm","The equivariant cohomology of Hamiltonian $G$-spaces From Residual $S^1$
  Actions","13 pages, 4 figures","Math. Res. Let. {\bf 8} (2001), 67-78",,,"math.SG",,"  We show that for a Hamiltonian action of a compact torus $G$ on a compact,
connected symplectic manifold $M$, the $G$-equivariant cohomology is determined
by the residual $S^1$ action on the submanifolds of $M$ fixed by codimension-1
tori. This theorem allows us to compute the equivariant cohomology of certain
manifolds, which have pieces that are four-dimensional or smaller. We give
several examples of the computations that this allows.
","[{""version"":""v1"",""created"":""Wed, 18 Jul 2001 19:19:45 GMT""}]","2007-05-23"
"math/0107132","Dirk Werner","Dmitriy Bilik, Vladimir Kadets, Roman Shvidkoy, and Dirk Werner","Narrow operators and the Daugavet property for ultraproducts","15 pages","Positivity 9, no.1, 45-62 (2005)","10.1007/s11117-003-9339-9",,"math.FA",,"  We show that if $T$ is a narrow operator on $X=X_{1}\oplus_{1} X_{2}$ or
$X=X_{1}\oplus_{\infty} X_{2}$, then the restrictions to $X_{1}$ and $X_{2}$
are narrow and conversely. We also characterise by a version of the Daugavet
property for positive operators on Banach lattices which unconditional sums of
Banach spaces inherit the Daugavet property, and we study the Daugavet property
for ultraproducts.
","[{""version"":""v1"",""created"":""Thu, 19 Jul 2001 10:34:40 GMT""}]","2021-10-05"
"math/0107133","Pavol Severa","Pavol Severa, Alan Weinstein","Poisson geometry with a 3-form background","10 pages, PTPTeX style; v2: minor changes, version to be published","Prog.Theor.Phys.Suppl. 144 (2001) 145-154",,,"math.SG hep-th",,"  We study a modification of Poisson geometry by a closed 3-form. Just as for
ordinary Poisson structures, these ""twisted"" Poisson structures are
conveniently described as Dirac structures in suitable Courant algebroids. The
additive group of 2-forms acts on twisted Poisson structures and permits them
to be seen as glued from ordinary Poisson structures defined on local patches.
We conclude with remarks on deformation quantization and twisted symplectic
groupoids.
","[{""version"":""v1"",""created"":""Thu, 19 Jul 2001 12:38:29 GMT""},{""version"":""v2"",""created"":""Fri, 14 Sep 2001 12:22:53 GMT""}]","2007-05-23"
"math/0107134","Francois Loeser","F. Loeser, J. Sebag","Motivic integration on smooth rigid varieties and invariants of
  degenerations","24 pages","Duke Math. J. 119 (2003), no. 2, 315--344",,,"math.AG",,"  We construct a theory of motivic integration for smooth rigid varieties. As
an application new invariants of degenerations are obtained.
","[{""version"":""v1"",""created"":""Thu, 19 Jul 2001 12:53:47 GMT""},{""version"":""v2"",""created"":""Fri, 10 Aug 2001 09:34:00 GMT""}]","2007-12-06"
