"astro-ph/0112317","Pavel Ivanov","P. B. Ivanov","On formation rate of close binaries consisting of a super-massive black
  hole and a white dwarf","This version is to be published in MNRAS","Mon.Not.Roy.Astron.Soc. 336 (2002) 373","10.1046/j.1365-8711.2002.05733.x",,"astro-ph",,"  The formation rate of a close binary consisting of a super-massive black hole
and a compact object (presumably a white dwarf) in galactic cusps is calculated
with help of the so-called loss cone approximation. For a power low cusp of
radius $r_{a}$, the black hole mass $M\sim 10^{6}M_{\odot}$, this rate $\dot
N_{wd}\sim 4\cdot 10^{-5}K(p}\sqrt{{GM\over r_{a}^{3}}}\approx 3\cdot
10^{-9}K(p){({M\over 10^{6}M_{\odot}})}^{1/2}{({r_{a}\over
1pc})}^{-3/2}yr^{-1}$. The function $K(p)$ depends on parameter $p$ determining
the cusp profile, and for the standard cusp profiles with $p=1/4$ $K(p)\sim 2$.
We estimate the probability ${\it Pr}$ of finding of a compact object orbiting
around a black hole with period $P$ in one particular galaxy to be ${\it
Pr}\sim 10^{-7}{({P/10^{3}s\over M/10^{6}M_{\odot}})}^{8/3}
{({M/10^{6}M_{\odot}\over r_{a}/ 1pc})}^{3/2}$. The object with the period
$P\sim 10^{3} s$ emits gravitational waves with amplitude sufficient to be
detected by LISA type gravitational wave anatenna from the distance $\sim
10^{3}Mpc$. Based on estimates of masses of super-massive black holes in nearby
galaxies, we speculate that LISA would detect several such events during its
mission.
","[{""version"":""v1"",""created"":""Thu, 13 Dec 2001 15:55:03 GMT""},{""version"":""v2"",""created"":""Sun, 9 Jun 2002 19:55:23 GMT""}]","2009-11-07"
"astro-ph/0112318","Tahir Yaqoob","T. Yaqoob (1,2), U. Padmanabhan (1), T. Dotani (3), K. Nandra (2,4)
  ((1) Jhu, (2) Lhea, Nasa/Gsfc, (3) Isas, Japan, (4) Usra)","The Effect of Changes in the ASCA Calibration on the Fe-Kalpha Lines in
  Active Galaxies","Accepted for publication in the Astrophysical Journal, Vol. 569, 10
  April, 2002. 22 pages, 4 figures",,"10.1086/339166",,"astro-ph",,"  The ASCA calibration has evolved considerably since launch and indeed, is
still evolving. There have been concerns in the literature that changes in the
ASCA calibration have resulted in the Fe-Kalpha lines in active galaxies (AGN)
now being systematically narrower than was originally thought. If this were
true, a large body of ASCA results would be impacted. In particular, it has
been claimed that the broad red wing (when present) of the Fe-Kalpha line has
been considerably weakened by changes in the ASCA calibration. We demonstrate
explicitly that changes in the ASCA calibration over a period of about eight
years have a negligible effect on the width, strength, or shape of the
Fe-Kalpha lines. The reduction in both width and equivalent width is only ~8%
or less. We confirm this with simulations and individual sources, as well as
sample average profiles. The average profile for type 1 AGN is still very
broad, with the red wing extending down to ~4 keV. The reason for the claimed,
apparently large, discrepancies is that in some sources the \fekalfa line is
complex, and a single-Gaussian model, being an inadequate description of the
line profile, picks up different portions of the profile with different
calibration. Single-Gaussian fits do not therefore model all of the line
emission in some sources, in which case they do not compare old and current
calibration since the models do not then describe the data.
","[{""version"":""v1"",""created"":""Thu, 13 Dec 2001 15:07:34 GMT""}]","2009-11-07"
"astro-ph/0112319","J. M. Oliveira","J.M. Oliveira, R.D. Jeffries, M.J. Kenyon, S.A. Thompson (Keele
  University, UK) and Tim Naylor (Exeter University, UK)","No disks around low-mass stars and brown dwarfs in the young sigma
  Orionis cluster?","4 pages, 2 eps figures, accepted by Astronomy and Astrophysics
  Letters",,"10.1051/0004-6361:20011778",,"astro-ph",,"  We report on the analysis of 2MASS near-infrared data of a sample of low-mass
stars and brown dwarfs in the sigma Orionis cluster. Youth and cluster
membership have been spectroscopically confirmed using the Li I spectral line.
We find little evidence in the JHKs colour-colour diagram for near-infrared
excess emission for these cluster members. By comparison with model
expectations, at most 2 out of 34 stars show (H-K) colour consistent with a
near-infrared excess. This scarcity of near-infrared signatures of
circumstellar disks in the lower-mass and substellar regimes of this cluster
contrasts with findings in younger clusters, hinting at an age dependence of
the disk frequency. Taking into account the apparent cluster age, our result
supports the idea of a relatively fast (few Myr) disk dissipation and extends
this conclusion to the substellar regime. We also find some evidence that, in
this cluster, the disk frequency as measured by the Ks-band excess may be mass
dependent.
","[{""version"":""v1"",""created"":""Thu, 13 Dec 2001 15:42:06 GMT""}]","2009-11-07"
"astro-ph/0112320","George A. Baker Jr.","George A. Baker Jr","Effects on the structure of the universe of an accelerating expansion","27 pages, 4 figures, latex2e (Kluwer style) to be published in
  General Relativity and Gravitation, June 2002",,"10.1023/A:1016371629024","LA-UR-01-1690","astro-ph",,"  Recent experimental results from supernovae Ia observations have been
interpreted to show that the rate of expansion of the universe is increasing.
Other recent experimental results find strong indications that the universe is
``flat.'' In this paper, I investigate some solutions of Einstein's field
equations which go smoothly between Schwarzschild's relativistic gravitational
solution near a mass concentration to the Friedmann-Lemaitre expanding universe
solution. In particular, the static, curved-space extension of the Lemaitre-
Schwarzschild solution in vacuum is given. Uniqueness conditions are discussed.
One of these metrics preserves the ``cosmological equation.'' We find that when
the rate of expansion of the universe is increasing, space is broken up into
domains of attraction. Outside a domain of attraction, the expansion of the
universe is strong enough to accelerate a test particle away from the domain
boundary. I give a domain-size--mass relationship. This relationship may very
well be important to our understanding of the large scale structure of the
universe.
","[{""version"":""v1"",""created"":""Thu, 13 Dec 2001 15:59:45 GMT""}]","2021-11-03"
"cond-mat/0112220","Fedir Kyrychenko","F.V.Kyrychenko, J.Kossut","Diluted magnetic semiconductor quantum dots: an extreme sensitivity of
  the hole Zeeman splitting on the aspect ratio of the confining potential",,,,,"cond-mat",,"  The valence band states confined in infinitely deep quantum dots made of
diluted magnetic semiconductors (DMS) are considered theoretically. A complex
anisotropic structure of the valence bands in DMSs with cubic symmetry
described by the full Luttinger Hamiltonian is taken into account. It is found
that the Zeeman splitting is very sensitive to the shape of the confining
potential and, in particular, to its orientation relative to the direction of
an external magnetic field. This sensitivity has its origin in a mixing of
different spin components of a hole wave function which takes place for finite
hole wave vectors ${\bf k}$. Several consequences of the effect are discussed,
including a possibility to control the inter-dot tunneling by an external
magnetic field. It is shown also that the polarizations of optical transitions
in a single DMS quantum dot depend on details of geometry of its confining
potential as well as on the strength of the magnetic field.
","[{""version"":""v1"",""created"":""Wed, 12 Dec 2001 18:56:54 GMT""}]","2007-05-23"
"cond-mat/0112222","Gulminelli","F.Gulminelli, Ph.Chomaz","On the inequivalence of statistical ensembles","4 pages, 4 figures","Phys.Rev. E 66 (2002) 046108","10.1103/PhysRevE.66.046108",,"cond-mat.stat-mech",,"  We investigate the relation between various statistical ensembles of finite
systems. If ensembles differ at the level of fluctuations of the order
parameter, we show that the equations of states can present major differences.
A sufficient condition for this inequivalence to survive at the thermodynamical
limit is worked out. If energy consists in a kinetic and a potential part, the
microcanonical ensemble does not converge towards the canonical ensemble when
the partial heat capacities per particle fulfill the relation
$c_{k}^{-1}+c_{p}^{-1}<0$.
","[{""version"":""v1"",""created"":""Wed, 12 Dec 2001 16:25:37 GMT""},{""version"":""v2"",""created"":""Thu, 13 Dec 2001 09:02:15 GMT""}]","2009-11-07"
"cond-mat/0112224","Prosenjit Singha Deo","P. Singha Deo, P. Koskinen, M. Koskinen, and M. Manninen","Fractional Periodicity of Persistent Currents: A Signature of Broken
  Internal Symmetry","minor corrections",,,,"cond-mat.mes-hall",,"  We show from the symmetries of the many body Hamiltonian, cast into the form
of the Heisenberg (spin) Hamiltonian, that the fractional periodicities of
persistent currents are due to the breakdown of internal symmetry and the spin
Hamiltonian holds the explanation to this transition. Numerical
diagonalizations are performed to show this explicitely. Persistent currents
therefore, provide an easy way to experimentally verify broken internal
symmetry in electronic systems.
","[{""version"":""v1"",""created"":""Wed, 12 Dec 2001 16:44:41 GMT""},{""version"":""v2"",""created"":""Thu, 13 Dec 2001 13:18:15 GMT""},{""version"":""v3"",""created"":""Mon, 17 Jun 2002 09:46:50 GMT""},{""version"":""v4"",""created"":""Mon, 10 Feb 2003 10:54:00 GMT""}]","2007-05-23"
"cond-mat/0112225","Christophe Texier","Christophe Texier","Scattering theory on graphs (2): the Friedel sum rule","20 pages, LaTeX, 6 eps figures","J.Phys.A: Math.Gen.35 (2002) 3389-3407","10.1088/0305-4470/35/15/303",,"cond-mat.mes-hall",,"  We consider the Friedel sum rule in the context of the scattering theory for
the Schr\""odinger operator $-\Dc_x^2+V(x)$ on graphs made of one-dimensional
wires connected to external leads. We generalize the Smith formula for graphs.
We give several examples of graphs where the state counting method given by the
Friedel sum rule is not working. The reason for the failure of the Friedel sum
rule to count the states is the existence of states localized in the graph and
not coupled to the leads, which occurs if the spectrum is degenerate and the
number of leads too small.
","[{""version"":""v1"",""created"":""Wed, 12 Dec 2001 17:03:05 GMT""},{""version"":""v2"",""created"":""Fri, 1 Mar 2002 14:38:43 GMT""}]","2009-11-07"
"cond-mat/0112226","Paul Kinsler","P. Kinsler","Quantum stochastic theory of phonon scattering between polaritons","14 pages, 7 EPS figures",,,"Kinsler-2001qmpp","cond-mat",,"  Quantum stochastic operator equations are derived for inter-branch exciton
and polariton processes caused by acoustic phonon scattering. The use of a
fully quantum model combined with these recently developed techniques predicts
the presence of ``stimulated scattering'' terms, and provides a sound basis for
understanding the basis of the approximations used in generating the equations.
The theory is applied to a model motivated by recent experiments where a
stronger photoluminescence signal from the high energy microcavity polariton
polariton is observed for low excitation powers, and also to an experimental
scheme designed to show evidence of the stimulated scattering effect.
","[{""version"":""v1"",""created"":""Wed, 12 Dec 2001 17:38:20 GMT""},{""version"":""v2"",""created"":""Mon, 18 Mar 2002 13:55:12 GMT""}]","2007-05-23"
"cond-mat/0112227","Achod Andre Aradian","Achod Aradian, Elie Raphael, Pierre-Gilles de Gennes","Surface flows of granular materials: A short introduction to some recent
  models","10 pages, 3 figures, published in a special issue of C. R. Physique
  (Paris) on granular matter","Published in C. R. Physique, vol. 3, pp. 187-196 (2002)","10.1016/S1631-0705(02)01304-X",,"cond-mat",,"  We present a short review of recent theoretical descriptions of flows
occuring at the surface of granular piles, and focus mainly on two models: the
phenomenological ``BCRE'' model and the hydrodynamic model, based on
Saint-Venant equations. Both models distinguish a ``static phase'' and a
``rolling'' phase inside the granular packing and write coupled equations for
the evolutions of the height of each of these phases, which prove similar in
both approaches. The BCRE description provides a very intuitive picture of the
flow, whereas the Saint-Venant hydrodynamic description establishes a general
and rigorous framework for granular flow studies.
","[{""version"":""v1"",""created"":""Wed, 12 Dec 2001 18:22:00 GMT""},{""version"":""v2"",""created"":""Mon, 28 Jan 2002 19:18:14 GMT""},{""version"":""v3"",""created"":""Wed, 22 May 2002 17:59:50 GMT""}]","2015-06-24"
"cond-mat/0112228","Dimitry M. Gangardt","J.N. Fuchs, D.M. Gangardt and F. Laloe","Internal state conversion in ultracold gases","Accepted version, to appear in PRL","Phys. Rev. Lett. 88, 230404 (2002)","10.1103/PhysRevLett.88.230404",,"cond-mat.stat-mech",,"  We consider an ultracold gas of (non-condensed) bosons or fermions with two
internal states, and study the effect of a gradient of the transition frequency
between these states. When a $\pi/2$ RF pulse is applied to the sample,
exchange effects during collisions transfer the atoms into internal states
which depend on the direction of their velocity. This results, after a short
time, in a spatial separation between the two states. A kinetic equation is
solved analytically and numerically; the results agree well with the recent
observations of Lewandowski et al.
","[{""version"":""v1"",""created"":""Wed, 12 Dec 2001 18:23:30 GMT""},{""version"":""v2"",""created"":""Sat, 15 Dec 2001 18:07:38 GMT""},{""version"":""v3"",""created"":""Fri, 21 Dec 2001 17:56:55 GMT""},{""version"":""v4"",""created"":""Mon, 18 Feb 2002 18:45:27 GMT""},{""version"":""v5"",""created"":""Fri, 26 Apr 2002 13:35:53 GMT""}]","2009-11-07"
"cond-mat/0112229","Edward G. Timoshenko","Edward G. Timoshenko, Yuri A. Kuznetsov, Ronan Connolly","Intra-chain correlation functions and shapes of homopolymers with
  different architectures in dilute solution","RevTeX 12 pages, 10 PS figures. Accepted by J. Chem. Phys",,"10.1063/1.1448490",,"cond-mat.soft",,"  We present results of Monte Carlo study of the monomer-monomer correlation
functions, static structure factor and asphericity characteristics of a single
homopolymer in the coil and globular states for three distinct architectures of
the chain: ring, open and star. To rationalise the results we introduce the
dimensionless correlation functions rescaled via the corresponding mean-squared
distances between monomers. For flexible chains with some architectures these
functions exhibit a large degree of universality by falling onto a single or
several distinct master curves. In the repulsive regime, where a stretched
exponential times a power law form (de Cloizeaux scaling) can be applied, the
corresponding exponents $\delta$ and $\theta$ have been obtained. The exponent
$\delta=1/\nu$ is found to be universal for flexible strongly repulsive coils
and in agreement with the theoretical prediction from improved higher-order
Borel-resummed renormalisation group calculations. The short-distance exponents
$\theta_{\upsilon}$ of an open flexible chain are in a good agreement with the
theoretical predictions in the strongly repulsive regime also. However,
increasing the Kuhn length in relation to the monomer size leads to their fast
cross-over towards the Gaussian behaviour. Likewise, a strong sensitivity of
various exponents $\theta_{ij}$ on the stiffness of the chain, or on the number
of arms in star polymers, is observed. The correlation functions in the
globular state are found to have a more complicated oscillating behaviour and
their degree of universality has been reviewed. Average shapes of the polymers
in terms of the asphericity characteristics, as well as the universal behaviour
in the static structure factors, have been also investigated.
","[{""version"":""v1"",""created"":""Wed, 12 Dec 2001 18:25:51 GMT""}]","2009-11-07"
"cond-mat/0112230","Dr Chris Ewels","C. P. Ewels, M. I. Heggie, P. R. Briddon","Adatoms and nanoengineering of carbon","3 Figures, 5 Page letter accepted for publication in Chemical Physics
  Letters",,"10.1016/S0009-2614(01)01371-9",,"cond-mat.mtrl-sci",,"  We present a new and general mechanism for inter-conversion of carbon
structures via a catalytic exchange process, which operates under conditions of
Frenkel pair generation. The mechanism typically lowers reaction barriers by a
factor of four compared to equivilent uncatalysed reactions. We examine the
relevance of this mechanism for fullerene growth, carbon onions and nanotubes,
and dislocations in irradiated graphite.
","[{""version"":""v1"",""created"":""Wed, 12 Dec 2001 18:30:17 GMT""}]","2009-11-07"
"cond-mat/0112231","Antonio del Rio","M. Lopez de Haro, J.A. del Rio and F. Vazquez","Light-scattering spectrum of a viscoelastic fluid subjected to an
  external temperature gradient","Article to be published in Rev. Mex. Fis","Rev. Mex. Fis. 2002 V. 48S1, p. 230-237",,,"cond-mat.stat-mech",,"  The light-scattering spectrum for a Maxwell fluid in a steady state due to
the presence of an external temperature gradient is computed. In such a fluid
heat conduction is assumed to be governed by the classical Fourier law. The
calculation is carried out through the use of fluctuating hydrodynamics. The
effect of the non-Newtonian character of the fluid in the resulting spectrum is
discussed.
","[{""version"":""v1"",""created"":""Wed, 12 Dec 2001 19:32:23 GMT""}]","2007-05-23"
"cond-mat/0112232","Kristine Lang","K.M. Lang, V. Madhavan, J.E. Hoffman, E.W. Hudson, H. Eisaki, S.
  Uchida, J.C. Davis","Imaging the granular structure of high-Tc superconductivity in
  underdoped Bi2Sr2CaCu2O8+x","To appear in Nature",,"10.1038/415412a",,"cond-mat.str-el cond-mat.supr-con",,"  Granular superconductivity occurs when microscopic superconducting grains are
separated by non-superconducting regions through which they communicate by
Josephson tunneling to establish the macroscopic superconducting state [1].
Although crystals of the cuprate high-Tc superconductors are not granular in a
structural sense, theory indicates that at low hole densities the holes can
become concentrated at some locations resulting in hole-rich superconducting
domains [2-5]. Granular superconductivity due to Josephson tunneling through
'undoped' regions between such domains would represent a new paradigm for the
underdoped cuprates. Here we report studies of the spatial interrelationships
between STM tunneling spectra in underdoped Bi2Sr2CaCu2O8+x. They reveal an
apparent spatial segregation of the electronic structure into ~3nm diameter
domains (with superconducting characteristics and local energy gap delta<50
meV) in an electronically distinct background. To explore whether this
represents nanoscale segregation of two distinct electronic phases, we employ
scattering-resonances at Ni impurity atoms [6] as 'markers' for the local
existence of superconductivity [7-9]. No Ni-resonances are detected in any
regions where delta>50(2.5) meV. These observations suggest that underdoped
Bi2Sr2CaCu2O8+x is a mixture of two different short-range electronic orders
with the long-range characteristics of a granular superconductor.
","[{""version"":""v1"",""created"":""Wed, 12 Dec 2001 22:06:28 GMT""}]","2009-11-07"
"cond-mat/0112233","Ziqiang Wang","D.N. Sheng, Ziqiang Wang, B. Friedman","Role of disorder in half-filled high Landau levels","4 pages, 4 figures","Phys. Rev. B66, 161103 (2002).","10.1103/PhysRevB.66.161103",,"cond-mat.mes-hall cond-mat.str-el",,"  We study the effects of disorder on the quantum Hall stripe phases in
half-filled high Landau levels using exact numerical diagonalization. We show
that, in the presence of weak disorder, a compressible, striped charge density
wave, becomes the true ground state. The projected electron density profile
resembles that of a smectic liquid. With increasing disorder strength W, we
find that there exists a critical value, W_c \sim 0.12 e^2/\epsilon l, where a
transition/crossover to an isotropic phase with strong local electron density
fluctuations takes place. The many-body density of states are qualitatively
distinguishable in these two phases and help elucidate the nature of the
transition.
","[{""version"":""v1"",""created"":""Wed, 12 Dec 2001 21:06:33 GMT""},{""version"":""v2"",""created"":""Fri, 27 Sep 2002 15:52:54 GMT""}]","2009-11-07"
"cond-mat/0112234","Philip M. Singer","P.M. Singer, T. Imai","Systematic (63)Cu NQR and (89)Y NMR Study of Spin Dynamics in
  Y(1-z)Ca(z)Ba(2)Cu(3)O(y) Across Superconductor-Insulator Boundary","Accepted for publication in PRL, scheduled tentatively for the issue
  of: L 29Apr02",,,,"cond-mat.supr-con",,"  We demonstrate that the spin dynamics in underdoped Y(1-z)Ca(z)Ba(2)Cu(3)O(y)
for y=~6.0 exhibit qualitatively the same behavior to underdoped
La(2-x)Sr(x)CuO(4) for an equal amount of hole concentration p=z/2=x<0.11.
However,a spin-gap appears as more holes are doped into the CuO(2) plane by
increasing the oxygen concentration to y=~6.5 for a fixed value of Ca
concentration z. Our results also suggest that Ca doping causes disorder
effects that enhance the low frequency spin fluctuations.
","[{""version"":""v1"",""created"":""Wed, 12 Dec 2001 21:52:36 GMT""},{""version"":""v2"",""created"":""Wed, 6 Mar 2002 17:49:39 GMT""},{""version"":""v3"",""created"":""Thu, 7 Mar 2002 14:24:31 GMT""},{""version"":""v4"",""created"":""Fri, 5 Apr 2002 22:10:18 GMT""}]","2007-05-23"
"cond-mat/0112235","Dragomir Davidovic","A. Korotkov, M. Bowman, H. J. McGuinness, and D. Davidovic","Electrostatically Assembled Metallic Point Contacts","submitted applied physics letters, 10/10/01",,,,"cond-mat.mes-hall cond-mat.mtrl-sci",,"  We describe a method for creating atomic-scale electric contacts. A metal
source is deposited on two insulating substrates separated by a 70 nm gap.
Electric conductance across the gap is monitored, while protrusions from the
bulk extend into the gap and reach corresponding protrusions on the other side
of the gap. When the voltage across the gap is large, a pair of corresponding
protrusions assembles into a point contact, via equilibrium between
electrostatic attraction and a maximum sustained current. The current voltage
characteristics of the point contact display crossover from weak link into
tunneling junction when its conductance is near 2e2/h, indicating that the
point contact is atomic-scale.
","[{""version"":""v1"",""created"":""Wed, 12 Dec 2001 23:44:28 GMT""}]","2009-09-25"
"cond-mat/0112236","Richard A. Klemm","Richard A. Klemm and Marco Ameduri","Exact Time Autocorrelation Function of the N-Spin Classical Heisenberg
  Equivalent Neighbor Model","4 pages, 4 figures, submitted to PRL","Phys. Rev. B 66, 012403 (2002).","10.1103/PhysRevB.66.012403",,"cond-mat.stat-mech cond-mat.mes-hall",,"  We reduce the autocorrelation function $C_{11}(t)$ of the equivalent neighbor
model of $N$ classical spins exhibiting Heisenberg dynamics and exchange
coupling $J$ to quadrature. As the temperature $T\to\infty$, $C_{11}(t)\propto
t^{-N}$ for $Jt>>1$. At low $T$, the antiferromagnetic $C_{11}(t)$ is a simple
function of $(JT)^{1/2}t$, exhibiting strong frustration, but the ferromagnetic
$C_{11}(t)$ oscillates in a single mode the frequency of which approaches $NJ$
as $T\to0$. We conjecture that as $T\to\infty$, the near-neighbor correlation
functions of $N$-spin classical Heisenberg rings are simply obtained from these
results.
","[{""version"":""v1"",""created"":""Thu, 13 Dec 2001 01:10:06 GMT""}]","2009-11-07"
"cond-mat/0112237","Jinsahn Zhang","H.M. Bozler, Yuan Gu, Jinshan Zhang, K.S. White, C.M. Gould","Ferromagnetism of $^3$He Films in the Low Field Limit","4 figures",,"10.1103/PhysRevLett.88.065302",,"cond-mat",,"  We provide evidence for a finite temperature ferromagnetic transition in
2-dimensions as $H \to 0$ in thin films of $^3$He on graphite, a model system
for the study of two-dimensional magnetism. We perform pulsed and CW NMR
experiments at fields of 0.03 - 0.48 mT on $^3$He at areal densities of 20.5 -
24.2 atoms/nm$^2$. At these densities, the second layer of $^3$He has a
strongly ferromagnetic tendency. With decreasing temperature, we find a rapid
onset of magnetization that becomes independent of the applied field at
temperatures in the vicinity of 1 mK. Both the dipolar field and the NMR
linewidth grow rapidly as well, which is consistent with a large (order unity)
polarization of the $^3$He spins.
","[{""version"":""v1"",""created"":""Thu, 13 Dec 2001 01:19:05 GMT""}]","2009-11-07"
