"math/0112266","Louis H. Kauffman","Louis H. Kauffman","Reformulating the Map Color Theorem","40 pages, 28 figures, LaTeX graphics",,,,"math.CO",,"  This paper discusses reformulations of the problem of coloring plane maps
with four colors. The context is the edge-coloring with three colors of cubic
graphs such that three distinct colors occur at each vertex. We include
discussion of the Eliahou-Kryuchkov conjecture, the Penrose formula, the vector
cross product formulation and the reformulations in terms of formations and
factorizations due to G. Spencer-Brown. The latter includes a proof of the
Spencer-Brown parity lemma and discussion of the parity-pass algorithm.
","[{""version"":""v1"",""created"":""Sun, 23 Dec 2001 23:40:44 GMT""},{""version"":""v2"",""created"":""Wed, 2 Jul 2003 02:17:01 GMT""}]","2007-05-23"
"math/0112267","Kota Yoshioka","Kota Yoshioka","A note on Fourier-Mukai transform","19 pages, some results added",,,,"math.AG",,"  In this note, we consider the problem on the preservation of stability under
the Fourier-Mukai transforms. We first show that the Fourier-Mukai transform on
an abelian surface or a K3 surface does not always preserve the stability, even
for a $\mu$-stable vector bundle. We next provide some positive results on this
problem. Finally we discuss the birational map of moduli spaces on an abelian
surface.
","[{""version"":""v1"",""created"":""Mon, 24 Dec 2001 05:59:50 GMT""},{""version"":""v2"",""created"":""Thu, 27 Dec 2001 04:48:57 GMT""},{""version"":""v3"",""created"":""Fri, 20 Sep 2002 06:49:16 GMT""}]","2007-05-23"
"math/0112268","Konstantin Igudesman","Konstantin Igudesman","Statistically self-similar fractal sets","11 pages, Latex",,,,"math.DS math.PR",,"  In the present paper we define statistically self-similar sets, and, using a
modification of method described K.J.Falconer find a Hausdorff dimension of a
statistically self-similar set.
","[{""version"":""v1"",""created"":""Mon, 24 Dec 2001 08:47:24 GMT""}]","2007-05-23"
"math/0112269","Inna Scherbak","I. Scherbak and A. Varchenko","Critical points of functions, sl_2 representations, and Fuchsian
  differential equations with only univalued solutions","The final version, to appear in MMJ",,,"TAU-12/01","math.QA math.CA",,"  Let a second order Fuchsian differential equation with only univalued
solutions have finite singular points at z_1, ..., z_n with exponents
(a_1,b_1), ..., (a_n,b_n). Let the exponents at infinity be (A,B). Then for
fixed generic z_1,...,z_n, the number of such Fuchsian equations is equal to
the multiplicity of the irreducible sl_2 representation of dimension |A-B| in
the tensor product of irreducible sl_2 representations of dimensions |a_1-b_1|,
>..., |a_n-b_n|.
  To show this we count the number of critical points of a suitable function
which plays the crucial role in constructions of the hypergeometric solutions
of the sl_2 KZ equation and of the Bethe vectors in the sl_2 Gaudin model. As a
byproduct of this study we conclude that the Bethe vectors form a basis in the
space of states for the sl_2 inhomogeneous Gaudin model.
","[{""version"":""v1"",""created"":""Mon, 24 Dec 2001 11:59:18 GMT""},{""version"":""v2"",""created"":""Wed, 26 Dec 2001 13:08:12 GMT""},{""version"":""v3"",""created"":""Thu, 2 May 2002 09:30:37 GMT""},{""version"":""v4"",""created"":""Mon, 27 Jan 2003 09:51:18 GMT""}]","2007-05-23"
"nlin/0112040","Luis Morales Molina","Luis Morales Molina, Owen Fernandez Piedra","DNA Torsional Solitons in Presence of localized Inhomogeneities","RevTex, 13 pages, 3 figures, final version","Physica Scripta Vol.66,385-390,2002","10.1238/Physica.Regular.066a00385",,"nlin.PS",,"  In the present paper we investigate the influence of inhomogeneities in the
dynamics and stability of DNA open states, modeled as propagating solitons in
the spirit of a Generalized Yakushevish Model. It is a direct consecuence of
our model that there exists a critical distance between the soliton's center of
mass and the inhomogeneity at which the interaction between them can change the
stability of the open state.Furtherly from this results was derived a
renormalized potential funtion.
","[{""version"":""v1"",""created"":""Sun, 23 Dec 2001 16:59:01 GMT""},{""version"":""v2"",""created"":""Wed, 4 Dec 2002 20:40:21 GMT""},{""version"":""v3"",""created"":""Wed, 4 Dec 2002 21:47:27 GMT""},{""version"":""v4"",""created"":""Thu, 19 Dec 2002 16:08:32 GMT""}]","2009-11-07"
"nucl-th/0112072","Pengfei Zhuang","Pengfei Zhuang","Multiplicity Moments and Hard Processes in Relativistic Heavy Ion
  Collisions","6 pages, 5 figures","Phys.Rev. C66 (2002) 064901","10.1103/PhysRevC.66.064901",,"nucl-th",,"  The normalized multiplicity moments and their relation with soft and hard
processes in relativistic heavy ion collisions are analyzed in a general
two-component model. It is found that, the strong fluctuations in binary
collision number N_c in minimum-bias events can enhance the hard component,
especially for the higher order moments. This enhancement can not be
effectively described by modifying the participant number in the one-component
model.
","[{""version"":""v1"",""created"":""Mon, 24 Dec 2001 01:52:38 GMT""}]","2009-11-07"
"quant-ph/0112152","Stefan Heinrich","Stefan Heinrich","From Monte Carlo to Quantum Computation","Paper submitted to the Proceedings of the 3rd IMACS Seminar on Monte
  Carlo Methods MCM2001, Salzburg. 15 pages",,,,"quant-ph",,"  Quantum computing was so far mainly concerned with discrete problems.
  Recently, E. Novak and the author studied quantum algorithms for high
dimensional integration and dealt with the question, which advantages quantum
computing can bring over classical deterministic or randomized methods for this
type of problem.
  In this paper we give a short introduction to the basic ideas of quantum
computing and survey recent results on high dimensional integration. We discuss
connections to the Monte Carlo methology and compare the optimal error rates of
quantum algorithms to those of classical deterministic and randomized
algorithms.
","[{""version"":""v1"",""created"":""Sun, 23 Dec 2001 16:28:16 GMT""}]","2016-09-08"
"quant-ph/0112153","Stefan Heinrich","Stefan Heinrich","Quantum Integration in Sobolev Classes","Paper submitted to the Journal of Complexity. 28 pages",,,,"quant-ph",,"  We study high dimensional integration in the quantum model of computation. We
develop quantum algorithms for integration of functions from Sobolev classes
$W^r_p([0,1]^d)$ and analyze their convergence rates. We also prove lower
bounds which show that the proposed algorithms are, in many cases, optimal
within the setting of quantum computing. This extends recent results of Novak
on integration of functions from H\""older classes.
","[{""version"":""v1"",""created"":""Sun, 23 Dec 2001 16:57:33 GMT""}]","2007-05-23"
"quant-ph/0112154","Masanao Ozawa","Masanao Ozawa (Tohoku University)","Conservation laws, uncertainty relations, and quantum limits of
  measurements","4 pages, RevTex, to appear in PRL","Phys. Rev. Lett. 88, 050402(1--4) (2002).","10.1103/PhysRevLett.88.050402",,"quant-ph",,"  The uncertainty relation between the noise operator and the conserved
quantity leads to a bound for the accuracy of general measurements. The bound
extends the assertion by Wigner, Araki, and Yanase that conservation laws limit
the accuracy of ``repeatable'', or ``nondisturbing'', measurements to general
measurements, and improves the one previously obtained by Yanase for spin
measurements. The bound also sets an obstacle to making a small quantum
computer.
","[{""version"":""v1"",""created"":""Mon, 24 Dec 2001 03:35:03 GMT""}]","2009-11-07"
"quant-ph/0112155","Libin Fu","Li-Bin Fu, Jing-Ling Chen, Xian-Geng Zhao, and Shi-Gang Chen","Understanding Quantum Entanglement of Bipartite System Based on Bell
  Inequality","5 pages",,,,"quant-ph",,"  We present an alternative definition of quantum entanglement for bipartite
system based on Bell inequality and operators' noncommutativity. A state is
said to be entangled, if the maximum of CHSH expectation value $F_{\max}$ is
obtain by noncommutative measures on each particle of the bipartite system;
otherwise, the state is a disentangled state. A uniform measure quantifying the
degree of entanglement for any state of the bipartite system is also proposed.
","[{""version"":""v1"",""created"":""Mon, 24 Dec 2001 07:38:39 GMT""}]","2007-05-23"
