"hep-ph/0102043","Michael G. Schmidt","Michael G. Schmidt","Electroweak Baryogenesis in Supersymmetric Variants","8 pages, 6 figures, SUSY30 conference proceedings","Nucl.Phys.Proc.Suppl.101:339-346,2001","10.1016/S0920-5632(01)01519-5",,"hep-ph",,"  We argue that the creation of a baryon asymmetry in the early universe is an
intriguing case where several aspects of ``Beyond'' physics are needed. We then
concentrate on baryogenesis in a strong first-order phase transition and
discuss that supersymmetric variants of the electroweak theory (MSSM and some
version of NMSSM) rather naturally provide the necessary ingredients. The
charginos and the stops play a prominent role. We present CP-violating
dispersion relations in the chargino sector and show results of a concrete
model calculation for the asymmetry production based on quasi-classical
Boltzmann transport equations and sphaleron transitions in the hot electroweak
phase.
","[{""version"":""v1"",""created"":""Mon, 5 Feb 2001 10:35:36 GMT""}]","2014-11-17"
"hep-ph/0102044","Christof Wetterich","Christof Wetterich","Connection between Chiral Symmetry Restoration and Deconfinement","New section on vortices,33 pages,LaTex","Phys.Rev. D66 (2002) 056003","10.1103/PhysRevD.66.056003","HD-THEP-01-06","hep-ph nucl-th",,"  We propose a simple explanation for the connection between chiral symmetry
restoration and deconfinement in QCD at high temperature. In the Higgs
description of the QCD vacuum both spontaneous chiral symmetry breaking and
effective gluon masses are generated by the condensate of a color octet
quark-antiquark pair. The transition to the high temperature state proceeds by
the melting of this condensate. Quarks and gluons become (approximately)
massless at the same critical temperature. For instanton-dominated effective
multiquark interactions and three light quarks with equal mass we find a first
order phase transition at a critical temperature around 170 MeV.
","[{""version"":""v1"",""created"":""Mon, 5 Feb 2001 12:33:56 GMT""},{""version"":""v2"",""created"":""Fri, 7 Dec 2001 15:22:57 GMT""},{""version"":""v3"",""created"":""Fri, 21 Jun 2002 17:13:53 GMT""}]","2009-11-07"
"hep-ph/0102045","Nobuchika Okada","Junji Hisano, Mihoko M. Nojiri and Nobuchika Okada","The fate of the B ball","27 pages incl 8 figs, LaTeX","Phys.Rev. D64 (2001) 023511","10.1103/PhysRevD.64.023511","KEK-TH-741, CERN-TH/2001-022, YITP-01-04","hep-ph astro-ph",,"  The gauge-mediated SUSY-breaking (GMSB) model needs entropy production at a
relatively low temperature in the thermal history of the Universe for the
unwanted relics to be diluted. This requires a mechanism for the baryogenesis
after the entropy production, and the Affleck and Dine (AD) mechanism is a
promising candidate for it. The AD baryogenesis in the GMSB model predicts the
existence of the baryonic Q ball, that is the B ball, and this may work as the
dark matter in the Universe. In this article, we discuss the stability of the B
ball in th presence of baryon-number violating interactions. We find that the
evaporation rate increases monotonically with the B-ball charge because the
large field value inside the B ball enhances the effect of the
baryon-number-violating operators. While there are some difficulties to
evaluate the evaporation rate of the B ball, we derive the evaporation time
(lifetime) of the B ball for the mass-to-charge ratio $\omega_0\gsim 100 \MEV$.
The lifetime of the B ball and the distortion of the cosmic ray positron flux
and the cosmic background radiation from the B ball evaporation give
constraints on the baryon number of the B ball and the interaction, if the B
ball is the dark matter. We also discuss some unresolved properties of the B
ball.
","[{""version"":""v1"",""created"":""Mon, 5 Feb 2001 13:10:52 GMT""}]","2009-11-07"
"hep-ph/0102046","Paolo Lipari","Paolo Lipari","CP violation effects and high energy neutrinos","Latex, 46 pages, 15 figures","Phys.Rev.D64:033002,2001","10.1103/PhysRevD.64.033002",,"hep-ph",,"  This work discusses critically the prospects of measuring CP and T violation
effects in high energy neutrino factories. For this purpose we develop, in the
standard framework with three neutrino flavors, simple expressions for the
oscillation probabilities in matter that are valid for high E_nu. All CP
violating effects vanish as E_nu^(-3) and are very difficult to detect with
high energy neutrinos. A significantly easier task is the determination of the
absolute value |delta| of the phase in the neutrino mixing matrix that controls
the CP and T violation effects, performing precision measurements of the CP and
T conserving part of the oscillation probabilities.
","[{""version"":""v1"",""created"":""Mon, 5 Feb 2001 14:47:16 GMT""}]","2014-11-17"
"hep-th/0102014","Per Osland","Jian-zu Zhang (Kaiserslautern, Bergen, Shanghai), Per Osland (Bergen)","Perturbative Aspects of q-Deformed Dynamics","10 pages, LaTeX, including 1 figure","Eur.Phys.J.C20:393-396,2001","10.1007/s100520100649",,"hep-th",,"  Within the framework of the q-deformed Heisenberg algebra a dynamical
equation of q-deformed quantum mechanics is discussed. The perturbative aspects
of the q-deformed Schr\""odinger equation are analyzed. General representations
of the additional momentum-dependent interaction originating from the
q-deformed effects are presented in two approaches. As examples, such
additional interactions related to the harmonic-oscillator potential and the
Morse potential are demonstrated.
","[{""version"":""v1"",""created"":""Sun, 4 Feb 2001 17:57:57 GMT""}]","2009-01-07"
"hep-th/0102016","M. B. Paranjape","Avinash Khare and M. B. Paranjape","Solitons in 2+1 Dimensional Non-Commutative Maxwell Chern-Simons Higgs
  Theories","17 pages, no figures, slightly corrected and expanded version,
  erroneous ancillary comments removed, references added","JHEP 0104:002,2001","10.1088/1126-6708/2001/04/002","UdeM-GPP-TH-01-81, DFTUZ/01/01","hep-th",,"  We find soliton solutions in the 2+1 dimensional non-commutative Maxwell
Chern-Simons Higgs theories. In the limit of the Chern-Simons coefficient going
to zero, these solutions go over to the previously found solutions in the
non-commutative Maxwell Higgs theories. The new solutions may have relevance in
the theory of the fractional quantum Hall effect and possibly in string vacua
corresponding to open strings terminating on D2 branes in the presence of D0
branes.
","[{""version"":""v1"",""created"":""Sun, 4 Feb 2001 20:51:19 GMT""},{""version"":""v2"",""created"":""Tue, 13 Feb 2001 09:00:45 GMT""}]","2010-02-03"
"hep-th/0102017","Balachandran Sathiapalan","B. Sathiapalan","Wave Functionals, Gauge Invariant Equations for Massive Modes and the
  Born-Infeld Equation in the Loop Variable Approach to String Theory","Latex File, 25 pages","JHEP 0103:029,2001","10.1088/1126-6708/2001/03/029","IMSC/2001/02/08","hep-th",,"  In earlier papers on the loop variable approach to gauge invariant
interactions in string theory, a ``wave functional'' with some specific
properties was invoked.
  It had the purpose of converting the generalized momenta to space time
fields. In this paper we describe this object in detail and give some explicit
examples. We also work out the interacting equations of the massive mode of the
bosonic string, interacting with electromagnetism, and discuss in detail the
gauge invariance. This is naturally described in this approach as a massless
spin two field interacting with a massless spin one field in a higher
dimension. Dimensional reduction gives the massive system. We also show that in
addition to describing fields perturbatively, as is required for reproducing
the perturbative equations, the wave functional can be chosen to reproduce the
Born-Infeld equations, which are non-perturbative in field strengths. This
makes contact with the sigma model approach.
","[{""version"":""v1"",""created"":""Mon, 5 Feb 2001 04:40:31 GMT""}]","2016-09-06"
"hep-th/0102018","Jacques Distler","Ilka Brunner and Jacques Distler","Torsion D-Branes in Nongeometrical Phases","35 pages, 1 figure. LaTeX2e, using UTarticle.cls and utphys.bst","Adv.Theor.Math.Phys.5:265-309,2002",,"UTTG-01-01","hep-th math.KT",,"  In a geometrical background, D-brane charge is classified by topological
K-theory. The corresponding classification of D-brane charge in an arbitrary,
nongeometrical, compactification is still a mystery. We study D-branes on
non-simply-connected Calabi-Yau 3-folds, with particular interest in the
D-branes whose charges are torsion elements of the K-theory. We argue that we
can follow the D-brane charge through the nongeometrical regions of the Kahler
moduli space and, as evidence, explicitly construct torsion D-branes at the
Gepner point in some examples. In one of our examples, the Gepner theory is a
nonabelian orbifold of a tensor product of minimal models, and this somewhat
exotic situation seems to be essential to the physics.
","[{""version"":""v1"",""created"":""Mon, 5 Feb 2001 05:27:46 GMT""}]","2014-11-18"
"hep-th/0102019","Abdur Rahim Choudhary","Abdur Rahim Choudhary","New relations between analyticity, Regge trajectories, Veneziano
  amplitude, and Moebius transformations","10 page paper in .ps format, includes three figures embedded in the
  text",,,,"hep-th",,"  In this paper we use the analyticity properties of the scattering amplitude
in the context of the conformal mapping techniques. The Schwarz-Christoffel and
Riemann-Schwarz functions are used to map the upper half -plane onto a
triangle. We use the known asymptotic and threshold behaviors of the scattering
amplitude to establish a connection between the values of the Regge trajectory
functions and the angles of the triangle. This geometrical interpretation
allows a link between values of the Regge trajectory functions and the
generators of the invariance group of Moebius transformations associated with
the underlying automorphic function. The formalism provides useful new
relations between analyticity, geometry, Regge trajectory functions, Veneziano
model, groups of Moebius transformations and automorphic functions. It is hoped
that they will provide avenues for further work.
","[{""version"":""v1"",""created"":""Mon, 5 Feb 2001 15:23:03 GMT""}]","2007-05-23"
"math-ph/0102003",,"J. Rheinlaender","Charakterizations of the Generators of Positive Semigroups on C*- and
  von Neumann Algebras","10 pages, Latex2e",,,"R-2001-01","math-ph math.MP",,"  Generators of positive C_0-semigroups on C^*-algebras and C_0^*-semigroups on
von Neumann algebras are examined. A characterization due to Bratteli and
Robinson in the C_0-case is proven in the C_0^*-case. Under the additional
assumptions of unitality and contractivity of the semigroup another
characterization of the generator is given. This result is restated for the
dual and predual semigroup.
","[{""version"":""v1"",""created"":""Sun, 4 Feb 2001 22:06:59 GMT""}]","2007-05-23"
"math/0102031","Matti Pitkanen","Matti Pitkanen","Riemann hypothesis and super-conformal invariance","18 pages, replacement of the original claim that Riemann hypothesis
  has been proven with the statement that superconformal invariance implies
  Riemann hypothesis",,,,"math.GM",,"  A strategy for proving (not a proof of, as was the first over-optimistic
belief) the Riemann hypothesis is suggested. The vanishing of Riemann Zeta
reduces to an orthogonality condition for the eigenfunctions of a non-Hermitian
operator D^+ having the zeros of Riemann Zeta as its eigenvalues. The
construction of D^+ is inspired by the conviction that Riemann Zeta is
associated with a physical system allowing superconformal transformations as
its symmetries and second quantization in terms of the representations of
superconformal algebra. The eigenfunctions of D^+ are analogous to the so
called coherent states and in general not orthogonal to each other. The states
orthogonal to a vacuum state (having a negative norm squared) correspond to the
zeros of Riemann Zeta. The physical states having a positive norm squared
correspond to the zeros of Riemann Zeta at the critical line. Riemann
hypothesis follows by reductio ad absurdum from the hypothesis that ordinary
superconformal algebra acts as gauge symmetries for all coherent states
orthogonal to the vacuum state, including also the non-physical coherent states
that might exist off from the critical line.
","[{""version"":""v1"",""created"":""Mon, 5 Feb 2001 05:16:17 GMT""},{""version"":""v10"",""created"":""Mon, 5 Mar 2001 09:09:27 GMT""},{""version"":""v2"",""created"":""Tue, 13 Feb 2001 14:58:54 GMT""},{""version"":""v3"",""created"":""Wed, 14 Feb 2001 15:06:57 GMT""},{""version"":""v4"",""created"":""Thu, 15 Feb 2001 06:47:52 GMT""},{""version"":""v5"",""created"":""Mon, 19 Feb 2001 15:02:00 GMT""},{""version"":""v6"",""created"":""Thu, 22 Feb 2001 08:09:36 GMT""},{""version"":""v7"",""created"":""Mon, 26 Feb 2001 07:23:51 GMT""},{""version"":""v8"",""created"":""Tue, 27 Feb 2001 16:06:46 GMT""},{""version"":""v9"",""created"":""Wed, 28 Feb 2001 15:35:18 GMT""}]","2007-05-23"
"math/0102032","Wolfgang Buehring","Wolfgang Buehring and H. M. Srivastava","Analytic continuation of the generalized hypergeometric series near unit
  argument with emphasis on the zero-balanced series","19 pages; v2: equations (4.10) and (4.11) corrected","Themistocles M. Rassias (Editor), Approximation Theory and
  Applications, Hadronic Press, Palm Harbor, FL 34682-1577, U.S.A., ISBN
  1-57485-041-5, 1998, pp. 17-35",,,"math.CA",,"  Various methods to obtain the analytic continuation near $z=1$ of the
hypergeometric series $_{p+1}F_p(z)$ are reviewed together with some of the
results. One approach is to establish a recurrence relation with respect to $p$
and then, after its repeated use, to resort to the well-known properties of the
Gaussian hypergeometric series. Another approach is based on the properties of
the underlying generalized hypergeometric differential equation: For the
coefficients in the power series expansion around $z=1$ a general formula,
valid for any $p$, is found in terms of a limit of a terminating
Saalsch\""utzian hypergeometric series of unit argument. Final results may then
be obtained for each particular $p$ after application of an appropriate
transformation formula of the Saalsch\""utzian hypergeometric series. The
behaviour at unit argument of zero-balanced hypergeometric series, which have
received particular attention in recent years, is discussed in more detail. The
related problem involving the behaviour of partial sums of such series is
addressed briefly.
","[{""version"":""v1"",""created"":""Sun, 4 Feb 2001 21:05:14 GMT""},{""version"":""v2"",""created"":""Tue, 12 Jun 2001 10:59:29 GMT""}]","2007-05-23"
"math/0102033","Niranjan Ramachandran","Niranjan Ramachandran","From Jacobians to one-motives: exposition of a conjecture of Deligne","19 pages, no figures","The arithmetic and geometry of algebraic cycles. (Banff, 1998) CRM
  Proceedings & Lecture Notes, 24., AMS",,,"math.AG math.KT",,"  Deligne has conjectured that certain mixed Hodge theoretic invariants of
complex algebraic invariants are motivic. This conjecture specializes to an
algebraic construction of the Jacobian for smooth projective curves, which was
done by A. Weil. The conjecture (and one-motives) are motivated by means of
Jacobians, generalized Jacobians of Rosenlicht, and Serre's generalized
Albanese varieties. We discuss the connections with the Hodge and the
generalized Hodge conjecture. We end with some applications to number theory by
providing partial answers to questions of Serre, Katz and Jannsen.
","[{""version"":""v1"",""created"":""Mon, 5 Feb 2001 01:24:43 GMT""}]","2007-05-23"
"math/0102034","Dave Witte","Dave Witte","Superrigid subgroups and syndetic hulls in solvable Lie groups","17 pages. This is the final version that will appear in the volume
  ""Rigidity in Dynamics and Geometry,"" edited by M. Burger and A. Iozzi
  (Springer, 2002)",,,,"math.RT math.GR",,"  This is an expository paper. It is not difficult to see that every group
homomorphism from the additive group Z of integers to the additive group R of
real numbers extends to a homomorphism from R to R. We discuss other examples
of discrete subgroups D of connected Lie groups G, such that the homomorphisms
defined on D can (""virtually"") be extended to homomorphisms defined on all of
G. For the case where G is solvable, we give a simple proof that D has this
property if it is Zariski dense. The key ingredient is a result on the
existence of syndetic hulls.
","[{""version"":""v1"",""created"":""Mon, 5 Feb 2001 03:39:00 GMT""},{""version"":""v2"",""created"":""Tue, 25 Dec 2001 09:48:23 GMT""}]","2007-05-23"
"math/0102035","Kotaro Yamada","Masaaki Umehara, Wayne Rossman and Kotaro Yamada","Mean curvature 1 surfaces in hyperbolic 3-space with low total curvature
  II","19 pages, 5 figures","Tohoku Math. J. 55 (2003), 375-395",,,"math.DG",,"  In this work, complete constant mean curvature 1 (CMC-1) surfaces in
hyperbolic 3-space with total absolute curvature at most 4 pi are classified.
This classification suggests that the Cohn-Vossen inequality can be sharpened
for surfaces with odd numbers of ends, and a proof of this is given.
","[{""version"":""v1"",""created"":""Mon, 5 Feb 2001 11:28:59 GMT""}]","2008-04-27"
"math/0102036","A. U. Klimyk","M. Havlicek, A. U. Klimyk, and S. Posta","Representations of the q-deformed algebra U'_q(so_4)","28 pages, LaTeX",,"10.1063/1.1402631","Erwin-Schroedinger-Institute (Vienna) Preprint No. 983","math.QA math.RT",,"  We study the nonstandard $q$-deformation $U'_q({\rm so}_4)$ of the universal
enveloping algebra $U({\rm so}_4)$ obtained by deforming the defining relations
for skew-symmetric generators of $U({\rm so}_4)$. This algebra is used in
quantum gravity and algebraic topology. We construct a homomorphism $\phi$ of
$U'_q({\rm so}_4)$ to the certain nontrivial extension of the Drinfeld--Jimbo
quantum algebra $U_q({\rm sl}_2)^{\otimes 2}$ and show that this homomorphism
is an isomorphism. By using this homomorphism we construct irreducible finite
dimensional representations of the classical type and of the nonclassical type
for the algebra $U'_q({\rm so}_4)$. It is proved that for $q$ not a root of
unity each irreducible finite dimensional representation of $U'_q({\rm so}_4)$
is equivalent to one of these representations. We prove that every finite
dimensional representation of $U'_q({\rm so}_4)$ for $q$ not a root of unity is
completely reducible. It is shown how to construct (by using the homomorphism
$\phi$) tensor products of irreducible representations of $U'_q({\rm so}_4)$.
(Note that no Hopf algebra structure is known for $U'_q({\rm so}_4)$.) These
tensor products are decomposed into irreducible constituents.
","[{""version"":""v1"",""created"":""Mon, 5 Feb 2001 09:08:25 GMT""}]","2015-06-26"
"math/0102037","Kotaro Yamada","Masatoshi Kokubu, Masaaki Umehara and Kotaro Yamada","Minimal surfaces that attain equality in the Chern-Osserman inequality","6 pages",,,,"math.DG",,"  In the previous paper, Takahasi and the authors generalized the theory of
minimal surfaces in Euclidean n-space to that of surfaces with holomorphic
Gauss map in certain class of non-compact symmetric spaces. It also includes
the theory of constant mean curvature one surfaces in hyperbolic 3-space.
Moreover, a Chern-Osserman type inequality for such surfaces was shown. Though
its equality condition is not solved yet, the authors have noticed that the
equality condition of the original Chern-Osserman inequality itself is not
found in any literature except for the case n=3, in spite of its importance. In
this paper, a simple geometric condition for minimal surfaces that attains
equality in the Chern-Osserman inequality is given. The authors hope it will be
a useful reference for readers.
","[{""version"":""v1"",""created"":""Mon, 5 Feb 2001 11:38:48 GMT""}]","2007-05-23"
"math/0102038","J. M. Speight","J.M. Speight","The L^2 geometry of spaces of harmonic maps S^2 -> S^2 and RP^2 -> RP^2","27 pages, 2 figures","J. Geom. Phys. 47 (2003) 343-368","10.1016/S0393-0440(02)00227-9",,"math.DG hep-th math-ph math.MP",,"  Harmonic maps from S^2 to S^2 are all weakly conformal, and so are
represented by rational maps. This paper presents a study of the L^2 metric
gamma on M_n, the space of degree n harmonic maps S^2 -> S^2, or equivalently,
the space of rational maps of degree n. It is proved that gamma is Kaehler with
respect to a certain natural complex structure on M_n. The case n=1 is
considered in detail: explicit formulae for gamma and its holomorphic
sectional, Ricci and scalar curvatures are obtained, it is shown that the space
has finite volume and diameter and codimension 2 boundary at infinity, and a
certain class of Hamiltonian flows on M_1 is analyzed. It is proved that
\tilde{M}_n, the space of absolute degree n (an odd positive integer) harmonic
maps RP^2 -> RP^2, is a totally geodesic Lagrangian submanifold of M_n, and
that for all n>1, \tilde{M}_n is geodesically incomplete. Possible
generalizations and the relevance of these results to theoretical physics are
briefly discussed.
","[{""version"":""v1"",""created"":""Mon, 5 Feb 2001 14:05:21 GMT""}]","2015-06-26"
"nucl-th/0102007","Ulrich A. Eichmann","Ulrich A. Eichmann","Comment on ""Coulomb corrections to e^+e^- production in
  ultra-relativistic nuclear collisions""","This comment on nucl-th/0101024 has been withdrawn after a fruitful
  discussion with the authors of the adressed article",,,,"nucl-th",,"  The qualitative difference in the use of retarded and Feynman amplitudes as
demonstrated in nucl-th/0101024 had been wrongly considered in this comment.
The concept of the breakdown of crossing symmetry is not effective in the case
considered in the adressed article. The technical aspects of the evaluation of
higher-order corrections which were adressed in the original comment and their
applicability to the total inclusive cross section have been clarified.
","[{""version"":""v1"",""created"":""Mon, 5 Feb 2001 00:37:09 GMT""},{""version"":""v2"",""created"":""Sat, 10 Mar 2001 04:00:32 GMT""}]","2007-05-23"
"physics/0102008","Chechelnitsky Albert M.","Albert M. Chechelnitsky","Large - Scale Homogeneity or Principle Hierarchy of the Universe?","9 pages; Report E1.5-H0-0018 to 33 COSPAR Scientific Assembly,
  Warsaw, 16-23 July 2000",,,,"physics.gen-ph",,"  Invariablly justified representations of the Wave Universe Concept-WU Concept
(see monography-Chechelnitsky A.M. Extremum, Stability and Resonance in
Astrodynamics..., etc. and other publications) indicate a principle
incorrectness of expectations of Standard (Model) cosmology about homogeneity
and isotropy of the Universe. It also is connected with observational data
about apparent hierarchy of giant astronomical systems (stellar systems,
galaxies, clusters of galaxies, superclusters of galaxies, etc.), their
megawave structure, quantization ""in the Large"", non-homogeneity of microwave
background Space radiation, adequately interpreted (in frameworks WU Concept)
effects redshifts quantization of quasars, etc. The principle absence of a
Limit of Hierarchy of Matter Levels asserts: ""The Staircase of a Matter""-is
endless. For orientation of the explorers, working with the observational data,
in frameworks of WU Concept the concrete characteristics of following (behind
superclusters of galaxies) potentially possible extremely large astronomical
systems are calculated with using the Fundamental parameter of Hierarchy -
Chechelnitsky Number (hi)=3.66(6). The astronomical systems, belonging to the
nearest hierarchy Levels of Solar- Like systems, are characterized by external
radiuses [a(k)=((hi)^k)a(0), a(0)=39.373 AU] a(20)=36.83, a(21)=135, a(22)=495,
a(23)=1815 Mpc.
","[{""version"":""v1"",""created"":""Mon, 5 Feb 2001 09:09:16 GMT""}]","2007-05-23"
"physics/0102009","Marc Toussaint","Marc Toussaint","Self-adaptive exploration in evolutionary search","24 pages, 5 figures",,,,"physics.bio-ph cs.NE nlin.AO q-bio",,"  We address a primary question of computational as well as biological research
on evolution: How can an exploration strategy adapt in such a way as to exploit
the information gained about the problem at hand? We first introduce an
integrated formalism of evolutionary search which provides a unified view on
different specific approaches. On this basis we discuss the implications of
indirect modeling (via a ``genotype-phenotype mapping'') on the exploration
strategy. Notions such as modularity, pleiotropy and functional phenotypic
complex are discussed as implications. Then, rigorously reflecting the notion
of self-adaptability, we introduce a new definition that captures
self-adaptability of exploration: different genotypes that map to the same
phenotype may represent (also topologically) different exploration strategies;
self-adaptability requires a variation of exploration strategies along such a
``neutral space''. By this definition, the concept of neutrality becomes a
central concern of this paper. Finally, we present examples of these concepts:
For a specific grammar-type encoding, we observe a large variability of
exploration strategies for a fixed phenotype, and a self-adaptive drift towards
short representations with highly structured exploration strategy that matches
the ``problem's structure''.
","[{""version"":""v1"",""created"":""Mon, 5 Feb 2001 13:55:16 GMT""}]","2007-05-23"
