"cond-mat/0102076","Sven Burger","S. Burger, F. S. Cataliotti, C. Fort, F. Minardi, and M. Inguscio, M.
  L. Chiofalo and M. P. Tosi","Superfluid and Dissipative Dynamics of a Bose-Einstein Condensate in a
  Periodic Optical Potential","4 pages, including figures","Phys. Rev. Lett. 86, 4447 (2001).","10.1103/PhysRevLett.86.4447",,"cond-mat",,"  We create Bose-Einstein condensates of 87-rubidium in a static magnetic trap
with a superimposed blue-detuned 1D optical lattice. By displacing the magnetic
trap center we are able to control the condensate evolution. We observe a
change in the frequency of the center-of-mass oscillation in the harmonic
trapping potential, in analogy with an increase in effective mass. For fluid
velocities greater than a local speed of sound, we observe the onset of
dissipative processes up to full removal of the superfluid component. A
parallel simulation study visualizes the dynamics of the BEC and accounts for
the main features of the observed behavior.
","[{""version"":""v1"",""created"":""Mon, 5 Feb 2001 11:08:40 GMT""}]","2009-05-28"
"cond-mat/0102079","Vladimir Privman","Jongsoon Park, Vladimir Privman and Egon Matijevic","Model of Formation of Monodispersed Colloids","30 pages in PDF","J. Phys. Chem. B 105, 11630-11635 (2001)","10.1021/jp011306a",,"cond-mat.mtrl-sci cond-mat.soft cond-mat.stat-mech",,"  Ample experimental evidence has been accumulated demonstrating that the
formation of monodispersed colloids proceeds through a more complex mechanism,
than the generally excepted diffusional ""burst nucleation"" process. Instead,
the synthesis of narrow-size-distribution colloidal dispersions involves
several stages, i.e., nuclei produced in a supersaturated solution, grow to
nanosize subunits, which then aggregate to form much larger uniform secondary
particles. To explain the size selection in such a series of processes, a
kinetic model was developed which combined two growth/aggregation stages. This
earlier study has shown the burst-nucleation growth of the primary particles to
depend strongly on the value of the effective surface tension entering the
surface term in the free energy of the subcritical embryos. The aim of the
present work has been to identify an appropriate control parameter in the
process of secondary particle aggregation. Modifications of the aggregation
rates to account for singlet size and aggregate diffusivity produced only small
changes. However, introduction of a ""bottle-neck"" factor in the dimer formation
rate had a profound effect on the final size distribution and suggested a
possible size-control mechanism.
","[{""version"":""v1"",""created"":""Mon, 5 Feb 2001 14:48:00 GMT""},{""version"":""v2"",""created"":""Wed, 28 Mar 2001 17:44:09 GMT""}]","2010-09-22"
"cond-mat/0102080","Claudionor Bezerra","C.G. Bezerra, A.M. Mariz, J.M. de Araujo and F.A. da Costa","The anisotropic Ashkin-Teller model: a renormalization group study","3 ps figures, accepted for publication in Physica A",,"10.1016/S0378-4371(00)00568-9",,"cond-mat.stat-mech",,"  The two-dimensional ferromagnetic anisotropic Ashkin-Teller model is
investigated through a real-space renormalization-group approach. The critical
frontier, separating five distinct phases, recover all the known exacts results
for the square lattice. The correlation length $(\nu_T)$ and crossover $(\phi)$
critical exponents are also calculated. With the only exception of the
four-state Potts critical point, the entire phase diagram belongs to the Ising
universality class.
","[{""version"":""v1"",""created"":""Mon, 5 Feb 2001 15:10:38 GMT""}]","2009-11-07"
"cond-mat/0102082","H. W. Diehl","H. W. Diehl and M. Smock","Bulk singularities at critical end points: a field-theory analysis","Latex file; uses epj stylefiles svepj.clo and svjour.cls. Two eps
  files as figures included; uses texdraw to generate some figures Only some
  remarks added in last Section of this final version","Eur.Phys.J. B21 (2001) 567-587","10.1007/PL00011126",,"cond-mat.stat-mech",,"  A class of continuum models with a critical end point is considered whose
Hamiltonian ${\mathcal{H}}[\phi,\psi]$ involves two densities: a primary
order-parameter field, $\phi$, and a secondary (noncritical) one, $\psi$.
Field-theoretic methods (renormalization group results in conjunction with
functional methods) are used to give a systematic derivation of singularities
occurring at critical end points. Specifically, the thermal singularity
$\sim|{t}|^{2-\alpha}$ of the first-order line on which the disordered or
ordered phase coexists with the noncritical spectator phase, and the
coexistence singularity $\sim |{t}|^{1-\alpha}$ or $\sim|{t}|^{\beta}$ of the
secondary density $<\psi>$ are derived. It is clarified how the renormalization
group (RG) scenario found in position-space RG calculations, in which the
critical end point and the critical line are mapped onto two separate fixed
points ${\mathcal P}_{\mathrm{CEP}}^*$ and ${\mathcal P}_{\lambda}^*$
translates into field theory. The critical RG eigenexponents of ${\mathcal
P}_{\mathrm{CEP}}^*$ and ${\mathcal P}_{\lambda}^*$ are shown to match.
${\mathcal P}_{\mathrm{CEP}}^*$ is demonstrated to have a discontinuity
eigenperturbation (with eigenvalue $y=d$), tangent to the unstable trajectory
that emanates from ${\mathcal P}_{\mathrm{CEP}}^*$ and leads to ${\mathcal
P}_{\lambda}^*$. The nature and origin of this eigenperturbation as well as the
role redundant operators play are elucidated. The results validate that the
critical behavior at the end point is the same as on the critical line.
","[{""version"":""v1"",""created"":""Mon, 5 Feb 2001 15:48:13 GMT""},{""version"":""v2"",""created"":""Fri, 6 Jul 2001 12:22:33 GMT""}]","2009-11-07"
"cond-mat/0102083","X. C. Xie","Ye Xiong, Shun-Qing Shen, and X.C. Xie","Percolative conductivity and critical exponents in mixed-valent
  manganites","4 pages, 4 figures. To appear in Rapid Communications of Phys. Rev. B",,"10.1103/PhysRevB.63.140418",,"cond-mat.str-el",,"  Recent experiments have shown that some colossal magnetoresistance (CMR)
materials exhibit a percolation transition. The conductivity exponent varies
substantially with or without an external magnetic field. This finding prompted
us to carry out theoretical studies of percolation transition in CMR systems.
We find that the percolation transition coincides with the magnetic transition
and this causes a large effect of a magnetic field on the percolation
transition. Using real-space-renormalization method and numerical calculations
for two-dimensional (2D) and three-dimensional (3D) models, we obtain the
conductivity exponent $t$ to be 5.3 (3D) and 3.3 (2D) without a magnetic field,
and 1.7 (3D) and 1.4 (2D) with a magnetic field.
","[{""version"":""v1"",""created"":""Mon, 5 Feb 2001 15:53:42 GMT""}]","2009-11-07"
"gr-qc/0102012","Alessandra Buonanno","Alessandra Buonanno and Yanbei Chen","Quantum noise in second generation, signal-recycled laser
  interferometric gravitational-wave detectors","35 pages, 9 figures; few misprints corrected and some references
  added","Phys.Rev. D64 (2001) 042006","10.1103/PhysRevD.64.042006","GRP/00/553","gr-qc quant-ph",,"  It has long been thought that the sensitivity of laser interferometric
gravitational-wave detectors is limited by the free-mass standard quantum
limit, unless radical redesigns of the interferometers or modifications of
their input/output optics are introduced. Within a fully quantum-mechanical
approach we show that in a second-generation interferometer composed of arm
cavities and a signal recycling cavity, e.g., the LIGO-II configuration, (i)
quantum shot noise and quantum radiation-pressure-fluctuation noise are
dynamically correlated, (ii) the noise curve exhibits two resonant dips, (iii)
the Standard Quantum Limit can be beaten by a factor of 2, over a frequency
range \Delta f/f \sim 1, but at the price of increasing noise at lower
frequencies.
","[{""version"":""v1"",""created"":""Sun, 4 Feb 2001 19:45:02 GMT""},{""version"":""v2"",""created"":""Fri, 6 Jul 2001 21:22:43 GMT""}]","2009-11-07"
"gr-qc/0102013","Sean A. Hayward","Sean A. Hayward","Gravitational-wave dynamics and black-hole dynamics: second
  quasi-spherical approximation","16 revtex pages","Class.Quant.Grav. 18 (2001) 5561-5582","10.1088/0264-9381/18/24/316",,"gr-qc",,"  Gravitational radiation with roughly spherical wavefronts, produced by
roughly spherical black holes or other astrophysical objects, is described by
an approximation scheme. The first quasi-spherical approximation, describing
radiation propagation on a background, is generalized to include additional
non-linear effects, due to the radiation itself. The gravitational radiation is
locally defined and admits an energy tensor, satisfying all standard local
energy conditions and entering the truncated Einstein equations as an effective
energy tensor. This second quasi-spherical approximation thereby includes
gravitational radiation reaction, such as the back-reaction on the black hole.
With respect to a canonical flow of time, the combined energy-momentum of the
matter and gravitational radiation is covariantly conserved. The corresponding
Noether charge is a local gravitational mass-energy. Energy conservation is
formulated as a local first law relating the gradient of the gravitational mass
to work and energy-supply terms, including the energy flux of the gravitational
radiation. Zeroth, first and second laws of black-hole dynamics are given,
involving a dynamic surface gravity. Local gravitational-wave dynamics is
described by a non-linear wave equation. In terms of a complex gravitational-
radiation potential, the energy tensor has a scalar-field form and the wave
equation is an Ernst equation, holding independently at each spherical angle.
The strain to be measured by a distant detector is simply defined.
","[{""version"":""v1"",""created"":""Mon, 5 Feb 2001 07:20:47 GMT""}]","2009-11-07"
"gr-qc/0102014","Roberto Casadio","G.L. Alberghi, R. Casadio, G.P. Vacca, G. Venturi","Gravitational Collapse of a Radiating Shell","LaTeX, 34 pages, 21 EPS figures included","Phys.Rev.D64:104012,2001","10.1103/PhysRevD.64.104012",,"gr-qc astro-ph hep-ph hep-th",,"  We study the collapse of a self-gravitating and radiating shell. Matter
constituting the shell is quantized and the construction is viewed as a
semiclassical model of possible black hole formation. It is shown that the
shell internal degrees of freedom are excited by the quantum non-adiabaticity
of the collapse and, consequently, on coupling them to a massless scalar field,
the collapsing matter emits a burst of coherent (thermal) radiation.
","[{""version"":""v1"",""created"":""Mon, 5 Feb 2001 08:40:43 GMT""},{""version"":""v2"",""created"":""Fri, 31 Aug 2001 07:36:41 GMT""}]","2008-11-26"
"gr-qc/0102015","Novak","Jerome Novak","Numerical Relativity CM1-a and CM1-b sessions","Summary of the ""Numerical Relativity"" session of the 9th Marcel
  Grossman Meeting, held in Rome, July 2000. 8 pages, no figures, uses World
  Scientific Latex style file (included)",,"10.1142/9789812777386_0362",,"gr-qc",,"  Numerical Relativity is concerned with solving the Einstein equations, as
well as any field or matter equations on curved space-time, by means of
computer calculations. The methods developed for this purpose up to now, as
well as the addressed physical problems are getting more numerous every day.
This is a brief summary of the presentations which have been given during the
9th Marcel Grossman meeting, which took place in Rome, from 2nd to 8th of July
2000. Many different fields have been addressed, from pure numerics and applied
mathematics to neutron star properties and gravitational wave astronomy.
","[{""version"":""v1"",""created"":""Mon, 5 Feb 2001 09:15:39 GMT""},{""version"":""v2"",""created"":""Tue, 13 Feb 2001 12:50:12 GMT""}]","2017-08-23"
"gr-qc/0102016","Peter Dunsby","Deon Solomons, Peter Dunsby and George Ellis","Exact Inflation Braneworlds","6 pages RevTeX. Submitted to Physical Review D",,,"uct-cosmology-01/02","gr-qc",,"  In Randall-Sundrum type braneworld cosmologies, the dynamical equations on
the three-brane differ from the general relativity equations by terms that
carry the effects of embedding and of the free gravitational field in the
five-dimensional bulk. In a FRW ansatze for the metric, we present two methods
for deriving inflationary solutions to the covariant non-linear dynamical
equations for the gravitational and matter fields on the brane. In the first
approach we examine the constraints on the dynamical relationship between the
cosmological scale factor and the scalar field driving self-interaction
potential, imposed by the weak energy condition. We then investigate
inflationary solutions obtained from a scalar field superpotential. Both these
techniques for solving the braneworld field equations are illustrated by flat
curvature models.
","[{""version"":""v1"",""created"":""Mon, 5 Feb 2001 12:34:06 GMT""}]","2007-05-23"
"gr-qc/0102017","Peter Dunsby","George F R Ellis","Cosmology and Local Physics","20 pages LaTeX","Int.J.Mod.Phys.A17:2667-2672,2002","10.1142/S0217751X02011588","uct-cosmology-01/03","gr-qc",,"  This article is dedicated to the memory of Dennis Sciama. It revisits a
series of issues to which he devoted much time and effort, regarding the
relationship between local physics and the large scale structure of the
universe - in particular, Olber's paradox, Mach's principle, and the various
arrows of time. Thus the focus is various ways in which local physics is
influenced by the universe itself.
","[{""version"":""v1"",""created"":""Mon, 5 Feb 2001 13:15:17 GMT""}]","2011-07-19"
"hep-ex/0102004","Ferenc Sikler","Ferenc Sikler (for the NA49 Collaboration)","Recent NA49 results on Pb+Pb collisions at CERN SPS","9 pages, 21 figures, proceedings of ISMD2000",,,,"hep-ex",,"  In the spirit of establishing a fair reference for nucleus-nucleus
collisions, results on stopping and baryon transfer, correlations of the p+p
interaction and their consequences are shown. In the discussion of new results
from nucleus-nucleus collisions the emphasis is on strange meson and baryon
production at different energies - for the first time at 40 GeV A - with the
study of light nuclei.
","[{""version"":""v1"",""created"":""Mon, 5 Feb 2001 13:16:00 GMT""}]","2007-05-23"
"hep-ex/0102005","Hans Eggers","H.C. Eggers","Experimental correlation analysis: foundations and practice","Multiparticle Dynamics (Tihany) review talk. 12 pages, includes 4
  figs, 8 .eps files and own style file","Proc. 30th Int. Symp. Multiparticle Dynamics, Tihany/Hungary,
  edited by T Csorgo, S Hegyi and W Kittel, World Scientific (2001), pages
  291-302",,"STPHY 49","hep-ex hep-ph",,"  Commonalities and differences in correlation analysis in terms of phase
space, conditioning and uncorrelatedness are discussed. The Poisson process is
not generally appropriate as reference distribution for normalisation and
cumulants, so that generalised statistics in terms of arbitrarily defined
reference processes must be employed. Consideration of the sampling hierarchy
leads us to a classification of current event-by-event observables.
","[{""version"":""v1"",""created"":""Mon, 5 Feb 2001 15:58:09 GMT""}]","2007-05-23"
"hep-ph/0102034","Lawrence P. Horwitz","Y. Strauss and L.P. Horwitz","Lax-Phillips Scattering Theory of a Relativistic Quantum Field
  Theoretical Lee-Friedrichs Model and Lee-Oehme-Yang-Wu Phenomenology","Plain TeX, 34 pages","J.Math.Phys. 43 (2002) 2394-2422","10.1063/1.1461426","TAUP 2546-99","hep-ph hep-th math-ph math.MP",,"  The one-channel Wigner-Weisskopf survival amplitude may be dominated by
exponential type decay in pole approximation at times not too short or too
long, but, in the two channel case, for example, the pole residues are not
orthogonal, and the pole approximation evolution does not correspond to a
semigroup (experiments on the decay of the neutral K-meson system support the
semigroup evolution postulated by Lee, Oehme and Yang, and Yang and Wu, to very
high accuracy). The scattering theory of Lax and Phillips, originally developed
for classical wave equations, has been recently extended to the description of
the evolution of resonant states in the framework of quantum theory. The
resulting evolution law of the unstable system is that of a semigroup, and the
resonant state is a well-defined funtion in the Lax-Phillips Hilbert space. In
this paper we apply this theory to relativistically covarant quantum field
theoretical form of the (soluble) Lee model. We show that this theory provides
a rigorous underlying basis for the Lee-Oehme-Yang-Wu construction.
","[{""version"":""v1"",""created"":""Sun, 4 Feb 2001 16:22:39 GMT""}]","2015-06-25"
"hep-ph/0102035","Matthew Lilley","Matthew Lilley and Antonio Ferrera","Defect Formation Rates in Cosmological First-Order Phase Transitions","9 pages, 5 figures. Replaced with version to appear in Physical
  Review D","Phys.Rev. D64 (2001) 023520","10.1103/PhysRevD.64.023520","HD-THEP-01-05, DAMTP-2001-11","hep-ph",,"  In cosmological first-order phase transitions, the progress of true-vacuum
bubbles is expected to be significantly retarded by the interaction between the
bubble wall and the hot plasma. It has been claimed that this leads to a
significant reduction in the number of topological defects formed per bubble,
as a result of phase equilibration between bubbles. This claim has been
verified for spontaneously-broken global symmetries. We perform a series of
simulations of complete phase transitions in the 2+1-dimensional U(1)-Abelian
Higgs model, for a range of bubble wall velocities, in order to obtain a
quantitative measure of the effect of bubble wall speed on the number density
of topological defects. We find that the number of defects formed is i)
significantly lower in the local than the global case and ii) decreases
exponentially as a function of wall velocity. Slow-moving bubbles also lead,
however, to the nucleation of more bubbles before the phase transition is
complete. Our simulations show that this is in fact the dominant effect, and so
we predict {\em more} defects per unit volume as a result of the sub-luminal
bubble wall terminal velocity.
","[{""version"":""v1"",""created"":""Sun, 4 Feb 2001 17:29:55 GMT""},{""version"":""v2"",""created"":""Fri, 27 Apr 2001 18:10:15 GMT""}]","2009-11-07"
"hep-ph/0102036","Steven D. Bass","Steven D. Bass","Spin structure in non-forward partons","15 pages","Phys.Rev. D65 (2002) 074025","10.1103/PhysRevD.65.074025","TUM/T39-01-01","hep-ph",,"  Renormalisation induces anomalous contributions in light-cone correlation
functions. We discuss the role of the axial anomaly and gluon topology in
non-forward parton distributions noting that non-forward matrix elements of the
gluonic Chern-Simons current K_{\mu} are not gauge-invariant even in
perturbation theory. The axial anomaly means that one has to be careful how to
interpret information from hard exclusive reactions about the orbital
angular-momentum carried by the proton's internal constituents.
","[{""version"":""v1"",""created"":""Sun, 4 Feb 2001 16:50:26 GMT""}]","2009-11-07"
"hep-ph/0102037","Tao Han","G. Eilam, A. Gemintern, T. Han, J.M. Yang, and X. Zhang","Top-quark rare decay $t\to c h$ in R-parity-violating SUSY","version to appear in Phys. Lett. B","Phys.Lett. B510 (2001) 227-235","10.1016/S0370-2693(01)00598-6","MADPH-01-1212","hep-ph hep-ex",,"  The flavor-changing top-quark decay $t\to c h$, where $h$ is the lightest
CP-even Higgs boson in the minimal supersymmetric standard model, is examined
in the R-parity-violating supersymmetric model. Within the existing bounds on
the relevant R-parity-violating couplings, the branching fraction for $t\to c
h$ can be as large as about $10^{-5}$ in some part of the parameter space.
","[{""version"":""v1"",""created"":""Sun, 4 Feb 2001 17:00:39 GMT""},{""version"":""v2"",""created"":""Thu, 10 May 2001 04:04:38 GMT""}]","2009-11-07"
"hep-ph/0102038","A. K. Chaudhuri","A. K. Chaudhuri","Transverse energy distributions and $J/\psi$ production in Pb+Pb
  collisions","Revised version with better E_T fit. 4 pages, 2 figures","Phys.Rev. C64 (2001) 054903","10.1103/PhysRevC.64.054903",,"hep-ph",,"  We have analyzed the latest NA50 data on transverse energy distributions and
$J/\psi$ suppression in Pb+Pb collisions. The transverse energy distribution
was analysed in the geometric model of AA collisions. In the geometric model,
fluctuations in the number of NN collisions at fixed impact parameter are taken
into account. Analysis suggests that in Pb+Pb collisions, individual NN
collisions produces less $<E_T>$, than in other AA collisions. The nucleons are
more transparent in Pb+Pb collisions. The transverse energy dependence of the
$J/\psi$ suppression was obtained following the model of Blaizot et al, where
charmonium suppression is assumed to be 100% effective above a threshold
density. With fluctuations in number of NN collisions taken into account, good
fit to the data is obtained, with a single parameter, the threshold density.
","[{""version"":""v1"",""created"":""Mon, 5 Feb 2001 09:17:03 GMT""},{""version"":""v2"",""created"":""Wed, 18 Apr 2001 06:17:59 GMT""}]","2009-11-07"
"hep-ph/0102039","Timo Arvid Lahde","T.A. Lahde and D.O. Riska (Helsinki Institute of Physics and
  Department of Physics, University of Helsinki, Finland)","Two-Pion Decay Widths of Excited Charm Mesons","20 pages, uses Feynmf Submitted to Nuclear Physics A, published
  version","Nucl.Phys.A693:755-774,2001","10.1016/S0375-9474(01)00917-4",,"hep-ph",,"  The widths for $\pi\pi$ decay of the L=1 charm mesons are calculated by
describing the pion coupling to light constituents quarks by the lowest order
chiral interaction. The wavefunctions of the charm mesons are obtained as
solutions to the covariant Blankenbecler-Sugar equation. These solutions
correspond to an interaction Hamiltonian modeled as the sum of a linear scalar
confining and a screened one-gluon exchange (OGE) interaction. This interaction
induces a two-quark contribution to the amplitude for two-pion decay, which is
found to interfere destructively with the single quark amplitude. For the
currently known L=1 $D$ mesons, the total $\pi\pi$ decay widths are found to be
$\sim 1$ MeV for the $D_1(2420)$ and $\sim 3$ MeV for the $D^*_2(2460)$ if the
axial coupling of the constituent quark is taken to be $g_A^q=1$. The as yet
undiscovered spin singlet $D_1^*$ state is predicted to have a larger width of
7 - 10 MeV for $\pi\pi$ decay.
","[{""version"":""v1"",""created"":""Mon, 5 Feb 2001 08:25:03 GMT""},{""version"":""v2"",""created"":""Mon, 26 Mar 2001 13:19:07 GMT""}]","2011-07-19"
"hep-ph/0102040","Tomohiro Matsuda","Tomohiro Matsuda","Electroweak baryogenesis and hierarchy","7pages, 1 figure, final version",,,,"hep-ph astro-ph hep-th",,"  We consider the scenario of electroweak baryogenesis mediated by cosmological
defects in a model of extra dimension. We consider the domain wall on the brane
in higher-dimensional theories.The electroweak breaking scale is suppressed and
the sphaleron interaction is activated in the false vacuum.
","[{""version"":""v1"",""created"":""Mon, 5 Feb 2001 08:58:29 GMT""},{""version"":""v2"",""created"":""Wed, 14 Feb 2001 06:22:49 GMT""},{""version"":""v3"",""created"":""Fri, 16 Mar 2001 06:28:56 GMT""},{""version"":""v4"",""created"":""Sat, 28 Jul 2001 05:28:29 GMT""}]","2007-05-23"
"hep-ph/0102041","Fukae Seiji","S. Fukae (Hiroshima University)","CP Asymmetry of $B\to X_sl^+l^-$ in Low Invariant Mass Region","12 pages, 5 figures, LaTeX, Accepted for Physical Review D","Phys.Rev. D64 (2001) 054010","10.1103/PhysRevD.64.054010","HUPD-0014","hep-ph",,"  I analyzed the CP asymmetry of $B\to X_sl^+l^-$ based on model-independent
analysis which includes twelve independent four Fermi operators. The CP
asymmetry is suppressed in the Standard Model, however, if some new physics
make it much larger, the present or the next generation B factories may catch
the CP violation in this decay mode. In this paper, we studied the correlation
of the asymmetry and the branching ratio, and then we will find only a type of
interactions can be enlarge the asymmetry. Therefore, in comparison with
experiments, we have possibility that we can constrain models beyond the
standard model.
","[{""version"":""v1"",""created"":""Mon, 5 Feb 2001 12:41:15 GMT""},{""version"":""v2"",""created"":""Sun, 15 Jul 2001 18:47:11 GMT""}]","2009-11-07"
"hep-ph/0102042","Thomas Hebbeker","Thomas Hebbeker and Charles Timmermans","A Compilation of High Energy Atmospheric Muon Data at Sea Level",,"Astropart.Phys.18:107-127,2002","10.1016/S0927-6505(01)00180-3",,"hep-ph",,"  We collect and combine all published data on the vertical atmospheric muon
flux and the muon charge ratio for muon momenta above 10 GeV. At sea level the
world average of the momentum spectra agrees with the flux calculated by E.V.
Bugaev et al. within 15%. The observed shape of the differential flux versus
momentum is slightly flatter than predicted in this calculation. The
experimental accuracy varies from 7% at 10 GeV to 17% at 1 TeV. The ratio of
fluxes of positive to negative muons is found to be constant, at a value of
1.268, with relative uncertainties increasing from approximately 1% at low
momenta to about 6% at 300 GeV.
","[{""version"":""v1"",""created"":""Mon, 5 Feb 2001 10:00:51 GMT""}]","2011-05-23"
