"quant-ph/0102020","Alberto Carlini","M. Sasaki, A. Carlini and R. Jozsa","Quantum Template Matching","Latex, 14 pages, includes 5 figures",,"10.1103/PhysRevA.64.022317",,"quant-ph",,"  We consider the quantum analogue of the pattern matching problem, which
consists of classifying a given unknown system according to certain predefined
pattern classes. We address the problem of quantum template matching in which
each pattern class ${\cal C}_i$ is represented by a known quantum state $\hat
g_i$ called a template state, and our task is to find a template which
optimally matches a given unknown quantum state $\hat f$. We set up a precise
formulation of this problem in terms of the optimal strategy for an associated
quantum Bayesian inference problem. We then investigate various examples of
quantum template matching for qubit systems, considering the effect of allowing
a finite number of copies of the input state $\hat f$. We compare quantum
optimal matching strategies and semiclassical strategies and demonstrate an
entanglement assisted enhancement of performance in the general quantum optimal
strategy.
","[{""version"":""v1"",""created"":""Mon, 5 Feb 2001 06:16:12 GMT""}]","2009-11-07"
"quant-ph/0102021","Vladimir K. Voronov","Vladimir V. Voronov","The Use of NMR for Solving the Problems of Quantum Computers","6 pages",,,,"quant-ph",,"  The analysis of papers on usage NMR in quantum computations is provided and
the probable direction of the future investigations are considered.
","[{""version"":""v1"",""created"":""Mon, 5 Feb 2001 07:26:30 GMT""}]","2007-05-23"
"quant-ph/0102022","Dae-Yup","Dae-Yup Song","Exact coherent states in one-dimensional quantum many-body systems with
  inverse-square interactions","Physical Review A in Press","Phys. Rev. A 63, 032104 (2001)","10.1103/PhysRevA.63.032104",,"quant-ph",,"  For the models of $N$-body identical harmonic oscillators interacting through
potentials of homogeneous degree -2, the unitary operator that transforms a
system of time-dependent parameters into that of unit spring constant and unit
mass of different timescale is found. If the interactions can be written in
terms of the differences between positions of two particles, it is also shown
that the Schr\""{o}dinger equation is invariant under a unitary transformation.
These unitary relations can be used not only in finding coherent states from
the given stationary states in a system, but also in finding exact wave
functions of the Hamiltonian systems of time-dependent parameters from those of
time-independent Hamiltonian systems. Both operators are invariant under the
exchange of any pair of particles. The transformations are explicitly applied
for some of the Calogero-Sutherland models to find exact coherent states.
","[{""version"":""v1"",""created"":""Mon, 5 Feb 2001 08:59:34 GMT""}]","2007-05-23"
"quant-ph/0102023","Marcelo F. Santos","M. Franca Santos, P. Milman, A. Z. Khoury and P.H. Souto Ribeiro","Measurement of the degree of Polarization Entanglement Through Position
  Interference","5 figures",,"10.1103/PhysRevA.64.023804",,"quant-ph",,"  We produce polarization entangled states with variable degree of entanglement
for twin photons. Entanglement in polarization is coupled to entanglement in
position that produces transverse coincidence interference fringes. We show
both theoretically and experimentally that, due to this coupling, we can use
the interference pattern to measure the polarization degree of entanglement.
","[{""version"":""v1"",""created"":""Mon, 5 Feb 2001 12:15:34 GMT""}]","2009-11-07"
"quant-ph/0102024","Michael M. Wolf","R.F. Werner and M.M. Wolf","All multipartite Bell correlation inequalities for two dichotomic
  observables per site","11 pages, REVTeX",,"10.1103/PhysRevA.64.032112",,"quant-ph",,"  We construct a set of 2^(2^n) independent Bell correlation inequalities for
n-partite systems with two dichotomic observables each, which is complete in
the sense that the inequalities are satisfied if and only if the correlations
considered allow a local classical model. All these inequalities can be
summarized in a single, albeit non-linear inequality. We show that quantum
correlations satisfy this condition provided the state has positive partial
transpose with respect to any grouping of the n systems into two subsystems. We
also provide an efficient algorithm for finding the maximal quantum mechanical
violation of each inequality, and show that the maximum is always attained for
the generalized GHZ state.
","[{""version"":""v1"",""created"":""Mon, 5 Feb 2001 15:00:06 GMT""}]","2009-11-07"
"quant-ph/0102025","Luca Marinatto","Luca Marinatto, Tullio Weber","Teleportation with indistinguishable particles","8 pages, Latex, submitted to Phys. Lett. A","Physics Letters A 287, 1 (2001)","10.1016/S0375-9601(01)00431-5",,"quant-ph",,"  We analyze in a critical way the mathematical treatment of a quantum
teleportation experiment performed with photon particles, showing that a
symmetrization operation over both the polarization and spatial degrees of
freedom of all the particles involved is necessary in order to reproduce
correctly the observed experimental data.
","[{""version"":""v1"",""created"":""Mon, 5 Feb 2001 15:52:50 GMT""}]","2009-11-07"
