"astro-ph/0102063","Jose A. Pons","Christoph Hanhart, Jose A. Pons, Daniel R. Phillips, and Sanjay Reddy","The likelihood of GODs' existence: Improving the SN1987a constraint on
  the size of large compact dimensions","14 pages including 2 figures","Phys.Lett.B509:1-9,2001","10.1016/S0370-2693(01)00544-5",,"astro-ph hep-ph nucl-th",,"  The existence of compact dimensions which are accessible only to gravity
represents an intriguing possible solution to the hierarchy problem. At present
the strongest constraint on the existence of such compact Gravity-Only
Dimensions (GODs) comes from SN1987a. Here we report on the first
self-consistent simulations of the early, neutrino-emitting phase of a
proto-neutron star which include energy losses due to the coupling of the
Kaluza-Klein modes of the graviton which arise in a world with GODs. We compare
the neutrino signals from these simulations to that from SN1987a and use a
rigorous probabilistic analysis to derive improved bounds for the radii of such
GODs. We find that the possibility that there are two compact extra dimensions
with radii larger than 0.66 $\mu$m is excluded at the 95% confidence level---as
is the possibility that there are three compact extra dimensions larger than
0.8 nm.
","[{""version"":""v1"",""created"":""Sun, 4 Feb 2001 20:52:40 GMT""},{""version"":""v2"",""created"":""Tue, 6 Feb 2001 01:23:01 GMT""}]","2008-11-26"
"astro-ph/0102064","Ermanno F. Borra","Ermanno F. Borra","Strip Searching for Supernovae","Adobe PDF, 13 pages",,,,"astro-ph",,"  The survey of a strip of sky carried out with a zenith-observing 4-m liquid
mirror can discover and observe several thousand supernovae/year to z = 1,
making it quite competitive with other proposed surveys. Because LMs are
inexpensive, and easy to build, a SNeIa survey can begin rapidly. As documented
in the published literature, the present technology, and its cost, has been
proven in both the laboratory and in observatory settings and is ready, at a
very modest cost, for a 4-m class telescope.
  As a bonus, the coadded data would survey 150 square degrees of sky to
magnitudes > 27, as deep as the deepest optical surveys but in a far larger
area of sky. There presently is a window of opportunity to make fundamental
discoveries by exploiting the cost advantage of this powerful novel technology.
","[{""version"":""v1"",""created"":""Sun, 4 Feb 2001 22:23:53 GMT""}]","2016-08-30"
"astro-ph/0102065","Tsunefumi Mizuno","T. Mizuno, A. Kubota and K. Makishima","Spectral variability of Ultra Luminous Compact X-ray Sources in Nearby
  Spiral Galaxies","13 pages, 11 figures, ApJ accepted",,"10.1086/321418",,"astro-ph",,"  Using the X-ray data taken with ASCA, a detailed analysis was made of
intensity and spectral variations of three ultra-luminous extra-galactic
compact X-ray sources (ULXs); IC 342 source 1, M81 X-6, and NGC 1313 source B,
all exhibiting X-ray luminosity in the range 10^{39}-1.5x10^{40} erg s^{-1}. As
already reported, IC 342 source 1 showed short-term X-ray intensity variability
by a factor of 2.0 on a typical time scale of 10 ks. M81 X-6 varied by a factor
of 1.6 across seven observations spanning 3 years, while NGC 1313 source B
varied by a factor of 2.5 between two observations conducted in 1993 July and
1995 November. The ASCA spectra of these sources, acquired on these occasions,
were all described successfully as optically-thick emission from standard
accretion disks around black holes. This confirms previous ASCA works which
explained ULXs as mass-accreting massive black-hole binaries. In all three
sources, the disk color temperature was uncomfortably high at T_{in}=1.0-2.0
keV, and was found to vary in proportion to the square-root of the source flux.
The apparent accretion-disk radius is hence inferred to change as inversely
proportional to T_{in}. This suggests a significant effect of advection in the
accretion disk. However, even taking this effect fully into account, the too
high values of T_{in} of ULXs cannot be explained. Further invoking the rapid
black-hole rotation may give a solution to this issue.
","[{""version"":""v1"",""created"":""Mon, 5 Feb 2001 01:36:37 GMT""}]","2009-11-06"
"astro-ph/0102066","Erik Kuulkers","Erik Kuulkers (Space Research Organization Netherlands & Utrecht
  University)","A `superoutburst' in XTE J1118+480","6 pages, 2 figures, to be published in Astronomische Nachrichten;
  correct inclusion of figure 1",,"10.1002/1521-3994(200103)322:1<9::AID-ASNA9>3.0.CO;2-F",,"astro-ph",,"  I propose that the properties of the two outbursts observed in the X-ray
transient XTE J1118+480 in 2000 are akin to superoutbursts of SU UMa stars. In
these systems a `normal' outburst immediately precedes a 5-10 times longer
(`super')outburst. The optical light curve of the outbursts of XTE J1118+480 is
remarkably similar to that seen in some SU UMa stars, such as UV Per and T Leo,
where the precursor outburst is distinct from the superoutburst, but the time
scales are a factor of ~15 different. The first outburst of XTE J1118+480 was
relatively short (~1 month) while the second outburst was ~5 times longer.
During the second outburst superhumps were seen, a feature characteristic for
superoutbursts. The gap of about a month between the two outbursts is longer in
X-rays with respect to the optical, a feature not previously recognized for
X-ray transients. Also in SU UMa stars the precursor outburst becomes more
distinct at shorter wavelengths. Finally, I show that the time of appearance of
the superhumps in XTE J1118+480 is consistent with the expected superhump
growth time, if the superhump mechanism was triggered during the first
outburst. I conclude that the similarity in outburst behaviour in the two types
of systems provides further support that a common mechanism is at work to start
the long (`super')outbursts.
","[{""version"":""v1"",""created"":""Mon, 5 Feb 2001 09:25:25 GMT""},{""version"":""v2"",""created"":""Wed, 14 Feb 2001 16:49:49 GMT""}]","2009-11-06"
"astro-ph/0102067","Giovanni Imponente","G.P. Imponente and G. Montani","On the Covariance of the Mixmaster Chaoticity","11 pages, accepted Phys. Rev. D (Jan 2001)","Phys.Rev. D63 (2001) 103501","10.1103/PhysRevD.63.103501",,"astro-ph gr-qc",,"  We analyze the dynamics of the Mixmaster Universe on the base of a standard
Arnowitt-Deser-Misner Hamiltonian approach showing how its asymptotic evolution
to the cosmological singularity is isomorphic to a billiard on the Lobachevsky
plane. The key result of our study consists in the temporary gauge invariance
of the billiard representation, once provided the use of very general
Misner-Chitre'-like variables.
","[{""version"":""v1"",""created"":""Mon, 5 Feb 2001 12:10:45 GMT""}]","2009-11-06"
"astro-ph/0102068","Stuart Caunt","S.E. Caunt, M.J. Korpi","A 3D MHD model of astrophysical flows: algorithms, tests and
  parallelisation","17 pages with 21 GIF figures. Accepted for publication in A&A",,"10.1051/0004-6361:20010157",,"astro-ph",,"  In this paper we describe a numerical method designed for modelling different
kinds of astrophysical flows in three dimensions. Our method is a standard
explicit finite difference method employing the local shearing-box technique.
  To model the features of astrophysical systems, which are usually
compressible, magnetised and turbulent, it is desirable to have high spatial
resolution and large domain size to model as many features as possible, on
various scales, within a particular system. In addition, the time-scales
involved are usually wide-ranging also requiring significant amounts of CPU
time.
  These two limits (resolution and time-scales) enforce huge limits on
computational capabilities. The model we have developed therefore uses parallel
algorithms to increase the performance of standard serial methods. The aim of
this paper is to report the numerical methods we use and the techniques invoked
for parallelising the code. The justification of these methods is given by the
extensive tests presented herein.
","[{""version"":""v1"",""created"":""Mon, 5 Feb 2001 13:03:57 GMT""}]","2009-11-06"
"astro-ph/0102069","Jean-Charles Augereau","J.C. Augereau (1), R.P. Nelson (2), A.M. Lagrange (1), J.C.B.
  Papaloizou (2), D. Mouillet (1) ((1) Laboratoire d'Astrophysique de
  l'Observatoire de Grenoble, (2) Astronomy Unit, School of Mathematical
  Sciences, Queen Mary & Westfield College)","Dynamical modeling of large scale asymmetries in the beta Pictoris dust
  disk",,,"10.1051/0004-6361:20010199",,"astro-ph",,"  We report a new and complete model of the beta Pictoris disk, which succeeds
in accounting for both the surface brightness distribution, warp
characteristics, the outer ``butterfly'' asymmetry as observed by HST/STIS in
scattered light, as well as the infrared emission. Our model includes the
presence of a disk of planetesimals extending out to 120-150 AU, perturbed
gravitationally by a giant planet on an inclined orbit, following the approach
of Mouillet et al. (1997b). At any time, the planetesimal disk is assumed to be
the source of a distribution of grains produced through collisional evolution,
with the same initial orbital parameter distribution. The steady state spatial
grain distribution is found incorporating the effects of radiation pressure
which can cause the distribution of the smallest particles to become very
distended. With realistic assumptions about the grains' chemical properties,
the modeling confirms the previously evident need for an additional population
of hot grains close to the star, to account for the 12 microns fluxes at short
distances from the star. It also indicates that this population cannot explain
the outer 12 microns flux distribution when the effects of gravity and
radiation pressure determine the distribution. Very small grains, produced by
collisions among aggregates, are tentatively proposed to account for this 12
microns outer emission.
","[{""version"":""v1"",""created"":""Mon, 5 Feb 2001 14:55:30 GMT""}]","2009-11-06"
"astro-ph/0102070","Diana Hannikainen","D. Hannikainen (1), K. Wu (2,3), Campbell-Wilson (2), R. Hunstead (2),
  J. Lovell(4), V. McIntyre (2,4), J. Reynolds (4), R. Soria (3) & T. Tzioumis
  (4) ((1) Univ. of Southampton, (2) Univ. of Sydney, (3) MSSL, (4) ATNF)","Radio Emission from the X-ray transient XTE J1550-564","4 pages, 3 figures. Proceedings of the 4th INTEGRAL Workshop
  (Alicante 2000), to be published in ESA-SP (2001)",,,,"astro-ph",,"  We report multifrequency radio observations of XTE J1550-564 obtained with
the Molonglo Observatory Synthesis Telescope and the Australia Telescope
Compact Array at the time of its discovery and subsequent hard and soft X-ray
outburst in 1998 September. A large radio flare was observed, peaking about 1.8
days after the X-ray flare. In addition, we present Australian Long Baseline
Array images obtained shortly after the maximum of the radio flare which show
evolving structure. The apparent separation velocity of the two outermost
components is v>2c.
","[{""version"":""v1"",""created"":""Mon, 5 Feb 2001 15:07:32 GMT""}]","2007-05-23"
"cond-mat/0102046","Claudionor Bezerra","C.G. Bezerra, E.L. Albuquerque, A.M. Mariz, L.R. da Silva and C.
  Tsallis","Spin wave specific heat in quasiperiodic Fibonacci structures","4 PS figures, accepted for publication in Physica A",,"10.1016/S0378-4371(01)00017-6",,"cond-mat.stat-mech",,"  The energy spectra of a variety of collective modes on quasiperiodic
structures exhibit a complex fractal profile. Among the modes that have
attracted particular attention in this context, are the spin wave spectra of
quasiperiodic magnetic multilayers that obey a substitutional sequence of the
Fibonacci type. They are described within the framework of the Heisenberg
theory. In order to have a deep insight on the relevant thermodynamical
implications of the above mentioned energy spectra's fractal profile, we have
performed analytical and numerical calculations of the spin wave specific heat
associated with successive hierarchical sequences of the Fibonacci
quasiperiodic structures. The spectra show interesting oscillatory behavior in
the low-temperature region, which can be traced back to the spin wave's
self-similar energy spectrum.
","[{""version"":""v1"",""created"":""Sun, 4 Feb 2001 18:14:15 GMT""}]","2009-11-07"
"cond-mat/0102047","P. Dai","H. A. Mook, Pengcheng Dai, and F. Dogan","Observation of Magnetic Moments in the Superconducting State of
  YBa$_2$Cu$_3$O$_{6.6}$","9 pages, and 4 figures","Phys. Rev. B 64, 012502 (2001)","10.1103/PhysRevB.64.012502",,"cond-mat.supr-con cond-mat.str-el",,"  Neutron Scattering measurements for YBa$_2$Cu$_3$O$_{6.6}$ have identified
small magnetic moments that increase in strength as the temperature is reduced
below $T^\ast$ and further increase below $T_c$. An analysis of the data shows
the moments are antiferromagnetic between the Cu-O planes with a correlation
length of longer than 195 \AA in the $a$-$b$ plane and about 35 \AA along the
c-axis. The origin of the moments is unknown, and their properties are
discusssed both in terms of Cu spin magnetism and orbital bond currents.
","[{""version"":""v1"",""created"":""Sun, 4 Feb 2001 19:32:53 GMT""}]","2009-11-07"
"cond-mat/0102056","R. Schumann","R. Schumann and L. Jahn","Theory of Thermal Remagnetization of Permanent Magnets","28 pages, 9 figures, Latex2e, accepted for publication in JMMM","Journal of Magnetism and Magnetic Materials 232 (2001) 231-243","10.1016/S0304-8853(01)00150-0",,"cond-mat.mtrl-sci",,"  A self-consistent mean-field theory explaining the thermal remagnetization
(TR) of polycrystalline permanent magnets is given. The influence of the
environment of a grain is treated by an inclusion approximation, relating the
field inside the grain to the local field outside by means of an internal
demagnetization factor $n$. For the switching fields and the fluctuations of
the local fields around the mean field Gaussian distributions of widths
$\sigmas$ and $\sigmaf$ resp. are assumed. The isothermal hysteresis curve, the
recoil curves, and the TR in dependence on the model parameters $n$, $\sigmas$,
and $\sigmaf$ are calculated. Furthermore, the influence of the initial
temperature and the strong dependence of the TR on the demagnetization factor
of the sample are studied, and it is shown that for reasonable parameter sets
TR effects up to 100 % are possible. The theoretical results correspond well
with the experimental situation.
","[{""version"":""v1"",""created"":""Mon, 5 Feb 2001 15:54:27 GMT""}]","2009-11-07"
"cond-mat/0102057","E. H. Hwang","E. H. Hwang and S. Das Sarma","Plasmon dispersion in dilute 2D electron systems: Quantum-Classical and
  Wigner Crystal-Electron Liquid Crossover","6 pages with 5 figures","Phys. Rev. B 64, 165409 (2001)","10.1103/PhysRevB.64.165409",,"cond-mat.str-el",,"  We theoretically calculate the finite wave vector plasmon dispersion in a low
density 2D electron layer taking into account finite temperature, finite layer
width, and local field corrections. We compare our theoretical results with
recent Raman scattering spectroscopic experimental 2D plasmon dispersion data
in GaAs quantum wells at very low carrier densities ($r_s > 10$) and large wave
vectors ($q \ge k_F$). We find good agreement with the experimental data,
providing an explanation for why the experimentally measured dispersion seems
to obey the simple classical long wavelength 2D plasmon dispersion formula. We
also provide a critical discussion on the observable manifestations of the
quantum-classical and the Wigner crystal - electron liquid crossover behavior
in the 2D plasmon properties as a function of electron density and temperature
in GaAs quantum well systems.
","[{""version"":""v1"",""created"":""Sun, 4 Feb 2001 19:32:07 GMT""}]","2009-11-07"
"cond-mat/0102066","Serge F. Mingaleev","Serge F. Mingaleev and Yuri S. Kivshar","Self-trapping and stable localized modes in nonlinear photonic crystals","4 pages (RevTex) with 5 figures (EPS)",,"10.1103/PhysRevLett.86.5474",,"cond-mat.mtrl-sci",,"  We predict the existence of stable nonlinear localized modes near the band
edge of a two-dimensional reduced-symmetry photonic crystal with a Kerr
nonlinearity. Employing the technique based on the Green function, we reveal a
physical mechanism of the mode stabilization associated with the effective
nonlinear dispersion and long-range interaction in the photonic crystals.
","[{""version"":""v1"",""created"":""Mon, 5 Feb 2001 09:04:31 GMT""}]","2009-11-07"
"cond-mat/0102067","Aviad Frydman","A. Frydman","The superconductor insulator transition in systems of ultrasmall grains","4 pages, 4 figures",,,,"cond-mat.mes-hall",,"  We present transport measurements on quench condensed granular Pb films in
which the grains are 40-80\AA in diameter. These films show a cross over from
an insulator to a superconductor behavior as the nominal thickness of the layer
is increased. This transition is different in nature than those seen in quench
condensed systems reported in the past where the films were either uniform or
granular with grain sizes on the order of 200\AA . We discuss possible physical
mechanisms for these transitions.
","[{""version"":""v1"",""created"":""Mon, 5 Feb 2001 13:30:12 GMT""}]","2007-05-23"
"cond-mat/0102068","Folk","R. Folk, D. V. Shopova, D. I. Uzunov","Fluctuation induced first order phase transition in thin films of type I
  superconductors",,,"10.1016/S0375-9601(01)00126-8",,"cond-mat.supr-con",,"  The effect of fluctuation induced weakly first order phase transition known
for three dimensional (3D) type I superconductors appears in a modified and
strongly enhanced variant in thin (quasi-2D) superconducting films. The unusual
thermodynamic properties of this new type of first order phase transitions and
the possibility for an experimental verification of the effect are established
and discussed.
","[{""version"":""v1"",""created"":""Mon, 5 Feb 2001 09:29:40 GMT""}]","2009-11-07"
"cond-mat/0102069","Susanna Manrubia","Susanna C. Manrubia, Jordi Delgado, and Bartolo Luque","Small-world behavior in a system of mobile elements","To appear in Europhysics Letters",,"10.1209/epl/i2001-00263-9",,"cond-mat nlin.CG",,"  We analyze the propagation of activity in a system of mobile automata. A
number r L^d of elements move as random walkers on a lattice of dimension d,
while with a small probability p they can jump to any empty site in the system.
We show that this system behaves as a Dynamic Small-World (DSW) and present
analytic and numerical results for several quantities. Our analysis shows that
the persistence time T* (equivalent to the persistence size L* of small-world
networks) scales as T* ~ (r p)^(-t), with t = 1/(d+1).
","[{""version"":""v1"",""created"":""Mon, 5 Feb 2001 09:50:37 GMT""}]","2009-11-07"
"cond-mat/0102070","Per Hedegard","Per Hedegard","Magnetic Vortices in High Temperature Superconductors","3 pages, 1 figure",,,,"cond-mat.supr-con cond-mat.str-el",,"  It is suggested that modes, observed in recent neutron scattering experiments
by Lake {\it et al.}, on La$_{2-x}$Sr$_x$CuO$_4$ in strong magnetic fields
($\approx$ 7 T), are due to the existence of antiferromagnetic moments
associated with the cores of vortices generated by the field. These moments
form one-dimensional chains along the $c$-axis (the vortex axis), which at
finite temperatures are disordered. At temperatures higher than 10 K the
correlation length gets shorter than the lattice parameter, resulting in no
scattering from coherent spin-waves above that temperature. The bandwidth of
the spin-waves is estimated to be $\approx$ 4 meV in accordance with the
observations.
","[{""version"":""v1"",""created"":""Mon, 5 Feb 2001 10:19:07 GMT""},{""version"":""v2"",""created"":""Tue, 6 Feb 2001 13:28:28 GMT""}]","2007-05-23"
"cond-mat/0102071","L. S. Schulman","L. S. Schulman and B. Gaveau","Coarse grains: the emergence of space and order","To appear in Foundations of Physics, Festschrift for Martin
  Gutzwiller","Found. Phys. 31, 713 - 731 (2001)","10.1023/A:1017577211902",,"cond-mat.stat-mech",,"  The emergence of macroscopic variables can be effected through {\it coarse
graining}. Despite practical and fundamental benefits conveyed by this
partitioning of state space, the apparently subjective nature of the selection
of coarse grains has been considered problematic. We provide objective
selection methods, deriving from the existence of relatively slow dynamical
time scales. Using a framework for nonequilibrium statistical mechanics
developed by us, we show the emergence of both spatial variables and order
parameters. Although significant objective criteria are introduced in the
coarse graining, we do not provide a unique prescription. Most significantly,
the grains, and by implication entropy, are only defined modulo a
characteristic time scale of observation.
","[{""version"":""v1"",""created"":""Mon, 5 Feb 2001 11:30:44 GMT""}]","2016-08-31"
"cond-mat/0102072","F. J. M. van Lankvelt","E. Ardonne, F.J.M. van Lankvelt, A.W.W. Ludwig, K. Schoutens","Separation of spin and charge in paired spin-singlet quantum Hall states","4 pages, uses revtex4","Phys. Rev. B 65, 041305 (2002)","10.1103/PhysRevB.65.041305","ITFA-01-04","cond-mat.mes-hall cond-mat.str-el",,"  We propose a series of paired spin-singlet quantum Hall states, which exhibit
a separation of spin and charge degrees of freedom. The fundamental excitations
over these states, which have filling fraction \nu=2/(2m+1) with m an odd
integer, are spinons (spin-1/2 and charge zero) or fractional holons (charge
+/- 1/(2m+1) and spin zero). The braid statistics of these excitations are
non-abelian. The mechanism for the separation of spin and charge in these
states is topological: spin and charge excitations are liberated by binding to
a vortex in a p-wave pairing condensate. We briefly discuss related, abelian
spin-singlet states and possible transitions.
","[{""version"":""v1"",""created"":""Mon, 5 Feb 2001 11:05:12 GMT""},{""version"":""v2"",""created"":""Mon, 14 Jan 2002 13:55:53 GMT""}]","2007-05-23"
"cond-mat/0102073","Victor Belinicher","Victor I. Belinicher, Constanca Providencia, and Joao da Providencia","Instanton picture of the spin tunneling in the Lipkin model","REVTEX, 32 pages, 3 figures","J.Phys. A: Math. and Gen. v. 30, 5633-5643, (1997)","10.1088/0305-4470/30/16/008",,"cond-mat.str-el",,"  A consistent theory of the ground state energy and its splitting due to the
process of tunneling for the Lipkin model is presented. For the functional
integral in terms of the spin coherent states for the partition function of the
model we accurately calculate the trivial and the instanton saddle point
contributions. We show that such calculation has to be perfomed very accurately
taking into account the discrete nature of the functional integral. Such
accurate consideration leads to finite corrections to a naive continous
consideration. We present comparison with numerical calculation of the ground
state energy and the tunneling splitting and with the results obtained by the
quasiclassical method and get excellent agreement.
","[{""version"":""v1"",""created"":""Mon, 5 Feb 2001 10:38:54 GMT""}]","2009-11-07"
"cond-mat/0102074","Ilya Eremin","I. Eremin, D. Manske, C. Joas, and K.H. Bennemann","Electronic theory for superconductivity in Sr$_2$RuO$_4$: triplet
  pairing due to spin-fluctuation exchange","5 pages, 5 figures, misprints corrected","Europhys. Lett. 58, 871 (2002)","10.1209/epl/i2002-00455-9",,"cond-mat.supr-con cond-mat.str-el",,"  Using a two-dimensional Hubbard Hamiltonian for the three electronic bands
crossing the Fermi level in Sr$_2$RuO$_4$ we calculate the band structure and
spin susceptibility $\chi({\bf q}, \omega)$ in quantitative agreement with
nuclear magnetic resonance (NMR) and inelastic neutron scattering (INS)
experiments. The susceptibility has two peaks at {\bf Q}$_i = (2\pi/3, 2\pi/3)$
due to the nesting Fermi surface properties and at {\bf q}$_i = (0.6\pi, 0)$
due to the tendency towards ferromagnetism. Applying spin-fluctuation exchange
theory as in layered cuprates we determine from $\chi({\bf q}, \omega)$,
electronic dispersions, and Fermi surface topology that superconductivity in
Sr$_2$RuO$_4$ consists of triplet pairing. Combining the Fermi surface topology
and the results for $\chi({\bf q}, \omega)$ we can exclude $s-$ and $d-$wave
symmetry for the superconducting order parameter. Furthermore, within our
analysis and approximations we find that $f$-wave symmetry is slightly favored
over p-wave symmetry due to the nesting properties of the Fermi surface.
","[{""version"":""v1"",""created"":""Mon, 5 Feb 2001 15:41:32 GMT""},{""version"":""v2"",""created"":""Mon, 30 Jul 2001 13:56:54 GMT""},{""version"":""v3"",""created"":""Wed, 1 Aug 2001 14:42:10 GMT""}]","2009-11-07"
"cond-mat/0102075","Kazuhiro Kuboki","Kazuhiro Kuboki","Effect of Band Structure on the Symmetry of Superconducting States","4 pages, 4 figures","J. Phys. Soc. Jpn. 70, 2698 (2001)","10.1143/JPSJ.70.2698",,"cond-mat.supr-con cond-mat.str-el",,"  Effects of the band structure on the symmetry of superconducting (SC) states
are studied. For a square lattice system with a nearest-neighbor attractive
interaction, SC states with various symmetries are found by changing the band
structure, or, the shape of the Fermi surface. The spin-triplet ($(p_x +
ip_y)$-wave) and spin-singlet ($d$- or s-wave) SC states, and states with their
coexistence ($d + ip_y$, $s + ip_y$) can be stabilized within the same type of
interaction. The stability of interlayer-pairing states with line nodes is also
examined, and its relation to the SC state of Sr$_2$RuO$_4$ is discussed.
","[{""version"":""v1"",""created"":""Mon, 5 Feb 2001 10:44:33 GMT""},{""version"":""v2"",""created"":""Tue, 6 Feb 2001 11:33:07 GMT""}]","2017-08-31"
