"hep-th/0102044","Jesper M. Grimstrup","A.A. Bichl, J. M. Grimstrup, L. Popp, M. Schweda, R. Wulkenhaar
  (Vienna)","Perturbative Analysis of the Seiberg-Witten Map","13 pages, 4 figures","Int.J.Mod.Phys.A17:2219-2232,2002","10.1142/S0217751X02010649","TUW 01-01, UWThPh-2001-7","hep-th",,"  We investigate the quantization of the theta-expanded noncommutative U(1)
Yang-Mills action, obtained via the Seiberg-Witten map. As expected we find
non-renormalizable terms. The one-loop propagator corrections are gauge
independent, and lead us to a unique extention of the noncommutative classical
action. We interpret our results as a requirement that also the trace in
noncommutative field theory should be deformed.
","[{""version"":""v1"",""created"":""Thu, 8 Feb 2001 18:44:38 GMT""}]","2008-11-26"
"hep-th/0102045","Valentin Khoze","Timothy J. Hollowood, Valentin V. Khoze and Gabriele Travaglini","Exact Results in Noncommutative ${\cal N}=2$ Supersymmetric Gauge
  Theories","typos corrected","JHEP 0105:051,2001","10.1088/1126-6708/2001/05/051",,"hep-th",,"  We study the low-energy dynamics of noncommutative $\N=2$ supersymmetric U(N)
Yang-Mills theories in the Coulomb phase. Exact results are derived for the
leading terms in the derivative expansion of the Wilsonian effective action. We
find that in the infrared regime the U(1) subgroup decouples, and the remaining
SU(N) is described by the ordinary commutative Seiberg-Witten solution. IR/UV
mixing is present in the U(1), but not in SU(N). Our analysis is based on
explicit perturbative and multi-instanton calculations.
","[{""version"":""v1"",""created"":""Thu, 8 Feb 2001 23:03:40 GMT""},{""version"":""v2"",""created"":""Mon, 12 Feb 2001 17:59:27 GMT""}]","2010-02-03"
"hep-th/0102046","Eduardo Lima","Eduardo Lima, Burt Ovrut and Jaemo Park","Five-Brane Superpotentials in Heterotic M-Theory","58 pages; minor corrections added","Nucl.Phys. B626 (2002) 113-164","10.1016/S0550-3213(02)00030-5","UPR 926T","hep-th",,"  The open supermembrane contribution to the non-perturbative superpotential of
bulk space five-branes in heterotic M-theory is presented. We explicitly
compute the superpotential for the modulus associated with the separation of a
bulk five-brane from an end-of-the-world three-brane. The gauge and
kappa-invariant boundary strings of such open supermembranes are given and the
role of the holomorphic vector bundle on the orbifold fixed plane boundary is
discussed in detail.
","[{""version"":""v1"",""created"":""Thu, 8 Feb 2001 23:33:35 GMT""},{""version"":""v2"",""created"":""Fri, 2 Mar 2001 17:35:19 GMT""},{""version"":""v3"",""created"":""Sat, 25 Aug 2001 16:30:28 GMT""}]","2009-11-07"
"hep-th/0102047","Tanmay Vachaspati","Tanmay Vachaspati","A class of kinks in SU(N)\times Z_2","7 pages; included discussion of gauge fields and other improvements","Phys.Rev. D63 (2001) 105010","10.1103/PhysRevD.63.105010",,"hep-th hep-ph",,"  In a classical, quartic field theory with $SU(N) \times Z_2$ symmetry, a
class of kink solutions can be found analytically for one special choice of
parameters. We construct these solutions and determine their energies. In the
limit $N\to \infty$, the energy of the kink is equal to that of a kink in a
$Z_2$ model with the same mass parameter and quartic coupling (coefficient of
${\rm Tr}(\Phi^4)$). We prove the stability of the solutions to small
perturbations but global stability remains unproven. We then argue that the
continuum of choices for the boundary conditions leads to a whole space of kink
solutions. The kinks in this space occur in classes that are determined by the
chosen boundary conditions. Each class is described by the coset space $H/I$
where $H$ is the unbroken symmetry group and $I$ is the symmetry group that
leaves the kink solution invariant.
","[{""version"":""v1"",""created"":""Fri, 9 Feb 2001 04:39:50 GMT""},{""version"":""v2"",""created"":""Tue, 13 Feb 2001 06:32:07 GMT""},{""version"":""v3"",""created"":""Wed, 28 Feb 2001 06:03:13 GMT""}]","2009-11-07"
"hep-th/0102048","Tekin Dereli","A. Catal-Ozer (METU, Ankara), T. Dereli (METU,Ankara)","Electroweak Theory and Noncommutative Geometry","11 pages, LATEX, no figures. Talk given at the 2nd Gursey Memorial
  Conference, June 2000, Istanbul","Class.Quant.Grav. 18 (2001) 3251-3258","10.1088/0264-9381/18/16/315",,"hep-th",,"  The noncommutative generalisation of the standard electroweak model due to
Balakrishna, Gursey and Wali is formulated in terms of the derivations
Der_2(M_3) of a three dimensional representation of the su(2) Lie algebra of
weak isospin. A light Higgs boson of mass about 130 GeV, together with four
very heavy scalar bosons are predicted.
","[{""version"":""v1"",""created"":""Fri, 9 Feb 2001 10:07:08 GMT""}]","2009-11-07"
"hep-th/0102049","Paolo Budinich","Paolo Budinich","On Fermions in Compact momentum Spaces Bilinearly Constructed with Pure
  Spinors","55 pages Latex",,,,"hep-th",,"  It is shown how the old Cartan's conjecture on the fundamental role of the
geometry of simple (or pure) spinors, as bilinearly underlying euclidean
geometry, may be extended also to quantum mechanics of fermions (in first
quantization), however in compact momentum spaces, bilinearly constructed with
spinors, with signatures unambiguously resulting from the construction, up to
sixteen component Majorana-Weyl spinors associated with the real Clifford
algebra $\Cl(1,9)$, where, because of the known periodicity theorem, the
construction naturally ends. $\Cl(1,9)$ may be formulated in terms of the
octonion division algebra, at the origin of SU(3) internal symmetry.
  In this approach the extra dimensions beyond 4 appear as interaction terms in
the equations of motion of the fermion multiplet; more precisely the directions
from 5$^{th}$ to 8$^{th}$ correspond to electric, weak and isospin interactions
$(SU(2) \otimes U(1))$, while those from 8$^{th}$ to 10$^{th}$ to strong ones
SU(3). There seems to be no need of extra dimension in configuration-space.
Only four dimensional space-time is needed - for the equations of motion and
for the local fields - and also naturally generated by four-momenta as
Poincar\'e translations.
  This spinor approach could be compatible with string theories and even
explain their origin, since also strings may be bilinearly obtained from simple
(or pure) spinors through sums; that is integrals of null vectors.
","[{""version"":""v1"",""created"":""Fri, 9 Feb 2001 11:16:30 GMT""},{""version"":""v2"",""created"":""Fri, 16 Feb 2001 11:21:39 GMT""}]","2007-05-23"
"hep-th/0102050","Denis Kochan","Michal Demetrian, Denis Kochan","Quantum mechanics on non-commutative plane","9 pages, LaTeX2e, changes done","Acta Physica Slovaca 52, No. 1, (2002), pp. 1-9",,,"hep-th",,"  One of the simplest example of non-commutative (NC) spaces is the NC plane.
In this article we investigate the consequences of the non-commutativity to the
quantum mechanics on a plane. We derive corrections to the standard
(commutative) Hamiltonian spectrum for hydrogen-like atom and isotropic linear
harmonic oscillator (LHO) and formulate the problem of the potential scattering
on the NC plane. In the case of LHO we consider the noncommutativity of the
momentum operators, too.
","[{""version"":""v1"",""created"":""Fri, 9 Feb 2001 11:19:46 GMT""},{""version"":""v2"",""created"":""Thu, 20 Jun 2002 09:05:35 GMT""}]","2007-05-23"
"hep-th/0102051","Danny Birmingham","Danny Birmingham, Kumar S. Gupta, and Siddhartha Sen","Near-Horizon Conformal Structure of Black Holes","9 pages, Latex","Phys.Lett.B505:191-196,2001","10.1016/S0370-2693(01)00354-9","SINP-TNP/01-02","hep-th gr-qc",,"  The near-horizon properties of a black hole are studied within an algebraic
framework, using a scalar field as a simple probe to analyze the geometry. The
operator H governing the near-horizon dynamics of the scalar field contains an
inverse square interaction term. It is shown that the operators appearing in
the corresponding algebraic description belong to the representation space of
the Virasoro algebra. The operator H is studied using the representation theory
of the Virasoro algebra. We observe that the wave functions exhibit scaling
behaviour in a band-like region near the horizon of the black hole.
","[{""version"":""v1"",""created"":""Fri, 9 Feb 2001 11:55:34 GMT""}]","2011-07-19"
"hep-th/0102052","Kuratov","I.V.Kostyakov, N.A.Gromov, V.V.Kuratov","Graded contractions of Virasoro algebras","10 pages, Latex. Report given at XXIII Int. Colloquium on Group
  Theoretical Methods in Physics, July 31 - August 05, 2000, Dubna (Russia)",,,,"hep-th",,"  We describe graded contractions of Virasoro algebra. The highest weight
representations of Virasoro algebra are constructed. The reducibility of
representations is analysed. In contrast to standart representations the
contracted ones are reducible except some special cases. Moreover we find an
exotic module with null-plane on fifth level.
","[{""version"":""v1"",""created"":""Fri, 9 Feb 2001 13:48:48 GMT""}]","2007-05-23"
"hep-th/0102053","Kuratov","I.V.Kostyakov, N.A.Gromov, V.V.Kuratov","On root systems in spaces with degenerate metric","10 pages, Latex. Report given at XXIII Int. Colloquium on Group
  Theoretical Methods in Physics, July 31 - August 05, 2000, Dubna (Russia)",,,,"hep-th",,"  A root systems in Carroll spaces with degenerate metric are defined. It is
shown that their Cartan matrices and reflection groups are affine. With the
help of the geometric consideration the root system structure of affine
algebras is determined by a sufficiently simple algorithm.
","[{""version"":""v1"",""created"":""Fri, 9 Feb 2001 13:54:51 GMT""}]","2007-05-23"
"hep-th/0102055","Max Chaves","M. Chaves","An introduction to generalized Yang-Mills theories","37 p., AMSLaTeX, Lectures, Summer School in Theoretical Physics,
  Zacatecas, August 2000. A few typos have been corrected","Hadronic J.Suppl. 17 (2002) 3-51",,,"hep-th",,"  In generalized Yang-Mills theories scalar fields can be gauged just as vector
fields in a usual Yang-Mills theory, albeit it is done in the spinorial
representation. The presentation of these theories is aesthetic in the
following sense: A physical theory using Yang-Mills theories requires several
terms and irreducible representations, but with generalized Yang-Mills
theories, only two terms and two irreducible representations are required.
These theories are constructed based upon the maximal subgroups of the gauge
Lie group. The two terms of the lagrangian are the kinetic energy of fermions
and of bosons. A brief review of Yang-Mills theories and covariant derivatives
is given, then generalized Yang-Mills theories are defined through a
generalization of the covariant derivative. Two examples are given, one
pertaining the Glashow-Weinberg-Salam model and another SU(5) grand
unification. The first is based upon a $U(3)\supset U(1)\times U(1)\times
SU(2)$ generalized Yang-Mills theory, and the second upon a $SU(6)\supset
U(1)\times SU(5)$ theory. The possibility of expressing generalized Yang-Mills
theories using a five-dimensional formalism is also studied. The situation is
unclear in this case. At the end a list of comments and criticisms is given.
","[{""version"":""v1"",""created"":""Fri, 9 Feb 2001 15:30:04 GMT""},{""version"":""v2"",""created"":""Sat, 18 Jan 2003 01:19:32 GMT""}]","2007-05-23"
"math-ph/0102009","Peter Gacs","Peter Gacs","A Toom rule that increases the thickness of sets","16 pages, 8 figures","Journal of Statistical Physics 59(1/2):171-193, 1990","10.1007/BF01015567",,"math-ph math.DS math.MP",,"  Toom's north-east-self voting cellular automaton rule R is known to suppress
small minorities. A variant which we call R^+ is also known to turn an
arbitrary initial configuration into a homogenous one (without changing the
ones that were homogenous to start with). Here we show that R^+ always
increases a certain property of sets called thickness. This result is intended
as a step towards a proof of the fast convergence towards consensus under R^+.
The latter is observable experimentally, even in the presence of some noise.
","[{""version"":""v1"",""created"":""Thu, 8 Feb 2001 16:48:42 GMT""}]","2015-06-26"
"math-ph/0102010","Narciso Roman-Roy","M.C. Mu\~noz-Lecanda, N. Rom\'an-Roy, F.J. Y\'aniz-Fern\'andez","Time-dependent Lagrangians invariant by a vector field","12 pages, LaTeX. Replaced with the published version. Minor changes.
  The bibliography is updated","Lett.Math.Phys. 57 (2001) 107-121","10.1023/A:1017963123948",,"math-ph math.MP",,"  We study the reduction of non-autonomous regular Lagrangian systems by
symmetries, which are generated by vector fields associated with connections in
the configuration bundle of the system $Q\times\real\to\real$. These kind of
symmetries generalize the idea of ``time-invariance'' (which corresponds to
taking the trivial connection in the above trivial bundle).
","[{""version"":""v1"",""created"":""Fri, 9 Feb 2001 10:30:10 GMT""},{""version"":""v2"",""created"":""Thu, 4 Oct 2001 13:46:57 GMT""}]","2015-12-15"
"math/0102070","Donu Arapura","Donu Arapura","Hodge cycles on some moduli spaces","28 pages latex; This is a major revision with new material on
  generalized Hodge conjecture and moduli of bundles over abelian and K3
  surfaces",,,,"math.AG",,"  The goal is to verify the Hodge conjecture (and some related conjectures) for
certain moduli spaces. It is shown that the (generalized) Hodge conjecture
holds for the projective moduli spaces of vector bundles over an abelian or K3
surface or a curve if it holds for all powers of the surface or curve. In the
latter case, the curve can be replaced by its Jacobian. As a consequence the
generalized Hodge conjecture holds for these moduli spaces when the curve is
very general. A similar result is proved for the Hilbert schemes of points over
an arbitrary surface.
","[{""version"":""v1"",""created"":""Thu, 8 Feb 2001 16:43:08 GMT""},{""version"":""v2"",""created"":""Wed, 10 Oct 2001 23:18:16 GMT""},{""version"":""v3"",""created"":""Mon, 15 Oct 2001 21:21:27 GMT""},{""version"":""v4"",""created"":""Thu, 18 Jul 2002 20:23:07 GMT""},{""version"":""v5"",""created"":""Mon, 26 Aug 2002 22:52:58 GMT""}]","2007-05-23"
"math/0102071","Kuratov","N.A. Gromov, I.V. Kostyakov and V.V.Kuratov","Possible contractions of quantum orthogonal groups","10 pages, Latex. Report given at XXIII Int. Colloquium on Group
  Theoretical Methods in Physics, July 31- August 5, 2000, Dubna (Russia)","Phys.Atom.Nucl. 64 (2001) 2121-2125; Yad.Fiz. 64 (2001) 2211-2215","10.1134/1.1432910",,"math.QA hep-th",,"  Possible contractions of quantum orthogonal groups which correspond to
different choices of primitive elements of Hopf algebra are considered and all
allowed contractions in Cayley--Klein scheme are obtained. Quantum deformations
of kinematical groups have been investigated and have shown that quantum analog
of (complex) Galilei group G(1,3) do not exist in our scheme.
","[{""version"":""v1"",""created"":""Thu, 8 Feb 2001 16:51:48 GMT""}]","2009-11-07"
"math/0102072","Boris Vaillant","Boris Vaillant","Index and Spectral Theory for Manifolds with Generalized Fibred Cusps","122 pages, 8 figures, doctoral thesis",,,,"math.DG math.SP",,"  Generalizing work of W. M\""uller we investigate the spectral theory for the
Dirac operator D on a noncompact manifold X with generalized fibred cusps $$
C(M)=M\times [A,\infty[_r, g= d r^2+ \phi^*g_Y+ e^{-2cr}g_Z, $$ at infinity.
Here $\phi:M^{h+v}\to Y^h$ is a compact fibre bundle with fibre Z and a
distinguished horizontal space HM. The metric $g_Z$ is a metric in the fibres
and $g_Y$ is a metric on the base of the fibration. We also assume that the
kernel of the vertical Dirac operator at infinity forms a vector bundle over
$Y$.
  Using the ``$\phi$-calculus'' developed by R. Mazzeo and R. Melrose we
explicitly construct the meromorphic continuation of the resolvent $G(\lambda)$
of D for small spectral parameter as a special ``conormal distribution''. From
this we deduce a description of the generalized eigensections and of the
spectral measure of D.
  Complementing this, we perform an explicit construction of the heat kernel
$[\exp(-tD^2)]$ for finite and small times t, corresponding to large spectral
parameter $\lambda$. Using a generalization of Getzler's technique, due to R.
Melrose, we can describe the singular terms in the heat kernel expansion and
prove an index formula for D, calculating the extended $L^2$-index of D in
terms of the usual local expression, the family eta invariant for the family of
vertical Dirac operators at infinity and the eta invariant for the horizontal
``Dirac'' operator at infinity.
","[{""version"":""v1"",""created"":""Thu, 8 Feb 2001 17:26:49 GMT""}]","2007-05-23"
"math/0102073","Alexander Berkovich","A. Berkovich, P. Paule","Variants of the Andrews-Gordon Identities","12 pages, 1 figure",,,,"math.CO math.NT math.QA",,"  The object of this paper is to propose and prove a new generalization of the
Andrews-Gordon identities, extending a recent result of Garrett, Ismail and
Stanton. We also give a combinatorial discussion of the finite form of their
result, which appeared in the work of Andrews, Knopfmacher, and Paule.
","[{""version"":""v1"",""created"":""Thu, 8 Feb 2001 22:43:32 GMT""}]","2007-05-23"
"math/0102074","Andrzej Sitarz","Andrzej Sitarz","Twists and spectral triples for isospectral deformations","11 pages, AMSLaTeX; introduction revised, references added","Letters in Mathematical Physics (2001) 58: 69","10.1023/A:1012549800670","LPT-ORSAY 01-16","math.QA math-ph math.MP",,"  We construct explicitly the symmetries of the isospectral deformations as
twists of Lie algebras and demonstrate that they are isometries of the deformed
spectral triples.
","[{""version"":""v1"",""created"":""Fri, 9 Feb 2001 00:00:34 GMT""},{""version"":""v2"",""created"":""Fri, 2 Mar 2001 11:09:15 GMT""}]","2018-06-04"
"math/0102075","Andrzej Sitarz","Andrzej Sitarz","Rieffel's deformation quantization and isospectral deformations","5 pages, AMSLaTeX","International Journal of Theoretical Physics (2001) 40: 1693","10.1023/A:1011956229254",,"math.QA math-ph math.MP",,"  We demonstrate the relation between the isospectral deformation and Rieffel's
deformation quantization by the action of $\mathbb{R}^d$.
","[{""version"":""v1"",""created"":""Fri, 9 Feb 2001 00:03:35 GMT""}]","2018-06-04"
"math/0102076","Andrei Sobolevskii","Grigori Shpiz","A theorem on eigenvectors in idempotent spaces","4 pages, no figures; some definitions corrected","Doklady Mathematics 62:2 (2000) 169-171",,,"math.FA",,"  This paper suggests an algebraic version of the theorem on the existence of
eigenvectors for linear operators in abstract idempotent spaces. Earlier, the
theorem on the existence of eigenvectors was only known for the cases of a free
finite-dimensional semimodule and for compact operators in semimodules of real
continuous functions.
","[{""version"":""v1"",""created"":""Fri, 9 Feb 2001 09:43:38 GMT""},{""version"":""v2"",""created"":""Mon, 19 Feb 2001 07:53:24 GMT""}]","2007-05-23"
"math/0102077","Alex Degtyarev","Alex Degtyarev and Viatcheslav Kharlamov","Real Rational Surfaces Are Quasi-Simple","A few references added, minor misprints corrected. 11 pages, AmS-TeX","J. Reine Angew. Math. 551 (2002), 87--99",,,"math.AG",,"  We show that a real rational (over $\C$) surfaces are quasi-simple, i.e.,
that such a surface is determined up to deformation in the class of real
surfaces by the topological type of its real structure.
","[{""version"":""v1"",""created"":""Fri, 9 Feb 2001 11:10:03 GMT""},{""version"":""v2"",""created"":""Thu, 15 Feb 2001 11:35:27 GMT""}]","2008-03-21"
"math/0102078","Tom Brady","T. Brady, C. Watt","K(\pi, 1)'s for Artin groups of finite type","Latex file, 28 pages",,,,"math.GR",,"  We construct K(\pi, 1)'s for Artin groups of type C_n and D_n.
","[{""version"":""v1"",""created"":""Fri, 9 Feb 2001 11:24:29 GMT""},{""version"":""v2"",""created"":""Thu, 15 Feb 2001 16:05:03 GMT""}]","2007-05-23"
"math/0102079","Eric Matzinger","Eric Matzinger","Etude d'equations differentielles singulierement perturbees au voisinage
  d'un point tournant","110 pages, Ph-D thesis, in french",,,,"math.FA",,"  Consider a singularly perturbed ordinary differential equation, admitting 0
as turning point of order p. We study the behaviour, in the complex plane, of
the solutions of this equation in the neighborhood of 0. We prove that the
domain of these solutions contains sectors like $\{\theta_1< \arg(x)<\theta_2,
and |x|<|X_l| |\epsilon|^{1/(p+1)} \}$. If we introduce thereafter a
p-parameter $\alpha$ in the equation, we have (for some particular values of
the parameter, depending from $\epsilon$) canards solutions, id est solutions
which are bounded in a whole neighborhood of the turning point. These two
results are used for two examples, one of them is the Van der Pol equation; we
can then find for these two equations an equivalent of the coefficients of the
asymptotic serie in $\epsilon$ for the values of $\alpha$ corresponding to
canards solutions.
","[{""version"":""v1"",""created"":""Fri, 9 Feb 2001 11:24:41 GMT""}]","2007-05-23"
"math/0102080","Michael Schroeder","Peter Carr and Michael Schr\""oder","On the valuation of arithmetic-average Asian options: the Geman-Yor
  Laplace transform revisited","24 pages, 2 Figures, 1 Table",,,,"math.CA math.PR q-fin.PR",,"  The 1993 Laplace transform approach of Geman and Yor is a celebrated advance
in valuing Asian options. Its insights are fundamental from both a mathematical
and a financial perspective. In this paper, we discuss two observations
regarding the financial relevance of its results. First, we show that the Geman
and Yor Laplace transform is not that of an Asian option price, as reported in
Geman and Yor and other papers. We nonetheless show how the Geman and Yor
Laplace transform can be used to obtain the price of an Asian option. Second,
we find that following Geman and Yor these Laplace transfoms are available only
if the risk-neutral drift is not less than half the squared volatility. Using
complex analytic techniques, we lift this restriction, thus extending the
financial applicability of the Laplace transform approach.
","[{""version"":""v1"",""created"":""Fri, 9 Feb 2001 12:13:33 GMT""}]","2016-08-16"
"nlin/0102009",,"Paolo Giuliani, Mogens H. Jensen (Niels Bohr Institute, Denmark),
  Victor Yakhot (Institute for Advanced Studies, Princeton)","A Critical ""Dimension"" in a Shell Model for Turbulence","4 pages, REVTex, 5 figures",,"10.1103/PhysRevE.65.036305",,"nlin.CD",,"  We investigate the GOY shell model within the scenario of a critical
dimension in fully developed turbulence. By changing the conserved quantities,
one can continuously vary an ``effective dimension'' between $d=2$ and $d=3$.
We identify a critical point between these two situations where the flux of
energy changes sign and the helicity flux diverges. Close to the critical point
the energy spectrum exhibits a turbulent scaling regime followed by a plateau
of thermal equilibrium. We identify scaling laws and perform a rescaling
argument to derive a relation between the critical exponents. We further
discuss the distribution function of the energy flux.
","[{""version"":""v1"",""created"":""Thu, 8 Feb 2001 16:08:01 GMT""}]","2009-11-07"
"nlin/0102010","Emil Nissimov","Emil Nissimov and Svetlana Pacheva","Symmetries of Supersymmetric Integrable Hierarchies of KP Type","LaTeX209, 43 pages","J.Math.Phys. 43 (2002) 2547-2586","10.1063/1.1466533","INRNE-01-10","nlin.SI hep-th",,"  This paper is devoted to the systematic study of additional (non-
isospectral) symmetries of constrained (reduced) supersymmetric integrable
hierarchies of KP type- the so called SKP_(R;M_B,M_F) models. The latter are
supersymmetric extensions of ordinary constrained KP hierarchies which contain
as special cases basic integrable systems such as (m)KdV, AKNS, Fordy-Kulish,
Yajima- Oikawa etc.. As a first main result it is shown that any
SKP_(R;M_B,M_F) hierarchy possesses two different mutually (anti-)commuting
types of superloop superalgebra additional symmetries corresponding to the
positive-grade and negative-grade parts of certain superloop superalgebras. The
second main result is the systematic construction of the full algebra of
additional Virasoro symmetries of SKP_(R;M_B,M_F) hierarchies, which requires
non- trivial modifications of the Virasoro flows known from the general case of
unconstrained Manin-Radul super-KP hierarchies (the latter flows do not define
symmetries for constrained SKP_(R;M_B,M_F) hierarchies). As a third main result
we provide systematic construction of the supersymmetric analogues of
multi-component (matrix) KP hierarchies and show that the latter contain among
others the supersymmetric version of Davey-Stewartson system. Finally, we
present an explicit derivation of the general Darboux- B\""acklund solutions for
the SKP_(R;M_B,M_F) super-tau functions (supersymmetric ``soliton''-like
solutions) which preserve the additional (non-isospectral) symmetries.
","[{""version"":""v1"",""created"":""Fri, 9 Feb 2001 12:53:34 GMT""}]","2009-11-07"
