"astro-ph/0102156","Paul M. O'Neill","Paul M. O'Neill (1), Erik Kuulkers (2), Ravi K. Sood (1) and Tadayasu
  Dotani (3) ((1) Australian Defence Force Academy (2) Space Research
  Organization Netherlands & Utrecht University (3) Institute of Space and
  Astronautical Science)","On the X-ray fast-time variability of Sco X-2 (GX 349+2)","9 pages, 7 figues, accepted for publication in A&A",,"10.1051/0004-6361:20010216",,"astro-ph",,"  We have analysed archived Ginga data on the Z source Sco X-2 (GX349+2). We
present the first detailed investigation of its X-ray fast-time variability, as
a function of position in the Z track. During the two-day observation over the
period 5-7 March 1989, the source was in the so-called flaring branch, and the
lower part of the so-called normal branch. We found broad peaked noise with a
centroid frequency and width of ~4-7 Hz and ~6-12 Hz respectively. The peaked
noise was strongest in the lower flaring branch, with a maximum fractional rms
amplitude of ~3 %. We conclude that it is not a manifestation of atoll source
high frequency noise, as had been suggested, and compare it with the power
spectral features seen in other Z sources. We find that the peaked noise is
markedly different to the quasi-periodic oscillations found in the normal and
flaring branches of Sco X-1; however it bears some resemblance to that seen in
the flaring branch of Cyg X-2 at low overall intensities.
","[{""version"":""v1"",""created"":""Fri, 9 Feb 2001 04:17:42 GMT""}]","2009-11-06"
"astro-ph/0102157","H. Casini","M. Barkovich, H. Casini, J. C. D'Olivo, R. Montemayor","Pulsar motions from neutrino oscillations induced by a violation of the
  equivalence principle","6 pages, no figures","Phys.Lett. B506 (2001) 20-26","10.1016/S0370-2693(01)00401-4","OUTP-0109P","astro-ph",,"  We analize a possible explanation of the pulsar motions in terms of resonant
neutrino transitions induced by a violation of the equivalence principle (VEP).
Our approach, based on a parametrized post-Newtonian (PPN) expansion, shows
that VEP effects give rise to highly directional contributions to the neutrino
oscillation length. These terms induce anisotropies in the linear and angular
momentum of the emitted neutrinos, which can account for both the observed
translational and rotational pulsar motions. The violation needed to produce
the actual motions is completely compatible with the existing bounds.
","[{""version"":""v1"",""created"":""Fri, 9 Feb 2001 10:54:05 GMT""}]","2009-11-06"
"astro-ph/0102158","Johan P. U. Fynbo","J.U. Fynbo, J. Gorosabel, T.H. Dall, J. Hjorth, H. Pedersen, M.I.
  Andersen, P. Moller, I. Smail, N. Kobayashi, P. Vreeswijk, I. Burud, S.
  Holland, B.L. Jensen, B. Thomsen, A. Henden, F. Vrba, B. Canzian, J. M.
  Castro Cer\'on, A.J. Castro-Tirado, T. Cline, M. Goto, J. Greiner, M.T.
  Hanski, K. Hurley, N. Lund, T. Pursimo, R. Oestensen, J. Solheim, N. Tanvir,
  H. Terada","The optical afterglow and host galaxy of GRB000926","9 pages, 4 figures. Accepted for publication in the A&A main journal","Astron.Astrophys. 373 (2001) 796-804","10.1051/0004-6361:20010531",,"astro-ph",,"  We present the discovery of the Optical Transient (OT) of the long-duration
gamma-ray burst GRB000926. The optical transient was detected independently
with the Nordic Optical Telescope and at Calar Alto 22.2 hours after the burst.
At this time the magnitude of the transient was R = 19.36. The transient faded
with a decay slope of about 1.7 during the first two days after which the slope
increased abruptly (within a few hours) to about 2.4. The light-curve started
to flatten off after about a week indicating the presence of an underlying
extended object. This object was detected in a deep image obtained one month
after the GRB at R=23.87+-0.15 and consists of several compact knots within
about 5 arcsec. One of the knots is spatially coincident with the position of
the OT and hence most likely belongs to the host galaxy. Higher resolution
imaging is needed to resolve whether all the compact knots belong to the host
galaxy or to several independent objects. In a separate paper we present a
discussion of the optical spectrum of the OT, and its inferred redshift (Moller
et al. in prep.).
","[{""version"":""v1"",""created"":""Fri, 9 Feb 2001 11:17:38 GMT""},{""version"":""v2"",""created"":""Wed, 11 Apr 2001 05:48:31 GMT""}]","2007-05-23"
"astro-ph/0102159","Oliva Ernesto","E. Oliva, A. Marconi, R. Maiolino, L. Testi, F. Mannucci, F. Ghinassi,
  J. Licandro, L. Origlia, C. Baffa, A. Checcucci, G. Comoretto, V. Gavryussev,
  S. Gennari, E. Giani, L.K. Hunt, F. Lisi, D. Lorenzetti, G. Marcucci, L.
  Miglietta, M. Sozzi, P. Stefanini, F. Vitali","NICS-TNG infrared spectroscopy of NGC1068: the first extragalactic
  measurement of [PII] and a new tool to constrain the origin of [FeII] line
  emission in galaxies","4 pages, accepted for publication in A&A",,"10.1051/0004-6361:20010214",,"astro-ph",,"  We report 0.9-1.4 micron spectroscopic observations of NGC1068 collected
during the commissioning phase of the near infrared camera spectrometer (NICS)
of the Telescopio Nazionale Galileo (TNG). These yielded the first
extragalactic measurement of [PII] (1.188 micron) line emission. In the central
0.75""x2"" the [FeII]/[PII] line-intensity ratio is close to unity, similar to
that measured in the Orion bar and a factor of about 20 smaller than in
supernova remnants. This indicates that most of iron is locked into grains and,
therefore, argues against shock excitation being the primary origin of [FeII]
line emission in the central regions of NGC1068.
  We propose the [FeII]/[PII] ratio as a simple and effective tool to study and
perhaps resolve the long debated questions related to the origin of [FeII] line
emission and, more generally, to constrain the role of shock excitation in
active galaxies.
","[{""version"":""v1"",""created"":""Fri, 9 Feb 2001 13:14:30 GMT""}]","2009-11-06"
"astro-ph/0102160","Long-Long Feng","Xiao-Hu Yang (1,2), Long-Long Feng (1,2,3), Yao-Quan Chu (1,2), Li-Zhi
  Fang (4) ((1) Univ. of Science and Technology of China; (2) National
  Astronomical Observatories, Chinese Academy of Science; (3) Institute for
  Theoretical Physics, Chinese Academy of Science; (4) Univ. of Arizona)","Measuring the galaxy power spectrum with multiresolution decomposition
  -- II. diagonal and off-diagonal power spectra of the LCRS galaxies","AAS LaTeX file, 41 pages, 10 figures included, accepted for
  publication in ApJ",,"10.1086/320661",,"astro-ph",,"  The power spectrum estimator based on the discrete wavelet transform (DWT)
for 3-dimensional samples has been studied. The DWT estimator for
multi-dimensional samples provides two types of spectra with respect to
diagonal and off-diagonal modes, which are very flexible to deal with
configuration-related problems in the power spectrum detection. With simulation
samples and mock catalogues of the Las Campanas redshift survey (LCRS), we show
(1) the slice-like geometry of the LCRS doesn't affect the off-diagonal power
spectrum with ``slice-like'' mode; (2) the Poisson sampling with the LCRS
selection function doesn't cause more than 1-$\sigma$ error in the DWT power
spectrum; and (3) the powers of peculiar velocity fluctuations, which cause the
redshift distortion, are approximately scale-independent. These results insure
that the uncertainties of the power spectrum measurement are under control. The
scatter of the DWT power spectra of the six strips of the LCRS survey is found
to be rather small. It is less than 1-$\sigma$ of the cosmic variance of mock
samples in the wavenumber range $0.1 < k < 2$ h Mpc$^{-1}$. To fit the detected
LCRS diagonal DWT power spectrum with CDM models, we find that the best-fitting
redshift distortion parameter $\beta$ is about the same as that obtained from
the Fourier power spectrum. The velocity dispersions $\sigma_v$ for SCDM and
$\Lambda$CDM models are also consistent with other $\sigma_v$ detections with
the LCRS. A systematic difference between the best-fitting parameters of
diagonal and off-diagonal power spectra has been significantly measured. This
indicates that the off-diagonal power spectra are capable of providing
information about the power spectrum of galaxy velocity field.
","[{""version"":""v1"",""created"":""Fri, 9 Feb 2001 13:28:37 GMT""}]","2009-11-06"
"astro-ph/0102161","Natalia V. Tiurina","Yuri N. Efremov","Progenitors of GRB originated in the dense star cluster","Paper presented to the Second Roma Workshop on GRB in the afterglow
  era, October 2000",,"10.1007/10853853_65",,"astro-ph",,"  The evidences are given for the origin of the GRB progenitors from the ready
stellar remnants in result of the dynamical interaction in the dense star
clusters. In this way the close binaries of compact objects may form and then
merge, often after ejecting from the parent cluster. The GRB may trigger star
formation in the gaseous partiall sphere and occurence of the GRB afterglows
near the star formation regions may be connected with the successive GRB
origins in the same parent cluster. The observed distributions of GRB
afterglows in Z and in distance to the galactic centers are compatible with the
origin of many GRBs in the (present day classical) globular clusters, which
were younger than 2 Gyr at the time of many GRBs events.
","[{""version"":""v1"",""created"":""Fri, 9 Feb 2001 13:58:54 GMT""}]","2009-11-06"
"astro-ph/0102162","Dessauges-Zavadsky","Sandro D'Odorico, Miroslava Dessauges-Zavadsky and Paolo Molaro","A new deuterium abundance measurement from a damped Ly-alpha system at
  z_abs = 3.025","5 pages, 4 figures, Accepted for publication in A&A Letters",,"10.1051/0004-6361:20010183",,"astro-ph",,"  We present the first D/H measurement in a damped Ly-alpha system at z_abs =
3.025 towards QSO 0347-3819 obtained from the UVES-VLT spectra. The DLA
absorber has a metallicity of [Zn/H] = -1.25 and a relatively simple velocity
structure, with two dominating components detected in several metal lines. The
hydrogen Lyman series can be followed down to Ly12 thanks to the high UV-Blue
efficiency of UVES. The best fit of the Lyman series lines, and in particular
of Ly5, Ly8, Ly10 and Ly12, relatively free of local contamination, is obtained
when the DI absorption is included in the two main components. The measured
deuterium column density yields D/H = (2.24+/-0.67) 10^{-5} close to other low
D/H values from Lyman limit systems. The corresponding values for the baryon to
photon ratio and the baryon density derived from D/H are eta = 6 10^{-10} and
Omega_b h^2 = 0.023 respectively.
","[{""version"":""v1"",""created"":""Fri, 9 Feb 2001 15:54:21 GMT""}]","2009-11-06"
"astro-ph/0102163","Fiona Hoyle","Fiona Hoyle, P.J. Outram, T. Shanks, S. M. Croom, B.J. Boyle N.S.
  Loaring, L. Miller & R.J. Smith (Durham, AAO, Oxford, Liverpool John Moores)","The 2dF QSO Redshift Survey - IV. The QSO Power Spectrum from the 10k
  Catalogue","MNRAS Accepted","Mon.Not.Roy.Astron.Soc. 329 (2002) 336","10.1046/j.1365-8711.2002.04989.x",,"astro-ph",,"  (ABRIDGED) We present a power spectrum analysis of the 10K catalogue from the
2dF QSO Redshift Survey. We compare the redshift-space power spectra of QSOs to
those measured for galaxies and Abell clusters at low redshift and find that
they show similar shapes in their overlap range, 50-150h^{-1}Mpc, with
P_QSO(k)\propto k^{-1.4}. The amplitude of the QSO power spectrum at z~1.4 is
almost comparable to that of galaxies at the present day if Omega_m=0.3 and
Omega_Lambda=0.7 (the Lambda cosmology), and a factor of ~3 lower if Omega_m=1
(the EdS cosmology) is assumed. The amplitude of the QSO power spectrum is a
factor of ~10 lower than that measured for Abell clusters at the present day.
At larger scales, the QSO power spectra continue to rise robustly to ~400
h^{-1}Mpc, implying more power at large scales than in the APM galaxy power
spectrum measured by Baugh & Efstathiou.
  We split the QSO sample into two redshift bins and find little evolution in
the amplitude of the power spectrum. The QSO power spectrum may show a spike
feature at ~90h^{-1}Mpc assuming the Lambda cosmology or ~65 h^{-1}Mpc assuming
an EdS cosmology. Although the spike appears to reproduce in both the North and
South strips and in two independent redshift ranges, its statistical
significance is still marginal and more data is needed to test further its
reality.
  We compare the QSO power spectra to CDM models to obtain a constraint on the
shape parameter, Gamma. For two choices of cosmology (Omega_m=1, Omega_Lambda=0
and Omega_m=0.3, Omega_Lambda=0.7), we find the best fit model has Gamma~0.1
+-0.1.
","[{""version"":""v1"",""created"":""Fri, 9 Feb 2001 14:10:28 GMT""},{""version"":""v2"",""created"":""Tue, 25 Sep 2001 13:56:58 GMT""}]","2009-11-06"
"astro-ph/0102164","Yuri Shekinov","Yu. A. Shchekinov (1,2), R.-J. Dettmar (2), A. Schroeer (2), A.
  Steinacker (3), (1 Rostov University, 2 Ruhr-Universitaet Bochum, 3 NASA
  Ames)","Bubbles in galactic haloes","11 pages, 4 Figs, Talk at the JENAM, May 29 -- June 3, 2000, Moscow",,"10.1080/10556790108229704",,"astro-ph",,"  We briefly discuss a possible interconnection of vertical HI structures
observed in the Milky Way Galaxy with large scale blow-outs caused by the
explosions of multiple clustered SNe. We argue that the observed OB
associations can produce only about 60 such events, or approximately one
chimney per 3 kpc$^2$ within the solar circle. We also discuss the overall
properties of HI shells in nearby face-on galaxies and the distribution of
H$\alpha$ and dust in edge-on galaxies. We argue that the presence of dust in
galactic haloes may indicate that radiation pressure is the most probable
mechanism capable of transporting dust to large heights above the galactic
plane. In order to make this possible, the galactic magnetic field must have a
strong vertical component. We mention that SNe explosions can initiate the
Parker instability which in turn creates large scale magnetic loops with a
strong vertical component. Recent observations of nearby edge-on galaxies
favour this suggestion.
","[{""version"":""v1"",""created"":""Fri, 9 Feb 2001 15:25:04 GMT""}]","2009-11-06"
"cond-mat/0102148","J. Williams","J. E. Williams","Optimal conditions for observing Josephson oscillations in a double-well
  Bose-gas condensate","8 pages with 5 embeded figures",,"10.1103/PhysRevA.64.013610",,"cond-mat",,"  The Josephson oscillations between condensates in a double-well trap are
known theoretically to be strongly effected by the mean field interaction in
dilute atomic gases. The most important effect is that the amplitude of
oscillation in the relative population of the two wells is greatly suppressed
due to the mean field interaction, which can make it difficult to observe the
Josephson effect. Starting from the work of Raghavan, Smerzi, Fantoni, and
Shenoy, we calculate the maximum amplitude of oscillation in the relative
population as a function of various physical parameters, such as the trap
aspect ratio, the Gaussian barrier height and width, and the total number of
atoms in the condensate. We also compare results for ${}^{23}$Na and
${}^{87}$Rb. Our main new result is that the maximum amplitude of oscillation
depends strongly on the aspect ratio of the harmonic trap and can be maximized
in a ``pancake'' trap, as used in the experiment of Anderson and Kasevich.
","[{""version"":""v1"",""created"":""Thu, 8 Feb 2001 21:27:05 GMT""}]","2009-11-07"
"cond-mat/0102152","H. Suderow","H. Suderow, P. Martinez-Samper, S. Vieira, N. Luchier, J.P. Brison, P.
  Canfield","Tunneling spectroscopy in the magnetic superconductor TmNi2B2C","Submitted to Phys. Rev. B, Rapid Communications",,"10.1103/PhysRevB.64.020503",,"cond-mat.supr-con",,"  We present new measurements about the tunneling conductance in the
borocarbide superconductor TmNi$_2$B$_2$C. The results show a very good
agreement with weak coupling BCS theory, without any lifetime broadening
parameter, over the whole sample surface. We detect no particular change of the
tunneling spectroscopy below 1.5K, when both the antiferromagnetic (AF) phase
and the superconducting order coexist.
","[{""version"":""v1"",""created"":""Thu, 8 Feb 2001 17:04:55 GMT""}]","2009-11-07"
"cond-mat/0102154","Oberholzer","S. Oberholzer, M. Henny, C. Strunk, C. Schonenberger, T. Heinzel, K.
  Ensslin, and M. Holland","The Hanbury Brown and Twiss Experiment with Fermions",,"Physica E 6, 314 (2000)","10.1016/S1386-9477(99)00162-9",,"cond-mat.mes-hall",,"  We realized an equivalent Hanbury Brown and Twiss experiment for a beam of
electrons in a two dimensional electron gas in the quantum Hall regime. A
metallic split gate serves as a tunable beam splitter which is used to
partition the incident beam into transmitted and reflected partial beams. The
current fluctuations in the reflected and transmitted beam are fully
anticorrelated demonstrating that fermions tend to exclude each other
(anti-bunching). If the occupation probability of the incident beam is lowered
by an additional gate, the anticorrelation is reduced and disappears in the
classical limit of a highly diluted beam.
","[{""version"":""v1"",""created"":""Thu, 8 Feb 2001 16:38:12 GMT""}]","2009-11-07"
"cond-mat/0102155","Zhiqiang Mao","Y. Liu, R. Jin, Z. Q. Mao, K. D. Nelson, M. K. Haas and R. J. Cava","Electrical Transport Properties of Single Crystal Sr3Ru2O7: The Possible
  Existence of an Antiferromagnetic Instability at Low Temperatures","To be published in Phys. Rev. B","Phys. Rev. B 63, 174435 (2001)","10.1103/PhysRevB.63.174435",,"cond-mat.str-el cond-mat.mtrl-sci",,"  We report the results of Hall coefficient R_H and magnetoresistance (MR)
measurements on single crystalline samples of Sr3Ru2O7 grown by the floating
zone method. R_H was found to be positive over the entire temperature range
studied (0.3 - 300K). Its temperature (T) dependence follows closely that of
the magnetic susceptibility, including a maximum at a characteristic
temperature T=17 K. We show that R_H can be decomposed into normal and
anomalous parts as in the case of skew scattering in heavy-fermion compounds
and ferromagnetic metals. This, together with the observation that the
longitudinal MR is greater than the transverse MR at the same magnetic field
and temperature, suggests that magnetic fluctuations dominate the electrical
transport properties in Sr3Ru2O7. We found a crossover in the sign of the MR at
T*, from positive to negative as the temperature increased, for both the
transverse and the longitudinal configurations. In addition, a non-monotonic
behavior in the field dependence of the MR was found at low temperatures. These
observations suggest that the magnetic correlations in Sr3Ru2O7 at ambient
pressure undergo a qualitative change as the temperature is lowered. Above T*,
they are dominated by ferromagnetic instability. However, below T*, the system
crosses over to a different behavior, controlled possibly by a canted
antiferromagnetic instability.
","[{""version"":""v1"",""created"":""Thu, 8 Feb 2001 16:25:21 GMT""}]","2010-10-11"
"cond-mat/0102156","Martin Dube","M. Dube and P.C.E. Stamp","Mechanisms of Decoherence at Low Temperatures","Typos corrected, invited article to appear in special issue of
  Chemical Physics on ""Quantum Physics of Open Systems""",,"10.1016/S0301-0104(01)00303-2",,"cond-mat.mes-hall quant-ph",,"  We briefly review the oscillator and spin bath models of quantum
environments, which can be used to describe the low-energy dynamics of open
quantum systems. We then use them to discuss both the mechanisms causing
decoherence at low $T$, and the dynamics of this decoherence. This is done
first for a central 2-level system coupled to these environments- the results
can be applied to the dynamics of quantum nanomagnets and superconducting
SQUIDs, where large-scale tunneling of magnetisation and flux take place.
Decoherence in these systems is caused principally by coupling to electrons and
nuclear spins, the spin bath couplings are particularly dangerous at low $T$.
  These models are also generalised to discuss quantum measurements in which
the measured system, the measuring apparatus, and the environment are treated
quantum mechanically. The results can be used to calculate the dynamics of
coupled SQUIDs and/or nanomagnets, in which one acts as a measuring apparatus
and the other exhibits large-scale quantum superpositions. The same model can
be used to describe coupled qubits.
","[{""version"":""v1"",""created"":""Thu, 8 Feb 2001 17:25:06 GMT""},{""version"":""v2"",""created"":""Wed, 14 Feb 2001 23:38:00 GMT""}]","2009-11-07"
"cond-mat/0102157","Roberto Senesi","R. Senesi, C. Andreani, D. Colognesi, A. Cunsolo, M. Nardone","Deep Inelastic Neutron Scattering determination of the single particle
  kinetic energy in solid and liquid 3He","RevTeX two column,4 pages, 2 figures, submitted to Phys. Rev. Lett",,"10.1103/PhysRevLett.86.4584",,"cond-mat",,"  For the first time, an experimental determination of the single-particle mean
kinetic energies for 3He along the T=2.00 K isotherm in the dense liquid and in
the solid hcp and bcc phases is reported. Deep Inelastic Neutron Scattering
measurements at exchanged wavevectors ranging from 90.0 A^-1 to 140.0 A^-1 have
been performed in order to evaluate, within the framework of the Impulse
Approximation, the molar volume dependence of the kinetic energy. The results
are found in excellent agreement with recent Diffusion Monte Carlo simulations.
","[{""version"":""v1"",""created"":""Thu, 8 Feb 2001 17:33:10 GMT""},{""version"":""v2"",""created"":""Fri, 9 Feb 2001 09:29:20 GMT""}]","2009-11-07"
"cond-mat/0102158","Miguel A. Munoz","Andrea Gabrielli, Miguel A. Munoz, and Bernard Sapoval","Field theory of self-organized fractal etching","9 pages, 3 figures. Submitted to Phys. Rev. E",,"10.1103/PhysRevE.64.016108",,"cond-mat",,"  We propose a phenomenological field theoretical approach to the chemical
etching of a disordered-solid. The theory is based on a recently proposed
dynamical etching model. Through the introduction of a set of Langevin
equations for the model evolution, we are able to map the problem into a field
theory related to isotropic percolation. To the best of the authors knowledge,
it constitutes the first application of field theory to a problem of chemical
dynamics. By using this mapping, many of the etching process critical
properties are seen to be describable in terms of the percolation
renormalization group fixed point. The emerging field theory has the
peculiarity of being ``{\it self-organized}'', in the sense that without any
parameter fine-tuning, the system develops fractal properties up to certain
scale controlled solely by the volume, $V$, of the etching solution.
  In the limit $V \to \infty$ the upper cut-off goes to infinity and the system
becomes scale invariant. We present also a finite size scaling analysis and
discuss the relation of this particular etching mechanism with Gradient
Percolation.
  Finally, the possibility of considering this mechanism as a new generic path
to self-organized criticality is analyzed, with the characteristics of being
closely related to a real physical system and therefore more directly
accessible to experiments.
","[{""version"":""v1"",""created"":""Thu, 8 Feb 2001 17:57:38 GMT""}]","2009-11-07"
"cond-mat/0102159","Mikhail L. Polianski","M. L. Polianski and P. W. Brouwer","Pumped current and voltage for an adiabatic quantum pump","6 pages, 4 figures","Phys. Rev. B 64, 075304 (2001)","10.1103/PhysRevB.64.075304",,"cond-mat.mes-hall",,"  We consider adiabatic pumping of electrons through a quantum dot. There are
two ways to operate the pump: to create a dc current ${\bar I}$ or to create a
dc voltage ${\bar V}$. We demonstrate that, for very slow pumping, ${\bar I}$
and ${\bar V}$ are not simply related via the dc conductance $G$ as $\bar I =
\bar V G$. For the case of a chaotic quantum dot, we consider the statistical
distribution of ${\bar V} G - {\bar I}$. Results are presented for the limiting
cases of a dot with single channel and with multichannel point contacts.
","[{""version"":""v1"",""created"":""Thu, 8 Feb 2001 19:17:26 GMT""}]","2009-11-07"
