"nlin/0102015","Boris Jacob","B. Jacob, A. Olivieri, C.M. Casciola","Experimental assessment of a new form of scaling law for near-wall
  turbulence","27 pages, 9 figures",,"10.1063/1.1425837",,"nlin.CD",,"  Scaling laws and intermittency in the wall region of a turbulent flow are
addressed by analyzing moderate Reynolds number data obtained by single
component hot wire anemometry in the boundary layer of a flat plate. The paper
aims in particular at the experimental validation of a new form of refined
similarity recently proposed for the shear dominated range of turbulence, where
the classical Kolmogorov-Oboukhov inertial range theory is inappropriate. An
approach inspired to the extended self-similarity allows for the extraction of
the different power laws for the longitudinal structure functions at several
wall normal distances. A double scaling regime is found in the logarithmic
region, confirming previous experimental results. Approaching the wall, the
scaling range corresponding to the classical cascade-dominated range tends to
disappear and, in the buffer layer, a single power law is found to describe the
available range of scales. The double scaling is shown to be associated with
two different forms of refined similarity. The classical form holds below the
shear scale L s . The other, originally introduced on the basis of DNS data for
a turbulent channel, is experimentally confirmed to set up above L s . Given
the experimental diffulties in the evaluation of the instantaneous dissipation
rate, some care is devoted to check that its one-dimensional surrogate does not
bias the results. The increased intermittency as the wall is approached is
experimentally found entirely consistent with the failure of the refined
Kolmogorov-Oboukhov similarity and the establishment of its new form near the
wall.
","[{""version"":""v1"",""created"":""Mon, 12 Feb 2001 13:34:10 GMT""}]","2009-11-07"
"nucl-th/0102022","Kenneth M. Nollett","Kenneth M. Nollett","Radiative alpha-capture cross sections from realistic nucleon-nucleon
  interactions and variational Monte Carlo wave functions","18 pages, 10 figures, submitted to Phys Rev C","Phys.Rev. C63 (2001) 054002","10.1103/PhysRevC.63.054002",,"nucl-th astro-ph",,"  We report the first calculations of cross sections for the radiative capture
reactions t(alpha,gamma)^7Li and ^3He(alpha,gamma)^7Be below 2 MeV which use
wave functions derived from realistic nucleon-nucleon interactions by the
variational Monte Carlo technique. After examining several small corrections to
the dominant E1 operator, we find energy dependences for the low-energy
S-factors which agree reasonably with experimental measurements. There is no
contradiction with the previous theoretical understanding of these processes,
but the zero-energy derivative of the t(alpha,gamma)^7Li S-factor is smaller
than in most models. While this method can in principle predict cross section
normalizations, the normalizations of our results are mostly too low.
","[{""version"":""v1"",""created"":""Mon, 12 Feb 2001 02:34:23 GMT""}]","2009-11-07"
"nucl-th/0102023","Wei Zuo","Jian-Ye Liu, Wen-Jun Guo, Shun-Jin Wang, Wei Zuo, Qiang Zhao, Yan-Fang
  Yang","Nuclear Stopping as A Probe to In-medium Nucleon-nucleon Cross Section
  in Intermediate Energy Heavy Ion Collisions",,"Phys.Rev.Lett. 86 (2001) 975","10.1103/PhysRevLett.86.975",,"nucl-th",,"  Using an isospin-dependent quantum molecular dynamics, nuclear stopping in
intermediate heavy ion collisions has been studied. The calculation has been
done for colliding systems with different neutron-proton ratios in beam energy
ranging from 15MeV/u to 150MeV/u. It is found that, in the energy region from
above Fermi energy to 150MeV/u, nuclear stopping is very sensitive to the
isospin dependence of in-medium nucleon-nucleon cross section, but insensitive
to symmetry potential. From this investigation, we propose that nuclear
stopping can be used as a new probe to extract the information on the isospin
dependence of in-medium nucleon-nucleon cross section in intermediate energy
heavy ion collisions.
","[{""version"":""v1"",""created"":""Mon, 12 Feb 2001 03:42:31 GMT""}]","2009-11-07"
"nucl-th/0102024","Wei Zuo","Jian-Ye Liu, Qiang Zhao, Shun-Jin Wang, Wei Zuo, Wen-Jun Guo","Entrance channel dependence and isospin dependence of preequilibrium
  nucleon emission in intermediate energy heavy ion collisions",,"Nucl.Phys. A687 (2001) 475-485","10.1016/S0375-9474(00)00581-9",,"nucl-th",,"  Using isospin dependent quantum molecular dynamical model, the studies of the
isospin effect on preequilibrium nucleon emission in heavy ion collisions under
different entrance channel conditions show that the ratio of preequilibrium
neutron number to proton number depends strongly on symmetry potential, beam
energy, and the ratio of neutron to proton of the colliding system, but weakly
on isospin dependent in-medium nucleon-nucleon cross sections, impact
parameter, Pauli potential, and momentum dependent interaction in the energy
region from 45MeV/u up to 150 MeV/u where the dynamics is dominated by
nucleon-nucleon collisions. In addition, the ratio of preequilibrium neutron
number to proton number for a neutron-rich colliding system is larger than the
initial value of the ratio of the colliding system, but the ratio for a
neutron-deficient system is less than the initial value.
","[{""version"":""v1"",""created"":""Mon, 12 Feb 2001 07:58:18 GMT""}]","2009-11-07"
"nucl-th/0102025","Mr Qiang Zhao","Qiang Zhao, B. Saghai, and J.S. Al-Khalili","Non-diffractive mechanisms in the $\phi$ meson photoproduction on
  nucleons","4 eps figures, version accepted by Phys. Lett. B","Phys.Lett. B509 (2001) 231-238","10.1016/S0370-2693(01)00432-4",,"nucl-th",,"  We examine the non-diffractive mechanisms in the $\phi$ meson photoproduction
from threshold up to a few GeV using an effective Lagrangian in a constituent
quark model. The new data from CLAS at large angles can be consistently
accounted for in terms of {\it s}- and {\it u}-channel processes. Isotopic
effects arising from the reactions $\gamma p\to \phi p$ and $\gamma n\to \phi
n$, are investigated by comparing the cross sections and polarized beam
asymmetries. Our result highlights an experimental means of studying
non-diffractive mechanisms in $\phi$ meson photoproduction.
","[{""version"":""v1"",""created"":""Mon, 12 Feb 2001 10:20:29 GMT""},{""version"":""v2"",""created"":""Sat, 24 Mar 2001 17:14:36 GMT""}]","2009-11-07"
"nucl-th/0102026","Burkhard Kaempfer","L.P. Kaptari, B. Kampfer","Polarization observables in the reaction $p n \to d \phi$","11 pages","Eur.Phys.J.A14:211-217,2002","10.1140/epja/i2001-10197-8",,"nucl-th",,"  The reaction $p n \to d \phi$ is studied within a covariant boson exchange
model. The behavior of polarization observables being accessible in forthcoming
experiments near threshold is predicted.
","[{""version"":""v1"",""created"":""Mon, 12 Feb 2001 10:51:25 GMT""}]","2008-11-26"
"nucl-th/0102027","Biro Tamas","T.S.Biro, A.A.Shanenko, V.D.Toneev","Towards thermodynamical consistency of qusiparticle picture","revised figures, minor style corrections and added new references","Phys.Atom.Nucl.66:982-996,2003; Yad.Fiz.66:1015-1029,2003","10.1134/1.1577921",,"nucl-th",,"  The purpose of the present article is to call attention to some realistic
quasiparticle-based description of the quark/gluon matter and its consistent
implementation in thermodynamics. A simple and transparent representation of
the thermodynamical consistency conditions is given. This representation allows
one to review critically and systemize available phenomenological approaches to
the deconfinement problem with respect to their thermodynamical consistency. A
particular attention is paid to the development of a method for treating the
string screening in the dense matter of unbound color charges. The proposed
method yields an integrable effective pair potential which can be incorporated
into the mean-field picture. The results of its application are in reasonable
agreement with lattice data on the QCD thermodynamics.
","[{""version"":""v1"",""created"":""Mon, 12 Feb 2001 12:41:10 GMT""},{""version"":""v2"",""created"":""Wed, 14 Feb 2001 13:44:40 GMT""},{""version"":""v3"",""created"":""Wed, 10 Apr 2002 09:18:35 GMT""}]","2014-11-18"
"physics/0102027","Yong-Gwan Yi","Y. G. Yi","A Reconciliation of Collision Theory and Transition State Theory","7 pages in LaTeX. A collision induced transition state theory of
  reaction rates, and the Green's function method of kinetics",,,,"physics.gen-ph",,"  A statistical-mechanical treatment of collision leads to a formal connection
with transition-state theory, suggesting that collision theory and
transition-state theory might be joined ultimately as a collision induced
transition state theory.
","[{""version"":""v1"",""created"":""Mon, 12 Feb 2001 14:26:21 GMT""},{""version"":""v2"",""created"":""Tue, 20 Feb 2001 17:39:39 GMT""},{""version"":""v3"",""created"":""Wed, 28 Feb 2001 09:27:51 GMT""},{""version"":""v4"",""created"":""Wed, 11 Jul 2001 17:05:14 GMT""},{""version"":""v5"",""created"":""Wed, 28 Nov 2001 11:48:01 GMT""}]","2007-05-23"
"physics/0102029","Oleksandr Dzyubak","S.N. Dzyubak, Yu.I. Gubin, O.P. Dzyubak, P.V. Sorokin, V.F. Popov,
  A.A. Orlov, V.P. Krasnov","Extraction of Cs-137 by alcohol-water solvents from plants containing
  cardiac glycosides","8 pages, LaTex, submitted to Applied Radiation and Isotopes",,,,"physics.med-ph physics.bio-ph physics.chem-ph physics.soc-ph",,"  As a result of nuclear power plant accidents, large areas receive radioactive
inputs of Cs-137. This cesium accumulates in herbs growing in such territories.
The problem is whether the herbs contaminated by radiocesium may be used as a
raw material for medicine. The answer depends on the amount of Cs-137
transfered from the contaminated raw material to the medicine. We have
presented new results of the transfer of Cs-137 from contaminated Digitalis
grandiflora Mill. and Convallaria majalis L. to medicine. We found that the
extraction of Cs-137 depends strongly on the hydrophilicity of the solvent. For
example 96.5%(vol.) ethyl alcohol extracts less Cs-137 (11.6%) than 40%(vol.)
ethyl alcohol or pure water (66.2%). The solubility of the cardiac glycosides
is inverse to the solubility of cesium, which may be of use in the
technological processes for manufacturing ecologically pure herbal medicine.
","[{""version"":""v1"",""created"":""Sun, 11 Feb 2001 22:21:17 GMT""}]","2007-05-23"
"physics/0102031","Michael Kachelriess","M. Kachelriess, E. Resconi and S. Schoenert","Two particle states, lepton mixing and oscillations",,,,"CERN-TH 2000-279","physics.ed-ph hep-ex hep-ph",,"  Discussions of lepton mixing and oscillations consider generally only flavor
oscillations of neutrinos and neglect the accompanying charged leptons. In
cases of experimental interest like pion or nuclear beta decay an oscillation
pattern is expected indeed only for neutrinos if only one of the two produced
particles is observed. We argue that flavor oscillations of neutrinos without
detecting the accompanying lepton is a peculiarity of the two-particle states
$|l\nu>$ produced in pion or nuclear beta decay. Generally, an oscillation
pattern is only found if both particles are detected. We discuss in a
pedagogical way how this distinction of the neutrinos arises, although on the
level of the Lagrangian lepton mixing does not single them out against charged
leptons. As examples, we discuss the difference between the state $|l\nu>$
produced by the decay of real $W$ boson and a $W$ originating from pion decay.
","[{""version"":""v1"",""created"":""Mon, 12 Feb 2001 14:42:05 GMT""}]","2007-05-23"
"quant-ph/0102057","Vanroose Wim","Wim Vanroose","Interference of resonances and the double-pole of the S-matrix in a
  double well system","3 pages, 4 Postscript figures","Phys. Rev. A 64, 062708 (2001) [3 pages]","10.1103/PhysRevA.64.062708",,"quant-ph physics.atm-clus",,"  We discuss the interaction between two resonant states in a quantum
double-well structure. The behaviour of the resonant states depends on the
coupling between the wells, i.e. the height and width of the barrier that
separates them. We distinguish a region with resonant tunneling and a region
where the two resonances repel each other. The transition between the two
regions is marked by a double pole of the S-matrix.
","[{""version"":""v1"",""created"":""Sun, 11 Feb 2001 19:50:29 GMT""}]","2007-05-23"
"quant-ph/0102058","BaoSen Shi","Bao-Sen Shi, Jian Li, Jin-Ming Liu, Xiao-Feng Fan and Guang-Can Guo","Quantum Key Distribution and Quantum Authentication Based on Entangled
  State","Revtex, 9 pages, no figure, accepted for publication by Phys. Lett. A",,"10.1016/S0375-9601(01)00129-3",,"quant-ph",,"  Using the previously shared Einstein-Podolsky-Rosen pairs, a proposal which
can be used to distribute a quantum key and identify the user's identification
simultaneously is presented. In this scheme, two local unitary operations and
the Bell state measurement are used. Combined with quantum memories, a
cryptographic network is proposed. One advantage is no classical communication
is needed, which make the scheme more secure. The secure analysis of this
scheme is shown.
","[{""version"":""v1"",""created"":""Mon, 12 Feb 2001 01:23:23 GMT""}]","2009-11-07"
"quant-ph/0102059","Alexei Gilchrist","A. Gilchrist and W. J. Munro","Signatures of the Pair-Coherent State","Figures hacked down to size for server","Published in J. Opt B, 2, p47, 2000","10.1088/1464-4266/2/1/308",,"quant-ph",,"  We explore in detail the possibility of generating a pair-coherent state in
the non-degenerate parametric oscillator when decoherence is included. Such
states are predicted in the transient regime in parametric oscillation where
the pump mode is adiabatically eliminated. Two specific signatures are examined
to indicate whether the state of interest has been generated, the Schrodinger
cat state - like signatures, and the fidelity. Solutions in a transient regime
reveal interference fringes which are indicative of the formation of a
Schrodinger cat state. The fidelity indicates the purity of our prepared state
compared to the ideal pair-coherent state.
","[{""version"":""v1"",""created"":""Mon, 12 Feb 2001 01:26:23 GMT""}]","2015-06-26"
"quant-ph/0102060","ChuanFeng Li","Guo-Ping Guo, Chuan-Feng Li, Bao-Sen Shi, Jian Li, and Guang-Can Guo
  (University of Science and Technology of China)","A novel quantum key distribution scheme with orthogonal product states","4 Pages, 3 Figures","Phys. Rev. A 64 042301 (2001)","10.1103/PhysRevA.64.042301",,"quant-ph",,"  The general conditions for the orthogonal product states of the multi-state
systems to be used in quantum key distribution (QKD) are proposed, and a novel
QKD scheme with orthogonal product states in the 3x3 Hilbert space is
presented. We show that this protocol has many distinct features such as great
capacity, high efficiency. The generalization to nxn systems is also discussed
and a fancy limitation for the eavesdropper's success probability is reached.
","[{""version"":""v1"",""created"":""Mon, 12 Feb 2001 04:13:13 GMT""}]","2009-11-07"
"quant-ph/0102061","Reynaud","Serge Reynaud, Paulo A. Maia Neto, Astrid Lambrecht, Marc-Thierry
  Jaekel","Gravitational decoherence of planetary motions","6 pages, no figure, to appear in EuroPhysics Letters; needs `epl.cls'","Europhys.Lett. 54 (2001) 135-140","10.1209/epl/i2001-00286-8",,"quant-ph gr-qc",,"  We study the effect of the scattering of gravitational waves on planetary
motions, say the motion of the Moon around the Earth. Though this effect has a
negligible influence on dissipation, it dominates fluctuations and the
associated decoherence mechanism, due to the very high effective temperature of
the background of gravitational waves in our galactic environment.
","[{""version"":""v1"",""created"":""Mon, 12 Feb 2001 10:28:46 GMT""}]","2009-11-07"
"quant-ph/0102062","Stephane Felix","Stephane Felix, Nicolas Gisin, Andre Stefanov, Hugo Zbinden (Group of
  Applied Physics, University of Geneva)","Faint laser quantum key distribution: Eavesdropping exploiting
  multiphoton pulses","7 pages, 6 figures",,"10.1080/09500340108240903",,"quant-ph",,"  The technological possibilities of a realistic eavesdropper are discussed.
Two eavesdropping strategies taking profit of multiphoton pulses in faint laser
QKD are presented. We conclude that, as long as storage of Qubits is
technically impossible, faint laser QKD is not limited by this security issue,
but mostly by the detector noise.
","[{""version"":""v1"",""created"":""Mon, 12 Feb 2001 13:27:01 GMT""}]","2015-06-26"
"quant-ph/0102063","A. Myagkii","V.A. Bordovitsyn, V.S. Gushchina and A.N. Myagkii","Discussion on spin-flip synchrotron radiation","4 pages, LATEX","Nucl. Instr. and Meth. A405 (1998) 256-257","10.1016/S0168-9002(97)01048-6",,"quant-ph",,"  Quantum spin-flip transitions are of great importance in the synchrotron
radiation theory. For better understanding of the nature of this phenomenon, it
is necessary to except the effects connected with the electric charge radiation
from observation. This fact explains the suggested choice of the spin-flip
radiation model in the form of radiation of the electric neutral Dirac-Pauli
particle moving in the homogeneous magnetic field. It is known that in this
case, the total radiation in the quantum theory is conditioned by spin-flip
transitions. The idea is that spin-flip radiation is represented as a
nonstationary process connected with spin precession. We shall shown how to
construct a solution of the classical equation of the spin precession in the
BMT theory having the exact solution of the Dirac-Pauli equation.Thus, one will
find the connection of the quantum spin-flip transitions with classical spin
precession.
","[{""version"":""v1"",""created"":""Mon, 12 Feb 2001 13:38:36 GMT""}]","2009-11-07"
"quant-ph/0102064","Antonio Acin","A. Acin","Statistical distinguishability between unitary operations","6 pages, REVTEX. The perfect distinguishability result is extended to
  any finite set of gates","Phys. Rev. Lett 87, 177901 (2001).","10.1103/PhysRevLett.87.177901",,"quant-ph",,"  The problem of distinguishing two unitary transformations, or quantum gates,
is analyzed and a function reflecting their statistical distinguishability is
found. Given two unitary operations, $U_1$ and $U_2$, it is proved that there
always exists a finite number $N$ such that $U_1^{\otimes N}$ and $U_2^{\otimes
N}$ are perfectly distinguishable, although they were not in the single-copy
case. This result can be extended to any finite set of unitary transformations.
Finally, a fidelity for one-qubit gates, which satisfies many useful properties
from the point of view of quantum information theory, is presented.
","[{""version"":""v1"",""created"":""Mon, 12 Feb 2001 13:39:43 GMT""},{""version"":""v2"",""created"":""Wed, 7 Mar 2001 09:47:56 GMT""}]","2009-11-07"
"quant-ph/0102065","Georgios Metikas","M.A. Cirone, G. Metikas, and W.P. Schleich","Unusual bound or localized states","11 pages, 4 figures","Z. Naturforsch, 56 a, 1-13 (2001)","10.1515/zna-2001-0109",,"quant-ph",,"  We summarize unusual bound or localized states in quantum mechanics. Our
guide through these intriguing phenomena is the classical physics of the
upside-down pendulum. Taking advantage of the analogy between the corresponding
Newton's equation of motion and the time-independent Schr\""{o}dinger equation,
we discuss the zero-energy ground state in a three-dimensional, spatially
oscillating, potential. Moreover, we focus on the effect of the attractive
quantum anti-centrifugal potential that only occurs in a two-dimensional
situation.
","[{""version"":""v1"",""created"":""Mon, 12 Feb 2001 13:42:16 GMT""}]","2015-06-26"
