"astro-ph/0102184","Ian Bond","I.A. Bond, N.J. Rattenbury, J. Skuljan, F. Abe, R.J. Dodd, J.B.
  Hearnshaw, M. Honda, J. Jugaku, P.M. Kilmartin, A. Marles, K. Masuda, Y.
  Matsubara, Y. Muraki, T. Nakamura, G. Nankivell, S. Noda, C. Noguchi, K.
  Ohnishi, M. Reid, To. Saito, H. Sato, M. Sekiguchi, D.J. Sullivan, T. Sumi,
  M. Takeuti, Y. Watase, S. Wilkinson, R. Yamada, T. Yanagisawa, and P.C.M.
  Yock","Study by MOA of extra-solar planets in gravitational microlensing events
  of high magnification","14 pages, 16 embedded postscript figures, 3 PNG figures, revised
  version accepted by MNRAS","Mon.Not.Roy.Astron.Soc. 333 (2002) 71","10.1046/j.1365-8711.2002.05380.x",,"astro-ph",,"  A search for extra-solar planets was carried out in three gravitational
microlensing events of high magnification, MACHO 98-BLG-35, MACHO 99-LMC-2, and
OGLE 00-BUL-12. Photometry was derived from observational images by the MOA and
OGLE groups using an image subtraction technique. For MACHO 98-BLG-35,
additional photometry derived from the MPS and PLANET groups was included.
Planetary modeling of the three events was carried out in a super-cluster
computing environment. The estimated probability for explaining the data on
MACHO 98-BLG-35 without a planet is <1%. The best planetary model has a planet
of mass ~(0.4-1.5) X 10^-5 M_Earth at a projected radius of either ~1.5 or ~2.3
AU. We show how multi-planet models can be applied to the data. We calculated
exclusion regions for the three events and found that Jupiter-mass planets can
be excluded with projected radii from as wide as about 30 AU to as close as
around 0.5 AU for MACHO 98-BLG-35 and OGLE 00-BUL-12. For MACHO 99-LMC-2, the
exclusion region extends out to around 10 AU and constitutes the first limit
placed on a planetary companion to an extragalactic star. We derive a
particularly high peak magnification of ~160 for OGLE 00-BUL-12. We discuss the
detectability of planets with masses as low as Mercury in this and similar
events.
","[{""version"":""v1"",""created"":""Sun, 11 Feb 2001 22:02:16 GMT""},{""version"":""v2"",""created"":""Mon, 4 Feb 2002 07:54:57 GMT""}]","2009-11-06"
"astro-ph/0102187","Zoltan Perjes","Z. Perj\'es","Perturbed Friedmann cosmologies filled with dust and radiation","12 pages",,,,"astro-ph gr-qc",,"  An infinite number of perturbed k=0 Friedmann cosmologies filled with dust
and radiation is found. As we go up the sequence, the solutions contain an
increasing number of integration functions. With the coordinate gauge adopted
to co-move with the perturbed matter, the solution of a pair of coupled
equations for the trace h of the metric perturbations and for the radiation
density perturbations \delta\rho_r is the key to the problem. An estimate is
given of the temperature variation of the cosmic microwave background radiation
due to the Sachs-Wolfe effect. It is found that the temperature fluctuations
can grow faster than in the absence of radiation.
","[{""version"":""v1"",""created"":""Mon, 12 Feb 2001 09:51:01 GMT""}]","2007-05-23"
"astro-ph/0102191","Snezana Stanimirovic","S. Stanimirovi\'c & A. Lazarian","Velocity and density spectra of the Small Magellanic Cloud","5 pages, 1 figure, accepted for publication in the ApJ Letters",,"10.1086/319837",,"astro-ph",,"  This paper reports results on the statistical analysis of HI turbulence in
the Small Magellanic Cloud (SMC). We use 21 cm channel maps, obtained with the
Australia Telescope Compact Array and the Parkes telescope, and analyze the
spectrum of observed intensity fluctuations as a function of the velocity slice
thickness. We confirm predictions by Lazarian & Pogosyan (2000) on the change
of the power law index and establish the spectra of 3-D density and velocity.
The obtained spectral indices, -3.3 and -3.4, are slightly more shallow than
the predictions for the Kolmogorov spectrum. This contrasts to the predictions
for the shock-type spectra that are steeper than the Kolmogorov one. The nature
of the energy injection in the SMC is unclear as no distinct energy injection
scales are observed up to the entire scale of the SMC.
","[{""version"":""v1"",""created"":""Sun, 11 Feb 2001 17:03:27 GMT""}]","2016-08-16"
"astro-ph/0102192","Ulisse Munari","U.Munari (1,2), T.Tomov (2,3), B.F.Yudin (4), P.M.Marrese (1,2),
  T.Zwitter (5), R.G.Gratton (6), G.Bonanno (7), P.Bruno (7), A.Cali (7),
  R.U.Claudi (6), R.Cosentino (7,8), S.Desidera (6), G.Farisato (6),
  G.Martorana (1), G.Marino (8), M.Rebeschini (1), S.Scuderi (7), M.C.Timpanaro
  (7) ((1) Astron.Obs.Asiago (2) CISAS Padova (3) Center for Astron., Torun (4)
  Sternberg Astron.Inst., Moscow (5) Dept. Physics, Ljubljana (6) Astron.Obs.
  Padova (7) Astrophy.Obs. Catania (8) Centro Galileo Galilei, La Palma)","Discovery of a bipolar and highly variable mass outflow from the
  symbiotic binary StHa 190","Letter to the Editor, Astron.Astrophys, in press",,"10.1051/0004-6361:20010210",,"astro-ph",,"  A highly and rapidly variable bipolar mass outflow from StHa 190 has been
discovered, the first time in a yellow symbiotic star. Permitted emission lines
are flanked by symmetrical jet features and multi-component P-Cyg profiles,
with velocities up to 300 km/sec. Given the high orbital inclination of the
binary, if the jets leave the system nearly perpendicular to the orbital plane,
the de-projected velocity equals or exceeds the escape velocity (1000 km/sec).
StHa190 looks quite peculiar in many other respects: the hot component is an
O-type sub-dwarf without an accretion disk or a veiling nebular continuum and
the cool component is a G7 III star rotating at a spectacular 105 km/sec unseen
by a large margin in field G giants.
","[{""version"":""v1"",""created"":""Sun, 11 Feb 2001 18:04:15 GMT""}]","2009-11-06"
"astro-ph/0102193","Eyer Laurent","M. Grenon, J.A. Mattei, L. Eyer, G. Foster","The Variability of R,N,C Stars from HIPPARCOS and AAVSO Data","8 pages, 6 figures, IAU Symposium 177, published in ""The carbon star
  phenomenon"", RF. Wing ed., Kluwer, 2000",,,,"astro-ph",,"  Accurate photometry was obtained for all programme stars during the 3.3-year
HIPPARCOS mission. The final observing programme included several hundred Mirae
(M), semiregular (SR) long-period and irregular (L) variables. A detailed
calibration of the aging of the optics allowed the evaluation of very precise
magnitudes over the whole range of star colours.
  Since the time coverage of the satellite observations was not sufficient to
describe the behaviour of M, SR, or L type variables, smooth curves were fitted
statistically to the dense AAVSO observations. These curves were then
transformed to the HIPPARCOS system in order to complement the HIPPARCOS
photometry and thus produce precise light curves with fuller time coverage, for
a set of several hundred late-type variables, including most Carbon stars
brighter than V = 12.4 at minimum luminosity.
  A preliminary discussion of the behaviour of C stars, as observed from the
space in the broad Hp band, is given.
","[{""version"":""v1"",""created"":""Sun, 11 Feb 2001 19:44:24 GMT""}]","2007-05-23"
"astro-ph/0102194","Macquart J.-P.","D.L. Jauncey (ATNF) & J.-P. Macquart (USyd)","Intra-Day Variability and the Interstellar Medium Towards 0917+624","4 pages, 1 figure. Accepted for A&A Letters",,"10.1051/0004-6361:20010299",,"astro-ph",,"  The intra-day variable source 0917+624 displays annual changes in its
timescale of variability. This is explained in terms of a scintillation model
in which changes in the variability timescale are due to changes in the
relative velocity of the scintillation pattern as the Earth orbits the sun.
(see also astro-ph/0102050)
","[{""version"":""v1"",""created"":""Sun, 11 Feb 2001 22:17:16 GMT""}]","2009-11-06"
"astro-ph/0102195","Naoki Seto","Naoki Seto","Evolution of Power Spectrum in Non-Gaussian Models","25 pages, 7 figures, to appear in ApJ (553, Jun 1)",,"10.1086/320953",,"astro-ph",,"  Evolution of power spectrum is studied for non-Gaussian models of structure
formation. We generalize the dark-matter-approach to these models and find that
the evolved spectrum at weakly nonlinear regime is mainly determined by a
simple integral of the dark-matter-halo mass function in this approach.
  We also study the change of the nonlinear spectrum within the current
observational constraint of the primordial non-Gaussianity.
","[{""version"":""v1"",""created"":""Mon, 12 Feb 2001 06:21:12 GMT""}]","2009-11-06"
"astro-ph/0102196","Emmanuel Moy","E. Moy, B. Rocca-Volmerange and M. Fioc","Evolution of photoionization and star formation in starbursts and HII
  galaxies","14 pages, 10 figures","Astronomy and Astrophysics 365, 347","10.1051/0004-6361:20000045",,"astro-ph",,"  We analyze the stellar and nebular energy distributions of starbursts using
our evolutionary synthesis model PEGASE coupled to the photoionization code
CLOUDY. The originality of this study is to relate the evolution and the
metallicity of the starburst to the past star formation history of the host
galaxy.We compare our model predictions to an observed sample of ~750
starbursts. the most striking feature from line ratio fitting is the decreasing
spread in ionization parameter U at high metallicity Z. The best fits of
emission line ratios are obtained with a combination of a high- and a
low-ionization components. No additional source of ionizing photons --shocks or
hidden AGN -- is needed. Colors and equivalent widths are fitted in coherency
with emission line ratios. An underlying population is needed, even for
small-aperture observations. This evolved population not only reddens the
continuum and dilutes the equivalent width of the emission lines, but also
participates in the ionization process. Its main effect on line ratios is to
maintain a high level of excitation when the burst stops. Models combining
underlying populations typical of Hubble sequence galaxies and instantaneous
starbursts with ages between 0 and 8 Myr agree satisfactorily with all the
data.
","[{""version"":""v1"",""created"":""Mon, 12 Feb 2001 08:11:13 GMT""}]","2009-11-06"
"astro-ph/0102197","Alvaro Dominguez","Alvaro Dominguez","Morphology of the large-scale structure","Contribution to the proceedings of the 4th German-Chinese Joint
  Miniworkshop on Cosmology. 6 pages, 8 EPS figures, uses a World Scientific
  style file","Progress in Astronomy 19 (2001) 32 (Suppl.)",,,"astro-ph",,"  The Minkowski functionals are a mathematical tool to quantify morphological
features of patterns. Some applications to the matter distribution in galaxy
catalogues and N-body simulations are reviewed, with an emphasis on the effects
of cosmic variance. The conclusions are that (i) the observed large-scale
morphology is sensitive to cosmic variance on scales much larger than the
nonlinear length (approx. 8 Mpc/h), and (ii) the large-scale morphology
predicted by simulations is thus affected by finite-size effects, but
nonetheless a Lambda-CDM model is favored.
","[{""version"":""v1"",""created"":""Mon, 12 Feb 2001 10:11:46 GMT""}]","2007-05-23"
"astro-ph/0102198","Joanna Mikolajewska","J. Mikolajewska, R.J. Ivison and A. Omont","Mm/submm observations of symbiotic binary stars: implications for the
  mass loss and mass exchange","7 pages, 8 figures. Paper presented at COSPAR 2000 ""New results in
  FIR and Submm Astronomy"", to be published in Advances in Space Research",,"10.1016/S0273-1177(02)00599-9",,"astro-ph",,"  We discuss mm/submm spectra of a sample of symbiotic binary systems, and
compare them with popular models proposed to account for their radio emission.
We find that radio emission from quiescent S-type systems originates from a
conical region of the red giant wind ionized by the hot companion (the STB
model), whereas more complicated models involving winds from both components
and their interaction are required to account for radio emission of active
systems. We also find that the giant mass-loss rates derived from our
observations are systematically higher than those for single cool giants. This
result is in agreement with conclusions derived from IRAS observations and with
requirements of models for the hot component.
","[{""version"":""v1"",""created"":""Mon, 12 Feb 2001 12:05:21 GMT""}]","2009-11-06"
"astro-ph/0102199","Tinggui Wang","T. G. Wang (1), M. Matsuoka (2), T. Kubo (3), T. Mihara (4), H.
  Negoro(4)((1)USTC, (2)NASDA, (3)Kyoto U, (4)RIKEN)","A Rapid X-ray Flare in the Radio-loud Narrow Line Quasar PKS 0558-504","10 pages, ApJ accepted",,"10.1086/321344",,"astro-ph",,"  We report the detection of a very short time scale flare in the radio-loud
narrow line quasars PKS 0558-504 by using ASCA. The X-ray count rates increased
and decreased by a factor of two in 33 minutes, and possibly by 40% in as short
as two minutes during this flare, confirming that such flare event does occur
in this object with imaging detectors. The implied largest rate of change in
luminosity in 0.8-10 keV alone, dL/dt=(1.8+/-0.4) 10^{42} ergs s^-2, is several
times higher than the limit sets for the isotropic emitting plasma around a
Kerr black hole. Either emission from a relativistic boosting jet or a magnetic
heated corona may explain such high radiative efficiency. Magnetic field with a
strength of at least a few 10^4 Gauss is required in the latter case. The
spectrum during this flare is significant harder than the average one. Three
radio loud narrow line active galactic nuclei (AGN) possess considerably
smaller black holes than in radio loud AGN in bright quasar survey, indicating
they are still in a phase of the rapid growth of the black hole by accretion.
","[{""version"":""v1"",""created"":""Mon, 12 Feb 2001 13:19:04 GMT""}]","2009-11-06"
"astro-ph/0102200","Gabriele Breuer","B. Vollmer (1,2,8), V. Cayatte (1), W. van Driel (1,3), P.A. Henning
  (4), R.C. Kraan-Korteweg (1,5), C. Balkowski (1), P.A. Woudt (6,7), and W.
  Duschl (2,8) ((1) DAEC, Observatoire de Paris, France, (2) ITA, Univ.
  Heidelberg, Germany, (3) Unite Scientifique Nancay, Observatoire de Paris,
  France, (4) Institute for Astrophysics, Univ. of New Mexico, USA, (5) Dep. de
  Astronomia, Univ. de Guanajuato, Mexico, (6) Dept. of Astronomy, Univ. of
  Cape Town, South Africa, (7) ESO, Garching, Germany, (8) MPI fuer
  Radioastronomie, Bonn, Germany)","HI deficiency in the galaxy cluster ACO 3627. ATCA observations in the
  Great Attractor region","9 pages with 7 figures; A&A, in press",,,,"astro-ph",,"  ATCA 21 cm HI observations of the rich galaxy cluster ACO 3627 in the Great
Attractor region are presented. Three fields of 30' diameter located within one
Abell radius of ACO 3627 were observed with a resolution of 15'' and an rms
noise of \sim 1 mJy/beam. Only two galaxies were detected in these fields. We
compare their HI distribution to new optical R-band images and discuss their
velocity fields. The first galaxy is a gas-rich unperturbed spiral whereas the
second shows a peculiar HI distribution. The estimated 3-sigma HI mass limit of
our observations is \sim 7 x 10^8 M_{\odot} for a line width of 150 km s^{-1}.
The non-detection of a considerable number of luminous spiral galaxies
indicates that the spiral galaxies are HI deficient. The low detection rate is
comparable to the HI deficient Coma cluster (Bravo-Alfaro et al. 2000). ACO
3627 is a bright X-ray cluster. We therefore suspect that ram pressure
stripping is responsible for the HI deficiency of the bright cluster spirals.
","[{""version"":""v1"",""created"":""Mon, 12 Feb 2001 13:45:33 GMT""}]","2007-05-23"
"astro-ph/0102201","Sergei B. Popov","S.B. Popov and M.E. Prokhorov (Sternberg Astronomical Institute)","Evolution of isolated neutron stars in globular clusters: number of
  Accretors","6 pages, no figures. Submitted to Astronomical and Astrophysical
  Transactions (style included)",,"10.1080/10556790215593",,"astro-ph",,"  With a simple model from the point of view of population synthesis we try to
verify an interesting suggestion made by Pfahl & Rappaport (2001) that dim
sources in globular clusters (GCs) can be isolated accreting neutron stars
(NSs). Simple estimates show, that we can expect about 0.5-1 accreting isolated
NS per typical GC with $M=10^5 M_{\odot}$ in correspondence with observations.
Properties of old accreting isolated NSs in GCs are briefly discussed. We
suggest that accreting NSs in GCs experienced significant magnetic field decay.
","[{""version"":""v1"",""created"":""Mon, 12 Feb 2001 13:57:30 GMT""},{""version"":""v2"",""created"":""Tue, 8 May 2001 11:26:48 GMT""}]","2009-11-06"
"astro-ph/0102202","Soker Noam","Noam Soker (U. of Haifa), Saul Rappaport (MIT)","Departure from Axisymmetry in Planetary Nebulae","15 pages + 4 tables; Submitted to ApJ",,"10.1086/321669",,"astro-ph",,"  Many planetary nebulae (PNe) exhibit distinctly non-axisymmetric structure in
either (i) the shape of the nebula, or (ii) in the off-centered position of the
illuminating star. By examining a large number of well resolved images of PNe
we estimate that about 30-50 percents of all PNe exhibit distinctly
non-axisymmetric structure. In this paper, we discuss how such departures from
axisymmetry can arise from the binary nature of the progenitors of the PNe. The
scenarios include (a) relatively close binaries with eccentric orbits, and (b)
longer orbital period systems with either circular or eccentric orbits. In
order to assess the fraction of PNe whose non-axisymmetric morphologies are
expected to arise in binary systems, we have carried out a detailed population
synthesis study. The expected deviations from axisymmetry are classified for
each binary and the results tabulated. We find that about 25 percents of
elliptical and 30-50 percents of bipolar PNe are expected to acquire
non-axisymmetric structure from binary interactions.
","[{""version"":""v1"",""created"":""Mon, 12 Feb 2001 13:58:50 GMT""}]","2009-11-06"
"astro-ph/0102203","Anil K. Pradhan","Sultana N. Nahar (Dept. of Astronomy, Ohio State) and Manuel A.
  Bautista (IVIC, Venezuela)","Electron-Ion Recombination Rate Coefficients and Photoionization Cross
  Sections for Astrophysically Abundant Elements VI. Ni II","ApJ Suppl. (submitted), 4 figures","Astrophys.J.Suppl. 137 (2001) 201-208","10.1086/322540",,"astro-ph physics.atom-ph",,"  We present the first detailed ab initio quantum mechanical calculations for
total and state-specific recombination rate coefficients for e + Ni III --> Ni
II. These rates are obtained using a unified treatment for total electron-ion
recombination that treats the nonresonant radiative recombination and the
resonant dielectronic recombination in a self-consistent unified manner in the
close coupling approximation. Large-scale calculations are carried out using a
49-state wavefunction expansion from core configurations 3d^8, 3d^74s, and
3d^64p that permits the inclusion of prominent dipole allowed core transitions.
These extensive calculations for the recombination rates of Ni II required
hundreds of CPU hours on the Cray T90. The total recombination rate
coefficients are provided for a wide range of temperature. The state-specific
recombination rates for 532 bound states of doublet and quartet symmetries, and
the corresponding photoionization cross sections for leaving the core in the
ground state, are presented. Present total recombination rate coefficients
differ considerably from the currently used data in astrophysical models.
","[{""version"":""v1"",""created"":""Mon, 12 Feb 2001 15:19:11 GMT""}]","2009-11-06"
"cond-mat/0102192","Dr Pratap Raychaudhuri","A.R. Bhangale, P. Raychaudhuri, S. Sarkar, T. Banerjee, S. S. Bhagwat,
  V. S. Shirodkar and R. Pinto","Peak effect in a superconducting DyBa2Cu3O7-y film at microwave
  frequencies","1 text, 4 figures (all postscript) to be published in Phys. Rev. B",,"10.1103/PhysRevB.63.180502",,"cond-mat.supr-con",,"  We report the observation of a peak in the microwave (9.55 GHz) surface
resistance in an epitaxial DyBa2Cu3O7-y superconducting film in magnetic fields
(parallel to the c axis) ranging between 0.2 to 0.9 Tesla. Such a peak is
absent in the measurements done in zero-field. The temperature and field
dependence of the peak suggests that this peak could be associated with the
peak effect phenomenon reflecting the order-disorder transformation in the
flux-line lattice. A strong dependence of this peak effect at frequencies close
to the depinning frequency of the flux line lattice is observed.
","[{""version"":""v1"",""created"":""Sun, 11 Feb 2001 18:15:17 GMT""}]","2009-11-07"
"cond-mat/0102193","Todd M. Squires","Todd M. Squires","Effective pseudo-potentials of hydrodynamic origin","10 pages, 3 figures, submitted to J. Fluid Mech","J. Fluid Mech. (2001), vol. 443, pp. 403{412.","10.1017/S0022112001005432",,"cond-mat.soft cond-mat.stat-mech",,"  It is shown that low Reynolds number fluid flows can cause suspended
particles to respond as though they were in an equilibrium system with an
effective potential. This general result follows naturally from the fact that
different methods of moving particles in viscous fluids give rise to very
different long-range flows. Two examples are discussed: electrophoretic
`levitation' of a heavy charged sphere, for which a hydrodynamic
`pseudo-potential' can be written in closed form, and quasi-two dimensional
crystals of like-charged colloidal spheres which form near charged walls, whose
apparent attraction arises not from a force but from persistent fluid flows.
","[{""version"":""v1"",""created"":""Sun, 11 Feb 2001 19:18:16 GMT""}]","2019-06-19"
"cond-mat/0102194","Henryk Kepa","H. Kepa, J. Kutner-Pielaszek, J. Blinowski, A. Twardowski, C. F.
  Majkrzak, T. Story, P. Kacman, R. R. Galazka, K. Ha, H. J. M. Swagten, W. J.
  M. de Jonge, A. Yu. Sipatov, V. Volobuev, T. M. Giebultowicz","Antiferromagnetic Interlayer Coupling in Ferromagnetic Semiconductor
  EuS/PbS(001) Superlattices","7 pages, 5 figures, submitted to Europhysics Letters",,"10.1209/epl/i2001-00487-7",,"cond-mat",,"  Antiferromagnetic coupling between ferromagnetic layers has been observed for
the first time in all-semiconductor superlattice structure EuS/PbS(001), by
neutron scattering and magnetization measurements. Spin-dependent superlattice
band structure effects are invoked to explain the possible origin and the
strength of the observed coupling.
","[{""version"":""v1"",""created"":""Sun, 11 Feb 2001 22:08:32 GMT""},{""version"":""v2"",""created"":""Tue, 17 Jul 2001 16:10:09 GMT""}]","2009-11-07"
"cond-mat/0102195","Marcia Barbosa","Young C. Kim, Michael E. Fisher and Marcia C. Barbosa","The Isothermal Binodal Curves Near a Critical Endpoint","Revtex, 5 figures",,"10.1063/1.1373665",,"cond-mat",,"  Thermodynamics in the vicinity of a critical endpoint with nonclassical
exponents $\alpha$, $\beta$, $\gamma$, $\delta$, $...$ is analyzed in terms of
density variables (mole fractions, magnetizations, etc.). The shapes of the
isothermal binodals or two-phase coexistence curves are found at andnear the
endpoint for symmetric and nonsymmetric situations. The spectator- (or
noncritical)-phase binodal at $T=T_{e}$ is characterized by an exponent
$(\delta +1)/\delta$ $(\simeq 1.21)$ with leading corrections of relative order
$1/\delta$ $(\simeq 0.21)$, $\theta_{4}/\beta\delta$ $(\simeq 0.34)$ and $1
-(\beta\delta)^{-1}$$(\simeq 0.36)$; in contrast to classical (van der Waals,
mean field, $...$) theory, the critical endpoint binodal is singular with
leading exponent $(1-\alpha)/\beta$ $(\simeq 2.73)$ and corrections which are
elucidated; the remaining, $\lambda$-line binodals also display the
`renormalized exponent,' $(1-\alpha)/\beta$ butwith more singular corrections.
(The numerical values quoted here pertain to $(d=3)$-dimensional-fluid or
Ising-type systems.)
","[{""version"":""v1"",""created"":""Mon, 12 Feb 2001 00:08:03 GMT""}]","2009-11-07"
"cond-mat/0102196","Marcia Barbosa","Paulo A. Netz, Francis W. Starr, H. Eugene Stanley, and Marcia C.
  Barbosa","Static and Dynamic Properties of Stretched Water","Revtex4, 6 figures",,"10.1063/1.1376424",,"cond-mat",,"  We present the results of molecular dynamics simulations of the extended
simple point charge (SPC/E) model of water to investigate thethermodynamic and
dynamic properties of stretched and supercooled water. We locate the liquid-gas
spinodal, and confirm that the spinodal pressure increases monotonically with
$T$, supporting thermodynamic scenarios for the phase behavior of supercooled
water involving a ``non-reentrant'' spinodal. The dynamics at negative pressure
show a minimum in the diffusion constant $D$ when the density is decreased at
constant temperature, complementary to the known maximum of $D$ at higher
pressures. We locate the loci of minima of $D$ relative to the spinodal,
showing that the locus is inside the thermodynamicaly metastable regions of the
phase-diagram. These dynamical results reflect the initial enhancement and
subsequent breakdown of the tetrahedral structure and of the hydrogen bond
network as the density decreases.
","[{""version"":""v1"",""created"":""Mon, 12 Feb 2001 00:18:44 GMT""}]","2009-11-07"
"cond-mat/0102197","Andrey V. Shytov","Ilya A. Gruzberg, P. J. Hirschfeld, and A. V. Shytov","Comment on ``Density of States of Disordered Two-Dimensional Crystals
  with Half-Filled Band''",,,"10.1103/PhysRevLett.87.239703",,"cond-mat.mes-hall",,"  In a recent letter (PRL 84, 3930 (2000)) Nakhmedov et al. claimed that the
Van Hove singularity at $\epsilon=0$ in the density of states (DoS) of the
two-dimensional crystal with half-filled tight-binding band survives the
addition of substitutional impurities. This derivation suffers from several
inconsistencies. We resolve them and show that the DoS at the band center is
finite, as one might naively expect.
","[{""version"":""v1"",""created"":""Mon, 12 Feb 2001 08:03:40 GMT""}]","2009-11-07"
