"cond-mat/0102199","Sindhunil B. Roy","K. J. Singh, S. Chaudhary, M. K. Chattopadhyay, M. A. Manekar, S. B.
  Roy and P. Chaddah","A first order phase transition induced by magnetic field and temperature","10 pages and 2 figures",,,,"cond-mat.str-el cond-mat.mtrl-sci",,"  Taking the pseudobinary C15-Laves phase compound
Ce(Fe$_{0.96}$Al$_{0.04}$)$_2$ as a paradigm for studying a ferromagnetic(FM)
to antiferromagnetic(AFM) phase transition, we present interesting
thermomagnetic history effects in magnetotransport measurements across this
FM-AFM transition. We argue that these distinctive hysteretic features can be
used to identify the exact nature -first order or second order - of this kind
of transition in magnetic systems where electrical transport is strongly
correlated with the underlying magnetic order. A comparison is made with the
similar FM-AFM transitions observed in Nd and Pr-based manganese compounds with
perovskite-type structure.
","[{""version"":""v1"",""created"":""Mon, 12 Feb 2001 11:42:49 GMT""}]","2007-05-23"
"cond-mat/0102200","Tao Xiang","Tao Xiang, Jizhong Lou, Zhaobin Su","A two-dimensional algorithm of the density matrix renormalization group","6 pages, 7 figures, 1 table, minor corrections","Physical Review B 64, 104414 (2001).","10.1103/PhysRevB.64.104414",,"cond-mat.str-el cond-mat.stat-mech",,"  We propose a new approach to implement the density matrix renormalization
group (DMRG) in two dimensions. With this approach the initial blocks of a L by
L lattice are built up directly from the matrix elements of a (L-1) by L-1)
lattice and the topological characteristics of two dimensional lattices is
preserved in the iteration of DMRG. By applying it to the spin-1/2 Heisenberg
model on both square and triangle lattices, we find that this approach is
significantly more efficient and accurate than other two-dimensional DMRG
methods currently in use.
","[{""version"":""v1"",""created"":""Mon, 12 Feb 2001 11:08:03 GMT""},{""version"":""v2"",""created"":""Mon, 19 Feb 2001 13:14:09 GMT""},{""version"":""v3"",""created"":""Wed, 25 Apr 2001 16:35:01 GMT""}]","2009-11-07"
"cond-mat/0102201","Bruce Normand","B. Normand and A. P. Kampf","Lattice anisotropy as microscopic origin of static stripes in cuprates","18 pages, 16 figures, 8 tables","Phys. Rev. B 64, 024521 (2001).","10.1103/PhysRevB.64.024521",,"cond-mat.str-el",,"  Structural distortions in cuprate materials offer a microscopic origin for
anisotropies in electron transport in the basal plane. Using a real-space
Hartree-Fock approach, we consider the ground states of the anisotropic Hubbard
(t_x \ne t_y) and t-J (t_x \ne t_y, J_x \ne J_y) models. Symmetrical but
inhomogeneous (``polaronic'') charge structures in the isotropic models are
altered even by rather small anisotropies to one-dimensional, stripe-like
features. We find two distinct types of stripe, namely uniformly filled,
antiphase domain walls and non-uniform, half-filled, in-phase ones. We
characterize their properties, energies and dependence on the model parameters,
including filling and anisotropy in t (and J). We discuss the connections among
these results, other theoretical studies and experimental observation.
","[{""version"":""v1"",""created"":""Mon, 12 Feb 2001 12:11:42 GMT""}]","2009-11-07"
"cond-mat/0102203","Juan J. Mazo","E. Trias, J.J. Mazo, A. Brinkman and T.P. Orlando","Discrete Breathers in Josephson Ladders","Accepted in Physica D",,"10.1016/S0167-2789(01)00255-X",,"cond-mat nlin.PS",,"  We present a study of nonlinear localized excitations called discrete
breathers in a superconducting array. These localized solutions were recently
observed in Josephson-junction ladder arrays by two different experimental
groups. We review the experiments made by Trias et al. We report the detection
of different single-site and multi-site breather states and study the dynamics
when changing the array bias current. By changing the temperature we can
control the value of the damping (the Stewart-McCumber parameter) in the array,
thus allowing an experimental study at different array parameters. We propose a
simple DC circuit model to understand most of the features of the detected
states. We have also compared this model and the experiments with simulations
of the dynamics of the array. We show that the study of the resonances in the
ladder and the use of harmonic balance techniques allow for understanding of
most of the numerical results. We have computed existence diagrams of breather
solutions in our arrays, found resonant localized solutions and described the
localized states in terms of vortex and antivortex motion.
","[{""version"":""v1"",""created"":""Mon, 12 Feb 2001 12:48:33 GMT""}]","2009-11-07"
"cond-mat/0102204","A. Lefevre","A. Lefevre, D. S. Dean","Tapping Thermodynamics of the One Dimensional Ising Model","11 pages, 5 figures","J PHYS A-MATH GEN 34 (14): L213-L220 APR 13 2001","10.1088/0305-4470/34/14/101",,"cond-mat.stat-mech",,"  We analyse the steady state regime of a one dimensional Ising model under a
tapping dynamics recently introduced by analogy with the dynamics of
mechanically perturbed granular media. The idea that the steady state regime
may be described by a flat measure over metastable states of fixed energy is
tested by comparing various steady state time averaged quantities in extensive
numerical simulations with the corresponding ensemble averages computed
analytically with this flat measure. The agreement between the two averages is
excellent in all the cases examined, showing that a static approach is capable
of predicting certain measurable properties of the steady state regime.
","[{""version"":""v1"",""created"":""Mon, 12 Feb 2001 13:16:30 GMT""}]","2009-11-07"
"cond-mat/0102205","Balazs Dora","Bal\'azs D\'ora, Kazumi Maki and Attila Virosztek","Out of plane optical conductivity in d-wave superconductors","7 pages, 7 figures","Europhys. Lett. 55 (2001) 847","10.1209/epl/i2001-00358-9",,"cond-mat.str-el",,"  We study theoretically the out of plane optical conductivity of d-wave
superconductors in the presence of impurities at T=0K. Unlike the usual
approach, we assume that the interlayer quasi-particle transport is due to
coherent tunneling. The present model describes the T^2 dependence of the out
of plane superfluid density observed in YBCO and Tl2201 for example. In the
optical conductivity there is no Drude peak in agreement with experiment, and
the interlayer Josephson tunneling is also assured in this model. In the
unitary limit we predict a step like behaviour around omega=Delta in both the
real and imaginary part of the optical conductivity.
","[{""version"":""v1"",""created"":""Mon, 12 Feb 2001 13:48:43 GMT""}]","2009-11-07"
"gr-qc/0102043","Maurice H. P. M. van Putten","Maurice H.P.M. van Putten","Gravitational radiation from long gamma-ray bursts","submitted; Presented at the 2001 Aspen Winter Conference on
  Gravitational Waves, Feb. 4-10, 2001, Aspen",,,,"gr-qc astro-ph",,"  Long gamma-ray bursts (GRBs) are probably powered by high-angular momentum
black hole-torus systems in suspended accretion. The torus will radiate
gravitational waves as non-axisymmetric instabilities develop. The luminosity
in gravitational-wave emissions is expected to compare favorably with the
observed isotropic equivalent luminosity in GRB-afterglow emissions. This
predicts that long GRBs are potentially the most powerful LIGO/VIRGO
burst-sources in the Universe. Their frequency-dynamics is characterized by a
horizontal branch in the $\dot{f}(f)-$diagram.
","[{""version"":""v1"",""created"":""Sun, 11 Feb 2001 19:31:00 GMT""}]","2007-05-23"
"gr-qc/0102044","Jorge Pullin","Jorge Pullin","Matters of Gravity, the newsletter of the APS Topical Group on
  Gravitation, Spring 2001","23 pages, LaTeX with html.sty. PDF and html versions in
  http://gravity.phys.psu.edu/mog.html",,,"MOG-17","gr-qc",,"  News:
  - APS Prize on gravitation, by Cliff Will
  - TGG elections, by David Garfinkle
  - We hear that... by Jorge Pullin
  Research Briefs:
  - Experimental Unruh radiation?, by Matt Visser
  - Why is the universe accelerating?, by Beverly Berger
  - The Lazarus Project, by Richard Price
  - LIGO locks its first detector!, by Stan Whitcomb
  - Progress on the nonlinear r-mode problem, by Keith Lockitch
  Conference reports:
  - Analog models of general relativity, by Matt Visser
  - Astrophysical Sources of Gravitational radiation by Joan Centrella
  - Numerical relativity at the 20th Texas meeting, by Pablo Laguna
","[{""version"":""v1"",""created"":""Sun, 11 Feb 2001 19:43:37 GMT""}]","2007-05-23"
"gr-qc/0102045","Gabriela Gonzalez","Gabriela Gonzalez (Center for Gravitational Physics and Geometry, The
  Pennsylvania State University)","Angular Noise in Gravitational Wave Detectors","2 pages, to appear in proceedings of the IX Marcel Grossmann meeting,
  Rome, 2000",,"10.1142/9789812777386_0397","CGPG-01-2-1","gr-qc",,"  Angular fluctuations of suspended mirrors in gravitational wave
interferometers are a source of noise both for the locking and the operation of
the detectors. We describe here some of the sources of these fluctuations and
methods for the estimation of their order of magnitude.
","[{""version"":""v1"",""created"":""Sun, 11 Feb 2001 20:08:27 GMT""}]","2017-08-23"
"gr-qc/0102046","Lars Bildsten","Lars Bildsten (Institute for Theoretical Physics, UCSB)","Dissipation for Euler's Disk and a Desktop Demonstration of Coalescing
  Neutron Stars","Submitted to American Journal of Physics",,,,"gr-qc astro-ph",,"  I show that the recent calculation of Moffatt's regarding the viscous
dissipation of a spinning coin overlooked the importance of the finite width of
the viscous boundary layer. My new estimates are more in accord with that
observed. I also point out that the frequency ``chirp'' of the specially
designed toy ``Euler's Disk'' is similar to that expected during the last few
minutes of the life of a coalescing binary of two neutron stars. As such, this
toy is an excellent desktop demonstration for the expected phenomena.
","[{""version"":""v1"",""created"":""Sun, 11 Feb 2001 23:40:23 GMT""}]","2007-05-23"
"gr-qc/0102047","Sergio Dain","Sergio Dain and Helmut Friedrich","Asymptotically Flat Initial Data with Prescribed Regularity at Infinity","Latex 2e, 47 pages, no figures","Commun.Math.Phys. 222 (2001) 569-609","10.1007/s002200100524",,"gr-qc",,"  We prove the existence of a large class of asymptotically flat initial data
with non-vanishing mass and angular momentum for which the metric and the
extrinsic curvature have asymptotic expansions at space-like infinity in terms
of powers of a radial coordinate.
","[{""version"":""v1"",""created"":""Mon, 12 Feb 2001 15:35:25 GMT""}]","2009-11-07"
"hep-ex/0102026","Byron Lundberg","DONUT Collaboration","A New Upper Limit for the Tau-Neutrino Magnetic Moment","9 pages; 1 figure","Phys.Lett.B513:23-29,2001","10.1016/S0370-2693(01)00746-8",,"hep-ex",,"  Using a prompt neutrino beam in which a nu_tau component was identified for
the first time, the nu_tau magnetic moment was measured based on a search for
an anomalous increase in the number of neutrino-electron interactions. One such
event was observed when 2.3 were expected from background processes, giving an
upper 90% confidence limit of 3.9x10^-7 Bohr magnetons.
","[{""version"":""v1"",""created"":""Sun, 11 Feb 2001 18:13:07 GMT""}]","2012-08-27"
"hep-ex/0102027","Miroslav Kopal","Miroslav Kopal","Preliminary results of the Standard Model Higgs Boson search at LEP in
  2000","4 pages, 2 figures included",,,,"hep-ex",,"  A search for the Standard Model Higgs boson is performed using the data
collected by the four LEP experiments at center-of-mass energies between 202
GeV and 209 GeV. An average luminosity of 140 $pb^{-1}$ per experiment has been
analyzed. A 2.6 $\sigma$ excess is observed in the LEP-wide combination for a
Higgs boson mass hypothesis of around 114 GeV. All results are preliminary.
","[{""version"":""v1"",""created"":""Sun, 11 Feb 2001 19:54:03 GMT""}]","2007-05-23"
"hep-ex/0102028","Verene Chazal","V. Chazal (Universite de Neuchatel), F. Boehm (California Institute of
  Technology), B. Cook (California Institute of Technology), H. Henrikson
  (California Institute of Technology), G. Jonkmans (Universite de Neuchatel),
  A. Paic (Universite de Neuchatel), N. Mascarenhas (California Institute of
  Technology), P. Vogel (California Institute of Technology), J.-L. Vuilleumier
  (Universite de Neuchatel)","Investigations of fast neutron production by 190 GeV/c muon interactions
  on different targets","19 pages, 11 figures eps","Nucl.Instrum.Meth. A490 (2002) 334-343","10.1016/S0168-9002(02)01006-9",,"hep-ex",,"  The production of fast neutrons (1 MeV - 1 GeV) in high energy muon-nucleus
interactions is poorly understood, yet it is fundamental to the understanding
of the background in many underground experiments. The aim of the present
experiment (CERN NA55) was to measure spallation neutrons produced by 190 GeV/c
muons scattering on carbon, copper and lead targets. We have investigated the
energy spectrum and angular distribution of spallation neutrons, and we report
the result of our measurement of the neutron production differential cross
section.
","[{""version"":""v1"",""created"":""Mon, 12 Feb 2001 12:59:53 GMT""},{""version"":""v2"",""created"":""Wed, 12 Sep 2001 09:19:23 GMT""},{""version"":""v3"",""created"":""Mon, 13 May 2002 08:19:33 GMT""}]","2015-06-25"
"hep-ex/0102029","Sergei Burdin","M.N.Achasov, K.I.Beloborodov, A.V.Berdyugin, A.G.Bogdanchikov,
  A.V.Bozhenok, A.D.Bukin, D.A.Bukin, S.V.Burdin, T.V.Dimova, A.A.Drozdetsky,
  V.P.Druzhinin, M.S.Dubrovin, I.A.Gaponenko, V.B.Golubev, V.N.Ivanchenko,
  P.M.Ivanov, A.A.Korol, S.V.Koshuba, A.P.Lysenko, I.N.Nesterenko,
  E.V.Pakhtusova, E.A.Perevedentsev, A.A.Salnikov, S.I.Serednyakov, V.V.Shary,
  Yu.M.Shatunov, V.A.Sidorov, Z.K.Silagadze, A.N.Skrinsky, Yu.V.Usov,
  A.V.Vasiljev","Direct measurement of the phi(1020) leptonic branching ratio","RevTeX, 5 pages, 3 figures. To be published in Phys. Rev. Lett","Phys.Rev.Lett.86:1698-1701,2001","10.1103/PhysRevLett.86.1698",,"hep-ex",,"  The process e+e-->mu+mu- has been studied by SND detector at VEPP-2M e+e-
collider in the phi(1020)-resonance energy region. The measured effective phi
meson leptonic branching ratio:
B(phi->l+l-)=sqrt{B(phi->e+e-)*B(phi->mu+mu-)}=(2.89+-0.10+-0.06)*10^{-4}
agrees well with the PDG value B(phi->e+e-)=(2.91+-0.07)*10^{-4} confirming
mu-e universality. Without additional assumption of mu-e universality the
branching ratio B(phi->mu+mu-)=(2.87+-0.20+-0.14)*10^{-4} was obtained.
","[{""version"":""v1"",""created"":""Mon, 12 Feb 2001 14:10:01 GMT""}]","2008-11-26"
"hep-ph/0102133","Vadim Guzey","V. Guzey (Adelaide U.), K. Saito (Tohoku Coll., Pharmacy), M. Strikman
  (Penn State U.), A.W. Thomas and K. Tsushima (Adelaide U.)","Non-singlet structure function of the 3He-3H system and divergence of
  the Gottfried integral","29 pages, 6 figures, RevTex","Phys.Rev.D64:054503,2001","10.1103/PhysRevD.64.054503","ADP-01-03/T438","hep-ph hep-ex nucl-ex nucl-th",,"  We study shadowing and antishadowing corrections to the flavor non-singlet
structure function F_2(3He)-F_2(3H) and show that the difference between the
one-particle density distributions of 3He and 3H plays an important role at
very small x. We find that the flavor non-singlet structure function in these
mirror nuclei is enhanced at small x by nuclear shadowing, which increases the
nuclear Gottfried integral, integrated from 10^{-4} to 1, by 11-36 %. When
integrated from zero, the Gottfried integral is divergent for these mirror
nuclei. It seems likely that, as a consequence of charge symmetry breaking,
this may also apply to the proton-neutron system.
","[{""version"":""v1"",""created"":""Mon, 12 Feb 2001 00:22:35 GMT""}]","2010-02-17"
"hep-ph/0102134","Matteo Cacciari","M. Cacciari, S. Frixione and P. Nason","The p_T Spectrum in Heavy-Flavour Photoproduction","26 pages, Latex, epsfig, 15 figures. Submitted to JHEP","JHEP 0103:006,2001","10.1088/1126-6708/2001/03/006","Bicocca-FT-01-01, GEF/TH-2-01, YITP-SB-01-01","hep-ph",,"  We consider the transverse-momentum distribution of heavy flavours in
photon-hadron collisions. We present a formalism in which large
transverse-momentum logarithms are resummed to the next-to-leading level, and
mass effects are included exactly up to order alpha_em alpha_s^2, so as to
retain predictivity at both small and large transverse momenta.
Phenomenological applications relevant to charm photoproduction at HERA are
given.
","[{""version"":""v1"",""created"":""Mon, 12 Feb 2001 13:42:44 GMT""}]","2010-02-03"
"hep-ph/0102135","Svjetlana Fajfer","S. Fajfer and P. Singer","$\Delta S = 2$ decays of $B^-$ meson in MSSM and two Higgs doublet model","4 pages, talk presented at 4th International Conference on Hyperons,
  Charm and Beauty Hadrons, Valencia, July 27-30 2000; to appear in Nucl. Phys.
  B Suppl","Nucl.Phys.Proc.Suppl. 93 (2001) 103-106","10.1016/S0920-5632(00)01070-7",,"hep-ph",,"  In view of the extreme smallness of $\Delta S = 2$ transitions of $B$ meson
in the Standard Model, we consider their occurence in several extensions of it.
Thus, we analyze the three - body $B^- \to K^- K^- \pi^+$ and two - body $B^-
\to K^{*-} \barK^{*0}$, $B^- \to K^- \bar K^{0}$, $B^- \to K^{*-} \bar K^{0}$,
$B^- \to K^{-} \bar K^{*0}$ decay modes both in the Standard Model and in the
Minimal Supersymmetric Model with and without ${\cal R}$ parity conservation
and in two Higgs doublet models. All five modes are found to have a branching
ratio of the order of $10^{-13}$ in the Standard Model, while the expected
branching ratio in the different extensions vary between $10^{-9} - 10^{-6}$,
for a given reasonable choice of parameters.
","[{""version"":""v1"",""created"":""Mon, 12 Feb 2001 13:56:37 GMT""}]","2009-11-07"
"hep-ph/0102136","Domenico Falcone","D. Falcone, F. Tramontano","Neutrino oscillations and neutrinoless double beta decay","RevTex, 9 pages with 3 figures. Few comments and references added","Phys.Rev. D64 (2001) 077302","10.1103/PhysRevD.64.077302","DSF-07/2001","hep-ph",,"  The relation between neutrino oscillation parameters and neutrinoless double
beta decay is studied, assuming normal and inverse hierarchies for Majorana
neutrino masses. For normal hierarchy the crucial dependence on U_{e3} is
explored. The link with tritium beta decay is also briefly discussed.
","[{""version"":""v1"",""created"":""Mon, 12 Feb 2001 14:02:46 GMT""},{""version"":""v2"",""created"":""Thu, 15 Feb 2001 09:20:28 GMT""},{""version"":""v3"",""created"":""Fri, 16 Mar 2001 15:00:53 GMT""}]","2009-11-07"
"hep-th/0102058","Kevin E. Cahill","Kevin Cahill","Supersymmetry without Grassmann Variables","8 pages, JHEP style","JHEP 0106:002,2001","10.1088/1126-6708/2001/06/002",,"hep-th",,"  Supersymmetry transformations may be represented by unitary operators in a
formulation of supersymmetry without numbers that anti-commute. The physical
relevance of this formulation hinges on whether or not one may add states of
even and odd fermion number, a question which soon may be settled by
experiment.
","[{""version"":""v1"",""created"":""Mon, 12 Feb 2001 08:32:03 GMT""}]","2010-02-03"
"hep-th/0102059","Victor Pervushin","Victor Pervushin","Topology of Equivalent Unconstrained Systems in QCD","9 pages, Contribution to the Proceedings of the Workshop ""Quark
  Matter in Astro- and Particle Physics"", Rostock, Nov 27 - 29, 2000",,,,"hep-th",,"  We consider the derivation of equivalent unconstrained systems for QCD given
in the class of functions of nontrivial topological gauge transformations. We
show that the unconstrained QCD obtained by resolving the Gauss law constraint
contains a monopole, a zero mode of the Gauss law, and a rising potential,
which can explain the phenomena of confinment and hadronization as well as
spontaneous chiral symmetry breaking and the $\eta$-$\eta'$-mass difference.
","[{""version"":""v1"",""created"":""Mon, 12 Feb 2001 10:40:28 GMT""}]","2007-05-23"
"hep-th/0102060","Maria A. Lledo","R. D'Auria, S. Ferrara, M. A. Lledo","On the Embedding of Space-Time Symmetries into Simple Superalgebras","AMS LaTeX, 16 pages","Lett.Math.Phys. 57 (2001) 123-133",,"CERN-TH/2000-380","hep-th",,"  We explore the embedding of Spin groups of arbitrary dimension and signature
into simple superalgebras in the case of extended supersymmetry. The
R-symmetry, which generically is not compact, can be chosen compact for all the
cases that are congruent mod 8 to the physical conformal algebra so($D-2$,2),
$D\geq 3$. An $\rm{so}(1,1)$ grading of the superalgebra is found in all cases.
Central extensions of super translation algebras are studied in this framework.
","[{""version"":""v1"",""created"":""Mon, 12 Feb 2001 15:34:56 GMT""}]","2007-05-23"
"math/0102088","Thomas Kwok-keung Au","Thomas Kwok-keung Au","On the Saddle Point Property of Abresch-Langer curves under the Curve
  Shortening Flow","18 pages, 11 figures, AMS-LaTeX",,,,"math.AP math.DG",,"  In the study of the curve shortening flow on general closed curves, Abresch
and Langer posed a conjecture that the homothetic curves can be regarded as
saddle points between multi-folded circles and some singular curves. In other
words, these homothetic curves are the watershed between curves with a
nonsingular future and those with singular future along the flow. In this
article, we provide an affirmitive proof to this conjecture.
","[{""version"":""v1"",""created"":""Mon, 12 Feb 2001 09:14:36 GMT""},{""version"":""v2"",""created"":""Tue, 13 Feb 2001 02:06:31 GMT""}]","2009-09-25"
"math/0102089","Loday","Jean-Louis Loday, Maria O. Ronco","A duality between standard simplices and Stasheff polytopes","In french, english abridged version, 8 pages","C. R. Acad. Sci. Paris S\'er. I Math. 333 (2001), no. 2, 81--86","10.1016/S0764-4442(01)02014-6",,"math.QA math.AT math.KT",,"  We show that the family of chain modules over the standard simplices can be
equipped with an operad structure. Similarly, the family of cochain modules of
the Stasheff polytopes can be equipped with an operad structure. We first show
that these operads are Koszul dual to each other, and second that they are both
Koszul operads.
  The algebras over the standard simplices operad, called associative
trialgebras, are defined by 3 operations and 11 relations. The algebras over
the Stasheff polytopes operad, called dendriform trialgebras, are defined by 3
operations and 7 relations.
","[{""version"":""v1"",""created"":""Mon, 12 Feb 2001 09:24:58 GMT""}]","2015-06-26"
"math/0102090","Yuri G. Prokhorov","Yuri Prokhorov","A note on log canonical thresholds","10 pages, LaTex2e, several misprints are corrected","Comm. Algebra, 29(9):3961-3970, 2001",,,"math.AG",,"  We prove that the largest accumulation point of the set $\mathcal{T}_3$ of
all three-dimensional log canonical thresholds $c(X,F)$ is 5/6.
","[{""version"":""v1"",""created"":""Mon, 12 Feb 2001 15:02:07 GMT""},{""version"":""v2"",""created"":""Wed, 14 Feb 2001 12:35:03 GMT""},{""version"":""v3"",""created"":""Wed, 28 Feb 2001 16:26:25 GMT""}]","2010-05-04"
"nlin/0102014","Jan Wiersig","Jan Wiersig","Resonance zones in action space","22 pages, 19 figures",,"10.1515/zna-2001-0802",,"nlin.CD",,"  The classical and quantum mechanics of isolated, nonlinear resonances in
integrable systems with N>=2 degrees of freedom is discussed in terms of
geometry in the space of action variables. Energy surfaces and frequencies are
calculated and graphically presented for invariant tori inside and outside the
resonance zone. The quantum mechanical eigenvalues, computed in the
semiclassical WKB approximation, show a regular pattern when transformed into
the action space of the associated symmetry reduced system: eigenvalues inside
the resonance zone are arranged on N-dimensional cubic lattices, whereas those
outside are, in general, non-periodically distributed. However, N-dimensional
triclinic (skewed) lattices exist locally. Both kinds of lattices are joined
smoothly across the classical separatrix surface. The statements are
illustrated with the help of two and three coupled rotors.
","[{""version"":""v1"",""created"":""Mon, 12 Feb 2001 08:20:08 GMT""}]","2015-06-26"
