"astro-ph/0102204","Sabine Schindler","Thomas Toniazzo (University of Leeds), Sabine Schindler (Liverpool
  JMU)","Gas Dynamic Stripping and X-Ray Emission of Cluster Elliptical Galaxies","44 pages (incl. 15 figures), accepted for publication in MNRAS","Mon.Not.Roy.Astron.Soc. 325 (2001) 509","10.1046/j.1365-8711.2001.04385.x",,"astro-ph",,"  Detailed 3-D numerical simulations of an elliptical galaxy orbiting in a
gas-rich cluster of galaxies indicate that gas dynamic stripping is less
efficient than the results from previous, simpler calculations (Takeda et al.
1984; Gaetz et al. 1987) implied. This result is consistent with X-ray data for
cluster elliptical galaxies. Hydrodynamic torques and direct accretion of
orbital angular momentum can result in the formation of a cold gaseous disk,
even in a non-rotating galaxy. The gas lost by cluster galaxies via the process
of gas dynamic stripping tends to produce a colder, chemically enriched cluster
gas core. A comparison of the models with the available X-ray data of cluster
galaxies shows that the X-ray luminosity distribution of cluster galaxies may
reflect hydrodynamic stripping, but also that a purely hydrodynamic treatment
is inadequate for the cooler interstellar medium near the centre of the galaxy.
","[{""version"":""v1"",""created"":""Mon, 12 Feb 2001 16:35:47 GMT""}]","2016-08-30"
"astro-ph/0102205","Matias Zaldarriaga","Matias Zaldarriaga","Searching for fluctuations in the IGM temperature using the Lyman alpha
  forest","9 pages, 10 figures",,"10.1086/324212",,"astro-ph",,"  We propose a statistical method to search for fluctuations in the temperature
of the intergalactic medium (IGM) using the Lyman $\alpha$ forest. The power on
small scales ($\sim 25 \km/\s$) is used as a thermometer and fluctuations of
this power are constrained. The method is illustrated using Q1422+231. We see
no evidence of temperature fluctuations. We show that in a model with two
temperatures that occupy comparable fractions of the spectra, the ratio of
small scale powers is constrained to be smaller than 3.5 (corresponding to a
factor of 2.5 in temperature). We show that approximately ten quasars are
needed constrain factors of two fluctuations in small scale power power.
","[{""version"":""v1"",""created"":""Mon, 12 Feb 2001 16:55:42 GMT""}]","2009-11-06"
"astro-ph/0102206","K. D. Kuntz","K.D. Kuntz and S.L. Snowden","On the Contribution of Unresolved Galactic Stars to the Diffuse Soft
  X-ray Background","14 pages, 8 figures, accepted by ApJ",,"10.1086/321421",,"astro-ph",,"  Using stellar luminosity functions derived from ROSAT data, the contributions
of Galactic stars to the diffuse X-ray background are calculated for ROSAT PSPC
energy bands. The model follows that of Guillout et al. (1996), but uses ROSAT
rather than {\it Einstein} data to determine the intrinsic luminosity
distributions. The model adequately predicts the numbers of stellar sources
observed in deep ROSAT surveys. The contribution of unresolved stellar sources
to the ROSAT All-Sky Survey at the Galactic poles is 6.85, 4.76, and 4.91
$\times$ counts s$^{-1}$ arcmin$^{-2}$ in bands R12 (1/4 keV), R45(3/4 keV),
and R67(1.5 keV), respectively, which is equivalent to 4.66, 31.3 and 26.9
$\times10^{-14}$ ergs cm$^{-2}$ s$^{-1}$ deg$^{-2}$.
","[{""version"":""v1"",""created"":""Mon, 12 Feb 2001 17:49:57 GMT""}]","2009-11-06"
"astro-ph/0102207","Igor Moskalenko","I. V. Moskalenko, E. R. Christian, A. A. Moiseev, J. F. Ormes
  (NASA/GSFC), A. W. Strong (MPE, Garching)","Antiprotons below 200 MeV in the interstellar medium: perspectives for
  observing exotic matter signatures","4 pages, latex, 4 figures. Talk given by I. Moskalenko at the COSPAR
  Colloquium ``The Outer Heliosphere: The Next Frontiers'' (Potsdam, 24-28 July
  2000). To be published in COSPAR Colloquia Series, eds. H. J. Fahr et al","Proc. 11th COSPAR Colloquium, ``The Outer Heliosphere: The Next
  Frontiers'', eds. K. Scherer et al. (Amsterdam: Pergamon), pp.195-198 (2001)",,,"astro-ph",,"  Most cosmic ray antiprotons observed near the Earth are secondaries produced
in collisions of energetic cosmic ray (CR) particles with interstellar gas. The
spectrum of secondary antiprotons is expected to peak at ~2 GeV and decrease
sharply at lower energies. This leaves a low energy window in which to look for
signatures of exotic processes such as evaporation of primordial black holes or
dark matter annihilation. In the inner heliosphere, however, modulation of CRs
by the solar wind makes analysis difficult. Detecting these antiprotons outside
the heliosphere on an interstellar probe removes most of the complications of
modulation. We present a new calculation of the expected secondary antiproton
flux (the background) as well as a preliminary design of a light-weight,
low-power instrument for the interstellar probe to make such measurements.
","[{""version"":""v1"",""created"":""Mon, 12 Feb 2001 18:33:17 GMT""}]","2007-05-23"
"astro-ph/0102208","Marcin Sawicki","Marcin Sawicki","The Ultraviolet-Far Infrared Energy Budget of the Gravitationally Lensed
  Lyman Break Galaxy MS1512-cB58","To appear in the Astronomical Journal",,"10.1086/320402",,"astro-ph",,"  A 2-hour service-mode SCUBA observation of the gravitationally-lensed Lyman
break galaxy MS1512-cB58 resulted in a 3 sigma upper limit of 3.9 mJy at 850um.
A comparison of this upper limit with values expected from rest-UV/optical
measurements of extiction suggests that dust temperature (T_d) and/or
emissivity index (beta) in cB58 may be substantially higher than is seen in
local galaxies, or that the attenuation curve in cB58 may be even gentler than
the already quite mild SMC dust law. If dust temperature T_d and emissivity
index beta in cB58 are similar to those seen in local IRAS-seleceted galaxies,
then cB58's dust mass is M_d <~ 10^7.7 Msun and its star formation rate is SFR
<~ 10 Msun/yr (for q_0=0.1, H_0=75 km/s/Mpc). This SFR upper limit is lower
than the star formation rate measured from Halpha, thus giving further support
to the notion that (T_d, beta) values in cB58 are higher than those seen in
local galaxies. It thus appears that our understanding of dust in this
extensively studied Lyman break galaxy is poor, and observations at other
wavelentghs are needed to better understand dust at high redshift. Such
observations can be provided by the upcoming SIRTF mission for which cB58's
expected flux densities are calculated.
","[{""version"":""v1"",""created"":""Mon, 12 Feb 2001 18:25:59 GMT""}]","2009-11-06"
"astro-ph/0102209","Hyong Lee","H. C. Lee (1), R. Misra (1), R. E. Taam (1) ((1) Northwestern
  University)","A Compton Up-scattering Model for Soft Lags in the Lower Kilohertz QPO
  in 4U1608-52","4 pages, 2 figures",,"10.1086/319171",,"astro-ph",,"  An empirical Compton up-scattering model is described which reproduces both
the fractional amplitude (RMS) vs. energy and the soft time lags in the 830 Hz
QPO observed in 4U1608-52 on Mar. 3, 1996. A combination of two coherent
variations in the coronal and soft photon temperatures (with their relative
contributions determined by enforcing energy conservation) gives rise to the
QPO's energy dependent characteristics. All input parameters to the model, save
a characteristic plasma size and the fraction of Comptonized photons impinging
on the soft photon source, are derived from the time-averaged photon energy
spectrum of the same observation. Fits to the fractional RMS and phase lag data
for this kilohertz QPO imply that the spatial extent of the plasma is in the
range from 4 to 15 km.
","[{""version"":""v1"",""created"":""Mon, 12 Feb 2001 18:42:13 GMT""}]","2009-11-06"
"astro-ph/0102210","Joerg Sanner","J. Sanner, M. Geffert","The IMF of open star clusters with Tycho-2","14 pages, 10 figures. Accepted for publication in Astronomy &
  Astrophysics",,"10.1051/0004-6361:20010230",,"astro-ph",,"  We studied the fields of nine nearby open star clusters based on the Tycho-2
catalogue. The clusters are: Blanco 1, Stock 2, the alpha Per cluster, the
Pleiades, NGC 2451, IC 2391, Praesepe, IC 2602, and NGC 7092. We determined
membership probabilities for the stars in the cluster fields from the stellar
proper motions and used the Tycho-2 photometry to compute the initial mass
function (IMF) of the clusters from the main sequence turn-off point down to
approx. 1 M_sun. We found IMF slopes ranging from Gamma=-0.69 down to
Gamma=-2.27 (when the Salpeter (1955) value would be Gamma=-1.35). We also
studied the membership of individual stars of special astrophysical interest.
In some cases previous results had to be revised. As a by-product, we
investigated some general properties of the Tycho-2 catalogue; we confirmed
that the Tycho-2 proper motions show only marginal deviations from the
Hipparcos catalogue. On the other hand, in some regions the completeness of the
catalogue seems to decrease at magnitudes brighter than claimed by Hog et al.
(2000).
","[{""version"":""v1"",""created"":""Mon, 12 Feb 2001 18:47:34 GMT""}]","2009-11-06"
"astro-ph/0102211","Roger A. Chevalier","Roger A. Chevalier","Supernovae in Molecular Clouds","10 pages, 2 figures, review for proceedings of the Maryland
  conference on Young Supernova Remnants",,"10.1063/1.1377080",,"astro-ph",,"  Supernovae are expected to occur near the molecular material in which the
massive progenitor star was born, except in cases where the photoionizing
radiation and winds from the progenitor star and its neighbors have cleared out
a region. The clumpy structure in molecular clouds is crucial for the remnant
evolution; the supernova shock front can become radiative in the interclump
medium and the radiative shell then collides with molecular clumps. The
interaction is relevant to a number of phenomena: the hydrodynamics of a
magnetically supported dense shell interacting with molecular clumps; the
molecular emission from shock waves, including the production of the OH 1720
MHz maser line; the relativistic particle emission, including radio synchrotron
and gamma-ray emission, from the dense radiative shell; and the possible
gravitational instability of a compressed clump.
","[{""version"":""v1"",""created"":""Mon, 12 Feb 2001 19:35:06 GMT""}]","2009-11-06"
"astro-ph/0102212","Roger A. Chevalier","Roger A. Chevalier","Theoretical Implications of the Gamma-Ray Burst - Supernova Connection","6 pages, review for proceedings of 2nd Rome Workshop on Gamma-Ray
  Bursts in the Afterglow Era",,"10.1007/10853853_37",,"astro-ph",,"  Although observations of circumstellar shock interactions around supernovae
are generally consistent with a 1/r**2 density profile wind surrounding the
progenitor star, this is not true for GRB (gamma-ray burst) afterglows.
However, GRB 991208 and GRB 000301C may be consistent with wind interaction if
the injection particle spectrum is a broken power law. Circumstellar dust echos
can place constraints on supernova and GRB progenitors, but have been clearly
observed only around SN 1987A. Excess emission observed in two GRB afterglows
is more likely to have a supernova origin. An interstellar dust echo, causing
the light curve to flatten out, is a possibility for GRB afterglows, but is not
likely to be observable.
","[{""version"":""v1"",""created"":""Mon, 12 Feb 2001 20:51:58 GMT""}]","2009-11-06"
"astro-ph/0102213","Lori M. Lubin","Allan Sandage (OCIW), Lori M. Lubin (Caltech, JHU)","The Tolman Surface Brightness Test for the Reality of the Expansion. I.
  Calibration of the Necessary Local Parameters","34 pages, 4 figures; accepted for publication in Astronomical Journal","Astron.J.121:2271-2288,2001","10.1086/320394",,"astro-ph",,"  The extensive CCD photometry by Postman & Lauer (1995, ApJ, 440, 28) in the
Cape/Cousins R photometric band for first ranked cluster elliptical and S0
galaxies in 118 low redshift clusters is analyzed for the correlations between
average surface brightness, linear radius, and absolute magnitude. The purpose
is to calibrate the correlations between these three parameters in the limit of
zero redshift. These local correlations provide the comparisons to be made in
Paper IV with the sample of early-type galaxies at high redshift in search of
the Tolman surface brightness signal of (1 + z)^4 if the expansion is real.
Surface brightness averages are calculated at various metric radii in each
galaxy in the sample. The definition of such radii by Petrosian (1976, ApJ,
209, L1) uses ratios of observed surface photometric data. The observed surface
brightnesses are listed for 118 first ranked cluster galaxies at Petrosian eta
radii of 1.0, 1.3, 1.5, 1.7, 2.0, and 2.5 mag. The three local diagnostic
correlation diagrams are defined and discussed. We review the Tolman test and
show that, although recipes from the standard cosmological model that already
have the Tolman signal incorporated are required to calculate linear radii and
absolute magnitudes from the observed data, the test is nevertheless free from
the hermeneutical circularity dilemma occasionally claimed in the literature.
The reasons are the observed mean surface brightness (1) is independent of any
assumptions of cosmological model, (2) does not depend on the existence of a
Tolman signal because it is calculated directly from the data using only
angular radii and apparent magnitudes, and (3) can be used to search for the
Tolman signal because it carries the bulk of that signal.
","[{""version"":""v1"",""created"":""Mon, 12 Feb 2001 21:29:11 GMT""}]","2009-04-13"
"astro-ph/0102214","Lori M. Lubin","Lori M. Lubin (Caltech, JHU), Allan Sandage (OCIW)","The Tolman Surface Brightness Test for the Reality of the Expansion. II.
  The Effect of the Point-Spread Function and Galaxy Ellipticity on the Derived
  Photometric Parameters","15 pages, 9 figures; accepted for publication in Astronomical Journal","Astron.J.121:2289-2300,2001","10.1086/320401",,"astro-ph",,"  To complete the Tolman surface brightness test on the reality of the
expansion of the Universe, we need to measure accurately the surface brightness
profiles of the high-redshift galaxy sample. We, therefore, investigate the
effects of various sizes of point-spread-functions composed of telescope
diffraction, CCD pixel resolutions, and ground-based seeing on the measurements
of mean surface brightness. We have done the calculations using two synthetic
galaxies of effective radii of 0.70"" and 0.25"" with point-spread functions of
0.1, 0.3, and 0.9 arcseconds. We have also compared actual observations of
three high-redshift galaxies in the cluster Cl 1324 + 3011 (z = 0.76) made both
with the Keck telescopes in seeing of about 0.9"" and with HST which has a PSF
that is approximately ten times smaller. The conclusion is that HST data can be
used as far into the galaxy image as a Petrosian metric radius of eta = 1.3
magnitudes, whereas the ground-based data will have systematic errors of up to
2.9 magnitudes in the mean surface brightness at eta values of less than 2.2
magnitudes. In the final section, we compare the differences in derived average
surface brightness for nearly circular galaxy images compared with highly
flattened images. The comparison is made by using the two reduction procedures
of (1) integrating the profile curves using circular apertures, and (2)
approximating an ``equivalent circular'' galaxy that is highly elongated by
using an ``effective'' radius of sqrt{ab}, where a and b are the semi-major and
semi-minor axis, respectively, of the best-fitting ellipse. The conclusion is
that the two methods of reduction give nearly identical results and that either
method can be used to analyze the low and high-redshift galaxy samples used in
the Tolman test.
","[{""version"":""v1"",""created"":""Mon, 12 Feb 2001 21:43:23 GMT""}]","2009-04-13"
"astro-ph/0102215","Liese van Zee","Elizabeth J. Barton and Liese van Zee (HIA/NRC)","Possible Local Spiral Counterparts to Compact Blue Galaxies at
  Intermediate Redshift","5 pages, uses emulateapj5 and psfig. To appear in ApJL",,"10.1086/319495",,"astro-ph",,"  We identify nearby disk galaxies with optical structural parameters similar
to those of intermediate-redshift compact blue galaxies. By comparing HI and
optical emission-line widths, we show that the optical widths substantially
underestimate the true kinematic widths of the local galaxies. By analogy,
optical emission-line widths may underrepresent the masses of intermediate-z
compact objects. For the nearby galaxies, the compact blue morphology is the
result of tidally-triggered central star formation: we argue that interactions
and minor mergers may cause apparently compact morphology at higher redshift.
","[{""version"":""v1"",""created"":""Mon, 12 Feb 2001 22:26:34 GMT""}]","2009-11-06"
"astro-ph/0102216","Zeljko Ivezic","T.G. Knauer, Z. Ivezic and G.R. Knapp","Analysis of Stars Common to the IRAS and HIPPARCOS Surveys","Accepted to ApJ, 14 pages, 5 figures",,"10.1086/320584",,"astro-ph",,"  For about 11,000 stars observed in the HIPPARCOS Survey and detected by IRAS
we calculate bolometric luminosities by integrating their spectral energy
distributions from the B band to far-IR wavelengths. We present an analysis of
the dependence of dust emission on spectral type and correlations between the
luminosity and dust emission for about 1000 sources with the best data
(parallax error less than 30%, error in luminosity of about 50% or better).
This subsample includes stars of all spectral types and is dominated by K and M
giants.
  We use the IRAS [25]-[12] color to select stars with emission from
circumstellar dust and show that they are found throughout the
Hertzsprung-Russell diagram, including on the main sequence. Clear evidence is
found that M giants with dust emission have luminosities about 3 times larger
(about 3000 Lsun) than their counterparts without dust, and that mass loss on
the asymptotic giant branch for both M and C stars requires a minimum
luminosity of order 2000 Lsun. Above this threshold the mass-loss rate seems to
be independent of, or only weakly dependent on, luminosity. We also show that
the mass-loss rate for these stars is larger than the core mass growth rate,
indicating that their evolution is dominated by mass loss.
","[{""version"":""v1"",""created"":""Mon, 12 Feb 2001 23:01:16 GMT""}]","2009-11-06"
"astro-ph/0102217","Zeljko Ivezic","M. Marengo, Z. Ivezic and G.R. Knapp","100-year Mass Loss Modulations on the Asymptotic Giant Branch","Accepted to MNRAS, 14 pages, 11 figures","Mon.Not.Roy.Astron.Soc. 324 (2001) 1117","10.1046/j.1365-8711.2001.04399.x",,"astro-ph",,"  We analyze the differences in infrared circumstellar dust emission between
oxygen rich Mira and non-Mira stars, and find that they are statistically
significant. In particular, we find that these stars segregate in the K-[12]
vs. [12]-[25] color-color diagram, and have distinct properties of the IRAS LRS
spectra, including the peak position of the silicate emission feature. We show
that the infrared emission from the majority of non-Mira stars cannot be
explained within the context of standard steady-state outflow models. The
models can be altered to fit the data for non-Mira stars by postulating
non-standard optical properties for silicate grains, or by assuming that the
dust temperature at the inner envelope radius is significantly lower (300-400
K) than typical silicate grain condensation temperatures (800-1000 K). We argue
that the latter is more probable and provide detailed model fits to the IRAS
LRS spectra for 342 stars. These fits imply that 2/3 of non-Mira stars and 1/3
of Mira stars do not have hot dust ($>$ 500 K) in their envelopes. The absence
of hot dust can be interpreted as a recent (order of 100 yr) decrease in the
mass-loss rate. The distribution of best-fit model parameters agrees with this
interpretation and strongly suggests that the mass loss resumes on similar time
scales. Such a possibility appears to be supported by a number of spatially
resolved observations (e.g. recent HST images of the multiple shells in the Egg
Nebula) and is consistent with new dynamical models for mass loss on the
Asymptotic Giant Branch.
","[{""version"":""v1"",""created"":""Mon, 12 Feb 2001 23:01:27 GMT""}]","2009-11-06"
"astro-ph/0102218","Adrian Melott","Scott W. Chambers and Adrian L. Melott (University of Kansas), and
  Christopher J. Miller (University of Maine)","The Nearest Neighbor Alignment of Cluster X-ray Isophotes","Moderate revisions, including additional test for systematic error.
  Conclusions unchanged. Accepted for publication in ApJ",,"10.1086/324278",,"astro-ph",,"  We examine the orientations of rich galaxy cluster X-ray isophotes with
respect to their rich nearest neighbors using existing samples of Abell cluster
position angles measured from {\it Einstein} and {\it ROSAT} observations. We
study a merged subset of these samples using updated and improved positions and
redshifts for Abell/ACO clusters. We find high confidence for alignment, which
increases as nearest neighbor distance is restricted. We conclude that there is
a strong alignment signal in all this data, consistent with gravitational
instability acting on Gaussian perturbations.
","[{""version"":""v1"",""created"":""Mon, 12 Feb 2001 23:28:27 GMT""},{""version"":""v2"",""created"":""Mon, 10 Sep 2001 13:52:48 GMT""}]","2009-11-06"
"astro-ph/0102219","James R. Graham","James R. Graham, Richard R. Treffers","An Infrared Camera for Leuschner Observatory and the Berkeley
  Undergraduate Astronomy Lab","13 pages, 17 figures. Submitted to Publications of the Astronomical
  Society of the Pacific: 2001 Jan 10, Accepted 2001 Jan 19",,"10.1086/320284",,"astro-ph",,"  We describe the design, fabrication, and operation of an infrared camera
which is in use at the 30-inch telescope of the Leuschner Observatory. The
camera is based on a Rockwell PICNIC 256 x 256 pixel HgCdTe array, which is
sensitive from 0.9-2.5 micron. The primary purpose of this telescope is for
undergraduate instruction. The cost of the camera has been minimized by using
commercial parts whereever practical. The camera optics are based on a modified
Offner relay which forms a cold pupil where stray thermal radiation from the
telescope is baffled. A cold, six-position filter wheel is driven by a
cryogenic stepper motor, thus avoiding any mechanical feed throughs. The array
control and readout electronics are based on standard PC cards; the only custom
component is a simple interface card which buffers the clocks and amplifies the
analog signals from the array.
","[{""version"":""v1"",""created"":""Tue, 13 Feb 2001 00:26:05 GMT""}]","2009-11-06"
"astro-ph/0102220","Roya","Sabino Matarrese and Roya Mohayaee","The growth of structure in the intergalactic medium","26 pages, 6 figures, MNRAS in press (accepted version)","Mon.Not.Roy.Astron.Soc. 329 (2002) 37-60","10.1046/j.1365-8711.2002.04944.x",,"astro-ph cond-mat gr-qc",,"  A {\it stochastic adhesion} model is introduced, with the purpose of
describing the formation and evolution of mildly nonlinear structures, such as
sheets and filaments, in the intergalactic medium (IGM), after hydrogen
reionization. The model is based on replacing the overall force acting on the
baryon fluid -- as it results from the composition of local gravity, pressure
gradients and Hubble drag -- by a mock external force, self-consistently
calculated from first-order perturbation theory. A small kinematic viscosity
term prevents shell-crossing on small scales (which arises because of the
approximate treatment of pressure gradients). The emerging scheme is an
extension of the well-known adhesion approximation for the dark matter
dynamics, from which it only differs by the presence of a small-scale `random'
force, characterizing the IGM. Our algorithm is the ideal tool to obtain the
skeleton of the IGM distribution, which is responsible for the structure
observed in the low-column density Ly$\alpha$ forest in the absorption spectra
of distant quasars.
","[{""version"":""v1"",""created"":""Tue, 13 Feb 2001 01:07:04 GMT""},{""version"":""v2"",""created"":""Tue, 20 Feb 2001 19:57:17 GMT""},{""version"":""v3"",""created"":""Sat, 8 Sep 2001 20:21:26 GMT""}]","2009-11-06"
"astro-ph/0102221","Yutaka Fujita","Yutaka Fujita","Heating of X-Ray Hot Gas in Groups by Blast Waves","9 pages, 2 figures. To be published in ApJ Letters",,"10.1086/319490",,"astro-ph",,"  In order to find the conditions which determine whether X-Ray hot gas in
galaxy groups (intragroup gas; IGG) is heated externally or internally, we
investigate the evolution of blast waves in galaxy groups growing on a
hierarchical clustering scenario. We find that the blast waves driven by
quasars are confined in groups and heat the IGG internally at z<~ 1. However,
at z>~ 1, they expel the IGG from groups; the expelled gas may fall back into
the groups later as externally heated gas. Moreover, this may explain the
observed low metal abundance of IGG. For blast waves driven by strong
starbursts, the shift of the fate of blast waves occurs at z~ 3. On the other
hand, although blast waves driven by weak starbursts do not expel IGG from
groups, the heating efficiency decreases at z>~ 3 because of radiative cooling.
It will be useful to compare these results with XMM-Newton observations.
","[{""version"":""v1"",""created"":""Tue, 13 Feb 2001 03:41:38 GMT""}]","2009-11-06"
