"cond-mat/0102215","C. U. Jung","C. U. Jung, Min-Seok Park, W. N. Kang, Mun-Seog Kim, S. Y. Lee, and
  Sung-Ik Lee","Temperature- and magnetic-field-dependent resistivity of MgB2 sintered
  at high temperature and high pressure condition","2 pages, 3 figures. Accepted by PhysicaC","Physica C 353, 162 (2001).","10.1016/S0921-4534(01)00399-9",,"cond-mat.supr-con",,"  We report the temperature- and magnetic-field-dependent resistivity of MgB2
sintered at high temperature and high pressure condition. The superconducting
transition width for the resistivity measurement was about 0.4 K, and the
low-field magnetization showed a sharp superconducting transition with a
transition width of about 1 K. The resistivity in the normal state roughly
followed T^2 behavior with smaller residual resistivity ratio (RRR) of 3 over
broad temperature region above 100 K rather than reported T^3 behavior with
larger RRR value of ~ 20 in the samples made at lower pressures. Also, the
resistivity did not change appreciably with the applied magnetic field, which
was different from previous report. These differences were discussed with the
microscopic and structural change due to the high-pressure sintering.
","[{""version"":""v1"",""created"":""Mon, 12 Feb 2001 19:38:44 GMT""},{""version"":""v2"",""created"":""Tue, 13 Feb 2001 13:29:10 GMT""},{""version"":""v3"",""created"":""Wed, 14 Feb 2001 08:53:41 GMT""},{""version"":""v4"",""created"":""Mon, 9 Apr 2001 14:12:18 GMT""}]","2009-11-07"
"cond-mat/0102216","Alex Gurevich","D.C. Larbalestier, M.O. Rikel, L.D. Cooley, A.A. Polyanskii, J.Y.
  Jiang, S. Patnaik, X.Y. Cai, D.M. Feldmann, A. Gurevich, A.A. Squitieri, M.T.
  Naus, C.B. Eom, E.E. Hellstrom, R.J. Cava, K.A. Regan, N. Rogado, M.A.
  Hayward, T. He, J.S. Slusky, P. Khalifah, K. Inumaru, M. Haas","Strongly linked current flow in polycrystalline forms of the new
  superconductor MgB2",,,"10.1038/35065559",,"cond-mat.supr-con",,"  The discovery of superconductivity at 39 K in MgB2[1] raises many issues. One
of the central questions is whether this new superconductor resembles a
high-temperature-cuprate superconductor or a low-temperature metallic
superconductor in terms of its current carrying characteristics in applied
magnetic fields. In spite of the very high transition temperatures of the
cuprate superconductors, their performance in magnetic fields has several
drawbacks[2]. Their large anisotropy restricts high bulk current densities to
much less than the full magnetic field-temperature (H-T) space over which
superconductivity is found. Further, weak coupling across grain boundaries
makes transport current densities in untextured polycrystalline forms low and
strongly magnetic field sensitive[3,4]. These studies of MgB2 address both
issues. In spite of the multi-phase, untextured, nano-scale sub-divided nature
of our samples, supercurrents flow throughout without the strong sensitivity to
weak magnetic fields characteristic of Josephson-coupled grains[3].
Magnetization measurements over nearly all of the superconducting H-T plane
show good temperature scaling of the flux pinning force, suggestive of a
current density determined by flux pinning. At least two length scales are
suggested by the magnetization and magneto optical (MO) analysis but the cause
of this seems to be phase inhomogeneity, porosity, and minority insulating
phase such as MgO rather than by weakly coupled grain boundaries. Our results
suggest that polycrystalline ceramics of this new class of superconductor will
not be compromised by the weak link problems of the high temperature
superconductors, a conclusion with enormous significance for applications if
higher temperature analogs of this compound can be discovered.
","[{""version"":""v1"",""created"":""Mon, 12 Feb 2001 22:49:19 GMT""}]","2009-11-07"
"cond-mat/0102217","Gemunu H. Gunaratne","Gemunu H. Gunaratne","Using Nonlinear Response to Estimate the Strength of an Elastic Network","4 pages, 4 figures",,"10.1103/PhysRevE.66.061904",,"cond-mat.soft cond-mat.dis-nn q-bio",,"  Disordered networks of fragile elastic elements have been proposed as a model
of inner porous regions of large bones [Gunaratne et.al., cond-mat/0009221,
http://xyz.lanl.gov]. It is shown that the ratio $\Gamma$ of responses of such
a network to static and periodic strain can be used to estimate its ultimate
(or breaking) stress. Since bone fracture in older adults results from the
weakening of porous bone, we discuss the possibility of using $\Gamma$ as a
non-invasive diagnostic of osteoporotic bone.
","[{""version"":""v1"",""created"":""Mon, 12 Feb 2001 22:55:00 GMT""}]","2013-05-29"
"cond-mat/0102218","David Carpentier","David Carpentier, Leon Balents","Field theory for generalized Shastry-Sutherland models","Best viewed as a Postscript file (uses psfrag)","Phys. Rev. B 65, 024427 (2002)","10.1103/PhysRevB.65.024427",,"cond-mat",,"  We consider the bosonic dimer representation for Generalized
Shastry-Sutherland models that have the same symmetries as the original
Shastry-Sutherland model and preserve the exact dimer eigenstate. Various
phases with differing types of magnetic order are found within mean-field
theory for the corresponding low-energy effective dimer field theory.
Transitions are allowed between any of these mean-field phases, which are dimer
bose condensates, and with the dimer phase, which is the dimer bose vacuum. The
Neel state, absent from this mean-field study, is described as a bosonic Mott
insulator induced by the coupling to the underlying lattice. Moreover, dimer
bose condensates with local Neel order are found to be unstable to spiral
states. Instead of a direct phase transition between the dimer and the Neel
phases, we propose an intermediate weakly incommensurate spin-density wave
(WISDW) phase. The stability of the mean-field transitions is studied by
renormalization techniques in d=2, the upper critical dimension. While the
transition from the Neel phase is found to be stable, the transition point from
the dimer phase is not perturbatively accessible. We argue that the latter
renormalization results point to the possibility of an intermediate phase of a
different kind.
","[{""version"":""v1"",""created"":""Mon, 12 Feb 2001 23:01:54 GMT""}]","2009-11-07"
"cond-mat/0102219","Marina Hruska","M. Hruska, B. Spivak","Conductivity of the classical two-dimensional electron gas","Revtex, 3 pages",,"10.1103/PhysRevB.65.033315",,"cond-mat.str-el",,"  We discuss the applicability of the Boltzmann equation to the classical
two-dimensional electron gas. We show that in the presence of both the
electron-impurity and electron-electron scattering the Boltzmann equation can
be inapplicable and the correct result for conductivity can be different from
the one obtained from the kinetic equation by a logarithmically large factor.
","[{""version"":""v1"",""created"":""Mon, 12 Feb 2001 23:09:16 GMT""}]","2009-11-07"
"cond-mat/0102220","Adriaan A. Louis","A.A. Louis (Cambridge U)","Effective potentials for polymers and colloids: Beyond the van der Waals
  picture of fluids?","16 pages, 12 figures, mini review submitted to Phil. Trans Roy. Soc.
  A; uses \documentclass{rspublic} -- postscript figure problem corrected in
  new version","Phil. Trans. Roy. Soc. A 359, 939 (2001)","10.1098/rsta.2000.0804",,"cond-mat.soft cond-mat.stat-mech",,"  This contribution briefly reviews some recent work demonstrating the partial
breakdown of the colloidal fluid <--> atomic fluid analogy. The success of
liquid state theory for atomic fluids stems in part from the van der Waals
picture, where steric interactions dominate the structure, and attractive
interactions can be added as a perturbation. For complex fluids described by
effective potentials, this picture may break down. In the first example
discussed, depletion potentials in non-additive hard-sphere mixtures are shown
to be surprisingly complex, leading to fluid structure and fluid-solid
transitions dominated by properties of the attractive potentials instead of by
the hard-cores. Many colloidal suspensions, and possibly globular proteins,
fall into this {\em energetic fluid} category. In the second example, the
coarse-graining of polymers leads to soft-core effective potentials and
associated {\em mean field fluid} behaviour distinguished by a breakdown of the
virial expansion, an equation of state that is nevertheless nearly linear in
density, and correlation functions well described by the random phase
approximation.
","[{""version"":""v1"",""created"":""Tue, 13 Feb 2001 00:00:17 GMT""},{""version"":""v2"",""created"":""Tue, 13 Feb 2001 10:54:14 GMT""}]","2009-11-07"
"cond-mat/0102221","Wei Bao","Wei Bao, P.G. Pagliuso, J.L. Sarrao, J.D. Thompson, Z. Fisk, and J.W.
  Lynn","Magnetic Structure of Heavy Fermion Ce2RhIn8","4 pages, 3 figures, 1 table","Phys. Rev. B vol. 64, 020401(R) (2001)","10.1103/PhysRevB.64.020401",,"cond-mat.str-el cond-mat.supr-con",,"  Magnetic structure of the heavy fermion antiferromagnet Ce2RhIn8 is
determined using neutron diffraction.
","[{""version"":""v1"",""created"":""Tue, 13 Feb 2001 00:10:13 GMT""},{""version"":""v2"",""created"":""Fri, 2 Mar 2001 20:13:42 GMT""}]","2007-05-23"
"cond-mat/0102222","Subir Sachdev","C. H. Chung, J. B. Marston, and Subir Sachdev","Quantum Phases of the Shastry-Sutherland Antiferromagnet","8 pages, 8 figures; (v2) added new appendix and references","Physical Review B 64, 134407 (2001)","10.1103/PhysRevB.64.134407",,"cond-mat.str-el cond-mat.supr-con",,"  We study possible paramagnetic phases of antiferromagnets on the
Shastry-Sutherland lattice by a gauge-theoretic analysis of fluctuations in a
theory with Sp(2N) symmetry. In addition to the familiar dimer phase, we find a
confining phase with plaquette order, and a topologically ordered phase with
deconfined S=1/2 spinons and helical spin correlations. The deconfined phase is
contiguous to the dimer phase, and in a regime of couplings close to those
found in the insulator SrCu2(BO3)2. We suggest that a superconductor obtained
by doping this insulator with mobile charge carriers will be an attractive
candidate for observing the anomalous magnetic flux properties associated with
topological order.
","[{""version"":""v1"",""created"":""Tue, 13 Feb 2001 13:56:54 GMT""},{""version"":""v2"",""created"":""Sat, 10 Mar 2001 01:22:02 GMT""}]","2007-05-23"
"cond-mat/0102223","Masahito Mochizuki","Masahito Mochizuki and Masatoshi Imada","Magnetic and Orbital States and Their Phase Transition of the
  Perovskite-Type Ti Oxides: Strong Coupling Approach","13 pages, 15 figures","J. Phys. Soc. Jpn. 70 (2001) 1777","10.1143/JPSJ.70.1777",,"cond-mat.str-el cond-mat.supr-con",,"  The properties and mechanism of the magnetic phase transition of the
perovskite-type Ti oxides, which is driven by the Ti-O-Ti bond angle
distortion, are studied theoretically by using the effective spin and
pseudospin Hamiltonian with strong Coulomb repulsion. It is shown that the
A-type antiferromagnetic (AFM(A)) to ferromagnetic (FM) phase transition occurs
as the Ti-O-Ti bond angle is decreased. Through this phase transition, the
orbital state changes only little whereas the spin-exchange coupling along the
c-axis is expected to change from positive to negative nearly continuously and
approaches zero at the phase boundary. The resultant strong two-dimensionality
in the spin coupling causes rapid suppression of the critical temperature, as
observed experimentally. It may induce large quantum fluctuations in this
region.
","[{""version"":""v1"",""created"":""Tue, 13 Feb 2001 04:55:38 GMT""}]","2007-05-23"
"cond-mat/0102224","Wen-Fa Lu","Wen-Fa Lu and Chul Koo Kim","Phase Diagram of a Two-Dimensional Neutral Classical Coulomb Gas from a
  Non-perturbative sine-Gordon Expansion","7 pages, 1 figure (EPS), Revtex",,,,"cond-mat",,"  Within the sine-Gordon formalism of a two-dimensional neutral classical
Coulomb gas, a convergent expansion with non-perturbative nature is performed
to calculate the thermodynamic potential and construct the phase diagram. It is
shown that truncation at the first order yields the Gaussian approximation. The
second- and third-order corrections are analyzed for the case of small fugacity
and are shown that they substantially improve the Gaussian-approximation phase
diagram. In particular, these corrections introduce a new conducting phase and
make the insulator-conductor coexistence phase end at the conducting phase. The
latter result is in agreement with the prediction made by generalized
renormalization-group calculations.
","[{""version"":""v1"",""created"":""Tue, 13 Feb 2001 07:01:55 GMT""}]","2007-05-23"
"cond-mat/0102225","Frederic Restagno","F. Restagno, J. Crassous, E. Charlaix, M. Monchanin","A new capacitive sensor for displacement measurement in a surface force
  apparatus","7 pages, 8 figures","Meas. Sci. Tech., vol 12, p:16-22, (2001)","10.1088/0957-0233/12/1/302",,"cond-mat.soft cond-mat.dis-nn",,"  We present a new capacitive sensor for displacement measurement in a Surface
Forces Apparatus (SFA) which allows dynamical measurements in the range of
0-100 Hz. This sensor measures the relative displacement between two
macroscopic opaque surfaces over periods of time ranging from milliseconds to
in principle an indefinite period, at a very low price and down to atomic
resolution. It consists of a plane capacitor, a high frequency oscillator, and
a high sensitivity frequency to voltage conversion. We use this sensor to study
the nanorheological properties of dodecane confined between glass surfaces.
","[{""version"":""v1"",""created"":""Tue, 13 Feb 2001 09:01:48 GMT""}]","2009-11-07"
"cond-mat/0102226","Peter Johansson","Peter Johansson, S. Peter Apell, and D. R. Penn","Theory of a magnetic microscope with nanometer resolution","17 pages, 8 figures","Phys. Rev. B 64, 054411 (2001).","10.1103/PhysRevB.64.054411",,"cond-mat",,"  We propose a theory for a type of apertureless scanning near field microscopy
that is intended to allow the measurement of magnetism on a nanometer length
scale. A scanning probe, for example a scanning tunneling microscope (STM) tip,
is used to scan a magnetic substrate while a laser is focused on it. The
electric field between the tip and substrate is enhanced in such a way that the
circular polarization due to the Kerr effect, which is normally of order 0.1%
is increased by up to two orders of magnitude for the case of a Ag or W tip and
an Fe sample. Apart from this there is a large background of circular
polarization which is non-magnetic in origin. This circular polarization is
produced by light scattered from the STM tip and substrate. A detailed retarded
calculation for this light-in-light-out experiment is presented.
","[{""version"":""v1"",""created"":""Tue, 13 Feb 2001 09:46:31 GMT""}]","2007-05-23"
"cond-mat/0102227","Alessandra Lanzara","A. Lanzara, P. V. Bogdanov, X. J. Zhou, S. A. Kellar, D. L. Feng, E.
  D. Lu, T. Yoshida, H. Eisaki, A. Fujimori, K. Kishio, J. -I. Shimoyama, T.
  Noda, S. Uchida, Z. Hussain, and Z.-X. Shen","Evidence for ubiquitous strong electron-phonon coupling in
  high-temperature superconductors","14 pages, 4 figures","Nature 412, 510-514 (2001)","10.1038/35087518",,"cond-mat.supr-con cond-mat.str-el",,"  Coupling between electrons and phonons (lattice vibrations) drives the
formation of the electron pairs responsible for conventional superconductivity.
The lack of direct evidence for electron-phonon coupling in the electron
dynamics of the high transition temperature superconductors has driven an
intensive search for an alternative mechanism. A coupling of an electron with a
phonon would result in an abrupt change of its velocity and scattering rate
near the phonon energy. Here we use angle resolved photoemission spectroscopy
to probe electron dynamics -velocity and scattering rate- for three different
families of copper oxide superconductors. We see in all of these materials an
abrupt change of electron velocity at 50-80meV, which we cannot explain by any
known process other than to invoke coupling with the phonons associated with
the movement of the oxygen atoms. This suggests that electron-phonon coupling
strongly influences the electron dynamics in the high-temperature
superconductors, and must therefore be included in any microscopic theory of
superconductivity.
","[{""version"":""v1"",""created"":""Tue, 13 Feb 2001 10:44:31 GMT""},{""version"":""v2"",""created"":""Tue, 10 Jul 2001 19:22:26 GMT""}]","2009-11-07"
"cond-mat/0102228","I. Shlimak","I. Shlimak, V.I. Safarov, I.D. Vagner","Isotopically engineered silicon/silicon-germanium nanostructures as
  basic elements for a nuclear spin quantum computer","11 pages, 2 figures, PostScript, GS view",,"10.1088/0953-8984/13/26/319",,"cond-mat.mes-hall",,"  The idea of quantum computation is the most promising recent developments in
the high-tech domain, while experimental realization of a quantum computer
poses a formidable challenge. Among the proposed models especially attractive
are semiconductor based nuclear spin quantum computer's (S-NSQC), where nuclear
spins are used as quantum bistable elements, ''qubits'', coupled to the
electron spin and orbital dynamics. We propose here a scheme for implementation
of basic elements for S-NSQC's which are realizable within achievements of the
modern nanotechnology. These elements are expected to be based on a
nuclear-spin-controlled isotopically engineered Si/SiGe heterojunction, because
in these semiconductors one can vary the abundance of nuclear spins by
engineering the isotopic composition. A specific device is suggested, which
allows one to model the processes of recording, reading and information
transfer on a quantum level using the technique of electrical detection of the
magnetic state of nuclear spins. Improvement of this technique for a
semiconductor system with a relatively small number of nuclei might be applied
to the manipulation of nuclear spin ''qubits'' in the future S-NSQC.
","[{""version"":""v1"",""created"":""Tue, 13 Feb 2001 10:57:37 GMT""}]","2009-11-07"
"cond-mat/0102230","Tomas S. Grigera","T.S. Grigera, V. Martin-Mayor, G. Parisi and P. Verrocchio","Vibrational spectrum of topologically disordered systems","Completely rewritten version, accepted in Physical Review Letters","Phys. Rev. Lett. 87, 085502 (2001)","10.1103/PhysRevLett.87.085502",,"cond-mat.dis-nn cond-mat.stat-mech",,"  The topological nature of the disorder of glasses and supercooled liquids
strongly affects their high-frequency dynamics. In order to understand its main
features, we analytically studied a simple topologically disordered model,
where the particles oscillate around randomly distributed centers, interacting
through a generic pair potential. We present results of a resummation of the
perturbative expansion in the inverse particle density for the dynamic
structure factor and density of states. This gives accurate results for the
range of densities found in real systems.
","[{""version"":""v1"",""created"":""Tue, 13 Feb 2001 12:07:45 GMT""},{""version"":""v2"",""created"":""Wed, 4 Jul 2001 09:38:04 GMT""}]","2009-11-07"
"cond-mat/0102232","Dmitri A. Ivanov","D. A. Ivanov, L. B. Ioffe, V. B. Geshkenbein, G. Blatter","Interference effects in isolated Josephson junction arrays with
  geometric symmetries","9 pages, 6 figures","Phys. Rev. B 65, 024509 (2002)","10.1103/PhysRevB.65.024509",,"cond-mat.supr-con cond-mat.mes-hall quant-ph",,"  As the size of a Josephson junction is reduced, charging effects become
important and the superconducting phase across the link turns into a periodic
quantum variable. Isolated Josephson junction arrays are described in terms of
such periodic quantum variables and thus exhibit pronounced quantum
interference effects arising from paths with different winding numbers
(Aharonov-Casher effects). These interference effects have strong implications
for the excitation spectrum of the array which are relevant in applications of
superconducting junction arrays for quantum computing. The interference effects
are most pronounced in arrays composed of identical junctions and possessing
geometric symmetries; they may be controlled by either external gate potentials
or by adding/removing charge to/from the array. Here we consider a loop of N
identical junctions encircling one half superconducting quantum of magnetic
flux. In this system, the ground state is found to be non-degenerate if the
total number of Cooper pairs on the array is divisible by N, and doubly
degenerate otherwise (after the stray charges are compensated by the gate
voltages).
","[{""version"":""v1"",""created"":""Tue, 13 Feb 2001 14:10:49 GMT""}]","2009-11-07"
"cond-mat/0102234","Miguel A. L. Marques","M.A.L. Marques, Alberto Castro, and Angel Rubio","Assessment of exchange-correlation functionals for the calculation of
  dynamical properties of small clusters in TDDFT","28 pages, accepted by JCP",,"10.1063/1.1385368",,"cond-mat.soft cond-mat.mtrl-sci",,"  We present a detailed study of different exchange-correlation (xc)
functionals in describing the dynamical properties of finite systems. For that
purpose, we calculated the static polarizabilities, ionization potentials and
optical absorption spectrum of four small clusters, Na_2, Na_4, SiH_4 and
Si_2H_6, using a real-space, real-time technique. The computed static
polarizabilities and ionization potentials seem to be in rather good agreement
with the available experimental data, once the proper asymptotics of the
potential are taken into account. The same conclusion holds for the absorption
spectra, although the xc kernels in use do not provide a sufficiently strong
attractive interaction between electrons and holes, leading to spectra slightly
shifted towards higher energies. This deficiency is traced back to the
insufficient description of dynamical effects in the correlation functional.
Furthermore, it is shown that the xc potential used to obtain the ground state
is the key factor to get reasonable spectra, whereas the choice of the xc
kernel just amounts to small, although important, quantitative changes.
","[{""version"":""v1"",""created"":""Tue, 13 Feb 2001 14:29:30 GMT""},{""version"":""v2"",""created"":""Thu, 7 Jun 2001 09:33:03 GMT""}]","2009-11-07"
"cond-mat/0102236","Yshai Avishai","Y. Avishai and Y. Tokura","Resonant electron transmission through a finite quantum spin chain","4 pages including 4 .eps figures",,"10.1103/PhysRevLett.87.197203",,"cond-mat.mes-hall",,"  Electron transport in a finite one dimensional quantum spin chain (with
ferromagnetic exchange) is studied within an $s-d$ exchange Hamiltonian. Spin
transfer coefficients strongly depend on the sign of the $s-d$ exchange
constant. For a ferromagnetic coupling, they exhibit a novel resonant pattern,
reflecting the salient features of the combined electron-spin system. Spin-flip
processes are inelastic and feasible at finite voltage or at finite
temperature.
","[{""version"":""v1"",""created"":""Tue, 13 Feb 2001 15:22:03 GMT""}]","2009-11-07"
"gr-qc/0102048","Roman R. Zapatrin","Ioannis Raptis, Roman R. Zapatrin","Algebraic description of spacetime foam","34 pages, LaTeX2e, the section concerning classical spacetimes in the
  limit essentially corrected","Class.Quant.Grav. 18 (2001) 4187-4212","10.1088/0264-9381/18/20/303",,"gr-qc hep-th",,"  A mathematical formalism for treating spacetime topology as a quantum
observable is provided. We describe spacetime foam entirely in algebraic terms.
To implement the correspondence principle we express the classical spacetime
manifold of general relativity and the commutative coordinates of its events by
means of appropriate limit constructions.
","[{""version"":""v1"",""created"":""Mon, 12 Feb 2001 16:58:42 GMT""},{""version"":""v2"",""created"":""Wed, 11 Jul 2001 16:02:14 GMT""}]","2009-11-07"
"gr-qc/0102049","Thomas Buchert","Thomas Buchert (Univ. of Geneva)","On average properties of inhomogeneous fluids in general relativity II:
  perfect fluid cosmologies","TeX 21 pages, matches published version: G.R.G., in press","Gen.Rel.Grav.33:1381-1405,2001","10.1023/A:1012061725841",,"gr-qc astro-ph",,"  For general relativistic spacetimes filled with an irrotational perfect fluid
a generalized form of Friedmann's equations governing the expansion factor of
spatially averaged portions of inhomogeneous cosmologies is derived. The
averaging problem for scalar quantities is condensed into the problem of
finding an `effective equation of state' including kinematical as well as
dynamical `backreaction' terms that measure the departure from a standard FLRW
cosmology. Applications of the averaged models are outlined including
radiation-dominated and scalar field cosmologies (inflationary and
dilaton/string cosmologies). In particular, the averaged equations show that
the averaged scalar curvature must generically change in the course of
structure formation, that an averaged inhomogeneous radiation cosmos does not
follow the evolution of the standard homogeneous-isotropic model, and that an
averaged inhomogeneous perfect fluid features kinematical `backreaction' terms
that, in some cases, act like a free scalar field source. The free scalar field
(dilaton) itself, modelled by a `stiff' fluid, is singled out as a special
inhomogeneous case where the averaged equations assume a simple form.
","[{""version"":""v1"",""created"":""Mon, 12 Feb 2001 17:25:16 GMT""},{""version"":""v2"",""created"":""Tue, 31 Jul 2001 11:56:34 GMT""}]","2008-11-26"
