"astro-ph/0102222","Kaiki Taro Inoue","Kaiki Taro Inoue","Are Compact Hyperbolic Models Observationally Ruled Out?","25 pages, 16 EPS figures Version accepted for publication in PTP","Prog.Theor.Phys. 106 (2001) 39","10.1143/PTP.106.39","YITP-01-12","astro-ph",,"  We revisit the observational constraints on compact(closed) hyperbolic(CH)
models from cosmic microwave background(CMB). We carry out Bayesian analyses
for CH models with volume comparable to the cube of the present curvature
radius using the COBE-DMR data and show that a slight suppression in the
large-angle temperature correlations owing to the non-trivial topology explains
rather naturally the observed anomalously low quadrupole which is incompatible
with the prediction of the standard infinite Friedmann-Robertson-Walker models.
While most of positions and orientations are ruled out, the likelihoods of CH
models are found to be much better than those of infinite counterparts for some
specific positions and orientations of the observer, leading to less stringent
constraints on the volume of the manifolds. Even if the spatial geometry is
nearly flat as $\Omega_{tot}=0.9-0.95$, suppression of the angular power on
large angular scales is still prominent for CH models with volume much less
than the cube of the present curvature radius if the cosmological constant is
dominant at present.
","[{""version"":""v1"",""created"":""Tue, 13 Feb 2001 05:40:34 GMT""},{""version"":""v2"",""created"":""Tue, 29 May 2001 07:59:10 GMT""}]","2009-11-06"
"astro-ph/0102223","Coryn Bailer-Jones","C.A.L. Bailer-Jones (MPIA, Heidelberg, Germany)","Automated stellar classification for large surveys: a review of methods
  and results","To appear in ""Automated Data Analysis in Astronomy"", R. Gupta, H.P.
  Singh, C.A.L. Bailer-Jones (eds.), Narosa Publishing House, New Delhi, India,
  2001. 16 pages. Also available from
  http://www.mpia-hd.mpg.de/homes/calj/indiarev.html",,,,"astro-ph",,"  Current and future large astronomical surveys will yield multiparameter
databases on millions or even billions of objects. The scientific exploitation
of these will require powerful, robust, and automated classification tools
tailored to the specific survey. Partly motivated by this, the past five to ten
years has seen a significant increase in the amount of work focused on
automated classification and its application to astronomical data. In this
article, I review this work and assess the current status of automated stellar
classification, with particular regard to its potential application to large
astronomical surveys. I examine both the strengths and weaknesses of the
various techniques and how they have been applied to different classification
and parametrization problems. I finish with a brief look at the developments
still required in order to apply a stellar classifier to a large survey.
","[{""version"":""v1"",""created"":""Tue, 13 Feb 2001 09:07:15 GMT""}]","2007-05-23"
"astro-ph/0102224","Coryn Bailer-Jones","C.A.L. Bailer-Jones (MPIA, Heidelberg), R. Gupta (IUCAA, Pune), H.P.
  Singh (Sri Venkateswara College, New Delhi)","An introduction to artificial neural networks","To appear in ""Automated Data Analysis in Astronomy"", R. Gupta, H.P.
  Singh, C.A.L. Bailer-Jones (eds.), Narosa Publishing House, New Delhi, India,
  2001. 18 pages, 8 figures. Also available from
  http://www.mpia-hd.mpg.de/homes/calj/annintro.html",,,,"astro-ph",,"  Artificial neural networks are algorithms which have been developed to tackle
a range of computational problems. These range from modelling brain function to
making predictions of time-dependent phenomena to solving hard (NP-complete)
problems. In this introduction we describe a single, yet very important, type
of network known as a feedforward network. This network is a mathematical model
which can be trained to learn an arbitrarily complex relationship between a
data and a parameter domain, so can be used to solve interpolation and
classification problems. We discuss the structure, training and interpretation
of these networks, and their implementation, taking the classification of
stellar spectra as an example.
","[{""version"":""v1"",""created"":""Tue, 13 Feb 2001 09:08:06 GMT""}]","2007-05-23"
"astro-ph/0102225","Kazunori Kohri","K. Kohri and Shoichi Yamada","Polarization tensors in a strong magnetic field","16 pages, using REVTeX and 5 postscript figures","Phys.Rev. D65 (2002) 043006","10.1103/PhysRevD.65.043006",,"astro-ph hep-ph",,"  The vacuum polarization tensor in strong external magnetic fields has been
evaluated numerically for various strengths of magnetic fields and momenta of
photons under the threshold of the $e^{\pm}$ pair creation. The fitting formula
has been obtained which reproduces the calculated results within 10 % of error.
The proper time method is employed further to obtain the retarded polarization
tensor for finite temperature plasmas.
","[{""version"":""v1"",""created"":""Tue, 13 Feb 2001 10:49:17 GMT""}]","2009-11-06"
"astro-ph/0102226","Floyd Stecker","F.W. Stecker (NASA/GSFC) and Sheldon L. Glashow (Boston U.)","New Tests of Lorentz Invariance Following from Observations of the
  Highest Energy Cosmic Gamma Rays","corrected typo, Astroparticle Physics, in press","Astropart.Phys.16:97-99,2001","10.1016/S0927-6505(01)00137-2",,"astro-ph hep-ph hep-th",,"  We use the recent reanalysis of multi-TeV gamma-ray observations of Mrk 501
to constrain the Lorentz invariance breaking parameter involving the maximum
electron velocity. Our limit is two orders of magnitude better than that
obtained from the maximum observed cosmic-ray electron energy.
","[{""version"":""v1"",""created"":""Tue, 13 Feb 2001 14:33:03 GMT""},{""version"":""v2"",""created"":""Mon, 19 Mar 2001 15:35:16 GMT""}]","2011-06-09"
"astro-ph/0102227","Piotr Zycki","P. T. Zycki, A. Rozanska (CAMK, Warsaw)","Testing a model of variability of X-ray reprocessing features in Active
  Galactic Nuclei","12 pages. MNRAS, accepted","Mon.Not.Roy.Astron.Soc. 325 (2001) 197","10.1046/j.1365-8711.2001.04398.x",,"astro-ph",,"  A number of recent results from X-ray observations of Active Galactic Nuclei
involving the Fe K alpha line (reduction of line variability compared to the
X-ray continuum variability, the X-ray ``Baldwin effect'') were attributed to a
presence of a hot, ionized skin of an accretion disc, suppressing emission of
the line. The ionized skin appears as a result of the thermal instability of
X-ray irradiated plasma. We test this hypothesis by computing the Thomson
thickness of the hot skin on top of the 'alpha P_tot' Shakura-Sunyaev disc, by
simultaneously solving the vertical structure of both the hot skin and the
disc. We then compute a number of relations between observable quantities, e.g.
the hard X-ray flux, amplitude of the observed reprocessed component,
relativistic smearing of the K alpha line, the r.m.s. variability of the hard
X-rays. These relations can be compared to present and future observations. We
point out that this mechanism is unlikely to explain the behaviour of the X-ray
source in MCG-6-30-15, where there is a number of arguments against the
existence of a thick hot skin, but it can work for some other Seyfert 1
galaxies.
","[{""version"":""v1"",""created"":""Tue, 13 Feb 2001 14:59:44 GMT""}]","2009-11-06"
"astro-ph/0102228","Daniel Schaerer","Grazyna Stasinska (DAEC, Meudon), Daniel Schaerer (OMP, Toulouse),
  Claus Leitherer (STScI, Baltimore)","The evolution of emission lines in HII galaxies","Accepted for publication in A&A. LaTeX, 26 pages including figures.
  The photoionisation models are available at
  http://webast.ast.obs-mip.fr/people/schaerer/",,"10.1051/0004-6361:20010232",,"astro-ph",,"  We constructed diagnostic diagrams using emission line ratios and equivalent
widths observed in several samples of HII galaxies. The diagrams are compared
to predictions from new photoionization models for evolving starbursts. We find
that HII galaxies from objective-prism surveys are not reproduced by models of
instantaneous starbursts surrounded by constant density, ionization bounded HII
regions. The observed relations between emission line ratios and Hb equivalent
width (W(Hb)) can be understood if older stellar populations are not negligible
in HII galaxies. Also, different dust obscuration for stars and gas and leakage
of Lyman continuum photons from the observed HII regions can be important. As a
result, HII galaxies selected from objective-prism surveys are unlikely to
contain many objects in which the most recent starburst is older than about
5~Myr. The observed increase of [OI]/Hb with decreasing W(Hb) can result from
the dynamical effects of winds and supernovae. This interpretation provides
also a natural explanation of the small range of ionization parameters in giant
HII regions. The [OIII]/Hb vs [OII]/Hb diagnostic diagram cannot be fully
understood in terms of pure photoionization models and indicate the need for
additional heating sources. The [NII]/[OII] ratio is shown to increase as W(Hb)
decreases. A possible explanation is an N/O increase due to gradual enrichment
by winds from Wolf-Rayet stars on a time scale of 5 Myr. (abridged abstract)
","[{""version"":""v1"",""created"":""Tue, 13 Feb 2001 15:26:59 GMT""}]","2009-11-06"
"astro-ph/0102229","Vassiliki Kalogera","V. Kalogera (1), K. Belczynski (1 and 2) ((1) Harvard-Smithsonian
  Center for Astrophysics, (2) Nicolaus Copernicus Astronomical Center)","Binary Population Synthesis: Methods, Normalization, and Surprises","15 pages, 1 figure, to appear in the proceedings ``The influence of
  binaries on stellar population studies'', Brussels, August 2000 (Kluwer
  Academic Publishers), ed. D.Vanbeveren",,"10.1007/978-94-015-9723-4_32",,"astro-ph",,"  In this paper we present a brief overview of population synthesis methods
with a discussion of their main advantages and disadvantages. In the second
part, we present some recent results from synthesis models of close binary
compact objects with emphasis on the predicted rates, their uncertainties, and
the model input parameters the rates are most sensitive to. We also report on a
new evolutionary path leading to the formation of close double neutron stars
(NS), with the unique characteristic that none of the two NS ever had the
chance to be recycled by accretion. Their formation rates turn out to be
comparable to or maybe even higher than those of recycled NS-NS binaries (like
the ones observed), but their detection probability as binary pulsars is much
smaller because of their short lifetimes. We discuss the implications of such a
population for gravitational-wave detection of NS-NS inspiral events, and
possibly for gamma-ray bursts and their host galaxies.
","[{""version"":""v1"",""created"":""Tue, 13 Feb 2001 15:31:45 GMT""}]","2015-05-20"
"cond-mat/0102198","Anatolii Zvezdin","A. K. Zvezdin (Institute of General Physics, Russian Academy of
  Sciences, Moscow, Russia)","Nonlinear Dynamics of Quasiclassical Spin Moment in a Swept Field","5 pages",,,,"cond-mat.mes-hall",,"  Quantum dynamics of anisotropic spin system with large spin moment in a swept
magnetic field is theoretically investigated. Magnetic field of this type
induces vortex static electrical field, that breaks down the axial symmetry and
induces new coherent quantum phenomena: the occurrence of band energy spectrum
with continuous spin states, Bloch-type oscillations and interband Zener
tunnelling effect. These quantum phenomena display themselves, in particular,
in magnetization jumps and susceptibility peaks in the investigated spin
system.
","[{""version"":""v1"",""created"":""Mon, 12 Feb 2001 16:33:26 GMT""},{""version"":""v2"",""created"":""Sun, 11 Mar 2001 17:09:17 GMT""}]","2007-05-23"
"cond-mat/0102202","Nara Guisoni","Nara Guisoni and Vera Bohomoletz Henriques (Universidade de Sao Paulo
  - Instituto de Fisica - Brazil)","A geometric model for cold water and liquid-liquid transitions","14 pages, 5 figures. Submited to J. Chem. Phys","J.Chem.Phys. 115, 5238-5243 (2001).","10.1063/1.1395565",,"cond-mat.stat-mech",,"  Water is an associated liquid in which the main intermolecular interaction is
the hydrogen bond (HB) which is limited to four per atom, independently of the
number of neighbours. We have considered a hydrogen bond net superposed on
Bernal's geometric model for liquids, which allows for different local
environments for the liquid particles. In this study, a mean-field treatment of
the two-dimensinal version of the model is discussed. Under pressure the model
exhibits three phases of different densities and a coexistence line ending in a
critical point between low and high density phases. Entropy of the HB network
plays an essential role in defining the slope of the coexistence line. The
model behaviour might be of interest in describing supercooled water and
liquid-liquid transitions of other substances.
","[{""version"":""v1"",""created"":""Mon, 12 Feb 2001 20:00:15 GMT""},{""version"":""v2"",""created"":""Tue, 13 Feb 2001 18:46:37 GMT""}]","2009-11-07"
"cond-mat/0102206","Pierre Meystre","S. Potting, M. Cramer, C. H. Schwalb, H. Pu and P. Meystre","Coherent acceleration of Bose-Einstein condensates","11 pages incl. 10 PostScript figures (.eps), LaTeX using RevTeX,
  submitted to Phys. Rev. A, incl. corrections and modifications","Phys. Rev. A 64 (2001) 023604","10.1103/PhysRevA.64.023604",,"cond-mat.soft quant-ph",,"  We present a theoretical analysis of the coherent acceleration of atomic
Bose-Einstein condensates. A first scheme relies on the 'conveyor belt'
provided by a frequency-chirped optical lattice. For potentials shallow enough
that the condensate is not fragmented, the acceleration can be interpreted in
terms of sequential Bragg scattering, with the atomic sample undergoing
transitions to a succession of discrete momentum sidemodes. The narrow momentum
width of these sidemodes offers the possibility to accelerate an ultracold
atomic sample such as e.g. a Bose-Einstein condensate without change in its
momentum distribution. This is in contrast to classical point particles, for
which this kind of acceleration leads to a substantial heating of the sample. A
second scheme is based on the idea of a synchronous particle accelerator
consisting of a spatial array of quadrupole traps. Pulsing the trapping
potential creates a traveling trap that confines and accelerates the atomic
system. We study this process using the concept of phase stability.
","[{""version"":""v1"",""created"":""Mon, 12 Feb 2001 16:35:19 GMT""},{""version"":""v2"",""created"":""Fri, 20 Apr 2001 00:50:54 GMT""}]","2009-11-07"
"cond-mat/0102207","Markus Rauscher","Markus Rauscher and Herbert Spohn","Porous silicon formation and electropolishing","18 pages, 8 figures",,"10.1103/PhysRevE.64.031604",,"cond-mat.mtrl-sci",,"  Electrochemical etching of silicon in hydrofluoride containing electrolytes
leads to pore formation for low and to electropolishing for high applied
current. The transition between pore formation and polishing is accompanied by
a change of the valence of the electrochemical dissolution reaction. The local
etching rate at the interface between the semiconductor and the electrolyte is
determined by the local current density. We model the transport of reactants
and reaction products and thus the current density in both, the semiconductor
and the electrolyte. Basic features of the chemical reaction at the interface
are summarized in law of mass action type boundary conditions for the transport
equations at the interface. We investigate the linear stability of a planar and
flat interface. Upon increasing the current density the stability flips either
through a change of the valence of the dissolution reaction or by a nonlinear
boundary conditions at the interface.
","[{""version"":""v1"",""created"":""Mon, 12 Feb 2001 16:43:18 GMT""}]","2009-11-07"
"cond-mat/0102208","Abhishek Dhar","Abhishek Dhar","Heat conduction in a one-dimensional gas of elastically colliding
  particles of unequal masses","5 pages, 4 figures, Accepted for publication in Phys. Rev. Lett",,"10.1103/PhysRevLett.86.3554",,"cond-mat.stat-mech nlin.CD",,"  We study the nonequlibrium state of heat conduction in a one-dimensional
system of hard point particles of unequal masses interacting through elastic
collisions. A BBGKY-type formulation is presented and some exact results are
obtained from it. Extensive numerical simulations for the two-mass problem
indicate that even for arbitrarily small mass differences, a nontrivial steady
state is obtained. This state exhibits local thermal equilibrium and has a
temperature profile in accordance with the predictions of kinetic theory. The
temperature jumps typically seen in such studies are shown to be finite-size
effects. The thermal conductivity appears to have a very slow divergence with
system size, different from that seen in most other systems.
","[{""version"":""v1"",""created"":""Mon, 12 Feb 2001 17:14:09 GMT""}]","2009-11-07"
"cond-mat/0102209","Alexander Grosberg","Motohiko Tanaka and Alexander Grosberg","Giant Charge Inversion of a Macroion Due to Multivalent Counterions and
  Monovalent Coions: Molecular Dynamics Study","10 pages, including 10 figures; a few typos are fixed, and several
  references added","Journal of Chemical Physics, v. 115, n. 1, pp. 567-574, 2001.","10.1063/1.1377033",,"cond-mat.soft",,"  We report molecular dynamics simulation of the (overall neutral) system
consisting of an immobile macroion surrounded by the electrolyte of multivalent
counterions and monovalent coions. As expected theoretically, counterions
adsorb on the macroion surface in the amount much exceeding neutralization
requirement, thus effectively inverting the sign of the macroion charge. We
find two conditions necessary for charge inversion, namely, counterions must be
multivalently charged and Coulomb interactions must be strong enough compared
to thermal energy. On the other hand, coion condensation on the multivalent
counterions similar to Bjerrum pairing is the major factor restricting the
amount of charge inversion. Depending on parameters, we observe inverted charge
up to about 200% the original charge of the macroion in absolute value. Our
findings are consistent with the theory of ""giant charge inversion""
[Phys.Rev.Lett., v. 85, 1568 (2000)].
","[{""version"":""v1"",""created"":""Mon, 12 Feb 2001 17:16:52 GMT""},{""version"":""v2"",""created"":""Wed, 21 Feb 2001 22:12:08 GMT""}]","2009-11-07"
"cond-mat/0102210","Dietrich Meyer","D. Meyer, C. Santos, W. Nolting","Quantum effects in the quasiparticle structure of the ferromagnetic
  Kondo lattice model","19 pages, 4 figures",,"10.1088/0953-8984/13/11/310",,"cond-mat.str-el",,"  A new ``Dynamical Mean-field theory'' based approach for the Kondo lattice
model with quantum spins is introduced. The inspection of exactly solvable
limiting cases and several known approximation methods, namely the second-order
perturbation theory, the self-consistent CPA and finally a moment-conserving
decoupling of the equations of motion help in evaluating the new approach. This
comprehensive investigation gives some certainty to our results: Whereas our
method is somewhat limited in the investigation of the J<0-model, the results
for J>0 reveal important aspects of the physics of the model: The energetically
lowest states are not completely spin-polarized.A band splitting, which occurs
already for relatively low interaction strengths, can be related to distinct
elementary excitations, namely magnon emission (absorption) and the formation
of magnetic polarons. We demonstrate the properties of the ferromagnetic Kondo
lattice model in terms of spectral densities and quasiparticle densities of
states.
","[{""version"":""v1"",""created"":""Mon, 12 Feb 2001 17:22:26 GMT""}]","2009-11-07"
"cond-mat/0102211","You-Quan Li","Zu-Jian Ying (Zhejiang U.) You-Quan Li (Zhejiang U./Augsburg U.), and
  Shi-Jian Gu (Zhejiang U.)","Symmetries in the Hubbard model with n-fold orbital degeneracy","Revtex 7 pages, 0 figures","J.Math.Phys. 42 (2001) 4865-4872","10.1063/1.1402956",,"cond-mat.str-el hep-th",,"  The present paper studies the symmeries of the Hubbard model of electrons
with generally $n$-fold orbital degeneracy. It's shown SU_d(2n) and SU_c(2n)
symmetries hold respectively for the model with completely repulsive or
attractive on-site interaction and that with partly attractive interactions. An
extended Lieb-Mattis transformation is given to map these two symmetries into
each other. The sub-symmetry SU_d^{(e)}(n)\otimes SU_d^{(o)}(n) is found to be
shared by the two models with arbitrary chemical potential \mu. By assuming at
most two electrons on each site it's found that $SU_d(2n)$ and $SU_c(2n)$ both
exist in each kind of the two models and consequently lead to a larger symmetry
SU_d(2n)\times SU_c(2n). Another underlying symmetry SU_c^{(e)}(2)_{{\cal
P}}\times ...\times SU_c^{(e)}(2)_{{\cal P}} \otimes \bigl(SU_c^{(o)}(2)_{{\cal
P}}\times ...\times SU_c^{(o)}(2)_{{\cal P}}\bigr) is also revealed for the
unified $U$ model under the excluding. The symmetry is valid for the partially
attractive model with chemical potential $\mu =-U.$
","[{""version"":""v1"",""created"":""Mon, 12 Feb 2001 17:29:32 GMT""}]","2009-11-07"
"cond-mat/0102212","Claudio Castellano","Claudio Castellano and Paolo Politi","Spatio-temporal distribution of nucleation events during crystal growth","4 pages, 3 figures; accepted for publication on PRL","Phys. Rev. Lett. 87, 056102 (2001)","10.1103/PhysRevLett.87.056102",,"cond-mat.stat-mech",,"  We consider irreversible second-layer nucleation that occurs when two adatoms
on a terrace meet. We solve the problem analytically in one dimension for zero
and infinite step-edge barriers, and numerically for any value of the barriers
in one and two dimensions. For large barriers, the spatial distribution of
nucleation events strongly differs from $\rho^2$, where $\rho$ is the
stationary adatom density in the presence of a constant flux. The probability
$Q(t)$ that nucleation occurs at time $t$ after the deposition of the second
adatom, decays for short time as a power law [$Q(t)\sim t^{-1/2}$] in $d=1$ and
logarithmically [$Q(t)\sim 1/\ln(t/t_0)$] in $d=2$; for long time it decays
exponentially. Theories of the nucleation rate $\omega$ based on the assumption
that it is proportional to $\rho^2$ are shown to overestimate $\omega$ by a
factor proportional to the number of times an adatom diffusing on the terrace
visits an already visited lattice site.
","[{""version"":""v1"",""created"":""Mon, 12 Feb 2001 18:35:58 GMT""},{""version"":""v2"",""created"":""Thu, 7 Jun 2001 13:06:09 GMT""}]","2016-08-31"
"cond-mat/0102213","Thomas A. Witten","Adolfo M. Nemirovsky and Thomas A. Witten","Stress Relaxation in Diblock Copolymers",,"Complex Fluids, conference proceedings for conference in Sitges
  Spain, 1992, edited by Luis Garrido (Springer-Verlag, Heidelberg, 1993) p.
  281",,,"cond-mat.soft",,"  We study stress relaxation in a strongly segregated lamellar mesophase of
diblock copolymers. We consider the extreme limit in which chains are highly
stretched and with their junction points confined to narrow interfaces. A
lamella can be divided into ""stress blobs"" at some distance $z$ from the
interface, with well defined local modulus $G(z,\omega)$ at frequency $\omega$.
For sliding (compressional) stress the total modulus is transmitted in series
(parallel) across the layer. We evaluate the local $G(z,t)$ which shows, for a
given height, a very broad spectrum of relaxation times.
","[{""version"":""v1"",""created"":""Mon, 12 Feb 2001 18:59:32 GMT""},{""version"":""v2"",""created"":""Tue, 13 Feb 2001 02:02:28 GMT""}]","2009-09-25"
"cond-mat/0102214","Jan W. Kantelhardt","Jan W. Kantelhardt, Eva Koscielny-Bunde, Henio H. A. Rego, Shlomo
  Havlin, and Armin Bunde","Detecting Long-range Correlations with Detrended Fluctuation Analysis","10 pages, including 8 figures","Physica A 295, 441-454 (2001)","10.1016/S0378-4371(01)00144-3",,"cond-mat.stat-mech",,"  We examine the Detrended Fluctuation Analysis (DFA), which is a
well-established method for the detection of long-range correlations in time
series. We show that deviations from scaling that appear at small time scales
become stronger in higher orders of DFA, and suggest a modified DFA method to
remove them. The improvement is necessary especially for short records that are
affected by non-stationarities. Furthermore, we describe how crossovers in the
correlation behavior can be detected reliably and determined quantitatively and
show how several types of trends in the data affect the different orders of
DFA.
","[{""version"":""v1"",""created"":""Mon, 12 Feb 2001 19:00:02 GMT""}]","2009-11-07"
