"astro-ph/0102430","Subhabrata Majumdar","Subhabrata Majumdar","Probing the Evolution of Gas Mass Fraction with Sunyaev-Zel'dovich
  Effect","4 pages plus 2 figures, uses emulateapj",,"10.1086/323159",,"astro-ph",,"  Study of the primary anisotropies of the Cosmic Microwave Background (CMB)
can be used to determine the cosmological parameters to a very high precision.
The power spectrum of the secondary CMB anisotropies due to the thermal
Sunyaev-Zel'dovich Effect (SZE) by clusters of galaxies, can then be studied,
to constrain more cluster specific properties (like gas mass). We show the SZE
power spectrum from clusters to be a sensitive probe of any possible evolution
(or constancy) of the gas mass fraction. The position of the peak of the SZE
power spectrum is a strong discriminatory signature of different gas mass
fraction evolution models. For example, for a flat universe, there can be a
difference in the $l$ values (of the peak) of {\it as much as 3000} between a
constant gas mass fraction model and an evolutionary one. Moreover,
observational determination of power spectrum, from blank sky surveys, is
devoid of any selection effects that can possibly affect targeted X-ray or
radio studies of gas mass fractions in galaxy clusters.
","[{""version"":""v1"",""created"":""Sun, 25 Feb 2001 16:00:46 GMT""}]","2016-08-30"
"astro-ph/0102431","Vasilii Gvaramadze","V.V.Gvaramadze (Abastumani Astrophysical Observatory, Tbilisi,
  Georgia)","On the age of PSR B1509-58","5 pages, revised version accepted for publication in A&A","A&A, 2001, v. 374, pp. 259-263","10.1051/0004-6361:20010720",,"astro-ph",,"  It is generally accepted that the PSR B1509-58 is associated with the
supernova remnant (SNR) MSH 15-52 (G 320.4-01.2). The spin-down age of the
pulsar is \simeq 1700 years, while the size and the general appearance of the
SNR suggest that this system is much older. A few possible explanations of this
discrepancy have been put forward. We offer an alternative one and suggest that
the high spin-down rate of the pulsar characterizes only a relatively short
period of its (present) spin history, and that the enhanced braking torque is
connected with the interaction between the pulsar's magnetosphere and the dense
matter of a circumstellar clump (created during the late evolutionary stages of
the supernova (SN) progenitor star). Our suggestion implies that the ""true"" age
of PSR B1509-58 could be much larger than the spin-down age, and therefore the
SNR MSH 15-52 is a middle-aged remnant similar to the Vela SNR (G 263.9-3.3).
We also suggest that the dense (neutral) gas of the circumstellar clump could
be responsible for the enhanced neutral hydrogen absorption towards PSR
B1509-58, and that the optical emission of an optical counterpart for PSR
B1509-58 should rather be attributed to a bow shock around this pulsar than to
the pulsar itself.
","[{""version"":""v1"",""created"":""Sun, 25 Feb 2001 17:17:12 GMT""},{""version"":""v2"",""created"":""Mon, 11 Jun 2001 14:12:50 GMT""},{""version"":""v3"",""created"":""Fri, 15 Jun 2001 15:38:54 GMT""}]","2016-08-30"
"astro-ph/0102432","Ermanno F. Borra","Ermanno F. Borra","Astronomical Research with Liquid Mirror Telescopes","PDF format 36 pages, 6 figures",,,"efb111","astro-ph",,"  Liquid mirror telescopes are of interest to Astronomy because of their very
low capital and operating costs. Low cost has a potentially revolutionary
impact since it allows one to dedicate a large telescope to a narrowly focused
project that needs a large quantity of observations. The technology is now well
proven in the laboratory as well as in observatory settings and is stepping
into the mainstream of astronomical research. This paper has two main purposes.
a) To acquaint the astronomical community with LMT zenith observing and to
illustrate the LMT advantage with specific examples of research topics of
current interest that could be carried out only with LMTs because of their low
costs. I argue that LMTs are more versatile than generally thought and that the
challenge is to use LMTs in such ways as to maximize their advantages and
minimize their disadvantages. I briefly review specific issues regarding zenith
telescopes. I then illustrate the LMT advantage with specific examples of
astronomical research. b) I show that the large number of objects observed with
a surveying LMT allows one to carry out cosmological projects at low redshifts.
I show that a variability survey would obtain light curves for several
thousands of type Ia supernovae per year up to z=1 and easily discriminate
among competing cosmological models. The same survey would find large numbers
of MACHOs in clusters of galaxies and in background faint galaxies. Finally, I
discuss a spectrophotometric survey carried out with interference filters,
showing its power to discriminate among cosmological models and to study the
large-scale distribution of galaxies in the Universe.
","[{""version"":""v1"",""created"":""Sun, 25 Feb 2001 20:16:12 GMT""}]","2007-05-23"
"astro-ph/0102433","Ermanno F. Borra","Gregoire Tremblay, and Ermanno F. Borra","Optical Tests of a 3.7-m diameter Liquid Mirror: Behavior under External
  Perturbations","PDF format, 34 pages, 12 figures, (some figures reduced, full size
  figures in Applied Optics, Vol. 39, No 36, 5651)","Applied Optics, Vol. 39, No 36, 5651","10.1364/AO.39.005651",,"astro-ph",,"  We have built and tested a 3.7-m diameter liquid mirror that rotates on a
ball bearing. We have carried out extensive optical tests. We find that
although the ball bearing has a poor quality, the quality of the mirror, with
mercury layers 1-mm thick, is surprisingly good. Taken at face values the
instantaneous Strehl ratios indicate a mirror, that is not quite diffraction
limited but usable for astronomical applications. However, the large coning
error of the bearing (1.5 arcseconds P-V) induces an excessive wobble,
considerably worsening the time averaged PSF. The most interesting result of
the interferometry is that we do not see any evidence of the strong astigmatism
that may have been expected from Coriolis forces.
","[{""version"":""v1"",""created"":""Sun, 25 Feb 2001 21:34:58 GMT""}]","2009-11-06"
"astro-ph/0102434","Curtis J. Saxton","Curtis J. Saxton and Kinwah Wu","Stability analyses of two-temperature radiative shocks: formulation,
  eigenfunctions, luminosity response and boundary conditions","26 pages, 21 figures, MNRAS in press","Mon.Not.Roy.Astron.Soc. 324 (2001) 659","10.1046/j.1365-8711.2001.04343.x",,"astro-ph",,"  We present a general formulation for stability analyses of radiative shocks
with multiple cooling processes, longitudinal and transverse perturbations, and
unequal electron and ion temperatures. Using the accretion shocks of magnetic
cataclysmic variables as an illustrative application, we investigate the shock
instabilities by examining the eigenfunctions of the perturbed hydrodynamic
variables. We also investigate the effects of varying the condition at the
lower boundary of the post-shock flow from a zero-velocity fixed wall to
several alternative type of boundaries involving the perturbed hydrodynamic
variables, and the variations of the emission from the post-shock flow under
different modes of oscillations. We found that the stability properties for
flow with a stationary-wall lower boundary are not significantly affected by
perturbing the lower boundary condition, and they are determined mainly by the
energy-transport processes. Moreover, there is no obvious correlation between
the amplitude or phase of the luminosity response and the stability properties
of the system. Stability of the system can, however, be modified in the
presence of transverse perturbation. The luminosity responses are also altered
by transverse perturbation.
","[{""version"":""v1"",""created"":""Sun, 25 Feb 2001 23:34:16 GMT""}]","2009-11-06"
"astro-ph/0102435","Peter W. Gorham","P. W. Gorham, K. M. Liewer, C. J. Naudet (JPL), D. P. Saltzberg & D.
  R. Williams (UCLA)","Radio limits on an isotropic flux of >100 EeV cosmic neutrinos","12 pages, 7 fig., presented at the First International Workshop on
  Radio Detection of High Energy Particles (RADHEP 2000), Nov. 16-18, 2000",,,,"astro-ph hep-ex physics.ins-det",,"  We report on results from about 30 hours of livetime with the Goldstone Lunar
Ultra-high energy neutrino Experiment (GLUE). The experiment searches for <10
ns microwave pulses from the lunar regolith, appearing in coincidence at two
large radio telescopes separated by about 22 km and linked by optical fiber.
The pulses can arise from subsurface electromagnetic cascades induced by
interactions of up-coming ~100 EeV neutrinos in the lunar regolith. A new
triggering method implemented after the first 12 hours of livetime has
significantly reduced the terrestrial interference background, and we now
operate at the thermal noise level. No strong candidates are yet seen. We
report on limits implied by this non-detection, based on new Monte Carlo
estimates of the efficiency. We also report on preliminary analysis of smaller
pulses, where some indications of non-statistical excess may be present.
","[{""version"":""v1"",""created"":""Mon, 26 Feb 2001 01:19:54 GMT""}]","2007-05-23"
"astro-ph/0102436","Chenggang Shu","Chenggang Shu (1,2,4),Shude Mao (3),H.J. Mo (2)((1) SHAO, CAS, China;
  (2) MPA, Garching, Germany; (3)Jodrell Bank Observatory, UK; (4)JLOA, CAS,
  China)","The Host Haloes of Lyman Break Galaxies and Sub-millimeter Sources","27 pages, 14 figures, submitted to MNRAS","Mon.Not.Roy.Astron.Soc. 327 (2001) 895","10.1046/j.1365-8711.2001.04767.x",,"astro-ph",,"  We use the observed sizes and star formation rates of Lyman-break galaxies
(LBGs) to understand their properties expected in the hierarchical scenario of
galaxy formation. The observed size distribution constrains the masses of the
host haloes of LBGs from below, while the observed star-formation distribution
constrains the masses from above. Assuming a flat CDM model with a cosmological
constant ($\Omega_\Lambda=0.7$), we find that consistency with observations
requires the circular velocities of LBG host haloes to be in the range
100--$300 {\rm km s^{-1}}$. The predicted comoving correlation length of these
objects is $\sim 3 h^{-1}{\rm Mpc}$, and the predicted velocity dispersion of
their stellar contents is typically $70 {\rm km s^{-1}}$. The same prescription
applied to larger haloes in the CDM cosmogony predicts the existence of
galaxies with star formation rates $\sim 1000 {\rm M_\odot yr^{-1}}$ at
redshift $z\sim 3$. We explore the possibility of identifying these galaxies to
be the bright sub-millimeter (sub-mm) sources detected by SCUBA. The model
predicts that the host haloes of these sub-mm sources are massive. These
galaxies are predicted to be strongly correlated, with a comoving correlation
length of $\sim 7 h^{-1}{\rm Mpc}$. The descendants of the bright sub-mm
sources should reside in clusters of galaxies at the present time, and it is
likely that these objects are the progenitors of giant ellipticals. The model
predicts the existence of a relatively bright and red population of galaxies at
$z\sim 3$, which may be observed in the K-band.
","[{""version"":""v1"",""created"":""Mon, 26 Feb 2001 08:40:04 GMT""}]","2009-11-06"
"astro-ph/0102437","Marina Orio","M. Orio, A. Parmar, R. Benjamin, L. Amati, F. Frontera, J. Greiner, H.
  Ogelman, T. Mineo, S. Starrfield, E. Trussoni","The X-ray emission from Nova V382 Velorum: I. The hard component
  observed with BeppoSAX","1 tex file, 2 figures as .ps, and 1 .sty file of MNRAS","Mon.Not.Roy.Astron.Soc. 326 (2001) L13","10.1046/j.1365-8711.2001.04448.x",,"astro-ph",,"  We present BeppoSAX observations of Nova Velorum 1999 (V382 Vel), done in a
broad X-ray band covering 0.1-300 keV only 15 days after the discovery and
again after 6 months. The nova was detected at day 15 with the BeppoSAX
instruments in the energy range 1.8-10 keV and we attribute the emission to
shocks in the ejecta. The plasma temperature was kT~6 keV and the unabsorbed
flux was F(x)~4.3 x 10(-11) erg/cm**2/s. The nebular material was affected by
high intrinsic absorption of the ejecta. 6 months after after the outburst, the
intrinsic absorption did not play a role, the nova had turned into a bright
supersoft source, and the hot nebular component previously detected had cooled
to a plasma temperature kT<=1 keV. No emission was detected in either
observation above 20 keV.
","[{""version"":""v1"",""created"":""Mon, 26 Feb 2001 09:51:19 GMT""}]","2009-11-06"
"astro-ph/0102438","Fiore","F. Fiore, S. Pellegrini, G. Matt, L.A. Antonelli, A. Comastri, R.
  Della Ceca, E. Giallongo, S. Mathur, S. Molendi, A. Siemiginowska, G.
  Trinchieri and B. Wilkes","The BeppoSAX view of the X-ray active nucleus of NGC4258","ApJ in press",,"10.1086/321530",,"astro-ph",,"  BeppoSAX observed NGC4258 on December 1998, when its 2-10 keV luminosity was
\~1E41 erg/s. 100% variability is observed in the 3-10 keV band on timescales
of a half a day while 20% variability is observed on timescales of one hour.
The nuclear component is visible above 2 keV only, being obscured by a column
density of (9.5+/-1.2)E22 cm-2; this component is detected up to 70 keV with
S/N>=3 and with the steep power law energy index of 1.11+/-0.14. Bremsstrahlung
emission for the 2-70 keV X-ray luminosity, as expected in ADAF models with
strong winds, is ruled out by the data. The ratio between the nuclear radio and
the X-ray luminosities is <=1E-5, similar to that of radio quiet AGN. X-ray
variability and spectral shape, radio to X-ray and NIR to X-ray luminosity
ratios suggest that the nucleus of NGC4258 could be a scaled-down version of a
Seyfert nucleus. The soft (E<=2keV) X-ray emission is complex. There are at
least two thermal-like components, with T1=0.6+/-0.1 keV and T2>=1.3 keV. The
cooler (L(0.1-2.4keV)=1E40 erg/s) component is probably associated with the
jet, resolved in X-rays by the ROSAT HRI. The second component, which can be
modeled equally well by an unobscured power law model, has L(0.1-2.4keV)~7E39
erg/s, consistent with that expected from discrete X-ray sources in the host
galaxy. NGC4258 and other maser AGNs show strong nuclear X-ray absorption. We
propose that this large column of gas might be responsible for shielding the
regions of maser emission from X-ray illumination. So a large column density
gas may be a necessary property of masing AGNs.
","[{""version"":""v1"",""created"":""Mon, 26 Feb 2001 09:05:44 GMT""}]","2009-11-06"
"astro-ph/0102439","Peter Schuecker","P. Schuecker, H. Boehringer, K. Arzner and T.H. Reiprich","Cosmic Mass Functions from Gaussian Stochastic Diffusion Processes","17 pages, 8 figures, accepted for publication in Astronomy and
  Astrophysics, also available at
  http://www.xray.mpe.mpg.de/theorie/cluster/cl_publ.html",,"10.1051/0004-6361:20010282",,"astro-ph",,"  Gaussian stochastic diffusion processes are used to derive cosmic mass
functions. To get analytic relations previous studies exploited the sharp
$k$-space filter assumption yielding zero drift terms in the corresponding
Fokker-Planck (Kolmogorov's forward) equation and thus simplifying analytic
treatments significantly (excursion set formalism). In the present paper
methods are described to derive for given diffusion processes and Gaussian
random fields the corresponding mass and filter functions by solving the
Kolmogorov's forward and backward equations including nonzero drift terms. This
formalism can also be used in cases with non-sharp $k$-space filters and for
diffusion processes exhibiting correlations between different mass scales.
","[{""version"":""v1"",""created"":""Mon, 26 Feb 2001 10:02:51 GMT""}]","2009-11-06"
"astro-ph/0102440","Marina Orio","Marina Orio and Arvind Parmar","V382 Vel: a ""shocking"" supersoft x-ray source?","1 tex file, 2 figures as .ps, a newpasp.sty file",,,,"astro-ph",,"  Nova Vel 1999 (V382 Vel) was observed with BeppoSAX twice, 15 days and 6
months after the optical maximum. A hard X-ray source was detected in the first
observation, while the second time also a very luminous supersoft X-ray source
was detected.
  The continuum observed in the supersoft range with the BeppoSAX LECS cannot
be fitted with atmospheric models of hot hydrogen burning while dwarfs. We
suggest that we are observing instead mainly a ``pseudocontinuum'', namely a
blend of very strong emission lines in the supersoft X-ray range.
","[{""version"":""v1"",""created"":""Mon, 26 Feb 2001 10:06:25 GMT""}]","2007-05-23"
"astro-ph/0102441","Marina Orio","Marina orio, Roberto Casalegno, Chris Conselice, Jochen Greiner, Petko
  L. Nedialkov, Nikolay A. Tikhonov","Optical identification of supersoft X-ray sources in M31","1 .tex file, 1.sty file, 1 .ps file (figure)",,,,"astro-ph",,"  We report on initial progress in a program of optical identification of
supersoft X-ray sources in M31, pursued mainly with the WIYN telescope. We
propose the identification of one supersoft X-ray source with a variable star,
which we believe to have been a classical or recurrent nova in outburst in
September 1990. The nova remnant must have been still a supersoft X-ray sources
5 years after this observation, when it was observed with ROSAT.
","[{""version"":""v1"",""created"":""Mon, 26 Feb 2001 10:51:24 GMT""}]","2007-05-23"
"astro-ph/0102442","Zheng Zheng","Zheng Zheng (1), Chris Flynn (2), Andrew Gould (1 and 3), John N.
  Bahcall (4) and Samir Salim (1) ((1)The Ohio State University, (2)Tuorla
  Observatory, Turku University, Finland, (3) Laboratoire de Physique
  Corpusculaire et Cosmologie, College de France, (4)Institute for Advanced
  Study)","M Dwarfs from Hubble Space Telescope Star Counts. IV","20 pages, 10 ps figures, accepted for publication in ApJ","Astrophys.J. 555 (2001) 393-404","10.1086/321485",,"astro-ph",,"  We study a sample of about 1400 disk M dwarfs that are found in 148 fields
observed with the Wide Field Camera 2 (WFC2) on the Hubble Space Telescope and
162 fields observed with pre-repair Planetary Camera 1 (PC1), of which 95 of
the WFC2 fields are newly analyzed. The method of maximum likelihood is applied
to derive the luminosity function and the Galactic disk parameters. At first,
we use a local color-magnitude relation and a locally determined
mass-luminosity relation in our analysis. The results are consistent with those
of previous work but with considerably reduced statistical errors. These small
statistical errors motivate us to investigate the systematic uncertainties.
Considering the metallicity gradient above the Galactic plane, we introduce a
modified color-magnitude relation that is a function of Galactic height. The
resultant M dwarf luminosity function has a shape similar to that derived using
the local color-magnitude relation but with a higher peak value. The peak
occurs at $M_V \sim 12$ and the luminosity function drops sharply toward $M_V
\sim 14$. We then apply a height-dependent mass-luminosity function
interpolated from theoretical models with different metallicities to calculate
the mass function. Unlike the mass function obtained using local relations,
which has a power-law index $\alpha = 0.47$, the one derived from the
height-dependent relations tends to be flat ($\alpha = -0.10$). The resultant
local surface density of disk M dwarfs (12.2 +/- 1.6 M_sun pc^{-2}) is somewhat
smaller than the one obtained using local relations (14.3 +/- 1.3 M_sun
pc^{-2}). Our measurement favors a short disk scale length, H = 2.75 +/- 0.16
(statistical) +/- 0.25 (systematic) kpc.
","[{""version"":""v1"",""created"":""Mon, 26 Feb 2001 14:07:16 GMT""}]","2009-11-06"
"astro-ph/0102443","Markus Roth","T. Antoni, et al (KASCADE Collaboration)","A Non-Parametric Approach to Infer the Energy Spectrum and the Mass
  Composition of Cosmic Rays","28 pages, 13 figures, Accepted for publication in Astroparticle
  Physics","Astropart.Phys. 16 (2002) 245-263",,,"astro-ph",,"  The experiment KASCADE observes simultaneously the electron-photon, muon, and
hadron components of high-energy extensive air showers (EAS). The analysis of
EAS observables for an estimate of energy and mass of the primary particle
invokes extensive Monte Carlo simulations of the EAS development for preparing
reference patterns. The present studies utilize the air shower simulation code
CORSIKA with the hadronic interaction models VENUS, QGSJet and Sibyll,
including simulations of the detector response and efficiency. By applying
non-parametric techniques the measured data have been analyzed in an
event-by-event mode and the mass and energy of the EAS inducing particles are
reconstructed. Special emphasis is given to methodical limitations and the
dependence of the results on the hadronic interaction model used. The results
obtained from KASCADE data reproduce the knee in the primary spectrum, but
reveal a strong model dependence. Owing to the systematic uncertainties
introduced by the hadronic interaction models no strong change of chemical
composition can be claimed in the energy range around the knee.
","[{""version"":""v1"",""created"":""Mon, 26 Feb 2001 14:50:39 GMT""}]","2009-09-25"
"cond-mat/0102451","Lachezar Georgiev","Lachezar Georgiev","Stability and Activation Gaps of Parafermionic Hall States in the Second
  Landau Level","25 pages, LaTeX2e (using ELSART), 1 figure, 2 tables; added
  discussion on a possible phase transition","Nucl.Phys. B626 (2002) 415-434","10.1016/S0550-3213(02)00069-X",,"cond-mat.mes-hall hep-th",,"  Analyzing the effective conformal field theory for the parafermionic Hall
states, corresponding to filling fractions nu_k=2+k/(kM+2), k=2,3,..., M odd,
we show that the even k plateaux are expected to be more stable than their odd
k neighbors. The reason is that the parafermion chiral algebra can be locally
extended for k even. This reconciles the theoretical implication, that the
bigger the k the less stable the fluid, with the experimental fact that, for
M=1, the k=2 and k=4 plateaux are already observed at electron temperature
T_e~8 mK, while the Hall resistance for k=3 is not precisely quantized at that
temperature in the sample of Pan et al. Using a heuristic gap ansatz we
estimate the activation energy gap for nu_3=13/5 to be approximately 0.015 K,
which implies that the quantization of the Hall conductance could be observed
for temperature below 1 mK in the same sample. We also find an appealing exact
relation between the fractional electric charge and fractional statistics of
the quasiholes. Finally, we argue that besides the Moore-Read phase for the
nu_2=5/2 state there is another relevant phase, in which the fundamental
quasiholes obey abelian statistics and carry half-integer electric charge.
","[{""version"":""v1"",""created"":""Mon, 26 Feb 2001 14:31:29 GMT""},{""version"":""v2"",""created"":""Fri, 3 Aug 2001 12:01:13 GMT""},{""version"":""v3"",""created"":""Wed, 6 Feb 2002 11:54:48 GMT""}]","2009-11-07"
"cond-mat/0102457","Beatriz Noheda","D. E. Cox, B. Noheda, G. Shirane, Y. Uesu, K. Fujishiro, and Y. Yamada","Universal Phase Diagram for High-Piezoelectric Perovskite Systems","REVTeX file. 4 pages,=A0 4 figures embedded","Appl. Phys. Lett. 79, 400 (2001)","10.1063/1.1384475",,"cond-mat.mtrl-sci",,"  Strong piezoelectricity in the perovskite-type PbZr(1-x)TixO3 (PZT) and
Pb(Zn1/3Nb2/3)O3-PbTiO3 (PZN-PT) systems is generally associated with the
existence of a morphotropic phase boundary (MPB) separating regions with
rhombohedral and tetragonal symmetry. An x-ray study of PZN-9%PT has revealed
the presence of a new orthorhombic phase at the MPB, and a near-vertical
boundary between the rhombohedral and orthorhombic phases, similar to that
found for PZT between the rhombohedral and monoclinic phases. We discuss the
results in the light of a recent theoretical paper by Vanderbilt and Cohen,
which attributes these low-symmetry phases to the high anharmonicity in these
oxide systems.
","[{""version"":""v1"",""created"":""Sun, 25 Feb 2001 19:27:51 GMT""}]","2009-11-07"
"cond-mat/0102458","Michael Pustilnik","M. Pustilnik and L. I. Glazman","Kondo effect induced by a magnetic field",,"Phys. Rev. B 64, 045328 (2001)","10.1103/PhysRevB.64.045328",,"cond-mat.mes-hall",,"  We study peculiarities of transport through a Coulomb blockade system tuned
to the vicinity of the spin transition in its ground state. Such transitions
can be induced in practice by application of a magnetic field. Tunneling of
electrons between the dot and leads mixes the states belonging to the ground
state manifold of the dot. Remarkably, both the orbital and spin degrees of
freedom of the electrons are engaged in the mixing at the singlet-triplet
transition point. We present a model which provides an adequate theoretical
description of recent experiments with semiconductor quantum dots and carbon
nanotubes.
","[{""version"":""v1"",""created"":""Mon, 26 Feb 2001 03:19:43 GMT""},{""version"":""v2"",""created"":""Thu, 29 Mar 2001 23:38:00 GMT""}]","2007-05-23"
"cond-mat/0102459","Luis","L.Velazquez (Universidad de Pinar del Rio), F.Guzman (Instituto
  Superior de Ciencias y Tecnologias Nucleares)","Some geometrical aspects of the Microcanonical Distribution","4pages, RevTeX. Revised version",,,"PDP-01-02-1","cond-mat",,"  In the present work is presented some considerations for a possible
generalization of the Microcanonical thermoestatics (M.Th) of D.H.E. Gross.The
same reveals a geometric aspect that commonly it has been disregarded so far:
the local reparametrization invariance . This new characteristic leads to the
needing of generalizing the methods of M.Th to be consequent with this
property.
","[{""version"":""v1"",""created"":""Mon, 26 Feb 2001 08:40:36 GMT""},{""version"":""v2"",""created"":""Fri, 18 May 2001 05:20:51 GMT""}]","2007-05-23"
