"physics/0102086","Alex Kaivarainen","Alex Kaivarainen","The Hierarchic Theory of Liquids and Solids. Computerized applications
  for ice, water, and Biosystems","The book, printed by NOVA Science Publishers (New York, USA, 2008),
  ISBN-13: 978-1-60021-901-6. Homepage: http://web.petrsu.ru/~alexk and
  http://www.h-systems.be",,,,"physics.gen-ph","http://arxiv.org/licenses/nonexclusive-distrib/1.0/","  This is a new book of quantum Hierarchic theory of condensed matter, general
for liquids and solids, developed by this author during 20 years and its
numerous applications. Computer program, based on new theory, was used for
simulations of big number of physical properties of water and ice. Condensed
matter is considered as a superposition of 3D standing waves (collective
excitations) of different nature: thermal de Broglie waves, IR photons and
thermal phonons. New theories of total internal energy, heat capacity, surface
tension, vapor pressure, thermal conductivity, viscosity and self-diffusion are
described. Hierarchic theory of osmotic pressure, based on new state equation,
new theories of light refraction, Brillouin light scattering and Mossbauer
effect are presented also and compared with available experimental data for
water and ice. The agreement between theoretical and available experimental
results for water and ice is very good. New approach to the turbulence,
superfluidity and superconductivity is developed. A lot of applications of new
theory to biophysics, including model of Quantum of Mind are described. New
optoacoustic device: Comprehensive Analyzer of Matter Properties (CAMP) is
proposed.
","[{""version"":""v1"",""created"":""Mon, 26 Feb 2001 15:31:30 GMT""},{""version"":""v2"",""created"":""Tue, 3 Apr 2001 13:55:49 GMT""},{""version"":""v3"",""created"":""Wed, 23 May 2007 15:51:22 GMT""},{""version"":""v4"",""created"":""Fri, 23 Nov 2007 16:34:40 GMT""},{""version"":""v5"",""created"":""Thu, 5 Jun 2008 21:07:33 GMT""}]","2008-06-06"
"quant-ph/0102128","Massimo Blasone","Massimo Blasone, Petr Jizba","Bateman's dual system revisited: I. Quantization, geometric phase and
  relation with the ground-state energy of the linear harmonic oscillator","24 pages, RevTeX, 4 figures. Fully revised version","Annals Phys.312:354-397,2004","10.1016/j.aop.2004.01.008",,"quant-ph hep-th",,"  By using the Feynman-Hibbs prescription for the evolution amplitude, we
quantize the system of a damped harmonic oscillator coupled to its
time-reversed image, known as Bateman's dual system.
  The time-dependent quantum states of such a system are constructed and
discussed entirely in the framework of the classical theory.
  The corresponding geometric (Pancharatnam) phase is calculated and found to
be directly related to the ground-state energy of the 1D linear harmonic
oscillator to which the 2D system reduces under appropriate constraint.
","[{""version"":""v1"",""created"":""Mon, 26 Feb 2001 04:02:07 GMT""},{""version"":""v2"",""created"":""Sun, 18 Mar 2001 22:01:33 GMT""}]","2014-11-18"
"quant-ph/0102129","Antonino Messina","B.Militello, A.Messina and A.Napoli","Quantum Zeno Effect in Trapped Ions","12 pages, 4 figures",,"10.1016/S0375-9601(01)00462-5",,"quant-ph",,"  A ""continuous measurement"" Quantum Zeno Effect (QZE) in the context of
trapped ions is predicted. We describe the physical system and study its exact
time evolution showing the appearance of Zeno Phenomena. New indicators for the
occurrence of QZE in oscillatory systems are proposed and carefully discussed.
","[{""version"":""v1"",""created"":""Mon, 26 Feb 2001 09:54:31 GMT""}]","2009-11-07"
"quant-ph/0102130","Italo Vecchi","Italo Vecchi","Shannon entropy and blackbody radiation","Latex, 3 pages",,,,"quant-ph",,"  A response to criticism of the author's previous paper quant-ph/0002084.
","[{""version"":""v1"",""created"":""Mon, 26 Feb 2001 12:13:29 GMT""}]","2007-05-23"
