"cond-mat/0102460","Nicholas A. Pertsev","V. G. Koukhar, N. A. Pertsev, and R. Waser","Thermodynamic theory of epitaxial ferroelectric thin films with dense
  domain structures","19 pages, 8 figures","Physical Review B, vol. 64, art. 214103 (2001)","10.1103/PhysRevB.64.214103",,"cond-mat.mtrl-sci",,"  A Landau-Ginsburg-Devonshire-type nonlinear phenomenological theory is
presented, which enables the thermodynamic description of dense laminar
polydomain states in epitaxial ferroelectric thin films. The theory explicitly
takes into account the mechanical substrate effect on the polarizations and
lattice strains in dissimilar elastic domains (twins). Numerical calculations
are performed for PbTiO3 and BaTiO3 films grown on (001)-oriented cubic
substrates. The ""misfit strain-temperature"" phase diagrams are developed for
these films, showing stability ranges of various possible polydomain and
single-domain states. Three types of polarization instabilities are revealed
for polydomain epitaxial ferroelectric films, which may lead to the formation
of new polydomain states forbidden in bulk crystals. The total dielectric and
piezoelectric small-signal responses of polydomain films are calculated,
resulting from both the volume and domain-wall contributions. For BaTiO3 films,
strong dielectric anomalies are predicted at room temperature near special
values of the misfit strain.
","[{""version"":""v1"",""created"":""Mon, 26 Feb 2001 10:24:51 GMT""}]","2007-05-23"
"cond-mat/0102461","Stefano Zapperi","Stefano Zapperi, Andre A. Moreira and Jose S. Andrade Jr","Flux front penetration in disordered superconductors","5 pages, 4 figures, to appear in Phys. Rev. Lett","Phys. Rev. Lett. 86, 3622 (2001)","10.1103/PhysRevLett.86.3622",,"cond-mat.supr-con",,"  We investigate flux front penetration in a disordered type II superconductor
by molecular dynamics (MD) simulations of interacting vortices and find scaling
laws for the front position and the density profile. The scaling can be
understood performing a coarse graining of the system and writing a disordered
non-linear diffusion equation. Integrating numerically the equation, we observe
a crossover from flat to fractal front penetration as the system parameters are
varied. The value of the fractal dimension indicates that the invasion process
is described by gradient percolation.
","[{""version"":""v1"",""created"":""Mon, 26 Feb 2001 10:31:39 GMT""}]","2009-11-07"
"cond-mat/0102462","Ingo Loa","I. Loa and K. Syassen","Calculated elastic and electronic properties of MgB$_2$ at high
  pressures","10 pages, 3 figures (EPS), Elsevier LaTeX. More detailed analysis of
  the pressure dependence of Tc; results unchanged. Manuscript accepted for
  publication in Solid State Commun","Solid State Commun. 118, 279-282 (2001)","10.1016/S0038-1098(01)00095-3",,"cond-mat.supr-con",,"  The effect of high pressure on structural and electronic properties of the
novel superconductor \MB has been calculated using the full-potential
linearized augmented-plane-wave method. Despite the layered crystal structure
of \MB nearly isotropic compression (bulk modulus $B_0=140.1(6)$ GPa) is found
with only a 1.2% decrease of the $c/a$ ratio at 10 GPa. The effect of pressure
on the critical temperature has been estimated on the basis of BCS theory and
good agreement with experimental data is found. Our results suggest that it is
a combination of increasing phonon frequency and decreasing electronic density
of states at the Fermi level which leads to the observed decrease of the
critical temperature under pressure.
","[{""version"":""v1"",""created"":""Mon, 26 Feb 2001 11:58:35 GMT""},{""version"":""v2"",""created"":""Mon, 5 Mar 2001 11:36:40 GMT""}]","2009-11-07"
"cond-mat/0102463","Sorcha B. Healy","Sorcha B. Healy, Claudia Filippi (UCC, Ireland), P. Kratzer, E. Penev,
  M. Scheffler (FHI, Berlin)","The role of electronic correlation in the Si(100) reconstruction: a
  quantum Monte Carlo study","5 pages, Revtex, 10 figures",,"10.1103/PhysRevLett.87.016105",,"cond-mat.mtrl-sci",,"  Recent low-temperature scanning tunneling experiments have challenged the
generally accepted picture of buckled silicon dimers as the ground state
reconstruction of the Si(100) surface. Together with the symmetric dimer model
of the surface suggested by quantum chemistry calculations on small clusters,
these findings question our general understanding of electronic correlations at
surfaces and its proper description within density functional theory. We
present quantum Monte Carlo calculations on large cluster models of the
symmetric and buckled surface, and conclude that buckling remains energetically
more favorable even when the present-day best treatment of electronic
correlation is employed.
","[{""version"":""v1"",""created"":""Mon, 26 Feb 2001 12:27:02 GMT""}]","2009-11-07"
"cond-mat/0102464","Hartmut Monien","Manfred Sigrist and Hartmut Monien","Phenomenological theory of the 3 Kelvin phase in Sr2RuO4","10 pages, 5 figures",,"10.1143/JPSJ.70.2409",,"cond-mat.str-el cond-mat.mes-hall cond-mat.supr-con",,"  We model the 3K-phase of Sr2RuO4 with Ru-metal inclusion as interface state
with locally enhanced transition temperatures. The resulting 3K-phase must have
a different pairing symmetry than the bulk phase of Sr2RuO4, because the
symmetry at the interface is lower than in the bulk. It is invariant under time
reversal and a second transition, in general, above the onset of bulk
superconductivity is expected where time reversal symmetry is broken. The
nucleation of the 3K-phase exhibits a ``capillary effect'' which can lead to
frustration phenomena for the superconducting states on different
Ru-inclusions. Furthermore, the phase structure of the pair wave function gives
rise to zero-energy quasiparticle states which would be visible in
quasiparticle tunneling spectra. Additional characteristic properties are
associated with the upper critical field Hc2. The 3K-phase has a weaker
anisotropy of Hc2 between the inplane and z-axis orientation than the bulk
superconducting phase. This is connected with the more isotropic nature
Ru-metal which yields a stronger orbital depairing effect for the inplane
magnetic field than in the strongly layered Sr$_2RuO4. An anomalous temperature
dependence for the z-axis critical field is found due to the coupling of the
magnetic field to the order parameter texture at the interface. Various other
experiments are discussed and new measurements are suggested.
","[{""version"":""v1"",""created"":""Mon, 26 Feb 2001 13:15:29 GMT""}]","2009-11-07"
"cond-mat/0102466","Ulrich S. Schwarz","U. S. Schwarz (1), G. Gompper (2) ((1) MPI Colloids and Interfaces,
  (2) Forschungszentrum Juelich)","Bending Frustration of Lipid-Water Mesophases Based on Cubic Minimal
  Surfaces","Revtex, 23 pages with 9 postscript figures included, to appear in
  Langmuir","Langmuir 17: 2084 -2096 (2001)",,,"cond-mat.soft",,"  Inverse bicontinuous cubic phases are ubiquitous in lipid-water mixtures and
consist of a lipid bilayer forming a cubic minimal surface, thereby dividing
space into two cubic networks of water channels. For small hydrocarbon chain
lengths, the monolayers can be modeled as parallel surfaces to a minimal
midsurface. The bending energy of the cubic phases is determined by the
distribution of Gaussian curvature over the minimal midsurfaces which we
calculate for seven different structures (G, D, P, I-WP, C(P), S and F-RD). We
show that the free-energy densities of the structures G, D and P are
considerably lower than those of the other investigated structures due to their
narrow distribution of Gaussian curvature. The Bonnet transformation between G,
D, and P implies that these phases coexist along a triple line, which also
includes an excess water phase. Our model includes thermal membrane
undulations. Our qualitative predictions remain unchanged when higher order
terms in the curvature energy are included. Calculated phase diagrams agree
well with the experimental results for 2:1 lauric acid/dilauroyl
phosphatidylcholine and water.
","[{""version"":""v1"",""created"":""Mon, 26 Feb 2001 14:06:24 GMT""}]","2007-05-23"
"cond-mat/0102467","Alexander P. Itin","Alexander P. Itin","Electronic properties of single and coupled anisotropic quantum dots in
  a magnetic field, spin interactions and switching","6 pages, 3 figures, submitted for publication",,,,"cond-mat quant-ph",,"  We determined the eigenstates of a single electron in a parabolic anisotropic
2D quantum dot in a magnetic field. Using obtained expressions for these
eigenstates, we study the spin coupling J between two electrons located in two
laterally coupled anisotropic quantum dots (QD). The exhange coupling J is
calculated using the Heitler-London and Hund-Mulliken approaches. We found that
the exhange J changes sign at certain values of parameters of the system, in
particular at certain anisotropy of the QD. Therefore, we present a new method
to switch on and off the spin coupling between QD: switching by means of
changing shape of the QD. Switching the spin coupling is essential for quantum
computation using electronic spins as qubits. We note that our calculations can
be applied to the system of vertically coupled QD as well.
","[{""version"":""v1"",""created"":""Mon, 26 Feb 2001 14:26:15 GMT""}]","2007-05-23"
"cond-mat/0102468","Taku J. Sato","Taku J Sato, Kaoru Shibata and Yoshihiko Takano","Vibrational Density of States in Superconducting MgB$_2$",,,,,"cond-mat.supr-con cond-mat.mtrl-sci",,"  This paper is withdrawn by the authors.
","[{""version"":""v1"",""created"":""Mon, 26 Feb 2001 14:45:02 GMT""},{""version"":""v2"",""created"":""Tue, 27 Feb 2001 04:22:57 GMT""},{""version"":""v3"",""created"":""Tue, 23 Oct 2001 14:08:55 GMT""}]","2007-05-23"
"cond-mat/0102469","Eugene Kogan","Mark Auslender and Eugene Kogan","Ferromagnetic transition in a double-exchange system","4 pages, 1 eps figure, LaTeX2e, RevTeX. References added, text
  changed",,"10.1103/PhysRevB.65.012408",,"cond-mat.stat-mech",,"  We study ferromagnetic transition in three-dimensional double-exchange model.
The influence of strong spin fluctuations on conduction electrons is described
in coherent potential approximation. In the framework of thermodynamic approach
we construct for the system ""electrons (in a disordered spin configuration) +
spins"" the Landau functional, from the analysis of which critical temperature
of ferromagnetic transition is calculated.
","[{""version"":""v1"",""created"":""Mon, 26 Feb 2001 15:10:37 GMT""},{""version"":""v2"",""created"":""Thu, 8 Mar 2001 14:31:47 GMT""}]","2013-05-29"
"cond-mat/0102471","M.-B. Lepetit","Nicolas Suaud and Marie-Bernadette Lepetit","Ab initio evaluation of the charge-ordering in $\alpha^\prime NaV_2O_5$","4 pages","Phys. Rev. Letters, 88, 056405 (2002)","10.1103/PhysRevLett.88.056405",,"cond-mat.str-el",,"  We report {\it ab initio} calculations of the charge ordering in
$\alpha^\prime NaV_2O_5$ using large configurations interaction methods on
embedded fragments. Our major result is that the $2p_y$ electrons of the
bridging oxygen of the rungs present a very strong magnetic character and
should thus be explicitly considered in any relevant effective model. The most
striking consequence of this result is that the spin and charge ordering differ
substantially, as differ the experimental results depending on whether they are
sensitive to the spin or charge density.
","[{""version"":""v1"",""created"":""Mon, 26 Feb 2001 15:52:10 GMT""},{""version"":""v2"",""created"":""Mon, 17 Sep 2001 15:38:23 GMT""}]","2009-11-07"
"cs/0102027","Candida Ferreira","Candida Ferreira","Gene Expression Programming: a New Adaptive Algorithm for Solving
  Problems","22 pages, 17 figures","Complex Systems, 13(2): 87-129, 2001",,,"cs.AI cs.NE",,"  Gene expression programming, a genotype/phenotype genetic algorithm (linear
and ramified), is presented here for the first time as a new technique for the
creation of computer programs. Gene expression programming uses character
linear chromosomes composed of genes structurally organized in a head and a
tail. The chromosomes function as a genome and are subjected to modification by
means of mutation, transposition, root transposition, gene transposition, gene
recombination, and one- and two-point recombination. The chromosomes encode
expression trees which are the object of selection. The creation of these
separate entities (genome and expression tree) with distinct functions allows
the algorithm to perform with high efficiency that greatly surpasses existing
adaptive techniques. The suite of problems chosen to illustrate the power and
versatility of gene expression programming includes symbolic regression,
sequence induction with and without constant creation, block stacking, cellular
automata rules for the density-classification problem, and two problems of
boolean concept learning: the 11-multiplexer and the GP rule problem.
","[{""version"":""v1"",""created"":""Sun, 25 Feb 2001 19:29:55 GMT""},{""version"":""v2"",""created"":""Tue, 17 Apr 2001 12:21:18 GMT""},{""version"":""v3"",""created"":""Sun, 30 Dec 2001 20:04:47 GMT""}]","2007-05-23"
"cs/0102028","Chris Kimble","Chris Kimble, Paul Hildreth, and Peter Wright","Communities of Practice: Going Virtual","Draft version available from
  http://www-users.cs.york.ac.uk/~kimble/research/publics.html","Chapter 13 in Knowledge Management and Business Model Innovation,
  Idea Group Publishing, Hershey (USA)/London (UK), 2001. pp 220 - 234",,,"cs.HC cs.CY",,"  With the current trends towards downsizing, outsourcing and globalisation,
modern organisations are reducing the numbers of people they employ. In
addition, organisations now have to cope with the increasing
internationalisation of business forcing collaboration and knowledge sharing
across time and distance simultaneously. There is a need for new ways of
thinking about how knowledge is shared in distributed groups. In this paper we
explore a relatively new approach to knowledge sharing using Lave and Wenger's
(1991) theory of Communities of Practice (CoPs). We investigate whether CoPs
might translate to a geographically distributed international environment
through a case study that explores the functioning of a CoP across national
boundaries.
","[{""version"":""v1"",""created"":""Mon, 26 Feb 2001 15:22:27 GMT""}]","2007-05-23"
"cs/0102029","Chris Kimble","Chris Kimble and Kevin McLoughlin","Computer based Information Systems and Managers' Work","Available from
  http://www-users.cs.york.ac.uk/~kimble/research/publics.html","New Technology, Work and Employment, 10 (1), March, 1995. pp 56 -
  67",,,"cs.CY cs.HC",,"  This paper identifies three categories of model: the Technology Impact Model;
the Social Impact Model and the Integrationist Model, which imply different
views of the ""impact"" of Information Technology on work organisation. These
models are used to structure data from case studies conducted by the authors to
explore the implications of the use of computer-based information systems for
managers' work. The paper argues that the ""impact"" of information systems is
not a single stable and predictable outcome but a non-linear ongoing process
that changes and evolves over time. It also argues that the actions of
individuals and groups within an organisation are not wholly determined by
outside forces: people can and do react to, and shape, systems in different
ways. In this sense, the ""impact"" of computer-based information systems on
managers' work reflects decisions made by managers themselves about how the
technology is used.
","[{""version"":""v1"",""created"":""Mon, 26 Feb 2001 15:45:03 GMT""}]","2007-05-23"
"hep-lat/0102011","Federico Rapuano","The APE Collaboration","apenext: A Multi-Tflops LQCD Computing Project","53 pages, 10 figures",,,,"hep-lat",,"  This paper is a slightly modified and reduced version of the proposal of the
{\bf apeNEXT} project, which was submitted to DESY and INFN in spring 2000. .It
presents the basic motivations and ideas of a next generation lattice QCD
(LQCD) computing project, whose goal is the construction and operation of
several large scale Multi-TFlops LQCD engines, providing an integrated peak
performance of tens of TFlops, and a sustained (double precision) performance
on key LQCD kernels of about 50% of peak speed.
","[{""version"":""v1"",""created"":""Sun, 25 Feb 2001 16:08:46 GMT""}]","2012-08-27"
"hep-ph/0102303","Oleg Teryaev","O.V. Teryaev","Crossing and Radon Tomography for Generalized Parton Distributions","LaTeX, 10 pages","Phys.Lett. B510 (2001) 125-132","10.1016/S0370-2693(01)00564-0","TPR-01-05","hep-ph",,"  The crossing properties of the matrix elements of non-local operators,
parameterized by Generalized Parton Distribution, are considered. They are
especially simple in terms of the Double Distributions which are common for the
various kinematical regions. As a result, Double Distributions may be in
principle extracted from the combined data in these regions by making use of
the inverse Radon transform, known as a standard method in tomography. The
ambiguities analogous to the ones for the vetor potential in the
two-dimensional magneto-statics are outlined. The possible generalizations are
discussed.
","[{""version"":""v1"",""created"":""Sun, 25 Feb 2001 18:05:11 GMT""},{""version"":""v2"",""created"":""Mon, 16 Apr 2001 15:44:25 GMT""}]","2009-11-07"
"hep-ph/0102305","Mei","Mei Huang, Pengfei Zhuang, Weiqin Chao","The Mesonic Fluctuations and Corrections in the Chiral Symmetry Breaking
  Vacuum","15 pages with 3 figures, abstract, introduction, conclusion revised","Phys.Lett. B514 (2001) 63-71","10.1016/S0370-2693(01)00740-7",,"hep-ph",,"  The mesonic quantum fluctuations and their corrections on the chiral
condensate and pion polarization function are investigated in the
self-consistent scheme of SU(2) Nambu-Jona-Lasinio model by exactly calculating
the next-to-leading order (NLO) Feynman diagrams in $1/N_c$ expansion. While
the fluctuations and corrections depend strongly on the meson's three-momentum
cut-off $\Lambda_M$, no chiral symmetry restoration is found since the
cancellation between the NLO and the one-quark-loop diagram with quark mass
deviated from the mean-field value.
","[{""version"":""v1"",""created"":""Sun, 25 Feb 2001 17:20:39 GMT""},{""version"":""v2"",""created"":""Sun, 10 Jun 2001 12:21:14 GMT""}]","2009-11-07"
"hep-ph/0102306","D. M. Ghilencea","Dumitru M. Ghilencea, Graham G. Ross","Precision prediction of gauge couplings and the profile of a string
  theory","15 pages, LaTeX, 6 figures, one reference added","Nucl.Phys.B606:101,2001","10.1016/S0550-3213(01)00234-6","OUTP-00-77-P","hep-ph hep-th",,"  We estimate the significance of the prediction for the gauge couplings in the
MSSM with an underlying unification. The correlation between the couplings
covers only (0.2-2)% of the a priori reasonable region of the parameter space,
while the prediction for $\sin ^{2}\theta_{W}$ is accurate to 1.3%. Given that
agreement with experiment to such precision is unlikely to be fortuitous, we
discuss the profile of a string theory capable of preserving this level of
accuracy. We argue that models with a low scale of unification involving power
law running in the gauge couplings do not. Even theories with a high scale of
unification are strongly constrained, requiring the compactification scale of
new space dimensions in which states transforming under the Standard Model
propagate to be very close to the string cut-off scale. As a result {\it no}
new space dimensions can be larger than $10^{-14}fm.$
","[{""version"":""v1"",""created"":""Sun, 25 Feb 2001 19:10:04 GMT""},{""version"":""v2"",""created"":""Sun, 6 May 2001 13:23:53 GMT""}]","2014-11-17"
"hep-ph/0102308","Leszek Roszkowski","Takeshi Nihei, Leszek Roszkowski and Roberto Ruiz de Austri","Towards An Accurate Calculation of the Neutralino Relic Density","23 pages, 4 eps figures","JHEP 0105:063,2001","10.1088/1126-6708/2001/05/063",,"hep-ph astro-ph",,"  We compute the neutralino relic density in the minimal supersymmetric
standard model by using exact expressions for the neutralino annihilation cross
section into all tree-level final states, including all contributions and
interference terms. We find that several final states may give comparable
contributions to the relic density, which illustrates the importance of
performing a complete calculation. We compare the exact results with those of
the usual expansion method and demonstrate a sizeable discrepancy (of more than
10%) over a significant range of the neutralino mass of up to several tens of
GeV which is caused by the presence of resonances and new final-state
thresholds. We perform several related checks and comparisons. In particular,
we find that the often employed approximate iterative procedure of computing
the neutralino freeze-out temperature gives generally very accurate results,
except when the expansion method is used near resonances and thresholds.
","[{""version"":""v1"",""created"":""Sun, 25 Feb 2001 22:10:58 GMT""}]","2010-02-03"
"hep-ph/0102309","Daniel Kabat","Daniel Kabat (Columbia University), Arvind Rajaraman (Rutgers
  University)","Testing cosmological supersymmetry breaking","9 pages, LaTeX. v2: references added, comments added to conclusions","Phys.Lett.B516:383-387,2001","10.1016/S0370-2693(01)00935-2","CU-TP-1006, RUNHETC-2001-06","hep-ph hep-th",,"  Banks has proposed a relation between the scale of supersymmetry breaking and
the cosmological constant in de Sitter space. His proposal has a natural
extension to a general FRW cosmology, in which the supersymmetry breaking scale
is related to the Hubble parameter. We study one consequence of such a
relation, namely that coupling constants change as the universe evolves. We
find that the most straightforward extension of Banks' proposal is disfavored
by experimental bounds on variation of the fine structure constant.
","[{""version"":""v1"",""created"":""Sun, 25 Feb 2001 23:41:07 GMT""},{""version"":""v2"",""created"":""Wed, 11 Apr 2001 20:18:31 GMT""}]","2008-11-26"
"hep-ph/0102310","Yue-Liang Wu","Yue-Liang Wu and Yu-Feng Zhou (ITP, CAS)","Implication of $\sin 2\beta$ from global fit and $B\to J/\psi K_S$","19 pages, ReVtex, 5 figures, published version, latest result on sin
  (2 beta) from BaBar was considered and more references added","Int.J.Mod.Phys.A16:4547-4566,2001","10.1142/S0217751X01005377",,"hep-ph",,"  The measurement of $\sin 2 \beta$ is discussed within and beyond the standard
model. In the presence of new physics, the angle $\beta$ extracted from the
global fit(denoted by $\beta^{SM}_{fit}$) and the one extracted from $B\to
J/\psi K_S$ (denoted by $\beta_{J/\psi}$) are in general all different from the
'true' angle $\beta$ which is the weak phase of CKM matrix element $V^*_{td}$.
Possible new physics effects on the ratio $R_{\beta}=\sin2\beta_{J/\psi}/\sin
2\beta^{SM}_{fit}$ is studied and parameterized in a most general form. It is
shown that the ratio $R_{\beta}$ may provide a useful tool in probing new
physics. The experimental value of $R_{\beta}$ is obtained through an update of
the global fit of the unitarity triangle with the latest data and found to be
less than unity at 1$\sigma$ level. The new physics effects on $R_{\beta}$ from
the models with minimum flavor violation (MFV) and the standard model with
two-Higgs-doublet (S2HDM) are studied in detail. It is found that the MFV
models seem to give a relative large value $R_{\beta}\geq 1$. With the current
data, this may indicate that this kind of new physics may be disfavored and
alternative new physics with additional phases appears more relevant. As an
illustration for models with additional phase beyond CKM phase, the S2HDM
effects on $R_{\beta}$ are studied and found to be easily coincide with the
data due to the flavor changing neutral Higgs interaction.
","[{""version"":""v1"",""created"":""Mon, 26 Feb 2001 04:00:47 GMT""},{""version"":""v2"",""created"":""Wed, 28 Feb 2001 07:00:15 GMT""},{""version"":""v3"",""created"":""Tue, 17 Jul 2001 03:15:27 GMT""}]","2014-11-17"
"hep-ph/0102311","Boris Arbuzov","B.A. Arbuzov","Higgs' mass around 115 GeV would testify for composite Higgs","16 pages, latex, 6 figures, 1 table",,,,"hep-ph",,"  Theory with $SU(2)\times U(1)$ gauge invariant electroweak Lagrangian
describing standard interaction of massless quark doublet without elementary
scalar Higgs sector is considered. We show in the main order of $1/N_c$
expansion, that there exists a solution, which breaks initial symmetry and is
accompanied by an appearance of zero mass composite scalar doublet. The
electroweak loop corrections shift its mass to a tachyon value and thus the
scalar serves as a substitute for usual elementary Higgs. The $t$-quark mass
also arise. The problem of adjusting its observable mass leads to prediction of
triple gauge constant $\lambda_V \simeq -0.034$ without contradiction with
experimental data. The mass of the surviving composite Higgs scalar is
predicted to be $M_H = 117 \pm 7 GeV$, that agrees with recent indications of
$M_H \simeq 115 GeV$. The resulting theory contains realistic $W, Z, t$ masses,
composite massive Higgs and massless other particles. Parameters used are
cut-off $\Lambda \simeq 3500 GeV$, weak gauge constant $g$ and mixing angle
$\theta_W$.
","[{""version"":""v1"",""created"":""Mon, 26 Feb 2001 10:29:23 GMT""}]","2007-05-23"
