"hep-ph/0102312","Fjy","F. J. Yndurain","Disagreement between standard model and experiment for muon g-2 ?","New version with corrections and a few additions. Plain TeX file, 1
  figure",,,,"hep-ph",,"  In a recent experimental paper reporting a precise measurement of the muon
anomalous magnetic moment, Brown et al. claim disagreement of their result with
evaluations based on the standard model. This claim is based on comparison with
a single theoretical evaluation. It is pointed out that other equally
legitimate theoretical evaluations exist in the literature, with which the new
experimental figure is quite compatible. The claim of indications for new
physics beyond the standard model does not appear justified. In this version we
take into account corrections to one of the works quoted, we include a new
discussion at the end, and also minor errors are corrected. The conclusions
remain unchanged.
","[{""version"":""v1"",""created"":""Mon, 26 Feb 2001 11:44:17 GMT""},{""version"":""v2"",""created"":""Tue, 27 Feb 2001 09:19:23 GMT""},{""version"":""v3"",""created"":""Mon, 19 Mar 2001 10:07:24 GMT""}]","2007-05-23"
"hep-ph/0102313","Gregory Korchemsky","V.M.Braun, G.P.Korchemsky and A.N.Manashov","Evolution equation for the structure function g_2(x,Q^2)","53 pages, 10 figures, LaTeX style","Nucl.Phys.B603:69-124,2001","10.1016/S0550-3213(01)00165-1","LPT-Orsay-01-19, TPR-01-02, UB-ECM-PF-01/01","hep-ph",,"  We perform an extensive study of the scale dependence of flavor-singlet
contributions to the structure function g_2(x,Q^2) in polarized deep-inelastic
scattering. We find that the mixing between quark-antiquark-gluon and
three-gluon twist-3 operators only involves the three-gluon operator with the
lowest anomalous dimension and is weak in other cases. This means, effectively,
that only those three-gluon operators with the lowest anomalous dimension for
each moment are important, and allows to formulate a simple two-component
parton-like description of g_2(x,Q^2) in analogy with the conventional
description of twist-2 parton distributions. The similar simplification was
observed earlier for the nonsinglet distributions, although the reason is in
our case different.
","[{""version"":""v1"",""created"":""Mon, 26 Feb 2001 13:26:38 GMT""}]","2014-11-17"
"hep-ph/0102314","Koshiro Suzuki","Koshiro Suzuki and T.Watari","Constraints on Inflation Models from Supersymmetry Breakings","12 pages, 1 ps figure, minor correction","Phys.Lett. B506 (2001) 231-237","10.1016/S0370-2693(01)00412-9",,"hep-ph",,"  Effects of soft SUSY-breaking terms on inflation potentials are discussed.
There exist generic constraints that must be satisfied in order not for the
inflaton potential to loose its flatness. We examine explicitly the constraints
in the case of a hybrid inflation model and find that the coupling constant
\lambda between the inflaton and the ``water-fall-direction'' field is bounded
as 2.0 \times 10^{-6} < \lambda. This is a highly non-trivial result. Indeed,
if we adopt the severest constraint from avoiding the problem of the gravitinos
produced non-thermally, \lambda < 7.4 \times 10^{-6} is required, under a
reasonable assumption on the reheating process. This means that the hybrid
inflation model marginally has a viable parameter space. We also discuss
analogous constraints on other inflation models.
","[{""version"":""v1"",""created"":""Mon, 26 Feb 2001 14:23:52 GMT""},{""version"":""v2"",""created"":""Tue, 27 Feb 2001 04:43:42 GMT""}]","2009-11-07"
"hep-th/0102173","Koji Hashimoto","Koji Hashimoto and Shinji Hirano","Branes Ending On Branes In A Tachyon Model","19 pages, LaTeX, minor corrections and references added","JHEP 0104:003,2001","10.1088/1126-6708/2001/04/003",,"hep-th",,"  In a tachyon model proposed by Minahan and Zwiebach and derived in the
boundary string field theory, we construct various new solutions which
correspond to nontrivial brane configurations in string theory. Our solutions
include Dp-D(p-2) bound states, (F, Dp) bound states, string junctions,
D(p-2)-branes ending on a Dp-brane, D(p-2)-branes suspended between parallel
Dp-branes and their non-commutative generalizations. We find the Bogomol'nyi
bounds and the BPS equations for some of our solutions, and check the physical
consistency of our solutions with the D-brane picture by looking at the
distributions of their energies and RR-charges in space. We also give
conjectures for a few other brane configurations.
","[{""version"":""v1"",""created"":""Sun, 25 Feb 2001 20:45:05 GMT""},{""version"":""v2"",""created"":""Wed, 7 Mar 2001 23:57:58 GMT""}]","2010-02-03"
"hep-th/0102174","Koji Hashimoto","Koji Hashimoto and Shinji Hirano","Metamorphosis Of Tachyon Profile In Unstable D9-Branes","26 pages, LaTeX, (v2) minor corrections and a misleading footnote
  concerning the paper hep-th/0012198 was eliminated. References added, (v3) an
  important correction of the normalizations in the action, while the results
  being intact","Phys.Rev. D65 (2002) 026006","10.1103/PhysRevD.65.026006",,"hep-th",,"  We explored a variety of brane configurations in our previous paper within
the two derivative truncation of the unstable D9-brane effective theory. In
this paper we extend our previous results with emphasis on the inclusion of the
higher derivative corrections for the tachyon and the gauge fields computed in
the boundary string field theories. We give the exact solutions to BPS brane
configurations studied in our previous paper and find remarkable exact
agreements of their energies and RR-charges with the expected results. We
further find a few more solutions that we could not construct in the two
derivative truncations, such as a (F,D6) bound state ending on a D8-brane whose
existence turns out to be due to a higher derivative effect and also the
dielectric brane of Emparan and Myers as a nonsupersymmetric example. These are
also in exact agreements with the results obtained in the effective theory of
supersymmetric D-branes.
","[{""version"":""v1"",""created"":""Sun, 25 Feb 2001 20:39:51 GMT""},{""version"":""v2"",""created"":""Mon, 5 Mar 2001 22:53:55 GMT""},{""version"":""v3"",""created"":""Wed, 21 Mar 2001 23:05:03 GMT""}]","2009-11-07"
"hep-th/0102175","Gennadi Sardanashvily","G.Sardanashvily","Cohomology of the variational complex in BRST theory","17 pages","Mod.Phys.Lett. A16 (2001) 1531","10.1142/S0217732301004790",,"hep-th math-ph math.MP",,"  We show that cohomology of the variational complex in field-antifield BRST
theory on an arbitrary manifold is equal to the de Rham cohomology of this
manifold.
","[{""version"":""v1"",""created"":""Mon, 26 Feb 2001 08:13:40 GMT""}]","2009-11-07"
"hep-th/0102176","Satoshi Yamaguchi","Satoshi Yamaguchi (Kyoto Univ.)","Noncompact Gepner Models with Discrete Spectra","11 pages, LaTeX, 1 figure","Phys.Lett. B509 (2001) 346-354","10.1016/S0370-2693(01)00396-3","KUCP-178","hep-th",,"  We investigate a noncompact Gepner model, which is composed of a number of
SL(2,R)/U(1) Kazama-Suzuki models and N=2 minimal models. The SL(2,R)/U(1)
Kazama-Suzuki model contains the discrete series among the SL(2,R) unitary
representations as well as the continuous series. We claim that the discrete
series contain the vanishing cohomology and the vanishing cycles of the
associated noncompact Calabi-Yau manifold. We calculate the Elliptic genus and
the open string Witten indices. In the A_{N-1} ALE models, they actually agree
with the vanishing cohomology and the intersection form of the vanishing
cycles.
","[{""version"":""v1"",""created"":""Mon, 26 Feb 2001 14:17:47 GMT""}]","2009-11-07"
"hep-th/0102177","Minu Joy","Minu Joy and V. C. Kuriakose","Phase transitions and bubble nucleations for a phi^6 model in curved
  spacetime","15 pages, 6 figures","Mod.Phys.Lett. A18 (2003) 937-946","10.1142/S0217732303009502",,"hep-th",,"  Condsidering a massive self-interacting phi ^6 scalar field coupled
arbitrarily to a (2+1) dimensional Bianchi type-I spacetime, we evaluate the
one-loop effective potential. It is found that phi ^6 potential can be
regularized in (2+1) dimensional curved spacetime. A finite expression for the
energy-momentum tensor is obtained for this model. Evaluating the finite
temperature effective potential, the temperature dependence of phase
transitions is studied. The crucial dependence of the phase transitions on the
spacetime curvature and on the coupling to gravity are also verified. We also
discuss the nucleation of bubbles in a phi ^6 model. It is found that there
exists an exact solution for the damped motion of the bubble in the thin wall
regime.
","[{""version"":""v1"",""created"":""Mon, 26 Feb 2001 14:59:53 GMT""}]","2009-11-07"
"math/0102191","Dave Witte","Alessandra Iozzi and Dave Witte","Tessellations of homogeneous spaces of classical groups of real rank two","74 pages, 7 figures",,,,"math.RT math.DG",,"  Let H be a closed, connected subgroup of a connected, simple Lie group G with
finite center. The homogeneous space G/H has a ""tessellation"" if there is a
discrete subgroup D of G, such that D acts properly discontinuously on G/H, and
the double-coset space D\G/H is compact. Note that if either H or G/H is
compact, then G/H has a tessellation; these are the obvious examples.
  It is not difficult to see that if G has real rank one, then only the obvious
homogeneous spaces have tessellations. Thus, the first interesting case is when
G has real rank two. In particular, R.Kulkarni and T.Kobayashi constructed
examples that are not obvious when G = SO(2,2n) or SU(2,2n). H.Oh and D.Witte
constructed additional examples in both of these cases, and obtained a complete
classification when G = SO(2,2n). We simplify the work of Oh-Witte, and extend
it to obtain a complete classification when G = SU(2,2n). This includes the
construction of another family of examples.
  The main results are obtained from methods of Y.Benoist and T.Kobayashi: we
fix a Cartan decomposition G = KAK, and study the intersection of KHK with A.
Our exposition generally assumes only the standard theory of connected Lie
groups, although basic properties of real algebraic groups are sometimes also
employed; the specialized techniques that we use are developed from a fairly
elementary level.
","[{""version"":""v1"",""created"":""Sun, 25 Feb 2001 16:25:45 GMT""}]","2007-05-23"
"math/0102192","Philip Foth","Philip Foth","Integrable systems associated with the Bruhat Poisson structures","replaced with an enhanced version",,,,"math.DG math.DS",,"  The purpose of this note is to give a simple description of a (complete)
family of functions in involution on certain hermitian symmetric spaces. This
family, obtained via bi-hamiltonian approach using the Bruhat Poisson
structure, is especially simple for the projective spaces, where the formulas
in terms of the moment map coordinates are presented. We show how these
functions are related to the Gelfand-Tsetlin coordinates. We also show how the
Lenard scheme can be applied.
","[{""version"":""v1"",""created"":""Mon, 26 Feb 2001 03:02:58 GMT""},{""version"":""v2"",""created"":""Mon, 9 Apr 2001 23:41:57 GMT""},{""version"":""v3"",""created"":""Tue, 26 Jun 2001 00:41:22 GMT""}]","2007-05-23"
"math/0102193","David B. Wilson","David Bruce Wilson","Mixing times of lozenge tiling and card shuffling Markov chains","39 pages, 8 figures","Annals of Applied Probability, 14(1):274--325, 2004","10.1214/aoap/1075828054",,"math.PR",,"  We show how to combine Fourier analysis with coupling arguments to bound the
mixing times of a variety of Markov chains. The mixing time is the number of
steps a Markov chain takes to approach its equilibrium distribution. One
application is to a class of Markov chains introduced by Luby, Randall, and
Sinclair to generate random tilings of regions by lozenges. For an L X L region
we bound the mixing time by O(L^4 log L), which improves on the previous bound
of O(L^7), and we show the new bound to be essentially tight. In another
application we resolve a few questions raised by Diaconis and Saloff-Coste, by
lower bounding the mixing time of various card-shuffling Markov chains. Our
lower bounds are within a constant factor of their upper bounds. When we use
our methods to modify a path-coupling analysis of Bubley and Dyer, we obtain an
O(n^3 log n) upper bound on the mixing time of the Karzanov-Khachiyan Markov
chain for linear extensions.
","[{""version"":""v1"",""created"":""Mon, 26 Feb 2001 05:14:05 GMT""},{""version"":""v2"",""created"":""Tue, 31 Dec 2002 20:22:45 GMT""}]","2012-06-19"
"math/0102194","Claude Cibils","Claude Cibils, Eduardo Marcos, Maria Julia Redondo and Andrea Solotar","Cohomology of split algebras and of trivial extensions",,,,,"math.KT math.RA",,"  We consider associative algebras L over a field provided with a direct sum
decomposition of a two-sided ideal M and a sub-algebra A - examples are
provided by trivial extensions or triangular type matrix algebras. In this
relative and split setting we describe a long exact sequence computing the
Hochschild cohomology of L. We study the connecting homomorphism using the
cup-product and we infer several results, in particular the first Hochschild
cohomology group of a trivial extension never vanishes.
","[{""version"":""v1"",""created"":""Mon, 26 Feb 2001 11:24:16 GMT""},{""version"":""v2"",""created"":""Mon, 21 May 2001 14:27:49 GMT""},{""version"":""v3"",""created"":""Tue, 22 Jan 2002 15:17:22 GMT""},{""version"":""v4"",""created"":""Fri, 29 Mar 2002 16:01:48 GMT""},{""version"":""v5"",""created"":""Fri, 5 Jul 2002 08:28:57 GMT""}]","2007-05-23"
"math/0102195","Giovanni landi","Giovanni Landi, John Madore","Twisted Configurations over Quantum Euclidean Spheres","14 pages, latex. Additional minor changes; final version for the
  journal","J.Geom.Phys. 45 (2003) 151-163","10.1016/S0393-0440(02)00132-8",,"math.QA hep-th math.AG",,"  We show that the relations which define the algebras of the quantum Euclidean
planes $\b{R}^N_q$ can be expressed in terms of projections provided that the
unique central element, the radial distance from the origin, is fixed. The
resulting reduced algebras without center are the quantum Euclidean spheres
$S^{N-1}_q$. The projections $e=e^2=e^*$ are elements in
$\Mat_{2^n}(S^{N-1}_q)$, with N=2n+1 or N=2n, and can be regarded as defining
modules of sections of q-generalizations of monopoles, instantons or more
general twisted bundles over the spheres. We also give the algebraic definition
of normal and cotangent bundles over the spheres in terms of canonically
defined projections in $\Mat_{N}(S^{N-1}_q)$.
","[{""version"":""v1"",""created"":""Mon, 26 Feb 2001 13:50:44 GMT""},{""version"":""v2"",""created"":""Mon, 13 May 2002 10:11:22 GMT""},{""version"":""v3"",""created"":""Fri, 21 Jun 2002 15:16:36 GMT""}]","2015-06-26"
"math/0102196","Roberto Longo","Roberto Longo","Conformal Subnets and Intermediate Subfactors","29 pages; AMS-Latex2e","Commun.Math.Phys.237:7-30,2003","10.1007/s00220-003-0814-8",,"math.OA hep-th math-ph math.MP",,"  Given an irreducible local conformal net A of von Neumann algebras on the
circle and a finite-index conformal subnet B of A, we show that A is completely
rational iff B is completely rational. In particular this extends a result of
F. Xu for the orbifold construction. By applying previous results of Xu, many
coset models turn out to be completely rational and the structure results in
[KLM] hold. Our proofs are based on an analysis of the net inclusion B in A;
among other things we show that, for a fixed interval I, every von Neumann
algebra R intermediate between B(I) and A(I) comes from an intermediate
conformal net L between B and A with L(I)=R. We make use of a theorem of
Watatani (type II case) and Teruya and Watatani (type III case) on the
finiteness of the set I(N,M) of intermediate subfactors in an irreducible
inclusion of factors N in M with finite Jones index [M:N]. We provide a unified
proof of this result that gives in particular an explicit bound for the
cardinality of I(N,M) which depends only on [M:N].
","[{""version"":""v1"",""created"":""Mon, 26 Feb 2001 14:43:48 GMT""},{""version"":""v2"",""created"":""Tue, 5 Mar 2002 12:37:34 GMT""}]","2011-04-06"
"nlin/0102034","Giulia Menconi","Claudio Bonanno (Univ. of Pisa), Giulia Menconi (Univ. of Pisa)","Computational information for the logistic map at the chaos threshold","23 pages, 3 figures, changed content",,,,"nlin.CD",,"  We study the logistic map $f(x)=\lambda x(1-x)$ on the unit square at the
chaos threshold. By using the methods of symbolic dynamics, the information
content of an orbit of a dynamical system is defined as the Algorithmic
Information Content (AIC) of a symbolic sequence. We give results for the
behaviour of the AIC for the logistic map. Since the AIC is not a computable
function we use, as approximation of the AIC, a notion of information content
given by the length of the string after it has been compressed by a compression
algorithm, and in particular we introduce a new compression algorithm called
CASToRe. The information content is then used to characterise the chaotic
behaviour.
","[{""version"":""v1"",""created"":""Mon, 26 Feb 2001 09:33:29 GMT""},{""version"":""v2"",""created"":""Tue, 24 Jul 2001 14:19:26 GMT""}]","2009-09-25"
"nucl-ex/0102015","Rivet Marie-France","INDRA Collaboration: G. Tabacaru, B. Borderie, M. F. Rivet, P. Chomaz,
  M. Colonna, J. D. Frankland, A. Guarnera, M. Parlog, B. Bouriquet, A. Chbihi,
  S. Salou, J.P. Wieleczko","Experimental evidence for spinodal decomposition in multifragmentation
  of heavy systems","5 pages, 3 figures, Contribution to Bologna 2000, Structure of the
  Nucleus at the Dawn of the Century, Bologna, Italy, May 29 - June 3, 2000, to
  be published by World Scientific",,,"IPNO DR 01-004","nucl-ex",,"  Multifragmentation of fused systems was observed for central collisions
between 32 AMeV 129Xe and Sn, and 36 AMeV 155Gd and U. Previous extensive
comparisons between the two systems led to the hypothesis of spinodal
decomposition of finite systems as the origin of multifragmentation for
incident energies around 30 AMeV. New results on velocity and charge
correlations of fragments bring strong arguments in favor of this
interpretation.
","[{""version"":""v1"",""created"":""Mon, 26 Feb 2001 10:23:34 GMT""}]","2019-08-17"
"nucl-ex/0102016","Borderie Bernard","B. Borderie","Experimental signals of the first phase transition of nuclear matter","9 pages, 5 figures Invited talk to Bologna 2000, Structure od the
  Nucleus at the Dawn of the century, Bologna, Italy, May 29 - June 3 2000, to
  be published by World Scientific",,"10.1142/9789812810939_0022","IPNO DR 00-25","nucl-ex",,"  Vaporized and multifragmenting sources produced in heavy ion collisions at
intermediate energies are good candidates to investigate the phase diagram of
nuclear matter. The properties of highly excited nuclear sources which undergo
a simultaneous disassembly into particles are found to sign the presence of a
gas phase. For heavy nuclear sources produced in the Fermi energy domain, which
undergo a simultaneous disassembly into particles and fragments, a fossil
signal (fragment size correlations) reveals the origin of
multifragmentation:spinodal instabilities which develop in the unstable
coexistence region of the phase diagram of nuclear matter. Studies of
fluctuations give a direct signature of a first order phase transition through
measurements of a negative microcanonical heat capacity.
","[{""version"":""v1"",""created"":""Mon, 26 Feb 2001 11:38:26 GMT""}]","2017-08-23"
"nucl-th/0102058","Thomas Falter","T. Falter, S. Leupold and U. Mosel","Nuclear shadowing at low photon energies","RevTeX, 16 pages including 6 eps figures; new calculation of
  effective pion propagator, negligible effect on results; version to be
  published in Phys. Rev. C","Phys.Rev. C64 (2001) 024608","10.1103/PhysRevC.64.024608","UGI-01-1","nucl-th hep-ph",,"  We calculate the shadowing effect in nuclear photoabsorption at low photon
energies (1-3 GeV) within a multiple scattering approach. We avoid some of the
high energy approximations that are usually made in simple Glauber theory like
the narrow width and the eikonal approximation. We find that the main
contribution to nuclear shadowing at low energies stems from $\rho^0$ mesons
with masses well below their pole mass. We also show that the possibility of
scattering in non forward directions allows for a new contribution to shadowing
at low energies: the production of neutral pions as intermediate hadronic
states enhances the shadowing effect in the onset region. For light nuclei and
small photon energies they give rise to about 30% of the total shadowing
effect.
","[{""version"":""v1"",""created"":""Mon, 26 Feb 2001 12:57:53 GMT""},{""version"":""v2"",""created"":""Thu, 17 May 2001 13:39:08 GMT""}]","2009-11-07"
"physics/0102082","Phlogiston","Eric Baird","Problems with ""GR without SR: A gravitational-domain description of
  first-order Doppler effects"" (gr-qc/9807084)","PDF, 4 pages, no figures. Update to the earlier ""Doppler mass shift""
  paper",,,,"physics.gen-ph",,"  Einstein's goal of producing an advanced gravitational model that was
independent of special relativity's ""non-gravitational"" derivations has
arguably still not been achieved. The author produced a paper in 1998 outlining
a possible method of attack on the problem based on shift equivalence
principles (""Doppler mass shift""). Some problems with this paper have since
come to light. We list some further developments, some papers not cited in
gr-qc/9807084, some experimental results missed by the author, and identify a
problem with the paper's approach to aberration effects.
","[{""version"":""v1"",""created"":""Sun, 25 Feb 2001 22:19:35 GMT""}]","2007-05-23"
"physics/0102083","Mikhail Achasov","M.N.Achasov, B.A.Baryshev, K.I.Beloborodov, A.V.Bozhenok, S.V.Burdin,
  V.B.Golubev, E.E.Pyata, S.I.Serednyakov, Z.I.Stepanenko, Yu.A.Tikhonov,
  P.V.Vorobyov","Compact vacuum phototriodes for operation in strong magnetic field","9 pages Latex and 8 figures, accepted for publication in Nuclear
  Instruments and Methods in Physics Research","Nucl.Instrum.Meth.A478:506-510,2002","10.1016/S0168-9002(01)00894-4",,"physics.ins-det hep-ex",,"  The results of tests of 1'' vacuum phototriodes in a magnetic field up to 4.5
T are presented. It was found that output amplitude decreases by about 6 % per
tesla in the magnetic field range from 2.0 to 4.0 T. For devices with an anode
mesh pitch of 16$\mu$m, the output amplitude at 4.0 T is 30 % lower than that
at zero field.
","[{""version"":""v1"",""created"":""Mon, 26 Feb 2001 08:52:43 GMT""}]","2010-01-15"
"physics/0102084","Tahir Gulu-zade","R.I. Khrapko (Moscow Aviation Institute)","True energy-momentum tensors are unique. Electrodynamics spin tensor is
  not zero","LaTeX, 12 pages, submitted to ""J. Phys. A"". I include new results
  which confirm the previous version",,,,"physics.class-ph",,"  A true energy-momentum tensor is unique and does not admit an addition of a
term. The true electrodynamics' energy-momentum tensor is the Maxwell-Minkowski
tensor. It cannot be got with the Lagrange formalism. The canonical
energy-momentum and spin tensors are out of all relation to the physical
reality. The true electrodynamics' spin tensor is not equal to a zero. So,
electrodynamics' ponderomotive action comprises a force from the Maxwell stress
tensor and a torque from the spin tensor. A gauge non-invariant expression for
the spin tensor is presented and is used for a consideration of a circularly
polarized standing wave. A circularly polarized light beam carries a spin
angular momentum and an orbital angular momentum. So, we double the beams
angular momentum. The Beths experiment is considered.
","[{""version"":""v1"",""created"":""Mon, 26 Feb 2001 09:59:55 GMT""},{""version"":""v2"",""created"":""Sat, 10 Aug 2002 13:39:46 GMT""}]","2007-05-23"
"physics/0102085","Savely G. Karshenboim","Savely G. Karshenboim (D. I. Mendeleev Institute for Metrology,
  Max-Planck-Institut fur Quantenoptik)","2s Hyperfine Structure in Hydrogen Atom and Helium-3 Ion","10 pages, presented at Hydrogen Atom II meeting (2000)","In Hydrogen atom: Precision physics of simple atomic systems. Ed.
  by S. G. Karshenboim et al., (Springer, Berlin, Heidelberg, 2001) pp. 335-343",,,"physics.atom-ph",,"  The usefulness of study of hyperfine splitting in the hydrogen atom is
limited on a level of 10 ppm by our knowledge of the proton structure. One way
to go beyond 10 ppm is to study a specific difference of the hyperfine
structure intervals 8 Delta nu_2 - Delta nu_1. Nuclear effects for are not
important this difference and it is of use to study higher-order QED
corrections.
","[{""version"":""v1"",""created"":""Mon, 26 Feb 2001 10:39:30 GMT""}]","2007-05-23"
