"cond-mat/0103293","Ferdinando De Pasquale","F. de Pasquale and S.M. Giampaolo","Local quantum coherence and superfluidity","8 pages",,,,"cond-mat.stat-mech",,"  We consider a model of bosons on a regular lattice with a kinetic energy due
to hopping among sites and a potential energy due to strong on site
interaction. A superfluid phase is expected when the ground state of the local
energy is doubly degenerate. We consider a new scheme of simmetry breaking
associated to the superfluid phase in which the order parameter is the
statistical average of the quantum coherence operator associated to the
superposition of the degenerate local ground states. In the strong coupling
limit a systematic expansion of the free energy can be performed in terms of
the hopping amplitude at constant order parameter. Within such an expansion we
obtain a self-consistent equation for the order parameter. The first order
approximation gives, in the case of degeneracy between single occupied and
empty state, the same result of the standard mean field approximation for the
``hard core bosons''. This new approach to the superfluid phase is shown to
have a natural application to the implementation of quantum computation on a
superfluid.
","[{""version"":""v1"",""created"":""Wed, 14 Mar 2001 10:24:40 GMT""}]","2007-05-23"
"cond-mat/0103294","Pavloff Nicolas","P. Leboeuf and N. Pavloff","Bose beams: coherent propagation through a guide","32 pages, 13 figures final version, typos corrected and better
  discussion of the boundary conditions","Phys. Rev. A 64, 033602 (2001)","10.1103/PhysRevA.64.033602",,"cond-mat",,"  We compute the stationary profiles of a coherent beam of Bose condensed atoms
propagating through a guide. Special emphasis is put on the effect of an
obstacle present on the trajectory of the beam. The obstacle considered (such
as a bend in the guide, or a laser field perpendicular to the beam) results in
a repulsive or an attractive potential acting on the condensate. Different
behaviors are observed when varying the beam velocity (with respect to the
speed of sound), the size of the obstacle (relative to the healing length) and
the intensity and sign of the potential. The existence of bound states of the
condensate is also considered.
","[{""version"":""v1"",""created"":""Wed, 14 Mar 2001 10:54:31 GMT""},{""version"":""v2"",""created"":""Wed, 18 Jul 2001 14:34:29 GMT""}]","2009-11-07"
"cond-mat/0103295","Laurent Chusseau","J. Arnaud, L. Chusseau, F. Philippe","Fluorescence from a few electrons","10 pages, 3 figures, RevTeX","Phys. Rev. B 62 (2000) 13482-13489","10.1103/PhysRevB.62.13482",,"cond-mat.mes-hall cond-mat.stat-mech quant-ph",,"  Systems containing few Fermions (e.g., electrons) are of great current
interest. Fluorescence occurs when electrons drop from one level to another
without changing spin. Only electron gases in a state of equilibrium are
considered. When the system may exchange electrons with a large reservoir, the
electron-gas fluorescence is easily obtained from the well-known Fermi-Dirac
distribution. But this is not so when the number of electrons in the system is
prevented from varying, as is the case for isolated systems and for systems
that are in thermal contact with electrical insulators such as diamond. Our
accurate expressions rest on the assumption that single-electron energy levels
are evenly spaced, and that energy coupling and spin coupling between electrons
are small. These assumptions are shown to be realistic for many systems.
Fluorescence from short, nearly isolated, quantum wires is predicted to drop
abruptly in the visible, a result not predicted by the Fermi-Dirac
distribution. Our exact formulas are based on restricted and unrestricted
partitions of integers. The method is considerably simpler than the ones
proposed earlier, which are based on second quantization and contour
integration.
","[{""version"":""v1"",""created"":""Wed, 14 Mar 2001 11:03:10 GMT""}]","2009-11-07"
"cond-mat/0103297","Ehoud Pazy","E. Pazy, I. D'Amico, P. Zanardi and F. Rossi","Storage Qubits and Their Potential Implementation Through a
  Semiconductor Double Quantum Dot","Revised version accepted for publication in Phys.Rev. B. 19 pages, 4
  eps figures","Phys. Rev. B 64, 195320 (2001)","10.1103/PhysRevB.64.195320",,"cond-mat quant-ph",,"  In the context of a semiconductor based implementation of a quantum computer
the idea of a quantum storage bit is presented and a possible implementation
using a double quantum dot structure is considered. A measurement scheme using
a stimulated Raman adiabatic passage is discussed.
","[{""version"":""v1"",""created"":""Wed, 14 Mar 2001 11:23:56 GMT""},{""version"":""v2"",""created"":""Thu, 9 Aug 2001 08:02:48 GMT""}]","2009-11-07"
"cond-mat/0103298","Dr. Uwe Wille","R. Lipperheide, T. Weis, U. Wille","Generalized Drude model: Unification of ballistic and diffusive electron
  transport","14 pages, 5 figures, REVTEX file, to appear in J. Phys.: Condens.
  Matter",,"10.1088/0953-8984/13/14/309",,"cond-mat.mtrl-sci cond-mat.mes-hall",,"  For electron transport in parallel-plane semiconducting structures, a model
is developed that unifies ballistic and diffusive transport and thus
generalizes the Drude model. The unified model is valid for arbitrary magnitude
of the mean free path and arbitrary shape of the conduction band edge profile.
Universal formulas are obtained for the current-voltage characteristic in the
nondegenerate case and for the zero-bias conductance in the degenerate case,
which describe in a transparent manner the interplay of ballistic and diffusive
transport. The semiclassical approach is adopted, but quantum corrections
allowing for tunneling are included. Examples are considered, in particular the
case of chains of grains in polycrystalline or microcrystalline semiconductors
with grain size comparable to, or smaller than, the mean free path. Substantial
deviations of the results of the unified model from those of the ballistic
thermionic-emission model and of the drift-diffusion model are found. The
formulation of the model is one-dimensional, but it is argued that its results
should not differ substantially from those of a fully three-dimensional
treatment.
","[{""version"":""v1"",""created"":""Wed, 14 Mar 2001 13:06:54 GMT""}]","2009-11-07"
"cond-mat/0103299","Aftalion","Amandine Aftalion and Qiang Du","Bose-Einstein condensate: critical velocities and energy diagrams in the
  Thomas-Fermi regime","10pages 9 figures","PRA (2001) Vol 64 063603","10.1103/PhysRevA.64.063603",,"cond-mat.stat-mech",,"  For a Bose-Einstein condensate placed in a rotating trap and confined in the
z axis, we set a framework of study for the Gross-Pitaevskii energy in the
Thomas Fermi regime. We investigate an asymptotic development of the energy,
the critical velocities of nucleation of vortices with respect to a small
parameter $\ep$ and the location of vortices. The limit $\ep$ going to zero
corresponds to the Thomas Fermi regime. The non-dimensionalized energy is
similar to the Ginzburg-Landau energy for superconductors in the high-kappa
high-field limit and our estimates rely on techniques developed for this latter
problem. We also take the advantage of this similarity to develop a numerical
algorithm for computing the Bose-Einstein vortices. Numerical results and
energy diagrams are presented.
","[{""version"":""v1"",""created"":""Wed, 14 Mar 2001 13:10:29 GMT""}]","2009-11-07"
"cond-mat/0103300","Peter Horsch","G. Khaliullin, P. Horsch, and A.M. Oles","Spin Order due to Orbital Fluctuations: Cubic Vanadates","4 pages, 3 figures, to appear in Phys. Rev. Lett","Phys. Rev. Lett. 86, 3879 (2001)","10.1103/PhysRevLett.86.3879",,"cond-mat.str-el",,"  We investigate the highly frustrated spin and orbital superexchange
interactions in cubic vanadates. The fluctuations of $t_{2g}$ orbitals trigger
a {\it novel mechanism of ferromagnetic interactions} between spins S=1 of
V$^{3+}$ ions along one of the cubic directions which operates already in the
absence of Hund's rule exchange $J_H$, and leads to the C-type
antiferromagnetic phase in LaVO$_3$. The Jahn-Teller effect can stabilize the
orbital ordering and the G-type antiferromagnetic phase at low temperatures,
but large entropy due to orbital fluctuations favors again the C-phase at
higher temperatures, as observed in YVO$_3$.
","[{""version"":""v1"",""created"":""Wed, 14 Mar 2001 13:24:53 GMT""}]","2009-11-07"
"cond-mat/0103302","Amish G. Joshi","Amish G. Joshi, C.G.S. Pillai, P. Raj and S.K. Malik","Magnetization studies on superconducting MgB$_2$ - lower and upper
  critical fields and critical current density","7 pages, 6 figures, to be publihed in Solid State Communications
  (2001) [in press]","Solid State Commun. 118 (2001) 445-448","10.1016/S0038-1098(01)00149-1",,"cond-mat.supr-con",,"  Magnetization studies have been carried out on superconducting MgB$_2$
(T$_c$=37K) in the temperature range of 2-50K and in magnetic field up to 5
Tesla. From these measurements, values of the lower critical field H$_c1$(0),
upper critical field H$_c2$(0) at zero K are estimated to be ~300 Oe and ~12.5
Tesla, respectively, which yield a value of ~26 for the Ginzburg-Landau
parameter, k. Magnetization hysteresis loops have been obtained at various
temperatures from which the magnetization critical current density is estimated
using Bean's critical state model.
","[{""version"":""v1"",""created"":""Wed, 14 Mar 2001 14:31:39 GMT""}]","2007-05-23"
"cond-mat/0103303","Slava Yukalov","V.I. Yukalov","Turbulent Photon Filamentation in Resonant Media","RevTex, 6 pages","Phys. Lett. A 278 (2000) 30-34","10.1016/S0375-9601(00)00748-9",,"cond-mat",,"  Optical turbulence is the term that is used being based on the analogy
between hydrodynamic and optical equations. The phenomenon of turbulent photon
filamentation occurs in lasers and other active optical media at high Fresnel
numbers. A description of this phenomenon is suggested. The solutions to
evolution equations are presented in the form of a bunch of filaments
chaotically distributed in space and having different radii. The probability
distribution of patterns is defined characterizing the probabilistic weight of
different filaments. The most probable filament radius and filament number are
found, being in good agreement with experiment.
","[{""version"":""v1"",""created"":""Wed, 14 Mar 2001 14:35:41 GMT""}]","2009-11-07"
"cond-mat/0103304","J. M. Pitarke","A. Garcia-Lekue, M. Nekovee, J. M. Pitarke, and R. Gaudoin","An inhomogeneous and anisotropic Jastrow function for non-uniform
  many-electron systems","9 pages, 2 figures, to appear in Comp. Mater. Sci","Comp. Mater. Sci. 22, 129 (2001)",,,"cond-mat.mtrl-sci",,"  Quantum Monte Carlo simulations of interacting electrons in solids often use
Slater-Jastrow trial wave functions. The Jastrow function takes into account
correlations between pairs of electrons. In simulations of solids, it is common
to use a Jastrow function which is both homogeneous and isotropic. The use of a
homogeneous and isotropic Jastrow factor is questionable in applications to
systems with strong density inhomogeneities, such as surfaces and multilayers.
By generalizing the original derivation of the RPA Jastrow factor for the
homogeneous electron gas [Gaskell] to inhomogeneous systems we derive an scheme
for generating inhomogeneous and anisotropic Jastrow factors for use in
nonuniform systems, from the non-interacting static structure factor and
density of the system. We discuss aspects of our scheme and illustrate it with
a first application to an inhomogeneous electron gas.
","[{""version"":""v1"",""created"":""Wed, 14 Mar 2001 14:43:56 GMT""}]","2007-05-23"
"cond-mat/0103305","Juan LOPEZ Linares","J. Lopez, P. N. Lisboa-Filho, W. A. C. Passos, W. A. Ortiz and F. M.
  Araujo-Moreira (UFSCAR, Sao Carlos) O. F. de Lima (UNICAMP, Campinas) D.
  Schaniel (ETH, Zurich) K. Ghosh (SMSU, Springfield)","Unusual magnetic relaxation behavior in La0.5Ca0.5MnO3 and
  Nd0.5Sr0.5MnO3","Accepted to PRB as a regular article, 10 figures, Scheduled Issue: 01
  June 2001","Phys. Rev. B 63 (22) 224422 (9 pages) 2001","10.1103/PhysRevB.63.224422",,"cond-mat.str-el cond-mat.mtrl-sci",,"  We have carried out a systematic magnetic relaxation study, measured after
applying and switching off a 5 T magnetic field to polycrystalline samples of
La0.5Ca0.5MnO3 and Nd0.5Sr0.5MnO3. The long time logarithmic relaxation rate
(LTLRR), decreased from 10 K to 150 K and increased from 150 K to 195 K in
La0.5Ca0.5MnO3. This change in behavior was found to be related to the complete
suppression of the antiferromagnetic phase above 150 K and in the presence of a
5 T magnetic field. At 195 K, the magnetization first decreased, and after a
few minutes increased slowly as a function of time. Moreover, between 200 K and
245 K, the magnetization increased throughout the measured time span. The
change in the slope of the curves, from negative to positive at about 200 K was
found to be related to the suppression of antiferromagnetic fluctuations in
small magnetic fields. A similar temperature dependence of the LTLRR was found
for the Nd0.5Sr0.5MnO3 sample. However, the temperature where the LTLRR reached
the minimum in Nd0.5Sr0.5MnO3 was lower than that of La0.5Ca0.5MnO3. This
result agrees with the stronger ferromagnetic interactions that exist in
Nd0.5Sr0.5MnO3 in comparison to La0.5Ca0.5MnO3. The above measurements
suggested that the general temperature dependence of the LTLRR and the
underlying physics were mainly independent of the particular charge ordering
system considered. All relaxation curves could be fitted using a logarithmic
law at long times. This slow relaxation was attributed to the coexistence of
ferromagnetic and antiferromagnetic interactions between Mn ions, which
produced a distribution of energy barriers.
","[{""version"":""v1"",""created"":""Wed, 14 Mar 2001 15:11:51 GMT""}]","2009-11-07"
"gr-qc/0103041","Keisuke Taniguchi","Keisuke Taniguchi, Eric Gourgoulhon, and Silvano Bonazzola","Quasiequilibrium sequences of synchronized and irrotational binary
  neutron stars in general relativity. II. Newtonian limits","27 pages, 2 tables, 34 figures, revtex, added one more figure and its
  explanation, accepted to Phys. Rev. D","Phys.Rev. D64 (2001) 064012","10.1103/PhysRevD.64.064012",,"gr-qc astro-ph",,"  We study equilibrium sequences of close binary systems composed of identical
polytropic stars in Newtonian gravity. The solving method is a multi-domain
spectral method which we have recently developed. An improvement is introduced
here for accurate computations of binary systems with stiff equation of state
($\gamma > 2$). The computations are performed for both cases of synchronized
and irrotational binary systems with adiabatic indices $\gamma=3,~2.5,~2.25,~2$
and 1.8. It is found that the turning points of total energy along a
constant-mass sequence appear only for $\gamma \ge 1.8$ for synchronized binary
systems and $\gamma \ge 2.3$ for irrotational ones. In the synchronized case,
the equilibrium sequences terminate by the contact between the two stars. On
the other hand, for irrotational binaries, it is found that the sequences
terminate at a mass shedding limit which corresponds to a detached
configuration.
","[{""version"":""v1"",""created"":""Tue, 13 Mar 2001 16:54:09 GMT""},{""version"":""v2"",""created"":""Tue, 12 Jun 2001 13:54:13 GMT""}]","2009-11-07"
"gr-qc/0103042","Osvaldo M. Moreschi","Osvaldo M. Moreschi and Alejandro Perez","Perturbations with angular momentum of Robinson-Trautman spacetimes","23 pages, no figures","Class.Quant.Grav. 18 (2001) 3701-3720","10.1088/0264-9381/18/17/320",,"gr-qc",,"  We study the possible asymptotically flat perturbations of Robinson-Trautman
spacetimes. We differentiate between algebraically special perturbations and
general perturbations. The equations that determine physically realistic
spacetimes with angular momentum are presented.
","[{""version"":""v1"",""created"":""Tue, 13 Mar 2001 17:46:19 GMT""}]","2009-11-07"
"gr-qc/0103043","Guilherme de Berredo-Peixoto","G. de Berredo-Peixoto, A.B. Penna-Firme and I.L. Shapiro","1-Loop Divergences of Quantum Gravity Using Conformal Parametrization","8 pages, no figures, LaTeX","Mod.Phys.Lett.A15:2335-2343,2000","10.1142/S0217732300002929","CBPF-NF-086/00","gr-qc",,"  We calculate the one-loop divergences for quantum gravity with cosmological
constant, using new parametrization of quantum metric. The conformal factor of
the metric is treated as an independent variable. As a result the theory
possesses an additional degeneracy and one needs an extra conformal gauge
fixing. We verify the on shell independence of the divergences from the
parameter of the conformal gauge fixing, and find a special conformal gauge in
which the divergences coincide with the ones obtained by t'Hooft and Veltman
(1974). Using conformal invariance of the counterterms one can restore the
divergences for the conformal metric-scalar gravity.
","[{""version"":""v1"",""created"":""Tue, 13 Mar 2001 19:38:57 GMT""}]","2011-04-12"
"gr-qc/0103044","John Baez","John C. Baez and Emory F. Bunn","The Meaning of Einstein's Equation","23 pages LaTeX, 8 encapsulated Postscript figures; unlike the
  published version this includes a derivation of the inverse-square force law","Amer. Jour. Phys. 73 (2005), 644-652","10.1119/1.1852541",,"gr-qc astro-ph","http://arxiv.org/licenses/nonexclusive-distrib/1.0/","  This is a brief introduction to general relativity, designed for both
students and teachers of the subject. While there are many excellent
expositions of general relativity, few adequately explain the geometrical
meaning of the basic equation of the theory: Einstein's equation. Here we give
a simple formulation of this equation in terms of the motion of freely falling
test particles. We also sketch some of its consequences, and explain how the
formulation given here is equivalent to the usual one in terms of tensors.
Finally, we include an annotated bibliography of books, articles and websites
suitable for the student of relativity.
","[{""version"":""v1"",""created"":""Tue, 13 Mar 2001 22:38:05 GMT""},{""version"":""v2"",""created"":""Fri, 6 Apr 2001 01:30:30 GMT""},{""version"":""v3"",""created"":""Wed, 18 Aug 2004 17:39:22 GMT""},{""version"":""v4"",""created"":""Thu, 5 Jan 2006 18:23:17 GMT""},{""version"":""v5"",""created"":""Thu, 5 Jan 2006 21:09:33 GMT""},{""version"":""v6"",""created"":""Fri, 12 Jun 2015 07:27:23 GMT""}]","2015-06-15"
"gr-qc/0103045","Mauricio Bellini","F. Lara (Michoacana University), F. Astorga (Michoacana University),
  M. Bellini (Michoacana University)","Inflation from a massive scalar field and scalar perturbations of the
  metric","To appear in Il Nuovo Cimento B","Nuovo Cim.B116:845-852,2001",,,"gr-qc",,"  In the framework of chaotic inflation we study the case of a massive scalar
field using a semiclassical approach. We derive the energy density fluctuations
in the infrared sector generated by matter field and gauge-invariant metric
fluctuations by means of a different method. We find that the super Hubble
density fluctuations increase during inflation for a massive scalar field, in
agreement with the result obtained in a previous work in which a power-law
expanding universe was considered.
","[{""version"":""v1"",""created"":""Tue, 13 Mar 2001 23:55:03 GMT""},{""version"":""v2"",""created"":""Sat, 11 Aug 2001 17:35:36 GMT""}]","2010-11-11"
"gr-qc/0103046","Tekin Dereli","M.Adak (METU,Ankara),T.Dereli (METU,Ankara),L.H.Ryder (Univ.of Kent)","Neutrino Oscillations Induced by Space-Time Torsion","18 pages,LATEX, no figures. To appear in Class.Q.Grav","Class.Quant.Grav.18:1503-1512,2001","10.1088/0264-9381/18/8/307",,"gr-qc",,"  The gravitational neutrino oscillation problem is studied by considering the
Dirac Hamiltonian in a Riemann-Cartan space-time and calculating the dynamical
phase. Torsion contributions which depend on the spin direction of the mass
eigenstates are found. These effects are of the order of Planck scales.
","[{""version"":""v1"",""created"":""Wed, 14 Mar 2001 09:53:53 GMT""}]","2010-12-23"
"gr-qc/0103047","Claus Laemmerzahl","Claus L\""ammerzahl","A Characterisation of the Weylian Structure of Space-Time by Means of
  Low Velocity Tests","to appear in Gen.Rel.Grav","Gen.Rel.Grav. 33 (2001) 815-831","10.1023/A:1010203823865",,"gr-qc",,"  The compatibility axiom in Ehlers, Pirani and Schild's (EPS) constructive
axiomatics of the space-time geometry that uses light rays and freely falling
particles with high velocity, is replaced by several constructions with low
velocity particles only. For that purpose we describe in a space-time with a
conformal structure and an arbitrary path structure the radial acceleration, a
Coriolis acceleration and the zig-zag construction. Each of these quantities
give effects whose requirement to vanish can be taken as alternative version of
the compatibility axiom of EPS. The procedural advantage lies in the fact, that
one can make null-experiments and that one only needs low velocity particles to
test the compatibility axiom. We show in addition that Perlick's standard clock
can exist in a Weyl space only.
","[{""version"":""v1"",""created"":""Wed, 14 Mar 2001 12:46:16 GMT""}]","2015-06-25"
"hep-ex/0103016","Colin Gay","Colin Gay","B Mixing",,"Ann.Rev.Nucl.Part.Sci.50:577-641,2000","10.1146/annurev.nucl.50.1.577",,"hep-ex",,"  The neutral $B$ mesons, $B^0$ and $B_s$, can oscillate between their particle
and antiparticle states owing to flavor-changing weak interactions. In recent
years, techniques to detect these oscillations as a function of the meson's
decay time have been developed. In this article the physics of flavor
oscillations is reviewed and theoretical predictions are summarized. The many
observations that demonstrate the time-dependence of $B^0-\B0bar$ oscillations
are presented along with a combined measurement of its frequency, $\delta m_d$.
The attempts to measure the $B_s$ oscillation frequency, both directly and
indirectly, are then summarized. Finally, values for the CKM elements
$|V_{td}|$ and $|V_{ts}/V_{td}|$ are extracted.
","[{""version"":""v1"",""created"":""Tue, 13 Mar 2001 17:22:19 GMT""}]","2014-11-17"
"hep-ex/0103017","Mikhail Kirsanov","NOMAD Collaboration, P. Astier, et al","Inclusive production of $\rho^{0}(770), f_0(980)$ and $f_2(1270)$ mesons
  in $\nu_{\mu}$ charged current interactions","23 pages, 14 figures, 8 tables. To appear in Nucl. Phys. B","Nucl.Phys.B601:3-23,2001","10.1016/S0550-3213(01)00054-2",,"hep-ex",,"  The inclusive production of the meson resonances $\rho^{0}(770)$, $f_0(980)$
and $f_2(1270)$ in neutrino-nucleus charged current interactions has been
studied with the NOMAD detector exposed to the wide band neutrino beam
generated by 450 GeV protons at the CERN SPS. For the first time the
$f_{0}(980)$ meson is observed in neutrino interactions. The statistical
significance of its observation is 6 standard deviations. The presence of
$f_{2}(1270)$ in neutrino interactions is reliably established. The average
multiplicity of these three resonances is measured as a function of several
kinematic variables. The experimental results are compared to the
multiplicities obtained from a simulation based on the Lund model. In addition,
the average multiplicity of $\rho^{0}(770)$ in antineutrino - nucleus
interactions is measured.
","[{""version"":""v1"",""created"":""Wed, 14 Mar 2001 10:10:25 GMT""}]","2010-05-28"
"hep-ex/0103018","Paul de Jong","Paul de Jong","Colour Reconnection in W Decays","LaTeX, 6 pages, 3 postscript figures",,,"NIKHEF 2001-003","hep-ex",,"  The studies of colour reconnection in e+e- -> WW -> 4 jets events at LEP are
reviewed. It is shown that the analysis of the particle- and energy flow
between jets is sensitive to realistic model predictions. The effects on the W
mass measurement are discussed.
","[{""version"":""v1"",""created"":""Wed, 14 Mar 2001 13:45:47 GMT""}]","2007-05-23"
"hep-lat/0103008","Colin Morningstar","K. Jimmy Juge, Julius Kuti, and Colin Morningstar","From Surface Roughening to QCD String Theory","Contribution to the 24th Johns Hopkins Workshop on Nonperturbative
  QFT and their Applications, Budapest, Hungary, August 2000, 23 pages, 10
  figures",,"10.1142/9789812799968_0006",,"hep-lat hep-ph hep-th",,"  Surface critical phenomena and the related onset of Goldstone modes represent
fundamental properties of the confining flux in Quantum Chromodynamics. New
ideas on surface roughening and their implications for lattice studies of quark
confinement and string formation are presented. Problems with a simple string
description of the large Wilson surface are discussed.
","[{""version"":""v1"",""created"":""Tue, 13 Mar 2001 23:19:04 GMT""}]","2017-08-23"
"hep-lat/0103009","Peter Petreczky","A. Cucchieri, F. Karsch, P. Petreczky","Propagators and Dimensional Reduction of Hot SU(2) Gauge Theory","18 pages RevTex","Phys.Rev.D64:036001,2001","10.1103/PhysRevD.64.036001","BI-TP 2001/04","hep-lat hep-ph",,"  We investigate the large distance behavior of the electric and magnetic
propagators of hot SU(2) gauge theory in different gauges using lattice
simulations of the full 4d theory and the effective, dimensionally reduced 3d
theory. Comparison of the 3d and 4d propagators suggests that dimensional
reduction works surprisingly well down to the temperature T=2 T_c. Within
statistical uncertainty the electric screening mass is found to be gauge
independent. The magnetic propagator, on the other hand, exhibits a complicated
gauge dependent structure at low momentum.
","[{""version"":""v1"",""created"":""Wed, 14 Mar 2001 10:51:03 GMT""},{""version"":""v2"",""created"":""Wed, 23 May 2001 07:05:27 GMT""}]","2009-09-25"
