"astro-ph/0103206","Daniel Mortlock","Daniel J. Mortlock (1), Michael J. Drinkwater (2) ((1) Cambridge
  University, (2) University of Melbourne)","Using the 6dF galaxy redshift survey to detect gravitationally-lensed
  quasars","PASA (OzLens edition), in press; 4 pages, 0 figures","2001, PASA, 18, 195","10.1071/AS01023",,"astro-ph",,"  It is possible to detect gravitationally-lensed quasars spectroscopically if
the spectra obtained during galaxy surveys are searched for the presence of
quasar emission lines. The up-coming 6 degree Field (6dF) redshift survey on
the United Kingdom Schmidt Telescope (UKST) will involve obtaining 10^5 spectra
of near-infrared selected galaxies to a magnitude limit of K = 13. Applying
previously developed techniques implies that at least one lens should be
discovered in the 6dF survey, but that as many as ten could be found if quasars
typically have B_J - K = 8. In this model there could be up to fifty lensed
quasars in the sample, but most of them could only be detected by infrared
spectroscopy.
","[{""version"":""v1"",""created"":""Wed, 14 Mar 2001 11:08:56 GMT""}]","2009-11-06"
"astro-ph/0103207","Daniel Mortlock","Daniel J. Mortlock, Darren S. Madgwick, Ofer Lahav (Cambridge
  University)","The 2dF gravitational lens survey","PASA (OzLens edition), in press; 4 pages, 0 figures","2001, PASA, 18, 192","10.1071/AS01021",,"astro-ph",,"  The 2 degree Field (2dF) galaxy redshift survey will involve obtaining
approximately 2.5 x 10^5 spectra of objects previously identified as galaxy
candidates on morphological grounds. Included in these spectra should be about
ten gravitationally-lensed quasars, all with low-redshift galaxies as
deflectors (as the more common lenses with high-redshift deflectors will be
rejected from the survey as multiple point-sources). The lenses will appear as
superpositions of galaxy and quasar spectra, and both cross-correlation
techniques and principal components analysis should be able to identify
candidates systematically. With the 2dF survey approximately half-completed it
is now viable to begin a systematic search for these spectroscopic lenses, and
the first steps of this project are described here.
","[{""version"":""v1"",""created"":""Wed, 14 Mar 2001 11:15:49 GMT""}]","2009-11-06"
"astro-ph/0103208","Daniel Mortlock","Daniel J. Mortlock (1), Edwin L. Turner (2) ((1) Cambridge University,
  (2) Princeton University)","Gravitational lensing and modified Newtonian dynamics","PASA (OzLens edition), in press; 5 pages, 1 figure","2001, PASA, 18, 189","10.1071/AS01017",,"astro-ph",,"  Gravitational lensing is most often used as a tool to investigate the
distribution of (dark) matter in the universe, but, if the mass distribution is
known a priori, it becomes, at least in principle, a powerful probe of gravity
itself. Lensing observations are a more powerful tool than dynamical
measurements because they allow measurements of the gravitational field far
away from visible matter. For example, modified Newtonian dynamics (MOND) has
no relativistic extension, and so makes no firm lensing predictions, but
galaxy-galaxy lensing data can be used to empirically the deflection law of a
point-mass. MONDian lensing is consistent with general relativity, in so far as
the deflection experienced by a photon is twice that experienced by a massive
particle moving at the speed of light. With the deflection law in place and no
invisible matter, MOND can be tested wherever lensing is observed. The
implications are that either MONDian lensing is completely non-linear or that
MOND is not an accurate description of the universe.
","[{""version"":""v1"",""created"":""Wed, 14 Mar 2001 11:21:43 GMT""}]","2009-11-06"
"astro-ph/0103209","Simon L. Berman","S. Berman","Hydrodynamic simulations of the triaxial bulge of M31","11 pages, 9 figures, Accepted for A+A",,"10.1051/0004-6361:20010391",,"astro-ph",,"  The interstellar gas flow in the inner disk of M31 is modelled using a new,
two dimensional, grid based, hydrodynamics code. The potential of the stellar
bulge is derived from its surface brightness profile. The bulge is assumed to
be triaxial and rotating in the same plane as the disk in order to explain the
twisted nature of M31's central isophotes and the non circular gas velocities
in the inner disk. Results are compared with CO observations and the bulge is
found to be a fast rotator with a B-band mass-to-light ratio, Y = 6.5 +/- 0.8,
and a ratio of co-rotation radius to bulge semi-major axis, R = 1.2 +/- 0.1,
implying that any dark halo must have a low density core in contradiction to
the predictions of CDM. These conclusions would be strengthened by further
observations confirming the model's off axis CO velocity predictions.
","[{""version"":""v1"",""created"":""Wed, 14 Mar 2001 11:51:54 GMT""}]","2009-11-06"
"astro-ph/0103210","Ehud Nakar","Ehud Nakar & Tsvi Piran","Time Scales in Long GRBs","5 pages, 8 figures, accepted for publication by MNRAS","Mon.Not.Roy.Astron.Soc. 331 (2002) 40-44","10.1046/j.1365-8711.2002.05158.x",,"astro-ph",,"  We analyze a sample of bright long bursts and find that the pulses duration
have a lognormal distribution while the intervals between pulses have an excess
of long intervals (relative to lognormal distribution). This excess can be
explained by the existence of quiescent times, long periods with no signal
above the background. The lognormal distribution of the intervals (excluding
the quiescent times) is similar to the distribution of the pulses width. This
result suggests that the quiescent times are made by a different mechanism than
the rest of the intervals. It also suggests that the intervals (excluding the
quiescent times) and the pulse width are connected to the same parameters of
the source. We find that there is a correlation between a pulse width and the
duration of the interval preceding it. There is a weaker, but still a
significant, correlation between a pulse width and the interval following it.
The significance of the correlation drops substantially when the intervals
considered are not adjacent to the pulse.
","[{""version"":""v1"",""created"":""Wed, 14 Mar 2001 11:58:27 GMT""},{""version"":""v2"",""created"":""Sun, 18 Nov 2001 11:08:58 GMT""}]","2009-11-06"
"astro-ph/0103211","Museib Bagirov","M.B. Kerimbekov (Azerbaijan Academy of Sciences Observatory, settl. Y.
  Mamedaliyev, Shamakhy)","On the Surface Waves in the Solar Photosphere","3 pages, paper is available only in ps format",,,,"astro-ph",,"  The regular structures similar to the chains and clusters on the Solar
Photosphere are investigated and mechanism these origin are proposed.
","[{""version"":""v1"",""created"":""Wed, 14 Mar 2001 12:06:57 GMT""}]","2007-05-23"
"astro-ph/0103212","David Fernandez","D. Fernandez, F. Figueras, J. Torra","Kinematics of young stars. II. Galactic spiral structure","18 pages, 6 figures, LaTeX, uses aa.cls. Accepted for publication in
  A&A",,"10.1051/0004-6361:20010366",,"astro-ph",,"  The young star velocity field is analysed by means of a galactic model which
takes into account solar motion, differential galactic rotation and spiral arm
kinematics. We use two samples of Hipparcos data, one containing O- and B-type
stars and another one composed of Cepheid variable stars. The robustness of our
method is tested through careful kinematic simulations. Our results show a
galactic rotation curve with a classical value of $A$ Oort constant for the O
and B star sample ($A^{\mathrm{OB}} =$ 13.7-13.8 km s$^{-1}$ kpc $^{-1}$) and a
higher value for Cepheids ($A^{\mathrm{Cep}} =$ 14.9-16.9 km s$^{-1}$ kpc
$^{-1}$, depending on the cosmic distance scale chosen). The second-order term
is found to be small, compatible with a zero value. The study of the residuals
shows the need for a $K$-term up to a heliocentric distance of 4 kpc, obtaining
a value $K = -$(1-3) km s$^{-1}$ kpc$^{-1}$. The results obtained for the
spiral structure from O and B stars and Cepheids show good agreement. The Sun
is located relatively near the minimum of the spiral perturbation potential
($\psi_\odot =$ 284-20$\degr$) and very near the corotation circle. The angular
rotation velocity of the spiral pattern was found to be $\Omega_{\mathrm{p}}
\approx 30$ km s$^{-1}$ kpc $^{-1}$.
","[{""version"":""v1"",""created"":""Wed, 14 Mar 2001 15:51:04 GMT""}]","2009-11-06"
"cond-mat/0103278","James R. Morris","J. R. Morris and K. M. Ho","Molecular dynamic simulation of a homogeneous bcc -> hcp transition","11 pages plus 8 figures (GIF format); to appear in Phys. Rev. B",,"10.1103/PhysRevB.63.224116",,"cond-mat.mtrl-sci",,"  We have performed molecular dynamic simulations of a Martensitic bcc->hcp
transformation in a homogeneous system. The system evolves into three
Martensitic variants, sharing a common nearest neighbor vector along a bcc
<111> direction, plus an fcc region. Nucleation occurs locally, followed by
subsequent growth. We monitor the time-dependent scattering S(q,t) during the
transformation, and find anomalous, Brillouin zone-dependent scattering similar
to that observed experimentally in a number of systems above the transformation
temperature. This scattering is shown to be related to the elastic strain
associated with the transformation, and is not directly related to the phonon
response.
","[{""version"":""v1"",""created"":""Tue, 13 Mar 2001 16:26:33 GMT""}]","2009-11-07"
"cond-mat/0103279","Doron Cohen","Doron Cohen","Dephasing due to the interaction with chaotic degrees of freedom","8 pages, 2 figures. To be published in Phys. Rev. E. This detailed
  version includes discussion of quantum irreversibility","Phys. Rev. E 65, 026218 (2002).","10.1103/PhysRevE.65.026218",,"cond-mat.mes-hall",,"  We consider the motion of a particle, taking into account its interaction
with environmental degrees of freedom. The dephasing time is determined by the
nature of the environment, and depends on the particle velocity. Our interest
is in the case where the environment consists of few chaotic degrees of
freedom. We obtain results for the dephasing time, and compare them with those
of the effective-bath approach. The latter approach is based on the conjecture
that the environment can be modelled as a collection of infinitely many
harmonic oscillators. The work is related to studies of driven systems, quantum
irreversibility, and fidelity. The specific model that we consider requires the
solution of the problem of a particle-in-a-box with moving wall, whose 1D
version is related to the Fermi acceleration problem.
","[{""version"":""v1"",""created"":""Tue, 13 Mar 2001 16:54:02 GMT""},{""version"":""v2"",""created"":""Fri, 9 Nov 2001 08:58:45 GMT""}]","2009-11-07"
"cond-mat/0103280","Andrey Miroshnochenko","A. E. Miroshnichenko, S. Flach, M. V. Fistul, Y. Zolotaryuk and J. B.
  Page","Breathers in Josephson junction ladders: resonances and electromagnetic
  waves spectroscopy","15 pages, 13 figures","Phys. Rev. E 64, 066601 (2001)","10.1103/PhysRevE.64.066601",,"cond-mat.supr-con",,"  We present a theoretical study of the resonant interaction between dynamical
localized states (discrete breathers) and linear electromagnetic excitations
(EEs) in Josephson junction ladders. By making use of direct numerical
simulations we find that such an interaction manifests itself by resonant steps
and various sharp switchings (voltage jumps) in the current-voltage
characteristics. Moreover, the power of ac oscillations away from the breather
center (the breather tail) displays singularities as the externally applied dc
bias decreases. All these features can be mapped to the spectrum of EEs that
has been derived analytically and numerically. Using an improved analysis of
the breather tail, a spectroscopy of the EEs is developed. The nature of
breather instability driven by localized EEs is established.
","[{""version"":""v1"",""created"":""Tue, 13 Mar 2001 18:02:02 GMT""}]","2009-11-07"
"cond-mat/0103281","Paul Huffman","P. R. Huffman, C. R. Brome, J. S. Butterworth, S. N. Dzhosyuk, R.
  Golub, S. K. Lamoreaux, C. E. H. Mattoni, D. N. McKinsey, and J. M. Doyle","Magnetically Stabilized Luminescent Excitations in Hexagonal Boron
  Nitride","11 pages, 7 figures, to appear in the Journal of Luminescence",,"10.1016/S0022-2313(01)00166-1",,"cond-mat",,"  Magnetically stabilized luminescence is observed in hexagonal boron nitride.
The luminescence is induced by absorption of cold neutrons and is in the
visible region. In the absence of a magnetic field, the photon emission level
is observed to decay over several hundred seconds. A fraction of this
luminescence can be suppressed if the temperature is T <~ 0.6 K and the
magnetic field is B >~ 1.0 T. Subsequent to irradiation and suppression,
luminescence can be induced by an increase in T or lowering of B. Possible
explanations include stabilization of triplet states or the localization and
stabilization of excitons.
","[{""version"":""v1"",""created"":""Tue, 13 Mar 2001 19:27:18 GMT""}]","2009-11-07"
"cond-mat/0103282","Ilya Eremin","M. Eremin and A. Rigamonti","On the ""spin-freezing"" mechanism in underdoped superconducting cuprates",,"Phys. Rev. Lett. 88, 037002 (2002)","10.1103/PhysRevLett.88.037002",,"cond-mat.supr-con cond-mat.str-el",,"  The letter deals with the spin-freezing process observed by means of NMR-NQR
relaxation or by muon spin rotation in underdoped cuprate superconductors. This
phenomenon, sometimes referred as coexistence of antiferromagnetic and
superconducting order parameters, is generally thought to result from randomly
distributed magnetic moments related to charge inhomogeneities (possibly
stripes) which exhibit slowing down of their fluctuations on cooling below
T$_c$ . Instead, we describe the experimental findings as due to fluctuating,
vortex-antivortex, orbital currents state coexisting with d-wave
superconducting state. A direct explanation of the experimental results, in
underdoped Y$_{1-x}$Ca$_x$Ba$_2$Cu$_3$O$_{6.1}$ and La$_{2-x}$Sr$%_x$CuO$_4$,
is thus given in terms of freezing of orbital current fluctuations.
","[{""version"":""v1"",""created"":""Tue, 13 Mar 2001 19:45:45 GMT""}]","2009-11-07"
"cond-mat/0103283","Pudalov V. M.","R. Fletcher, V. M. Pudalov, A. D. B. Radcliffe and C. Possanzini","Critical behaviour of thermopower and conductivity at the
  metal-insulator transition in high-mobility Si-MOSFETs","Extended version of the preprint cond-mat/0002436; 21 pages, 6
  figures","Semicond. Sci.Technol. v16, 386 (2001)","10.1088/0268-1242/16/5/318",,"cond-mat.str-el",,"  This paper reports thermopower and conductivity measurements through the
metal-insulator transition for 2-dimensional electron gases in high mobility
Si-MOSFETs. At low temperatures both thermopower and conductivity show critical
behaviour as a function of electron density. When approaching the critical
density from the metallic side the diffusion thermopower appears to diverge and
the conductivity vanishes. On the insulating side the thermopower shows an
upturn with decreasing temperature. These features have much in common with
those expected for an Anderson transition.
","[{""version"":""v1"",""created"":""Tue, 13 Mar 2001 21:26:26 GMT""}]","2009-11-07"
"cond-mat/0103284","Alberto M. Cuitino","Laurent Stainier, Alberto M. Cuitino and Michael Ortiz","A Micromechanical Model of Hardening, Rate Sensitivity and Thermal
  Softening in BCC Single Crystals","27 pages (LaTeX) and 15 Figures (jpg)",,"10.1016/S0022-5096(01)00114-4",,"cond-mat.mtrl-sci cond-mat.stat-mech",,"  The present paper is concerned with the development of a micromechanical
model of the hardening, rate-sensitivity and thermal softening of bcc crystals.
In formulating the model we specifically consider the following unit processes:
double-kink formation and thermally activated motion of kinks; the close-range
interactions between primary and forest dislocations, leading to the formation
of jogs; the percolation motion of dislocations through a random array of
forest dislocations introducing short-range obstacles of different strengths;
dislocation multiplication due to breeding by double cross-slip; and
dislocation pair annihilation. The model is found to capture salient features
of the behavior of Ta crystals such as: the dependence of the initial yield
point on temperature and strain rate; the presence of a marked stage I of easy
glide, specially at low temperatures and high strain rates; the sharp onset of
stage II hardening and its tendency to shift towards lower strains, and
eventually disappear, as the temperature increases or the strain rate
decreases; the parabolic stage II hardening at low strain rates or high
temperatures; the stage II softening at high strain rates or low temperatures;
the trend towards saturation at high strains; the temperature and strain-rate
dependence of the saturation stress; and the orientation dependence of the
hardening rate.
","[{""version"":""v1"",""created"":""Tue, 13 Mar 2001 22:51:51 GMT""}]","2009-11-07"
"cond-mat/0103285","Jindrich Kolorenc","J. Kolorenc, L. Smrcka, P. Streda","Inter-layer Hall effect in double quantum wells subject to in-plane
  magnetic fields","7 RevTex pages, 4 figures, appendix added and misprint in Eq. (11)
  corrected","Phys. Rev. B 66, 085301 (2002)","10.1103/PhysRevB.66.085301",,"cond-mat.mes-hall",,"  We report on a theoretical study of the transport properties of two coupled
two-dimensional electron systems subject to in-plane magnetic fields. The
charge redistribution in double wells induced by the Lorenz force in crossed
electric and magnetic fields has been studied. We have found that the
redistribution of the charge and the related inter-layer Hall effect originate
in the chirality of diamagnetic currents and give a substantial contribution to
the conductivity.
","[{""version"":""v1"",""created"":""Tue, 13 Mar 2001 21:59:09 GMT""},{""version"":""v2"",""created"":""Wed, 27 Jun 2001 11:25:15 GMT""},{""version"":""v3"",""created"":""Sun, 4 Nov 2001 19:42:55 GMT""}]","2009-11-07"
"cond-mat/0103286","Valeria Del Prete","Valeria Del Prete and Alessandro Treves","A theoretical model of neuronal population coding of stimuli with both
  continuous and discrete dimensions","20 pages, 10 figures",,"10.1103/PhysRevE.64.021912",,"cond-mat.dis-nn q-bio",,"  In a recent study the initial rise of the mutual information between the
firing rates of N neurons and a set of p discrete stimuli has been analytically
evaluated, under the assumption that neurons fire independently of one another
to each stimulus and that each conditional distribution of firing rates is
gaussian. Yet real stimuli or behavioural correlates are high-dimensional, with
both discrete and continuously varying features.Moreover, the gaussian
approximation implies negative firing rates, which is biologically implausible.
Here, we generalize the analysis to the case where the stimulus or behavioural
correlate has both a discrete and a continuous dimension. In the case of large
noise we evaluate the mutual information up to the quadratic approximation as a
function of population size. Then we consider a more realistic distribution of
firing rates, truncated at zero, and we prove that the resulting correction,
with respect to the gaussian firing rates, can be expressed simply as a
renormalization of the noise parameter. Finally, we demonstrate the effect of
averaging the distribution across the discrete dimension, evaluating the mutual
information only with respect to the continuously varying correlate.
","[{""version"":""v1"",""created"":""Tue, 13 Mar 2001 23:18:42 GMT""}]","2009-11-07"
"cond-mat/0103287","Marcos A. Avila","O.F. de Lima, R.A. Ribeiro, M.A. Avila, C.A. Cardoso and A.A. Coelho","Anisotropic superconducting properties of aligned MgB2 crystallites","4 pages, 4 figures; Revised version to appear in Phys. Rev. Lett","published in Phys. Rev. Lett. 86, 5974 (2001).","10.1103/PhysRevLett.86.5974",,"cond-mat.supr-con cond-mat.mtrl-sci",,"  Samples of aligned MgB2 crystallites have been prepared, allowing for the
first time the direct identification of an upper critical field anisotropy
Hc2^{ab}/Hc2^{c}= xi_{ab}/xi_{c} ~ 1.73; with xi_{o,ab} ~ 70 A, xi_{o,c} ~ 40
A, and a mass anisotropy ratio m_{ab}/m_{c} ~ 0.3. A ferromagnetic background
signal was identified, possibly related to the raw materials purity.
","[{""version"":""v1"",""created"":""Tue, 13 Mar 2001 23:28:13 GMT""},{""version"":""v2"",""created"":""Thu, 15 Mar 2001 23:53:46 GMT""},{""version"":""v3"",""created"":""Fri, 16 Mar 2001 00:55:02 GMT""},{""version"":""v4"",""created"":""Tue, 15 May 2001 23:13:28 GMT""}]","2009-11-07"
"cond-mat/0103288","Alexander Kordyuk","A. A. Kordyuk, V. V. Nemoshkalenko, A. I. Plyushchay (IMP Kyiv,
  Ukraine), T. A. Prikhna (ISM Kyiv, Ukraine), W. Gawalek (IPH Jena, Germany)","Simple technique for superconducting joints quality estimation in bulk
  melt-processed high temperature superconductors","3 pages with 2 figures (revtex)","Supercond. Sci. Technol. 14, L41 (2001)","10.1088/0953-2048/14/10/101",,"cond-mat.supr-con",,"  We propose an empirical approach to estimate the quality of superconducting
joints (welds) between blocks of bulk high temperature superconductors (HTS).
As a measuring value, we introduce a joint's quality factor and show its
natural correlation with joint's critical current density. Being simple and
non-destructive, this approach is considered to be quite important to solve the
problem of utilization of HTS in large scale applications. The approach has
been applied to characterize the joint's quality of melt-processed Y-123 joined
by Tm-123 solder.
","[{""version"":""v1"",""created"":""Wed, 14 Mar 2001 01:04:51 GMT""}]","2009-02-28"
"cond-mat/0103289","Alain Karma","Alain Karma (Physics Department and CIRCS, Northeastern University)","Phase-Field Formulation for Quantitative Modeling of Alloy
  Solidification",,,"10.1103/PhysRevLett.87.115701",,"cond-mat.mtrl-sci",,"  A phase-field formulation is introduced to simulate quantitatively
microstructural pattern formation in alloys. The thin-interface limit of this
formulation yields a much less stringent restriction on the choice of interface
thickness than previous formulations and permits to eliminate non-equilibrium
effects at the interface. Dendrite growth simulations with vanishing solid
diffusivity show that both the interface evolution and the solute profile in
the solid are well resolved.
","[{""version"":""v1"",""created"":""Wed, 14 Mar 2001 04:35:17 GMT""}]","2016-08-31"
"cond-mat/0103290","Kozlov","I.V.Ryzhov, G.G. Kozlov, V.A.Malyshev, and J. Knoester","Low-temperature kinetics of exciton-exciton annihilation of weakly
  localized one-dimensional Frenkel excitons","Published in J. Chem. Phys. 114, 1 April (2001)",,"10.1063/1.1352080",,"cond-mat.dis-nn",,"  We present results of numerical simulations of the kinetics of
exciton-exciton annihilation of weakly localized one-dimensional Frenkel
excitons at low temperatures. We find that the kinetics is represented by two
well-distinguished components: a fast short-time decay and a very slow
long-time tail. The former arises from excitons that initially reside in states
belonging to the same localization segment of the chain, while the slow
component is caused by excitons created on different localization segments. We
show that the usual bi-molecular theory fails in the description of the
behavior found. We also present a qualitative analytical explanation of the
non-exponential behavior observed in both the short- and the long-time decay
components.
","[{""version"":""v1"",""created"":""Wed, 14 Mar 2001 08:27:17 GMT""}]","2009-11-07"
"cond-mat/0103291","Sindhunil B. Roy","M. A. Manekar, S. Chaudhary, M. K. Chattopadhyay, K. J. Singh, S. B.
  Roy and P. Chaddah","First order phase transition from ferromagnetism to antiferromagnetism
  in Ce(Fe$_{0.96}$Al$_{0.04}$)$_2$","11 pages of text and 4 figures; submitted to Physical Review Letters",,,,"cond-mat.str-el cond-mat.mtrl-sci",,"  Taking the pseudobinary C15 Laves phase compound
Ce(Fe$_{0.96}$Al$_{0.04}$)$_2$ as a paradigm for studying a ferromagnetic to
antiferromagnetic phase transition, we present interesting thermomagnetic
history effects in magnetotransport as well as magnetisation measurements
across this phase transition. A comparison is made with history effects
observed across the ferromagnetic to antiferromagnetic transition in
R$_{0.5}$Sr$_{0.5}$MnO$_3$ crystals.
","[{""version"":""v1"",""created"":""Wed, 14 Mar 2001 08:32:29 GMT""}]","2007-05-23"
"cond-mat/0103292","Peter Gillin","Peter Gillin, Hidetoshi Nishimori, David Sherrington","Multispin Ising spin glasses with ferromagnetic interactions","16 pages, AMS LaTeX, 14 EPS figures; one minor correction to (42)",,"10.1088/0305-4470/34/14/303",,"cond-mat.dis-nn",,"  We consider the thermodynamics of an infinite-range Ising p-spin glass model
with an additional r-spin ferromagnetic interaction. For r=2 there is a
continuous transition to a ferromagnetic phase, while for r>2 the transition is
first order. We find both glassy and non-glassy ferromagnetic phases, with
replica symmetry breaking of both the one step and full varieties. We obtain
new results for the case where r=p>2, demonstrating the existence of a
non-glassy ferromagnetic phase, of significance to error-correcting codes.
","[{""version"":""v1"",""created"":""Wed, 14 Mar 2001 09:29:35 GMT""},{""version"":""v2"",""created"":""Tue, 20 Mar 2001 12:29:48 GMT""}]","2009-11-07"
