"astro-ph/0111346","Adam Lidz","Adam Lidz, Lam Hui (Columbia University), Matias Zaldarriaga, Roman
  Scoccimarro (NYU)","How Neutral is the Intergalactic Medium at z ~ 6?","20 pages, 5 figures; ApJ accepted version; constraints revised due to
  a revised power spectrum normalization in fiducial model","Astrophys.J. 579 (2002) 491-499","10.1086/342983",,"astro-ph",,"  Recent observations of high redshift quasar spectra reveal long gaps with
little flux. A small or no detectable flux does not by itself imply the
intergalactic medium (IGM) is neutral. Inferring the average neutral fraction
from the observed absorption requires assumptions about clustering of the IGM,
which the gravitational instability model supplies. Our most stringent
constraint on the neutral fraction at z ~ 6 is derived from the mean Lyman-beta
transmission measured from the z=6.28 SDSS quasar of Becker et al. -- the
neutral hydrogen fraction at mean density has to be larger than 4.7 times
10^{-4}. This is substantially higher than the neutral fraction of ~ 3-5 times
10^{-5} at z = 4.5 - 5.7, suggesting that dramatic changes take place around or
just before z ~ 6, even though current constraints are still consistent with a
fairly ionized IGM at z ~ 6. An interesting alternative method to constrain the
neutral fraction is to consider the probability of having many consecutive
pixels with little flux, which is small unless the neutral fraction is high.
This constraint is slightly weaker than the one obtained from the mean
transmission. We show that while the derived neutral fraction at a given
redshift is sensitive to the power spectrum normalization, the size of the jump
around z ~ 6 is not. We caution that systematic uncertainties include spatial
fluctuations in the ionizing background, and the continuum placement. Tests are
proposed. In particular, the sightline to sightline dispersion in mean
transmission might provide a useful diagnostic. We express the dispersion in
terms of the transmission power spectrum, and develop a method to calculate the
dispersion for spectra that are longer than the typical simulation box.
","[{""version"":""v1"",""created"":""Sun, 18 Nov 2001 21:35:14 GMT""},{""version"":""v2"",""created"":""Tue, 20 Nov 2001 16:41:24 GMT""},{""version"":""v3"",""created"":""Sun, 21 Jul 2002 18:15:45 GMT""}]","2009-11-07"
"astro-ph/0111353","Pellegrini Silvia","S. Pellegrini (1), G. Fabbiano (2), F. Fiore (3), G. Trinchieri (4),
  A. Antonelli (3) ((1) Astronomy Department, Bologna University; (2) CfA; (3)
  Rome Astronomical Observatory; (4) Brera Astronomical Observatory, Milan)","Nuclear and global X-ray properties of LINER galaxies: Chandra and
  BeppoSAX results for Sombrero and NGC 4736","13 pages, 12 figures (Fig. 4 and Fig. 5 are colour figures), to be
  published in Astronomy & Astrophysics",,"10.1051/0004-6361:20011482",,"astro-ph",,"  We report on the 0.1--100 keV BeppoSAX observations of two nearby LINER
galaxies, Sombrero and NGC 4736. Chandra ACIS-S observations supplement this
broad-beam spectral study with a high resolution look into the nuclear region,
and show a dominating central point source in Sombrero and a complex X-ray
binary dominated/starburst region in NGC 4736. A compact non-thermal radio
source, present in the nucleus of both galaxies, coincides with the central
source in Sombrero, while in NGC 4736 its X-ray counterpart is a much fainter
point source, not the brightest of the central region. On the basis of these
and other results, we conclude that the LINER activity is linked to the
presence of a low luminosity AGN in Sombrero and to a recent starburst in NGC
4736, and that Chandra's spectroscopic capabilities coupled to high resolution
imaging are essential to establish the origin of the nuclear activity.
","[{""version"":""v1"",""created"":""Mon, 19 Nov 2001 14:58:47 GMT""}]","2009-11-07"
"astro-ph/0111354","Richard Dodson","R. Dodson, K. Golap, J. Osborne, N. UdayaShankar, A.P.Rao","On the association of G343.1-2.3 and PSR 1706-44","4 pages, 2 figures. IAU 199",,,,"astro-ph",,"  The observations of the supernova remnant G343.1-2.3 with the Mauritius Radio
Telescope, the Australia Compact Array, and the Hobart Single dish are
presented. With these more sensitive measurements the association with the
pulsar PSR1706-44 becomes much more likely. The major points from the
observations are presented.
","[{""version"":""v1"",""created"":""Mon, 19 Nov 2001 00:41:07 GMT""}]","2007-05-23"
"astro-ph/0111355","Sachiyo Noda","S. Noda, M. Takeuti, F. Abe, I.A. Bond, R.J. Dodd, J.B. Hearnshaw, M.
  Honda, M. Honma, J. Jugaku, S. Kabe, Y. Kan-ya, Y. Kato, P.M. Kilmartin, Y.
  Matsubara, K. Masuda, Y. Muraki, T. Nakamura, G.R. Nankivell, C. Noguchi, K.
  Ohnishi, M. Reid, N.J. Rattenbury, To. Saito, H. Sato, M. Sekiguchi, J.
  Skuljan, D.J. Sullivan, T. Sumi, Y. Watase, S. Wilkinson, R. Yamada, T.
  Yanagisawa, P.C.M. Yock, and M. Yoshizawa","Study of variable stars in the MOA data base: long-period red variables
  in the Large Magellanic Cloud","19 pages, 19 figures, accepted for publication in MNRAS","Mon.Not.Roy.Astron.Soc. 330 (2002) 137","10.1046/j.1365-8711.2002.05055.x",,"astro-ph",,"  One hundred and forty six long-period red variable stars in the Large
Magellanic Cloud (LMC) from the three year MOA project database were analysed.
A careful periodic analysis was performed on these stars and a catalogue of
their magnitudes, colours, periods and amplitudes is presented. We convert our
blue and red magnitudes to $K$ band values using 19 oxygen-rich stars. A group
of red short-period stars separated from the Mira sequence has been found on a
(log P, K) diagram. They are located at the short period side of the Mira
sequence consistent with the work of Wood and Sebo (1996). There are two
interpretations for such stars; a difference in pulsation mode or a difference
in chemical composition. We investigated the properties of these stars together
with their colour, amplitude and periodicity. We conclude that they have small
amplitudes and less regular variability. They are likely to be higher mode
pulsators. A large scatter has been also found on the long period side of the
(log P, K) diagram. This is possibly a systematic spread given that the blue
band of our photometric system covers both standard B and V bands and affects
carbon-rich stars.
","[{""version"":""v1"",""created"":""Mon, 19 Nov 2001 02:39:28 GMT""}]","2009-11-07"
"astro-ph/0111356","Heino Falcke","Heino Falcke (MPIfR Bonn), Thomas Beckert (MPIfR Bonn), Sera Markoff
  (MPIfR Bonn), Elmar Koerding (MPIfR Bonn), Geoffrey C. Bower (UC Berkeley),
  Rob Fender (Univ. Amsterdam)","The Power of Jets: New Clues from Radio Circular Polarization and X-rays","to appear in: ``Lighthouses of the Universe'', Springer Verlag, ESO
  Astrophysics Symposia, Eds: R.Sunyaev, M.Gilfanov, E.Churazov, LaTex, 8
  pages, 5 figures, also available at
  http://www.mpifr-bonn.mpg.de/staff/hfalcke/publications.html#lighthouses",,"10.1007/10856495_61","hfa/eprint/No.48","astro-ph",,"  Jets are ubiquitous in accreting black holes. Often ignored, they may be a
major contributor to the emitted spectral energy distribution for sub-Eddington
black holes. For example, recent observations of radio-to-X-ray correlations
and broad band spectra of X-ray binaries in the low/hard state can be explained
by a significant synchrotron contribution from jets also to their IR-to-X-ray
spectrum as proposed by Markoff, Falcke, Fender 2001. This model can also
explain state-transitions from low/hard to high/soft states. Relativistic
beaming of the jet X-ray emission could lead to the appearance of seemingly
Super-Eddington X-rays sources in other galaxies. We show that a simple
population synthesis model of X-ray binaries with relativistic beaming can well
explain the currently found distribution of off-nucleus X-ray point sources in
nearby galaxies. Specifically we suggest that the so-called ultra-luminous
X-ray sources (ULXs, also IXOs) could well be relativistically beamed
microblazars. The same model that can be used to explain X-ray binaries also
fits Low-Luminosity AGN (LLAGN) and especially Sgr A* in the Galactic Center.
The recent detection of significant circular polarization in AGN radio cores,
ranging from bright quasars down to low-luminosity AGN like M81*, Sgr A* and
even X-ray binaries, now places additional new constraints on the matter
contents of such jets. The emerging picture are powerful jets with a mix of hot
and cold matter, a net magnetic flux, and a stable magnetic north pole.
","[{""version"":""v1"",""created"":""Mon, 19 Nov 2001 07:30:53 GMT""}]","2009-11-07"
"astro-ph/0111357","Sandro Mereghetti","S. Mereghetti, A. Tiengo, G.L. Israel","The X-ray Source at the Center of the Cassiopeia A Supernova Remnant","15 pages, latex, 3 figures, to appear in The Astrophysical Journal;
  Revised version with more details on spectral analysis, fig. 1 and 2 slightly
  changed, revised flux values",,"10.1086/339277",,"astro-ph",,"  We present the first results of an XMM-Newton observation of the central
X-ray source in the Cas A supernova remnant. The spectrum can be fit equally
well with an absorbed steep power law (alpha~3, N_H~1.5x10^22 cm^-2) or with a
bremsstrahlung with temperature kT~2.4 keV and N_H~10^22 cm^-2. A blackbody
model (kT~0.7 keV) gives a slightly worse fit and requires a column density
N_H~5x10^21 cm^-2 and an emitting area with radius ~0.3 km (for d=3.4 kpc). A
search for pulsations for periods longer than 150 ms gave negative results. The
3 sigma upper limits on the pulsed fraction are ~13% for P>0.3 s and ~7% for
P>3 s. The overall properties of the central X-ray source in Cas A are
difficult to explain in terms of a rapidly spinning neutron star with a
canonical magnetic field of ~10^12 G, and are more similar to those of slowly
rotating neutron stars such as the Anomalous X-ray Pulsars.
","[{""version"":""v1"",""created"":""Mon, 19 Nov 2001 15:07:37 GMT""},{""version"":""v2"",""created"":""Tue, 18 Dec 2001 13:42:19 GMT""}]","2009-11-07"
"cond-mat/0111318","Vladimir Lisy","T. Yu. Tchesskaya, V. Lisy, and A. V. Zatovsky","Hydrodynamic fluctuations of liquids with internal rotation inside a
  pore","6 pages, 2 figures. The work presented at the conference Physics of
  Liquid Matter: Modern Problems, September 14-19, Kyiv, Ukraine, 2001",,,"KBF 2001-11-1","cond-mat.soft",,"  The correlation theory of the thermal hydrodynamic fluctuations of liquids
with internal spin within a spherical cavity is developed. For the hydrodynamic
fields of such a liquid, linearized equations with random thermal sources are
used. For the time dependent amplitudes of the expansion of the fields in the
basis functions of the vector Helmholtz equations a set of Langevin equations
is obtained that allowed us, with the help of the fluctuation-dissipation
theorem, to find the spectral densities of the correlation functions of the
amplitudes. The spectra of the fluctuations of hydrodynamic fields are found in
the form of a superposition of spectral amplitudes of the expansion with
weights expressed as bilinear combinations of the proper coordinate functions
and their derivatives. The correlation functions of the field of the
translational velocity and internal spin of the liquid in one spatial point are
analyzed. They have a sense of local coefficients of the translational and
rotational diffusion coefficients of the Lagrange particle. We represent them
as a series in spherical Bessel functions and roots of transcendental equations
following from the boundary conditions on the sphere. The results demonstrate
that the size of the pore essentially affects the character of the hydrodynamic
fluctuations of the liquid.
","[{""version"":""v1"",""created"":""Mon, 19 Nov 2001 06:32:03 GMT""}]","2007-05-23"
"cond-mat/0111323","Guler","Guler Ergun","Human Sexual Contact Network as a Bipartite Graph","Corrected typos, to be published in Physica A","Physica A 308 (2002) 483-488","10.1016/S0378-4371(02)00628-3",,"cond-mat.stat-mech cond-mat.dis-nn q-bio.PE",,"  A simple model to encapsulate the essential growth properties of \emph{the
web of human sexual contacts} is presented. In the model only heterosexual
connection is considered and represented by a random growing bipartite graph
where both male-female contact networks grow simultaneously. The time evolution
of the model is analysed by a rate equation approach leading to confirm that
male and female sexual contact distributions decay as power laws with exponents
depending on influx and charisma of the sexes.
","[{""version"":""v1"",""created"":""Mon, 19 Nov 2001 00:34:05 GMT""},{""version"":""v2"",""created"":""Tue, 4 Dec 2001 17:51:49 GMT""},{""version"":""v3"",""created"":""Mon, 28 Jan 2002 16:50:26 GMT""}]","2009-11-07"
"cond-mat/0111324","Viatcheslav V. Dobrovitski","V. V. Dobrovitski, M. I. Katsnelson, B. N. Harmon","Length scales coupling for nonlinear dynamical problems in magnetism","4 RevTeX pages, 4 EPS figures",,,,"cond-mat.mtrl-sci cond-mat.stat-mech",,"  The dynamics of real magnets is often governed by several interacting
processes taking place simultaneously at different length scales. For dynamical
simulations the relevant length scales should be coupled, and the energy
transfer accurately described. We show that in this case the micromagnetic
theory is not always reliable. We present a coarse-graining approach applicable
to nonlinear problems, which provides a unified description of all relevant
length scales, allowing a smooth, seamless coupling. The simulations performed
on model systems show that the coarse-graining approach achieves nearly the
precision of all-atom simulations.
","[{""version"":""v1"",""created"":""Sun, 18 Nov 2001 23:35:31 GMT""}]","2007-05-23"
"cond-mat/0111325","Buddhapriya Chakrabarti","B. Chakrabarti and C. Dasgupta (Centre for Condensed Matter Theory,
  Department of Physics, Indian Institute of Science, Bangalore)","Nonequilibrium phase transition in surface growth","7 pages, 4 .eps figures (Minor changes in text and references.)","Europhys. Lett., 61(4), pp. 547-553 (2003)","10.1209/epl/i2003-00164-y",,"cond-mat.stat-mech cond-mat.dis-nn cond-mat.mtrl-sci",,"  Conserved growth models that exhibit a nonlinear instability in which the
height (depth) of isolated pillars (grooves) grows in time are studied by
numerical integration and stochastic simulation. When this instability is
controlled by the introduction of an infinite series of higher-order nonlinear
terms, these models exhibit, as function of a control parameter, a
non-equilibrium phase transition between a kinetically rough phase with
self-affine scaling and a phase that exhibits mound formation, slope selection
and power-law coarsening.
","[{""version"":""v1"",""created"":""Mon, 19 Nov 2001 05:19:29 GMT""},{""version"":""v2"",""created"":""Tue, 1 Jan 2002 09:35:30 GMT""},{""version"":""v3"",""created"":""Fri, 14 Feb 2003 08:59:26 GMT""}]","2009-11-07"
"cond-mat/0111326","Michael","Minghong G. Wu and Michael W. Deem","Monte Carlo Study of the Nucleation Process during Zeolite Synthesis","28 pages, 11 figures, to appear in J. Chem. Phys",,"10.1063/1.1430742",,"cond-mat.stat-mech",,"  An atomic-scale model for silicate solutions is introduced for investigation
of the nucleation process during zeolite synthesis in the absence of a
structure directing agent. Monte Carlo schemes are developed to determine the
equilibrium distribution of silicate cluster sizes within the context of this
model. How the nucleation barrier and critical cluster size change with Si
monomer concentration is discussed. Distance and angle histograms as well as
ring size distributions are calculated and compared with known zeolite
structures. The free energies of critical clusters are compared with those for
small clusters of alpha-quartz.
","[{""version"":""v1"",""created"":""Mon, 19 Nov 2001 05:44:05 GMT""}]","2009-11-07"
"cond-mat/0111327","Mohammadreza Ratimitabar","M. Reza Rahimi Tabar","Disordered Systems and Logarithmic Conformal Field Theory","47 pages, latex, to appear in Int. J. of Mod. Phys. A (2003)","Int.J.Mod.Phys.A18:4703-4746,2003","10.1142/S0217751X03016902",,"cond-mat hep-th",,"  We review a recent development in theoretical understanding of the quenched
averaged correlation functions of disordered systems and the logarithmic
conformal field theory (LCFT) in d-dimensions. The logarithmic conformal field
theory is the generalization of the conformal field theory when the dilatation
operator is not diagonal and has the Jordan form. It is discussed that at the
random fixed point the disordered systems such as random-bond Ising model,
Polymer chain, etc. are described by LCFT and their correlation functions have
logarithmic singularities. As an example we will discuss in detail the
application of LCFT to the problem of random-bond Ising model in $ 2 \leq d
\leq 4$.
","[{""version"":""v1"",""created"":""Mon, 19 Nov 2001 08:09:32 GMT""},{""version"":""v2"",""created"":""Sun, 9 Feb 2003 14:10:29 GMT""}]","2014-10-13"
"cond-mat/0111328","Diptiman Sen","Sujit Sarkar (1) and Diptiman Sen (2) ((1) MPIPKS, Dresden, (2) IISc,
  Bangalore)","Field theoretical study of a spin-1/2 ladder with unequal chain
  exchanges","Revtex, 4 pages, 1 eps figure","Phys. Rev. B 65 (2002) 172408","10.1103/PhysRevB.65.172408",,"cond-mat.str-el",,"  We study the low-energy properties of a Heisenberg spin-1/2 zigzag ladder
with different exchange constants on the two chains. Using a nonlinear
sigma-model field theory and abelian bosonization, we find that the excitations
are gapless, with a finite spin wave velocity, if the values of the chain
exchanges are small. If the chain exchanges are large, the system is gapped,
and the energy spectra of the kink and antikink excitations are different from
each other.
","[{""version"":""v1"",""created"":""Mon, 19 Nov 2001 10:49:06 GMT""}]","2009-11-07"
"cond-mat/0111329","Sang-Hoon Kim","Sang-Hoon Kim and Peter Pfeifer","Condensate of low dimensional charged Bose disks in a uniform magnetic
  field","2 pages, 2 figures",,,,"cond-mat.stat-mech cond-mat.supr-con",,"  The Bose condensation of a stack of low dimensional disks which is composed
of a noninteracting charged Bose gas in a uniform magnetic field is studied. A
statistical approach with density of states at noninteger dimensions are
applied for the system. The condensate fraction of the disk system in a uniform
magnetic field is calculated. The stack of low dimensional charged Bose disks
is found not to share the condensate behavior of the traditional BCS
superfluids.
","[{""version"":""v1"",""created"":""Mon, 19 Nov 2001 11:43:21 GMT""},{""version"":""v2"",""created"":""Thu, 22 Nov 2001 00:33:40 GMT""},{""version"":""v3"",""created"":""Wed, 28 Nov 2001 01:32:20 GMT""}]","2007-05-23"
"cond-mat/0111330","Konstantin Varnashev","Andrei Mudrov and Konstantin Varnashev","Critical behavior of certain antiferromagnets with complicated ordering:
  Four-loop $\ve$-expansion analysis","LaTeX, 16 pages, no figures. Expands on cond-mat/0109338 and includes
  detailed formulas","Phys. Rev. B 64, 214423 (2001) (9 pages)","10.1103/PhysRevB.64.214423",,"cond-mat.stat-mech",,"  The critical behavior of a complex N-component order parameter
Ginzburg-Landau model with isotropic and cubic interactions describing
antiferromagnetic and structural phase transitions in certain crystals with
complicated ordering is studied in the framework of the four-loop
renormalization group (RG) approach in $(4-\ve)$ dimensions. By using
dimensional regularization and the minimal subtraction scheme, the perturbative
expansions for RG functions are deduced and resummed by the Borel-Leroy
transformation combined with a conformal mapping. Investigation of the global
structure of RG flows for the physically significant cases N=2 and N=3 shows
that the model has an anisotropic stable fixed point governing the continuous
phase transitions with new critical exponents. This is supported by the
estimate of the critical dimensionality $N_c=1.445(20)$ obtained from six loops
via the exact relation $N_c={1/2} n_c$ established for the complex and real
hypercubic models.
","[{""version"":""v1"",""created"":""Mon, 19 Nov 2001 14:49:55 GMT""}]","2009-11-07"
"cond-mat/0111332","Sergey Yampolskii","S. V. Yampolskii and F. M. Peeters","Giant vortices in small mesoscopic disks: an approximate description","5 pages, 2 figures (presented at the Second European Conference in
  School Format on Vortex Matter in Superconductors, Crete, Greece, September
  15-25, 2001; to be published in Physica C)",,"10.1016/S0921-4534(01)01274-6",,"cond-mat.supr-con cond-mat.mes-hall",,"  We present an approximate description of the giant vortex state in a thin
mesoscopic superconducting disk within the phenomenological Ginzburg-Landau
approach. Analytical asymptotic expressions for the energies of the states with
fixed vorticity are obtained when a small magnetic flux is accumulated in the
disk. The spectrum of the lowest Landau levels of such a disk is also
discussed.
","[{""version"":""v1"",""created"":""Mon, 19 Nov 2001 15:45:07 GMT""}]","2009-11-07"
"cond-mat/0111333","Oded Agam","Oded Agam, Eldad Bettelheim, P. Wiegmann and A. Zabrodin","Viscous fingering and a shape of an electronic droplet in the Quantum
  Hall regime","4 pages, 1 eps figure included","Phys.Rev.Lett. 88 (2002) 236801","10.1103/PhysRevLett.88.236801",,"cond-mat hep-th nlin.SI",,"  We show that the semiclassical dynamics of an electronic droplet confined in
the plane in a quantizing inhomogeneous magnetic field in the regime when the
electrostatic interaction is negligible is similar to viscous (Saffman-Taylor)
fingering on the interface between two fluids with different viscosities
confined in a Hele-Shaw cell. Both phenomena are described by the same
equations with scales differing by a factor of up to $10^{-9}$. We also report
the quasiclassical wave function of the droplet in an inhomogeneous magnetic
field.
","[{""version"":""v1"",""created"":""Mon, 19 Nov 2001 15:52:57 GMT""},{""version"":""v2"",""created"":""Wed, 13 Feb 2002 10:33:12 GMT""},{""version"":""v3"",""created"":""Thu, 14 Feb 2002 09:58:28 GMT""}]","2007-05-23"
"gr-qc/0111057","Antony C. Searle","Susan M Scott, Benjamin J K Evans and Antony C Searle","GRworkbench: A Computational System Based on Differential Geometry","10 pages, 4 figures, submitted to Proceedings of the Ninth Marcel
  Grossmann Meeting",,"10.1142/9789812777386_0031",,"gr-qc",,"  We have developed a new tool for numerical work in General Relativity:
GRworkbench. While past tools have been ad hoc, GRworkbench closely follows the
framework of Differential Geometry to provide a robust and general way of
computing on analytically defined space-times. We discuss the relationship
between Differential Geometry and C++ classes in GRworkbench, and demonstrate
their utility.
","[{""version"":""v1"",""created"":""Mon, 19 Nov 2001 00:41:00 GMT""}]","2017-08-23"
"gr-qc/0111058","Carlos Augusto Romero Filho","F. Dahia and C. Romero","The embedding of the spacetime in five-dimensional spaces with arbitrary
  non-degenerate Ricci tensor",,"J.Math.Phys. 43 (2002) 3097-3106","10.1063/1.1473680",,"gr-qc",,"  We discuss and prove a theorem which asserts that any n-dimensional
semi-Riemannian manifold can be locally embedded in a (n+1)-dimensional space
with a non-degenerate Ricci tensor which is equal, up to a local analytic
diffeomorphism, to the Ricci tensor of an arbitrary specified space. This may
be regarded as a further extension of the Campbell-Magaard theorem. We
highlight the significance of embedding theorems of increasing degrees of
generality in the context of higher dimensional spacetimes theories and
illustrate the new theorem by establishing the embedding of a general class of
Ricci-flat spacetimes.
","[{""version"":""v1"",""created"":""Mon, 19 Nov 2001 01:50:02 GMT""}]","2015-06-25"
"hep-lat/0111032","Shin Muroya","S. Muroya, A. Nakamura and C. Nonaka","Study of the SU(2) High Density System with Wilson Fermion","Talk at Lattice 2001","Nucl.Phys.Proc.Suppl. 106 (2002) 453-455",,"TWC-01-06","hep-lat",,"  We investigate high density state of SU(2) QCD in the case of the Wilson
fermions with Iwasaki improved action. Based on the Woodbery formula, the ratio
of fermion determinants is evaluated at each step of the Metropolis link
update. At $\beta=0.7$, for $\kappa = 0.150$, and $\kappa = 0.175$, we
calculate thermodynamical quantities, such as, baryon number density, Polyakov
line, and the energy density of gluon sector with chemical potential $\mu$=0 to
0.9 on the $4^{3} \times 8$ lattice. The susceptibility of the Polyakov line to
the chemical potential shows peak at around $\mu = 0.7$ which indicates the
deconfinement phase transition. Behavior of the meson and diquark propagators
with finite chemical potential are also investigated at both side of the peak.
","[{""version"":""v1"",""created"":""Mon, 19 Nov 2001 04:42:27 GMT""}]","2007-05-23"
