"astro-ph/0111345","Stanislav Boldyrev","Stanislav Boldyrev, Aake Nordlund, Paolo Padoan","Scaling relations of supersonic turbulence in star-forming molecular
  clouds","17 pages, 6 figures included","Astrophys.J.573:678-684,2002","10.1086/340758",,"astro-ph nlin.CD physics.flu-dyn",,"  We present a direct numerical and analytical study of driven supersonic MHD
turbulence that is believed to govern the dynamics of star-forming molecular
clouds. We describe statistical properties of the turbulence by measuring the
velocity difference structure functions up to the fifth order. In particular,
the velocity power spectrum in the inertial range is found to be close to E(k)
\~ k^{-1.74}, and the velocity difference scales as <|\Delta u|>~ L^{0.42}. The
results agree well with the Kolmogorov--Burgers analytical model suggested for
supersonic turbulence in [astro-ph/0108300]. We then generalize the model to
more realistic, fractal structure of molecular clouds, and show that depending
on the fractal dimension of a given molecular cloud, the theoretical value for
the velocity spectrum spans the interval [-1.74 ... -1.89], while the
corresponding window for the velocity difference scaling exponent is [0.42 ...
0.78].
","[{""version"":""v1"",""created"":""Mon, 19 Nov 2001 20:35:34 GMT""}]","2009-11-07"
"astro-ph/0111358","Gavin Ramsay","Kinwah Wu (1,2), Mark Cropper (2), Gavin Ramsay (2), Kazuhiro
  Sekiguchi (3) ((1) Univ Sydney, (2) MSSL, (3) NAOJ)","An electrically powered binary star?","accepted by MNRAS","Mon.Not.Roy.Astron.Soc. 331 (2002) 221","10.1046/j.1365-8711.2002.05190.x",,"astro-ph",,"  We propose a model for stellar binary systems consisting of a magnetic and a
non-magnetic white-dwarf pair which is powered principally by electrical
energy. In our model the luminosity is caused by resistive heating of the
stellar atmospheres due to induced currents driven within the binary. This
process is reminiscent of the Jupiter-Io system, but greatly increased in power
because of the larger companion and stronger magnetic field of the primary.
Electrical power is an alternative stellar luminosity source, following on from
nuclear fusion and accretion. We find that this source of heating is sufficient
to account for the observed X-ray luminosity of the 9.5-min binary RX J1914+24,
and provides an explanation for its puzzling characteristics.
","[{""version"":""v1"",""created"":""Mon, 19 Nov 2001 16:07:58 GMT""}]","2009-11-07"
"astro-ph/0111359","Pierini","D. Pierini (The University of Toledo, Ohio)","New clues to the evolution of dwarf early-type galaxies","12 pages, 8 Postscript figures, accepted to MNRAS","Mon.Not.Roy.Astron.Soc. 330 (2002) 997","10.1046/j.1365-8711.2002.05170.x",,"astro-ph",,"  Surface photometry of 18 Virgo cluster dwarf elliptical (dE) and dwarf
lenticular (dS0) galaxies, made by Gavazzi et al. (2001) in the H-band (1.65
micron) and in the B-band (0.44 micron), shows that the ratio of the effective
radii of these stellar systems in the B- and H-band, r_{e B}/r_{e H}, ranges
between 0.7 and 2.2. In particular, dwarf ellipticals and lenticulars with a
red total color index B-H (i.e. with 3.2 < B-H < 4) have equal effective radii
in these two pass-bands. By contrast, blue (i.e. with 2.5 < B-H < 3.1) dEs and
dS0s have B-band effective radii about 50% longer than the H-band ones, on
average. Consistently, strong negative gradients in B-H along the
galactocentric radius are found to be associated with blue total colors. This
trend is not found in a sample of 29 giant E and S0 galaxies of the Coma
cluster with analogous data available in the literature. These early-type
giants span a broad range in r_{e B}/r_{e H} (0.2--2.2), with a mean r_{e
B}/r_{e H} of about 1.1, but a narrow range in (red) color (3.3 < B-H < 4.2).
In these stellar systems, color gradients are usually interpreted as due either
to age/metallicity gradients along the radial coordinate or to dust
attenuation, whatever the total color of the system is. Assuming each of these
three distinct interpretations of the origin of color gradients, we discuss the
origin of the association of strong negative color gradients with blue colors
found in the early-type dwarfs under study, in relation with current scenarios
of formation and evolution of dE and dS0 galaxies.
","[{""version"":""v1"",""created"":""Mon, 19 Nov 2001 16:16:38 GMT""}]","2009-11-07"
"astro-ph/0111360","John Jackson","J.C. Jackson","Coherent Scalar Field Oscillations and the Epoch of Deceleration","6 pages, 4 Figures. Submitted to MNRAS",,,"UNN-SCM-M-01-01","astro-ph gr-qc hep-ph hep-th",,"  The discovery of supernova SN 1997ff at z~1.7 has confirmed the expected
switch from cosmological acceleration to deceleration, as predicted by the
concordance Lambda/CDM model. However, its position in the SN Ia Hubble diagram
suggestes that the switch is too pronounced, which here is taken to mean that a
cosmological constant is not an adequate description of the state of the
vacuum. An 'oscillessence' model is invoked, with a scalar field phi governed
by a simple quadratic potential, which gives a better fit to the new data
point. The field is undergoing coherent oscillations, and a key feature of the
proposal is that we are towards the end of the second period of acceleration; a
Lambda/phi mix replaces Lambda/CDM, with Omega_Lambda~0.4 and Omega_phi~0.6.
","[{""version"":""v1"",""created"":""Mon, 19 Nov 2001 16:39:25 GMT""}]","2007-05-23"
"astro-ph/0111361","Ennio Poretti","Ennio Poretti (Osservatorio Astronomico di Brera) D. Buzasi (Dept. of
  Physics, USAF), R. Laher (SIRTF, Pasadena), J. Catanzarite (California
  Institute of Technology), T. Conrow (California Institute of Technology)","Asteroseismology from space: the Delta Scuti star Theta2 Tauri monitored
  by the WIRE satellite","7 pages (in A&A style), 7 eps figures. Accepted for A&A Main Journal",,"10.1051/0004-6361:20011623",,"astro-ph",,"  The first intensive photometric time-series of a Delta Scuti star was
obtained from space. Theta2 Tau was monitored with the star camera on the
Wide-Field Infrared Explorer (WIRE) satellite. Twelve independent frequencies
were detected down to the 0.5 mmag amplitude level. Their reality was
investigated by searching for them using two different algorithms and by some
internal checks. All the frequencies are in the range 10.8-14.6 c\d. The
histogram of the frequency spacings shows that 81% are below 1.8 c\d; rotation
may thus play a role in the mode excitation. The fundamental radial mode is not
observed, although it is expected to occur in a region where the noise level is
very low (55 micromag). The rms residual is about two times lower than that
usually obtained from successful ground--based multisite campaigns. The
comparison of the results of previous campaigns with the new ones establishes
the amplitude variability of some modes.
","[{""version"":""v1"",""created"":""Mon, 19 Nov 2001 16:44:58 GMT""}]","2009-11-07"
"astro-ph/0111362","Uros Seljak","Uros Seljak (Princeton University)","Cluster abundance normalization from observed mass-temperature relation","5 pages, 2 figures, submitted to MNRAS","Mon.Not.Roy.Astron.Soc. 337 (2002) 769","10.1046/j.1365-8711.2002.05801.x",,"astro-ph",,"  Abundance of rich clusters in local universe is currently believed to provide
the most robust normalization of power spectrum at a scale of 10 Mpc. This
normalization depends very sensitively on the calibration between virial mass M
and temperature T, which is usually taken from simulations. Uncertainties in
the modelling, such as gas cooling and heating, can lead to a factor of two
variations in the normalization and are thus not very reliable. Here we use
instead an empirical M_{500}-T relation derived from X-ray mass determinations
to calibrate the method. We use results from dark matter simulations to relate
the virial mass function to the mass function at observed M_{500}. We find that
the best fitted value in flat models is sigma_8=(0.7 \pm 0.06)
(\Omega_m/0.35)^{-0.44}(\Gamma/0.2)^{0.08}, where only the statistical error is
quoted. This is significantly lower than previously obtained values from the
local cluster abundance. This lower value for sigma_8 is in a better agreement
with cosmic microwave background and large scale structure constraints and
helps alleviate small scale problems of CDM models. Presently the systematic
uncertainties in the mass determination are still large, but ultimately this
method should provide a more reliable way to normalize the M-T relation. This
can be achieved by obtaining a larger sample of well measured cluster masses
out to a significant fraction of virial radius with BeppoSAX, Chandra and
XMM-Newton.
","[{""version"":""v1"",""created"":""Mon, 19 Nov 2001 16:46:15 GMT""},{""version"":""v2"",""created"":""Wed, 21 Nov 2001 02:13:36 GMT""},{""version"":""v3"",""created"":""Mon, 26 Nov 2001 04:22:10 GMT""}]","2009-11-07"
"astro-ph/0111363","Paul P. Plucinsky","Paul P. Plucinsky, Richard J. Edgar, Shanil N. Virani, Leisa K.
  Townsley and Patrick S. Broos","The Low-Energy Spectral Response of the ACIS CCDs","To appear in ``The High Energy Universe at Sharp Focus'' (St. Paul,
  Minnesota 2001), eds Schlegel and Vrtilek (ASP Conference Series)",,,,"astro-ph",,"  The flight calibration of the spectral response of the Advanced CCD Imaging
Spectrometer (ACIS) below 1.5 keV is difficult because of the lack of strong
lines in the calibration source on-board the Chandra X-ray Observatory. We have
been using 1E0102.2-7219 (the brightest supernova remnant in the SMC) to
evaluate the ACIS response matrices, since this remnant has strong lines of O,
Ne and Mg below 1.5 keV. The spectrum of 1E0102.2-7219 has been
well-characterized using the gratings on Chandra and XMM. We have used the
high-resolution spectral data from both gratings instruments to develop a
spectral model for the CCD spectra. Fits with this model are sensitive to any
problems with the gain calibration and the spectral redistribution model. We
have fit the data with the latest response matrix for the S3 device released in
August 2001 (available in CALDB 2.7 or higher). We have also applied the
charge-transfer inefficiency (CTI) correction software (version 1.37) developed
at Penn State to both the Backside-illuminated (BI) and Front-side illuminated
(FI) data and fit the data with the associated CTI-corrected response matrices.
All fits show a significant improvement in the low energy response with the new
matrices. The fits to the FI CCDs demonstrate the utility of the FI CCDs for
spectral analysis, in spite of the radiation damage the devices suffered early
in the mission.
","[{""version"":""v1"",""created"":""Mon, 19 Nov 2001 17:18:14 GMT""}]","2007-05-23"
"astro-ph/0111364","Sarah Brough","Sarah Brough (Liverpool John Moores University), Chris Collins
  (Liverpool John Moores University), Doug Burke (CfA), Bob Mann (IfA,
  University of Edinburgh), Paul Lynam (MPE)","Evolution of Brightest Cluster Galaxies in X-Ray Clusters","4 pages. Accepted for publication in MNRAS","Mon.Not.Roy.Astron.Soc. 329 (2002) 53","10.1046/j.1365-8711.2002.05179.x",,"astro-ph",,"  A recent paper (Burke, Collins & Mann 2000) presents the analysis of the
K-band Hubble diagram of 76 brightest cluster galaxies (BCGs) in X-ray clusters
and shows that the properties of BCGs depend on the X-ray luminosity (Lx) of
their host clusters. Unfortunately, the low numbers of nearby clusters in this
sample makes it difficult to constrain evolutionary trends. In this letter we
extend the Hubble diagram of Burke et al. (2000) to a total of 155 clusters
using new data on 79 BCGs at z<0.1 from the 2MASS extended source catalogue. We
show that the major division between BCGs in high and low-Lx clusters
disappears at z<0.1, with BCGs having similar absolute magnitudes independent
of the X-ray luminosity of their host clusters. At larger redshifts the K-band
light of BCGs in high-Lx systems is consistent with little or no merging back
to z~0.8, whereas BCGs in the low-Lx systems have a different evolutionary
history, with many increasing their mass by a factor >4 since z~1. This
provides direct evidence of hierarchical merging in a galaxy population.
","[{""version"":""v1"",""created"":""Mon, 19 Nov 2001 17:18:37 GMT""}]","2009-11-07"
"astro-ph/0111365","Ata Sarajedini","A. Sarajedini, E. K. Grebel, A. E. Dolphin, P. Seitzer, D. Geisler, P.
  Guhathakurta, P. W. Hodge, I. D. Karachentsev, V. E. Karachentseva, and M. E.
  Sharina","The Stellar Populations of the Cetus Dwarf Spheroidal Galaxy","13 pages, 8 figures, Accepted for publication in the March 10, 2002
  ApJ",,"10.1086/338664",,"astro-ph",,"  We present Hubble Space Telescope Wide Field Planetary Camera 2 photometry in
the V and I passbands of the recently discovered Local Group dwarf spheroidal
galaxy in Cetus. Our color-magnitude diagram extends from above the first
ascent red giant branch (RGB) tip to approximately half a magnitude below the
horizontal branch (HB). Adopting a reddening of E(B-V) = 0.03, the magnitude of
the RGB tip yields a distance modulus of (m-M)o = 24.46 +/- 0.14. After
applying the reddening and distance modulus, we have utilized the color
distribution of RGB stars to determine a mean metal abundance of [Fe/H] = -1.7
on the Zinn & West scale with an intrinsic internal abundance dispersion of
+/-0.2 dex. An indirect calculation of the HB morphology of Cetus based on the
mean dereddened HB color yields (B-R)/(B+V+R) = -0.91 +/- 0.09, which
represents an HB that is redder than what can be attributed solely to Cetus'
metal abundance. As such, Cetus suffers from the `second parameter effect' in
which another parameter besides metallicity is controlling the HB morphology.
If we adopt the conventional `age hypothesis' explanation for the second
parameter effect, then this implies that Cetus is 2-3 Gyr younger than Galactic
globular clusters at its metallicity.
","[{""version"":""v1"",""created"":""Mon, 19 Nov 2001 17:26:48 GMT""}]","2009-11-07"
"astro-ph/0111366","Neven Bilic","Neven Bilic (1 and 2), Gary B. Tupper (1), and Raoul D. Viollier (1)
  ((1) University of Cape Town, SA, (2) Rudjer Boskovic Institute, Zagreb)","Unified description of dark matter at the center and in the halo of the
  Galaxy","13 pages, 3 figures, equations simplified, Fig. 1 slightly changed,
  summary expanded, 6 new references added",,,,"astro-ph hep-ph",,"  We consider a self-gravitating ideal fermion gas at nonzero temperature as a
model for the Galactic halo. The Galactic halo of mass ~ 2 x 10^12 Msol
enclosed within a radius of ~ 200 kpc implies the existence of a supermassive
compact dark object at the Galactic center that is in hydrostatic and thermal
equilibrium with the halo. The central object has a maximal mass of ~ 2.3 x
10^6 Msol within a minimal radius of ~ 18 mpc for fermin masses ~ 15 keV.
","[{""version"":""v1"",""created"":""Mon, 19 Nov 2001 17:48:05 GMT""},{""version"":""v2"",""created"":""Tue, 2 Jul 2002 13:49:46 GMT""}]","2007-05-23"
"astro-ph/0111367","Romain Teyssier","Romain Teyssier (CEA Saclay, France)","Cosmological Hydrodynamics with Adaptive Mesh Refinement: a new high
  resolution code called RAMSES","21 pages and 13 low resolution JPEG images. Accepted for publication
  in A&A","Astron.Astrophys.385:337-364,2002","10.1051/0004-6361:20011817",,"astro-ph",,"  A new N-body and hydrodynamical code, called RAMSES, is presented. It has
been designed to study structure formation in the universe with high spatial
resolution. The code is based on Adaptive Mesh Refinement (AMR) technique, with
a tree based data structure allowing recursive grid refinements on a
cell-by-cell basis. The N-body solver is very similar to the one developed for
the ART code (Kravtsov et al. 97), with minor differences in the exact
implementation. The hydrodynamical solver is based on a second-order Godunov
method, a modern shock-capturing scheme known to compute accurately the thermal
history of the fluid component. The accuracy of the code is carefully estimated
using various test cases, from pure gas dynamical tests to cosmological ones.
The specific refinement strategy used in cosmological simulations is described,
and potential spurious effects associated to shock waves propagation in the
resulting AMR grid are discussed and found to be negligible. Results obtained
in a large N-body and hydrodynamical simulation of structure formation in a low
density LCDM universe are finally reported, with 256^3 particles and 4.1 10^7
cells in the AMR grid, reaching a formal resolution of 8192^3. A convergence
analysis of different quantities, such as dark matter density power spectrum,
gas pressure power spectrum and individual haloes temperature profiles, shows
that numerical results are converging down to the actual resolution limit of
the code, and are well reproduced by recent analytical predictions in the
framework of the halo model.
","[{""version"":""v1"",""created"":""Mon, 19 Nov 2001 18:11:54 GMT""}]","2014-10-13"
"astro-ph/0111368","Steve Allen","S.W. Allen, R.W. Schmidt, A.C. Fabian (IoA, Cambridge, UK)","Chandra observations of RXJ1347.5-1145: the distribution of mass in the
  most X-ray luminous galaxy cluster known","Final version (MNRAS, in press). Small improvments including more
  details on lensing and merger models","Mon.Not.Roy.Astron.Soc.335:256,2002","10.1046/j.1365-8711.2002.05554.x",,"astro-ph",,"  We present Chandra observations of RXJ1347.5-1145, the most X-ray luminous
cluster of galaxies known. We report the discovery of a region of relatively
hot, bright X-ray emission, located approximately 20 arcsec to the southeast of
the main X-ray peak, at a position consistent with the region of enhanced
Sunyaev-Zeldovich effect reported by Komatsu et al. (2001). We suggest that
this region contains shocked gas resulting from a recent subcluster merger
event. Excluding the data for the southeast quadrant, the cluster appears
relatively relaxed. The X-ray gas temperature rises from kT~6 keV within the
central 25 h_50^{-1} kpc radius to a mean value of ~16 keV between 0.1-0.5
h_50^{-1} Mpc. The mass profile for the relaxed regions of the cluster,
determined under the assumption of hydrostatic equilibrium, can be
parameterized by a Navarro, Frenk & White (1997) model with a scale radius
r_s~0.4 h_50^{-1} Mpc and a concentration parameter c~6. The best-fit Chandra
mass model is in good agreement with independent measurements from weak
gravitational lensing studies. Strong lensing data for the central regions of
the cluster can be also explained by the introduction of an additional mass
clump centred on the second brightest galaxy. We argue that this galaxy is
likely to have been the dominant galaxy of the recently merged subcluster.
","[{""version"":""v1"",""created"":""Mon, 19 Nov 2001 18:54:52 GMT""},{""version"":""v2"",""created"":""Thu, 4 Apr 2002 17:57:23 GMT""}]","2008-11-26"
"astro-ph/0111369","Miguel Angel Aloy Toras","L. Scheck (1), M. A. Aloy (1), J. M. Marti (2), J. L. Gomez (3) and E.
  Mueller (1) ((1) Max-Planck-Institut fuer Astrophysik, (2) Departamento de
  Astronomia y Astrofisica -Universidad de Valencia-, (3) Instituto de
  Astrofisica de Andalucia)","Does the plasma composition affect the long term evolution of
  relativistic jets?","41 pages, 12 png figures. See also high quality versions of the
  figures and several movies under
  http://www.mpa-garching.mpg.de/~maa/JETS/LongTermEv/index.html","Mon.Not.Roy.Astron.Soc. 331 (2002) 615","10.1046/j.1365-8711.2002.05210.x",,"astro-ph",,"  We study the influence of the matter content of extragalactic jets on their
morphology, dynamics and emission properties. For this purpose we consider jets
of extremely different compositions including pure leptonic and baryonic
plasmas. Our work is based on two-dimensional relativistic hydrodynamic
simulations of the long-term evolution of powerful extragalactic jets
propagating into a homogeneous environment. The equation of state used in the
simulations accounts for an arbitrary mixture of electrons, protons and
electron-positron pairs. Using the hydrodynamic models we have also computed
synthetic radio maps and the thermal Bremsstrahlung X-ray emission from their
cavities.
  Although there is a difference of about three orders of magnitude in the
temperatures of the cavities inflated by the simulated jets, we find that both
the morphology and the dynamic behaviour are almost independent on the assumed
composition of the jets. Their evolution proceeds in two distinct epochs.
During the first one multidimensional effects are unimportant and the jets
propagate ballistically. The second epoch starts when the first larger vortices
are produced near the jet head causing the beam cross section to increase and
the jet to decelerate. The evolution of the cocoon and cavity is in agreement
with a simple theoretical model. The beam velocities are relativistic ($\Gamma
\simeq 4$) at kiloparsec scales supporting the idea that the X-ray emission of
several extragalactic jets may be due to relativistically boosted CMB photons.
The radio emission of all models is dominated by the contribution of the hot
spots. All models exhibit a depression in the X-rays surface brightness of the
cavity interior in agreement with recent observations.
","[{""version"":""v1"",""created"":""Mon, 19 Nov 2001 19:13:41 GMT""},{""version"":""v2"",""created"":""Tue, 1 Oct 2002 06:56:44 GMT""},{""version"":""v3"",""created"":""Thu, 7 Nov 2002 07:55:32 GMT""}]","2009-11-07"
"astro-ph/0111370","Michael P. Muno","Michael P. Muno, Ronald A. Remillard, and Deepto Chakrabarty (MIT)","How Do Z and Atoll X-ray Binaries Differ?","Five pages, including one table and three figures. Submitted to ApJ
  letters",,"10.1086/340269",,"astro-ph",,"  Low-mass X-ray binaries containing weakly magnetized neutron stars may be
divided into two classes, Z and atoll sources, based in large part upon the
patterns which they trace in plots of two X-ray colors. In this paper, we
examine color-color diagrams of nine atoll sources and five Z sources using
data from the Rossi X-ray Timing Explorer. The five-year span of data we have
examined is significantly longer than those of previous studies. We find that
the previous clear distinction between atoll and Z sources may be an artifact
of incomplete sampling, as those atoll sources which are sampled over a wide
dynamic range in intensity (greater than a factor of 80) trace three-branched
color-color patterns similar to the tracks for which Z sources are named. This
suggests that the two classes are more intimately related than previously
realized, which also has been suggested based upon recent timing studies.
However, detailed differences in the spectral behavior of the two classes argue
against any simple unification.
","[{""version"":""v1"",""created"":""Mon, 19 Nov 2001 19:58:22 GMT""},{""version"":""v2"",""created"":""Fri, 22 Feb 2002 17:05:40 GMT""}]","2009-11-07"
"astro-ph/0111371","Nathan Roche","Nathan Roche, James Lowenthal and David Koo","Keck Spectroscopy and Imaging of Faint Galaxies Identified as
  MicroJansky Radio Sources","20 pages, latex, 16 figures, accepted for publication in MNRAS","Mon.Not.Roy.Astron.Soc. 330 (2002) 307","10.1046/j.1365-8711.2002.05051.x",,"astro-ph",,"  We investigate the nature of the faintest radio sources detected in 3 VLA
surveys, to faint limits 8 microJy at 8.5 GHz. Using the Keck Low Resolution
Imaging Spectrograph in BRI and the Near Infra Red Camera in K, we image 51
radio sources, and identify probable optical counterparts for 50. With LRIS
spectroscopy, we successfully acquire new redshifts for 17 sources, and 9 have
redshifts from previous data. Of this sample of 26, about 60 per cent are disk
galaxies with high radio to optical ratios, indicating ongoing or very recent
starbursts, at redshifts z=0-1. Others are normal, non-interacting galaxies at
z<0.4, QSOs and radioluminous giant ellipticals (obscured AGN?). All of the 14
non-QSO galaxies with spectra show emission lines, but with luminosities
corresponding to star-formation rates about an order of magnitude lower than
estimated from the high radio luminosities (dust extinction?). Three have
strong H-delta absorption (`e+a galaxies'). The Keck spectra also provide
approximate emission line widths and rotation curves. Most (12/14) have
kinematics implying large dynamical masses, and moderate excitation ratios
consistent with L* spirals. The other two, which have sub-L* optical
luminosities, appear to be low-mass galaxies with much higher excitations and
may be more similar to HII galaxies.
","[{""version"":""v1"",""created"":""Mon, 19 Nov 2001 20:25:36 GMT""}]","2009-11-07"
"astro-ph/0111372","Jesus Maiz-Apellaniz","Jes\'us Ma\'iz-Apell\'aniz (1), Lucas Cieza (2), and John W. MacKenty
  (1) ((1) STScI, Baltimore, USA; (2) Florida Institute of Technology,
  Melbourne, USA)","Tip of the Red Giant Branch Distances to NGC 4214, UGC 685, and UGC 5456","To appear in the March 2002 issue of the Astronomical Journal. 19
  pages, including 4 tables and 8 figures. Due to the size limitations of the
  astro-ph service, a reduced resolution version of figures 1-3 is provided
  here. For a full resolution version, please go to http://www.stsci.edu/~jmaiz",,"10.1086/338853",,"astro-ph",,"  We have used WFPC2 VRI observations to calculate the distances to three
nearby galaxies, NGC 4214, UGC 685, and UGC 5456 using the tip of the red giant
branch method. Our values for NGC 4214 (2.94 +/- 0.18 Mpc) and UGC 685 (4.79
+/- 0.30 Mpc) are the most precise measurementes of the distances to these
objects ever made. For UGC 5456 the data do not allow us to reach a decisive
conclusion since there are two possible solutions, one leading towards a short
distance around 3.8 Mpc and another one towards a long distance of 5.6 Mpc or
more.
","[{""version"":""v1"",""created"":""Tue, 20 Nov 2001 00:40:32 GMT""}]","2016-08-16"
