"hep-ph/0111229","Stefano Scopel","A. Bottino (1), F. Donato (2), N. Fornengo (1), S. Scopel (1) ((1)
  Torino U./INFN, (2) LAPTH-Annecy)","Size of the neutralino--nucleon cross--section in the light of a new
  determination of the pion--nucleon sigma term","12 pages, 2 figures, typeset with ReVTeX","Astropart.Phys.18:205-211,2002","10.1016/S0927-6505(02)00107-X","DFTT 32/2001","hep-ph astro-ph",,"  We discuss the implications of a new determination of the pion-nucleon sigma
term for the evaluation of the neutralino-nucleon cross-section, and, in turn,
for detection rates for relic neutralinos in WIMP direct experiments and in
some of the indirect searches. It is shown that the new range for the
pion-nucleon sigma term, taken at its face value, favours values of the
neutralino-nucleon cross-sections which are sizeably larger than some of the
current estimates. Implications for neutralino cosmological properties are
derived.
","[{""version"":""v1"",""created"":""Mon, 19 Nov 2001 18:02:44 GMT""}]","2011-05-23"
"hep-ph/0111230","Thomas G. Rizzo","Thomas G. Rizzo","Black Hole Production Rates at the LHC: Still Large","typo removed; contributed to Snowmass 2001","eConf C010630 (2001) P339",,"SLAC-PUB-9053","hep-ph",,"  We examine the rates for the production of black holes(BH) at the LHC in
light of the exponential suppression of the geometric cross section estimate
proposed by Voloshin. We show that these rates will still be quite large over a
reasonable range of model parameters. While BH production may not be the
dominant process, its unique signature will ensure observability over
conventional backgrounds.
","[{""version"":""v1"",""created"":""Mon, 19 Nov 2001 19:09:51 GMT""},{""version"":""v2"",""created"":""Tue, 11 Dec 2001 19:14:31 GMT""}]","2007-05-23"
"hep-ph/0111231","Igor M. Suslov","I. M. Suslov (P.L.Kapitza Institute for Physical Problems, Russia)","Summing Divergent Perturbative Series in a Strong Coupling Limit. The
  Gell-Mann - Low Function of the \phi^4 Theory","23 pages, PDF","J.Exp.Theor.Phys. 93 (2001) 1-23; Zh.Eksp.Teor.Fiz. 120N1 (2001)
  5-30","10.1134/1.1391515",,"hep-ph cond-mat hep-th",,"  An algorithm is proposed for determining asymptotics of the sum of a
perturbative series in the strong coupling limit using given values of the
expansion coefficients. Operation of the algorithm is illustrated by test
examples, method for estimating errors is developed, and an optimization
procedure is described. Application of the algorithm to the $\phi^4$ theory
gives a behavior $\beta(g)\approx 7.4 g^{0.96}$ at large $g$ for its Gell-Mann
-- Low function. The fact that the exponent is close to unity can be
interpreted as a manifestation of the logarithmic branching of the type
$\beta(g)\sim g (\ln g)^{-\gamma}$ (with $\gamma\approx 0.14$), which is
confirmed by independent evidence. In any case, the $\phi^4$ theory is
internally consistent. The procedure of summing perturbartive series with
arbitrary values of expansion parameter is discussed.
","[{""version"":""v1"",""created"":""Mon, 19 Nov 2001 19:10:24 GMT""}]","2009-11-07"
"hep-ph/0111232","Tancredi Carli","Tancredi Carli","Small-x QCD Effects in Particle Collisions at High Energies","Invited talk at the XX. Int. Sym. on Lepton and Photon Interactions
  at High Energies, Rome, Italy, July 2001","Int.J.Mod.Phys.A17:3185-3203,2002","10.1142/S0217751X02012685",,"hep-ph",,"  Recent theoretical developments to calculate cross sections of hadronic
objects in the high energy limit are summarised and experimental attempts to
establish the need for new QCD effects connected with a resummation of small
hadron momentum fractions x are reviewed.
  The relation between small-$x$ parton dynamics and the phenomenon of
diffraction is briefly out-lined. In addition, a search for a novel,
non-perturbative QCD effect, the production of QCD instanton induced events, is
presented.
","[{""version"":""v1"",""created"":""Mon, 19 Nov 2001 19:38:46 GMT""},{""version"":""v2"",""created"":""Wed, 5 Dec 2001 18:23:16 GMT""}]","2011-01-25"
"hep-ph/0111233","Alexey Anisimov","Alexey Anisimov (UC Santa Cruz, Physics Department)","Thermal Effects And Flat Direction Baryogenesis","20 pages, 8 figures, Latex","Phys.Atom.Nucl. 67 (2004) 640-647; Yad.Fiz. 67 (2004) 660-667","10.1134/1.1690074","SCIPP 01/35","hep-ph",,"  In this paper we provide a detailed numerical study of the influence of
thermal effects on the original picture of AD baryogenesis. These effects are
found to modify the results greatly in some cases. We estimate the
baryon/entropy ratio and provide numerical results on the typical behavior of
the charge as a function of the strength of the potential and other parameters.
","[{""version"":""v1"",""created"":""Mon, 19 Nov 2001 20:17:44 GMT""},{""version"":""v2"",""created"":""Thu, 23 Jan 2003 06:01:20 GMT""}]","2015-06-25"
"hep-ph/0111234","Matt Dobbs","Matt Dobbs","Phase space veto method for next-to-leading order event generators in
  hadronic collisions","18 pages, 15 figures","Phys.Rev. D65 (2002) 094011","10.1103/PhysRevD.65.094011",,"hep-ph",,"  A method for organizing next-to-leading order QCD calculations using a veto
which enforces the cancellations between virtual and real emission diagrams is
applied to hadronic collisions. The method employs phase space slicing with the
slicing parameter determined dynamically event-by-event. It allows for the
generation of unweighted events and can be consistently merged with a parton
shower. The end product is more intuitive for the end user, as it is
probabilistic, and can be easily interfaced to general purpose showering and
hadronization programs to obtain a complete event description suitable for
experimental analyses. As an example an event generator for the process pp -->
Z + X at NLO is presented and interfaced consistently to the PYTHIA shower and
hadronization package.
","[{""version"":""v1"",""created"":""Mon, 19 Nov 2001 20:26:40 GMT""}]","2009-11-07"
"hep-ph/0111235","Gudrun Hiller","Gudrun Hiller (SLAC)","Testing factorization","Invited talk at the 9th International Symposium on Heavy Flavor
  Physics (HF9), 10-13 September 2001, Caltech, Pasadena. To be published in
  the proceedings; 8 pages, 1 figure, uses aipproc","AIP Conf.Proc. 618 (2002) 239-246","10.1063/1.1478842","SLAC-PUB-9009","hep-ph",,"  We briefly review the status of factorization in $b$-decays. We discuss
several experimental tests of its nature and stress their importance. We show
that decays into mesons which have small decay constants or spin greater than
one (`designer mesons') offer a variety of new opportunities.
","[{""version"":""v1"",""created"":""Mon, 19 Nov 2001 22:54:14 GMT""}]","2009-11-07"
"hep-ph/0111236","Umberto Cotti","U. Cotti, L. Diaz-Cruz, C. Pagliarone, E. Vataga","Search for the Lepton Flavour Violating Higgs decay H --> tau mu at
  Hadron Colliders","3 pages, 1 figure, uses RevTeX4. Contribution to Snowmass 2001","eConf C010630 (2001) P102",,,"hep-ph",,"  We study the prospects to detect at hadron colliders the Lepton Flavour
Violating Higgs decay H --> tau mu, which can reach substantial branching
fractions in several extensions of the SM. Among them, the generic two higgs
doublet model can be taken as a representative case where B.R.(H --> tau mu)
can reach values of order 10^-1-10^-2. Bounds on the LFV factor kappa_{tau mu}
of order 0.8-1.7 can be derived at 95% c.l. at Tevatron Run-2 with 4 fb^-1 for
m_H = 110-150 GeV.
","[{""version"":""v1"",""created"":""Tue, 20 Nov 2001 00:33:15 GMT""}]","2007-05-23"
"hep-ph/0111237","Ma Jian-ping","J.P.Ma","Revisiting spin alignment of heavy mesons in its inclusive production","14 pages with one figure","Nucl.Phys. B622 (2002) 416-428","10.1016/S0550-3213(01)00617-4","AS-ITP-2001-0014","hep-ph hep-ex",,"  In the heavy quark limit inclusive production rate of a heavy meson can be
factorized, in which the nonperturbative effect related to the heavy meson can
be characterized by matrix elements defined in the heavy quark effective
theory. Using this factorization, predictions for the full spin density matrix
of a spin-1 and spin-2 meson can be obtained and they are characterized only by
one coefficient representing the nonperturbative effect. Predictions for spin-1
heavy meson are compared with experiment performed at $e^+e^-$ colliders in the
energy range from $\sqrt{s}=10.5$GeV to $\sqrt{s}=91$GeV, a complete agreement
is found for $D^*$- and $B^*$-meson. For $D^{**}$ meson, our prediction suffers
a large correction, as indicated by experimental data. There exists another
approach by taking heavy mesons as bound systems, in which the total angular
momentum of the light degrees of freedom is 1/2 and 3/2 for spin-1 and spin-2
meson respectively, then the diagonal parts of spin density matrices can be
obtained. However, there are distinct differences in the predictions from the
two approaches and they are discussed in detail.
","[{""version"":""v1"",""created"":""Tue, 20 Nov 2001 03:54:16 GMT""}]","2009-11-07"
"hep-ph/0111238","Keiichi Akama","Keiichi Akama (Saitama Medical College), Takashi Hattori (Kanagawa
  Dental College), Kazuo Katsuura (Saitama Medical College)","Naturalness Bounds on Dipole Moments from New Physics","4 pages, 2 figures","Phys.Rev.Lett.88:201601,2002","10.1103/PhysRevLett.88.201601","SMC-PHYS-165","hep-ph",,"  Assuming naturalness that the quantum corrections to the mass should not
exceed the order of the observed mass, we derive and apply model-independent
bounds on the anomalous magnetic moments and electric dipole moments of leptons
and quarks due to new physics.
","[{""version"":""v1"",""created"":""Tue, 20 Nov 2001 06:09:01 GMT""},{""version"":""v2"",""created"":""Thu, 22 Nov 2001 06:33:51 GMT""}]","2008-11-26"
"hep-ph/0111239","Valentina Sadovnikova","E.G. Drukarev, M.G. Ryskin, V.A. Sadovnikova","Expectation values of four-quark operators in pions","9 pages, no figures, typos corrected","Phys.Rev.D65:074015,2002; Erratum-ibid.D66:039903,2002","10.1103/PhysRevD.65.074015 10.1103/PhysRevD.66.039903",,"hep-ph",,"  The values of four-quark operators averaged over pions are expressed through
those averaged over vacuum. The specific values are obtained in the framework
of the factorization assumption. For the condensates of the light quarks of the
same flavour \bar q\Gamma q\bar q\Gamma q the scalar condensate is shown to be
an order of magnitude larger than the other ones. The condensates containing
the strange quarks \bar q q\bar s s appear to be only about twice smaller than
those of the light quarks. The degeneracy of the ground state in the
Nambu--Jona--Lasinio model is shown explicitly.
","[{""version"":""v1"",""created"":""Tue, 20 Nov 2001 08:11:53 GMT""},{""version"":""v2"",""created"":""Tue, 11 Jun 2002 11:40:27 GMT""}]","2014-11-17"
"hep-ph/0111240","Steven D. Bass","Steven D. Bass","Proton spin structure and the axial U(1) problem","Invited talk at the Workshop on the Spin Structure of the Proton and
  Polarized Collider Physics, Trento (July 23-28, 2001), 6 pages, 1 figure","Nucl.Phys.Proc.Suppl. 105 (2002) 56-61","10.1016/S0920-5632(01)01951-X","ECT-01-031","hep-ph",,"  We emphasise the relation between the spin structure of the proton and the
axial U(1) problem. New experiments motivated by the proton spin problem which
could shed light on the nature of U(1) symmetry breaking in QCD are discussed.
","[{""version"":""v1"",""created"":""Tue, 20 Nov 2001 08:21:43 GMT""}]","2009-11-07"
"hep-ph/0111241","Michael Kachelriess","M. Kachelriess","Non-adiabatic oscillations of supernova neutrinos","5 pages, 8 eps figures, JHEP style included. Talk presented at
  ""Neutrino masses and mixings"", Les Houches, June 2001, and at ""EPS HEP 2001"",
  Budapest, July 2001",,,"CERN-TH/2001-325","hep-ph",,"  The level-crossing probability, local and global adiabaticity conditions are
discussed for 2-flavour neutrino oscillations in matter with arbitrary mixing
angle $\theta$. Different approximations for the survival probability of
supernova neutrinos are compared. Results of a combined likelihood analysis of
the observed SN1987A neutrino signal and of the latest solar neutrino data
including the recent SNO CC measurement are presented.
","[{""version"":""v1"",""created"":""Tue, 20 Nov 2001 09:05:34 GMT""}]","2007-05-23"
"hep-ph/0111242","Jean-Marc Virey","P. Taxil, E. Tugcu and J.-M. Virey","Constraints on leptophobic gauge bosons with polarized neutrons and
  protons at RHIC","Latex file, 19 pages and 4 ps fig included","Eur.Phys.J.C24:149-157,2002","10.1007/s100520200900","CPT-01/P.4263","hep-ph",,"  We explore the sensitivity and the physics interest of the measurement of
parity-violating spin asymmetries in one-jet production in the presence of a
new leptophobic neutral gauge boson Z', within polarized hadronic collisions at
the BNL RHIC. We focus on polarized neutron collisions which could be achieved
in a realistic upgrade of the RHIC-Spin program. We show that, in case of a
discovery, a compilation of the information coming from both polarized pp and
nn collisions should constrain the number of Higgs doublets and the presence or
absence of trilinear fermion mass terms in the underlying model of New Physics.
","[{""version"":""v1"",""created"":""Tue, 20 Nov 2001 12:05:40 GMT""}]","2011-09-13"
"hep-ph/0111243","Bourge","Andreas Hocker","Hadronic Contribution to (g-2)_{mu}","Talk given at the ``XXXVIth Rencontres de Moriond'': Electroweak
  Interactions and Unified Theories, Les Arcs (France), March 10-17, 2001",,,"LAL 01-74","hep-ph",,"  The recent precise measurement of the muon magnetic anomaly (g-2)_{mu} at BNL
opens a window into possible new physics, provided the contribution from
hadronic vacuum polarization is well understood. This talk summarizes the
development in the evaluation of the leading order hadronic contributions.
Significant improvement has been achieved in a series of analyses which is
presented historically in three steps: (1), use of tau spectral functions in
addition to e+e- cross sections, (2), extended use of perturbative QCD and (3),
application of QCD sum rule techniques. The uncertainties, in particular
concerning the CVC hypothesis used in step (1), and global quark-hadron duality
employed in steps (2) and (3) are discussed. No new analysis results are given
in these proceedings.
","[{""version"":""v1"",""created"":""Tue, 20 Nov 2001 12:58:41 GMT""}]","2007-05-23"
"hep-ph/0111244","Anne Billups","A.H.Mueller (Colunbia University)","Parton Saturation-An Overview","Cargese Lectures, 34 pages, 19 figures",,,"CU-TH-1035","hep-ph",,"  The idea of partons and the utility of using light-cone gauge in QCD are
introduced. Saturation of quark and gluon distributions are discussed using
simple models and in a more general context. The Golec-Biernat W\usthoff model
and some simple phenomenology are described. A simple, but realistic, equation
for unitary, the Kovchegov equation, is discussed, and an elementary derivation
of the JIMWLK equation is given.
","[{""version"":""v1"",""created"":""Tue, 20 Nov 2001 15:49:48 GMT""}]","2007-05-23"
"hep-th/0111160","Pei-Ming Ho","Tai-Chung Cheng, Pei-Ming Ho, Mao-Chuang Yeh","Perturbative Approach to Higher Derivative and Nonlocal Theories","19 pages, Latex, reference added","Nucl.Phys.B625:151-165,2002","10.1016/S0550-3213(02)00020-2",,"hep-th gr-qc",,"  We review a perturbative approach to deal with Lagrangians with higher or
infinite order time derivatives. It enables us to construct a consistent
Poisson structure and Hamiltonian with only first time derivatives order by
order in coupling. To the lowest order, the Hamiltonian is bounded from below
whenever the potential is. We consider spacetime noncommutative field theory as
an example.
","[{""version"":""v1"",""created"":""Mon, 19 Nov 2001 16:02:44 GMT""},{""version"":""v2"",""created"":""Thu, 6 Dec 2001 08:49:42 GMT""},{""version"":""v3"",""created"":""Thu, 3 Jan 2002 01:47:03 GMT""}]","2008-11-26"
"hep-th/0111161","Cecilia Albertsson","Cecilia Albertsson, Ulf Lindstrom and Maxim Zabzine","N=1 supersymmetric sigma model with boundaries, I","24 pages, LaTeX. v2: minor clarification in section 3.2, reference
  added. v3: section added on N=2 supersymmetry. v4: typos corrected, published
  version","Commun.Math.Phys. 233 (2003) 403-421","10.1007/s00220-002-0756-6",,"hep-th math-ph math.MP",,"  We study an N=1 two-dimensional non-linear sigma model with boundaries
representing, e.g., a gauge fixed open string. We describe the full set of
boundary conditions compatible with N=1 superconformal symmetry. The problem is
analyzed in two different ways: by studying requirements for invariance of the
action, and by studying the conserved supercurrent. We present the target space
interpretation of these results, and identify the appearance of partially
integrable almost product structures.
","[{""version"":""v1"",""created"":""Mon, 19 Nov 2001 16:11:40 GMT""},{""version"":""v2"",""created"":""Tue, 27 Nov 2001 14:20:30 GMT""},{""version"":""v3"",""created"":""Tue, 20 Aug 2002 11:28:43 GMT""},{""version"":""v4"",""created"":""Thu, 13 Feb 2003 14:01:14 GMT""}]","2009-11-07"
"hep-th/0111162",,"O. Miskovic and B. Sazdovic","Canonical approach to 2D supersymmetric WZNW model coupled to
  supergravity","LaTeX, 13 pages","Mod.Phys.Lett. A17 (2002) 1923-1936","10.1142/S0217732302008496",,"hep-th",,"  Starting from the known representation of the Kac-Moody algebra in terms of
the coordinates and momenta, we extend it to the representation of the super
Kac-Moody and super Virasoro algebras. Then we use general canonical method to
construct an action invariant under local gauge symmetries, where components of
the super energy-momentum tensor $L_\pm$ and $G_\pm$ play the role of the
diffeomorphisms and supersymmetries generators respectively. We obtain
covariant extension of WZNW theory with respect to local supersymmetry as well
as explicit expressions for gauge transformations.
","[{""version"":""v1"",""created"":""Mon, 19 Nov 2001 16:18:45 GMT""}]","2009-11-07"
"hep-th/0111163","Asad Naqvi","Vijay Balasubramanian, Asad Naqvi","Giant Gravitons and a Correspondence Principle","14 pages, Latex, references added","Phys.Lett. B528 (2002) 111-120","10.1016/S0370-2693(02)01190-5","UPR-967-T","hep-th",,"  We propose a correspondence between the physics of certain small charge black
holes in AdS_k x S^l and large charge black holes in AdS_l x S^k. The curvature
singularities of these solutions arise, following Myers and Tafjord, from a
condensate of giant gravitons. When the number of condensed giants N_g is much
greater than the number of background branes N, we propose that the system has
an equivalent description in terms of N giant gravitons condensed in a
background created by N_g branes. Our primary evidence is an exact
correspondence between gravitational entropy formulae of small and large charge
solutions in different dimensions.
","[{""version"":""v1"",""created"":""Mon, 19 Nov 2001 16:30:10 GMT""},{""version"":""v2"",""created"":""Thu, 3 Jan 2002 20:56:46 GMT""}]","2009-11-07"
"hep-th/0111164","Boris Barbashov","B.M. Barbashov (JINR, Dubna)","On the Canonical Treatment of Lagrangian Constraints","11 pages, latex, no figures, Presented at the Intern. Conf. ""New
  Trends in High Energy Physics"", Yalta, Ukrain, 8-15 Sept. 2001",,,"JINR Prepr. E2-2001-243","hep-th",,"  The canonical treatment of dynamic systems with manifest Lagrangian
constraints proposed by Berezin is applied to concrete examples: a special
Lagrangian linear in velocities, relativistic particles in proper time gauge, a
relativistic string in orthonormal gauge, and the Maxwell field in the Lorentz
gauge,
","[{""version"":""v1"",""created"":""Mon, 19 Nov 2001 16:41:40 GMT""}]","2007-05-23"
"hep-th/0111165","Dieter Luest H.","Gottfried Curio, Boris Kors and Dieter Lust","Fluxes and Branes in Type II Vacua and M-theory Geometry with G(2) and
  Spin(7) Holonomy","34 pages, latex, no figures, changed appendix on Spin(7) metrics,
  more references added","Nucl.Phys.B636:197-224,2002","10.1016/S0550-3213(02)00404-2","HU-EP-01/33, SPIN-01/24, NSF-ITP-01-82","hep-th",,"  We discuss fluxes of RR and NSNS background fields in type II string
compactifications on non-compact Calabi-Yau threefolds together with their dual
brane description which involves bound states of branes. Simultaneously turning
on RR and NSNS 2-form fluxes in an 1/2 supersymmetric way can be geometrically
described in M-theory by a SL(2,Z) family of metrics of G(2) holonomy. On the
other hand, if the flux configuration only preserves 1/4 of supersymmetries, we
postulate the existence of a new eight-dimensional manifold with spin(7)
holonomy, which does not seem to fit into the classes of known examples. The
latter situation is dual to a 1/4 supersymmetric web of branes on the deformed
conifold. In addition to the 2-form fluxes, we also present some considerations
on type IIA NSNS 4-form and 6-form fluxes.
","[{""version"":""v1"",""created"":""Mon, 19 Nov 2001 18:17:20 GMT""},{""version"":""v2"",""created"":""Tue, 20 Nov 2001 16:06:10 GMT""},{""version"":""v3"",""created"":""Fri, 23 Nov 2001 15:59:54 GMT""},{""version"":""v4"",""created"":""Mon, 11 Feb 2002 15:10:02 GMT""}]","2009-10-07"
"hep-th/0111166","E. Gaburov","Sergiu I. Vacaru","Ellipsoidal Black Hole - Black Tori Systems in 4D Gravity","12 pages, 4 figures","Chapter 12 in: ""Clifford and Riemann Finsler Structures in
  Geometric Mechanics and Gravity, Selected Works by S. Vacaru, P. Stavrinos,
  E. Gaburov and D. Gonta (Geometry Balkan Press, 2006)
  http://www.mathem.pub.ro/dgds/mono/va-t.pdf",,,"hep-th astro-ph gr-qc hep-ph math-ph math.DG math.MP nlin.SI",,"  We construct new classes of exact solutions of the 4D vacuum Einstein
equations which describe ellipsoidal black holes, black tori and combined black
hole -- black tori configurations. The solutions can be static or with
anisotropic polarizations and running constants. They are defined by
off--diagonal metric ansatz which may be diagonalized with respect to
anholonomic moving frames. We examine physical properties of such anholonomic
gravitational configurations and discuss why the anholonomy may remove the
restriction that horizons must be with spherical topology.
","[{""version"":""v1"",""created"":""Mon, 19 Nov 2001 19:43:05 GMT""}]","2007-05-23"
"hep-th/0111167","Cristine Nunes Ferreira","V. B. Bezerra (UFPB) and C. N. Ferreira (CCP/CBPF)","Gravitational field around a screwed superconducting cosmic string in
  scalar-tensor theories","22 pages, LaTeX, presented at the ""XXII - Encontro Nacional de Fisica
  de Particulas e Campos"", Sao Lourenco, MG, Brazil","Phys.Rev.D65:084030,2002","10.1103/PhysRevD.65.084030",,"hep-th",,"  We obtain the solution that corresponds to a screwed superconducting cosmic
string (SSCS) in the framework of a general scalar-tensor theory including
torsion. We investigate the metric of the SSCS in Brans-Dicke theory with
torsion and analyze the case without torsion. We show that in the case with
torsion the space-time background presents other properties different from that
in which torsion is absent. When the spin vanish, this torsion is a
$\phi$-gradient and then it propagates outside of the string. We investigate
the effect of torsion on the gravitational force and on the geodesics of a
test-particle moving around the SSCS. The accretion of matter by wakes
formation when a SSCS moves with speed $v $ is investigated. We compare our
results with those obtained for cosmic strings in the framework of
scalar-tensor theory.
","[{""version"":""v1"",""created"":""Mon, 19 Nov 2001 20:15:42 GMT""}]","2011-04-20"
"hep-th/0111168","Arthur Lue","Arthur Lue (New York University)","Cosmic Strings in a Braneworld Theory with Metastable Gravitons","18 pages, 2 figures, revtex. Improved discussion of interpolating
  solution. To be published in Phys. Rev. D","Phys.Rev. D66 (2002) 043509","10.1103/PhysRevD.66.043509","NYU-TH 01/11/01","hep-th astro-ph gr-qc hep-ph",,"  If the graviton possesses an arbitrarily small (but nonvanishing) mass,
perturbation theory implies that cosmic strings have a nonzero Newtonian
potential. Nevertheless in Einstein gravity, where the graviton is strictly
massless, the Newtonian potential of a cosmic string vanishes. This discrepancy
is an example of the van Dam--Veltman--Zakharov (VDVZ) discontinuity. We
present a solution for the metric around a cosmic string in a braneworld theory
with a graviton metastable on the brane. This theory possesses those features
that yield a VDVZ discontinuity in massive gravity, but nevertheless is
generally covariant and classically self-consistent. Although the cosmic string
in this theory supports a nontrivial Newtonian potential far from the source,
one can recover the Einstein solution in a region near the cosmic string. That
latter region grows as the graviton's effective linewidth vanishes (analogous
to a vanishing graviton mass), suggesting the lack of a VDVZ discontinuity in
this theory. Moreover, the presence of scale dependent structure in the metric
may have consequences for the search for cosmic strings through gravitational
lensing techniques.
","[{""version"":""v1"",""created"":""Tue, 20 Nov 2001 07:34:41 GMT""},{""version"":""v2"",""created"":""Tue, 11 Dec 2001 16:25:14 GMT""},{""version"":""v3"",""created"":""Wed, 14 Aug 2002 18:50:23 GMT""}]","2009-11-07"
