"hep-th/0111225","John W. Moffat","J. W. Moffat","M-Theory on a Supermanifold","25 pages, LaTeX file, no figures",,,,"hep-th astro-ph gr-qc hep-ph",,"  A conjectured finite M-theory based on eleven-dimensional supergravity
formulated in a superspace with a non-anticommutative <>-product of field
operators is proposed. Supermembranes are incorporated in the superspace
<>-product formalism. When the deformed supersymmetry invariant action of
eleven-dimensional supergravity theory is expanded about the standard
supersymmetry invariant action, the spontaneously compactified M-theory can
yield a four-dimensional de Sitter spacetime inflationary solution with dark
energy described by the four-form F-fields. A fit to the present cosmological
data for an accelerating universe is obtained from matter fields describing the
dominant dark matter and the four-form F-field dark energy. Chiral fermions are
obtained from the M-theory by allowing singularities in the compact internal
seven-dimensional space. The possibility of obtaining a realistic M-theory
containing the standard model is discussed.
","[{""version"":""v1"",""created"":""Sat, 24 Nov 2001 19:31:11 GMT""}]","2007-05-23"
"hep-th/0111226","Rolf Schimmrigk","Rolf Schimmrigk","Arithmetic of Calabi-Yau Varieties and Rational Conformal Field Theory","21 pages, Latex","J.Geom.Phys. 44 (2003) 555-569","10.1016/S0393-0440(02)00079-7","NSF-ITP-01-158","hep-th",,"  It is proposed that certain techniques from arithmetic algebraic geometry
provide a framework which is useful to formulate a direct and intrinsic link
between the geometry of Calabi-Yau manifolds and the underlying conformal field
theory. Specifically it is pointed out how the algebraic number field
determined by the fusion rules of the conformal field theory can be derived
from the number theoretic structure of the cohomological Hasse-Weil L-function
determined by Artin's congruent zeta function of the algebraic variety. In this
context a natural number theoretic characterization arises for the quantum
dimensions in this geometrically determined algebraic number field.
","[{""version"":""v1"",""created"":""Sat, 24 Nov 2001 20:59:10 GMT""}]","2015-06-26"
"hep-th/0111228","Michael Flohr","Michael Flohr","Bits and Pieces in Logarithmic Conformal Field Theory","91 pages, notes of lectures delivered at the first School and
  Workshop on Logarithmic Conformal Field Theory and its Applications, Tehran,
  September 2001. Amendments in Introduction","Int.J.Mod.Phys.A18:4497-4592,2003","10.1142/S0217751X03016859",,"hep-th cond-mat",,"  These are notes of my lectures held at the first School & Workshop on
Logarithmic Conformal Field Theory and its Applications, September 2001 in
Tehran, Iran.
  These notes cover only selected parts of the by now quite extensive knowledge
on logarithmic conformal field theories. In particular, I discuss the proper
generalization of null vectors towards the logarithmic case, and how these can
be used to compute correlation functions. My other main topic is modular
invariance, where I discuss the problem of the generalization of characters in
the case of indecomposable representations, a proposal for a Verlinde formula
for fusion rules and identities relating the partition functions of logarithmic
conformal field theories to such of well known ordinary conformal field
theories.
  These two main topics are complemented by some remarks on ghost systems, the
Haldane-Rezayi fractional quantum Hall state, and the relation of these two to
the logarithmic c=-2 theory.
","[{""version"":""v1"",""created"":""Sun, 25 Nov 2001 14:17:58 GMT""},{""version"":""v2"",""created"":""Thu, 6 Jun 2002 13:10:00 GMT""}]","2008-11-26"
"math/0111258","Oliver Klehn","Oliver Klehn","Local residues of holomorphic 1-forms on an isolated surface singularity","minor typographical errors corrected, 16pages, to appear in man. math",,,,"math.AG",,"  We define local residues of holomorphic 1-forms on an isolated surface
singularity that have isolated zeros and prove that a certain residue equals
the index of the 1-forms.
","[{""version"":""v1"",""created"":""Sun, 25 Nov 2001 01:56:02 GMT""},{""version"":""v2"",""created"":""Sun, 10 Mar 2002 16:42:51 GMT""},{""version"":""v3"",""created"":""Wed, 22 May 2002 20:37:35 GMT""},{""version"":""v4"",""created"":""Tue, 16 Jul 2002 12:40:43 GMT""}]","2007-05-23"
"nucl-th/0111070","Dirk H. Rischke","R.D. Pisarski and D.H. Rischke","Gauge invariance of the color-superconducting gap on the mass shell","8 pages, Proceedings of the Conference on Statistical QCD, Bielefeld,
  August 26 - 30, 2001","Nucl.Phys. A702 (2002) 177-184","10.1016/S0375-9474(02)00702-9",,"nucl-th hep-ph",,"  The gap parameter for color superconductivity is expected to be a gauge
invariant quantity, at least on the appropriate mass shell. Computing the gap
to subleading order in the QCD coupling constant, g, we show that the prefactor
of the exponential in 1/g is gauge dependent off the mass shell, and
independent of gauge on the mass shell.
","[{""version"":""v1"",""created"":""Sat, 24 Nov 2001 18:11:31 GMT""}]","2009-11-07"
"physics/0111173","Timo T. Korhonen","Timo Korhonen, Martin Heiniger","Timing system of the Swiss Light Source","Presented at ICALEPCS 2002, November 27-30, 2001, San Jose, CA
  (FRAT004). 3 pages, 1 figure","eConf C011127 (2001) FRAT004",,,"physics.acc-ph",,"  The timing system of the Swiss Light Source is based on the event system
concept of APS, Argonne [1]. However, for SLS the hardware was completely
redesigned while preserving the software compatibility with the APS system.
This gave us a head start in the implementation: we could use the latest
available hardware and take advantage of the features integrated in the EPICS
software. The event system is used as the sole timing distribution method, for
hardware trigger delivery (assisted with a high-precision delay at a few
places) and for controlling all the timing-related tasks of operation: injector
sequencing, filling patterns, software synchronization, timestamps and so on.
The event network is also extended to the beamlines to allow synchronization of
the beamline experiments. The implementation consists of the hardware (Gigabit
Ethernet link, FPGAs) and a firmware core written in VHDL. The functionality of
the cards can be modified in situ by rewriting the firmware in flash memory. On
the other hand, the functionality can be easily ported to new hardware
architectures, allowing smooth upgrade paths and maximal reusability of the
soft- and hardware resources.
  [1] F.R.Lenkszus et.al., 'The Advanced Photon Source Event System', Proc.
ICALEPCS'95
","[{""version"":""v1"",""created"":""Sat, 24 Nov 2001 21:23:51 GMT""}]","2007-05-23"
"physics/0111174","Roland Mueller","R. Bakker, T. Birke, R. Mueller (BESSY, Berlin, Germany)","Signal Archiving and Retrieval: Essential Long Term Performance Tuning
  Tool","Paper for oral presentation submitted to ICALEPCS'01, San Jose, USA,
  Nov.2001, PSN # FRBT005, 1 LaTeX File (3 Pages), 5 EPS-Figure Files, 1
  LaTeX-Class File, 1 PostScript File, 1 pdf-File","eConf C011127 (2001) FRBT005",,,"physics.acc-ph",,"  The first two years of user service of the third generation light source
BESSY II emphasized the importance of a reliable, comprehensive and dense
logging of a few thousand setpoints, readbacks, status and alarm values. Today
data from sources with various characteristics residing in different protected
networks are centrally collected and retrievable via an uncomplex CGI program
to any desktop system on the site. Data post-processing tools cover Windows
applications, IDL, SDDS and custom programs matching users skills and
preferences. In this paper illustrative sample data explorations are described
that underline the importance of the logging system for operations as well as
for the understanding of singular events or long term drifts. Serious
shortcomings of the present installation and focus of further development are
described.
","[{""version"":""v1"",""created"":""Sun, 25 Nov 2001 01:38:22 GMT""}]","2007-05-23"
"physics/0111176",,"V.V. Lyahov, V.M. Neshchadim","The Landau Damping Effect and Complex-valued Nature of Physical
  Quantities","6 pages, 1 table",,,"Glushcko's Physical & Engineering Laboratory report N-099/20.11.2001","physics.plasm-ph",,"  Within the framework of the hypothesis offered by authors about
complex-valued nature of physical quantities, the effect of the Landau damping
has been explored with assumption that not only frequency can be a small
imaginary component but also a wave vector. The numerical solution of the
obtained dispersion equation testifies that uncollisional damping is
accompanied in a certain region of space by antidumping of waves, and in
particular situations antidumping may prevail over damping. It is possible that
this effect may explain the experimental difficulties connected with inhibition
of instabilities of plasma in the problem of controllable thermonuclear fusion.
","[{""version"":""v1"",""created"":""Sun, 25 Nov 2001 13:29:55 GMT""}]","2007-05-23"
"physics/0111177","John Weiner","G. Leveque, G. Colas des Francs, C. Girard, J.-C. Weeber, C. Meier, C.
  Robilliard, R. Mathevet, and J. Weiner","Polarization state of the optical near-field","9 pages, 11 figures, accepted for publication in Phys. Rev. E",,"10.1103/PhysRevE.65.036701",,"physics.atom-ph",,"  The polarization state of the optical electromagnetic field lying several
nanometers above complex dielectric structures reveals the intricate
light-matter interaction that occurs in this near-field zone. This information
can only be extracted from an analysis of the polarization state of the
detected light in the near-field. These polarization states can be calculated
by different numerical methods well-suited to near--field optics. In this
paper, we apply two different techniques (Localized Green Function Method and
Differential Theory of Gratings) to separate each polarisation component
associated with both electric and magnetic optical near-fields produced by
nanometer sized objects. The analysis is carried out in two stages: in the
first stage, we use a simple dipolar model to achieve insight into the physical
origin of the near-field polarization state. In the second stage, we calculate
accurate numerical field maps, simulating experimental near-field light
detection, to supplement the data produced by analytical models. We conclude
this study by demonstrating the role played by the near-field polarization in
the formation of the local density of states.
","[{""version"":""v1"",""created"":""Sun, 25 Nov 2001 15:51:21 GMT""}]","2009-11-07"
"quant-ph/0111130","Andrei Khrennikov","Andrei Khrennikov and Johann Summhammer","Dialogue on Classical and Quantum between mathematician and experimenter",,,,,"quant-ph",,"  This dialogue took place at V\""axj\""o, 19 November 2001. The main aim of our
meeting in V\""axj\""o was to clarify our viewpoints on foundations of quantum
mechanics. The most attractive in our discussion was the extreme difference in
our quantum experiences. On one side, pure mathematician (specializing in
foundations of probability theory), Andrei Khrennikov; on the other side, pure
experimenter (specializing in neutron and electron interferometry), Johann
Summhammer. On one hand, an attempt to test mathematical models for larger and
larger domains of physical reality. On the other hand, an attempt to create
this reality from experimental information - roughly speaking from clicks of
detectors.
","[{""version"":""v1"",""created"":""Sat, 24 Nov 2001 17:22:31 GMT""}]","2007-05-23"
"quant-ph/0111131","W. A. Hofer","W. A. Hofer","Numerical simulation of interference experiments in a local hidden
  variables model","Eight pages (LaTeX) and nine figures (EPS). For related papers see
  http://cmmp.phys.ucl.ac.uk/~wah/index.html",,,,"quant-ph",,"  We present a theoretical model which allows to keep track of all photons in
an interferometer. The model is implemented in a numerical scheme, and we
simulate photon interference measurements on one, two, four, and eight slits.
Measurements are simulated for the high intensity regime, where we show that
our simulations describe all experimental results so far. With a slightly
modified concept we can also model interference experiments in the low
intensity regime, these experiments have recently been performed with single
molecules. Finally, we predict the result of polarization measurements, which
allow to check the model experimentally.
","[{""version"":""v1"",""created"":""Sat, 24 Nov 2001 18:20:46 GMT""}]","2007-05-23"
"quant-ph/0111132","H. J. Korsch","M. Glueck, A. R. Kolovsky, H. J. Korsch","Wannier-Stark resonances in optical and semiconductor superlattices","94 pages, 41 figures, typos corrected, references added","Phys. Rep. 366 (2002) 103","10.1016/S0370-1573(02)00142-4",,"quant-ph",,"  In this work, we discuss the resonance states of a quantum particle in a
periodic potential plus a static force. Originally this problem was formulated
for a crystal electron subject to a static electric field and it is nowadays
known as the Wannier-Stark problem. We describe a novel approach to the
Wannier-Stark problem developed in recent years. This approach allows to
compute the complex energy spectrum of a Wannier-Stark system as the poles of a
rigorously constructed scattering matrix and solves the Wannier-Stark problem
without any approximation. The suggested method is very efficient from the
numerical point of view and has proven to be a powerful analytic tool for
Wannier-Stark resonances appearing in different physical systems such as
optical lattices or semiconductor superlattices.
","[{""version"":""v1"",""created"":""Sat, 24 Nov 2001 22:27:38 GMT""},{""version"":""v2"",""created"":""Mon, 18 Mar 2002 22:34:51 GMT""}]","2009-11-07"
"quant-ph/0111133","Domenico D'Alessandro","D. D'Alessandro","Uniform Finite Generation of Compact Lie Groups and universal quantum
  gates",,,,,"quant-ph",,"  Consider a compact connected Lie group $G$ and the corresponding Lie algebra
$\cal L$. Let $\{X_1,...,X_m\}$ be a set of generators for the Lie algebra
$\cal L$. We prove that $G$ is uniformly finitely generated by
$\{X_1,...,X_m\}$. This means that every element $K \in G$ can be expressed as
$K=e^{Xt_1}e^{Xt_2} \cdot \cdot \cdot e^{Xt_l}$, where the indeterminates $X$
are in the set $\{X_1,...,X_m \}$, $t_i \in \RR$, $i=1,...,l$, and the number
$l$ is uniformly bounded. This extends a previous result by F. Lowenthal in
that we do not require the connected one dimensional Lie subgroups
corresponding to the $X_i$, $i=1,...,m$, to be compact.
  We discuss the consequence of this result to the question of universality of
quantum gates in quantum computing.
","[{""version"":""v1"",""created"":""Sat, 24 Nov 2001 22:42:54 GMT""}]","2007-05-23"
"quant-ph/0111134","Marco Frasca","Marco Frasca","Rabi oscillations and macroscopic quantum superposition states","7 pages, revtex, no figures. I have to thank Kazuyuki Fujii for
  pointing me out some corrections to introduce into the paper. Besides, the
  title and the nomenclature has been changed in agreement to editorial
  requirements. Finally, the correct citation for the paper by Nakamura et al.
  has been introduced","Phys. Rev. A 66, 023810 (2002)","10.1103/PhysRevA.66.023810",,"quant-ph cond-mat physics.atom-ph",,"  A two-level atom interacting with a single radiation mode is considered,
without the rotating-wave approximation, in the strong coupling regime. It is
shown that, in agreement with the recent results on Rabi oscillations in a
Josephson junction (Y. Nakamura, Yu. A. Pashkin and J. S. Tsai, Phys. Rev.
Lett. {\bf 87}, 246601 (2001)), the Rabi frequency is indeed proportional to
first kind integer order Bessel functions in the limit of a large number of
photons and the dressed states are macroscopic quantum superposition states. To
approach this problem analytically use is made of the dual Dyson series and the
rotating-wave approximation.
","[{""version"":""v1"",""created"":""Sat, 24 Nov 2001 23:12:57 GMT""},{""version"":""v2"",""created"":""Sun, 2 Dec 2001 23:04:50 GMT""},{""version"":""v3"",""created"":""Sat, 12 Jan 2002 12:16:16 GMT""}]","2009-11-07"
"quant-ph/0111135","Weiqin Chao","W. Q. Chao (Zhao), C. S. Ju","Different versions of perturbation expansion based on the
  single-trajectory quadrature method","18 pages, LaTex, no table, no figure",,,,"quant-ph",,"  The newly developed single trajectory quadrature method is applied to a
two-dimensional example. The results based on different versions of new
perturbation expansion and the new Green's function deduced from this method
are compared to each other, also compared to the result from the traditional
perturbation theory. As the first application to higher-dimensional
non-separable potential the obtained result further confirms the applicability
and potential of this new method.
","[{""version"":""v1"",""created"":""Sun, 25 Nov 2001 04:19:36 GMT""}]","2007-05-23"
"quant-ph/0111136","Ujjwal Sen","Sibasish Ghosh, Guruprasad Kar, Anirban Roy, Debasis Sarkar, Aditi Sen
  De, Ujjwal Sen","On local indistinguishability of orthogonal pure states by using a bound
  on distillable entanglement","6 pages latex, no figures",,"10.1103/PhysRevA.65.062307",,"quant-ph",,"  We show that the four states a|00>+b|11>, b^*|00>-a^*|11>, c|01>+d|10> and
d^*|01>-c^*|10> cannot be discriminated with certainty if only local operations
and classical communication (LOCC) are allowed and if only a single copy is
provided, except in the case when they are simply |00>, |11>, |01> and |10> (in
which case they are trivially distinguishable with LOCC). We go on to show that
there exists a continuous range of values of a, b, c and d such that even three
states among the above four are not locally distinguishable, if only a single
copy is provided. The proof follows from the fact that logarithmic negativity
is an upper bound of distillable entanglement.
","[{""version"":""v1"",""created"":""Sun, 25 Nov 2001 11:21:32 GMT""}]","2009-11-07"
