"astro-ph/0111464","Herman L. Marshall","H. L. Marshall (1), N. S. Schulz (1), T. Fang (1), W. Cui (2), C. R.
  Canizares (1), J. M. Miller (1), W.H.G. Lewin (1) ((1) MIT Center for Space
  Research, (2) Department of Physics, Purdue University)","Highly Ionized Absorption in the X-ray Spectrum of Cyg X-1","4 pages, 3 figures, in X-ray Emission from Accretion onto Black
  Holes, Proceedings of a joint workshop held by the Center for Astrophysics
  (Johns Hopkins University) and the Laboratory for High Energy Astrophysics
  (NASA/Goddard Space Flight Center) in Baltimore, MD, June 20-23, 2001, Eds.:
  T. Yaqoob and J.H. Krolik, published electronically, E45",,,,"astro-ph",,"  Using the Chandra High Energy Transmission Grating Spectrometer (HETGS), we
have found significant absorption features in the X-ray spectrum of Cyg X-1
taken in the continuous clocking mode. These features include resonance lines
of He-like ions of S, Si, and Mg; the Ly alpha lines of H-like S, Si, Mg, and
Ne; and several lower ionization lines of Fe XX, XXII, and XXIV. Preliminary
analysis shows that the lines are resolved in many cases, giving line widths of
order 300 km/s and are redshifted by 460 +/- 10 km/s. These features are
interpreted in the context of an accreting stellar wind model that is ionized
by the X-ray source. In addition, there are clear absorption features due to
neutral Mg, Fe, and O in the interstellar medium.
","[{""version"":""v1"",""created"":""Sat, 24 Nov 2001 20:33:57 GMT""}]","2007-05-23"
"astro-ph/0111465","Philip I. Choi","Philip I. Choi, Puragra Guhathakurta (UC Santa Cruz), Kathryn V.
  Johnston (Wesleyan University)","Tidal Interaction of M32 and NGC 205 with M31: Surface Photometry and
  Numerical Simulations","43 pages, including 16 figures, and 2 tables; accepted for
  publication in AJ; minor changes made to the text",,"10.1086/341041",,"astro-ph",,"  We investigate the interaction history of the M31 sub-group of galaxies by
comparing surface photometry of its two nearest satellites, M32 and NGC 205,
with N-body simulations of satellite destruction. The recent discovery of a
giant stream in M31's outer halo, apparently pointed towards M32 and NGC 205,
makes such an investigation particularly relevant. The observational component
of this study is based on 1.7 x 5.0 degree B- and I- band CCD mosaic images
centered on M31 and covering both satellites. The simulation component of this
project is based on the analysis of single-component, spherical model
satellites that are tidally disrupted through interactions with their parent
galaxy. Generic features of the simulations include an excess in the surface
brightness profile at large radii, a depletion zone at intermediate radii, and
isophotal elongation and twists that are coincident with breaks in the
brightness profile. The satellites M32 and NGC 205 display most of these
features consistently across the B and I bands, strongly suggestive of tidal
interaction and probable stripping by M31. We discuss what these observed
features can tell us about the satellites' orbital parameters and histories.
Specifically, M32 is found to be on a highly eccentric orbit and away from
pericenter. Investigating M32's unusual combination of high surface brightness
and low luminosity (the hallmark of compact ellipticals), we conclude on
empirical grounds that M32 is not likely to be the residual core of a
tidally-stripped normal elliptical galaxy as has been suggested, but rather
that its precursor was intrinsically compact.
","[{""version"":""v1"",""created"":""Sun, 25 Nov 2001 03:44:28 GMT""},{""version"":""v2"",""created"":""Mon, 15 Apr 2002 16:20:24 GMT""}]","2009-11-07"
"astro-ph/0111466","Philip I. Choi","Kathryn V. Johnston (Wesleyan University), Philip I. Choi, Puragra
  Guhathakurta (UC Santa Cruz)","Interpreting the Morphology of Diffuse Light Around Satellite Galaxies","41 pages, including 17 figures; accepted for publication in AJ; minor
  changes made to the text, Figure 1 added",,"10.1086/341040",,"astro-ph",,"  Recent observations of surface brightness distributions of both Milky Way and
M31 satellite galaxies have revealed many instances of sudden changes or breaks
in the slope of the surface brightness profiles (at some break radius,
r_break). These breaks are often accompanied by increasingly elliptical
isophotes and sometimes by isophote twisting. We investigate the hypothesis of
a tidal origin for these features by applying the same ellipse fitting
techniques that are used on observed galaxies to numerical simulations of the
destruction of satellites, represented by spherical, single-component systems.
We examine how observed quantities such as r_break, ellipticity and position
angle of the fitted ellipses and amplitude of extra-break population vary with
the satellite's orbital eccentricity and phase, and our viewpoint relative to
the orbit. We also look at orbit and viewpoint dependence of the rate of change
of the latter three quantities with radius.
  We find that there are trends with orbital phase and eccentricity in all
observed quantities, many of which are preserved through a wide variety of
viewing angles. In particular, a generic feature of all simulations is a
depletion zone just interior to an excess zone, regions in which the surface
brightness is lower and higher, respectively, than the initial profile. A clear
interpretation of any individual image, however, is likely to be hampered by
the dependence of the observable features on these multiple parameters. For
example, breaks can be excited by several physical processes and can occur well
within the bound satellite population. Nevertheless, we do find we can place
loose constraints on the tidal radius, mass loss rate, orbital type and phase
of the satellite, and nature of breaks using photometric data alone.
","[{""version"":""v1"",""created"":""Sun, 25 Nov 2001 03:49:09 GMT""},{""version"":""v2"",""created"":""Mon, 15 Apr 2002 16:31:11 GMT""}]","2009-11-07"
"astro-ph/0111467","Michael R. Santos","Michael R. Santos (1), Volker Bromm (2) and Marc Kamionkowski (1) ((1)
  Caltech, (2) CfA)","The Contribution of the First Stars to the Cosmic Infrared Background","11 pages, 6 figures, expanded discussion, added mid-IR to Fig 6,
  MNRAS in press","Mon.Not.Roy.Astron.Soc. 336 (2002) 1082","10.1046/j.1365-8711.2002.05895.x",,"astro-ph",,"  We calculate the contribution to the cosmic infrared background from very
massive metal-free stars at high redshift. We explore two plausible
star-formation models and two limiting cases for the reprocessing of the
ionizing stellar emission. We find that Population III stars may contribute
significantly to the cosmic near-infrared background if the following
conditions are met: (i) The first stars were massive, with M > ~100 M_sun. (ii)
Molecular hydrogen can cool baryons in low-mass haloes. (iii) Pop III star
formation is ongoing, and not shut off through negative feedback effects. (iv)
Virialized haloes form stars at about 40 per cent efficiency up to the redshift
of reionization, z~7. (v) The escape fraction of the ionizing radiation into
the intergalactic medium is small. (vi) Nearly all of the stars end up in
massive black holes without contributing to the metal enrichment of the
Universe.
","[{""version"":""v1"",""created"":""Sun, 25 Nov 2001 04:31:02 GMT""},{""version"":""v2"",""created"":""Tue, 30 Jul 2002 18:28:10 GMT""},{""version"":""v3"",""created"":""Wed, 31 Jul 2002 22:59:31 GMT""}]","2009-11-07"
"cond-mat/0111471","Maurizio Bottaccio","L. Pietronero, M. Bottaccio, M. Montuori, F. Sylos Labini","Scaling in cosmic structures","10 pages, 3 figures. Accepted for pubblication in Fractals -",,"10.1142/9789812778109_0028",,"cond-mat.stat-mech astro-ph",,"  The study of the properties of cosmic structures in the universe is one of
the most fascinating subject of the modern cosmology research. Far from being
predicted, the large scale structure of the matter distribution is a very
recent discovery, which continuosly exhibits new features and issues. We have
faced such topic along two directions; from one side we have studied the
correlation properties of the cosmic structures, that we have found
substantially different from the commonly accepted ones. From the other side,
we have studied the statistical properties of the very simplified system, in
the attempt to capture the essential ingredients of the formation of the
observed structures.
","[{""version"":""v1"",""created"":""Sat, 24 Nov 2001 16:22:41 GMT""},{""version"":""v2"",""created"":""Mon, 3 Dec 2001 10:31:26 GMT""}]","2016-11-23"
"cond-mat/0111472","Maurizio Bottaccio","M. Bottaccio, L. Pietronero, A. Amici, P. Moicchi, R. Capuzzo
  Dolcetta, M. Montuori","Clustering in N-Body gravitating systems","6 pages, 5 figures. To be published on Physica A",,"10.1016/S0378-4371(01)00670-7",,"cond-mat.stat-mech",,"  Self-gravitating systems have acquired growing interest in statistical
mechanics, due to the peculiarities of the 1/r potential. Indeed, the usual
approach of statistical mechanics cannot be applied to a system of many point
particles interacting with the Newtonian potential, because of (i) the long
range nature of the 1/r potential and of (ii) the divergence at the origin. We
study numerically the evolutionary behavior of self-gravitating systems with
periodical boundary conditions, starting from simple initial conditions. We do
not consider in the simulations additional effects as the (cosmological) metric
expansion and/or sophisticated initial conditions, since we are interested
whether and how gravity by itself can produce clustered structures. We are able
to identify well defined correlation properties during the evolution of the
system, which seem to show a well defined thermodynamic limit, as opposed to
the properties of the ``equilibrium state''.
  Gravity-induced clustering also shows interesting self-similar
characteristics.
","[{""version"":""v1"",""created"":""Sat, 24 Nov 2001 17:11:02 GMT""}]","2015-06-24"
"cond-mat/0111473","Sasha Chernyshev","A. L. Chernyshev, Y. C. Chen, and A. H. Castro Neto","Effect of impurities on quasi-2D quantum antiferromagnet","RevTeX, 3 pages, 3 figures, Proceedings of the 46 Conference on
  Magnetism and Magnetic Materials, Seattle 2001, to be published in J. Appl.
  Phys","J. Appl. Phys. 91, 8387 (2002).","10.1063/1.1456911",,"cond-mat.str-el cond-mat.dis-nn",,"  We have studied the static and dynamic properties of quasi-two-dimensional
quantum antiferromagnets (AF) diluted with spinless impurities using spin-wave
theory and $T$-matrix approximation. We show that the spectrum of a 2D AF at
long wavelengths is overdamped at arbitrary concentration of spinless
impurities. The scattering leads to a new length scale $\ell/a \sim
e^{\pi/4x}$, $x$ being impurity concentration and $a$ the lattice spacing,
beyond which the influence of impurities on the spectrum is dominant. Although
the dynamical properties are significantly modified we show that 2D is not the
lower critical dimension for this problem. Thus, in low-dimensional systems
with disorder the connection between static and dynamic quantities is not
straightforward. Our results are in quantitative agreement with the recent
Monte Carlo simulations and experimental data for $S=1/2$, S=1, and $S=5/2$. We
have also proposed experiments which can further test the results of our
theory.
","[{""version"":""v1"",""created"":""Sat, 24 Nov 2001 18:46:50 GMT""}]","2009-11-07"
"cond-mat/0111474","Sasha Chernyshev","A. L. Chernyshev, Steven R. White, and A. H. Castro Neto","Charge Stripe in an Antiferromagnet: 1d Band of Composite Excitations","5 pages, 3 figures, proceedings of SCES'01 conference, Ann Arbor,
  2001, to be published in Physica B","Physica B 312-313, 566-568 (2002).","10.1016/S0921-4526(01)01150-4",,"cond-mat.str-el",,"  With the help of analytical and numerical studies of the $t$-$J_z$ model we
argue that the charge stripe in an antiferromagnetic insulator should be
understood as a system of holon-spin-polaron excitations condensed at the
self-induced antiphase domain wall. The structure of such a charge excitation
is studied in detail with numerical and analytical results for various
quantities being in a very close agreement. An analytical picture of these
excitations occupying an effective 1D stripe band is also in a very good accord
with numerical data. The emerging concept advocates the primary role of the
kinetic energy in favoring the stripe as a ground state. A comparative analysis
suggests the effect of pairing and collective meandering on the energetics of
the stripe formation to be secondary.
","[{""version"":""v1"",""created"":""Sat, 24 Nov 2001 19:06:46 GMT""}]","2009-11-07"
"cond-mat/0111475","Sameer Sapra","Sameer Sapra, D. D. Sarma, S. Sanvito, N. A. Hill","Influence of quantum confinement on the ferromagnetism of (Ga,Mn)As
  diluted magnetic semiconductor","4 pages, 3 figures",,"10.1021/nl025516q",,"cond-mat.mtrl-sci cond-mat.soft",,"  We investigate the effect of quantum confinement on the ferromagnetism of
diluted magnetic semiconductor Ga$_{1-x}$Mn$_x$As using a combination of
tight-binding and density functional methods. We observe strong majority-spin
Mn $d$-As $p$ hybridization, as well as half metallic behavior, down to sizes
as small as 20 \AA in diameter. Below this critical size, the doped holes are
self-trapped by the Mn-sites, signalling both valence and electronic
transitions. Our results imply that magnetically doped III-V nanoparticles will
provide a medium for manipulating the electronic structure of dilute magnetic
semiconductors while conserving the ferromagnetic properties and even enhancing
it in certain size regime.
","[{""version"":""v1"",""created"":""Sat, 24 Nov 2001 20:36:57 GMT""}]","2015-06-24"
"cond-mat/0111476","George M. Chechin","George M. Chechin, Alexandr V. Gnezdilov, Vladimir P. Sakhnenko and
  Mikhail Yu. Zekhtser (Rostov State University, Rostov-on-Don, Russia)","Bushes of normal modes - new dynamical objects in nonlinear mechanical
  systems with discrete symmetry","LaTeX, 9 pages, to be published in Proceedings of XXIX Summer School
  ""Advanced Problems in Mechanics"" Russia, St.Petersburg (Repino), June 21-30,
  2001",,,,"cond-mat",,"  Bushes of normal modes represent exact mathematical objects describing
specific dynamical regimes in nonlinear mechanical systems with point or space
symmetry. In the present paper, we outline the bush theory and illustrate it
with some bushes of small dimensions in octahedral mechanical structures.
","[{""version"":""v1"",""created"":""Sun, 25 Nov 2001 13:19:06 GMT""}]","2007-05-23"
"cond-mat/0111477","W. A. Hofer","W.A. Hofer and A.J. Fisher","Tip effects in scanning tunnelling microscopy of atomic-scale magnetic
  structures","Four pages (RevTeX) and three figures (EPS). For related papers see
  http://cmmp.phys.ucl.ac.uk/~wah/index.html",,"10.1016/S0039-6028(01)01758-7",,"cond-mat.mtrl-sci",,"  The spin-polarized scanning tunnelling microscope (STM) can in principle
resolve not only the electronic, but also the magnetic surface structure. We
model recent STM measurements achieving magnetic resolution on the atomic scale
by a first-principles method. It is shown that the signature of a specific
magnetic or non-magnetic STM tip can unambiguously be identified. It is also
established that the model of Tersoff and Hamann would yield an electronic as
well as magnetic contrast of the surface which is well below STM resolution.
","[{""version"":""v1"",""created"":""Sun, 25 Nov 2001 15:14:14 GMT""}]","2009-11-07"
"gr-qc/0111081","V. Savchenko","L.B. Savchenko, V.A. Savchenko, G.M. Vereshkov","Topological Vacuum of the Closed Universe as a Gauging Factor","9 pages, LaTeX 2.09. A revised version: grammatical corrections",,,,"gr-qc",,"  The only known general base to eliminate the vacuum divergencies of quantized
matter fields in quantum geometrodynamics is the fermion-boson supersymmetry.
The topological effect of the closed Universe -- discretization of the vacuum
fluctuations spectra -- allows to formulate the conditions of cancellation of
the divergencies. In the center of attention of this work is the fact that
these conditions result in the considerable restrictions on the gauge and
factor-ordering ambiguities peculiar to the equations of the theory and, in the
limits of the isotropic model of the Universe, remove these ambiguities
completely.
","[{""version"":""v1"",""created"":""Sun, 25 Nov 2001 06:46:59 GMT""},{""version"":""v2"",""created"":""Sat, 8 Dec 2001 15:27:17 GMT""},{""version"":""v3"",""created"":""Thu, 8 Aug 2002 08:18:12 GMT""}]","2007-05-23"
"gr-qc/0111082","Anjan Ananda Sen","A.A. Sen and S. Sethi (HRI, Allahabad, India)","Quintessence Model With Double Exponential Potential","6 pages, Revtex Style, four eps figures,some new comments are added
  regarding the fitting analysis. Conclusion has been rewritten. Accepted for
  publication in Physics Letters B","Phys.Lett. B532 (2002) 159-165","10.1016/S0370-2693(02)01547-2",,"gr-qc astro-ph hep-th",,"  We have reinvestigated the quintessence model with minimally coupled scalar
field in the context of recent Supernova observation at $z=1.7$. By assuming
the form of the scale factor which gives both the early time deceleration and
late time acceleration, consistent with the observations, we show that one
needs a double exponential potential. We have also shown that the equation of
state and the behaviour of dark energy density are reasonably consistent with
earlier constraints obtained by different authors. This work shows again the
importance of double exponential potential for a quintessence field.
","[{""version"":""v1"",""created"":""Sun, 25 Nov 2001 09:47:12 GMT""},{""version"":""v2"",""created"":""Mon, 4 Mar 2002 18:15:54 GMT""}]","2009-11-07"
"hep-ex/0111080","Leonid Gladilin","L. Gladilin","Heavy Flavor in Photoproduction at HERA","5 pages, 4 figures, Proceedings of EPS HEP 2001, July 2001, Budapest,
  Hungary",,,,"hep-ex",,"  Recent results on charm and beauty photoproduction at HERA are discussed. The
perturbative QCD calculations are generally smaller than the measured cross
sections, particularly in the forward (proton) direction. The study of charm
dijet photoproduction is consistent with a significant contribution of charm
excitation processes.
","[{""version"":""v1"",""created"":""Sat, 24 Nov 2001 19:42:53 GMT""}]","2007-05-23"
"hep-lat/0111049","Thomas Manke","X. Liao, T. Manke","Relativistic Bottomonium Spectrum from Anisotropic Lattices","20 pages, 11 figures","Phys.Rev. D65 (2002) 074508","10.1103/PhysRevD.65.074508","CU-TP-1046","hep-lat",,"  We report on a first relativistic calculation of the quenched bottomonium
spectrum from anisotropic lattices. Using a very fine discretisation in the
temporal direction we were able to go beyond the non-relativistic approximation
and perform a continuum extrapolation of our results from five different
lattice spacings (0.04-0.17 fm) and two anisotropies (4 and 5). We investigate
several systematic errors within the quenched approximation and compare our
results with those from non-relativistic simulations.
","[{""version"":""v1"",""created"":""Sat, 24 Nov 2001 20:37:47 GMT""}]","2015-07-27"
"hep-ph/0111313","Sheldon Stone","Sheldon Stone","Probing New Physics With b Decays","Presented at Snowmass 2001, Working Group on Flavor Physics (P2),
  Snowmass, CO, July, 2001; to appear in proceedings. Contains 12 pages and 7
  figures; uses Revtex4","eConf C010630:P207,2001",,,"hep-ph",,"  I discuss how b decays can be used to unravel new physics beyond the Standard
Model. Decays second order in the weak interaction involving loops and CP
violation are emphasized. This information is complementary to that obtainable
with higher energy machines.
","[{""version"":""v1"",""created"":""Sat, 24 Nov 2001 16:55:45 GMT""}]","2014-11-17"
"hep-ph/0111317","Yang Jin-min","Y. F. Wang, K. Whisnant, Z. Xiong, Jin Min Yang, Bing-Lin Young","Probing neutrino oscillations jointly in long and very long baseline
  experiments","23 pages, 11 figures","Phys.Rev.D65:073021,2002","10.1103/PhysRevD.65.073021","VLBL Study Group-H2B-4, AMES-HET-01-09, AS-ITP-2001-022","hep-ph hep-ex",,"  We examine the prospects of making a joint analysis of neutrino oscillation
at two baselines with neutrino superbeams. Assuming narrow band superbeams and
a 100 kt water Cerenkov calorimeter, we calculate the event rates and
sensitivities to the matter effect, the signs of the neutrino mass differences,
the CP phase and the mixing angle \theta_{13}. Taking into account all possible
experimental errors under general consideration, we explored the optimum cases
of narrow band beam to measure the matter effect and the CP violation effect at
all baselines up to 3000 km. We then focus on two specific baselines, a long
baseline of 300 km and a very long baseline of 2100 km, and analyze their joint
capabilities. We found that the joint analysis can offer extra leverage to
resolve some of the ambiguities that are associated with the measurement at a
single baseline.
","[{""version"":""v1"",""created"":""Sun, 25 Nov 2001 15:10:37 GMT""}]","2008-11-26"
"hep-ph/0111320","Neil Russell","Neil Russell","CPT and Lorentz Tests with Clocks in Space","10 pages, presented at the Second Meeting on CPT and Lorentz
  Symmetry, Bloomington, Indiana, August 2001. One additional reference",,"10.1142/9789812778123_0013",,"hep-ph",,"  Space-based clock-comparison experiments can provide Planck-scale sensitivity
to many parameters for Lorentz and CPT violation that are difficult to measure
on Earth. The principal advantages are a reduced timescale for data collection,
reduced suppression for certain effects, and access to certain parameters not
possible with Earth-based experiments.
","[{""version"":""v1"",""created"":""Sat, 24 Nov 2001 18:29:18 GMT""},{""version"":""v2"",""created"":""Wed, 5 Dec 2001 02:09:08 GMT""}]","2017-08-23"
"hep-ph/0111321","Ji-Feng Yang","Ji-Feng Yang (ECNU, Shanghai)","On the equivalence of regularization schemes","9 pages, LaTex, no figure, revised version, new style,to appear in
  Comm.Theor.Phys","Commun.Theor.Phys.38:317-321,2002","10.1088/0253-6102/38/3/317",,"hep-ph gr-qc hep-th nucl-th quant-ph",,"  We illustrated via the sunset diagram that dimensional regularization
'deforms' the nonlocal contents of multi-loop diagrams with its equivalence to
cut-off regularization scheme recovered only after sub-divergence were
subtracted. Then we employed a differential equation approach for calculating
loop diagrams to verify that dimensional regularization deformed the 'low
energy' contents before subtraction. The virtues of the differential equation
approach were argued especially in non-perturbative perspective.
","[{""version"":""v1"",""created"":""Sun, 25 Nov 2001 10:42:58 GMT""},{""version"":""v2"",""created"":""Tue, 27 Nov 2001 10:07:08 GMT""},{""version"":""v3"",""created"":""Wed, 28 Nov 2001 09:52:48 GMT""},{""version"":""v4"",""created"":""Thu, 4 Jul 2002 12:15:47 GMT""}]","2018-01-17"
"hep-th/0111224","Myoung-taek Choi","Mu-in Park (CCNY)","The Hamiltonian Dynamics of Bounded Spacetime and Black Hole Entropy:
  The Canonical Method","Much details omitted, references added, accepted in Nucl. Phys. B","Nucl.Phys.B634:339-369,2002","10.1016/S0550-3213(02)00292-4","CCNY-HEP-01/08","hep-th gr-qc",,"  From first principles, I present a concrete realization of Carlip's idea on
the black hole entropy from the conformal field theory on the horizon in any
dimension. New formulation is free of inconsistencies encountered in Carlip's.
By considering a correct gravity action, whose variational principle is well
defined at the horizon, I $derive$ a correct $classical$ Virasoro generator for
the surface deformations at the horizon through the canonical method. The
existence of the classical Virasoro algebra is crucial in obtaining an operator
Virasoro algebra, through canonical quantization, which produce the right
central charge and conformal weight $\sim A_+/\hbar G$ for the semiclassical
black hole entropy. The coefficient of proportionality depends on the choice of
ground state, which has to be put in by hand to obtain the correct numerical
factor 1/4 of the Bekenstein-Hawking (BH) entropy. The appropriate ground state
is different for the rotating and the non-rotating black holes but otherwise it
has a $universality$ for a wide variety of black holes. As a byproduct of my
results, I am led to conjecture that {\it non-commutativity of taking the limit
to go to the horizon and computing variation is proportional to the Hamiltonian
and momentum constraints}. It is shown that almost all the known uncharged
black hole solutions satisfy the conditions for the universal entropy formula.
","[{""version"":""v1"",""created"":""Sun, 25 Nov 2001 00:36:55 GMT""},{""version"":""v2"",""created"":""Wed, 5 Dec 2001 21:26:30 GMT""},{""version"":""v3"",""created"":""Sat, 22 Dec 2001 04:17:08 GMT""},{""version"":""v4"",""created"":""Fri, 12 Apr 2002 23:40:14 GMT""}]","2009-01-30"
