"cs/0109032","Gerald Painkras","James Katz, Ronald E. Rice, and Philip Aspden","The Internet, 1995-2000: Access, Civic Involvement, and Social
  Interaction","29th TPRC Conference, 2001",,,"TPRC-2001-015","cs.CY",,"  Our research, which began fielding surveys in 1995, and which have been
repeated with variation in 1996, 1997 and 2000, was apparently the first to use
national random telephone survey methods to track social and community aspects
of Internet use, and to compare users and non-users. It also seems to be among
the first that used these methods to compare users with non-users in regards to
communication, social and community issues. The work has been largely supported
by grants from the Markle Foundation of New York City as well as the Robert
Wood Johnson Foundation.
  Abridged, see full text for complete abstract.
","[{""version"":""v1"",""created"":""Tue, 18 Sep 2001 16:29:06 GMT""}]","2007-05-23"
"cs/0109033","Francois Fages","Francois Fages","CLP versus LS on Log-based Reconciliation Problems","Article presented at the 6th ERCIM workshop of the Constraint Group,
  Prague, Czech Republic, June 2001",,,,"cs.PL",,"  Nomadic applications create replicas of shared objects that evolve
independently while they are disconnected. When reconnecting, the system has to
reconcile the divergent replicas. In the log-based approach to reconciliation,
such as in the IceCube system, the input is a common initial state and logs of
actions that were performed on each replica. The output is a consistent global
schedule that maximises the number of accepted actions. The reconciler merges
the logs according to the schedule, and replays the operations in the merged
log against the initial state, yielding to a reconciled common final state.
  In this paper, we show the NP-completeness of the log-based reconciliation
problem and present two programs for solving it. Firstly, a constraint logic
program (CLP) that uses integer constraints for expressing precedence
constraints, boolean constraints for expressing dependencies between actions,
and some heuristics for guiding the search. Secondly, a stochastic local search
method with Tabu heuristic (LS), that computes solutions in an incremental
fashion but does not prove optimality. One difficulty in the LS modeling lies
in the handling of both boolean variables and integer variables, and in the
handling of the objective function which differs from a max-CSP problem.
Preliminary evaluation results indicate better performance for the CLP program
which, on somewhat realistic benchmarks, finds nearly optimal solutions up to a
thousands of actions and proves optimality up to a hundreds of actions.
","[{""version"":""v1"",""created"":""Tue, 18 Sep 2001 19:16:30 GMT""}]","2007-05-23"
"cs/0109034","Ingo Kreuz","Ingo Kreuz, Dieter Roller","Relevant Knowledge First - Reinforcement Learning and Forgetting in
  Knowledge Based Configuration","pdf-file, 33 pages, 17 figures",,,,"cs.AI cs.LG",,"  In order to solve complex configuration tasks in technical domains, various
knowledge based methods have been developed. However their applicability is
often unsuccessful due to their low efficiency. One of the reasons for this is
that (parts of the) problems have to be solved again and again, instead of
being ""learnt"" from preceding processes. However, learning processes bring with
them the problem of conservatism, for in technical domains innovation is a
deciding factor in competition. On the other hand a certain amount of
conservatism is often desired since uncontrolled innovation as a rule is also
detrimental. This paper proposes the heuristic RKF (Relevant Knowledge First)
for making decisions in configuration processes based on the so-called
relevance of objects in a knowledge base. The underlying relevance-function has
two components, one based on reinforcement learning and the other based on
forgetting (fading). Relevance of an object increases with its successful use
and decreases with age when it is not used. RKF has been developed to speed up
the configuration process and to improve the quality of the solutions relative
to the reward value that is given by users.
","[{""version"":""v1"",""created"":""Wed, 19 Sep 2001 08:07:38 GMT""}]","2007-05-23"
"cs/0109035","Rob Frieden","Rob Frieden","Revenge of the Bell Heads: How the Net Heads Lost Control of the
  Internet",,,,,"cs.CY",,"  A dichotomy in regulatory treatment and corporate cultures exists between
Internet Service Providers (ISPs) and telecommunication carriers. Telephone
company executives (Bell Heads) may resent regulation, but they accept their
fate and work creatively to exploit anomalies and opportunities to secure a
regulation-conferred competitive advantage. Most ISP executives (Net Heads)
appear to embrace a libertarian attitude, strongly opposing any government
involvement. Despite the clash of cultures, the telecommunications and Internet
worlds have merged. Such convergence jeopardizes the ability of Net Heads to
avoid some degree of regulation, particularly when they offer services
functionally equivalent to what their Bell Head counterparts offer.
  This paper will assess the regulatory consequences when telecommunication and
Internet services converge in the marketplace and in terms of operating
technologies. The paper identifies commercial developments in the Internet to
support the view that the Internet has become more hierarchical and more like
telecommunication networks. The paper concludes that telecommunication carriers
will display superior skill in working the regulatory process to their
advantage. The paper suggests that Bell Heads will outmaneuver Net Heads
particularly when the revenue siphoning effect of Internet-mediated services
offsets the revenues generated from ISP leases of telecommunication
transmission capacity.
","[{""version"":""v1"",""created"":""Wed, 19 Sep 2001 13:50:38 GMT""}]","2009-09-25"
"gr-qc/0109060","V. L. Kalashnikov","V. L. Kalashnikov","X-matter induced cosmological scenarios in the relativistic theory of
  gravity","9 pages, 3 figures, LaTeX2e, commented Maple 6 worksheet is
  accessible on http://www.geocities.com/optomaplev","Spacetime and Substance 2 (2001) 75-78",,,"gr-qc",,"  It was shown, that the presence of the so-called X-matter with an equation of
state, which lies between limits of the strong and weak energy conditions,
allows the variety of the cosmological scenarios in the relativistic theory of
gravity. In spite of the fixed negative sign of the cosmological term in the
field equations with massive graviton, it is possible to obtain the solutions
with accelerated and complicated loitering expansion of the universe. The
numerical estimation of the universe's age agrees with the modern observational
data if the upper limit of the graviton's mass is 10^{-71} g
","[{""version"":""v1"",""created"":""Tue, 18 Sep 2001 18:18:29 GMT""},{""version"":""v2"",""created"":""Fri, 28 Sep 2001 14:39:48 GMT""}]","2007-05-23"
"gr-qc/0109061","Larry Ford","Arvind Borde, L.H. Ford, and Thomas A. Roman","Constraints on Spatial distributions of Negative Energy","16 pages, 15 figures. Some expressions in Sect. IIIB4 corrected;
  other minor changes in the text and in the figures","Phys.Rev. D65 (2002) 084002","10.1103/PhysRevD.65.084002",,"gr-qc hep-th quant-ph",,"  This paper initiates a program which seeks to study the allowed spatial
distributions of negative energy density in quantum field theory. Here we deal
with free fields in Minkowski spacetime. Known restrictions on time integrals
of the energy density along geodesics, the averaged weak energy condition and
quantum inequalities are reviewed. These restrictions are then used to discuss
some possible constraints on the allowable spatial distributions of negative
energy. We show how some geometric configurations can either be ruled out or
else constrained. We also construct some explicit examples of allowed
distributions. Several issues related to the allowable spatial distributions
are also discussed. These include spacetime averaged quantum inequalities in
two-dimensional spacetime, the failure of generalizations of the averaged weak
energy condition to piecewise geodesics, and the issue of when the local energy
density is negative in the frame of all observers.
","[{""version"":""v1"",""created"":""Wed, 19 Sep 2001 02:19:54 GMT""},{""version"":""v2"",""created"":""Tue, 18 Dec 2001 00:25:35 GMT""}]","2009-11-07"
"gr-qc/0109062","Yves Wiaux","J.-M. Gerard and Y. Wiaux","Gravitational dipole radiations from binary systems","One comment added, accepted for publication in Phys. Rev. D","Phys.Rev. D66 (2002) 024040","10.1103/PhysRevD.66.024040","UCL-IPT-01-14","gr-qc astro-ph hep-ph",,"  We investigate the possibility of generating sizeable dipole radiations in
relativistic theories of gravity. Optimal parameters to observe their effects
through the orbital period decay of binary star systems are discussed.
Constraints on gravitational couplings beyond general relativity are derived.
","[{""version"":""v1"",""created"":""Wed, 19 Sep 2001 09:20:39 GMT""},{""version"":""v2"",""created"":""Fri, 14 Jun 2002 14:22:44 GMT""}]","2007-08-14"
"gr-qc/0109063","T. Damour","Thibault Damour","Questioning the Equivalence Principle","14 pages, contribution to the ONERA workshop on ""Missions spatiales
  en physique fondamentale"" (Chatillon, 18-19 Jan 2001), to appear in a special
  issue of the Comptes Rendus de l'Academie des Sciences (Paris), edited by C.
  Borde and P. Touboul",,"10.1016/S1296-2147(01)01272-0",,"gr-qc",,"  The Equivalence Principle (EP) is not one of the ``universal'' principles of
physics (like the Action Principle). It is a heuristic hypothesis which was
introduced by Einstein in 1907, and used by him to construct his theory of
General Relativity. In modern language, the (Einsteinian) EP consists in
assuming that the only long-range field with gravitational-strength couplings
to matter is a massless spin-2 field. Modern unification theories, and notably
String Theory, suggest the existence of new fields (in particular, scalar
fields: ``dilaton'' and ``moduli'') with gravitational-strength couplings. In
most cases the couplings of these new fields ``violate'' the EP. If the field
is long-ranged, these EP violations lead to many observable consequences
(variation of ``constants'', non-universality of free fall, relative drift of
atomic clocks,...). The best experimental probe of a possible violation of the
EP is to compare the free-fall acceleration of different materials.
","[{""version"":""v1"",""created"":""Wed, 19 Sep 2001 10:56:04 GMT""}]","2015-06-25"
"gr-qc/0109064","Hideo Kodama","Hideo Kodama (Kyoto Univ.)","Phase Space of Compact Bianchi Models with Fluid","58 pages in LaTeX with the PTP style. No figure","Prog.Theor.Phys. 107 (2002) 305-362","10.1143/PTP.107.305",,"gr-qc hep-th",,"  The structure of phase space is determined for spatially compact and locally
homogeneous universe models with fluid. Analysis covers models with all
possible space topologies except for those covered by S^3, H^3 or S^2xR which
have no moduli freedom. We show that space topology significantly affects the
number of dynamical degrees of freedom of the system. In particular, we give a
detailed proof of the result that for the systems modeled on the Thurston types
H^2xR and SL_2, which have locally the Bianchi type III or VIII symmetry, the
number of dynamical degrees of freedom increases without bound when the space
topology becomes more and more complicated, which was first pointed out by
Koike, Tanimoto and Hosoya in an incomplete form.
","[{""version"":""v1"",""created"":""Wed, 19 Sep 2001 11:29:35 GMT""}]","2009-11-07"
"gr-qc/0109065","Johannes Ruoff","Johannes Ruoff, Adamantios Stavridis and Kostas D. Kokkotas","Evolution equations for the perturbations of slowly rotating
  relativistic stars","13 pages, no figures, MSRAS typesetting, cleaning of the
  inadvertently disfigured equations","Mon.Not.Roy.Astron.Soc. 332 (2002) 676","10.1046/j.1365-8711.2002.05329.x",,"gr-qc astro-ph",,"  We present a new derivation of the equations governing the oscillations of
slowly rotating relativistic stars. Previous investigations have been mostly
carried out in the Regge-Wheeler gauge. However, in this gauge the process of
linearizing the Einstein field equations leads to perturbation equations which
as such cannot be used to perform numerical time evolutions. It is only through
the tedious process of combining and rearranging the perturbation variables in
a clever way that the system can be cast into a set of hyperbolic first order
equations, which is then well suited for the numerical integration. The
equations remain quite lengthy, and we therefore rederive the perturbation
equations in a different gauge, which has been first proposed by Battiston et
al. (1970). Using the ADM formalism, one is immediately lead to a first order
hyperbolic evolution system, which is remarkably simple and can be numerically
integrated without many further manipulations. Moreover, the symmetry between
the polar and the axial equations becomes directly apparent.
","[{""version"":""v1"",""created"":""Wed, 19 Sep 2001 12:15:54 GMT""},{""version"":""v2"",""created"":""Fri, 23 Nov 2001 19:06:19 GMT""}]","2009-11-07"
"gr-qc/0109066","Margarita Tchitchikina","O.A.Khrustalev, M.V.Tchitchikina (Moscow State University)","Quantum Gravity on the Classical Background: Group Analysis, Part II","10 pages",,,,"gr-qc",,"  Quantization of gravitational field in the neighbourhood of arbitrary
nontrivial solution of Einstein equations is considered, the 2nd order of
perturbation theory is calculated. The expression for quantum corrections of
the field operator and explicit view of Hamiltonian are represented.
","[{""version"":""v1"",""created"":""Wed, 19 Sep 2001 14:06:23 GMT""}]","2007-05-23"
"gr-qc/0109067","Margarita Tchitchikina","O.A.Khrustalev, M.V.Tchitchikina (Moscow State University)","Quantum Gravity on the Classical Background: Group Analysis, Part I","17 pages",,,,"gr-qc",,"  Quantization of gravitational field in the neighbourhood of exact solution of
Einstein equation is considered. The method of Bogoliubov group variables is
used.
","[{""version"":""v1"",""created"":""Wed, 19 Sep 2001 13:30:01 GMT""}]","2007-05-23"
"gr-qc/0109068","Ariel Caticha","Ariel Caticha","Entropic Dynamics","Presented at MaxEnt 2001, the 21th International Workshop on Bayesian
  Inference and Maximum Entropy Methods (August 4-9, 2001, Baltimore, MD, USA)","AIP Conf.Proc. 617 (2002) 302","10.1063/1.1477054",,"gr-qc cond-mat.stat-mech physics.class-ph",,"  I explore the possibility that the laws of physics might be laws of inference
rather than laws of nature. What sort of dynamics can one derive from
well-established rules of inference? Specifically, I ask: Given relevant
information codified in the initial and the final states, what trajectory is
the system expected to follow? The answer follows from a principle of
inference, the principle of maximum entropy, and not from a principle of
physics. The entropic dynamics derived this way exhibits some remarkable formal
similarities with other generally covariant theories such as general
relativity.
","[{""version"":""v1"",""created"":""Wed, 19 Sep 2001 13:36:39 GMT""}]","2009-11-07"
"hep-ex/0109027","Ken Garrow","K. Garrow, et al","Nuclear transparency from quasielastic A(e,e'p) reactions uo to Q^2=8.1
  (GeV/c)^2","11 pages, 6 figures","Phys.Rev.C66:044613,2002","10.1103/PhysRevC.66.044613",,"hep-ex",,"  The quasielastic (e,e$^\prime$p) reaction was studied on targets of
deuterium, carbon, and iron up to a value of momentum transfer $Q^2$ of 8.1
(GeV/c)$^2$. A nuclear transparency was determined by comparing the data to
calculations in the Plane-Wave Impulse Approximation. The dependence of the
nuclear transparency on $Q^2$ and the mass number $A$ was investigated in a
search for the onset of the Color Transparency phenomenon. We find no evidence
for the onset of Color Transparency within our range of $Q^2$. A fit to the
world's nuclear transparency data reflects the energy dependence of the free
proton-nucleon cross section.
","[{""version"":""v1"",""created"":""Tue, 18 Sep 2001 18:12:56 GMT""}]","2008-11-26"
"hep-ex/0109028","Brian O'Reilly","The FOCUS Collaboration","Reconstruction of Vees, Kinks, $\Xi^-$'s, and $\Omega^-$'s in the Focus
  Spectrometer","29 pages, 36 figures","Nucl.Instrum.Meth.A484:174-193,2002","10.1016/S0168-9002(01)02065-4",,"hep-ex",,"  We describe the various techniques developed in the Fermilab Wideband
Experiments, E687 and FOCUS, to reconstruct long-lived states. The techniques
all involve modifications to standard tracking techniques and are useful to
report for future experiments.
","[{""version"":""v1"",""created"":""Tue, 18 Sep 2001 21:50:12 GMT""}]","2012-08-27"
"hep-lat/0109013","Juergen Engels","S. Holtmann, J. Engels, T. Schulze (University Bielefeld, Germany)","Specific heat and energy for the three-dimensional O(2) model","Lattice2001(spin), 3 pages, 4 figures","Nucl.Phys.Proc.Suppl. 106 (2002) 893-895","10.1016/S0920-5632(01)01877-1","BI-TP 2001/12","hep-lat cond-mat.stat-mech",,"  We investigate the three-dimensional O(2) model on lattices of size 8^3 to
160^3 close to the critical point at zero magnetic field. We confirm explicitly
the value of the critical coupling J_c found by Ballesteros et al. and estimate
there the universal values of g_r and xi/L. At the critical point we study the
finite size dependencies of the energy density epsilon and the specific heat C.
We find that the nonsingular part of the specific heat C_{ns} is linearly
dependent on 1/alpha. From the critical behaviour of the specific heat for T
not T_c on the largest lattices we determine the universal amplitude ratio
A+/A-. The alpha- dependence of this ratio is close to the phenomenological
relation A+/A- = 1-4alpha.
","[{""version"":""v1"",""created"":""Wed, 19 Sep 2001 09:55:58 GMT""}]","2015-06-25"
"hep-lat/0109014","Randy Lewis","Randy Lewis, Nilmani Mathur and R. M. Woloshyn","Spin splittings among charmed hadrons","Lattice2001(heavyquark), 3 pages","Nucl.Phys.Proc.Suppl. 106 (2002) 370-372",,,"hep-lat",,"  The mass differences between spin-1/2 and spin-3/2 baryons are compared to
the mass differences between spin-0 and spin-1 mesons. Results of simulations
for charmed hadrons in the quenched approximation from a tadpole-improved
anisotropic action are discussed in the context of other lattice calculations,
quark model predictions, heavy quark symmetry predictions and experimental
data.
","[{""version"":""v1"",""created"":""Wed, 19 Sep 2001 15:12:58 GMT""}]","2007-05-23"
"hep-ph/0109158","George Rupp","Frieder Kleefeld (CFIF, IST, Lisbon, Portugal), Eef van Beveren
  (University of Coimbra, Portugal), George Rupp (CFIF, IST, Lisbon, Portugal),
  Michael D. Scadron (Physics Department, University of Arizona, Tucson, USA)","Identifying the quark content of the isoscalar scalar mesons f_0(980),
  f_0(1370), and f_0(1500) from weak and electromagnetic processes","v1, 15 pages, plain LaTeX, 1 eps figure. v2, 18 pages, plain LaTeX
  (figure included). More discussion, especially on the f0(1370) and its
  empirical two-photon width","Phys.Rev.D66:034007,2002","10.1103/PhysRevD.66.034007",,"hep-ph",,"  The assignments of the isoscalar scalar mesons f0(980), f0(1370), and
f0(1500) in terms of their qqbar substructure is still a matter of heated
dispute. Here we employ the weak and electromagnetic decays D(s)(+) to f0+pi(+)
and f0 two-photon decays, respectively, to identify the f0(980) and f0(1500) as
mostly ssbar, and the f0(1370) as dominantly nonstrange, in agreement with
previous work. The two-photon decays can be satisfactorily described with quark
as well as with meson loops, though the latter ones provide a less
model-dependent and more quantitative description.
","[{""version"":""v1"",""created"":""Tue, 18 Sep 2001 22:49:16 GMT""},{""version"":""v2"",""created"":""Tue, 6 Nov 2001 09:41:54 GMT""}]","2008-11-26"
"hep-ph/0109163","A. B. Balantekin","A.B. Balantekin (Wisconsin U., Madison)","Neutrinos in Stochastic Media: From Sun to Core-Collapse Supernovae","4 pages, to be published in the proceedings of the International
  Nuclear Physics Conference (INPC 2001): Nuclear Physics And The 21st Century,
  30 Jul - 3 Aug 2001, Berkeley, California","AIPConf.Proc.610:969-972,2002","10.1063/1.1470265",,"hep-ph",,"  Recent work on neutrino propagation in stochastic media and its implications
for the Sun and core-collapse supernovae are reviewed. It is shown that recent
results from Sudbury Neutrino Observatory and SuperKamiokande combined with a
best global fit value of $\delta m^2= 5\times 10^{-5}$ eV$^2$ and $\tan^2
\theta = 0.3$ rule out solar electron density fluctuations of a few percent or
more. It is argued that solar neutrino experiments may be able to rule out even
smaller fluctuations in the near future.
","[{""version"":""v1"",""created"":""Tue, 18 Sep 2001 16:29:35 GMT""}]","2008-11-26"
"hep-ph/0109164","Berezhnoy Alexandr","A. V. Berezhnoy, V. V. Kiselev, I. A. Korzhavina, A. K. Likhoded","Diffractive charm photoproduction at HERA ep-collider","9 pages, 3 figures","Phys.Atom.Nucl.65:1487-1490,2002; Yad.Fiz.65:1523-1527,2002","10.1134/1.1501661",,"hep-ph",,"  The cross section of the $D^*$-meson diffractive photoproduction at the HERA
collider has been calculated in the framework of perturbatively motivated model
for the different kinematic regions. The camparison between the different
Pomeron models has been performed.
","[{""version"":""v1"",""created"":""Wed, 19 Sep 2001 09:17:09 GMT""}]","2014-11-17"
"hep-ph/0109165","Wolfgang Lucha","Wolfgang Lucha and F. F. Schoberl","Instantaneous Bethe-Salpeter equation: improved analytical solution","7 pages","Int.J.Mod.Phys. A17 (2002) 2233","10.1142/S0217751X0200976X","HEPHY-PUB 745/01","hep-ph nucl-th quant-ph",,"  Studying the Bethe-Salpeter formalism for interactions instantaneous in the
rest frame of the bound states described, we show that, for bound-state
constituents of arbitrary masses, the mass of the ground state of a given spin
may be calculated almost entirely analytically with high accuracy, without the
(numerical) diagonalization of the matrix representation obtained by expansion
of the solutions over a suitable set of basis states.
","[{""version"":""v1"",""created"":""Wed, 19 Sep 2001 11:11:18 GMT""}]","2009-11-07"
"hep-ph/0109166","Akiya Miyamoto","ACFA Linear Collider Working Group","Particle Physics Experiments at JLC","457 pages, 322 figures. All figures have reduced quality. Full
  quality figures can be obtained from http://acfahep.kek.jp/acfareport",,,"KEK Report 2001-11","hep-ph",,"  ACFA Linear Collider Working Group report
","[{""version"":""v1"",""created"":""Wed, 19 Sep 2001 13:57:08 GMT""}]","2012-08-27"
"hep-ph/0109167","Hubert Spiesberger","G.Kramer and H.Spiesberger","Inclusive D* Production in Photon-Photon Collisions at Next-to-Leading
  Order QCD","27 pages, 8 figures, LaTeX","Eur.Phys.J.C22:289-301,2001","10.1007/s100520100805","DESY 01/134, MZ-TH/01-23 (Mainz)","hep-ph",,"  The next-to-leading order cross section for the inclusive production of charm
quarks in gamma-gamma collisions is calculated as a function of the transverse
momentum pT and the rapidity y in approaches using massive or massless charm
quarks. For the direct cross section we derive the massless limit from the
massive theory with the result that this limit differs from the massless
version with MSbar factorization by finite corrections. Subtracting or adding
these corrections allows us to compare the two approaches on equal footing. We
establish massless and massive versions with 3 and 4 initial flavours which are
shown to approach the massless approximations very fast with increasing pT.
With these results we calculate the inclusive D* cross section in gamma-gamma
collisions using realistic evolved fragmentation functions with appropriate
factorization scales and compare with recent data for dsigma/dpT from three LEP
collaborations after single- and double-resolved contributions have been added.
","[{""version"":""v1"",""created"":""Wed, 19 Sep 2001 14:00:43 GMT""}]","2011-09-13"
"hep-ph/0109168","Lorenzo Magnea","Lorenzo Magnea","Analytic resummation and power corrections for DIS and Drell--Yan","6 pages, talk delivered at DIS 2001, Bologna (Italy), 27/4-1/5 2001",,"10.1142/9789812778345_0038",,"hep-ph",,"  Dimensional continuation is applied to resummed expressions for the DIS and
Drell-Yan partonic cross sections, to regularize the Landau pole. Simple
analytic expression are obtained, encoding information about nonperturbative
power--suppressed effects.
","[{""version"":""v1"",""created"":""Wed, 19 Sep 2001 14:24:25 GMT""}]","2015-06-25"
