"cond-mat/0109324","Ariel Caticha","Chih-Yuan Tseng and Ariel Caticha","Yet another resolution of the Gibbs paradox: an information theory
  approach","Presented at MaxEnt 2001, the 21th International Workshop on Bayesian
  Inference and Maximum Entropy Methods (August 4-9, 2001, Baltimore, MD, USA)","p. 331 in ""Bayesian Inference and Maximum Entropy Methods in
  Science and Engineering"" ed. by R. L. Fry (A.I.P. Vol. 617, 2002)","10.1063/1.1477057",,"cond-mat.stat-mech quant-ph",,"  The ``Gibbs Paradox'' refers to several related questions concerning entropy
in thermodynamics and statistical mechanics: whether it is an extensive
quantity or not, how it changes when identical particles are mixed, and the
proper way to count states in systems of identical particles. Several authors
have recognized that the paradox is resolved once it is realized that there is
no such thing as the entropy of a system, that there are many entropies, and
that the choice between treating particles as being distinguishable or not
depends on the resolution of the experiment. The purpose of this note is
essentially pedagogical; we add to their analysis by examining the paradox from
the point of view of information theory. Our argument is based on that
`grouping' property of entropy that Shannon recognized, by including it among
his axioms, as an essential requirement on any measure of information. Not only
does it provide the right connection between different entropies but, in
addition, it draws our attention to the obvious fact that addressing issues of
distinguishability and of counting states requires a clear idea about what
precisely do we mean by a state.
","[{""version"":""v1"",""created"":""Tue, 18 Sep 2001 20:39:53 GMT""}]","2009-11-07"
"cond-mat/0109325","Marcello Terraneo","Italo Guarneri (1, 2 and 3) and Marcello Terraneo (1 and 2) ((1) Un.
  dell'Insubria, Como, (2) INFM, Como, (3) INFN, Pavia)","Fractal fluctuations in quantum integrable scattering","revtex, 4 pages, 3 eps figures","Phys.Rev.E 65, 015203 (2002)","10.1103/PhysRevE.65.015203",,"cond-mat.mes-hall",,"  We theoretically and numerically demonstrate that completely integrable
scattering processes may exhibit fractal transmission fluctuations, due to
typical spectral properties of integrable systems.
  Similar properties also occur with scattering processes in the presence of
strong dynamical localization, thus explaining recent numerical observations of
fractality in the latter class of systems.
","[{""version"":""v1"",""created"":""Tue, 18 Sep 2001 16:28:56 GMT""}]","2016-08-31"
"cond-mat/0109326","J. T. Chalker","S. Rapsch, J. T. Chalker, and D. K. K. Lee","Spin textures, screening and excitations in dirty quantum Hall
  ferromagnets","4 pages, 3 figures","Phys. Rev. Lett. 88, 036801 (2002)","10.1103/PhysRevLett.88.036801",,"cond-mat.mes-hall cond-mat.dis-nn cond-mat.stat-mech",,"  We study quantum Hall ferromagnets in the presence of a random electrostatic
impurity potential. Describing these systems with a classical non-linear sigma
model and using analytical estimates supported by results from numerical
simulations, we examine the nature of the ground state as a function of
disorder strength, $\Delta$, and deviation, $\delta \nu$, of the average Landau
level filling factor from unity. Screening of an impurity potential requires
distortions of the spin configuration, and in the absence of Zeeman coupling
there is a disorder-driven, zero-temperature phase transition from a
ferromagnet at small $\Delta$ and $|\delta \nu|$ to a spin glass at larger
$\Delta$ or $|\delta \nu|$. We examine ground-state response functions and
excitations.
","[{""version"":""v1"",""created"":""Tue, 18 Sep 2001 22:07:03 GMT""}]","2011-08-05"
"cond-mat/0109327","Shao-Ming Fei","Sergio Albeverio and Shao-Ming Fei","Integrable Stochastic Ladder Models","Latex, 11 pages","J.Phys.A34:6545-6552,2001","10.1088/0305-4470/34/34/301",,"cond-mat hep-th quant-ph",,"  A general way to construct ladder models with certain Lie algebraic or
quantum Lie algebraic symmetries is presented. These symmetric models give rise
to series of integrable systems. It is shown that corresponding to these SU(2)
symmetric integrable ladder models there are exactly solvable stationary
discrete-time (resp. continuous-time) Markov processes with transition matrices
(resp. intensity matrices) having spectra which coincide with the ones of the
corresponding integrable models.
","[{""version"":""v1"",""created"":""Tue, 18 Sep 2001 16:56:20 GMT""}]","2010-12-01"
"cond-mat/0109328","Entin-Wohlman","O. Entin-Wohlman, A. Aharony, Y. Imry, and Y. Levinson","The Fano Effect in Aharonov-Bohm interferometers","15 pages",,,,"cond-mat.mes-hall",,"  After briefly reviewing the Fano effect, we explain why it may be relevant to
various types of Aharonov-Bohm interferometers. We discuss both closed
(electron conserving) and open interferometers, in which one path contains
either a simple quantum dot or a decorated quantum dot (with more than one
internal state or a parallel path). The possible relevance to some hitherto
unexplained experimental features is also discussed.
","[{""version"":""v1"",""created"":""Tue, 18 Sep 2001 17:33:18 GMT""}]","2019-08-17"
"cond-mat/0109329","Stephanie M. Reimann","G.M. Kavoulakis, S.M. Reimann (LTH, Lund, Sweden), and B. Mottelson
  (NORDITA, Copenhagen, Denmark)","Comment on ``Fragmented Condensate Ground State of Trapped Weakly
  Interacting Bosons in Two Dimensions""","1 page, RevTex, 2 figures","Phys. Rev. Lett., 89 (2002) 079403","10.1103/PhysRevLett.89.079403",,"cond-mat.stat-mech cond-mat.mes-hall",,"  Recently Liu et al. [PRL 87, 030404 (2001)] examined the lowest state of a
weakly-interacting Bose-Einstein condensate. In addition to other interesting
results, using the method of the pair correlation function, they questioned the
validity of the mean-field picture of the formation of vortices and stated that
the vortices are generated at the center of the cloud. This is in apparent
contradiction to the Gross-Pitaevskii approach, which predicts that the
vortices successively enter the cloud from its outer parts as L/N (where N is
the number of atoms in the trap and hbar(L) is the angular momentum of the
system) increases. We have managed to reproduce the results of Liu et al.
however a more careful analysis presented below confirms the validity of the
mean-field approach.
","[{""version"":""v1"",""created"":""Tue, 18 Sep 2001 18:16:36 GMT""},{""version"":""v2"",""created"":""Sun, 4 Aug 2002 15:52:38 GMT""}]","2009-11-07"
"cond-mat/0109330","Ugur Tirnakli","U. Tirnakli, C. Tsallis, M.L. Lyra","Asymmetric unimodal maps at the edge of chaos","8 pages, 6 figs in eps format, submitted for publication",,"10.1103/PhysRevE.65.036207",,"cond-mat.stat-mech",,"  We numerically investigate the sensitivity to initial conditions of
asymmetric unimodal maps $x_{t+1} = 1-a|x_t|^{z_i}$ ($i=1,2$ correspond to
$x_t>0$ and $x_t<0$ respectively, $z_i >1$, $0<a\leq 2$, $t=0,1,2,...$) at the
edge of chaos. We employ three distinct algorithms to characterize the
power-law sensitivity to initial conditions at the edge of chaos, namely:
direct measure of the divergence of initially nearby trajectories, the
computation of the rate of increase of generalized nonextensive entropies $S_q$
and multifractal analysis. The first two methods provide consistent estimates
for the exponent governing the power-law sensitivity. In addition to this, we
verify that the multifractal analysis does not provide precise estimates of the
singularity spectrum $f(\alpha)$, specially near its extremal points. Such
feature prevents to perform a fine check of the accuracy of the scaling
relation between $f(\alpha)$ and the entropic index $q$, thus restricting the
applicability of the multifractal analysis for studing the sensitivity to
initial conditions in this class of asymmetric maps.
","[{""version"":""v1"",""created"":""Tue, 18 Sep 2001 18:12:33 GMT""}]","2009-11-07"
"cond-mat/0109331","Ernesto Villar","Ernesto Villar-Coci\~na, Eduardo Valencia-Morales, Romulo Gonz\'alez-
  Rodr\'iguez and Jes\'us Hern\'andez-Ru\'iz. (Department of Physics, Central
  University of Las Villas, Cuba)","Modeling of the pozzolanic reaction kinetics between lime and wastes of
  the sugar industry starting from the conductometric changes","16 pages, latex, 10 PostScript figures",,,,"cond-mat.mtrl-sci",,"  In this paper the kinetics of the pozzolanic reaction between lime (calcium
hydroxide) and sugar cane straw ash with 20 and 30% of clay burned at 800 and
1000 C is studied. A simple experimental technique where the conductivity is
the experimental variable was used. A calibration curve was established for
correlating the conductivity with the concentration of calcium hydroxide (CH).
We elaborated a mathematical model that allows us to describe the process in
kinetic - diffusive or kinetic regimen. The fitting of the model by
computerized methods lets us determine the parameters that characterize the
process: i.e. the diffusion coefficient and reaction rate constant. The
pozzolanic activity is evaluated according to the obtained values of the
reaction rate constant. The results show that sugar cane straw ash (SCSA) has a
good pozzolanic activity comparable to that of the rice husk ask (RHA).
","[{""version"":""v1"",""created"":""Tue, 18 Sep 2001 19:36:15 GMT""}]","2007-05-23"
"cond-mat/0109332","Wang Yuqing","Yuqing Wang, Z. D. Wang, Y. -X. Li, and X. Pei","Synchronous phase clustering in a network of neurons with spatially
  decaying excitatory coupling",,,,,"cond-mat.soft cond-mat.dis-nn q-bio",,"  Synchronization is studied in a spatially-distributed network of
weekly-coupled, excitatory neurons of Hodgkin-Huxley type. All neurons are
coupled to each other synaptically with a fixed time delay and a coupling
strength inversely proportional to the distance between two neurons. We found
that a robust, noise-resistant phase clustering state occurred regardless of
the initial phase distribution. This has not been shown in previous studies
where similar clustering states were found only when the coupling was
inhibitory. The spatial distribution of neurons in each synchronous cluster is
determined by the spatial distribution of the coupling strength.
Phase-interaction properties of the model neurons in the network are used to
explain why can such a clustering state be robust.
","[{""version"":""v1"",""created"":""Wed, 19 Sep 2001 00:36:23 GMT""}]","2007-05-23"
"cond-mat/0109333","Mohammad H. S. Amin","M.H.S. Amin, A.N. Omelyanchouk, A.M. Zagoskin","Mesoscopic multiterminal Josephson structures: I. Effects of nonlocal
  weak coupling","18 pages, 11 figures","Low Temp. Phys. 27, 616 (2001)","10.1063/1.1399198",,"cond-mat.supr-con cond-mat.mes-hall",,"  We investigate nonlocal coherent transport in ballistic four-terminal
Josephson structures (where bulk superconductors (terminals) are connected
through a clean normal layer, e.g., a two-dimensional electron gas).
  Coherent anisotropic superposition of macroscopic wave functions of the
superconductors in the normal region produces phase slip lines (2D analogs to
phase slip centres) and time-reversal symmetry breaking 2D vortex states in it,
as well as such effects as phase dragging and magnetic flux transfer. The
tunneling density of local Andreev states in the normal layer was shown to
contain peaks at the positions controlled by the phase differences between the
terminals.
  We have obtained general dependence of these effects on the controlling
supercurrent/phase differences between the terminals of the ballistic
mesoscopic four-terminal SQUID.
","[{""version"":""v1"",""created"":""Wed, 19 Sep 2001 00:26:23 GMT""}]","2009-11-07"
"cond-mat/0109334","Shtrichman Itay","I. Shtrichman, C. Metzner, B. D. Gerardot, W. V. Schoenfeld, P. M.
  Petroff","Photoluminescence of a single InAs quantum dot molecule under applied
  electric field","8 pages, 5 figures",,"10.1103/PhysRevB.65.081303",,"cond-mat.str-el",,"  We study the electronic coupling between two vertically stacked InAs quantum
dots, which are embedded in the center of a n-i-n structure. We use a
micro-photoluminescence setup to optically isolate a single quantum dot pair
and measure the time-averaged photoluminescence under an applied vertical
electric field. We find that field tunable coupling between excited states of
the two quantum dots leads to charge transfer from one dot to the other. We
model the spectra including simultaneously the field dependent charge transfer
and exciton capture rates, and the many-body spectra of the quantum dot
molecule for different carrier configurations.
","[{""version"":""v1"",""created"":""Wed, 19 Sep 2001 01:44:27 GMT""}]","2009-11-07"
"cond-mat/0109335","Ferruccio Renzoni","F. Renzoni, T. Brandes","Charge transport through quantum dots via time-varying tunnel couplings","accepted for publication in Phys. Rev. B",,"10.1103/PhysRevB.64.245301",,"cond-mat",,"  We describe a novel mechanism for charge pumping through tunnel-coupled
quantum dots in the regime of strong Coulomb blockade. The quantum state of an
additional electron within the structure is steered by changing the tunneling
couplings between neighbouring dots. Appropriate tailoring of the interdot
tunneling rates allows to design the instantaneous eigenvalues of the system
Hamiltonian. A combination of adiabatic following and Landau-Zener tunneling
results in the transfer of charge from one dot to the neighbouring one.
Coupling to electron reservoirs via weak tunnel-barriers then allows to
implement an electron pump.
","[{""version"":""v1"",""created"":""Wed, 19 Sep 2001 07:51:49 GMT""}]","2009-11-07"
"cond-mat/0109336","Reinhold Egger","R. Egger and A.O. Gogolin","Intrinsic Coulomb blockade in multi-wall carbon nanotubes","13 pages, incl 2 figs, for: Special issue ""Transport in Molecular
  Wires"" in Chemical Physics, ed. by P. Hanggi, M. Ratner, S. Yaliraki","Chem.Phys. 281, 447 (2002)","10.1016/S0301-0104(02)00345-2",,"cond-mat.str-el cond-mat.mes-hall",,"  Carbon nanotubes provide a new class of molecular wires that display new and
exciting mesoscopic transport properties. We provide a detailed theoretical
description for transport in multi-wall nanotubes, where both disorder and
strong interactions are important. The interplay of both aspects leads to a
particularly effective intrinsic Coulomb blockade for tunneling. The relation
to recent experiments is discussed.
","[{""version"":""v1"",""created"":""Wed, 19 Sep 2001 07:53:57 GMT""}]","2009-11-07"
"cond-mat/0109337","Zanardi Paolo","E. Pazy (1) E. Biolatti (2) T. Calarco, (3) I. D'Amico, (1) P. Zanardi
  (1) F. Rossi (1,2), P. Zoller (3) ((1) Institute for Scientific Interchange
  (ISI) Foundation, (2) Physics Department, Polytechnical University of Torino
  (3), Institute for Theoretical Physics, University of Innsbruck)","Spin-based optical quantum gates via Pauli blocking in semiconductor
  quantum dots","14 Pages RevTeX, 3 eps figures included","Europhys. Lett. 62 2003 175","10.1209/epl/i2003-00343-4",,"cond-mat quant-ph",,"  We present a solid-state implementation of ultrafast conditional quantum
gates. Our proposal for a quantum-computing device is based on the spin degrees
of freedom of electrons confined in semiconductor quantum dots, thus benefiting
from relatively long decoherence times. More specifically, combining Pauli
blocking effects with properly tailored ultrafast laser pulses, we are able to
obtain sub-picosecond spin-dependent switching of the Coulomb interaction,
which is the essence of our conditional phase-gate proposal. This allows us to
realize {\it a fast two qubit gate which does not translate into fast
decoherence times} and paves the road for an all-optical spin-based quantum
computer.
","[{""version"":""v1"",""created"":""Wed, 19 Sep 2001 08:53:37 GMT""},{""version"":""v2"",""created"":""Wed, 26 Sep 2001 08:35:38 GMT""},{""version"":""v3"",""created"":""Thu, 28 Feb 2002 11:56:22 GMT""}]","2015-06-24"
"cond-mat/0109339","Karlo Penc","Karlo Penc and B. Sriram Shastry","Exact Spectral Functions of a Non Fermi Liquid in 1 Dimension","14 pages, 5 figures, revtex","Phys. Rev. B 65, 155110/1-7 (2002)","10.1103/PhysRevB.65.155110",,"cond-mat.str-el",,"  We study the exact one electron propagator and spectral function of a
solvable model of interacting electrons due to Schulz and Shastry. The solution
previously found for the energies and wave functions is extended to give the
spectral functions, which turn out to be computable, interesting and non
trivial. They provide one of the few examples of cases where the spectral
functions are known asymptotically as well as exactly.
","[{""version"":""v1"",""created"":""Wed, 19 Sep 2001 10:45:10 GMT""}]","2009-02-27"
"cond-mat/0109340","Martin","R. Guyon, P. Devillard, T. Martin, and I. Safi","Klein Factors in multiple Fractional Quantum Hall edge tunneling","4 pages, 1 figure","Phys. Rev. B 65, 153304 (2002)","10.1103/PhysRevB.65.153304",,"cond-mat.mes-hall",,"  A fractional quantum Hall liquid with multiple edges is considered. The
computation of transport quantities such as current, noise and noise cross
correlations in such multiple edge samples requires the implementation of so
called Klein factors, which insure the correct quasiparticle exchange
properties. The commutation relations of these factors are obtained by closing
the system into a single edge. The non-equilibrium Green's function formalism
associated with such factors is derived for a simple Laughlin fraction of the
Hall effect. It is shown explicitly how Klein factors enter the calculation of
the noise cross correlations, as well as the correction to the Poisson limit
for the noise.
","[{""version"":""v1"",""created"":""Wed, 19 Sep 2001 10:58:29 GMT""},{""version"":""v2"",""created"":""Mon, 14 Jan 2002 16:02:30 GMT""}]","2009-11-07"
"cond-mat/0109341","Daniel Duque","Daniel Duque (Department of Physics, University of Washington)","Comment on ""Spin-1 aggregation model in one dimension""","Accepted for publication in Phys. Rev. E",,"10.1103/PhysRevE.64.063601",,"cond-mat.soft cond-mat.stat-mech",,"  M. Girardi and W. Figueiredo have proposed a simple model of aggregation in
one dimension to mimic the self-assembly of amphiphiles in aqueous solution
[Phys. Rev. E 62, 8344 (2000)]. We point out that interesting results can be
obtained if a different set of interactions is considered, instead of their
choice (the s=1 Ising model).
","[{""version"":""v1"",""created"":""Wed, 19 Sep 2001 13:27:17 GMT""}]","2009-11-07"
"cond-mat/0109342","Laurent Proville","Laurent Proville and S. Aubry","Many-polaron states in the Holstein-Hubbard model","submitted to Journal of Statistical Physics",,,,"cond-mat.str-el cond-mat.supr-con",,"  A variational approach is proposed to determine some properties of the
adiabatic Holstein-Hubbard model which describes the interactions between a
static atomic lattice and an assembly of fermionic charge carriers. The sum of
the electronic energy and the lattice elastic energy is proved to have minima
with a polaron structure in a certain domain of the phase diagram. Our
analytical work consists in the expansion of these energy minima from the zero
electronic transfer limit which remarkably holds for a finite amplitude of the
onsite Hubbard repulsion and for an unbounded lattice size.
","[{""version"":""v1"",""created"":""Wed, 19 Sep 2001 14:47:57 GMT""}]","2007-05-23"
"cond-mat/0109343","M. Keller","M. Keller, W. Metzner, and U. Schollwoeck","Dynamical mean-field theory for the normal phase of the attractive
  Hubbard model",,,,,"cond-mat.str-el",,"  We analyze the normal phase of the attractive Hubbard model within dynamical
mean-field-theory. We present results for the pair-density, the
spin-susceptibility, the specific heat, the momentum distribution, and for the
quasiparticle weight. At weak coupling the low-temperature behavior of all
quantities is consistent with Fermi liquid theory. At strong coupling all
electrons are bound pairs, which leads to a spin gap and removes fermionic
quasi-particle excitations. The transition between the Fermi liquid phase and
the pair phase takes place at a critical coupling of the order of the
band-width and is generally discontinuous at sufficiently low temperatures.
","[{""version"":""v1"",""created"":""Wed, 19 Sep 2001 15:04:38 GMT""}]","2007-05-23"
"cond-mat/0109344","Michael G. A. Crawford","M.G.A. Crawford and P.W. Brouwer","Density of proper delay times in chaotic and integrable quantum
  billiards","3 pages, 2 figures, submitted to Phys. Rev. E","Phys Rev E 65, 026221 (2002)","10.1103/PhysRevE.65.026221",,"cond-mat.mes-hall",,"  We calculate the density P(\tau) of the eigenvalues of the Wigner-Smith time
delay matrix for two-dimensional rectangular and circular billiards with one
opening. For long times, the density of these so-called ""proper delay times""
decays algebraically, in contradistinction to chaotic quantum billiards for
which P(\tau) exhibits a long-time cut-off.
","[{""version"":""v1"",""created"":""Wed, 19 Sep 2001 15:12:31 GMT""}]","2016-08-31"
"cond-mat/0109345","Frithjof Anders","Frithjof B. Anders","Composite spin and orbital triplet superconductivity formed out of a
  Non-Fermi Liquid phase","4 pages, 4 figures, RevTex 4",,"10.1103/PhysRevB.66.020504",,"cond-mat.str-el cond-mat.supr-con",,"  An unconventional superconducting phase is explored developing out of a non
Fermi-liquid phase of the two-channel Anderson lattice model. It is
characterized by a composite order parameter comprising of a local spin or
orbital degree of freedom bound to triplet Cooper pairs with an isotropic and a
nearest neighbour form factor. The superconducting transition temperature peaks
in the moderate intermediate valence regime and vanishes at integral valence.
The gap function is non analytic and odd in frequency, and a pseudo-gap
develops in the conduction electron density of states which vanishes as
$|\omega|$ close to $\omega=0$.
","[{""version"":""v1"",""created"":""Wed, 19 Sep 2001 15:19:37 GMT""}]","2009-11-07"
"cond-mat/0109346","Joel Lebowitz","B. Derrida, J. L. Lebowitz, E. R. Speer","Large Deviation of the Density Profile in the Steady State of the Open
  Symmetric Simple Exclusion Process","37 pages, in Latex, e-mail addresses: derrida@lps.ens.fr,
  lebowitz@sakharov.rutgers.edu, speer@math.rutgers.edu This is a revised
  version with minor changes and corrections; the title has also been revised","J. Stat Phys. 107, 599--634 (2002).","10.1023/A:1014555927320",,"cond-mat",,"  We consider an open one dimensional lattice gas on sites $i=1,...,N$, with
particles jumping independently with rate 1 to neighboring interior empty
sites, the {\it simple symmetric exclusion process}. The particle fluxes at the
left and right boundaries, corresponding to exchanges with reservoirs at
different chemical potentials, create a stationary nonequilibrium state (SNS)
with a steady flux of particles through the system. The mean density profile in
this state, which is linear, describes the typical behavior of a macroscopic
system, i.e., this profile occurs with probability 1 when $N \to \infty$. The
probability of microscopic configurations corresponding to some other profile
$\rho(x)$, $x = i/N$, has the asymptotic form $\exp[-N {\cal F}(\{\rho\})]$;
$\cal F$ is the {\it large deviation functional}. In contrast to equilibrium
systems, for which ${\cal F}_{eq}(\{\rho\})$ is just the integral of the
appropriately normalized local free energy density, the $\cal F$ we find here
for the nonequilibrium system is a nonlocal function of $\rho$. This gives rise
to the long range correlations in the SNS predicted by fluctuating
hydrodynamics and suggests similar non-local behavior of $\cal F$ in general
SNS, where the long range correlations have been observed experimentally.
","[{""version"":""v1"",""created"":""Wed, 19 Sep 2001 15:22:14 GMT""},{""version"":""v2"",""created"":""Thu, 17 Jan 2002 20:56:07 GMT""},{""version"":""v3"",""created"":""Thu, 17 Jan 2002 21:03:08 GMT""}]","2015-06-24"
"cond-mat/0109347","Martijn van den Broek","V. A. Ivanov, M. van den Broek and F. M. Peeters","Strongly interacting $\sigma$-electrons and MgB$_2$ superconductivity","8 pages, 4 figures",,"10.1016/S0038-1098(01)00351-9",,"cond-mat.supr-con",,"  MgB$(p^{n_{\sigma}}p^{n_{\pi}})_{2}$ is classified as a system with strongly
interacting $\sigma$-electrons and non-correlated $\pi$-electrons of boron
ions. The kinematic and Coulomb interaction V between the orbitally degenerated
$\sigma$-electrons provide the superconducting state with an anisotropic gap of
s*-wave symmetry. The critical temperature $T_c$ has a non-monotonic dependence
on the distance r between the centers of gravity of $\sigma$- and $\pi$-bands.
MgB$_2$ corresponds to r=0.085 eV and V=0.45 eV in our model with flat bands.
The derived superconducting density of electronic states is in good agreement
with available experimental and theoretical data. The possibilities for
increasing $T_c$ are discussed.
","[{""version"":""v1"",""created"":""Wed, 19 Sep 2001 15:49:36 GMT""}]","2008-04-09"
