"math/0105049","Philippe Gaucher","Philippe Gaucher","Investigating The Algebraic Structure of Dihomotopy Types","28 pages ; LaTeX2e + 4 figures ; Expository paper ; Minor typos
  corrections ; To appear in GETCO'01 proceedings","Electronic Notes in Theoretical Computer Science, Vol. 52 (2)
  (2002), 25p","10.1016/S1571-0661(04)00221-X",,"math.AT math.CT",,"  This presentation is the sequel of a paper published in GETCO'00 proceedings
where a research program to construct an appropriate algebraic setting for the
study of deformations of higher dimensional automata was sketched. This paper
focuses precisely on detailing some of its aspects. The main idea is that the
category of homotopy types can be embedded in a new category of dihomotopy
types, the embedding being realized by the Globe functor. In this latter
category, isomorphism classes of objects are exactly higher dimensional
automata up to deformations leaving invariant their computer scientific
properties as presence or not of deadlocks (or everything similar or related).
Some hints to study the algebraic structure of dihomotopy types are given, in
particular a rule to decide whether a statement/notion concerning dihomotopy
types is or not the lifting of another statement/notion concerning homotopy
types. This rule does not enable to guess what is the lifting of a given
notion/statement, it only enables to make the verification, once the lifting
has been found.
","[{""version"":""v1"",""created"":""Mon, 7 May 2001 14:55:21 GMT""},{""version"":""v2"",""created"":""Thu, 10 May 2001 19:49:55 GMT""},{""version"":""v3"",""created"":""Mon, 9 Jul 2001 22:26:46 GMT""},{""version"":""v4"",""created"":""Wed, 25 Jul 2001 13:31:13 GMT""}]","2021-08-25"
"nlin/0105010","Jean-Luc Thiffeault","Jean-Luc Thiffeault","Differential Constraints in Chaotic Flows on Curved Manifolds","22 pages. LaTeX 2e with Elsevier style (included). Submitted to
  Physica D",,,,"nlin.CD",,"  The Lagrangian derivatives of finite-time Lyapunov exponents and the
corresponding characteristic directions are shown to satisfy time-asymptotic
differential constraints in chaotic flows. The constraints are valid for any
metric tensor, and are realised with exponential accuracy in time. Some of
these constraints were derived previously for chaotic systems on
low-dimensional Euclidean spaces, by requiring that the Riemann curvature
tensor vanish in Lagrangian coordinates. The new derivation applies in any
number of dimensions, predicts the number of constraints for a given flow, and
provides a rigorous convergence rate of the constraints.
","[{""version"":""v1"",""created"":""Mon, 7 May 2001 15:34:22 GMT""}]","2007-05-23"
"nucl-th/0105017","Jacek Dobaczewski","Ingemar Ragnarsson and W.C. Ma","High-spin terminating bands formed from successive particle-hole
  excitations across closed shells","Invited talk at ""High Spin Physics 2001"", see
  http://www.fuw.edu.pl/~hs2001/, to be published in Acta Physica Polonica B","Acta Phys.Polon. B32 (2001) 2597-2612",,,"nucl-th",,"  High spin states in Zn and Dy isotopes with two protons outside the closed
shells at Z=28 and Z=64, respectively, are discussed. Bands terminating at
higher and higher spin values are formed from successive proton excitations
across these shells. These bands show very different features depending on the
number of excited particles. Very good agreement with experiment is obtained.
Special emphasis is put on the formation of M1-bands in configurations with one
hole in the Z=64 core.
","[{""version"":""v1"",""created"":""Mon, 7 May 2001 07:40:42 GMT""}]","2007-05-23"
"nucl-th/0105018","Jacek Dobaczewski","Gabriel Martinez-Pinedo","Shell Model applications to N=Z nuclei","Invited talk at ""High Spin Physics 2001"", see
  http://www.fuw.edu.pl/~hs2001/, to be published in Acta Physica Polonica B","Acta Phys.Polon. B32 (2001) 2423-2432",,,"nucl-th",,"  This manuscript reviews recent results of large scale shell model
calculations on N=Z nuclei. The topics discussed include the role
proton-neutron pairing on the binding energies of pf-shell nuclei and his
influence on backbending rotors; coulomb energy differences and their
relationship with alignment. Proton-neutron correlations are found responsible
for the characteristic features of the isotopic shifts in calcium, the
parabolic dependence on A and the prominent odd-even staggering.
","[{""version"":""v1"",""created"":""Mon, 7 May 2001 07:44:15 GMT""}]","2007-05-23"
"nucl-th/0105019","Antonio M.","A.M. Moro, J.A. Caballero and J. G\'omez-Camacho","Uncorrelated scattering approximation for the scattering and break-up of
  weakly bound nuclei on heavy targets","34 pages, 5 figures, accepted for publication in Nucl. Phys. A","Nucl.Phys. A695 (2001) 143-166","10.1016/S0375-9474(01)01102-2",,"nucl-th",,"  The scattering of a weakly bound (halo) projectile nucleus by a heavy target
nucleus is investigated. A new approach, called the Uncorrelated Scattering
Approximation, is proposed. The main approximation involved is to neglect the
correlation between the fragments of the projectile in the region where the
interaction with the target is important. The formalism makes use of
hyper-spherical harmonics, Raynal-Revay coefficients and momentum-localized
wave functions to expand projectile channel wave functions in terms of products
of the channel wave function of the individual fragments. Within this approach,
the kinetic energy and angular momentum of each fragment is conserved during
the scattering process. The elastic, inelastic and break-up S-matrices are
obtained as an analytic combination involving the bound wave function of the
projectile and the product of the S-matrices of the fragments. The approach is
applied to describe the scattering of deuteron on $^{58}$Ni at several
energies. The results are compared with experimental data and
continuum-discretized coupled-channels calculations.
","[{""version"":""v1"",""created"":""Mon, 7 May 2001 10:01:55 GMT""}]","2009-11-07"
"physics/0105017","Andrea Macchi","Andrea Macchi, Fulvio Cornolti, and Francesco Pegoraro","Two-Surface Wave Decay","4 EPS figures, Revtex","Physics of Plasmas 9, n.5 (2002) 1704-1711","10.1063/1.1464146",,"physics.plasm-ph",,"  Using an analytical model we discuss the parametric excitation of pairs of
electron surface waves (ESW) in the interaction of an ultrashort, intense laser
pulse with an overdense plasma which has a step-like density profile. The ESWs
can be excited either by the electric or by the magnetic part of the Lorentz
force exerted by the laser and, correspondingly, have frequencies around
$\omega/2$ or $\omega$, where $\omega$ is the laser frequency.
","[{""version"":""v1"",""created"":""Mon, 7 May 2001 11:34:52 GMT""},{""version"":""v2"",""created"":""Wed, 21 Nov 2001 10:24:31 GMT""},{""version"":""v3"",""created"":""Fri, 1 Feb 2002 11:11:39 GMT""},{""version"":""v4"",""created"":""Fri, 26 Apr 2002 12:17:21 GMT""}]","2009-11-07"
"physics/0105019","Andrea Macchi","A. Macchi, F. Cornolti, F. Pegoraro, T. V. Liseikina, H. Ruhl, V. A.
  Vshivkov","Surface Oscillations in Overdense Plasmas Irradiated by Ultrashort Laser
  Pulses","9 pages (LaTeX, Revtex4), 4 GIF color figures, accepted for
  publication in Phys. Rev. Lett","Phys. Rev. Lett. 87, 205004 (2001)","10.1103/PhysRevLett.87.205004",,"physics.plasm-ph",,"  The generation of electron surface oscillations in overdense plasmas
irradiated at normal incidence by an intense laser pulse is investigated.
Two-dimensional (2D) particle-in-cell simulations show a transition from a
planar, electrostatic oscillation at $2\omega$, with $\omega$ the laser
frequency, to a 2D electromagnetic oscillation at frequency $\omega$ and
wavevector $k>\omega/c$. A new electron parametric instability, involving the
decay of a 1D electrostatic oscillation into two surface waves, is introduced
to explain the basic features of the 2D oscillations. This effect leads to the
rippling of the plasma surface within a few laser cycles, and is likely to have
a strong impact on laser interaction with solid targets.
","[{""version"":""v1"",""created"":""Mon, 7 May 2001 08:41:08 GMT""},{""version"":""v2"",""created"":""Tue, 25 Sep 2001 15:16:19 GMT""},{""version"":""v3"",""created"":""Mon, 29 Oct 2001 12:54:30 GMT""}]","2009-11-07"
"physics/0105020","Charbel Tannous","C. Tannous","Static and Dynamic Regimes of Arbitrary Gain Compensation Single-Mode
  Laser Diodes","20 pages including 9 figures. Submitted to Computational Materials
  Science",,,,"physics.optics",,"  We report on a methodology for the evaluation of the DC characteristics,
small-signal frequency response and large-signal dynamic response of carrier
and photon density responses in semiconductor laser diodes. A single mode laser
is considered and described with a pair of rate equations containing a novel
non-linear gain compensation term depending on a single parameter that can be
chosen arbitrarily. This approach can be applied to any type of solid-state
laser as long as it is described by a set of rate equations.
","[{""version"":""v1"",""created"":""Mon, 7 May 2001 15:08:54 GMT""}]","2007-05-23"
"quant-ph/0105020","Bart Jongejan","Bart Jongejan","On Bell's Paradox","13 pages, TeX, 2 figures (stereograms)",,,,"quant-ph",,"  The correlations between the outcomes of pairs of spin component measurements
on particles in the singlet state exist and can be observed independently of
any a priori given frame of reference. We can even construct a frame of
reference that is based on these correlations. This observation-based frame of
reference is equivalent to the customary a priori given frame of reference of
the laboratory when describing real Bohm-Aharonov experiments.
  J.S. Bell has argued that local hidden parameter theories that reproduce the
predictions of Quantum Mechanics cannot exist, but the counterfactual reasoning
leading to Bell's conclusion is physically meaningless if the frame of
reference that is based on spin component measurements is accepted as the
backdrop for Bohm-Aharonov experiments.
  The refutal of Bell's proof opens up for the construction of a viable hidden
parameter theory. A model of a spin h/2 particle in terms of a non-flat metric
of space-time is shown to allow the predictions of quantum mechanics in the
Bohm-Aharonov experiment to be reproduced, without introducing non-locality.
","[{""version"":""v1"",""created"":""Sun, 6 May 2001 19:37:23 GMT""}]","2016-09-08"
"quant-ph/0105022","Ignacio Wilson-Rae","I. Wilson-Rae, A. Imamoglu","Quantum Dot Cavity-QED in the Presence of Strong Electron-Phonon
  Interactions","5 pages, 2 figures, revtex","Phys. Rev. B 65, 235311 (2002).","10.1103/PhysRevB.65.235311",,"quant-ph cond-mat.mes-hall",,"  A quantum dot strongly coupled to a single high finesse optical microcavity
mode constitutes a new fundamental system for quantum optics. Here, the effect
of exciton-phonon interactions on reversible quantum-dot cavity coupling is
analysed without making Born-Markov approximation. The analysis is based on
techniques that have been used to study the ``spin boson'' Hamiltonian.
Observability of vacuum-Rabi splitting depends on the strength and the
frequency dependence of the spectral density function characterizing the
interactions with phonons, both of which can be influenced by phonon
confinement.
","[{""version"":""v1"",""created"":""Mon, 7 May 2001 01:44:30 GMT""}]","2009-09-04"
"quant-ph/0105024","Xiang-Bin Wang","Xiang-Bin Wang and Keiji Matsumoto","NMR C-NOT gate through Aharanov-Anandan's phase shift","5 pages, 1 figure","J. Phys. A: Math. Gen. 34, L631(2001)","10.1088/0305-4470/34/44/105",,"quant-ph",,"  Recently, it is proposed to do quantum computation through the Berry's
phase(adiabatic cyclic geometric phase) shift with NMR (Jones et al, Nature,
403, 869(2000)). This geometric quantum gate is hopefully to be fault tolerant
to certain types of errors because of the geometric property of the Berry
phase. Here we give a scheme to realize the NMR C-NOT gate through
Aharonov-Anandan's phase(non-adiabatic cyclic phase) shift on the dynamic phase
free evolution loop.
  In our scheme, the gate is run non-adiabatically, thus it is less affected by
the decoherence. And, in the scheme we have chosen the the zero dynamic phase
time evolution loop in obtaining the gepmetric phase shift, we need not take
any extra operation to cancel the dynamic phase.
","[{""version"":""v1"",""created"":""Mon, 7 May 2001 14:21:49 GMT""},{""version"":""v2"",""created"":""Tue, 8 May 2001 07:43:08 GMT""},{""version"":""v3"",""created"":""Thu, 10 May 2001 03:58:38 GMT""}]","2009-11-07"
