"hep-ph/0105054","Masato Senami","Masato Senami and Katsuji Yamamoto","Affleck-Dine leptogenesis with triplet Higgs","11 pages, 2 figures","Phys.Lett.B524:332-341,2002","10.1016/S0370-2693(01)01393-4",,"hep-ph",,"  We study an extension of the supersymmetric standard model including a pair
of electroweak triplet Higgs $\Delta$ and ${\bar \Delta}$. The neutrinos
acquire Majorana masses mediated by these triplet Higgs fields rather than the
right-handed neutrinos. The successful leptogenesis for baryogenesis can be
realized after the inflation through the Affleck-Dine mechanism on a flat
manifold consisting of $\Delta$, ${\bar \Delta}$, ${\tilde e}^c$
(anti-slepton), even if the triplet Higgs mass $M_\Delta$ is much larger than
the gravitino mass $m_{3/2} \sim 10^3 {\rm GeV}$. Specifically, due to the
effects of the potential terms provided with the superpotential terms $M_\Delta
{\bar \Delta} \Delta$, $(\lambda_{L /} / 2M) {\bar \Delta} {\bar \Delta} e^c
e^c$, $(\lambda_\Delta / 2M) {\bar \Delta} \Delta {\bar \Delta} \Delta$
($\lambda_{L /} / \lambda_\Delta \sim 0.3 - 3$), the phases of $\Delta$, ${\bar
\Delta}$, ${\tilde e}^c$ are rotated at the time with the Hubble parameter $H
\sim M_\Delta$, producing generally the asymmetry with fraction $\epsilon_L
\sim 0.1$. If $M_\Delta$ is large enough, this early leptogenesis can be
completed before the thermal effects take place.
","[{""version"":""v1"",""created"":""Mon, 7 May 2001 03:58:22 GMT""},{""version"":""v2"",""created"":""Wed, 24 Oct 2001 08:19:40 GMT""},{""version"":""v3"",""created"":""Fri, 9 Nov 2001 08:42:20 GMT""}]","2014-11-17"
"hep-ph/0105055","Jan Kalinowski","Wojciech Krolikowski","LSND effect as a Chooz-restricted ""sterile"" perturbation of
  three-neutrino texture","14 pages, latex, no figures",,,"IFT-01/14","hep-ph",,"  Considering the hypothesis of mixing of three active neutrinos with, at
least, one sterile neutrino, we report on a simple $4\times 4$ texture whose $
3 \times 3 $ part arises from the popular bimaximal texture for three active
neutrinos $ \nu_e, \nu_\mu, \nu_\tau $, where $ c_{12} = 1/\sqrt{2} = s_{12}$,
$ c_{23} = 1/\sqrt{2} = s_{23}$ and $ s_{13} = 0$. Such a $3\times 3 $
bimaximal texture is perturbed through a rotation in the 14 plane, where $\nu_4
$ is the extra neutrino mass state induced by the sterile neutrino $\nu_s $
which becomes responsible for the LSND effect. Then, with $m^2_1\simeq m^2_2$
we predict that $\sin^2 2\theta_{\rm atm} = {1/2}(1+ c^2_{14}) \sim 0.99$ and
$\sin^2 2\theta_{\rm LSND} = {1/2}s^4_{14} \sim 4.5\times10^{-4}$, and in
addition $ \Delta m^2_{\rm atm} = \Delta m^2_{32}$ and $ \Delta m^2_{\rm LSND}
= |\Delta m^2_{41}|$, where $c^2_{14} = \sin^2 2\theta_{\rm sol} \sim 0.97$ and
$\Delta m^2_{21} = \Delta m^2_{\rm sol} \sim 10^{-7} {\rm eV}^2$ if {\it e.g.}
the LOW solar solution is applied. In this four-neutrino texture with $m^2_1
\simeq m^2_2 $ the sum rule $\sin^2 2 \theta_{\rm sol} + {1/2}\sin^2 2
\theta_{\rm Chooz} + \sin^2 2 \theta_{\rm LSND} = 1$ holds in the two-flavor
approximation (for each of three cases), leaving room for the LSND effect,
depending on the magnitude of Chooz effect that, not observed so far, leads (at
present) to the upper bound $\sin^2 2\theta_{\rm LSND}\stackrel{<}{\sim}
1.3\times10^{-3}$ and the lower bound $\sin^2 2\theta_{\rm sol}
\stackrel{>}{\sim} 0.95$. At the end a four-neutrino seesaw mechanism is
sketched.
","[{""version"":""v1"",""created"":""Mon, 7 May 2001 09:05:13 GMT""}]","2007-05-23"
"hep-ph/0105056","B. Lee Roberts","William J. Marciano, B. Lee Roberts","Status of the Hadronic Contribution to the Muon (g-2) Value","18 Pages, 5 figures",,,,"hep-ph",,"  With the recent interest in the measured and standard model values of the
muon anomalous magnetic moment, a_mu, some confusion has arisen concerning our
knowledge of the hadronic contribution to a_mu. In the dispersion integral
approach to hadronic vacuum polarization effects, low energy contributions must
be evaluated from data or in a model-dependent approach tested by data. At
higher energies perturbative QCD has been used, sometimes in conjunction with
data. The history of such evaluations is reviewed, and the prospects for
further improvement are discussed. We conclude that not all published
evaluations are on an equal footing or up-to-date. One must critically examine
which, and how much information went into each analysis in order to determine
which are more complete, and reliable.
","[{""version"":""v1"",""created"":""Mon, 7 May 2001 12:22:18 GMT""}]","2007-05-23"
"hep-ph/0105057","Gautam Bhattacharyya","Gautam Bhattacharyya, Amitava Datta, Anirban Kundu","Can R-parity violation lower $\sin 2\beta$?","Latex, 9 pages, 1 PS figure, requires psfig.sty; v2: minor cosmetic
  changes in text, one reference added; v3: more references and further
  clarifying remarks to match the version to appear in PLB","Phys.Lett.B514:47-56,2001","10.1016/S0370-2693(01)00784-5","SINP/TNP/01-10","hep-ph",,"  Recent time-dependent CP asymmetry measurements in the $B_d \to J/\psi K_S$
channel by the BaBar and Belle Collaborations yield somewhat lower values of
$\sin 2\beta$ compared to the one obtained from the standard model fit. If the
inconsistency between these numbers persists with more statistics, this will
signal new physics contaminating the $B_d \to J/\psi K_S$ channel, thus
disturbing the extraction of $\beta$. We show that the R-parity-violating
interactions in supersymmetric theories can provide extra new phases which play
a role in significantly reducing the above CP asymmetry, thus explaining why
BaBar and Belle report lower values of $\sin 2\beta$. The same couplings also
affect the $B_d \to \phi K_S$ decay rate and asymmetry, explain the $B \to
\eta' K$ anomaly, and predict nonzero CP asymmetry in dominant $B_s$ decays.
The scenario will be tested in the ongoing and upcoming B factories.
","[{""version"":""v1"",""created"":""Mon, 7 May 2001 12:24:03 GMT""},{""version"":""v2"",""created"":""Tue, 15 May 2001 14:10:35 GMT""},{""version"":""v3"",""created"":""Mon, 18 Jun 2001 14:14:26 GMT""}]","2014-11-17"
"hep-ph/0105058","Aldo Deandrea","A. Deandrea and A.D. Polosa","The exclusive B_s -> phi mu+ mu- process in a constituent quark model","17 pages, 6 figures, 5 tables, LaTeX; minor changes to the
  introduction, table III and figure 3. Few references added","Phys.Rev.D64:074012,2001","10.1103/PhysRevD.64.074012","HIP-2001-16/TH, LYCEN-2001-27","hep-ph",,"  We consider the exclusive B_s -> phi mu+ mu- process in the standard model
using a constituent quark loop model approach together with a simple
parameterization of the quark dynamics. The model allows to compute the decay
form factors and therefore can give predictions for the decay rates, the
invariant mass spectra and the asymmetries. This process is suppressed in the
standard model but can be enhanced if new physics beyond the standard model is
present, such as flavor-violating supersymmetric models. It constitutes
therefore an interesting precision test of the standard model at forthcoming
experiments.
","[{""version"":""v1"",""created"":""Mon, 7 May 2001 12:49:34 GMT""},{""version"":""v2"",""created"":""Thu, 14 Jun 2001 16:10:04 GMT""}]","2011-03-23"
"hep-ph/0105059","Eduard Gorbar","E.V. Gorbar, V.P. Gusynin, V.A. Miransky","Dynamical Chiral Symmetry Breaking on a Brane in Reduced QED","PRD version","Phys.Rev. D64 (2001) 105028","10.1103/PhysRevD.64.105028",,"hep-ph hep-th",,"  Reduced gauge theories are theories in which while gauge fields propagate in
a bulk, fermion fields are localized on a brane. We study dynamical chiral
symmetry breaking on a 2-brane and a 1-brane in reduced QED_{3+1}, and on a
1-brane in reduced QED_{2+1}. Since, unlike higher dimensional gauge theories,
QED_{3+1} and QED_{2+1} are well defined, their reduced versions can serve as a
laboratory for studying dynamics in a higher dimensional brane world. The
analysis of the Schwinger-Dyson (SD) equations in these theories reveals rich
and quite nontrivial dynamics in which the conformal symmetry and its breakdown
play a crucial role. Explicit solutions of the SD equations in the
near-critical regime are obtained and the character of the corresponding phase
transition is described.
","[{""version"":""v1"",""created"":""Mon, 7 May 2001 13:17:46 GMT""},{""version"":""v2"",""created"":""Thu, 16 Aug 2001 13:44:37 GMT""},{""version"":""v3"",""created"":""Thu, 8 Nov 2001 17:49:00 GMT""}]","2009-11-07"
"hep-ph/0105060","Marc Vanderhaeghen","D. Drechsel and M. Vanderhaeghen","Magnetic dipole moment of the $\Delta^+$(1232) from the $\gamma p \to
  \gamma \pi^0 p$ reaction","25 pages, 11 figures","Phys.Rev. C64 (2001) 065202","10.1103/PhysRevC.64.065202",,"hep-ph",,"  The $\gamma p \to \gamma \pi^0 p$ reaction in the $\Delta(1232)$-resonance
region is investigated as a method to access the $\Delta^+(1232)$ magnetic
dipole moment. The calculations are performed within the context of an
effective Lagrangian model containing both the $\Delta$-resonant mechanism and
a background of non-resonant contributions to the $\gamma p \to \gamma \pi^0 p$
reaction. Results are shown both for existing and forthcoming $\gamma p \to
\gamma \pi^0 p$ experiments. In particular, the sensitivity of unpolarized
cross sections and photon asymmetries to the $\Delta^+$ magnetic dipole moment
is displayed for those forthcoming data.
","[{""version"":""v1"",""created"":""Mon, 7 May 2001 13:22:14 GMT""}]","2016-09-06"
"hep-ph/0105061","Jonathan R. Ellis","J. Ellis (CERN), S. Heinemeyer (BNL), K.A. Olive (CERN, U. Minnesota)
  and G. Weiglein (CERN, IPPP-Durham)","Observability of the Lightest CMSSM Higgs Boson at Hadron Colliders","13 pages, 4 eps figures, typos corrected, more references","Phys.Lett.B515:348-358,2001","10.1016/S0370-2693(01)00823-1","BNL--HET--01/14, CERN--TH/2001-116, DCPT/01/38,IPPP/01/19,
  UMN--TH--2004/01,TPI--MINN--01/18","hep-ph hep-ex",,"  We discuss the observability of the lightest neutral Higgs boson in the
constrained MSSM (CMSSM), with universal soft supersymmetry-breaking
parameters, at hadron colliders such as the Tevatron and the LHC. We take
account of the constraints on parameter space provided by LEP, the measured
rate of b to s gamma decay, the cosmological relic density Omega h^2, and the
recent measurement of g_mu - 2. We normalize products of the expected CMSSM
Higgs production cross sections and decay branching ratios (sigma B)_CMSSM
relative to those expected for a Standard Model Higgs boson of the same mass.
In the h to gamma gamma channel, we find that (sigma B)_CMSSM > 0.85 (sigma
B)_SM. In the W/t tbar + h, h to b bbar channels, we find that (sigma B)_CMSSM
\~ 1.05 (sigma B)_SM. We conclude that the lightest CMSSM Higgs boson should be
almost as easy to see as the Standard Model Higgs boson: in particular, it
should be discoverable with about 15/fb of luminosity at the Tevatron or 10/fb
of luminosity at the LHC.
","[{""version"":""v1"",""created"":""Mon, 7 May 2001 15:20:35 GMT""},{""version"":""v2"",""created"":""Tue, 26 Jun 2001 16:09:36 GMT""}]","2009-09-11"
"hep-ph/0105062","Rudolf Baier","R. Baier, Yu.L. Dokshitzer, A.H. Mueller, D. Schiff","On the Angular Dependence of the Radiative Gluon Spectrum","LaTex, 5 pages, 1 figure","Phys.Rev. C64 (2001) 057902","10.1103/PhysRevC.64.057902",,"hep-ph",,"  The induced momentum spectrum of soft gluons radiated from a high energy
quark produced in and propagating through a QCD medium is reexamined in the
BDMPS formalism. A mistake in our published work (Physical Review C60 (1999)
064902) is corrected. The correct dependence of the fractional induced loss
$R(\theta_{{\rm cone}})$ as a universal function of the variable
$\theta^2_{{\rm cone}} L^3 \hat q$ where $L$ is the size of the medium and
$\hat q$ the transport coefficient is presented. We add the proof that the
radiated gluon momentum spectrum derived in our formalism is equivalent with
the one derived in the Zakharov-Wiedemann approach.
","[{""version"":""v1"",""created"":""Mon, 7 May 2001 15:35:02 GMT""}]","2009-11-07"
"hep-th/0105052","Shin'ichi Nojiri","Shin'ichi Nojiri, Octavio Obregon, Sergei D. Odintsov, Hernando
  Quevedo and Mike P. Ryan","Quantum bounds for gravitational de Sitter entropy and the
  Cardy-Verlinde formula","LaTeX file, 15 pages, reference is added","Mod.Phys.Lett.A16:1181-1192,2001","10.1142/S0217732301004418",,"hep-th",,"  We analyze different types of quantum corrections to the Cardy-Verlinde
entropy formula in a Friedmann-Robertson-Walker universe and in an (anti)-de
Sitter space. In all cases we show that quantum corrections can be represented
by an effective cosmological constant which is then used to redefine the
parameters entering the Cardy-Verlinde formula so that it becomes valid also
with quantum corrections, a fact that we interpret as a further indication of
its universality. A proposed relation between Cardy-Verlinde formula and the
ADM Hamiltonian constraint is given.
","[{""version"":""v1"",""created"":""Mon, 7 May 2001 01:52:53 GMT""},{""version"":""v2"",""created"":""Sat, 16 Jun 2001 01:41:06 GMT""}]","2009-09-17"
"hep-th/0105054","Shin Nakamura","Shin Nakamura (YITP Kyoto)","Closed-string Tachyon Condensation and the On-shell Effective Action of
  Open-string Tachyons","Latex, 33pages. V3/ Typos corrected and sentences improved.
  References added. V4/ Conclusion changed. Sentences improved, Appendix added,
  references added. V5/ Sentences improved, to appear in Prog.Theor.Phys","Prog.Theor.Phys. 106 (2001) 989-1016","10.1143/PTP.106.989","YITP-01-35","hep-th",,"  We study how the effect of closed-string tachyon condensation can enter into
the on-shell effective action of open-string tachyons in the bosonic case. We
also consider open-string one-loop quantum corrections to the on-shell action.
We use a sigma-model approach with boundary terms, and we utilize some results
of boundary string field theory (BSFT) to define the on-shell effective action.
We regard D-instanton-like objects with appropriate weight as closed-string
tachyon tadpoles, and we insert them into worldsheets to analyze the effect of
closed-string tachyons.
","[{""version"":""v1"",""created"":""Mon, 7 May 2001 05:55:06 GMT""},{""version"":""v2"",""created"":""Mon, 7 May 2001 23:08:19 GMT""},{""version"":""v3"",""created"":""Sat, 26 May 2001 06:55:15 GMT""},{""version"":""v4"",""created"":""Mon, 6 Aug 2001 18:13:03 GMT""},{""version"":""v5"",""created"":""Wed, 12 Dec 2001 14:27:54 GMT""}]","2009-11-07"
"hep-th/0105055","Archil Kobakhidze","Masud Chaichian, Archil Kobakhidze and Dimitry Polyakov","Ghost Tachyon Condensation, Brane-like States and Extra Time Dimension","24 pages, harvmac.tex",,,"KEK-TH-767, HIP-2001-13/TH","hep-th",,"  NSR superstring theory contains a tower of physical vertex operators
(brane-like states) which exist at non-zero pictures only, i.e. are essentially
mixed with superconformal ghosts. Some of these states are massless, they are
responsible for creating D-branes. Other states are tachyonic (called ghost
tachyons) creating a problem for the vacuum stability of the NSR model. In this
paper we explore the role played by these tachyonic states in string dynamics.
We show that the ghost tachyons condense on D-branes, created by massless
brane-like states. Thus the vacuum stability is achieved dynamically, as the
effective ghost tachyon potential exactly cancels the D-brane tension, in full
analogy with Sen's mechanism. As a result, from perturbative NSR model point of
view, massless and tachyonic brane-like states appear to live in a parallel
world, as the brane is screened by the tachyonic veil. We extend the analysis
to the brane-antibrane pair in AdS space and show that in this case due to the
effect of the ghost tachyon condensation one can construct extra
time-dimensional phenomenological models without tachyons and antibranes.
","[{""version"":""v1"",""created"":""Mon, 7 May 2001 07:28:44 GMT""}]","2007-05-23"
"hep-th/0105056","Hiroshige Kajiura","Hiroshige Kajiura","T-Duality Group for Open String Theory","Latex 14 pages; typos corrected, interpretation and references added,
  equations unchanged",,,"UTMS 2001-12","hep-th",,"  We study T-duality for open strings on tori $\T^d$. The general boundary
conditions for the open strings are constructed, and it is shown that T-duality
group, which preserves the mass spectrum of closed strings, preserves also the
mass spectrum of the open strings. The open strings are transformed to those
with different boundary conditions by T-duality. We also discuss the T-duality
for D-brane mass spectrum, and show that the D-branes and the open strings with
both ends on them are transformed together consistently.
","[{""version"":""v1"",""created"":""Mon, 7 May 2001 11:30:03 GMT""},{""version"":""v2"",""created"":""Thu, 7 Jun 2001 14:43:26 GMT""}]","2007-05-23"
"hep-th/0105057","Manfried Faber","M. Faber and A. N. Ivanov","On the equivalence between sine-Gordon model and Thirring model in the
  chirally broken phase of the Thirring model","62 pages, 3 figures,misprints are corrected, the chiral Jacobian is
  recalculated and a few references are added","Eur.Phys.J.C20:723-757,2001","10.1007/s100520100694","IK-TUW-0012401","hep-th",,"  We investigate the equivalence between Thirring model and sine-Gordon model
in the chirally broken phase of the Thirring model. This is unlike all other
available approaches where the fermion fields of the Thirring model were
quantized in the chiral symmetric phase. In the path integral approach we show
that the bosonized version of the massless Thirring model is described by a
quantum field theory of a massless scalar field and exactly solvable, and the
massive Thirring model bosonizes to the sine-Gordon model with a new relation
between coupling constants. We show that the non-perturbative vacuum of the
chirally broken phase in the massless Thirring model can be described in
complete analogy with the BCS ground state of superconductivity. The
Mermin-Wagner theorem and Coleman's statement concerning the absence of
Goldstone bosons in the 1+1-dimensional quantum field theories are discussed.
We investigate the current algebra in the massless Thirring model and give a
new value of the Schwinger term. We show that the topological current in the
sine-Gordon model coincides with the Noether current responsible for the
conservation of the fermion number in the Thirring model. This allows to
identify the topological charge in the sine-Gordon model with the fermion
number.
","[{""version"":""v1"",""created"":""Mon, 7 May 2001 12:58:30 GMT""},{""version"":""v2"",""created"":""Fri, 26 Apr 2002 14:03:17 GMT""}]","2009-01-07"
"hep-th/0105058","Barton Zwiebach","Leonardo Rastelli, Ashoke Sen, and Barton Zwiebach","Half-strings, Projectors, and Multiple D-branes in Vacuum String Field
  Theory","34 pages, LaTeX","JHEP 0111:035,2001","10.1088/1126-6708/2001/11/035","CTP-MIT-3132, PUPT-1985, NSF-ITP-01-35","hep-th",,"  A sliver state is a classical solution of the string field theory of the
tachyon vacuum that represents a background with a single D25-brane. We show
that the sliver wavefunctional factors into functionals of the left and right
halves of the string, and hence can be naturally regarded as a rank-one
projector in a space of half-string functionals. By developing an algebraic
oscillator approach we are able construct higher rank projectors that describe
configurations of multiple D-branes of various dimensionalities and located at
arbitrary positions. The results bear remarkable similarities with
non-commutative solitons.
","[{""version"":""v1"",""created"":""Mon, 7 May 2001 14:40:06 GMT""}]","2009-11-07"
"hep-th/0105060","Silvio Paolo Sorella","A.R. Fazio, V.E.R. Lemes, M.S. Sarandy and S.P. Sorella","The Diagonal Ghost Equation Ward Identity for Yang-Mills Theories in the
  Maximal Abelian Gauge","1+17 pages, LaTeX2e","Phys.Rev.D64:085003,2001","10.1103/PhysRevD.64.085003",,"hep-th",,"  A BRST perturbative analysis of SU(N) Yang-Mills theory in a class of maximal
Abelian gauges is presented. We point out the existence of a new nonintegrated
renormalizable Ward identity which allows to control the dependence of the
theory from the diagonal ghosts. This identity, called the diagonal ghost
equation, plays a crucial role for the stability of the model under radiative
corrections implying, in particular, the vanishing of the anomalous dimension
of the diagonal ghosts. Moreover, the Ward identity corresponding to the
Abelian Cartan subgroup is easily derived from the diagonal ghost equation.
Finally, a simple proof of the fact that the beta function of the gauge
coupling can be obtained from the vacuum polarization tensor with diagonal
gauge fields as external legs is given. A possible mechanism for the decoupling
of the diagonal ghosts at low energy is also suggested.
","[{""version"":""v1"",""created"":""Mon, 7 May 2001 15:40:34 GMT""}]","2010-02-05"
"hep-th/0105061","Diederik Roest","E. Bergshoeff, R. Kallosh, T. Ortin, D. Roest, A. Van Proeyen","Brane plus Bulk Supersymmetry in Ten Dimensions","15 pages, proceedings of 37th Karpacz Winter School, feb 2001",,"10.1063/1.1419313","UG-01-28, SU-ITP-01/23, IFT-UAM/CSIC-01-14, KUL-TF-01/12","hep-th",,"  We discuss a generalized form of IIA/IIB supergravity depending on all R-R
potentials C^(p) (p=0,1,...,9) as the effective field theory of Type IIA/IIB
superstring theory. For the IIA case we explicitly break this R-R democracy to
either p<=3 or p>=5 which allows us to write a new bulk action that can be
coupled to N=1 supersymmetric brane actions.
  The case of 8-branes is studied in detail using the new bulk & brane action.
The supersymmetric negative tension branes without matter excitations can be
viewed as orientifolds in the effective action. These D8-branes and O8-planes
are fundamental in Type I' string theory. A BPS 8-brane solution is given which
satisfies the jump conditions on the wall. As an application of our results we
derive a quantization of the mass parameter and the cosmological constant in
string units.
","[{""version"":""v1"",""created"":""Mon, 7 May 2001 15:49:59 GMT""}]","2009-11-07"
"math/0105045","Boaz Tsaban","Boaz Tsaban","Selection principles and the minimal tower problem","Small updates","Note di Matematica 22 (2003), 53--81","10.1285/i15900932v22n2p53",,"math.LO math.CO math.GN",,"  We study diagonalizations of covers using various selection principles, where
the covers are related to linear quasiorderings (tau-covers). This includes:
equivalences and nonequivalences, combinatorial characterizations, critical
cardinalities and constructions of special sets of reals. This study leads to a
solution of a topological problem which was suggested to the author by
Scheepers (and stated in an earlier work) and is related to the Minimal Tower
problem.
  We also introduce a variant of the notion of tau-cover, called tau^*-cover,
and settle some problems for this variant which are still open in the case of
$\tau$-covers. This new variant introduces new (and tighter) topological and
combinatorial lower bounds on the Minimal Tower problem.
","[{""version"":""v1"",""created"":""Sun, 6 May 2001 17:16:24 GMT""},{""version"":""v2"",""created"":""Sun, 6 Oct 2002 12:14:57 GMT""},{""version"":""v3"",""created"":""Sat, 12 Apr 2003 18:01:22 GMT""},{""version"":""v4"",""created"":""Tue, 23 Sep 2003 12:18:35 GMT""},{""version"":""v5"",""created"":""Tue, 9 Nov 2004 17:11:51 GMT""},{""version"":""v6"",""created"":""Thu, 17 May 2007 18:29:56 GMT""}]","2010-08-02"
"math/0105046","John M. Lee","John M. Lee","Fredholm Operators and Einstein Metrics on Conformally Compact Manifolds","Latex; 83 + vi pages. Fixed an error in the proof of Lemma 3.7(b)","Mem. Amer. Math. Soc. 183 (2006), 83pp., ISBN 0821839152",,,"math.DG math.AP",,"  The main purpose of this monograph is to give an elementary and
self-contained account of the existence of asymptotically hyperbolic Einstein
metrics with prescribed conformal infinities sufficiently close to that of a
given asymptotically hyperbolic Einstein metric with nonpositive curvature. The
proof is based on an elementary derivation of sharp Fredholm theorems for
self-adjoint geometric linear elliptic operators on asymptotically hyperbolic
manifolds.
","[{""version"":""v1"",""created"":""Mon, 7 May 2001 08:48:33 GMT""},{""version"":""v2"",""created"":""Fri, 11 May 2001 22:32:12 GMT""},{""version"":""v3"",""created"":""Tue, 3 Jan 2006 22:19:25 GMT""},{""version"":""v4"",""created"":""Tue, 10 Jan 2006 23:14:39 GMT""},{""version"":""v5"",""created"":""Thu, 27 Jul 2006 21:30:52 GMT""}]","2007-05-23"
"math/0105047","Yuli Rudyak","Yuli B. Rudyak","Piecewise linear structures on topological manifolds","97 pages, LateX",,,,"math.AT math.GT","http://arxiv.org/licenses/nonexclusive-distrib/1.0/","  This is a survey paper where we expose the Kirby--Siebenmann results on
classification of PL structures on topological manifolds and, in particular,
the homotopy equivalence TOP/PL=K(Z/2.3) and the Hauptvermutung for manifolds.
","[{""version"":""v1"",""created"":""Mon, 7 May 2001 11:44:47 GMT""},{""version"":""v2"",""created"":""Wed, 24 Dec 2014 00:58:25 GMT""}]","2016-10-05"
"math/0105048","Marc Gilg","M. Gilg","On deformations of the filiform Lie superalgebra $L_{n,m}$","13 pages",,,,"math.RA",,"  In this work, we recall that every filiform Lie superalgebra is a deformation
of the superalgebra $L_{n,m}$. We study the even cocycles which give this
nilpotent deformations. A family of independent bilinear maps will help us to
describe this cocycles. At the end an evaluation of the dimension of the space
$Z_0^2(L_{n,m},L_{n,m})$ is established.
","[{""version"":""v1"",""created"":""Mon, 7 May 2001 14:19:11 GMT""}]","2007-05-23"
