"astro-ph/0105092","Vladimir Avila-Reese","X. Hernandez (1), V. Avila-Reese (1), C. Firmani (1,2) ((1) Instituto
  de Astronomia UNAM (2) Osservatorio Astronomico di Brera)","A cosmological study of the star formation history in the solar
  neighbourhood","11 pages, 5 encapsulated figures. Accepted for publication in MNRAS.
  Minor changes, references updated","Mon.Not.Roy.Astron.Soc. 327 (2001) 329","10.1046/j.1365-8711.2001.04723.x",,"astro-ph",,"  We use a cosmological galactic evolutionary approach to model the Milky Way.
A detailed treatment of the mass aggregation and dynamical history of the
growing dark halo is included, together with a self consistent physical
treatment for the star formation processes within the growing galactic disc.
This allows us to calculate the temporal evolution of star and gas surface
densities at all galactic radii, in particular, the star formation history
(SFH) at the solar radius. A large range of cosmological mass aggregation
histories (MAHs) is capable of producing a galaxy with the present day
properties of the Milky Way. The resulting SFHs for the solar neighbourhood
bracket the available observational data for this feature, the most probable
MAH yielding the optimal comparison with these observations. We also find that
the rotation curve for our Galaxy implies the presence of a constant density
core in its dark matter halo.
","[{""version"":""v1"",""created"":""Sun, 6 May 2001 19:59:08 GMT""},{""version"":""v2"",""created"":""Tue, 12 Jun 2001 22:58:59 GMT""}]","2009-11-06"
"astro-ph/0105099","Je-An Gu","Je-An Gu and W-Y. P. Hwang","Can the quintessence be a complex scalar field?","9 pages, LaTeX, final version","Phys.Lett. B517 (2001) 1-6","10.1016/S0370-2693(01)00975-3",,"astro-ph hep-ph",,"  In light of the recent observations of type Ia supernovae suggesting an
accelerating expansion of the Universe, we wish in this paper to point out the
possibility of using a complex scalar field as the quintessence to account for
the acceleration. In particular, we extend the idea of Huterer and Turner in
deriving the reconstruction equations for the complex quintessence, showing the
feasibility of making use of a complex scalar field (instead of a real scalar
field) while maintaining the uniqueness feature of the reconstruction for two
possible situations, respectively. We discuss very briefly how future
observations may help to distinguish the different quintessence scenarios,
including the scenario with a positive cosmological constant.
","[{""version"":""v1"",""created"":""Mon, 7 May 2001 14:52:58 GMT""},{""version"":""v2"",""created"":""Tue, 24 Sep 2002 07:50:41 GMT""}]","2009-11-06"
"astro-ph/0105100","Travis A. Rector","Travis A. Rector and John T. Stocke","The Properties of the Radio-Selected 1Jy Sample of BL Lacertae Objects","29 pages, 47 figures, accepted AJ",,"10.1086/321179",,"astro-ph",,"  We present new optical and near-IR spectroscopy as well as new high dynamic
range, arcsecond-resolution VLA radio maps of BL Lacs from the complete
radio-selected ""1 Jansky"" (1Jy) sample (RBLs) for which such data were not
previously available. Unlike BL Lacs from the complete X-ray-selected Einstein
Medium Sensitivity Survey (EMSS) sample (XBLs), most RBLs possess weak but
moderately luminous emission lines. And whereas nearly all XBLs have extended
power levels consistent with FR-1s, more than half of the RBLs have extended
radio power levels too luminous to be beamed FR-1 radio galaxies. In fact, we
find evidence for and examples of three distinct mechanisms for creating the BL
Lac phenomenon in the 1Jy sample: beamed FR-1s, beamed FR-2s and possibly a few
gravitationally-lensed quasars. The v/v_max determined for the 1Jy sample is
0.614+/-0.047, which is markedly different from the negative evolution seen in
the EMSS and other XBL samples. A correlation between logarithmic X-ray to
radio flux ratio and v/v_max is observed across the EMSS and 1Jy samples, from
negative evolution in the more extreme XBLs to positive evolution in the more
extreme RBLs. There is evidence that the selection criteria chosen by Stickel
et al. eliminates some BL Lac objects from the 1Jy sample, although how many is
unknown. And several objects currently in the sample have exhibited strong
emission lines in one or more epochs, suggesting they should be reclassified as
FSRQs. However these selection effects cannot account for the observed
discrepancy in XBL and RBL properties. From these observational properties we
conclude that RBLs and XBLs cannot be related by viewing angle alone, and that
RBLs are more closely related to FSRQs.
","[{""version"":""v1"",""created"":""Sun, 6 May 2001 20:25:44 GMT""}]","2009-11-06"
"astro-ph/0105101","Simon Casassus","S. Casassus (1,2), P.F. Roche (1), D.K. Aitken (3), C.H. Smith (4)
  ((1) Oxford University; (2) Universidad de Chile; (3) University of
  Hertfordshire; (4) UNSW)","8-13um Dust Emission Features in Galactic Bulge Planetary Nebulae","accepted by MNRAS","Mon.Not.Roy.Astron.Soc. 327 (2001) 744","10.1046/j.1365-8711.2001.04750.x",,"astro-ph",,"  A sample of 25 IR-bright planetary nebulae (PNe) towards the Galactic bulge
is analysed through 8-13um spectroscopy. The classification of the warm-dust
emission features provides a measure of the C/O chemical balance, and
represents the first C/O estimates for bulge PNe. Out of 13 PNe with identified
dust types, 4 PNe have emission features associated with C-based grains, while
the remaining 9 have O-rich dust signatures. The low fraction of C-rich PNe,
<30%, contrasts with that for local PNe, around 80%, although it follows the
trend for a decreasing frequency of C-rich PNe with galactocentric radius
(paper~I). We investigate whether the PNe discussed here are linked to the
bulge stellar population (similar to type~IV, or halo, PNe) or the inner
Galactic disk (a young and super-metal-rich population). Although 60% of the
PNe with warm dust are convincing bulge members, none of the C-rich PNe satisfy
our criteria, and they are probably linked to the inner Galactic disk. In the
framework of single star evolution, the available information on bulge PNe
points towards a progenitor population similar in age to that of local PNe
(type I PNe are found in similar proportions), but super-metal-rich (to account
for the scarcity of C-rich objects). Yet the metallicities of bulge PNe, as
inferred from [O/H], fail to reach the required values - except for the C-rich
objects. It is likely that the sample discussed here is derived from a mixed
disk/bulge progenitor population and dominated by type IV PNe, as suggested by
Peimbert (1992). The much higher fraction of O-rich PNe in this sample than in
the solar neighbourhood should result in a proportionally greater injection of
silicate grains into the inner Galactic medium.
","[{""version"":""v1"",""created"":""Mon, 7 May 2001 00:15:48 GMT""}]","2009-11-06"
"astro-ph/0105102","Masako Yamada","Masako Yamada, Yutaka Fujita","Heating of Intracluster Gas by Jet Activities of AGN: Is the
  ""Preheating"" Scenario Realistic?","10 pages including 2 figures, accepted for publication in ApJL",,"10.1086/320674","NAOJ-Th-Ap 2001, No.12","astro-ph",,"  We investigate the non-gravitational heating of hot gas in clusters of
galaxies (intracluster medium; ICM) on the assumption that the gas is heated
well before cluster formation ('preheating'). We examine the jet activities of
radio galaxies as the sources of excess energy in ICM, and the deformation of
the cosmic microwave background (the Sunyaev-Zel'dovich effect) by hot
electrons produced at the jet terminal shocks. We show that the observed excess
entropy of ICM and {\sl COBE/FIRAS} upper limit for the Compton $y$-parameter
are compatible with each other only when the heating by the jets occurred at
relatively small redshift ($z\lesssim 3$). Since this result contradicts the
assumption of 'preheating', it suggests that the heating occurred
simultaneously with or after cluster formation.
","[{""version"":""v1"",""created"":""Mon, 7 May 2001 01:55:19 GMT""}]","2009-11-06"
"astro-ph/0105103","Leonid S. Pilyugin","L.S. Pilyugin (Main Astron. Obs. of Nat. Academy of Sc. of Ukraine)","The oxygen abundance distribution in M101","7 pages, 5 figures, accepted for publication in Astronomy and
  Astrophysics",,"10.1051/0004-6361:20010598",,"astro-ph",,"  The well-observed spiral galaxy M101 was considered. The radial distributions
of oxygen abundances determined in three different ways (with the classic Te -
method, with the R23 - method, and with the P -- method) were compared. It was
found that the parameters (the central oxygen abundance and the gradient) of
the radial O/H(P) abundance distribution are close to those of the O/H(Te)
abundance distribution. The parameters of the O/H(R23) abundance distribution
differ significantly from those of the O/H(Te) abundance distribution: the
central O/H(R23) oxygen abundance is higher by around 0.4dex and the gradient
is steeper by a factor of around 1.5 as compared to those values in the O/H(Te)
abundance distribution.
  The dispersion in O/H(P) abundance at fixed radius is rather small, around
0.08 dex, and is equal to that in O/H(Te) abundance. The dispersion in O/H(R23)
abundance at fixed radius is appreciably larger, around 0.16 dex, compared to
that in O/H(Te) abundance. It has been shown that the extra dispersion in
O/H(R23) abundances is an artifact and reflects scatter in excitation parameter
P at fixed radius.
","[{""version"":""v1"",""created"":""Mon, 7 May 2001 06:53:54 GMT""}]","2009-11-06"
"astro-ph/0105104","Sylos-Labini Francesco","Michael Joyce and Francesco Sylos Labini","Luminosity density estimation from redshift surveys and the mass density
  of the Universe","16 pages, latex, no figures. To be published in Astrophysical Journal
  Letters",,"10.1086/320907",,"astro-ph",,"  In most direct estimates of the mass density (visible or dark) of the
Universe, a central input parameter is the luminosity density of the Universe.
Here we consider the measurement of this luminosity density from red-shift
surveys, as a function of the yet undetermined characteristic scale R_H at
which the spatial distribution of visible matter tends to a well defined
homogeneity. Making the canonical assumption that the cluster mass to
luminosity ratio M/L is the universal one, we can estimate the total mass
density as a function \Omega_m(R_H,M/L). Taking the highest estimated cluster
value M/L ~300h and a conservative lower limit R_H > 20 Mpc/h, we obtain the
upper bound \Omega_m < 0.1 . We note that for values of the homogeneity scale
R_H in the range R_H ~ (90 +/- 45) hMpc, the value of \Omega_m may be
compatible with the nucleosynthesis inferred density in baryons.
","[{""version"":""v1"",""created"":""Mon, 7 May 2001 08:52:53 GMT""}]","2009-11-06"
"astro-ph/0105105","Dima Yakovlev","D.A. Baiko (Ioffe Institute, St.-Petersburg), P. Haensel (Copernicus
  Astronomical Center, Warsaw), D.G. Yakovlev (Ioffe Institute, St.-Petersburg)","Thermal Conductivity of Neutrons in Neutron Star Cores","13 pages, 4 figures, accepted to AA","A&A, 374 (2001) 151","10.1051/0004-6361:20010621",,"astro-ph",,"  The diffusive thermal conductivity of neutrons in dense matter [$\rho \sim (1
- 8) \times 10^{14}$ g cm$^{-3}$] of neutron star cores is calculated. The
contribution from neutron--neutron and neutron--proton collisions is taken into
account. We use the transition probabilities calculated for symmetric dense
nucleon matter on the basis of the Dirac--Brueckner approach to the in-medium
effects and the Bonn model of bare nucleon--nucleon interaction. The diffusive
thermal conductivity of neutrons in the presence of neutron and proton
superfluidities is analyzed in a microscopic manner; the effects of
superfluidity are shown to be significant. The low temperature behavior of the
thermal conductivity appears to be extremely sensitive to the relation between
critical temperatures of neutrons and protons. The results are fitted by simple
analytic expressions. In combination with the formulae for the electron and
muon thermal conductivities, obtained earlier, the present expressions provide
a realistic description of the full diffusive thermal conductivity in the
neutron star cores for normal and various superfluid phases.
","[{""version"":""v1"",""created"":""Mon, 7 May 2001 09:31:43 GMT""}]","2009-11-06"
"astro-ph/0105106","Andrew Read","A. M. Read, W. Pietsch (MPE, Garching)","X-ray emission from the Sculptor galaxy NGC 300","12 pages, latex file, 7 compressed postscript figures, to appear in
  A&A",,"10.1051/0004-6361:20010636",,"astro-ph",,"  We report here the results of a full analysis of all the ROSAT PSPC spectral
imaging observations and all the ROSAT HRI high resolution imaging observations
of the very nearby (D=2.1 Mpc) Sculptor galaxy, NGC 300. Many point sources are
detected within the field, several of them showing evidence for variability,
and we present full source lists detailing their X-ray properties, and attempt
to classify them on the basis of their temporal, spectral and multi-wavelength
characteristics. A black hole X-ray binary candidate, a supersoft source and
several supernova remnants and HII regions are detected in X-rays, as is
unresolved, possibly diffuse emission, accounting for perhaps 20% of the total
NGC 300 X-ray (0.1-2.4 keV) luminosity (5.8 10e38 erg/s). We compare the X-ray
source luminosity distribution of NGC 300 with that of other nearby galaxies,
and we also compare NGC 300 with its Sculptor neighbours, concluding that it is
a quite an unremarkable system, showing no unusual X-ray (or other
multi-wavelength) properties. It may be one of the best examples of a
completely typical normal quiescent late-type spiral galaxy.
","[{""version"":""v1"",""created"":""Mon, 7 May 2001 10:27:39 GMT""}]","2009-11-06"
"astro-ph/0105107","Paola Andreani","Roberto Vio (1), Paola Andreani (2,3), Willem Wamsteker (4) ((1) Chip
  Computers Consulting, Venice Italy, (2) Osservatorio Astronomico di Padova,
  Italy, (3) MPI f. Extraterrestrische Physik, Garching, Germany, (4) ESA IUE
  Observatory, Madrid, Spain)","Numerical Simulation of Non-Gaussian Random Fields with Prescribed
  Correlation Structure","37 pages, 9 figures, accepted by P.A.S.P",,"10.1086/322919",,"astro-ph",,"  In this paper we will consider the problem of the numerical simulation of
non-Gaussian, scalar random fields with a prescribed correlation structure
provided either by a theoretical model or computed on a set of observational
data. Although, the numerical generation of a generic, non-Gaussian random
field is a trivial operation, the task becomes tough when constraining the
field with a prefixed correlation structure. At this regards, three numerical
methods, useful for astronomical applications, are presented. The limits and
capabilities of each method are discussed and the pseudo-codes describing the
numerical implementation are provided for two of them.
","[{""version"":""v1"",""created"":""Mon, 7 May 2001 12:47:56 GMT""}]","2009-11-06"
"astro-ph/0105108","J. D. Myers","J.P. Norris (1), J.D. Scargle (2), and J.T. Bonnell (1) ((1)
  NASA/Goddard Space Flight Center, (2) NASA/Ames Research Center)","Short Gamma-Ray Bursts Are Different","2nd Rome Workshop on Gamma-Ray Bursts in the Afterglow Era, 3 pages",,"10.1007/10853853_9",,"astro-ph",,"  We analyze BATSE time-tagged event (TTE) data for short gamma-ray bursts (T90
duration < 2.6 s), studying spectral lag vs. peak flux and duration, as well as
the number of distinct pulse structures per burst. Performing the
cross-correlation between two energy bands, we measure an average lag ~ 20-40 x
shorter than for long bursts, and a lag distribution close to symmetric about
zero - unlike long bursts. Using a ""Bayesian Block"" method to identify
significantly distinct pulse peaks, we find an order of magnitude fewer pulses
than found in studies of long bursts. The disparity in lag magnitude is
discontinuous across the ~ 2-s valley between long and short bursts. Thus,
short bursts do not appear to be representable as a continuation of long
bursts' temporal characteristics.
","[{""version"":""v1"",""created"":""Mon, 7 May 2001 12:53:31 GMT""}]","2009-11-06"
"astro-ph/0105109","Rachid Ouyed","R. Ouyed (NORDITA, Copenhagen, Denmark), J. Dey (Maulana Azad College,
  Calcutta, India), M. Dey (Presidency College, Calcutta, India)","Quark-Nova","4 pages, 2 figures, shortened title. Major changes in the text,
  version to appear in Astronomy&Astrophysics",,"10.1051/0004-6361:20020982",,"astro-ph",,"  We explore the scenario where the core of a neutron star (having experienced
a transition to an up and down quark phase) shrinks into the equilibrated quark
object after reaching strange quark matter saturation density (where a
composition of up, down and strange quarks is the favored state of matter). The
overlaying (envelope) material free-falls following the core contraction
releasing upto 10^{53} {\rm ergs} in energy as radiation, partly as a result of
the conversion of envelope material to quarks. This phenomena, we named
Quark-Nova, leads to a wide variety of ejectae ranging form the Newtonian,
""dirty"" to the ultra-relativistic fireball. The mass range of the corresponding
compact remnant (the quark star) ranges from less than 0.3M_{\odot} up to a
solar mass. We discuss the connection between Quark-Novae and Gamma ray bursts
and suggest the recently studied GRB011211 event as a plausible Quark-Nova
candidate.
","[{""version"":""v1"",""created"":""Mon, 7 May 2001 12:54:03 GMT""},{""version"":""v2"",""created"":""Mon, 21 May 2001 15:52:56 GMT""},{""version"":""v3"",""created"":""Mon, 1 Jul 2002 14:23:09 GMT""}]","2009-11-06"
"astro-ph/0105110","Ersin Gogus","Ersin Gogus, Chryssa Kouveliotou, Peter M. Woods, Christopher
  Thompson, Robert C. Duncan, Michael S. Briggs","Temporal and Spectral Characteristics of Short Bursts from the Soft
  Gamma Repeaters 1806-20 and 1900+14","24 pages, 11 figures, accepted for publication in ApJ",,"10.1086/322463",,"astro-ph",,"  We study the temporal and coarse spectral properties of 268 bursts from SGR
1806-20 and 679 bursts from SGR 1900+14, all observed with the Rossi X-Ray
Timing Explorer/Proportional Counter Array. Hardness ratios and temporal
parameters, such as T_90 durations and tau_90 emission times are determined for
these bursts. We find a lognormal distribution of burst durations, ranging over
more than two orders of magnitude: T_90 ~ 10^-2 to >~ 1 s, with a peak at ~ 0.1
s. The burst light curves tend to be asymmetrical, with more than half of all
events showing rise times t_r < 0.3 T_90. We find that there exists a
correlation between the duration and fluence of bursts from both sources. We
also find a significant anti-correlation between hardness ratio and fluence for
SGR 1806-20 bursts and a marginal anti-correlation for SGR 1900+14 events.
Finally, we discuss possible physical implications of these results within the
framework of the magnetar model.
","[{""version"":""v1"",""created"":""Mon, 7 May 2001 14:18:01 GMT""}]","2009-11-06"
"astro-ph/0105111","Laura Cayon","L. Cayon, J.L. Sanz, E. Martinez-Gonzalez, A. J. Banday, F. Argueso,
  J.E. Gallegos, K. M. Gorski and G. Hinshaw","Spherical Mexican Hat wavelet: an application to detect non-Gaussianity
  in the COBE-DMR maps","to be published in MNRAs","Mon.Not.Roy.Astron.Soc.326:1243,2001","10.1111/j.1365-2966.2001.04641.x",,"astro-ph",,"  The spherical Mexican Hat wavelet is introduced in this paper, with the aim
of testing the Gaussianity of the Cosmic Microwave Background temperature
fluctuations. Using the information given by the wavelet coefficients at
several scales, we have performed several statistical tests on the COBE-DMR
maps to search for evidence of non-Gaussianity. Skewness, kurtosis, scale-scale
correlations (for two and three scales) and Kolmogorov-Smirnov tests indicate
that the COBE-DMR data are consistent with a Gaussian distribution. We have
extended the analysis to compare temperature values provided by COBE-DMR data
with distributions (obtained from Gaussian simulations) at each pixel and at
each scale. The number of pixels with temperature values outside the 95% and
the 99% is consistent with that obtained from Gaussian simulations, at all
scales. Moreover, the extrema values for COBE-DMR data (maximum and minimum
temperatures in the map) are also consistent with those obtained from Gaussian
simulations.
","[{""version"":""v1"",""created"":""Mon, 7 May 2001 15:28:20 GMT""}]","2011-05-10"
"cond-mat/0105122","Hiroto Adachi","Hideharu Ishida and Ryusuke Ikeda","Theoretical Description of Resistive Behavior near a Quantum
  Vortex-Glass Transition","Explanation of data in strongly disordered case, as well as Fig.2 and
  3, was renewed, and comments on recent publications were added. To appear in
  J.Phys.Soc. Jpn",,"10.1143/JPSJ.71.254",,"cond-mat.supr-con",,"  Resistive behaviors at nonzero temperatures (T > 0) reflecting a quantum
vortex-glass (VG) transition (the so-called field-tuned
superconductor-insulator transition at T=0) are studied based on a quantum
Ginzburg-Landau (GL) action for a s-wave pairing case containing microscopic
details. The ordinary dissipative dynamics of the pair-field is assumed on the
basis of a consistency between the fluctuation conductance terms excluded from
GL approach and an observed negative magnetoresistance. It is shown that the VG
contribution, G_{vg}(B=B_{vg}, T \to 0),to 2D fluctuation conductance at the VG
transition field B_{vg} depends on the strength of a repulsive-interaction
between electrons and takes a universal value only in the ordinary dirty limit
neglecting the electron-repulsion. Available resistivity data near B_{vg} are
discussed based on our results, and extensions to the cases of a d-wave pairing
and of 3D systems are briefly commented on.
","[{""version"":""v1"",""created"":""Mon, 7 May 2001 07:00:35 GMT""},{""version"":""v2"",""created"":""Thu, 18 Oct 2001 06:37:46 GMT""}]","2009-11-07"
"cond-mat/0105123","Hiroto Adachi","Ryusuke Ikeda","Ginzburg-Landau Theory of Vortex Phase Diagram in Layered Type II
  Superconductor","A manuscript to appear in ""Studies of High Temperature
  Superconductors"" Vol.37; Nova Science Publishers. Ed: A. Narlikar",,,,"cond-mat.supr-con",,"  Recent theoretical understanding of the vortex phase diagram in real layered
type II superconductors is briefly described in both cases with fields
perpendicular (B \parallel c) and parallel (B \perp c) to the superconducting
layers. The description is based on a high field approximation of the
Lawrence-Doniach model and on a vortex-glass ordering in each case. It is
argued that, generically, the familiar thermal first order transition at B_m(T)
occurs between the vortex liquid region and the so-called vortex slush region,
and that, in systems with stronger fluctuation, most of the thermal first order
line is covered by the first order melting of the Bragg-glass phase. Recent
observations in YBCO in B \parallel c of the vortex slush region and of the
lower critical point of B_m(T) are understood in this way. Based on the same
scenario, recent resistivity data in YBCO and BSCCO, suggestive of the phase
diagram in B \perp c, are explained.
","[{""version"":""v1"",""created"":""Mon, 7 May 2001 07:20:46 GMT""}]","2007-05-23"
"cond-mat/0105126","Nan Lin Wang","N. L. Wang, H. Mori, S. Tanaka, J. Dong and B. P. Clayman","Far-infrared study of the insulator-metal transition in
  $\theta$-(BEDT-TTF)$_2$RbZn(SCN)$_4$","to be published in J. of Phys.: Condens. Matter",,,,"cond-mat.str-el",,"  The temperature-dependent infrared properties of
$\theta$-(BEDT-TTF)$_2$RbZn(SCN)$_4$ were investigated. In the temperatures
above the metal-insulator (M-I) transition, the optical conductivity remains
finite in the low energy region, but shows no conventional Drude feature
typical of metals. Below the M-I transition temperature, the low-energy
spectral weight is significantly reduced. An opening of optical gap at about
300 cm$^{-1}$ is observed clearly in the polarization parallel to the
donor-stacking direction. Analysis of both the electronic and vibronic spectra
suggests a redistribution of charges in ET molecules as temperature decreases
across the M-I transition, providing strong support for the charge-ordering
state at low temperatures.
","[{""version"":""v1"",""created"":""Sun, 6 May 2001 17:06:47 GMT""}]","2007-05-23"
"cond-mat/0105127","Vijay Balasubramanian","Vijay Balasubramanian, Don Kimber, Michael J Berry","Metabolically Efficient Information Processing","LaTeX, 15 pages, 4 separate Postscript figures","Neural Computation, Vol. 13, Issue 4, April 2001, pp. 799-815",,,"cond-mat.stat-mech cond-mat.dis-nn q-bio.NC",,"  Energy efficient information transmission may be relevant to biological
sensory signal processing as well as to low power electronic devices. We
explore its consequences in two different regimes. In an ``immediate'' regime,
we argue that the information rate should be maximized subject to a power
constraint, while in an ``exploratory'' regime, the transmission rate per power
cost should be maximized. In the absence of noise, discrete inputs are
optimally encoded into Boltzmann distributed output symbols. In the exploratory
regime, the partition function of this distribution is numerically equal to 1.
The structure of the optimal code is strongly affected by noise in the
transmission channel. The Arimoto-Blahut algorithm, generalized for cost
constraints, can be used to derive and interpret the distribution of symbols
for optimal energy efficient coding in the presence of noise. We outline the
possibilities and problems in extending our results to information coding and
transmission in neurobiological systems.
","[{""version"":""v1"",""created"":""Sun, 6 May 2001 17:09:05 GMT""}]","2007-05-23"
