"cond-mat/0105128","Vijay Balasubramanian","Vijay Balasubramanian and Michael J Berry","Metabolically Efficient Codes in The Retina","LaTeX, 22 pages, 9 separate PS figures",,,"UPR-932-T","cond-mat.soft cond-mat.dis-nn q-bio.NC",,"  We tested the hypothesis that the neural code of retinal ganglion cells is
optimized to transmit visual information at minimal metabolic cost. Under a
broad ensemble of light patterns, ganglion cell spike trains consisted of
sparse, precise bursts of spikes. These bursts were viewed as independent
neural symbols. The noise in each burst was measured via repeated presentation
of the visual stimulus, and the energy cost was estimated from the total charge
flow in a biophysically realistic model of ganglion cell spiking. Given these
costs and noise, the theory of efficient codes predicts an optimal distribution
of symbol usage. Symbols that are either noisy or metabolically costly are
suppressed in this optimal code. We found excellent qualitative and
quantitative agreement with the measured distribution of burst sizes for
ganglion cells in the tiger salamander retina.
","[{""version"":""v1"",""created"":""Sun, 6 May 2001 18:10:15 GMT""}]","2007-05-23"
"cond-mat/0105129","Patrick Bruno","Patrick Bruno","Absence of spontaneous magnetic order at non-zero temperature in one-
  and two-dimensional Heisenberg and XY systems with long-range interactions","RevTeX, 4 pages. Further (p)reprints available from
  http://www.mpi-halle.de/~theory ; v2: revised version","Phys. Rev. Lett. 87, 137203 (2001)","10.1103/PhysRevLett.87.137203",,"cond-mat.stat-mech cond-mat.mes-hall",,"  The Mermin-Wagner theorem is strengthened so as to rule out magnetic
long-range order at T>0 in one- or two-dimensional Heisenberg and XY systems
with long-range interactions decreasing as R^{-alpha} with a sufficiently large
exponent alpha. For oscillatory interactions, ferromagnetic long-range order at
T>0 is ruled out if alpha >= 1 (D=1) or alpha > 5/2 (D=2). For systems with
monotonically decreasing interactions ferro- or antiferromagnetic long-range
order at T>0 is ruled out if alpha >= 2D.
","[{""version"":""v1"",""created"":""Sun, 6 May 2001 19:57:37 GMT""},{""version"":""v2"",""created"":""Wed, 11 Jul 2001 17:05:08 GMT""},{""version"":""v3"",""created"":""Mon, 27 May 2002 13:26:58 GMT""}]","2009-11-07"
"cond-mat/0105130","Shun-Qing Shen","Shun-Qing Shen","Generalized Valence Bond State and Solvable Models for Spin-1/2 Systems
  with Orbital degeneracy","4 pages","Phys. Rev. B 64, 132411 (2001)","10.1103/PhysRevB.64.132411",,"cond-mat.str-el",,"  A spin-1/2 system with double orbital degeneracy may possess SU(4) symmetry.
According to the group theory a global SU(4) singelt state can be expressed as
a linear combination of all possible configurations consisting of four-site
SU(4) singlets. Following P. W. Andersion's idea for spin 1/2 system, we
propose that the ground state for the antiferromagnetic SU(4) model is SU(4)
resonating valence bond (RVB) state. A short-range SU(4) RVB state is a spin
and orbital liquid, and its elementary excitations has an energy gap. We
construct a series of solvale models which ground states are short-range SU(4)
RVB states. The results can be generalized to the antiferromagnetic SU(N)
models.
","[{""version"":""v1"",""created"":""Mon, 7 May 2001 01:15:39 GMT""}]","2009-11-07"
"cond-mat/0105131","Tsutomu Momoi","Tsutomu Momoi (University of Tsukuba)","Quantum melting of incommensurate domain walls in two dimensions","11 pages, 5 figures","Phys. Rev. B 67, 014529 (2003).","10.1103/PhysRevB.67.014529",,"cond-mat.stat-mech cond-mat.str-el",,"  Quantum fluctuations of periodic domain-wall arrays in two-dimensional
incommensurate states at zero temperature are investigated using the elastic
theory in the vicinity of the commensurate-incommensurate transition point.
Both stripe and honeycomb structures of domain walls with short-range
interactions are considered. It is revealed that the stripes melt and become a
stripe liquid in a large-wall-spacing (low-density) region due to dislocations
created by quantum fluctuations. This quantum melting transition is of second
order and characterized by the three-dimensional XY universality class.
Zero-point energies of the stripe and honeycomb structures are calculated. As a
consequence of these results, phase diagrams of the domain-wall solid and
liquid phases in adsorbed atoms on graphite are discussed for various
domain-wall masses. Quantum melting of stripes in the presence of long-range
interactions that fall off as power laws is also studied. These results are
applied to incommensurate domain walls in two-dimensional adsorbed atoms on
substrates and in doped antiferromagnets, e.g. cuprates and nickelates.
","[{""version"":""v1"",""created"":""Mon, 7 May 2001 06:17:14 GMT""},{""version"":""v2"",""created"":""Mon, 15 Jul 2002 15:41:54 GMT""}]","2009-11-07"
"cond-mat/0105132","Andrei Zaikin","A.D. Zaikin and D.S. Golubev","Coulomb Effects and Electron Transport Through a Coherent Conductor","6 pages, 2 figures. To be published in the Proceedings of the
  Rencontres de Moriond Conference ""Electronic Correlations: From Meso- to
  Nano-physics"", Les Arcs, France, January 20-27, 2001",,,,"cond-mat.mes-hall",,"  We analyze electron transport through relatively short coherent conductors in
the presence of Coulomb interaction. We evaluate the current-voltage
characteristics of such conductors taking into account the effect of an
external environment. Within our model, at large conductances and low $T$ the
conductance is suppressed by a universal factor which depends only on the type
of the conductor. We also argue that at T=0 the system ``scatterer+shunt'' can
be either an insulator or a metal depending on whether its total resistance is
larger or smaller than $R_Q=h/e^2\approx 25.8$ k$\Omega$. In a metallic phase
the Coulomb gap is fully suppressed by quantum fluctuations.
","[{""version"":""v1"",""created"":""Mon, 7 May 2001 08:52:18 GMT""}]","2007-05-23"
"cond-mat/0105133","Andrei Ivanov","Andrei Ivanov","Possibility of the investigation of the X-ray diffraction patterns for
  yttrium ceramic YBa2Cu3Ox having different oxygen stoichiometry on the basis
  of the mixed-layer crystal model","2 figures",,,,"cond-mat.mtrl-sci cond-mat.supr-con",,"  In view of the strong anisotropy of oxygen diffusion in high-Tc ceramic
YBa2Cu3Ox, it is supposed that a polycrystalline sample of this material can be
presented as consisting of crystal grains where each grain was formed by a
certain sequence of layers with tetragonal or orthorhombic phase structure. The
theory of scattering by mixed-layer crystals was taken as a basis for
calculating theoretical X-ray patterns for different sequences of the layers.
Some modifications were made in the theory due to crystal structure features of
the YBa2Cu3Ox phases. The results obtained agreed quantitatively with data
published in many papers and can be used for interpreting the X-ray patterns
from ceramics with different oxygen stoichiometry.
","[{""version"":""v1"",""created"":""Mon, 7 May 2001 09:05:51 GMT""}]","2007-05-23"
"cond-mat/0105134","Alberto Girlando","Luca Farina, Aldo Brillante, Matteo Masino and Alberto Girlando","Pressure driven neutral-ionic transition in ClMePD-DMeDCNQI","6 pages in *.PS format, 5 figures","Phys. Rev. B, 64, 144102 (2001)","10.1103/PhysRevB.64.144102",,"cond-mat.mtrl-sci cond-mat.str-el",,"  Application of about 0.8 GPa pressure is sufficient to induce the
neutral-ionic transition in the mixed stack charge-transfer crystal
2-chloro-5-methyl-$p$-phenylenediamine--2,5-dimethyl-dicyanoquinonediimine
({\CD}). The ionicity increases continuously from $\sim$ 0.35 at ambient
conditions to $\sim$ 0.65 when the pressure is raised up to 2 GPa. Moreover,
stack dimerization begins well before the crossing of the neutral-ionic
interface. The evolution of the transition is similar to what observed in the
temperature induced phase change in the same compound. (cond-mat/0101179) A
distinguishing feature is represented by the simultaneous presence of domains
of molecules with slightly different ionicities across the transition pressure.
A comparison of the present example of pressure driven neutral-ionic transition
with the well studied cases of tetrathiafulvalene--chloranil and of
tetrathiafulvalene--2,5-dichloro-p-benzoquinone puts in evidence the remarkably
different evolution of the three transitions.
","[{""version"":""v1"",""created"":""Mon, 7 May 2001 09:59:48 GMT""}]","2009-11-07"
"cond-mat/0105135","Masahito Mochizuki","Masahito Mochizuki and Masatoshi Imada","Origin of G-type Antiferromagnetism and Orbital-Spin Structures in ${\rm
  LaTiO}_3$","9 pages, 6 figures","J. Phys. Soc. Jpn. 70 (2001) 2872","10.1143/JPSJ.70.2872",,"cond-mat.str-el",,"  The possibility of the $D_{3d}$ distortion of ${\rm TiO}_6$ octahedra is
examined theoretically in order to understand the origin of the G-type
antiferromagnetism (AFM(G)) and experimentally observed puzzling properties of
${\rm LaTiO}_3$. By utilizing an effective spin and pseudospin Hamiltonian with
the strong Coulomb repulsion, it is shown that AFM(G) state is stabilized
through the lift of the $t_{2g}$-orbital degeneracy accompanied by a tiny
$D_{3d}$-distortion . The estimated spin-exchange interaction is in agreement
with that obtained by the neutron scattering. Moreover, the level-splitting
energy due to the distortion can be considerably larger than the spin-orbit
interaction even when the distortion becomes smaller than the detectable limit
under the available experimental resolution. This suggests that the orbital
momentum is fully quenched and the relativistic spin-orbit interaction is not
effective in this system, in agreement with recent neutron-scattering
experiment.
","[{""version"":""v1"",""created"":""Mon, 7 May 2001 13:23:02 GMT""}]","2009-09-25"
"cond-mat/0105136","Ilya Eremin","M. V. Eremin and I. A. Larionov","Characteristic features of d pairing in bilayer cuprates under
  conditions of Peierls instability of the normal phase",,"JETP Lett. 68, 611 (1998)","10.1134/1.567916",,"cond-mat.supr-con cond-mat.str-el",,"  A system of self-consistent integral equations for the superconducting gap is
formulated and solved taking account of the instability of the normal phase of
bilayered cuprates against charge-density waves. The critical parameters are
calculated as a function of the wave vector, temperature, and doping index. It
is found that the region in which superconductivity coexists with d-type
charge-density waves depends strongly on the doping index. The effective
energy-gap parameter, determined as the interval between the peaks of the
density of states, can have a local minimum at temperatures T$<$T$_C$.
","[{""version"":""v1"",""created"":""Mon, 7 May 2001 13:40:09 GMT""}]","2009-11-07"
"cond-mat/0105137","Fleurov Victor","M. Levanda and V Fleurov (School of Physics and Astronomy, Tel Aviv
  University)","Wigner quasi-distribution function for charged particles in classical
  electromagnetic fields","47 pages; accepted for publication in Annals of Physics","Annals of Physics (2001), 292, 199 - 231","10.1006/aphy.2001.6170",,"cond-mat quant-ph",,"  A gauge-invariant Wigner quasi-distribution function for charged particles in
classical electromagnetic fields is derived in a rigorous way. Its relation to
the axial gauge is discussed, as well as the relation between the kinetic and
canonical momenta in the Wigner representation. Gauge-invariant quantum analogs
of Hamilton-Jacobi and Boltzmann kinetic equations are formulated for arbitrary
classical electromagnetic fields in terms of the ""slashed"" derivatives and
momenta, introduced for this purpose. The kinetic meaning of these slashed
quantities is discussed. We introduce gauge-invariant conditional moments and
use them to derive a kinetic momentum continuity equation. This equation
provides us with a hydrodynamic representation for quantum transport processes
and a definition of the ""collision force"". The hydrodynamic equation is applied
for the rotation part of the electron motion. The theory is illustrated by its
application in three examples. These are: Wigner quasi-distribution function
and equations for an electron in a magnetic field and harmonic potential;
Wigner quasi-distribution function for a charged particle in periodic systems
using the kq representation; two Wigner quasi-distribution functions for
heavy-mass polaron in an electric field.
","[{""version"":""v1"",""created"":""Mon, 7 May 2001 15:34:47 GMT""},{""version"":""v2"",""created"":""Tue, 8 May 2001 13:13:59 GMT""}]","2009-11-07"
"cs/0105011","Frederic Goualard","Frederic Goualard","Component Programming and Interoperability in Constraint Solver Design","11 pages, 1 figure, paper accepted at the 6th Annual workshop of the
  ERCIM Working Group on Constraints",,,,"cs.PL",,"  Prolog was once the main host for implementing constraint solvers.
  It seems that it is no longer so. To be useful, constraint solvers have to be
integrable into industrial applications written in imperative or
object-oriented languages; to be efficient, they have to interact with other
solvers. To meet these requirements, many solvers are now implemented in the
form of extensible object-oriented libraries. Following Pfister and Szyperski,
we argue that ``objects are not enough,'' and we propose to design solvers as
component-oriented libraries. We illustrate our approach by the description of
the architecture of a prototype, and we assess its strong points and
weaknesses.
","[{""version"":""v1"",""created"":""Mon, 7 May 2001 12:56:11 GMT""}]","2007-05-23"
"cs/0105012","Mark Johnson","Mark Johnson","Joint and conditional estimation of tagging and parsing models","8 pages, Proceedings of the ACL 2001",,,,"cs.CL",,"  This paper compares two different ways of estimating statistical language
models. Many statistical NLP tagging and parsing models are estimated by
maximizing the (joint) likelihood of the fully-observed training data. However,
since these applications only require the conditional probability
distributions, these distributions can in principle be learnt by maximizing the
conditional likelihood of the training data. Perhaps somewhat surprisingly,
models estimated by maximizing the joint were superior to models estimated by
maximizing the conditional, even though some of the latter models intuitively
had access to ``more information''.
","[{""version"":""v1"",""created"":""Mon, 7 May 2001 14:25:22 GMT""}]","2007-05-23"
"cs/0105013","Ted Herman","Shlomi Dolev and Ted Herman","Dijkstra's Self-Stabilizing Algorithm in Unsupportive Environments","12 pages, uses eepic.sty",,,"TR-01-03","cs.DC",,"  The first self-stabilizing algorithm [Dij73] assumed the existence of a
central daemon, that activates one processor at time to change state as a
function of its own state and the state of a neighbor. Subsequent research has
reconsidered this algorithm without the assumption of a central daemon, and
under different forms of communication, such as the model of link registers. In
all of these investigations, one common feature is the atomicity of
communication, whether by shared variables or read/write registers. This paper
weakens the atomicity assumptions for the communication model, proposing
versions of [Dij73] that tolerate various weaker forms of atomicity. First, a
solution for the case of regular registers is presented. Then the case of safe
registers is considered, with both negative and positive results presented. The
paper also presents an implementation of [Dij73] based on registers that have
probabilistically correct behavior, which requires a notion of weak
stabilization.
","[{""version"":""v1"",""created"":""Mon, 7 May 2001 14:29:59 GMT""}]","2007-05-23"
"gr-qc/0105023","Marc Mars","Marc Mars, Walter Simon","On uniqueness of static Einstein-Maxwell-dilaton black holes","LaTex, 24 pages, no figures; Corrected and enlarged version","Adv.Theor.Math.Phys. 6 (2002) 279-305",,,"gr-qc",,"  We prove uniqueness of static, asymptotically flat spacetimes with
non-degenerate black holes for three special cases of Einstein-Maxwell-dilaton
theory: For the coupling ``$\alpha = 1$'' (which is the low energy limit of
string theory) on the one hand, and for vanishing magnetic or vanishing
electric field (but arbitrary coupling) on the other hand. Our work generalizes
in a natural, but non-trivial way the uniqueness result obtained by
Masood-ul-Alam who requires both $\alpha = 1$ and absence of magnetic fields,
as well as relations between the mass and the charges. Moreover, we simplify
Masood-ul-Alam's proof as we do not require any non-trivial extensions of
Witten's positive mass theorem. We also obtain partial results on the
uniqueness problem for general harmonic maps.
","[{""version"":""v1"",""created"":""Mon, 7 May 2001 12:55:39 GMT""},{""version"":""v2"",""created"":""Wed, 3 Jul 2002 17:46:48 GMT""}]","2013-09-02"
"gr-qc/0105024","M. B. Altaie","M.B.Altaie","Quantum black hole inflation","18 pages, Latex",,,,"gr-qc",,"  In this paper we follow a new approach for particle creation by a localized
strong gravitational field. The approach is based on a definition of the
physical vacuum drawn from Heisenberg uncertainty principle. Using the fact
that the gravitational field red-shifts the frequency modes of the vacuum, a
condition on the minimum stregth of the gravitational field required to achieve
real particle creation is derived. Application of this requirement on a
Schwartzchid black hole resulted in deducing an upper limit on the region,
outside the event horizon, where real particles can be created. Using this
regional upper limit, and considering particle creation by black holes as a
consequence of the Casimir effect, with the assumption that the created quanta
are to be added to the initial energy, we deduce a natural power law for the
development of the event horizon, and consequently a logarithmic law for the
area spectrum of an inflating black hole. Application of the results on a
cosmological model shows that if we start with a Planck-dimensional black hole,
then through the process of particle creation we end up with a universe having
the presently estimated critical density. Such a universe will be in a state of
eternal inflation.
","[{""version"":""v1"",""created"":""Mon, 7 May 2001 14:03:01 GMT""}]","2007-05-23"
"hep-ex/0105009","Baurov A.","Yu.A.Baurov, A.A.Konradov, V.F.Kushniruk, E.A.Kuznetsov, Yu.V.Ryabov,
  A.P.Senkevich, Yu.G.Sobolev, S.V.Zadorozsny","Experimental Investigations of Changes in beta-decay rate of Co-60 and
  Cs-137","13 pages, LaTeX2e, 4 PS figures","Mod.Phys.Lett. A16 (2001) 2089-2102","10.1142/S0217732301005187",,"hep-ex",,"  Results of simultaneous measurements of beta-decay rate with the aid of
Ge(Li)-detectors performed at two laboratories 140km apart (INR RAS, Troitsk,
Co-60, and JINR, Dubna, Cs-137) during a period from 15.03.2000 till
10.04.2000, are presented. Regular deviations of the count rate of gamma-quanta
following the beta-decay of $\sim$ 0.7% (INR RAS, Co-60) and $\sim$ 0.2% (JINR,
Cs-137) from the statistical average, are observed. The analysis of extremum
deviations of gamma-quanta count rate shows that the set of directions of
tangents to the Earth's parallels of latitude at the extremum points of
trajectories of motion in the space of each laboratory clearly forms three
separate compact subsets of directions which agree, for two laboratories, to an
accuracy of $\pm10^\circ$. This phenomenon is shown not to be explained on the
basis of traditional notion. A possible explanation is suggested basing on the
hypothesis that there exists a new anisotropic interaction caused by the
cosmological vectorial potential \textbf{A}$_{\rm g}$, a new fundamental
constant having, according to the experiments carried out, the coordinate of
right ascension $\alpha \approx 285^\circ$ in the second equatorial system.
This is in agreement with earlier experiments.
","[{""version"":""v1"",""created"":""Mon, 7 May 2001 08:02:35 GMT""}]","2009-11-07"
"hep-ex/0105010","Matthew Wing","M. Krawczyk (University of Warsaw), S. Soldner-Rembold (CERN), M. Wing
  (McGill University)","Reach of future colliders in probing the structure of the photon","5 pages, 2 figures. To appear in ""The THERA Book"",
  DESY-LC-REV-2001-062. IFT 2001/13",,,,"hep-ex",,"  A comparison of the potentials of ep and e^+e^-$machines to probe the
structure of the photon is performed. In particular, the kinematic reach of a
proposed future ep facility, THERA, is compared with those of current
colliders, LEP and HERA, and with the proposed linear collider, TESLA. THERA
like HERA will use a proton beam of 920 GeV but with an increased electron beam
energy of 250 GeV allowing higher scales, Q^2, and lower values of parton
momentum fraction in the photon, x_\gamma, to be probed.
","[{""version"":""v1"",""created"":""Mon, 7 May 2001 12:41:16 GMT""}]","2007-05-23"
"hep-lat/0105006","Tom Blum","T. Blum, N. Christ, C. Cristian, C. Dawson, X. Liao, G. Liu, R.
  Mawhinney, L. Wu, Y. Zhestkov","Chirality Correlation within Dirac Eigenvectors from Domain Wall
  Fermions","latex, 25 pages including 12 eps figures","Phys.Rev. D65 (2002) 014504","10.1103/PhysRevD.65.014504","CU-TP-1014, BNL-HET-01/10, RBRC-185","hep-lat hep-th",,"  In the dilute instanton gas model of the QCD vacuum, one expects a strong
spatial correlation between chirality and the maxima of the Dirac eigenvectors
with small eigenvalues. Following Horvath, {\it et al.} we examine this
question using lattice gauge theory within the quenched approximation. We
extend the work of those authors by using weaker coupling, $\beta=6.0$, larger
lattices, $16^4$, and an improved fermion formulation, domain wall fermions. In
contrast with this earlier work, we find a striking correlation between the
magnitude of the chirality density, $|\psi^\dagger(x)\gamma^5\psi(x)|$, and the
normal density, $\psi^\dagger(x)\psi(x)$, for the low-lying Dirac eigenvectors.
","[{""version"":""v1"",""created"":""Mon, 7 May 2001 02:31:45 GMT""}]","2009-11-07"
"hep-ph/0105050","Hai Lin","Hai Lin","A Grand Canonical Ensemble Approach to the Thermodynamic Properties of
  the Nucleon in the Quark-Gluon Coupling Model","5 pages, LaTex",,"10.1103/PhysRevD.64.105026",,"hep-ph",,"  In this paper, we put forward a way to study the nucleon's thermodynamic
properties such as its temperature, entropy and so on, without inputting any
free parameters by human hand, even the nucleon's mass and radius. First we use
the Lagrangian density of the quark gluon coupling fields to deduce the Dirac
Equation of the quarks confined in the gluon fields. By boundary conditions we
solve the wave functions and energy eigenvalues of the quarks, and thus get
energy-momentum tensor, nucleon mass, and density of states. Then we utilize a
hybrid grand canonical ensemble, to generate the temperature and chemical
potentials of quarks, antiquarks of three flovars by the four conservation laws
of the energy and the valence quark numbers, after which, all other
thermodynamic properties are known. The only seemed free paremeter, the nucleon
radius is finally determined by the grand potential minimal principle.
","[{""version"":""v1"",""created"":""Mon, 7 May 2001 03:58:33 GMT""}]","2013-05-29"
"hep-ph/0105053","Alexander Belyaev","Alexander Belyaev, David Garcia, Jaume Guasch, Joan Sola","Prospects for supersymmetric charged Higgs boson discovery at the
  Tevatron and the LHC","4 pages, 4 figures,revtex","Phys.Rev.D65:031701,2002","10.1103/PhysRevD.65.031701","FSU-HEP-050101, KA-TP-15-2001, UAB-FT-512","hep-ph",,"  We investigate the prospects for heavy charged Higgs boson production through
the mechanisms pp-bar(pp)->tbH+ +X at the upgraded Fermilab Tevatron and at the
upcoming LHC collider at CERN respectively. We focus on the MSSM case at high
values of tan[beta]> m_top/m_bot and include the leading SUSY quantum
corrections. A detailed study is performed for all important production modes
and basic background processes for the ""ttbb"" signature. At the upgraded
Tevatron a charged Higgs signal is potentially viable in the 220-250 GeV range
or excluded at 95%CL up to 300 GeV. At the LHC, a H+ of mass up to 800 GeV can
be discovered at 5 sigma or else be excluded up to a mass of ~ 1.5 TeV. The
presence ofSUSY quantum effects may highly influence the discovery potential in
both machines and can typically shift these limits by 200 GeV at the LHC.
","[{""version"":""v1"",""created"":""Sun, 6 May 2001 21:27:53 GMT""}]","2008-11-26"
