"hep-ph/0105196","Alberto Martin Gago Medina","A. M. Gago, M. M. Guzzo, H. Nunokawa, W. J. C. Teves and R. Zukanovich
  Funchal","Probing Flavor Changing Neutrino Interactions Using Neutrino Beams from
  a Muon Storage Ring","Revtex, 25 pages, 10 encapsulated postscript figures, some new
  references added, typos corrected","Phys.Rev.D64:073003,2001","10.1103/PhysRevD.64.073003","IFUSP-DFN/01-060","hep-ph",,"  We discuss the capabilities of a future neutrino factory based on intense
neutrino beams from a muon storage ring to explore the non-standard neutrino
matter interactions, which are assumed to be sub-leading effects in the
standard mass induced neutrino oscillations. The conjunction of these two
mechanisms will magnify fake CP violating effect in the presence of matter
which is not coming from the CP phase in the neutrino mixing matrix. We show
that such fake CP violation can be observed in neutrino factory experiments by
measuring the difference between the neutrino and anti-neutrino probabilities.
In order to perform such test, we consider three neutrino flavors, admitting
the mixing parameters in the range consistent with the oscillation solution to
the atmospheric and the solar neutrino problems, as well as with the
constraints imposed by the reactor neutrino data. We show that with a 10 kt
detector with 5 years of operation, a stored muon energy E_\mu \ge 20 GeV, 2
\times 10^{20} muon decays per year, and a baseline L \sim 732 km, such a
neutrino facility can probe the non-standard flavor changing neutrino
interactions down to the level of (10^{-3}-10^{-2})~G_F, in both \nu_\mu \to
\nu_\tau/ \bar \nu_\mu \to \bar \nu_\tau and \nu_e \to \nu_\tau/\bar \nu_e \to
\bar \nu_\tau modes.
","[{""version"":""v1"",""created"":""Fri, 18 May 2001 22:17:18 GMT""},{""version"":""v2"",""created"":""Sat, 19 May 2001 20:51:50 GMT""},{""version"":""v3"",""created"":""Tue, 5 Jun 2001 19:19:47 GMT""}]","2014-11-17"
"hep-ph/0105197","Xiangdong Ji","Jiunn-Wei Chen and Xiangdong Ji","Is the Sullivan Process Compatible with QCD Chiral Dynamics?","2 pages, two figures included","Phys.Lett.B523:107-110,2001","10.1016/S0370-2693(01)01337-5",,"hep-ph hep-lat nucl-th",,"  We calculate the leading non-analytic quark-mass dependence in the moments of
isovector quark distributions using heavy-baryon chiral perturbation theory.
The results differ from those obtained from the Sullivan process in which hard
scattering occurs through the virtual pion cloud of the nucleon. Our results
provide useful guidance for improving upon the meson-cloud model and can be
used to constrain the extrapolations of the existing lattice QCD results to the
physical quark masses.
","[{""version"":""v1"",""created"":""Sat, 19 May 2001 04:12:44 GMT""},{""version"":""v2"",""created"":""Fri, 6 Jul 2001 20:06:22 GMT""}]","2008-11-26"
"hep-ph/0105198","Seungho Choe","O. Miyamura and S. Choe","$dm/d\mu$ in the Nambu--Jona-Lasinio model","8 pages, 11 eps figures, aipproc.sty; Poster presented at Quark
  Matter 2001, and contribution to ""International Symposium on Hadrons and
  Nuclei, Seoul, Feb. 20-22, 2001",,"10.1063/1.1425510",,"hep-ph nucl-th",,"  Using the Nambu--Jona-Lasinio (NJL) model we study responses of the pion and
kaon masses to changes in the chemical potential, $dm/d\mu$, at zero and finite
chemical potential. We find that the behavior of $dm/d\mu$ for the pion is
quite different from that for the kaon. Our results can give a clue for future
studies of $dm/d\mu$ on the lattice.
","[{""version"":""v1"",""created"":""Sat, 19 May 2001 09:36:51 GMT""}]","2009-11-07"
"hep-ph/0105199","Alessia Tricomi","Alessia Tricomi","Discovery potential of charged Higgs at LHC in H+- ->tau nu decays","Talk given to the XXXVI Rencontres de Moriond, QCD and High Energy
  Hadronic Interactions, 17-24 March 2001, Les Arcs, Savoie, France",,,,"hep-ph",,"  The discovery potential of charged Higgs from pp->tH+- in the H+- -> tau nu
decay channel is investigated in CMS and ATLAS. For m_H>m_t, the most relevant
channels are H+- -> tb and H+- -> tau nu. Whereas the former has the largest
branching ratio it suffers of large irreducible backgrounds, while the latter
offers a very clean enviroment when appropriate cuts are used. Making use of
the tau polarization effects, in the purely hadronic final states an almost
background-free signal is selected. The expected discovery range is evaluated
for CMS and ATLAS with 30 fb^-1 each in the low luminosity running conditions
and the combined results are presented.
","[{""version"":""v1"",""created"":""Sat, 19 May 2001 10:51:39 GMT""}]","2007-05-23"
"hep-ph/0105200","Enrico Lunghi","A. Ali and E. Lunghi","Extended Minimal Flavour Violating MSSM and Implications for B Physics","35 pages, 12 figures. Theoretical analysis modified in view of the
  recent CP violation observed in B-> J/Psi K decays. Resulting constraints on
  the model parameters are recomputed","Eur.Phys.J.C21:683-700,2001","10.1007/s100520100767","DESY 01-059","hep-ph",,"  The recently reported measurements of the CP asymmetry a(psi K) by the BABAR
and BELLE collaborations are in good agreement with the standard model (SM)
prediction, resulting from the unitarity of the CKM matrix. The so-called
minimal flavour violating (MFV) supersymmetric extensions of the standard
model, in which the CKM matrix remains the only flavour changing structure,
predict a(psi K) similar to the one in the SM. With the anticipated precision
in a(psi K) and other CP asymmetries at the B factories and hadron colliders,
one hopes to pin down any possible deviation from the SM. We discuss an
extension of the MFV-supersymmetric models which comfortably accommodates the
current measurements of the CP asymmetry a(psi K), but differs from the SM and
the MFV-supersymmetric models due to an additional flavour changing structure
beyond the CKM matrix. We suggest specific tests in forthcoming experiments in
B physics. In addition to the CP-asymmetries in B-meson decays, such as a(psi
K) and a(pi pi), and the mass difference Delta M_s in the Bs-bar(Bs) system, we
emphasize measurements of the radiative transition b -> d gamma as sensitive
probes of the postulated flavour changing structure. Interestingly, the
CKM-unitarity analysis in the Extended-MFV model also allows solutions rho < 0,
as opposed to the SM and the MFV models for which only rho > 0 solutions are
now admissible, implying gamma > pi/2, where gamma=- arg (Vub). Such large
values of gamma are hinted by the current measurements of the branching ratios
for the decays B -> pi pi and B -> K pi.
","[{""version"":""v1"",""created"":""Sat, 19 May 2001 15:41:28 GMT""},{""version"":""v2"",""created"":""Wed, 4 Jul 2001 10:39:24 GMT""},{""version"":""v3"",""created"":""Fri, 3 Aug 2001 17:24:06 GMT""}]","2010-05-28"
"hep-th/0105182","Miguel A. Vazquez-Mozo","A. Feinstein, K.E. Kunze and M.A. Vazquez-Mozo","Curved dilatonic brane worlds","v2: 10 pages, RevTeX4. Minor changes. Typos corrected and references
  added. New paragraph included in the conclusions discussing the role of the
  singularities in the self-tuning mechanism. Final version to appear in
  Physical Review D","Phys.Rev. D64 (2001) 084015","10.1103/PhysRevD.64.084015","EHU-FT/0103","hep-th astro-ph gr-qc",,"  We construct a broad family of exact solutions to the five-dimensional
Einstein equations coupled to a scalar field with an exponential potential.
Embedding a three-brane in these bulk space-times in a particular way we obtain
a class of self-tuned curved brane worlds in which the vacuum energy on the
brane is gravitationally idle, the four-dimensional geometry being insensitive
to the value of the brane tension. This self-tuning arises from cancellations,
enforced by the junction conditions, between the scalar field potential, the
brane vacuum energy and the matter on the brane. Finally, we study some
physically relevant examples and their dynamics.
","[{""version"":""v1"",""created"":""Fri, 18 May 2001 16:54:07 GMT""},{""version"":""v2"",""created"":""Mon, 3 Sep 2001 13:31:09 GMT""}]","2009-11-07"
"hep-th/0105183","Oscar J. C. Dias","Oscar J. C. Dias, Jose' P. S. Lemos","Static and rotating electrically charged black holes in
  three-dimensional Brans-Dicke gravity theories","Latex, 32 pages, 6 Figures","Phys.Rev. D64 (2001) 064001","10.1103/PhysRevD.64.064001","DF/IST-5.2001","hep-th gr-qc",,"  We obtain static and rotating electrically charged black holes of a
Einstein-Maxwell-Dilaton theory of the Brans-Dicke type in (2+1)-dimensions.
The theory is specified by three fields, the dilaton, the graviton and the
electromagnetic field, and two parameters, the cosmological constant and the
Brans-Dicke parameter. It contains eight different cases, of which one
distinguishes as special cases, string theory, general relativity and a theory
equivalent to four dimensional general relativity with one Killing vector. We
find the ADM mass, angular momentum, electric charge and dilaton charge and
compute the Hawking temperature of the solutions. Causal structure and geodesic
motion of null and timelike particles in the black hole geometries are studied
in detail.
","[{""version"":""v1"",""created"":""Fri, 18 May 2001 18:40:25 GMT""}]","2009-11-07"
"hep-th/0105184","Justin David","Justin R. David","Excitations on wedge states and on the sliver","31 pages, 1 figure, refrences added, corrected some typos","JHEP 0107 (2001) 024","10.1088/1126-6708/2001/07/024",,"hep-th",,"  We study ghost number one excitations on the sliver to investigate the
solution of string field actions around the tachyon vacuum. The generalized
gluing and resmoothing theorem is used to develop a method for evaluating the
effective action for excitations on both the wedge states and the sliver state.
We analyze the discrete symmetries of the resulting effective action for
excitations on the sliver. The gauge unfixed effective action till level two
excitations on the sliver is evaluated. This is done for the case with the BRST
operator $c_0$ and $c_0 + (c_2 + c_{-2})/2$ with excitations purely in the
ghost sector. We find that the values of the effective potential at the local
maximum lie close by for the zeroth and the second level of approximation. This
indicates that level truncation in string field theory around the tachyon
vacuum using excitations on the sliver converges for both choices of the BRST
operator. It also provides evidence for the conjectured string field theory
actions around the tachyon vacuum.
","[{""version"":""v1"",""created"":""Fri, 18 May 2001 20:38:42 GMT""},{""version"":""v2"",""created"":""Sun, 5 Aug 2001 15:40:55 GMT""}]","2009-11-07"
"hep-th/0105185","Lori D. Paniak","L.D. Paniak","Exact Noncommutative KP and KdV Multi-solitons","18 pages LaTeX. Reference added",,,"PUPT-1982","hep-th",,"  We derive the Kadomtsev-Petviashvili (KP) equation defined over a general
associative algebra and construct its N-soliton solution. For the example of
the Moyal algebra, we find multi-soliton solutions for arbitrary space-space
noncommutativity. The noncommutativity of coordinates is shown to obstruct the
general construction of a tau function for these solitons. We investigate the
two-soliton solution in detail and show that asymptotic observers of soliton
scattering are unable to detect a finite spatial noncommutativity. An explicit
example shows that a pair of solitons in a noncommutative background can be
interpreted as several pairs of image solitons. Finally, a dimensional
reduction gives the general N-soliton solution for the previously discussed
noncommutative KdV equation.
","[{""version"":""v1"",""created"":""Fri, 18 May 2001 23:10:23 GMT""},{""version"":""v2"",""created"":""Fri, 1 Jun 2001 17:50:30 GMT""}]","2007-05-23"
"hep-th/0105186","Masato Ito","Masato Ito (Nagoya Univ.)","Warped Geometry in Higher Dimensions with an Orbifold Extra Dimension","20 pages, no figure, final version in PRD 15 Dec 2001","Phys.Rev. D64 (2001) 124021","10.1103/PhysRevD.64.124021","DPNU-01-08","hep-th",,"  We solve the Einstein equations in higher dimensions with warped geometry
where an extra dimension is assumed to have orbifold symmetry $S^{1}/Z_{2}$.
The setup considered here is an extension of the five-dimensional
Randall-Sundrum model to $5+D$ dimensions, and hidden and observable branes are
fixed on the orbifold. It is assumed that the brane tension (self-energy) of
each brane with $(4+D)$-dimensional spacetime is anisotropic and that the
warped metric function of the four dimensions is generally different from that
of the extra $D$ dimensions. We point out that the forms of the warped metric
functions and the relations between the tensions of two branes depend on the
integration constant appearing in the Einstein equations as well as on the sign
of the bulk cosmological constant.
","[{""version"":""v1"",""created"":""Sat, 19 May 2001 01:03:03 GMT""},{""version"":""v2"",""created"":""Fri, 25 May 2001 22:19:57 GMT""},{""version"":""v3"",""created"":""Sun, 22 Jul 2001 23:50:43 GMT""},{""version"":""v4"",""created"":""Fri, 14 Sep 2001 01:09:20 GMT""},{""version"":""v5"",""created"":""Wed, 24 Oct 2001 04:48:25 GMT""}]","2009-11-07"
"hep-th/0105188","El Mostapha Sahraoui","El Mostapha Sahraoui and El Hassan Saidi","D-branes on Noncommutative Orbifolds","16 pages, latex","JHEP 0205 (2002) 063",,,"hep-th",,"  We study tachyon condensation on noncommutative toric orbifolds with a $Z_2$
discrete group and explore the various kins of brane bound states arising in
the case of irrational values of the B-field. We show that $Z_$ symmetry of the
orbifolds incorporates naturally anti-branes in the spectrum and leads to
equivalent results as those obtained by starting from an original pair of
D-barD system on quantum torii. A specific analysis is deserved to the
irrational representation of NC orbifolds and to the unstable bound states
generated by the condensation.
","[{""version"":""v1"",""created"":""Sat, 19 May 2001 12:20:52 GMT""}]","2007-05-23"
"hep-th/0105189","Jjlee","Jungjai Lee and Yeong Deok Han","Composite Operators and Topological Contributions in Gauge Theory","8 pages, Latex file","Mod.Phys.Lett. A16 (2001) 679-684","10.1142/S0217732301003899",,"hep-th",,"  In $D$-dimensional gauge theory with a kinetic term based on the p-form
tensor gauge field, we introduce a gauge invariant operator associated with the
composite formed from a electric $(p-1)$-brane and a magnetic $(q-1)$-brane in
$D=p+q+1$ spacetime dimensions. By evaluating the partition function for this
operator, we show that the expectation value of this operator gives rise to the
topological contributions identical to those in gauge theory with a topological
Chern-Simons BF term.
","[{""version"":""v1"",""created"":""Sat, 19 May 2001 09:38:31 GMT""}]","2009-11-07"
"math-ph/0105025","Vladimir G. Danilov","V.G.Danilov","Weak asymptotics method","15 pages, 2 figures",,,,"math-ph math.MP",,"  We present a new method for constructing solutions to nonlinear evolutionary
equations describing the propagation and interaction of nonlinear waves.
","[{""version"":""v1"",""created"":""Sat, 19 May 2001 11:49:13 GMT""}]","2007-05-23"
"math-ph/0105026","Vladimir G. Danilov","K.A. Volosov, V. G. Danilov, and A. M. Loginov (Moscow)","Exact self-similar and two-phase solutions of systems of semilinear
  parabolic equations","13 pages","Teoreticheskaya i Matematicheskaya Fizika, Vol. 101, No. 2, (in
  Russian)",,,"math-ph math.MP",,"  Exact single-wave and two-wave solutions of systems of equations of
Newell-Whitehead type are presented. The Painleve test and calculations in the
spirit of Hirota are used to construct these solutions.
","[{""version"":""v1"",""created"":""Sat, 19 May 2001 11:57:54 GMT""}]","2007-05-23"
"math/0105159","Michael T. Lacey","Michael Lacey","Carleson's theorem with quadratic phase",,"Studia Math. 153 (2002), no. 3, 249--267",,,"math.CA",,"  Carleson's theorem on the pointwise convergence of Fourier series provides
bounds for a maximal operator, with the maximum taken over all choices of
linear functions of a phase argument. We extend this to all quadratic choices
of phase functions. Specifically, we show that the maximal operator below maps
$L^p$ into itself for $1<p<\infty$. $$ \sup_a \sup_b |\int
e^{i(ay^2+by)}f(x-y)dy/y| $$
","[{""version"":""v1"",""created"":""Fri, 18 May 2001 17:50:22 GMT""}]","2007-05-23"
"math/0105160","Hao Fang","Hao Fang","Equivariant spectral flow and a Lefschetz theorem on odd dimensional
  spin manifolds","13 pages",,,,"math.DG math.FA math.SP",,"  A notion of equivariant spectral flows for families of self-dual elliptic
operators on Riemannian manifolds is purposed. As a consequence, a local
version of a Lefschetz fix point theorem is proved for Toeplitz operators on
odd-dimensional spin manifolds.
","[{""version"":""v1"",""created"":""Fri, 18 May 2001 23:40:09 GMT""}]","2007-05-23"
"math/0105161","Scott Morrison","Scott Morrison","An Introduction to Pull-backs of Bundles and Homotopy Invariance","5 pages; an introductory note; unpublished",,,,"math.DG",,"  We define the pull-back of a smooth principal fibre bundle, and show that it
has a natural principal fibre bundle structure. Next, we analyse the
relationship between pull-backs by homotopy equivalent maps. The main result of
this article is to show that for a principal fibre bundle over a paracompact
manifold, there is a principal fibre bundle isomorphism between pull-backs
obtained from homotopic maps. This enables simple proofs of several results on
the structure of principal fibre bundles. No new results are obtained---this is
simply an accessible presentation of an important idea.
","[{""version"":""v1"",""created"":""Sat, 19 May 2001 10:55:03 GMT""}]","2007-05-23"
"math/0105162","Ping Xu","Luen-Chau Li and Ping Xu","Integrable spin Calogero-Moser systems","30 pages, Latex file","Commun.Math.Phys. 231 (2002) 257-286","10.1007/s00220-002-0724-1",,"math.QA hep-th math.SG nlin.SI",,"  We introduce spin Calogero-Moser systems associated with root systems of
simple Lie algebras and give the associated Lax representations (with spectral
parameter) and fundamental Poisson bracket relations. The associated integrable
models (called integrable spin Calogero-Moser systems in the paper) and their
Lax pairs are then obtained via Poisson reduction and gauge transformations.
For Lie algebras of $A_{n}$-type, this new class of integrable systems includes
the usual Calogero-Moser systems as subsystems. Our method is guided by a
general framework which we develop here using dynamical Lie algebroids.
","[{""version"":""v1"",""created"":""Sat, 19 May 2001 14:13:49 GMT""}]","2009-11-07"
"nlin/0105044","Michelle Girvan","Michelle Girvan, Duncan S. Callaway, M. E. J. Newman, and Steven H.
  Strogatz","A Simple Model of Epidemics with Pathogen Mutation","9 pages, 11 figures",,"10.1103/PhysRevE.65.031915",,"nlin.CD q-bio",,"  We study how the interplay between the memory immune response and pathogen
mutation affects epidemic dynamics in two related models. The first explicitly
models pathogen mutation and individual memory immune responses, with contacted
individuals becoming infected only if they are exposed to strains that are
significantly different from other strains in their memory repertoire. The
second model is a reduction of the first to a system of difference equations.
In this case, individuals spend a fixed amount of time in a generalized immune
class. In both models, we observe four fundamentally different types of
behavior, depending on parameters: (1) pathogen extinction due to lack of
contact between individuals, (2) endemic infection (3) periodic epidemic
outbreaks, and (4) one or more outbreaks followed by extinction of the epidemic
due to extremely low minima in the oscillations. We analyze both models to
determine the location of each transition. Our main result is that pathogens in
highly connected populations must mutate rapidly in order to remain viable.
","[{""version"":""v1"",""created"":""Fri, 18 May 2001 17:10:30 GMT""}]","2009-11-07"
"nucl-ex/0105012","Julia Velkovska","J.Velkovska (PHENIX Collaboration)","Pt Distributions of Identified Charged Hadrons Measured with the PHENIX
  Experiment at RHIC","4 pages, 4 figures, Contribution to Quark Matter 2001, Long Island,
  New York, January 15-20, 2001","Nucl.Phys.A698:507-510,2002","10.1016/S0375-9474(01)01415-4",,"nucl-ex",,"  Transverse momentum spectra of identified $\pi^{+}$, $\pi^{-}$, $K^{+}$,
$K^{-}$, p and $\overline{p}$ were measured by the PHENIX experiment at
mid-rapidity in Au-Au collisions at $\sqrt{s_{NN}}=130$ GeV over a broad
momentum range. Inverse slope parameters and mean $p_{t}$ were measured in
minimum bias events and as a function of the number of participating nucleons.
The mass and centrality dependence of the inverse slope parameters and mean
$p_{t}$ is presented and discussed.
","[{""version"":""v1"",""created"":""Fri, 18 May 2001 17:57:06 GMT""}]","2010-05-28"
"nucl-ex/0105013","Peter Steinberg","Peter Steinberg","Global Observables at RHIC","9 Pages, 12 Figures, for QM2001, Stony Brook","Nucl.Phys.A698:314-322,2002","10.1016/S0375-9474(01)01378-1",,"nucl-ex",,"  The first three measurements from the RHIC program were results on global
observables: charged particle multiplicity (N_ch), transverse energy (E_T) and
elliptic flow (v_2). They offer a look at the large-scale features of particle
production in high-energy nuclear collisions, with particular insight into
entropy production and collective behavior. Results from all of the RHIC
experiments are discussed in light of data from lower energy nuclear collisions
as well as from high-energy hadronic collisions to test our current
understanding of the collision dynamics.
","[{""version"":""v1"",""created"":""Fri, 18 May 2001 21:29:01 GMT""}]","2014-11-18"
"nucl-th/0105044","Ziwei Lin","Zi-wei Lin, Subrata Pal, C.M. Ko, Bao-An Li and Bin Zhang","Multiphase transport model for heavy ion collisions at RHIC","4 pages, 4 figures, espcrc1.sty included, presented at 15th
  International Conference on Ultra-Relativistic Nucleus-Nucleus Collisions
  (QM2001), Long Island, New York, January 2001","Nucl.Phys. A698 (2002) 375-378","10.1016/S0375-9474(01)01383-5",,"nucl-th",,"  Using a multiphase transport model (AMPT) with both partonic and hadronic
interactions, we study the multiplicity and transverse momentum distributions
of charged particles such as pions, kaons and protons in central Au+Au
collisions at RHIC energies. Effects due to nuclear shadowing and jet quenching
on these observables are also studied. We further show preliminary results on
the production of multistrange baryons from the strangeness-exchange reactions
during the hadronic stage of heavy ion collisions.
","[{""version"":""v1"",""created"":""Fri, 18 May 2001 20:09:14 GMT""}]","2009-11-07"
"nucl-th/0105045","Martin J. Savage","Daniel Arndt and Martin J. Savage","Chiral Corrections to Matrix Elements of Twist-2 Operators","12 pages, 3 eps figures, latex","Nucl.Phys.A697:429-439,2002","10.1016/S0375-9474(01)01223-4","NT@UW-01-013","nucl-th hep-lat hep-ph",,"  We compute the leading non-analytic contributions of the form m_q Log(m_q) to
matrix elements of twist-2 operators in the nucleon and pion using effective
field theory. Previously omitted one-loop contributions that are related to
tree-level matrix elements by chiral symmetry are included.
","[{""version"":""v1"",""created"":""Fri, 18 May 2001 22:48:52 GMT""},{""version"":""v2"",""created"":""Mon, 21 May 2001 20:11:29 GMT""}]","2014-11-18"
"nucl-th/0105046","Azwinndini Muronga","Azwinndini Muronga","Dissipative Relativistic Fluid Dynamics for Nuclear Collisions","10 pages, 4 figures, Proceedings of the 17th Winter Workshop on
  Nuclear Dynamics, Park City, Utah, March 10-17, 2001","HeavyIonPhys.15:337-347,2002","10.1556/APH.15.2002.3-4.16",,"nucl-th",,"  In the context of the M\""uller-Israel-Stewart second-order theory for
dissipative fluids due to Grad, we analyze the effects of thermal conduction
and viscosity in heavy ion collisions. We contrast the results to those of the
first-order theory due to Eckart and to Landau and Lifshitz and to those of
perfect (ideal) fluid due to Euler. We study the energy density and entropy
density evolution of a pion gas produced in the heavy ion collisions. The
truncated version of the second-order theory is used to find the dissipative
quantities.
","[{""version"":""v1"",""created"":""Sat, 19 May 2001 01:40:16 GMT""}]","2008-11-26"
"physics/0105061","Florin Despa","F. Despa and R.S. Berry","Relaxation dynamics in the presence of unequally spaced attractors along
  the reaction coordinate","8 pages, 1 fig.; Eur. Phys. J. D - to appear",,"10.1007/s100530170059",,"physics.chem-ph physics.atm-clus",,"  We show how reaction coordinate path lengths affect the relaxation efficiency
of a complex system. To this purpose, we consider the metric contributions to
the transition rates. These metric contributions preserve informations about
the geometry change of the system at the barrier crossing and, therefore, are
directly related to the path lengths. The output of the present work can lead
to identify a way to enrich our knowledge about the ability of the complex
systems to relax only to preferential structures.
","[{""version"":""v1"",""created"":""Fri, 18 May 2001 22:18:31 GMT""}]","2009-11-07"
