"physics/0105062","Florin Despa","Silvia Stan and Florin Despa","On the Doublet Formation in the Flocculation Process of the Yeast Cells","11 pages, 2 figures","BioSystems 57 (2000) 139-145",,,"physics.bio-ph physics.chem-ph q-bio",,"  The combination of single cells to form doublets is regarded as the
rate-limiting step of flocculation and requires the presence of surface
proteins in active form. The process of activation of the flocculation proteins
of yeast cells is described in the frame of the autocrine interaction regime
(Cantrell, D. A. and Smith, K. A., 1984, Science 224, 1312-1316). The influence
of several effectors (the cell efficiency to use sugars, the calcium content in
the external medium and the probability that free cells collide each other
under thermal motion conditions) on the initial rate of flocculation and on the
fraction of remaining free cells in the steady state is briefly discussed in
the paper. The present model offers an useful tool for further quantitative
investigations in this topic. Also, it indicates qualitatively a way in which
the regulation of flocculation might be controlled at the level of the
expression of cell-surface activation abilities.
  Keywords: flocculation; yeast; autocrine binding; lectin hypothesis
","[{""version"":""v1"",""created"":""Fri, 18 May 2001 22:45:25 GMT""}]","2007-05-23"
"physics/0105063","Fabrice Philippe","Fabrice Philippe and Jacques Arnaud","Photon number variance in isolated cavities","4 pages, to be submitted to Journal of Physics A",,,,"physics.optics cond-mat.stat-mech quant-ph",,"  We consider a strictly isolated single-mode optical cavity resonating at
angular frequency omega containing atoms whose one-electron level energies are
supposed to be: hbar*omega, 2*hbar*omega,...B*hbar\omega, and m photons. If
initially the atoms are in their highest energy state and m=0, we find that at
equilibrium: variance(m)/mean(m)=(B+1)/6, indicating that the internal field
statistics is sub-Poissonian if the number of atomic levels B does not exceed
4. Remarkably, this result does not depend on the number of atoms, nor on the
number of electrons that each atom incorporates. Our result has application to
the statistics of the light emitted by pulsed lasers and nuclear magnetic
resonance. On the mathematical side, the result is based on the restricted
partitions of integers.
","[{""version"":""v1"",""created"":""Sat, 19 May 2001 13:30:22 GMT""}]","2007-05-23"
"quant-ph/0105090","Frank Verstraet","Frank Verstraete, Jeroen Dehaene and Bart De Moor","Normal forms and entanglement measures for multipartite quantum states","Proof of uniqueness of normal form added","Phys. Rev. A 68, 012103 (2003)","10.1103/PhysRevA.68.012103",,"quant-ph",,"  A general mathematical framework is presented to describe local equivalence
classes of multipartite quantum states under the action of local unitary and
local filtering operations. This yields multipartite generalizations of the
singular value decomposition. The analysis naturally leads to the introduction
of entanglement measures quantifying the multipartite entanglement (as
generalizations of the concurrence and the 3-tangle), and the optimal local
filtering operations maximizing these entanglement monotones are obtained.
Moreover a natural extension of the definition of GHZ-states to e.g. $2\times
2\times N$ systems is obtained.
","[{""version"":""v1"",""created"":""Fri, 18 May 2001 18:13:59 GMT""},{""version"":""v2"",""created"":""Mon, 21 May 2001 20:48:50 GMT""},{""version"":""v3"",""created"":""Mon, 6 Aug 2001 13:31:17 GMT""},{""version"":""v4"",""created"":""Wed, 22 Jan 2003 15:23:24 GMT""},{""version"":""v5"",""created"":""Fri, 30 May 2003 12:22:50 GMT""}]","2009-11-07"
"quant-ph/0105091","Oscar Rosas-Ortiz","O. Rosas-Ortiz, J. Negro and L.M. Nieto","Physical sectors of the confluent hypergeometric functions space","LaTeX, 9 pages, no figures, macros included","Rev. Mex. Fis. 49 S1 (2003) 88-89",,,"quant-ph",,"  A relaxed factorization is used to obtain many of the properties obeyed by
the confluent hypergeometric functions. Their implications on the analytical
solutions of some interesting physical problems are also studied. It is quite
remarkable that, although these properties appear frequently in solving the
Schroedinger equation, it has been not clear the role they play in describing
the physical systems. The main objective of this communication is precisely to
throw some light on the subject.
","[{""version"":""v1"",""created"":""Fri, 18 May 2001 18:59:47 GMT""}]","2007-05-23"
"quant-ph/0105092","Zhou Ling","L. Zhou, H. S. Song, Y. X. Luo","Role of degenerate atomic levels in the entanglement and the decoherence","8 pages,3 figures",,,"ZSL-05-19","quant-ph",,"  We studied the dispersive dissipation of denegerate-level atom interacting
with a single linearly-polarized mode field. It is found that the degeneracy of
the atomic level affects the dissipation bahavior of the system as well as the
subsystems. The degeneracy of the atomic level augment the periods of
entanglement and increase the degree of the maxima statistical mixture states.
","[{""version"":""v1"",""created"":""Sat, 19 May 2001 13:23:51 GMT""}]","2007-05-23"
