"cond-mat/0105378","Luis","L.Velazquez (Universidad de Pinar del Rio), F.Guzman (Instituto
  Superior de Ciencias y Tecnologias Nucleares)","Where the Tsallis Statistic is valid?","9 pages, RevTeX",,,"PDP-01-05-3","cond-mat",,"  In the present paper are analysed the conditions for the validity of the
Tsallis Statistics. The same have been done following the analogy with the
traditional case: starting from the microcanonical description of the systems
and analysing the scaling properties of the fundamental macroscopic observables
in the Thermodynamic Limit. It is shown that the Generalized Legendre Formalism
in the Tsallis Statistic only could be applied for one special class of the
bordering systems, those with non exponential growth of the accessible states
density in the thermodynamic limit and zero-order divergency behavior for the
fundamental macroscopic observables, systems located in the chaos threshold.
","[{""version"":""v1"",""created"":""Sat, 19 May 2001 15:26:19 GMT""},{""version"":""v2"",""created"":""Wed, 23 May 2001 17:30:51 GMT""}]","2007-05-23"
"cond-mat/0105380","Yannick Meurice","Y. Meurice and S. Niermann","From nonlinear scaling fields to critical amplitudes","38 pages, 14 figures, uses revtex, modified presentation for a
  generic spin model, calculation of subleading amplitude added","J.Statist.Phys. 108 (2002) 213-246",,,"cond-mat.stat-mech hep-th math-ph math.MP",,"  We propose to combine the nonlinear scaling fields associated with the
high-temperature (HT) fixed point, with those associated with the unstable
fixed point, in order to calculate the susceptibility and other thermodynamic
quantities. The general strategy relies on simple linear relations between the
HT scaling fields and the thermodynamic quantities, and the estimation of RG
invariants formed out of the two sets of scaling fields. This estimation
requires convergent expansions in overlapping domains. If, in addition, the
initial values of the scaling fields associated with the unstable fixed point
can be calculated from the temperature and the parameters appearing in the
microscopic Hamiltonian, one can estimate the critical amplitudes. This
strategy has been developed using Dyson's hierarchical model where all the
steps can be approximately implemented with good accuracy. We show numerically
that for this model (and a simplified version of it), the required overlap
apparently occurs, allowing an accurate determination of the critical
amplitudes.
","[{""version"":""v1"",""created"":""Sat, 19 May 2001 05:14:44 GMT""},{""version"":""v2"",""created"":""Wed, 30 May 2001 21:02:45 GMT""},{""version"":""v3"",""created"":""Fri, 8 Feb 2002 16:34:14 GMT""}]","2007-05-23"
"cond-mat/0105381","Abraham Nitzan","Michael Galperin and Abraham Nitzan","Inelastic effects in electron tunneling through water layers","30 pages, 8 figures. This paper is in press in the Journal of
  Chemical Physics",,"10.1063/1.1383991",,"cond-mat",,"  Calculations of tunneling matrix elements associated with electron transfer
through molecular environments are usually done for given frozen nuclear
configurations, assuming that nuclear motions are slow relative to the
timescale of a tunneling event. The motivation for this study is a recent
calculation [Peskin et al, J. Chem. Phys. 111, 7558 (1999)] that indicates that
electron tunneling through water may be enhanced by tunneling resonances in the
range of ~1eV below the vacuum barrier and finds that the lifetimes of such
resonances are in the 10fs range, same order as OH stretch periods. Our
calculation is based on the absorbing-boundary-conditions-Green's-function
(ABCGF) method. First we consider the effect of a single symmetric OH-stretch
mode on electron tunneling in an otherwise frozen water environment and
establish that the inelastic tunneling probability is small enough to justify
an approach based on perturbation theory limited to single phonon transitions.
Next we note that on the short timescale of a tunneling event, even under
resonance conditions, water nuclear dynamics may be represented in the
instantaneous normal modes picture. We generalize the ABCGF method to take into
account low order inelastic scattering from a continuum of such harmonic normal
modes. We find that near resonance the total inelastic transmission probability
is of the same order as the elastic one, and may lead to an additional ~20-40%
enhancement of the overall transmission in the range of up to 1eV below the
vacuum barrier. The absolute energy exchange is small, of the order of 1% of
the incident electron energy. The main contribution to the inelastic
transmission is associated with energy transfer into the rotational-librational
range of the water instantaneous normal mode spectrum.
","[{""version"":""v1"",""created"":""Sat, 19 May 2001 06:30:38 GMT""}]","2009-11-07"
"cs/0105028","Naren Ramakrishnan","Naren Ramakrishnan, Benjamin J. Keller, Batul J. Mirza, Ananth Y.
  Grama, and George Karypis","When being Weak is Brave: Privacy in Recommender Systems",,,,,"cs.CR cs.DS",,"  We explore the conflict between personalization and privacy that arises from
the existence of weak ties. A weak tie is an unexpected connection that
provides serendipitous recommendations. However, information about weak ties
could be used in conjunction with other sources of data to uncover identities
and reveal other personal information. In this article, we use a
graph-theoretic model to study the benefit and risk from weak ties.
","[{""version"":""v1"",""created"":""Fri, 18 May 2001 18:47:10 GMT""}]","2007-05-23"
"gr-qc/0105067","Martin Bojowald","Martin Bojowald","The Inverse Scale Factor in Isotropic Quantum Geometry","17 pages, 4 figures","Phys.Rev. D64 (2001) 084018","10.1103/PhysRevD.64.084018","CGPG-01/5-1","gr-qc hep-th",,"  The inverse scale factor, which in classical cosmological models diverges at
the singularity, is quantized in isotropic models of loop quantum cosmology by
using techniques which have been developed in quantum geometry for a
quantization of general relativity. This procedure results in a bounded
operator which is diagonalizable simultaneously with the volume operator and
whose eigenvalues are determined explicitly. For large scale factors (in fact,
up to a scale factor slightly above the Planck length) the eigenvalues are
close to the classical expectation, whereas below the Planck length there are
large deviations leading to a non-diverging behavior of the inverse scale
factor even though the scale factor has vanishing eigenvalues. This is a first
indication that the classical singularity is better behaved in loop quantum
cosmology.
","[{""version"":""v1"",""created"":""Fri, 18 May 2001 17:47:16 GMT""}]","2009-11-07"
"gr-qc/0105068","Jose Geraldo Pereira","R. Aldrovandi, A. L. Barbosa, M. Calcada, J. G. Pereira","Kinematics of a Spacetime with an Infinite Cosmological Constant","RevTex, 7 pages, no figures. Presentation changes, including a new
  Title. Version to appear in Found. Phys. Lett","Found.Phys. 33 (2003) 613-624",,,"gr-qc hep-th",,"  A solution of the sourceless Einstein's equation with an infinite value for
the cosmological constant \Lambda is discussed by using Inonu-Wigner
contractions of the de Sitter groups and spaces. When \Lambda --> infinity,
spacetime becomes a four-dimensional cone, dual to Minkowski space by a
spacetime inversion. This inversion relates the four-cone vertex to the
infinity of Minkowski space, and the four-cone infinity to the Minkowski
light-cone. The non-relativistic limit c --> infinity is further considered,
the kinematical group in this case being a modified Galilei group in which the
space and time translations are replaced by the non-relativistic limits of the
corresponding proper conformal transformations. This group presents the same
abstract Lie algebra as the Galilei group and can be named the conformal
Galilei group. The results may be of interest to the early Universe Cosmology.
","[{""version"":""v1"",""created"":""Fri, 18 May 2001 17:53:57 GMT""},{""version"":""v2"",""created"":""Mon, 2 Dec 2002 17:53:06 GMT""}]","2007-05-23"
"gr-qc/0105069","Brett D. Altschul","B. Altschul, R. Jackiw","Photon Decay at the Schwarzschild Horizon","11 pages, no figures","Phys.Lett. B515 (2001) 451-457","10.1016/S0370-2693(01)00848-6","MIT-CTP-3140","gr-qc hep-th",,"  A recent proposal that gravity theory is an emergent phenomenon also entails
the possibility of photon decay near the Schwarzschild event horizon. We
present a possible mechanism for such decay, which utilizes a dimensional
reduction near the horizon.
","[{""version"":""v1"",""created"":""Fri, 18 May 2001 19:04:23 GMT""},{""version"":""v2"",""created"":""Mon, 21 May 2001 17:36:41 GMT""}]","2009-11-07"
"gr-qc/0105070","Margarita Safonova","Margarita Safonova (University of Delhi, India), Diego F. Torres and
  Gustavo E. Romero (Instituto Argentino de Radioastronom\'ia, Buenos Aires,
  Argentina)","Microlensing by natural wormholes: theory and simulations","16 pages, 24 postscript figures (3 coloured), revtex style, submitted
  to Phys. Rev. D","Phys.Rev. D65 (2002) 023001","10.1103/PhysRevD.65.023001",,"gr-qc astro-ph hep-th",,"  We provide an in depth study of the theoretical peculiarities that arise in
effective negative mass lensing, both for the case of a point mass lens and
source, and for extended source situations. We describe novel observational
signatures arising in the case of a source lensed by a negative mass. We show
that a negative mass lens produces total or partial eclipse of the source in
the umbra region and also show that the usual Shapiro time delay is replaced
with an equivalent time gain. We describe these features both theoretically, as
well as through numerical simulations. We provide negative mass microlensing
simulations for various intensity profiles and discuss the differences between
them. The light curves for microlensing events are presented and contrasted
with those due to lensing produced by normal matter. Presence or absence of
these features in the observed microlensing events can shed light on the
existence of natural wormholes in the Universe.
","[{""version"":""v1"",""created"":""Fri, 18 May 2001 20:40:33 GMT""}]","2016-08-16"
"gr-qc/0105071","Robert D. Klauber","Robert D. Klauber","Physical Components, Coordinate Components, and the Speed of Light","10 pages including 4 figures, references",,,,"gr-qc",,"  For generalized coordinate systems, the numerical values of vector and tensor
components do not generally equal the physical values, i.e., the values one
would measure with standard physical instruments. Hence, calculating physical
components from coordinate components is important for comparing experiment
with theory. Surprisingly, however, this calculational method is not widely
known among physicists, and is rarely taught in relativity courses, though it
is commonly employed in at least one other field (applied mechanics.) Different
derivations of this method, ranging from elementary to advanced level, are
presented. The result is then applied to clarify the oftentimes confusing issue
of whether or not the speed of light in non-inertial frames is equal to c.
","[{""version"":""v1"",""created"":""Fri, 18 May 2001 22:23:29 GMT""}]","2007-05-23"
"gr-qc/0105072","William H. Kinney","M. Brisudova and R. P. Woodard (University of Florida at Gainesville),
  W. H. Kinney (Columbia)","Homogeneous and Isotropic Charge Densities to Accelerate the Universe","9 pages, LaTeX 2epsilon, no figures. Revised for publication to
  include an expanded bibliography and discussion of recent related results by
  other authors","Class.Quant.Grav. 18 (2001) 3929-3934","10.1088/0264-9381/18/18/311","UFIFT-HET-01-5","gr-qc hep-ph",,"  Various theoretical obstacles are associated with a homogeneous and isotropic
distribution of ``charge'' which is subject to a repulsive, long-range force.
We show how these can be overcome, for all practical purposes, by the simple
device of endowing the particle which carries the force with a small mass. The
resulting situation may be relevant to a phase of cosmological acceleration
which is triggered by the approach to masslessness of such a force carrier.
","[{""version"":""v1"",""created"":""Fri, 18 May 2001 22:01:30 GMT""},{""version"":""v2"",""created"":""Thu, 2 Aug 2001 08:00:25 GMT""}]","2009-11-07"
"hep-ex/0105051","David B. MacFarlane","Riccardo Faccini (for the BABAR Collaboration)","Measurements of CP violation, mixing and lifetimes in B meson decays
  with the BABAR experiment at PEP-II","9 pages, 7 postscript figues, submitted to proceedings of the 36th
  Rencontres de Moriond on Weak Interactions",,,"BABAR-PROC-01/24, SLAC-PUB-8833","hep-ex",,"  The BABAR detector, which operates at the SLAC PEPII asymmetric e+e- collider
at energies near the Y(4S) resonance has collected about 23M B-anti-B pairs in
year 2000. Based on this data sample, we present the first study of sin(2b),
with samples of B^0 --> J/psi K0S, B^0 --> psi(2S) K0S and B^0 --> J/psi K0L
decays. The measured value is 0.34+-0.20+-0.05. In addition, we present
preliminary measurements of charged and neutral B meson lifetimes and
B^0-anti-B^0 oscillation frequency.
","[{""version"":""v1"",""created"":""Fri, 18 May 2001 18:24:49 GMT""}]","2019-08-14"
"hep-ex/0105055","Guenter Wolf","Guenter Wolf","Deep Inelastic Scattering at Large Energy and Momentum Transfers: Recent
  Results from HERA","77 pages, 55 figures, review","AIP Conf.Proc.623:61-112,2002","10.1063/1.1489737","DESY 01-058","hep-ex",,"  Data from H1 and ZEUS on the structure and the quark and gluon densities of
the proton are discussed. A brief excursion is made into the field of inclusive
diffraction by deep inelastic scattering. The comparison of e- p and e+ p
scattering at large momentum transfers demonstrates clearly the presence of
weak contributions in neutral current interactions. The comparison with the
corresponding charged current results shows at Q2 values above the masses
squared of the heavy vector bosons the unification of electromagnetic and weak
interactions. The new data are testing the validity of the Standard Model down
to spatial resolutions of the order of 10^{-16} cm. Intensive searches have
been performed for a manifestation of instantons, for signs of compositeness of
quarks and leptons and for the effect of extra dimensions.
","[{""version"":""v1"",""created"":""Fri, 18 May 2001 17:28:58 GMT""}]","2014-11-17"
"hep-ex/0105056","Sylvie Braibant-Giacomelli","Sylvie Braibant-Giacomelli","Other searches at LEP","Proceedings of the Conference: ""QCD and High Energy Hadronic
  Interactions"", Rencontres de Moriond, 18-24 March 2001",,,,"hep-ex",,"  During the year 2000, LEP has been operated at centre-of-mass energies up to
sqrt(s) = 209 GeV. New particle searches have been performed using these data
samples. Model independent limits on the production cross-sections and mass
limits in the context of the Minimal Supersymmetric Standard Model (MSSM)
assuming R-parity violation and in the context of gauge-mediated supersymmetry
breaking theories (GMSB) are presented. Searches for technicolor, excited
leptons and leptoquarks are also reviewed.
","[{""version"":""v1"",""created"":""Fri, 18 May 2001 17:39:51 GMT""}]","2007-05-23"
"hep-lat/0105022","Francesco Knechtli","A. Hasenfratz and F. Knechtli (U. of Colorado)","Four Flavor Finite Temperature Phase Transition with HYP Action: Where
  is the First Order Phase Transition Line?","21 pages, 9 figures; We have added new data to Section III. and a new
  analysis of the finite temperature phase diagram. We find agreement with the
  prediction of instanton models",,,"COLO-HEP-465","hep-lat",,"  We study the finite temperature phase transition of four flavor staggered
fermions with hypercubic fat link actions on N_t=4 and N_t=6 temporal lattices.
Our fat links are constructed with hypercubic blocking (HYP) and therefore are
very compact. We present a new algorithm for simulating fermions coupled to HYP
fat links. The algorithm has a simple form based on the standard overrelaxation
and heatbath updatings for the pure gauge action. We observe that as we
increase the smoothness of the gauge fields by changing the parameters of the
blocking the very pronounced first order phase transition of the thin link
action becomes weaker and moves to physically uninteresting values of the gauge
coupling. With our smoothest HYP action we do not find any indication of a
phase transition in the accessible temperature range on the N_t=4 or 6 lattices
even at quark masses close to the physical light quark mass. We argue that the
observed difference in the phase diagram is due to the improved flavor symmetry
of the smeared link actions.
","[{""version"":""v1"",""created"":""Sat, 19 May 2001 01:08:53 GMT""},{""version"":""v2"",""created"":""Wed, 20 Jun 2001 20:39:19 GMT""}]","2007-05-23"
"hep-ph/0105187","R. N. Rogalyov","R.N. Rogalyov","A Possibility to Measure CP-Violating Effects in the Decay K --> mu nu
  gamma","12 pages, 4 figures; the overall sign changed, typos corrected","Phys.Lett.B521:243-251,2001","10.1016/S0370-2693(01)01198-4",,"hep-ph",,"  It is argued that a precise measurement of the transverse component of the
muon spin in the decay K --> mu nu gamma makes it possible to obtain more
stringent limits on CP-violating parameters of the leptoquark, SUSY and
left-right symmetric models. The results of the calculations of the CP-even
transverse component of the muon spin in the decay K --> mu nu gamma due to the
final-state electromagnetic interactions are presented. The weighted average of
the transverse component of the muon spin comprises 2.3 times 10^{-4}.
","[{""version"":""v1"",""created"":""Fri, 18 May 2001 16:50:15 GMT""},{""version"":""v2"",""created"":""Sat, 19 May 2001 04:56:26 GMT""},{""version"":""v3"",""created"":""Thu, 31 May 2001 17:41:56 GMT""},{""version"":""v4"",""created"":""Fri, 1 Jun 2001 20:34:34 GMT""},{""version"":""v5"",""created"":""Sun, 3 Jun 2001 10:34:26 GMT""},{""version"":""v6"",""created"":""Thu, 5 Jul 2001 07:55:08 GMT""},{""version"":""v7"",""created"":""Mon, 26 Aug 2002 08:54:31 GMT""}]","2014-11-17"
"hep-ph/0105189","Daria Ahrensmeier","D. Ahrensmeier, R. Baier and M. Dirks (University of Bielefeld)","Parametric amplification versus collisions: An illustrative application","LaTeX, 9 pages, 7 figures",,,,"hep-ph",,"  We investigate the time dependence of the quantum statistical model with
$\lambda \phi^4/4!$ self-interaction and consider the resulting induced
particle number density. For a special example in which the classical
approximation exhibits parametric resonance, the effects of the back reaction
and especially of collisions, treated in a perturbative way, are analysed.
","[{""version"":""v1"",""created"":""Fri, 18 May 2001 16:05:55 GMT""}]","2007-05-23"
"hep-ph/0105190","Valeri V. Kiselev","V.V.Kiselev, A.K.Likhoded, O.N.Pakhomova, V.A.Saleev","Leptonic constants of heavy quarkonia in potential approach of NRQCD","18 pages, 6 eps-figures, discussion and references added, vNRQCD
  analysis considered","Phys.Rev. D65 (2002) 034013","10.1103/PhysRevD.65.034013",,"hep-ph",,"  We consider a general scheme for calculating the leptonic constant of heavy
quarkonium QQ-bar in the framework of nonrelativistic quantum chromodynamics,
NRQCD, operating as the effective theory of nonrelativistic heavy quarks. We
explore the approach of static potential in QCD, which takes into account both
the evolution of effective charge in the three-loop approximation and the
linearly raising potential term, which provides the quark confinement. The
leptonic constants of bb-bar and cc-bar systems are evaluated by making use of
two-loop anomalous dimension for the current of nonrelativistic quarks, where
the factor for the normalization of matrix element is introduced in order to
preserve the renormalization group invariance of estimates.
","[{""version"":""v1"",""created"":""Fri, 18 May 2001 16:23:04 GMT""},{""version"":""v2"",""created"":""Tue, 23 Oct 2001 06:20:43 GMT""}]","2009-11-07"
"hep-ph/0105191","Ferruccio Feruglio","Ferruccio Feruglio","Large Neutrino Mixing in Grand Unified Theories","LaTex, 4 pages, talk given at the Cairo International Conference on
  High Energy Physics, Cairo, Egypt, 9-14 January 2001 and at the XXXth
  International Conference on High Energy Physics (ICHEP2000), Osaka, July
  27-August 2, 2000",,,,"hep-ph",,"  A non-minimal, semi-realistic version of supersymmetric SU(5) grand unified
theory is discussed. The solution of the doublet-triplet splitting problem
leads to a better agreement between the predicted and observed values of the
low-energy strong coupling constant and to a prolongation of the proton
lifetime. A U(1) flavor symmetry allows to accommodate a realistic mass
spectrum in the charged and in the neutral fermion sectors and protects
doublet-triplet splitting and proton decay from dangerous radiative corrections
or non-renormalizable operators.
","[{""version"":""v1"",""created"":""Fri, 18 May 2001 16:48:43 GMT""}]","2007-05-23"
"hep-ph/0105192","Fritz W. Bopp","Fritz W. Bopp and Johannes Ranft","Charged Particle Fluctuation as Signal of the Dynamics in Heavy Ion
  Processes","11 pages, 11 figures, to be published in EJPC","Eur.Phys.J.C22:171-177,2001","10.1007/s100520100788","SI-01-3","hep-ph",,"  We compare the dispersion of the charges in a central rapidity box according
to the Dual Parton Model with the predictions of statistical models.
Significant deviations are found in heavy ion collisions at RHIC and LHC
energies. Hence the charged particle fluctuations should provide a clear signal
of the dynamics of heavy ion processes. They should allow to directly measure
the degree of thermalization in a quantitative way.
","[{""version"":""v1"",""created"":""Fri, 18 May 2001 16:53:45 GMT""},{""version"":""v2"",""created"":""Mon, 10 Sep 2001 15:14:48 GMT""}]","2009-01-07"
"hep-ph/0105193",,"Chueng-Ryong Ji and Chad Mitchell (NCSU)","Poincare Invariant Algebra From Instant to Light-Front Quantization","21 pages, 3 figures, 1 table","Phys.Rev. D64 (2001) 085013","10.1103/PhysRevD.64.085013",,"hep-ph",,"  We present the Poincare algebra interpolating between instant and light-front
time quantizations. The angular momentum operators satisfying SU(2) algebra are
constructed in an arbitrary interpolation angle and shown to be identical to
the ordinary angular momentum and Leutwyler-Stern angular momentum in the
instant and light-front quantization limits, respectively. The exchange of the
dynamical role between the transverse angular mometum and the boost operators
is manifest in our newly constructed algebra.
","[{""version"":""v1"",""created"":""Fri, 18 May 2001 18:43:19 GMT""}]","2009-11-07"
"hep-ph/0105194","Markus Diehl","M. Diehl (DESY) and G. Hiller (SLAC)","New ways to explore factorization in b decays","30 pages, 5 figures, references added, signs corrected in eqs.
  10-13,19,20","JHEP 0106:067,2001","10.1088/1126-6708/2001/06/067","SLAC-PUB-8822, DESY-01-060","hep-ph",,"  We propose to study factorization breaking effects in exclusive b decays
where they are strongly enhanced over the factorizing contributions. This can
be done by selecting final-state mesons with a small decay constant or with
spin greater than one. We find a variety of decay modes which could help
understand the dynamical origin of factorization and the mechanisms responsible
for its breaking.
","[{""version"":""v1"",""created"":""Fri, 18 May 2001 21:01:54 GMT""},{""version"":""v2"",""created"":""Mon, 9 Jul 2001 21:32:36 GMT""}]","2010-02-03"
"hep-ph/0105195","Boris Kopeliovich","M.B. Johnson, B.Z. Kopeliovich, I.K. Potashnikova, and P.L. McGaughey,
  J.M. Moss, J.C. Peng, G. Garvey, M. Leitch, C.N. Brown, D.M. Kaplan","Energy Loss versus Shadowing in the Drell-Yan Reaction on Nuclei","43 pages including 17 figures","Phys.Rev. C65 (2002) 025203","10.1103/PhysRevC.65.025203",,"hep-ph nucl-th",,"  We present a new analysis of the E772 and E866 experiments on the nuclear
dependence of Drell-Yan (DY) lepton pair production resulting from the
bombardment of $^2H$, Be, C, Ca, Fe, and W targets by 800 GeV/c protons at
Fermilab. We employ a light-cone formulation of the DY reaction in the rest
frame of the nucleus, where the dimuons detected at small values of Bjorken x_2
<< 1 may be considered to originate from the decay of a heavy photon radiated
from an incident quark in a bremsstrahlung process. We infer the energy loss of
the quark by examining the suppression of the nuclear-dependent DY ratios seen
as a function of projectile momentum fraction x_1 and dimuon mass M. Shadowing,
which also leads to nuclear suppression of dimuons, is calculated within the
same approach employing the results of phenomenological fits to deep inelastic
scattering data from HERA. The analysis yields -dE/dz =2.73 +/- 0.37 +/- 0.5
GeV/fm for the rate of quark energy loss per unit path length, a value
consistent with theoretical expectations including the effects of the inelastic
interaction of the incident proton at the surface of the nucleus. This is the
first observation of a nonzero energy loss effect in such experiments.
","[{""version"":""v1"",""created"":""Fri, 18 May 2001 21:59:08 GMT""},{""version"":""v2"",""created"":""Sun, 27 May 2001 13:04:15 GMT""}]","2009-11-07"
