"astro-ph/0105351","Ofer Lahav","Ofer Lahav (Institute of Astronomy, Cambridge)","Large Surveys in Cosmology: The Changing Sociology","Invited article for ""Organizations and Strategies in Astronomy II"",
  ed. A. Heck, Kluwer Acad. Publ., in press (7 pages, no figures)",,"10.1007/978-94-010-0666-8_9",,"astro-ph",,"  Galaxy redshift surveys and Cosmic Microwave Background experiments are
undertaken with larger and larger teams, in a fashion reminiscent of particle
physics experiments and the human genome projects. We discuss the role of young
researchers, the issue of multiple authorship, and ways to communicate
effectively in teams of tens to hundreds of collaborators.
","[{""version"":""v1"",""created"":""Sun, 20 May 2001 16:12:46 GMT""}]","2016-01-27"
"astro-ph/0105352","Ofer Lahav","Ofer Lahav (Institute of Astronomy, Cambridge, UK)","The Age of the Universe from Joint Analysis of Cosmological Probes","Invited talk at ""Asrtrophysical Ages and Time Scales"", Hawaii, 2001,
  APS Conference Series, Eds. T. von Hippel, M. Manset, C. Simpson, in press,
  10 pages, 2 figures",,,,"astro-ph",,"  Analyses of various cosmological probes, including the latest Cosmic
Microwave Background anisotropies, the 2dF Galaxy Redshift Survey and
Cepheid-calibrated distance indicators suggest that the age of expansion is $13
\pm 3$ Gyr. We discuss some statistical aspects of this estimation, and we also
present results for joint analysis of the latest CMB and Cepheid data by
utilizing `Hyper-Parameters'. The deduced age of expansion might be
uncomfortably close to the age of the oldest Globular Clusters, in particular
if they formed relatively recently.
","[{""version"":""v1"",""created"":""Sun, 20 May 2001 16:39:32 GMT""}]","2007-05-23"
"astro-ph/0105353","Ofer Lahav","Ofer Lahav (Institute of Astronomy, Cambridge, UK)","New Cosmological Data and the `Best-Fit' FRW Universe","Review talk at ""X Encontro Nacional de Astronomia e Astrofisica"",
  Lisbon, 2000, eds,. J. Lemos et al. (16 pages, 5 figures)",,"10.1142/9789812811110_0001",,"astro-ph",,"  Observational tests for the homogeneity of the Universe on large scales are
reviewed. Assuming the Cosmological Principle we then estimate cosmological
parameters by joint analysis of the Cosmic Microwave Background, Supernovae Ia,
peculiar velocities, cluster abundance and redshift surveys. Our results are
consistent with results obtained by other groups, suggesting a best-fit FRW
Universe with $\omegam = 1 -\lambda \approx 0.3$ and $H_0 \approx 75$
km/sec/Mpc. We point out some potential problems with this currently popular
model.
","[{""version"":""v1"",""created"":""Sun, 20 May 2001 17:29:21 GMT""}]","2017-08-23"
"astro-ph/0105355","Christofer Gunnarsson","Edvard Moertsell, Christofer Gunnarsson and Ariel Goobar","Gravitational lensing of the farthest known supernova SN1997ff","5 pages, 4 figures, minor revisions after bug fix, conclusions remain
  unchanged","ApJ, 561, 106 (2001)","10.1086/323242",,"astro-ph",,"  We investigate the effects of gravitational lensing due to intervening
galaxies on the recently discovered Type Ia supernova at z=1.7, SN1997ff, in
the Hubble Deep Field North. We find that it is possible to obtain a wide range
of magnifications by varying the mass and/or the velocity dispersion
normalization of the lensing galaxies. In order to be able to use SN1997ff to
constrain the redshift-distance relation, very detailed modeling of the
galaxies to control the systematic effects from lensing is necessary. Thus we
argue, that based on our current limited knowledge of the lensing galaxies, it
is difficult to use SN1997ff to constrain the values of Omega_M and
Omega_Lambda, or even to place severe limits on grey dust obscuration or
luminosity evolution of Type Ia supernovae.
","[{""version"":""v1"",""created"":""Mon, 21 May 2001 07:54:37 GMT""},{""version"":""v2"",""created"":""Thu, 6 Feb 2003 16:25:27 GMT""}]","2009-11-06"
"astro-ph/0105356","Heinrich Voelk","H.J. Voelk","Supernova Remnants: acceleration of particles and gamma-ray emission","11 pages, 9 figures, to appear in the Proceedings of the XXIst
  Rencontres de Moriond ""Very High Energy Phenomena in the Universe"", Les Arcs,
  France, Jan. 20-27 (2001)",,,,"astro-ph",,"  Particle acceleration in the dynamically evolving environment of Supernova
Remnants is discussed in the framework of a genuinely time-dependent nonlinear
theory, assuming spherical symmetry. As a consequence the dependence of
injection on the angle between shock normal and external magnetic field
direction requires a renormalisation of the calculated particle fluxes. The
recent observational results in TeV gamma-rays from such objects are discussed
and found to be consistent with theory. We conclude that for the present
instrumental sensitivities there are no reasons to draw premature negative
conclusions as to the possible origin of the Galactic Cosmic Rays below the
""knee"" in Supernova Remnants. In addition, theoretical predictions and
observations are getting very close. Therefore the coming generation of
ground-based and space-borne detectors will decide this basic question of
astrophysics.
","[{""version"":""v1"",""created"":""Mon, 21 May 2001 09:23:41 GMT""}]","2007-05-23"
"astro-ph/0105357","Michele Bellazzini","M. Tosi, E. Sabbi, M. Bellazzini, A. Aloisi, L. Greggio, C. Leitherer,
  P. Montegriffo","The Resolved Stellar Populations in NGC 1705","aastex, 37 pages, 13 (reduced resolution) .ps figures. Accepted by
  AJ. Full resolution figures are available upon request to the first author",,"10.1086/322104",,"astro-ph",,"  We present HST photometry of the resolved stellar population in the dwarf
irregular galaxy NGC 1705. The galaxy has been observed with both WFPC2 and
NICMOS, and successful images have been obtained in the F555W, F814W, F110W and
F160W bands. The optical fields cover most of the galaxy, while the infrared
field (NIC2) maps only its central regions. The optical photometry provides
\~20000 objects down to m_F555W ~ 29 in the PC field of view and ~ 20000 in the
three WFCs. In the infrared we have been able to resolve ~ 2400 stars down to
m_{F110W}, m_{F160W} ~ 26. A subsample of 1834 stars have been unambiguously
measured in all the four bands. The corresponding color-magnitude diagrams
(CMDs) confirm the existence of an age gradient, showing that NGC 1705 hosts
both young (a few Myr old) and very old (up to 15 Gyr old) stars, with the
former strongly concentrated toward the galactic center and the latter present
everywhere, but much more easily visible in the external regions. The tip of
the red giant branch (TRGB) is clearly visible both in the optical and in the
infrared CMDs and allows us to derive the galaxy distance. Taking into account
the uncertainties related to both the photometry and the TRGB magnitude --
distance relation, we find that the distance modulus of NGC 1705 is
(m-M)_0=28.54 +- 0.26, corresponding to a distance D=5.1 +- 0.6 Mpc.
","[{""version"":""v1"",""created"":""Mon, 21 May 2001 10:07:43 GMT""}]","2009-11-06"
"astro-ph/0105358","Antonino Del Popolo","A. Del Popolo","The fluctuating gravitational field in inhomogeneous and clustered
  self-gravitating systems","13 pages, 8 figures","Astron.Astrophys., 1996, 311, 715-720",,,"astro-ph",,"  In this paper I extend the results of Ahmad & Cohen (1973), regarding the
study of the probability distribution of the stochastic force in homogeneous
gravitational systems, to inhomogeneous gravitational ones. To this aim, I
study the stochastic force distribution using N-body realizations of Plummer's
spherically symmetric models. I find that the stochastic force distribution
obtained for the evolved system is in good agreement with Kandrup's (1980)
theory of stochastic force in inhomogeneous systems. Correlation effects that
arise during the evolution of the system of particles are well described by
Antonuccio-Delogu & Atrio-Barandela's (1992) theory.
","[{""version"":""v1"",""created"":""Mon, 21 May 2001 10:59:05 GMT""}]","2007-05-23"
"astro-ph/0105359","Antonino Del Popolo","A. Del Popolo and M. Gambera","Non radial motions and the large scale structure of the Universe","11 pages, 3 encapsulated figures","Clustering at High redshift, ASP conference series, (2000) Vol.
  200, pg. 148. Edited by A. Mazure, O. Le Fevre and V. Le Brun",,,"astro-ph",,"  We study the effect of non-radial motions on the mass function, the VDF and
on the shape of clusters of galaxies using the model introduced in Del Popolo &
Gambera (1998a,b; 1999). The mass function of clusters, obtained using the
quoted model, is compared with the statistical data by Bahcall & Cen (1992) and
Girardi et al. (1998), while the VDF is compared with the CfA data by Zabludoff
et al. (1993) for local clusters. In both cases the model predictions are in
good agreement with the observational data showing once more how non-radial
motions can reduce many of the discrepancies between CDM model predictions and
observational data. Besides we study the effect of non-radial motions on the
intrinsic shape of clusters of galaxies showing that non-radial motions produce
clusters less elongated with respect to CDM model.
","[{""version"":""v1"",""created"":""Mon, 21 May 2001 11:37:27 GMT""}]","2007-05-23"
"astro-ph/0105360","Leonid S. Pilyugin","L.S. Pilyugin (Main Astron. Obs. of Nat. Academy of Sc. of Ukraine)","Oxygen abundances in dwarf irregular galaxies and the metallicity -
  luminosity relationship","9 pages, 5 figures, accepted for publication in Astronomy and
  Astrophysics",,"10.1051/0004-6361:20010732",,"astro-ph",,"  The low-luminosity dwarf irregular galaxies are considered. The oxygen
abundances in HII regions of dwarf irregular galaxies were recalculated from
published spectra through the recently suggested P - method. It has been found
that the metallicity of low-luminosity dwarf irregular galaxies, with a few
exceptions, correlates well with galaxy luminosity. The dispersion of oxygen
abundances around the metallicity - luminosity relationship increases with
decreasing of galaxy luminosity, as was found by Richer and McCall (1995). No
relationship between the oxygen abundance and the absolute magnitude in the
blue band for irregular galaxies obtained by Hidalgo-Gamez and Olofsson (1998)
can be explained by the large uncertainties in the oxygen abundances derived
through the Te - method, that in turn can be explained by the large
uncertainties in the measurements of the strengths of the weak oxygen line
[OIII]4363 used in the Te - method.
","[{""version"":""v1"",""created"":""Mon, 21 May 2001 11:50:02 GMT""}]","2009-11-06"
"astro-ph/0105361","Lesgourgues","Julien Lesgourgues and Andrew R. Liddle","The lepton asymmetry: the last chance for a critical-density cosmology?","6 pages, 4 figures","Mon.Not.Roy.Astron.Soc. 327 (2001) 1307","10.1046/j.1365-8711.2001.04833.x","LAPTH 847/01","astro-ph hep-ph",,"  We use a wide range of observations to constrain cosmological models
possessing a significant asymmetry in the lepton sector, which offer perhaps
the best chance of reconciling a critical-density Universe with current
observations. The simplest case, with massless neutrinos, fails to fit many
experimental data and does not lead to an acceptable model. If the neutrinos
have mass of order one electron-volt (which is favoured by some neutrino
observations), then models can be implemented which prove a good fit to
microwave anisotropies and large-scale structure data. However, taking into
account the latest microwave anisotropy results, especially those from
Boomerang, we show that the model can no longer accommodate the observed baryon
fraction in clusters. Together with the observed acceleration of the present
Universe, this puts considerable pressure on such critical-density models.
","[{""version"":""v1"",""created"":""Mon, 21 May 2001 13:51:04 GMT""}]","2009-11-06"
"astro-ph/0105362","Astaude","A. Staude, A. D. Schwope and R. Schwarz (all AIP Potsdam, Germany)","System parameters of the long-period polar V1309 Ori","11 pages, accepted at A&A",,"10.1051/0004-6361:20010695",,"astro-ph",,"  Based on high-resolution optical spectroscopy in the blue and the near
infra-red spectral range, we derived velocity images (Doppler tomograms) of the
mass-donating secondary star and the accretion stream of the long-period
eclipsing polar V1309 Ori (RX J0515.41+0104.6). Combined with HST-spectroscopy
of high time resolution and optical photometry we were able to derive the main
system parameters and to determine the accretion geometry of the binary. The
length of the eclipse of the white dwarf is Delta t_{ecl} = 2418 +/- 60 s, the
mass ratio Q = 1.37 - 1.63, and the orbital inclination i=76.6 - 78.9 degrees.
The surface of the secondary star could be resolved in the Doppler image of NaI
absorption lines, where it shows a marked depletion on the X-ray irradiated
side. The accretion geometry proposed by us with a nearly aligned rotator,
co-latitude delta ~ 10 degrees, tilted away from the ballistic stream, azimuth
chi ~ -35 degrees, explains the shape of the emission-line Doppler tomograms
and the shape of optical/UV eclipse light curves.
","[{""version"":""v1"",""created"":""Mon, 21 May 2001 15:02:08 GMT""}]","2009-11-06"
"astro-ph/0105363","Eli Dwek","Eli Dwek","The Role of Dust in Producing the Cosmic Infrared Background","Invited talk presented at the IAU Symposium No 204 on ""The
  Extragalactic Infrared Background and its Cosmological Implications"" Martin
  Harwit and Michael G. Hauser eds",,,,"astro-ph",,"  The extragalactic background light (EBL), exclusive of the cosmic microwave
background, consists of the cumulative radiative output from all energy sources
in the universe since the epoch of recombination. Most of this energy is
released at ultraviolet and optical wavelengths. However, observations show
that a significant fraction of the EBL falls in the 10 to 1000 micron
wavelength regime. This provides conclusive evidence that we live in a dusty
universe, since only dust can efficiently absorbs a significant fraction of the
background energy and reemit it at infrared wavelengths. The general role of
dust in forming the cosmic infrared background (CIB) is therefore obvious.
However, its role in determining the exact spectral shape of the CIB is quite
complex. The CIB spectrum depends on the microscopic physical properties of the
dust, its composition, abundance, and spatial distribution relative to the
emitting sources, and its response to evolutionary processes that can modify
all the factors listed above. This paper will present a brief summary of the
many ways dust affects the intensity and spectral shape of the cosmic infrared
background. In an Appendix we present new limits on the mid-infrared intensity
of the CIB using TeV gamma-ray observations of Mrk 501.
","[{""version"":""v1"",""created"":""Mon, 21 May 2001 15:01:23 GMT""}]","2007-05-23"
"astro-ph/0105364","Pettini Marco","Cecilia Clementi (1) and Marco Pettini (2) ((1) Department of Physics,
  University of California at San Diego,La Jolla, USA; (2) Osservatorio
  Astrofisico di Arcetri, Firenze, Italy)","A geometric interpretation of integrable motions","20 pages",,,,"astro-ph math-ph math.MP nlin.SI",,"  Integrability, one of the classic issues in galactic dynamics and in general
in celestial mechanics, is here revisited in a Riemannian geometric framework,
where newtonian motions are seen as geodesics of suitable ``mechanical''
manifolds. The existence of constants of motion that entail integrability is
associated with the existence of Killing tensor fields on the mechanical
manifolds. Such tensor fields correspond to hidden symmetries of non-Noetherian
kind. Explicit expressions for Killing tensor fields are given for the N=2 Toda
model, and for a modified Henon-Heiles model, recovering the already known
analytic expressions of the second conserved quantity besides energy for each
model respectively.
","[{""version"":""v1"",""created"":""Mon, 21 May 2001 15:04:50 GMT""}]","2007-05-23"
"cond-mat/0105379","Luca Peliti","Luca Peliti","Quasispecies evolution in general mean-field landscapes","6 pages, 2 figures, Europhysics Letters style (included) Finite-size
  scaling analysis sketched. To appear in Europhysics Letters","Europhys. Lett. 57, 745-751 (2002)","10.1209/epl/i2002-00526-5","NSF-ITP-01-40","cond-mat.dis-nn nlin.AO q-bio.PE",,"  I consider a class of fitness landscapes, in which the fitness is a function
of a finite number of phenotypic ""traits"", which are themselves linear
functions of the genotype. I show that the stationary trait distribution in
such a landscape can be explicitly evaluated in a suitably defined
""thermodynamic limit"", which is a combination of infinite-genome and strong
selection limits. These considerations can be applied in particular to identify
relevant features of the evolution of promoter binding sites, in spite of the
shortness of the corresponding sequences.
","[{""version"":""v1"",""created"":""Mon, 21 May 2001 02:01:07 GMT""},{""version"":""v2"",""created"":""Tue, 18 Dec 2001 11:19:41 GMT""}]","2009-11-07"
"cond-mat/0105388","Dale J. Van Harlingen","W. K. Neils and D. J. Van Harlingen","Experimental test for subdominant superconducting phases with complex
  order parameters in cuprate grain boundary junctions",,,"10.1103/PhysRevLett.88.047001",,"cond-mat.supr-con",,"  We propose and implement a direct experimental test for subdominant
superconducting phases with broken time-reversal symmetry in d-wave
superconductors. The critical current of 45-degree asymmetric grain boundary
junctions are shown to be extremely sensitive to the predicted onset of a
complex order parameter at (110)-surfaces and near magnetic impurities.
Measurements in YBCO and Ni-doped YBCO junctions indicate that the symmetry at
the surface is consistent with pure d-wave at all temperatures, putting limits
on the magnitude and chiral domain structure of any subdominant symmetry
component.
","[{""version"":""v1"",""created"":""Sun, 20 May 2001 21:50:47 GMT""}]","2009-11-07"
"cond-mat/0105389","Wei Ku","Wei Ku, W.E. Pickett, R.T. Scalettar, and A.G. Eguiluz","Ab Initio Investigation of Collective Charge Excitations in MgB_2","4 pages, 4 figures. accepted for publication by Phys. Rev. Lett",,"10.1103/PhysRevLett.88.057001",,"cond-mat.supr-con cond-mat.mtrl-sci",,"  A sharp collective charge excitation is predicted in MgB$_2$ at $\sim2.5eV$
for $q$ perpendicular to the boron layers, based on an all-electron analysis of
the dynamical density response within time-dependent density functional theory.
This novel excitation, consisting of coherent charge fluctuation between Mg and
B sheets, induces an abrupt plasma edge in the experimentally-observable
reflectivity. The existence of this mode reflects the unique electronic
structure of MgB$_2$, that is also responsible for strong electron-phonon
coupling. By contrast, the acoustic plasmon, recently suggested to explain the
high $T_c$, is not realized when realistic transition strengths are
incorporated.
","[{""version"":""v1"",""created"":""Sun, 20 May 2001 23:54:47 GMT""},{""version"":""v2"",""created"":""Fri, 7 Dec 2001 23:34:41 GMT""}]","2009-11-07"
"cond-mat/0105390","Alexander Lavrov","A. N. Lavrov, Yoichi Ando, Seiki Komiya, and I. Tsukada (CRIEPI,
  Japan)","Unusual magnetic susceptibility anisotropy in untwinned
  La_{2-x}Sr_xCuO_4 single crystals in the lightly-doped region","4 pages, 3 figures, accepted for publication in Phys.Rev.Lett","Phys. Rev. Lett. 87, 017007 (2001)","10.1103/PhysRevLett.87.017007",,"cond-mat.supr-con cond-mat.str-el",,"  We present a study of the magnetic susceptibility in carefully detwinned
La_{2-x}Sr_{x}CuO_4 single crystals in the lightly-doped region (x=0-0.03),
which demonstrates a remarkable in-plane anisotropy of the spin system. This
anisotropy is found to persist after the long-range antiferromagnetic (AF)
order is destroyed by hole doping, suggesting that doped holes break the AF
order into domains in which the spin alignment is kept essentially intact. It
turns out that the freezing of the spins taking place at low temperatures is
also notably anisotropic, implying that the ""spin-glass"" feature is governed by
the domain structure as well.
","[{""version"":""v1"",""created"":""Mon, 21 May 2001 05:58:58 GMT""}]","2009-11-07"
"cond-mat/0105391","Andrea Crisanti","B. Coluzzi, A. Crisanti, E. Marinari, F. Ritort, A. Rocco","A New Method to Compute the Configurational Entropy in Spin Glasses","14 pages, 3 figures, LaTeX2e with EJP class. EPJ B (in press)",,,,"cond-mat.dis-nn cond-mat.stat-mech",,"  We propose a new method to compute the configurational entropy of glassy
systems as a function of the free energy of valleys at a given temperature, in
the framework of the Stillinger and Weber approach. In this method, which we
call free-energy inherent structures (FEIS) approach, valleys are represented
by inherent structures that are statistically grouped according to their
free-energy rather than the energy as is commonly done in the standard
procedure. The FEIS method provides a further step toward a description of the
relaxational behavior of glassy systems in terms of a free energy measure. It
can be used to determine the character of the glass transition as well as the
mode coupling and the Kauzmann temperatures. We illustrate the usefulness of
the method by applying it to simple models of glasses and spin glasses.
","[{""version"":""v1"",""created"":""Mon, 21 May 2001 06:27:36 GMT""},{""version"":""v2"",""created"":""Tue, 30 Oct 2001 10:18:24 GMT""},{""version"":""v3"",""created"":""Tue, 17 Dec 2002 09:00:48 GMT""},{""version"":""v4"",""created"":""Fri, 14 Mar 2003 13:08:47 GMT""}]","2007-05-23"
"cond-mat/0105392","A. Reischl","E. M\""uller-Hartmann, A. Reischl","Derivation of effective spin models from a three band model for
  CuO_2-planes","27 pages, 10 figures. Changed from particle to hole notation, right
  value for the charge transfer gap used; this results in some changes in the
  figures and a higher value of the ring exchange","Eur. Phys. J. B 28, 173-183 (2002)","10.1140/epjb/e2002-00219-5",,"cond-mat.str-el",,"  The derivation of effective spin models describing the low energy magnetic
properties of undoped CuO_2-planes is reinvestigated. Our study aims at a
quantitative determination of the parameters of effective spin models from
those of a multi-band model and is supposed to be relevant to the analysis of
recent improved experimental data on the spin wave spectrum of La_2CuO_4.
Starting from a conventional three-band model we determine the exchange
couplings for the nearest and next-nearest neighbor Heisenberg exchange as well
as for 4- and 6-spin exchange terms via a direct perturbation expansion up to
12th (14th for the 4-spin term) order with respect to the copper-oxygen hopping
t_pd. Our results demonstrate that this perturbation expansion does not
converge for hopping parameters of the relevant size. Well behaved
extrapolations of the couplings are derived, however, in terms of Pade
approximants. In order to check the significance of these results from the
direct perturbation expansion we employ the Zhang-Rice reformulation of the
three band model in terms of hybridizing oxygen Wannier orbitals centered at
copper ion sites. In the Wannier notation the perturbation expansion is
reorganized by an exact treatment of the strong site-diagonal hybridization.
The perturbation expansion with respect to the weak intersite hybridizations is
calculated up to 4th order for the Heisenberg coupling and up to 6th order for
the 4-spin coupling. It shows excellent convergence and the results are in
agreement with the Pade approximants of the direct expansion. The relevance of
the 4-spin coupling as the leading correction to the nearest neighbor
Heisenberg model is emphasized.
","[{""version"":""v1"",""created"":""Mon, 21 May 2001 08:13:03 GMT""},{""version"":""v2"",""created"":""Tue, 30 Jul 2002 13:01:31 GMT""}]","2009-11-07"
"cond-mat/0105393","Arnulf Latz","T. Theenhaus, R. Schilling, A. Latz and M. Letz","Microscopic dynamics of molecular liquids and glasses: Role of
  orientations and translation-rotation coupling","26 pages 24 figures",,"10.1103/PhysRevE.64.051505",,"cond-mat.dis-nn",,"  We investigate the dynamics of a fluid of dipolar hard spheres in its liquid
and glassy phase, with emphasis on the microscopic time or frequency regime.
This system shows rather different glass transition scenarios related to its
rich equilibrium behavior which ranges from a simple hard sphere fluid to a
long range ferroelectric orientational order. In the liquid phase close to the
ideal glass transition line and in the glassy regime a medium range
orientational order occurs leading to a softening of an orientational mode. To
investigate the role of this mode we use the molecular mode-coupling equations
to calculate the spectra $\phi_{lm}^{\prime \prime}(q,\omega)$ and $\chi
_{lm}''(q,\omega)$. In the center of mass spectra $ \phi_{00}''(q,\omega)$ and
$\chi_{00}''(q,\omega)$ we found besides a high frequency peak at $\omega
_{hf}$ a peak at $\omega_{op}$, about one decade below $\omega_{hf}$. $\omega
_{op}$ has almost no $q$-dependence and exhibits an ``isotope'' effect $\omega
_{op}\propto I^{-1/2}$, with $I$ the moment of inertia. We give evidence that
the existence of this peak is related to the occurrence of the medium ranged
orientational order. It is shown that some of these feature also exist for
schematic mode coupling models.
","[{""version"":""v1"",""created"":""Mon, 21 May 2001 08:57:56 GMT""}]","2009-11-07"
