"cond-mat/0105394","Gerald Hechenblaikner","G. Hechenblaikner, S.A. Morgan, E. Hodby, O.M. Marago, and C.J. Foot
  (Clarendon Laboratory, University of Oxford, UK)","Calculation of mode coupling for quadrupole excitations in a
  Bose-Einstein condensate","12 pages, 3 figures",,"10.1103/PhysRevA.65.033612",,"cond-mat.soft cond-mat.stat-mech",,"  In this paper we give a theoretical description of resonant coupling between
two collective excitations of a Bose condensed gas (BEC) on, or close, to a
second harmonic resonance. Using analytic expressions for the quasi-particle
wavefunctions we show that the coupling between quadrupole modes is strong,
leading to a coupling time of a few milliseconds (for a TOP trap with radial
frequency 100 Hz and 10^4 atoms). Using the hydrodynamic approximation, we
derive analytic expression for the coupling matrix element. These can be used
with an effective Hamiltonian (that we also derive) to describe the dynamics of
the coupling process and the associated squeezing effects.
","[{""version"":""v1"",""created"":""Mon, 21 May 2001 09:39:48 GMT""}]","2009-11-07"
"cond-mat/0105395","Vicente Garzo","Vicente Garz\'o and J. W. Dufty","Hydrodynamics for a granular binary mixture at low density","to be published in Physics of Fluids","Phys. Fluids 14, 1476-1490 (2002)","10.1063/1.1458007",,"cond-mat.soft",,"  Hydrodynamic equations for a binary mixture of inelastic hard spheres are
derived from the Boltzmann kinetic theory. A normal solution is obtained via
the Chapman-Enskog method for states near the local homogeneous cooling state.
The mass, heat, and momentum fluxes are determined to first order in the
spatial gradients of the hydrodynamic fields, and the associated transport
coefficients are identified. In the same way as for binary mixtures with
elastic collisions, these coefficients are determined from a set of coupled
linear integral equations. Practical evaluation is possible using a Sonine
polynomial approximation, and is illustrated here by explicit calculation of
the relevant transport coefficients: the mutual diffusion, the pressure
diffusion, the thermal diffusion, the shear viscosity, the Dufour coefficient,
the thermal conductivity, and the pressure energy coefficient. All these
coefficients are given in terms of the restitution coefficients and the ratios
of mass, concentration, and particle sizes. Interesting and new effects arise
from the fact that the reference states for the two components have different
partial temperatures, leading to additional dependencies of the transport
coefficients on the concentration. The results hold for arbitrary degree of
inelasticity and are not limited to specific values of the parameters of the
mixture. Applications of this theory will be discussed in subsequent papers.
","[{""version"":""v1"",""created"":""Mon, 21 May 2001 09:54:11 GMT""},{""version"":""v2"",""created"":""Wed, 5 Dec 2001 10:43:34 GMT""}]","2009-11-07"
"cond-mat/0105396","Agustin Perez-Madrid","J.M. Rubi and A. Perez-Madrid","Mesoscopic non-equilibrium thermodynamics approach to the dynamics of
  polymers","13 pages (RevTex). To be published in Physica A",,"10.1016/S0378-4371(01)00217-5",,"cond-mat.soft",,"  We present a general formalism able to derive the kinetic equations of
polymer dynamics. It is based on the application of nonequilibrium
thermodynamics to analyze the irreversible processes taking place in the
conformational space of the macromolecules. The Smoluchowski equation results
from the analysis of the underlying diffusion process in that space within the
scheme of nonequilibrium thermodynamics. We apply the method to different
situations, concerning flexible, semiflexible and rod-like polymers and to the
case of more concentrated solutions in which interactions become important.
","[{""version"":""v1"",""created"":""Mon, 21 May 2001 10:37:53 GMT""}]","2009-11-07"
"cond-mat/0105397","E. Penev","Evgeni Penev, Peter Kratzer, and Matthias Scheffler","Effect of strain on surface diffusion in semiconductor heteroepitaxy","10 pages, 8 figures, LaTeX2e, to appear in Phys. Rev. B (2001). Other
  related publications can be found at
  http://www.rz-berlin.mpg.de/th/paper.html",,"10.1103/PhysRevB.64.085401",,"cond-mat.mtrl-sci",,"  We present a first-principles analysis of the strain renormalization of the
cation diffusivity on the GaAs(001) surface. For the example of
In/GaAs(001)-c(4x4) it is shown that the binding of In is increased when the
substrate lattice is expanded. The diffusion barrier \Delta E(e) has a
non-monotonic strain dependence with a maximum at compressive strain values (e
< 0), while being a decreasing function for any tensile strain (e > 0) studied.
We discuss the consequences of spatial variations of both the binding energy
and the diffusion barrier of an adatom caused by the strain field around a
heteroepitaxial island. For a simplified geometry, we evaluate the speed of
growth of two coherently strained islands on the GaAs(001) surface and identify
a growth regime where island sizes tend to equalize during growth due to the
strain dependence of surface diffusion.
","[{""version"":""v1"",""created"":""Mon, 21 May 2001 11:32:35 GMT""}]","2009-11-07"
"cond-mat/0105398","Sami M. M. Virtanen","S. M. M. Virtanen, T. P. Simula, and M. M. Salomaa","Adiabaticity Criterion for Moving Vortices in Dilute Bose-Einstein
  Condensates","4 pages, 1 figure",,"10.1103/PhysRevLett.87.230403",,"cond-mat.stat-mech cond-mat.soft",,"  Considering a moving vortex line in a dilute atomic Bose-Einstein condensate
within time-dependent Hartree-Fock-Bogoliubov-Popov theory, we derive a
criterion for the quasiparticle excitations to follow the vortex core rigidly.
The assumption of adiabaticity, which is crucial for the validity of the
stationary self-consistent theories in describing such time-dependent
phenomena, is shown to imply a stringent criterion for the velocity of the
vortex line. Furthermore, this condition is shown to be violated in the recent
vortex precession experiments.
","[{""version"":""v1"",""created"":""Mon, 21 May 2001 12:25:31 GMT""}]","2009-11-07"
"cond-mat/0105399","Zsolt Gulacsi","Zs. Gulacsi, I. Orlik (University Debrecen, Department of Theoretical
  Physics)","New non-Fermi liquid type behavior given by a two-band system in normal
  phase","13 pages, 0 figures, Latex in .gz file, accepted for publication in
  Jour. of Phys. A. Letters",,,,"cond-mat.str-el",,"  We are reporting a new non-Fermi liquid type normal phase that has a well
defined Fermi energy, but without showing any non-regularity in the momentum
distribution function in the whole momentum space, the sharp Fermi momentum
concept being undefinable. The system contains a natural built in gap that is
visible in the physical properties of the system at nonzero temperatures. The
presence of a flat band in multiband interacting Fermi systems with more than
half filling is the key feature leading to such a ground state, which is not
restricted to one spatial dimension and emerges in the proximity of an
insulating phase.
","[{""version"":""v1"",""created"":""Mon, 21 May 2001 12:35:59 GMT""}]","2016-08-31"
"cond-mat/0105400","Daniel Sanchez-Portal","Daniel Sanchez-Portal, Julian D. Gale, Alberto Garcia, Richard M.
  Martin","Two distinct metallic bands associated with monatomic Au wires on the
  Si(557)-Au surface","5 pages with 3 postscript figures. Submitted to PRL on May 10th 2001","Physical Review B (Rapid Communications) 65, 81401 (2002)","10.1103/PhysRevB.65.081401",,"cond-mat.mtrl-sci cond-mat.str-el",,"  The Si(557)-Au surface, containing monatomic Au wires parallel to the steps,
has been proposed as an experimental realization of an ideal one-dimensional
metal. In fact, recent photoemission experiments on this system (Nature 402,
504 (1999)) found two peaks that were interpreted in terms of the spin-charge
separation in a Luttinger liquid. Our first-principles density functional
calculations reveal two metallic bands associated with Au-Si bonds, instead of
the single band expected from the Au 6s states, providing an alternative
explanation for the experimental observations.
","[{""version"":""v1"",""created"":""Mon, 21 May 2001 14:01:45 GMT""}]","2009-11-07"
"cond-mat/0105401","Erik Koch","Erik Koch and Stefan Goedecker","Locality properties and Wannier functions for interacting systems","9 pages with 3 eps figures, to be published in Solid State
  Communications","Solid State Communications 119, 105-109 (2001)","10.1016/S0038-1098(01)00192-2",,"cond-mat.str-el cond-mat.mtrl-sci",,"  We define Wannier functions for interacting systems, and show that the
results on the localization of the Wannier functions for non-interacting
systems carry over to the Wannier functions for interacting systems. In
addition we demonstrate that the characterization of metals and insulators by
the decay properties of their respective density matrices does not only apply
to non-interacting, but also to interacting systems. As a prototypical example
of a correlated system we investigate the one-dimensional Hubbard model. We
propose an expression for the density matrix of that model, and derive a
relation between the decay constant of the density matrix and the gap.
","[{""version"":""v1"",""created"":""Mon, 21 May 2001 14:17:24 GMT""}]","2009-11-07"
"cond-mat/0105402","Ingo Loa","K. Kunc, I. Loa, K. Syassen, R. K. Kremer, and K. Ahn","MgB_2 under pressure: phonon calculations, Raman spectroscopy, and
  optical reflectance","18 pages, 8 figures (EPS), revtex","J. Phys.: Condens. Matter 13, 9945--9962 (2001)","10.1088/0953-8984/13/44/310",,"cond-mat.supr-con",,"  The effect of pressure on optical phonon frequencies of MgB$_2$ has been
calculated using the frozen-phonon approach based on a pseudopotential method.
Gr\""uneisen parameters of the harmonic mode frequencies are reported for the
high-frequency zone-center $E_{2g}$ and $B_{1g}$ and the zone-boundary $E_{2u}$
and $B_{2u}$ modes at $A$. Anharmonic effects of phonon frequencies and the
implications of the calculated phonon frequency shifts for the pressure
dependence of the superconducting transition temperature of MgB$_2$ are
discussed. Also reported are Raman and optical reflectance spectra of MgB$_2$
measured at high pressures. The experimental observations in combination with
calculated results indicate that broad spectral features we observed in the
Raman spectra at frequencies between 500 and 900 cm$^{-1}$ cannot be attributed
to first-order scattering by zone-center modes, but originate in part from a
chemical species other than MgB$_2$ at the sample surface and in part from a
maximum in the MgB$_2$ phonon density of states. Low-temperature Raman spectra
taken at ambient pressure showed increased scattering intensity in the region
below 300 cm$^{-1}$.
","[{""version"":""v1"",""created"":""Mon, 21 May 2001 14:43:45 GMT""}]","2009-11-07"
"cond-mat/0105403","Oberholzer","S.Oberholzer, E.V.Sukhorukov, C.Strunk, C.Schoenenberger","Shot noise of series quantum point contacts intercalating chaotic
  cavities","4 pages, 5 figures","Phys.Rev. B66 (2002) 233304","10.1103/PhysRevB.66.233304",,"cond-mat.mes-hall astro-ph",,"  Shot noise of series quantum point contacts forming a sequence of cavities in
a two dimensional electron gas are studied theoretically and experimentally.
Noise in such a structure originates from local scattering at the point
contacts as well as from chaotic motion of the electrons in the cavities. We
found that the measured shot noise is in reasonable agreement with our
theoretical prediction taking the cavity noise into account.
","[{""version"":""v1"",""created"":""Mon, 21 May 2001 15:16:03 GMT""},{""version"":""v2"",""created"":""Sat, 14 Jul 2001 12:54:56 GMT""},{""version"":""v3"",""created"":""Tue, 11 Jun 2002 18:25:13 GMT""},{""version"":""v4"",""created"":""Mon, 16 Dec 2002 16:50:18 GMT""}]","2009-11-07"
"cond-mat/0105404","Igor Zaliznyak","I. A. Zaliznyak, J. M. Tranquada, R. Erwin, Y. Moritomo","Spin-entropy driven melting of the charge order in La1.5Sr0.5CoO4","4 pages, 4 figures","Phys. Rev. B 64, 195117 (2001)","10.1103/PhysRevB.64.195117",,"cond-mat.str-el",,"  We studied the melting of the charge order in the half-doped tetragonal
perovskite La1.5Sr0.5CoO4 by elastic neutron scattering. We found that diffuse
peaks, corresponding to the breathing-type modulation of oxygen positions in
the CoO6 octahedra, disappear above Tc = 825(27) K. This melting of the diffuse
superstructure is reversible (no change in the correlation lengths upon
annealing is observed) and accompanied by a large nonlinear thermal expansion
along the tetragonal c-axis, with a cusp at Tc. We conclude that quenched
disorder of the doped Sr ions is at the origin of this anisotropic charge glass
state. We also suggest that its melting is driven by the transition from the
intermediate- to the high-spin state of Co{3+} ion, which is favored by the
spin entropy at high T.
","[{""version"":""v1"",""created"":""Mon, 21 May 2001 15:59:29 GMT""}]","2010-07-28"
"cs/0105029","Uri Zwick","Eran Halperin, Ram Nathaniel and Uri Zwick","Coloring k-colorable graphs using relatively small palettes","16 pages, 2 figures. A preliminary version of this paper appeared in
  the proceedings the of 12th ACM-SIAM Symposium on Discrete Algorithm
  (SODA'01) under a slightly different title",,,,"cs.DS cs.CC cs.DM",,"  We obtain the following new coloring results:
  * A 3-colorable graph on $n$ vertices with maximum degree~$\Delta$ can be
colored, in polynomial time, using $O((\Delta \log\Delta)^{1/3} \cdot\log{n})$
colors. This slightly improves an $O((\Delta^{{1}/{3}}
\log^{1/2}\Delta)\cdot\log{n})$ bound given by Karger, Motwani and Sudan. More
generally, $k$-colorable graphs with maximum degree $\Delta$ can be colored, in
polynomial time, using $O((\Delta^{1-{2}/{k}}\log^{1/k}\Delta) \cdot\log{n})$
colors.
  * A 4-colorable graph on $n$ vertices can be colored, in polynomial time,
using $\Ot(n^{7/19})$ colors. This improves an $\Ot(n^{2/5})$ bound given again
by Karger, Motwani and Sudan. More generally, $k$-colorable graphs on $n$
vertices can be colored, in polynomial time, using $\Ot(n^{\alpha_k})$ colors,
where $\alpha_5=97/207$, $\alpha_6=43/79$, $\alpha_7=1391/2315$,
$\alpha_8=175/271$, ...
  The first result is obtained by a slightly more refined probabilistic
analysis of the semidefinite programming based coloring algorithm of Karger,
Motwani and Sudan. The second result is obtained by combining the coloring
algorithm of Karger, Motwani and Sudan, the combinatorial coloring algorithms
of Blum and an extension of a technique of Alon and Kahale (which is based on
the Karger, Motwani and Sudan algorithm) for finding relatively large
independent sets in graphs that are guaranteed to have very large independent
sets. The extension of the Alon and Kahale result may be of independent
interest.
","[{""version"":""v1"",""created"":""Mon, 21 May 2001 11:56:18 GMT""}]","2016-08-31"
"gr-qc/0105076","Gerald Vones","Gerald Vones","R0 Cosmology ?","11 pages, 1 figure",,,,"gr-qc",,"  It is postulated that the action of the FRW-universe is the cosmological term
of Einsteins theory (no curvature term - R0 Cosmology). The expansion equation
emerging from the embedding of this most simple brane world with variable speed
of light is deduced. The universal dimensionless coupling constant of gravity
is addressed. Some implications on the deep problems of cosmology are
discussed.
","[{""version"":""v1"",""created"":""Mon, 21 May 2001 13:09:13 GMT""}]","2007-05-23"
"gr-qc/0105077","Gil de Oliveira-Neto","G. Oliveira-Neto","Self-similar collapse of a massless scalar field in three-dimensions","Revtex version, 9 pages, 1 eps figure",,,,"gr-qc",,"  We study an analytical solution to the Einstein's equations in
2+1-dimensions, representing the self-similar collapse of a circularly
symmetric, minimally coupled, massless, scalar field. Depending on the value of
certain parameters, this solution represents the formation of black holes.
Since our solution is asymptotically flat, our black holes do not have the BTZ
space-time as their long time limit. They represent a new family of black holes
in 2+1-dimensions.
","[{""version"":""v1"",""created"":""Mon, 21 May 2001 14:11:59 GMT""}]","2007-05-23"
"hep-ex/0105057","Pablo Garcia-Abia","Pablo Garcia-Abia","Search for charged Higgs bosons in L3","4 pages, 4 figures, to be published in the proceedings of LEPTRE,
  XIII Convegno sulla Fisica al LEP (Rome, Italy)",,,,"hep-ex",,"  A search for pair-produced charged Higgs bosons is performed with the L3
detector at LEP using data collected at centre-of-mass energies between 200 and
209 GeV, corresponding to an integrated luminosity of 217.8 pb^-1. We observe
an excess of events in the H+-H -> cscs and cs\tau\nu channels in the mass
region around 68 GeV, which is most significant at low values of the H+ ->
\tau\nu branching ratio. Including data taken at lower centre-of-mass energies,
the excess is compatible with a 4.4\sigma fluctuation in the background.
Interpreting this excess as a statistical fluctuation in the background, lower
limits on the charged Higgs mass are derived at the 95% confidence level. They
vary from 67.1 to 84.9 GeV as a function of the H+ -> \tau\nu branching ratio.
These results are PRELIMINARY.
","[{""version"":""v1"",""created"":""Mon, 21 May 2001 10:44:38 GMT""}]","2007-05-23"
"hep-ex/0105058","Nicolo de Groot","Nicolo de Groot","Electroweak Results from SLD","4 pages, 2 figures. Uses Moriond.sty. Presentation at the Rencontres
  de Moriond, March 2001",,,"BRIS/HEP/2001-01","hep-ex",,"  In this paper we present three updates to heavy flavour results from the SLD
detector at SLAC. These results are preliminary, based on our full 1993-1998
dataset of 550 000 hadronic Z0 decays produced with an average electron
polarisation of 73%. The new measurements are of the hadronic branching
fractions into heavy quarks (Rb, Rc), the b quark asymmetry (Ab) using jet
charge, and the heavy quark asymmetries (Ab and Ac) using vertex charge and
kaons.
","[{""version"":""v1"",""created"":""Mon, 21 May 2001 15:18:49 GMT""},{""version"":""v2"",""created"":""Tue, 22 May 2001 12:40:32 GMT""}]","2007-05-23"
"hep-ph/0105204","Takahashi Keitaro","K.Takahashi, M.Watanabe, K.Sato and T.Totani","Effects of Neutrino Oscillation on the Supernova Neutrino Spectrum","10 pages, 14 figures, corrected version","Phys.Rev.D64:093004,2001","10.1103/PhysRevD.64.093004","UTAP-390/01,RESCEU-7/01","hep-ph astro-ph",,"  The effects of three-flavor neutrino oscillation on the supernova neutrino
spectrum are studied. We calculate the expected event rate and energy spectra,
and their time evolution at the Superkamiokande (SK) and the Sudbury Neutrino
Observatory (SNO), by using a realistic neutrino burst model based on numerical
simulations of supernova explosions. We also employ a realistic density profile
based on a presupernova model for the calculation of neutrino conversion
probability in supernova envelopes. These realistic models and numerical
calculations allow us to quantitatively estimate the effects of neutrino
oscillation in a more realistic way than previous studies. We then found that
the degeneracy of the solutions of the solar neutrino problem can be broken by
the combination of the SK and SNO detections of a future Galactic supernova.
","[{""version"":""v1"",""created"":""Mon, 21 May 2001 05:35:31 GMT""},{""version"":""v2"",""created"":""Sun, 15 Jul 2001 10:33:27 GMT""}]","2010-05-28"
"hep-ph/0105205","Eugene Levin","E.Levin (Tel Aviv U.)","Saturation at low $x$","31pp.,22 pictures, paper for THERA book",,,"TAUP - 2681-2001","hep-ph",,"  This talk is an attempt to review all our knowledge on saturation at low $x$
both theoretical and experimental, to stimulate a search for saturation effects
at THERA. The main goals of this presentation are 1. To discuss an intuitive
picture of the deep inelastic scattering that leads to the saturation of the
parton densities;
  2. To show that the saturation hypothesis has solid theoretical proof;
  3. To report on the theoretical progress that has been made over the past two
years in high parton density QCD, and on the property of the saturation phase
that emerges from the theory that has been developed;
  4. To collect all that we know theoretically and experimentally about the
saturation scale $Q_s(x)$ .
","[{""version"":""v1"",""created"":""Mon, 21 May 2001 08:38:42 GMT""}]","2007-05-23"
"hep-ph/0105206","Piotr Zenczykowski","P. Zenczykowski (Institute of Nuclear Physics, Krakow, Poland)","Weak Radiative Decays of Hyperons: Quark Model and Nonlocality","Revised with minor changes; 31 LaTeX pages, 1 .ps figure; to appear
  in Acta Phys. Pol. B","Acta Phys.Polon. B33 (2002) 1253-1276",,,"hep-ph hep-ex quant-ph",,"  It is proved that symmetry structure of the parity-viol. (p.v.) amplitudes of
weak radiative hyperon decays in the VMD approach, and the violation of Hara's
theorem in particular, are also obtained when direct coupling e_q
\bar{q}\gamma_{\mu}q A^{\mu} of photon to quarks is used in place of VMD. Thus,
violation of Hara's theorem in VMD-based models does not result from the lack
of gauge invariance. It is further shown that, in the static limit of the quark
model, the CA commutator term in the p.v. amplitudes of nonleptonic hyperon
decays (NLHD) and the parity-violating \Sigma ^+ \to p \gamma decay amplitude
are proportional to each other. As a result, Hara's theorem may be satisfied in
this limit if and only if the contribution from the CA commutator in NLHD is
zero. Violation of Hara's theorem is traced back to the nonlocality of quark
model states in the static limit. It is argued that the ensuing intrinsic
baryon nonlocality does not have to be unphysical. It is stressed that the \Xi
^0 \to \Lambda \gamma asymmetry will provide very important information
concerning the presence or absence of nonlocal features in p.v. photon coupling
to baryons at vanishing photon momentum. If the \Xi ^0 \to \Lambda \gamma
asymmetry is found negative, Hara's theorem is satisfied but the
gauge-invariant quark model machinery predicting its violation must miss some
contribution, or be modified. If experiment confirms positive \Xi ^0 \to
\Lambda \gamma asymmetry, then, most likely, Hara's theorem is violated.
Although positive \Xi ^0 \to \Lambda \gamma asymmetry admits of the possibility
that Hara's theorem is satisfied, this alternative is in disagreement with
hints suggested by the similarity of photon and vector-meson couplings and the
observed size of p.v. nuclear forces.
","[{""version"":""v1"",""created"":""Mon, 21 May 2001 10:01:20 GMT""},{""version"":""v2"",""created"":""Wed, 19 Dec 2001 15:48:07 GMT""}]","2007-05-23"
"hep-ph/0105207","John Collins","J.C. Collins and J. Pumplin","Tests of goodness of fit to multiple data sets","22 pages, 8 figures",,,"DESY-01-014","hep-ph",,"  We propose a new and rather stringent criterion for testing the goodness of
fit between a theory and experiment. It is motivated by the paradox that the
criterion on \chi^2 for testing a theory is much weaker than the criterion for
finding the best fit value of a parameter in the theory. We present a method by
which the stronger parameter-fitting criterion can be applied to subsets of
data in a global fit.
","[{""version"":""v1"",""created"":""Mon, 21 May 2001 13:13:58 GMT""}]","2007-05-23"
"hep-ph/0105208",,"I.V.Andreev (Lebedev Phys. Inst.)","Two-photon correlations as a sign of sharp transition in quark-gluon
  plasma","23 pages, 2 figures","Phys.Atom.Nucl.65:1908-1917,2002; Yad.Fiz.65:1961-1971,2002","10.1134/1.1515855","TD/2001-9","hep-ph",,"  The photon production arising due to time variation of the medium has been
considered. The Hamilton formalism for photons in time-variable medium (plasma)
has been developed with application to inclusive photon production. The results
have been used for calculation of the photon production in the course of
transition from quark-gluon phase to hadronic phase in relativistic heavy ion
collisions. The relative strength of the effect as well as specific two- photon
correlations have been evaluated. It has been demonstrated that the opposite
side two-photon correlations are indicative of the sharp transition from the
quark-gluon phase to hadrons.
","[{""version"":""v1"",""created"":""Mon, 21 May 2001 12:34:54 GMT""}]","2014-11-17"
"hep-ph/0105209","Alexei Prokudin","V. A. Petrov, A. V. Prokudin","The First Three Pomerons","26 pages, 16 figures","Eur.Phys.J.C23:135-143,2002","10.1007/s100520100838",,"hep-ph",,"  A model of a three Pomeron contribution to high energy elastic $pp$ and $\bar
p p$ scattering is proposed. The data are well described for all momenta
($0.01\le |t|\le 14. GeV^2$) and energies ($8.\le\sqrt{s}\le 1800. GeV$)
($\chi^2/{\rm d.o.f.}=2.74$). The model predicts the appearance of two dips in
the differential cross-section which will be measured at LHC. The parameters of
the Pomeron trajectories are: $\alpha(0)_{{\Bbb P}_1}=1.058, \alpha'(0)_{{\Bbb
P}_1}=0.560 (GeV^{-2});$ $\alpha(0)_{{\Bbb P}_2}=1.167, \alpha'(0)_{{\Bbb
P}_2}=0.273 (GeV^{-2});$ $\alpha(0)_{{\Bbb P}_3}=1.203, \alpha'(0)_{{\Bbb
P}_3}=0.094 (GeV^{-2}).$
","[{""version"":""v1"",""created"":""Mon, 21 May 2001 12:47:52 GMT""}]","2011-09-13"
