"hep-ph/0105210","Kazutaka Sudoh","Kazutaka Sudoh, Han-Wen Huang, and Toshiyuki Morii (Kobe Univ.)","Electroproduction of psi' and polarized gluon distribution in a proton","9 pages, 6 figures","Phys.Lett.B515:99-104,2001","10.1016/S0370-2693(01)00843-7","KOBE-FHD-01-04","hep-ph",,"  In order to get information about the polarized gluon distribution in a
proton, we studied the electroproduction of \psi' in polarized electron and
polarized proton collisions in the framework of the NRQCD factorization
approach. The value of the cross section d\Delta\sigma / dp_T^2 for color-octet
mechanism is about 5 times larger than that for color-singlet one, and it might
be another test of the color-octet model if the polarized gluon distribution
\Delta g(x) is well known. Furthermore, we found that this reaction is quite
effective for testing the model of gluon polarization by measuring the double
spin asymmetry A_{LL} for the initial electron and proton. Though the shape of
p_T^2 distribution of A_{LL} is quite similar for the production mechanism with
color-octet and color-singlet, we can see a big difference in A_{LL} among
various models of the polarized gluon distribution function \Delta g(x).
","[{""version"":""v1"",""created"":""Mon, 21 May 2001 13:24:03 GMT""}]","2011-03-23"
"hep-ph/0105211","Rafel Escribano","R. Escribano, J.-M. Frere, D. Monderen, V. Van Elewyck","Insights on neutrino lensing","15 pages, 4 figures, to be published in Phys. Lett. B","Phys.Lett. B512 (2001) 8-17","10.1016/S0370-2693(01)00686-4","LNF-01/011(P), ULB-TH/01-01","hep-ph astro-ph hep-ex",,"  We discuss the gravitational lensing of neutrinos by astrophysical objects.
Unlike photons, neutrinos can cross a stellar core; as a result, the lens
quality improves. We also estimate the depletion of the neutrino flux after
crossing a massive object and the signal amplification expected. While Uranians
alone would benefit from this effect in the Sun, similar effects could be
considered for binary systems.
","[{""version"":""v1"",""created"":""Mon, 21 May 2001 14:14:18 GMT""}]","2009-11-07"
"hep-ph/0105212","Walter Grimus","W. Grimus, L. Lavoura","Softly broken lepton numbers and maximal neutrino mixing","Latex, 15 pages; two references added and minor changes in the text;
  final version accepted for publication in JHEP","JHEP 0107:045,2001","10.1088/1126-6708/2001/07/045","UWThPh-2001-21","hep-ph",,"  We consider lepton mixing in an extension of the Standard Model with three
right-handed neutrino singlets. We require that the three lepton numbers L_e,
L_\mu, and L_\tau be separately conserved in the Yukawa couplings, and we
assume that they are softly broken only by the Majorana mass matrix M_R of the
neutrino singlets. In this framework, where lepton-number breaking occurs at a
scale much higher than the electroweak scale, deviations from
family-lepton-number conservation are calculable and finite, and lepton mixing
stems exclusively from M_R. We then show that a discrete symmetry exists such
that, in the lepton mixing matrix U, maximal atmospheric neutrino mixing
together with U_{e3}=0 can be obtained naturally. Alternatively, if one assumes
that there are two different scales in M_R and that the lepton number \bar L =
L_e - L_\mu - L_\tau is conserved in between them, then maximal solar neutrino
mixing follows naturally. If both the discrete symmetry and intermediate \bar L
conservation are introduced, bimaximal mixing is achieved.
","[{""version"":""v1"",""created"":""Mon, 21 May 2001 15:41:01 GMT""},{""version"":""v2"",""created"":""Tue, 14 Aug 2001 10:24:08 GMT""}]","2010-02-03"
"hep-th/0105187","Valentin Khoze","Chong-Sun Chu, Valentin V. Khoze, Gabriele Travaglini (Durham)","Dynamical Breaking of Supersymmetry in Noncommutative Gauge Theories","12 pages, 1 figure; v2, reference added","Phys.Lett. B513 (2001) 200-206","10.1016/S0370-2693(01)00733-X",,"hep-th hep-ph",,"  We propose a new mechanism of spontaneous supersymmetry breaking in
noncommutative gauge theories. We find that in N=1 noncommutative gauge
theories both supersymmetry and gauge invariance are dynamically broken.
Supersymmetry is broken spontaneously by a Fayet-Iliopoulos D-term which
naturally arises in a noncommutative U(n) theory. For a non-chiral matter
content the Fayet-Iliopoulos term is not renormalized and its tree-level value
can be chosen to be much smaller than the relevant string/noncommutativity
scale. In the low energy theory, the noncommutative U(n) gauge symmetry is
broken down to a commutative U(1) x SU(n). This breaking is triggered by the
IR/UV mixing and manifests itself at and below the noncommutativity mass scale
M_{NC}\sim \theta^{-1/2}. In particular, the U(1) degrees of freedom decouple
from the SU(n) in the infrared and become arbitrarily weakly coupled, thus
playing the role of the hidden sector for supersymmetry breaking.
","[{""version"":""v1"",""created"":""Mon, 21 May 2001 14:58:25 GMT""},{""version"":""v2"",""created"":""Tue, 7 Aug 2001 08:27:06 GMT""}]","2009-11-07"
"hep-th/0105190","Robert Marnelius","Igor Batalin, Robert Marnelius","Generalized Poisson sigma models","8 pages, Latexfile, added comment and references","Phys.Lett. B512 (2001) 225-229","10.1016/S0370-2693(01)00720-1",,"hep-th",,"  A general master action in terms of superfields is given which generates
generalized Poisson sigma models by means of a natural ghost number
prescription. The simplest representation is the sigma model considered by
Cattaneo and Felder. For Dirac brackets considerably more general models are
generated.
","[{""version"":""v1"",""created"":""Mon, 21 May 2001 09:05:21 GMT""},{""version"":""v2"",""created"":""Tue, 22 May 2001 07:50:23 GMT""},{""version"":""v3"",""created"":""Wed, 6 Jun 2001 09:21:13 GMT""},{""version"":""v4"",""created"":""Wed, 13 Jun 2001 06:25:19 GMT""}]","2009-11-07"
"hep-th/0105192","Andrea Pasqua","D. Brace, B. L. Cerchiai, A. F. Pasqua, U. Varadarajan, B. Zumino","A Cohomological Approach to the Non-Abelian Seiberg-Witten Map","18 pages. References added and some misprints corrected","JHEP 0106:047,2001","10.1088/1126-6708/2001/06/047",,"hep-th",,"  We present a cohomological method for obtaining the non-Abelian
Seiberg-Witten map for any gauge group and to any order in theta. By
introducing a ghost field, we are able to express the equations defining the
Seiberg-Witten map through a coboundary operator, so that they can be solved by
constructing a corresponding homotopy operator.
","[{""version"":""v1"",""created"":""Mon, 21 May 2001 11:14:41 GMT""},{""version"":""v2"",""created"":""Tue, 19 Jun 2001 22:34:01 GMT""}]","2010-02-03"
"hep-th/0105194","Nicholas Warner","Tohru Eguchi, Nicholas P. Warner and Sung-Kil Yang","ADE Singularities and Coset Models","41 pages; harvmac","Nucl.Phys.B607:3-37,2001","10.1016/S0550-3213(01)00263-2","CITUSC/01-017; USC-01/01","hep-th",,"  We consider the compactification of the IIA string to (1+1) dimensions on
non-compact 4-folds that are ALE fibrations. Supersymmetry requires that the
compactification include 4-form fluxes, and a particular class of these models
has been argued by Gukov, Vafa and Witten to give rise to a set of perturbed
superconformal coset models that also have a Landau-Ginzburg description. We
examine all these ADE models in detail, including the exceptional cosets. We
identify which perturbations are induced by the deformation of the singularity,
and compute the Landau-Ginzburg potentials exactly. We also show how the the
Landau-Ginzburg fields and their superpotentials arise from the geometric data
of the singularity, and we find that this is most naturally described in terms
of non-compact, holomorphic 4-cycles.
","[{""version"":""v1"",""created"":""Sun, 20 May 2001 19:16:40 GMT""}]","2014-11-18"
"hep-th/0105195","Vladimir Kazakov","Vladimir A. Kazakov","Vortex condensation and black hole in the matrix model of 2-d string
  theory","12 pages, talk presented at Strings 2001, Mumbai, India",,,,"hep-th",,"  We review recent results in the matrix model approach to the 2-d non-critical
string theory compactified in time, in the phase of condensation of the world
sheet vortices (above the Berezinski-Kosterlitz-Thouless phase transition).
This phase is known to describe strings on the 2-d black hole background, due
to the conjecture of V.Fateev, A. and Al.Zamolodchikov. The corresponding
matrix model has an integrable Toda structure which allows to compute many
interesting physical quantities, such as string partition functions of various
genera and the 1- and 2-point correlators of vorticities of arbitrary charges.
","[{""version"":""v1"",""created"":""Sun, 20 May 2001 21:27:48 GMT""}]","2007-05-23"
"hep-th/0105196","Shogo Tanimura","Seiho Matsumoto, Makoto Sakamoto, Shogo Tanimura","Spontaneous breaking of the rotational symmetry induced by monopoles in
  extra dimensions","12 pages, LaTeX2e, no figures","Phys.Lett.B518:163-170,2001","10.1016/S0370-2693(01)01053-X","KOBE-TH-01-03","hep-th",,"  We propose a field theoretical model that exhibits spontaneous breaking of
the rotational symmetry. The model has a two-dimensional sphere as extra
dimensions of the space-time and consists of a complex scalar field and a
background gauge field. The Dirac monopole, which is invariant under the
rotations of the sphere, is taken as the background field. We show that when
the radius of the sphere is larger than a certain critical radius, the vacuum
expectation value of the scalar field develops vortices, which pin down the
rotational symmetry to lower symmetries. We evaluate the critical radius and
calculate configurations of the vortices by the lowest approximation. The
original model has a $U(1) \times SU(2)$ symmetry and it is broken to U(1),
U(1), D_3 for each case of the monopole number q = 1/2, 1, 3/2, respectively,
where D_3 is the symmetry group of a regular triangle. Moreover, we show that
the vortex configurations are stable against higher corrections of the
perturbative approximation.
","[{""version"":""v1"",""created"":""Mon, 21 May 2001 07:30:46 GMT""},{""version"":""v2"",""created"":""Tue, 22 May 2001 08:43:27 GMT""}]","2010-11-19"
"hep-th/0105197","Ryu Sasaki","V. I. Inozemtsev and R. Sasaki","Hierarchies of Spin Models related to Calogero-Moser Models","12pages, LaTeX2e, packages used: pstricks, pst-node, pstcol, if these
  are not available, an eps file will be sent upon request","Nucl.Phys. B618 (2001) 689-698","10.1016/S0550-3213(01)00491-6","YITP-01-42","hep-th cond-mat math-ph math.MP nlin.SI",,"  The universal formulation of spin exchange models related to Calogero-Moser
models implies the existence of integrable hierarchies, which have not been
explored. We show the general structures and features of the spin exchange
model hierarchies by taking as examples the well-known Heisenberg spin chain
with the nearest neighbour interactions. The energy spectra of the second
member of the hierarchy belonging to the models based on the $A_r$ root systems
$(r=3,4,5)$ are explicitly and {\em exactly} evaluated. They show many many
interesting features and in particular, much higher degree of degeneracy than
the original Heisenberg model, as expected from the integrability.
","[{""version"":""v1"",""created"":""Mon, 21 May 2001 05:01:48 GMT""}]","2009-11-07"
"hep-th/0105198","Y. M. Cho","Y. M. Cho, H. W. Lee, D. G. Pak","Faddeev-Niemi Conjecture and Effective Action of QCD","6 pages","Phys.Lett. B525 (2002) 347-354","10.1016/S0370-2693(01)01450-2",,"hep-th",,"  We calculate a one loop effective action of SU(2) QCD in the presence of the
monopole background, and find a possible connection between the resulting QCD
effective action and a generalized Skyrme-Faddeev action of the non-linear
sigma model. The result is obtained using the gauge-independent decomposotion
of the gauge potential into the topological degrees which describes the
non-Abelian monopoles and the local dynamical degrees of the potential, and
integrating out all the dynamical degrees of QCD.
","[{""version"":""v1"",""created"":""Mon, 21 May 2001 05:02:16 GMT""}]","2009-11-07"
"hep-th/0105199","Paul Steinhardt","Ron Y. Donagi, Justin Khoury, Burt A. Ovrut, Paul J. Steinhardt and
  Neil Turok","Visible Branes with Negative Tension in Heterotic M-Theory","30 pages","JHEP 0111:041,2001","10.1088/1126-6708/2001/11/041",,"hep-th astro-ph hep-ph",,"  It is shown that there exist large classes of BPS vacua in heterotic M-theory
which have negative tension on the visible orbifold plane, positive tension on
the hidden plane and positive tension, physical five-branes in the bulk space.
Explicit examples of such vacua are presented. Furthermore, it is demonstrated
that the ratio, beta/|alpha|, of the bulk five-brane tension to the visible
plane tension can, for several large classes of such vacua, be made arbitrarily
small. Hence, it is straightforward to find vacua with the properties required
in the examples of the Ekpyrotic theory of cosmology - a visible brane with
negative tension and beta/|alpha| small. This contradicts recent claims in the
literature.
","[{""version"":""v1"",""created"":""Mon, 21 May 2001 05:02:41 GMT""}]","2009-11-07"
"hep-th/0105201","Mihai Visinescu","Ion I. Cot\u{a}escu, Mihai Visinescu","Non-existence of f-symbols in generalized Taub-NUT spacetimes","8 pages, latex, no figures; minor corrections; version to appear in
  J.Phys.A: Math.Gen","J.Phys.A34:6459-6464,2001","10.1088/0305-4470/34/33/310",,"hep-th gr-qc math-ph math.MP",,"  In a previous article it was proved that the extensions of the Taub-NUT
geometry do not admit Killing-Yano tensors, even if they possess St\""
{a}ckel-Killing tensors. Here the analysis is taken further, and it is shown
that, in general, this class of metrics does not even admit f-symbols. The only
exception is the original Taub-NUT metric which possesses four Killing-Yano
tensors of valence two.
","[{""version"":""v1"",""created"":""Mon, 21 May 2001 07:33:40 GMT""},{""version"":""v2"",""created"":""Tue, 10 Jul 2001 07:02:00 GMT""}]","2008-11-26"
"hep-th/0105202","Nobuhito Maru","Nobuhito Maru","SUSY Breaking by Coexisting Walls","6 pages, 2 EPS figures, LaTeX2e, Pararell session talk presented at
  Eighth International Symposium on Particles, Strings and Cosmology (PASCOS
  2001), University of North Carolina at Chapel Hill, April 10-15, 2001,
  Reference added",,,"UT-941","hep-th",,"  Supersymmetry (SUSY) breaking without messenger fields is proposed. We assume
that our world is on a wall and SUSY is broken only by the coexistence of
another wall with some distance from our wall. The Nambu-Goldstone (NG) fermion
is localized on the distant wall. Its overlap with the wave functions of
physical fields on our wall gives the mass splitting of physical fields on our
wall thanks to a low-energy theorem. We propose that this overlap provides a
practical method to evaluate mass splitting in models with SUSY breaking due to
the coexistence of walls.
","[{""version"":""v1"",""created"":""Mon, 21 May 2001 07:46:15 GMT""},{""version"":""v2"",""created"":""Thu, 24 May 2001 07:42:19 GMT""}]","2007-05-23"
"hep-th/0105203","Sviatoslav Solganik","G. Dvali, Q. Shafi and S. Solganik","D-brane Inflation","Talk given by Q.S. at the workshop in Heidelberg (April 4-7, 2001),
  and at the EURESCO conference in Le Londe (France) May 11-16, 2001. 12pp",,,,"hep-th astro-ph hep-ph",,"  We discuss a calculable version of brane inflation, in which a set of
parallel D-brane and anti-D-brane worlds, initially displaced in extra
dimension, slowly attract each other. In the effective four-dimensional theory
this slow motion of branes translates into a slow-roll of a scalar field
(proportional to their separation) with a flat potential that drives inflation.
The number of possible e-foldings is severely constrained. The scalar spectral
index is found to be 0.97, while the effective compactification scale is of
order $10^{12}$ GeV. Reheating of the Universe is provided by collision and
subsequent annihilation of branes.
","[{""version"":""v1"",""created"":""Mon, 21 May 2001 14:34:36 GMT""}]","2007-05-23"
"math-ph/0105028","Jamal Berakdar","Jamal Berakdar","Many-body scattering theory of electronic systems",,,,,"math-ph math.MP physics.atom-ph",,"  This work reviews recent advances in the analytical treatment of the
continuum spectrum of correlated few-body non-relativistic Coulomb systems. The
exactly solvable two-body problem serves as an introduction to the
non-separable three-particle system. For the latter case we discuss the
existence of an approximate separability of the long and the short-range
dynamics which is exposed in an appropriately chosen curvilinear coordinates.
  The three-body wave functions of the long-ranged part of the Hamiltonian are
derived and methods are presented to account approximately for the short-ranged
dynamics. Furthermore, we present a generalization of the methods employed for
the derivation of the three-body wave functions to the scattering states of $N$
charged particles.
  To deal with thermodynamic properties of finite systems we develop and
discuss a recent Green function methodology designed for the non-perturbative
regime.
  In addition, we give a brief account on how thermodynamic properties and
critical phenomena can be exposed in finite interacting systems.
","[{""version"":""v1"",""created"":""Mon, 21 May 2001 12:54:53 GMT""}]","2007-05-23"
"math/0105166","Gianluca occhetta","Gianluca Occhetta and Jaroslaw A. Wisniewski","On Euler-Jaczewski sequence and Remmert-Van de Ven problem for toric
  varieties","8 pages, added important references",,,,"math.AG",,"  Let X be a complete toric variety and let Y be a smooth projective variety
with Picard number one. We prove that, if there exists a surjective morphism
from X to Y, then Y is a projective space.
","[{""version"":""v1"",""created"":""Mon, 21 May 2001 07:21:04 GMT""},{""version"":""v2"",""created"":""Thu, 24 May 2001 09:50:38 GMT""}]","2009-09-25"
"math/0105167","Antonino Del Popolo","Xing Li (1), Ying Liu (2) and Antonino Del Popolo (3 and 4 and 5) ((1)
  CORA, Department of Applied Mathematics, Dalian University of Technology, (2)
  Division of Software, Legend Computer Company, Beijing, China, (3) Department
  of Mathematics, University of Bergamo, Italy, (4) Department of Physics,
  Bogazici University, Istanbul, Turkey, (5) Feza Gursey Institute, Istanbul,
  Turkey)","C++ Codes of Implicit Lu Algorithms for Absdll01","23 pages; report for the III international conference on ABS methods;
  CAS (Chinese Accademy of Sciences), Beijing, 13-14/05/2001",,,"formerly math.SC/0105167","math.NA astro-ph",,"  This report is devoted to some C++ codes implementing the implicit LU class
algorithms for solving linear determined, and undetermined systems with $n$
variables and $m$ equations. A main program used in part of the numerical test
is given in the last section.
","[{""version"":""v1"",""created"":""Mon, 21 May 2001 08:26:03 GMT""}]","2007-05-23"
"math/0105168","Antonino Del Popolo","Hai-Shan Han (1), Zun-Quan Xia (2) and Antonino Del Popolo (3 and 4
  and 5) ((1) CORA, Department of Applied Mathematics, Dalian University of
  Technology, (2) Division of Software, Legend Computer Company, Beijing,
  China, (3) Department of Mathematics, University of Bergamo, Italy, (4)
  Department of Physics, Bogazici University, Istanbul, Turkey, (5) Feza Gursey
  Institute, Istanbul, Turkey)","An ABS Algorithm for a Class of Systems of Stochastic Linear Equations","17 pages; report for the III international conference on ABS methods;
  CAS (Chinese Accademy of Sciences), Beijing, 13-14/05/2001",,,"formerly math.SC/0105168","math.NA astro-ph",,"  This paper is to explore a model of the ABS Algorithms for dealing with a
class of systems of linear stochastic equations A xi=eta satisfying eta sim
N_m(v, I_{m}). It is shown that the iteration step alpha_{i} is N(V,\pi) and
approximation solutions is xi_{i} \sim N_n(U,\Sigma) for this algorithm model.
And some properties of (V,\pi)$ and $(U,\Sigma) are given.
","[{""version"":""v1"",""created"":""Mon, 21 May 2001 08:43:39 GMT""}]","2007-05-23"
"math/0105169","Mina Teicher","Mina Teicher","BMT Invariants of Surfaces and 4-Manifolds","11 pages, 1 figure",,,,"math.AG math.GT",,"  In this paper we present the Braid Monodromy Type (BMT) of curves and
surfaces; past, present and future. The BMT is an invariant that can
distinguish between non-isotopic curves; between different families of surfaces
of general type; between connected components of moduli space of surfaces and
between non symplectmorphic 4-manifolds. BMT is a finer invariant than the
Sieberg-Witten invariants. Consider 2 simply connected surfaces of general type
with the same Chern classes. It is known that if they are in the same
deformation class, they are diffeomorphic to each other. Are there computable
invariants distinguishing between these 2 classes? The new invariant, proposed
here, is located between the 2 classes. In this paper we shall introduce the
new invariant, state the current results and pose an open question.
","[{""version"":""v1"",""created"":""Mon, 21 May 2001 15:20:20 GMT""}]","2007-05-23"
"nlin/0105045","Janne V. Kujala","Janne V. Kujala, Tuomas J. Lukka","Exact limiting solutions for certain deterministic traffic rules","25 pages, 8 figures",,,,"nlin.CG",,"  We analyze the steady-state flow as a function of the initial density for a
class of deterministic cellular automata rules (``traffic rules'') with
periodic boundary conditions [H. Fuks and N. Boccara, Int. J. Mod. Phys. C 9, 1
(1998)]. We are able to predict from simple considerations the observed,
unexpected cutoff of the average flow at unity. We also present an efficient
algorithm for determining the exact final flow from a given finite initial
state. We analyze the behavior of this algorithm in the infinite limit to
obtain for R_m,k an exact polynomial equation maximally of 2(m+k)th degree in
the flow and density.
","[{""version"":""v1"",""created"":""Mon, 21 May 2001 14:03:33 GMT""}]","2007-05-23"
"nlin/0105046","Susan Kurien","Susan Kurien and Katepalli R. Sreenivasan","Dynamical equations for high-order structure functions, and a comparison
  of a mean field theory with experiments in three-dimensional turbulence","16 pages, 23 figures",,"10.1103/PhysRevE.64.056302",,"nlin.CD",,"  Two recent publications [V. Yakhot, Phys. Rev. E {\bf 63}, 026307, (2001) and
R.J. Hill, J. Fluid Mech. {\bf 434}, 379, (2001)] derive, through two different
approaches that have the Navier-Stokes equations as the common starting point,
a set of steady-state dynamic equations for structure functions of arbitrary
order in hydrodynamic turbulence. These equations are not closed. Yakhot
proposed a ""mean field theory"" to close the equations for locally isotropic
turbulence, and obtained scaling exponents of structure functions and an
expression for the tails of the probability density function of transverse
velocity increments. At high Reynolds numbers, we present some relevant
experimental data on pressure and dissipation terms that are needed to provide
closure, as well as on aspects predicted by the theory. Comparison between the
theory and the data shows varying levels of agreement, and reveals gaps
inherent to the implementation of the theory.
","[{""version"":""v1"",""created"":""Sun, 20 May 2001 23:32:38 GMT""}]","2009-11-07"
"nucl-ex/0105014","Gabor David","G. David, PHENIX Collaboration","Neutral Pion Distributions in PHENIX at RHIC","6 pages, 3 figures","Nucl.Phys.A698:227-232,2002","10.1016/S0375-9474(01)01368-9",,"nucl-ex",,"  Transverse momentum spectra for identified $\pi^0$'s in the range 1 GeV/c $<
p_T <$ 4 GeV/c have been measured by the PHENIX experiment in Au-Au collisions
at $\sqrt{s}=130$ GeV. The spectra from peripheral nuclear collisions are
consistent with the simple expectation of scaling the spectra from p+p
collisions by the average number of nucleon-nucleon binary collisions. The
spectra from central collisions and the ratio of central/peripheral spectra are
significantly suppressed when compared to point-like scaling.
","[{""version"":""v1"",""created"":""Mon, 21 May 2001 13:51:20 GMT""}]","2010-05-28"
"nucl-ex/0105015","Inkyu Park","Inkyu Park, The PHOBOS Collaboration","Charged particle flow measurement for $|\eta|<5.3$ with the PHOBOS
  detector","Contribution to the Quark Matter 2001 conference proceedings","Nucl.Phys.A698:564-567,2002","10.1016/S0375-9474(01)01429-4",,"nucl-ex",,"  The measurement of elliptic flow for charged particles in Au-Au collisions at
$\sqrt{s_{_{NN}}} = 130$ GeV using the PHOBOS detector at the Relativistic
Heavy Ion Collider (RHIC) is presented. Charge particle distributions over a
wide pseudo-rapidity region ($|\eta|<5.3$) are measured by the PHOBOS silicon
multiplicity detectors. These distributions are used to extract the final-state
azimuthal anisotropy. The centrality and pseudo-rapidity dependences of
elliptic flow, averaged over momenta on an event-by-event basis and particle
species, are discussed.
","[{""version"":""v1"",""created"":""Mon, 21 May 2001 15:38:31 GMT""}]","2010-05-28"
