"astro-ph/0106007","David P. Huenemoerder","David P. Huenemoerder, Claude R. Canizares, and Norbert S. Schulz","X-Ray Spectroscopy of II Pegasi: Coronal Temperature Structure,
  Abundances, and Variability","25 pages, 5 figures, 3 tables, accepted by ApJ (scheduled for the
  v559 n2 p1 Oct 1, 2001 issue)",,"10.1086/322419",,"astro-ph",,"  We have obtained high resolution X-ray spectra of the coronally active
binary, II Pegasi (HD 224085), covering the wavelength range of 1.5-25
Angstroms. For the first half of our 44 ksec observation, the source was in a
quiescent state with constant X-ray flux, after which it flared, reaching twice
the quiescent flux in 12 ksec, then decreasing. We analyze the emission-line
spectrum and continuum during quiescent and flaring states. The differential
emission measure derived from lines fluxes shows a hot corona with a continuous
distribution in temperature. During the non-flare state, the distribution peaks
near log T = 7.2, and when flaring, near 7.6. High-temperature lines are
enhanced slightly during the flare, but most of the change occurs in the
continuum. Coronal abundance anomalies are apparent, with iron very deficient
relative to oxygen and significantly weaker than expected from photospheric
measurements, while neon is enhanced relative to oxygen. We find no evidence of
appreciable resonant scattering optical depth in line ratios of iron and
oxygen. The flare light curve is consistent with Solar two-ribbon flare models,
but with a very long reconnection time-constant of about 65 ks. We infer loop
lengths of about 0.05 stellar radii, to about 0.25 in the flare, if the flare
emission originated from a single, low-density loop.
","[{""version"":""v1"",""created"":""Fri, 1 Jun 2001 21:14:37 GMT""}]","2009-11-06"
"astro-ph/0106011","Kazushi Sakamoto","Kazushi Sakamoto (NRO, CfA), Hiroyuki Fukuda (NAOJ), Keiichi Wada
  (NAOJ) and Asao Habe (Hokkaido Univ.)","Millimetric Observations of the Center of M81 : A Starved Nucleus with
  Intraday Variability","25 pages, 8 figures (2 of them bitmapped), to appear in AJ (Sept.
  2001), for full ps file see http://th.nao.ac.jp/~wada/m81/",,"10.1086/322111",,"astro-ph",,"  The central kiloparsec of M81 has been observed in the CO(J=1-0) line and the
3 mm continuum at 100 pc resolution in an attempt to probe molecular gas, and
to search for the nuclear inner Lindblad resonance (NILR), around the
low-luminosity AGN M81*. We found the following. (1) Molecular gas in the
central kpc is mainly on a ``pseudoring'' or a spiral arm at a radius of about
500 pc. (2) The region within ~300 pc from the nucleus is mostly devoid of
molecular gas except for diffuse one; in particular, there is neither a giant
molecular cloud that is now accreting on the nucleus nor a conspicuous gas
feature that can be identified as an NILR. (3) The 3 mm continuum emission
shows significant intraday variation, suggesting an emitting region of ~100 AU.
(4) The 3-sigma upper limit for CO absorption toward the continuum source is
tau_CO(0->1) dV < 0.1 for a linewidth of 10 km/s. The dearth of accreting
molecular gas in the vicinity of the nucleus may explain the low luminosity of
M81*.
","[{""version"":""v1"",""created"":""Fri, 1 Jun 2001 22:21:38 GMT""}]","2009-11-06"
"astro-ph/0106024","David L. Band","David L. Band","Intensity Distributions of Gamma-Ray Bursts","For the proceedings of GAMMA 2001 (Baltimore, April 4-6, 2001), 5
  pages",,"10.1063/1.1419404",,"astro-ph",,"  Observations of individual bursts chosen by the vagaries of telescope
availability demonstrated that bursts are not standard candles and that their
apparent energy can be as great as 10^54 erg. However, determining the
distribution of their apparent energy (and of other burst properties) requires
the statistical analysis of a well-defined burst sample; the sample definition
includes the threshold for including a burst in the sample. Thus optical groups
need to the criteria behind the decision to search for a spectroscopic
redshift. Currently the burst samples are insufficient to choose between
lognormal and power law functional forms of the distribution, and the parameter
values for these functional forms differ between burst samples. Similarly, the
actual intensity distribution may be broader than observed, with a low energy
tail extending below the detection threshold.
","[{""version"":""v1"",""created"":""Fri, 1 Jun 2001 17:49:14 GMT""}]","2009-11-06"
"astro-ph/0106025","Phil Marshall","P.J. Marshall (Cavendish, Cambridge)","Maximum-Entropy Reconstruction of the Distribution of Mass in Cluster
  MS1054-03 from Weak Lensing Data","6 pages, with 11 bitmapped postscript figures. To appear in
  Proceedings of XXI Moriond Conference: Galaxy Clusters and the High Redshift
  Universe Observed in X-rays, edited by D. Neumann, F. Durret, & J. Tran Thanh
  Van. A version with uncompressed colour figures is available from
  http://www.mrao.cam.ac.uk/~pjm43/papers/",,,,"astro-ph",,"  Weak gravitational lensing studies of clusters of galaxies provide
complimentary information to that from X-ray data; the measured signal depends
only on the cluster's projected mass, independent of dynamical assumptions.
Here we apply a maximum-entropy method algorithm for reconstructing the
two-dimensional density distribution to two sets of shear data for the high
redshift cluster MS1054-03, courtesy of Clowe et al (2000) and Hoekstra et al
(2000).
","[{""version"":""v1"",""created"":""Fri, 1 Jun 2001 18:05:27 GMT""}]","2007-05-23"
"astro-ph/0106026","Daniela Borges Pavani","D.B. Pavani (1), E. Bica (1), C.M. Dutra (1), H. Dottori (1), B.X.
  Santiago (1), G. Carranza (2), R.J. Diaz (2) ((1) Universidade Federal do Rio
  Grande do Sul - IF, (2) Observatorio Astronomico de Cordoba)","Open clusters or their remnants: B and V photometry of NGC 1901 and NGC
  1252","25 pages, 11 Postscript figures, accepted for A&A",,"10.1051/0004-6361:20010741",,"astro-ph",,"  Photometry in the B and V bands is presented for the southern stellar groups
NGC 1901 and NGC 1252. NGC 1901 is often described as an open cluster while NGC
1252 consists of a concentration of about 20 stars centered approx 20' north of
the original New General Catalogue coordinates, and at the southwest edge of
the large region previously assigned to this object in the literature. NGC 1901
has a clear main sequence and shares similarities with the Hyades. We derive a
reddening value E(B-V) = 0.04, a distance from the Sun d = 0.45 kpc (Z = -0.23
kpc) and an age 0.6 +/- 0.1 Gyr. NGC 1901 is conclusively a physical system,
dynamically comparable to or more evolved than the Hyades. The colour-
magnitude diagram of NGC 1252 suggests a turnoff and main sequence, and a total
of 12 probable members. We simulated the Galactic field colour-magnitude
diagram in the same direction and found it to be a poor match to NGC 1252,
suggesting that NGC 1252 is not a field fluctuation. Isochrone fitting to the
probable members is consistent with E(B-V) = 0.02, a distance from the Sun d =
0.64 kpc (Z = -0.46 kpc) and an age 3 +/- 1 Gyr. NGC 1252 cannot be ruled out
as a physical group with the available data. If so, evidence is found that it
is not a classical open cluster, but rather an open cluster remnant.
","[{""version"":""v1"",""created"":""Fri, 1 Jun 2001 18:16:07 GMT""}]","2009-11-06"
"astro-ph/0106027","Takamitsu Miyaji","R. E. Griffiths, A. Ptak, T. Miyaji","Resolving the X-ray Spectral Paradox: XMM-Newton Spectra of Faint
  Sources in the Lockman Hole","2 pages, 1 figure, to appear in the proceedings of the conference
  ""New Century of X-ray Astronomy"" held in Yokohama, Japan, March 2001",,,,"astro-ph",,"  Using 100ks of XMM-Newton data on the Lockman Hole, we show how the X-ray
background 'spectral paradox' is being resolved. We find the summed spectra of
the Type I AGN, Type II AGN, and the unidentified objects. We conclude that the
hard slope of the XRB is caused predominantly by latter sources, i.e. the Type
II AGN and unidentified objects.
","[{""version"":""v1"",""created"":""Fri, 1 Jun 2001 19:26:53 GMT""}]","2007-05-23"
"astro-ph/0106028","Takamitsu Miyaji","T. Miyaji, R. E. Griffiths","First Results from the XMM-Newton Observation in the Groth-Westphal
  Survey Strip Region","5 page, 4 postscript figures, to appear in the proceedings of the
  XXIst Moriond Astrophysics Meeting ""Galaxy Clusters and the High Redshift
  Universe Observed in X-rays"" held in Les Arcs, France, March 2001",,,,"astro-ph",,"  We present the first results of the XMM-Newton observation on the
Groth-Westphal Strip Field. The scheduled exposure time was 70 [ks]. We first
analyzed about 50 [ks] of calibrated and cleaned EPIC-PN data, which were the
only ones we could successfully process with an early version of the SAS
software applicable to these observations. A total of about 110 sources have
been detected in the central 10 arcmin of the PN field of view (FOV). A
cross-correlation with the Hubble Space Telescope (HST) Medium Deep Survey
(MDS) database shows a range of morphological properties of host galaxies of
the X-ray source. Spectra of hard X-ray sources in our data indeed show
absorption in the range N_H~10^{22}-10^{23} [cm^{-2}] at z~1.
","[{""version"":""v1"",""created"":""Fri, 1 Jun 2001 20:24:35 GMT""}]","2007-05-23"
"astro-ph/0106029","Martin Hardcastle","M. J. Hardcastle, M. Birkinshaw and D. M. Worrall","Chandra observations of the X-ray jet in 3C66B","9 pages, 6 figures. MNRAS accepted. v2; fix typo in core spectral
  index and UGC number","Mon.Not.Roy.Astron.Soc. 326 (2001) 1499","10.1111/j.1365-2966.2001.04699.x",,"astro-ph",,"  Our Chandra observation of the FRI radio galaxy 3C66B has resulted in the
first detection of an X-ray counterpart to the previously known radio,
infra-red and optical jet. The X-ray jet is detected up to 7 arcsec from the
core and has a steep X-ray spectrum, alpha ~ 1.3 +/- 0.1. The overall X-ray
flux density and spectrum of the jet are consistent with a synchrotron origin
for the X-ray emission. However, the inner knot in the jet has a higher ratio
of X-ray to radio emission than the others. This suggests that either two
distinct emission processes are present or that differences in the acceleration
mechanism are required; there may be a contribution to the inner knot's
emission from an inverse-Compton process or it may be the site of an early
strong shock in the jet. The peak of the brightest radio and X-ray knot is
significantly closer to the nucleus in the X-ray than in the radio, which may
suggest that the knots are privileged sites for high-energy particle
acceleration. 3C66B's jet is similar both in overall spectral shape and in
structural detail to those in more nearby sources such as M87 and Centaurus A.
","[{""version"":""v1"",""created"":""Fri, 1 Jun 2001 22:14:48 GMT""},{""version"":""v2"",""created"":""Thu, 7 Jun 2001 13:28:25 GMT""}]","2016-01-13"
"astro-ph/0106030","Renato A. Dupke","Renato A. Dupke, Joel N. Bregman (University of Michigan)","Detection of Bulk Motions in the ICM of the Centaurus Cluster","13 pages in emulateapj5 style, 8 postscript figures; Accepted by ApJ;
  Revised version with minor changes",,"10.1086/323433",,"astro-ph",,"  Several recent numerical simulations of off-center cluster mergers predict
that significant angular momentum with associated velocities of a few x 10^{3}
km/s can be imparted to the resulting cluster. Such gas bulk velocities can be
detected by the Doppler shift of X-ray spectral lines with ASCA spectrometers.
Using two ASCA observations of the Centaurus cluster, we produced a velocity
map for the gas in the cluster's central regions. We also detected radial and
azimuthal gradients in temperature and metal abundance distributions, which
seem to be associated with the infalling sub-group centered at NGC 4709 (Cen
45). More importantly, we found a significant (>99.8% confidence level)
velocity gradient along a line near-perpendicular to the direction of the
incoming sub-group and with a maximum velocity difference of ~3.4+-1.1 x 10^{3}
km/s. It is unlikely (P < 0.002) that the observed velocity gradient is
generated by gain fluctuations across the detectors. While the observed
azimuthal temperature and abundance variations can be attributed to the
interaction with Cen 45, we argue that the intracluster gas velocity gradient
is more likely due to a previous off-center merging event in the main body of
the Centaurus cluster.
","[{""version"":""v1"",""created"":""Fri, 1 Jun 2001 23:01:49 GMT""},{""version"":""v2"",""created"":""Thu, 28 Jun 2001 15:47:12 GMT""}]","2009-11-06"
"astro-ph/0106032","Linda J. Tacconi","R. Genzel, L.J. Tacconi, D. Rigopoulou, D. Lutz, and M. Tecza","Ultra-Luminous Infrared Mergers: Elliptical Galaxies in Formation?","submitted to ApJ",,"10.1086/323772",,"astro-ph",,"  We report high quality near-infrared spectroscopy of 12 ultra-luminous
infrared galaxy mergers (ULIRGs). Our new VLT and Keck data provide ~0.5""
resolution, stellar and gas kinematics of these galaxies most of which are
compact systems in the last merger stages.
  We confirm that ULIRG mergers are 'ellipticals-in-formation'. Random motions
dominate their stellar dynamics, but significant rotation is common. Gas and
stellar dynamics are decoupled in most systems. ULIRGs fall on or near the
fundamental plane of hot stellar systems, and especially on its less evolution
sensitive, r(eff)-sigma projection. The ULIRG velocity dispersion distribution,
their location in the fundamental plane and their distribution of
v(rot)*sin(i)/sigma closely resemble those of intermediate mass (~L*),
elliptical galaxies with moderate rotation. As a group ULIRGs do not resemble
giant ellipticals with large cores and little rotation. Our results are in good
agreement with other recent studies indicating that disky ellipticals with
compact cores or cusps can form through dissipative mergers of gas rich, disk
galaxies while giant ellipticals with large cores have a different formation
history.
","[{""version"":""v1"",""created"":""Sat, 2 Jun 2001 14:17:41 GMT""}]","2009-11-06"
"cond-mat/0106021","Klaus Capelle","K. Capelle, G. Vignale and B. L. Gyorffy","Spin currents and spin dynamics in time-dependent density-functional
  theory","now includes discussion of OEP and GGA; to appear in Phys. Rev. Lett","Physical Review Letters 87 p. 206403 (2001)","10.1103/PhysRevLett.87.206403",,"cond-mat.mtrl-sci cond-mat.mes-hall",,"  We derive and analyse the equation of motion for the spin degrees of freedom
within time-dependent spin-density-functional theory (TD-SDFT). Results are (i)
a prescription for obtaining many-body corrections to the single-particle spin
currents from the Kohn-Sham equation of TD-SDFT, (ii) the existence of an
exchange-correlation (xc) torque within TD-SDFT, (iii) a prescription for
calculating, from TD-SDFT, the torque exerted by spin currents on the spin
magnetization, (iv) a novel exact constraint on approximate xc functionals, and
(v) the discovery of serious deficiencies of popular approximations to TD-SDFT
when applied to spin dynamics.
","[{""version"":""v1"",""created"":""Fri, 1 Jun 2001 17:15:59 GMT""},{""version"":""v2"",""created"":""Mon, 1 Oct 2001 19:51:15 GMT""},{""version"":""v3"",""created"":""Mon, 1 Oct 2001 20:42:15 GMT""}]","2009-11-07"
"cond-mat/0106022","Friederike Schmid","D. D\""uchs and F. Schmid","Phase Behaviour of Amphiphilic Monolayers: Theory and Simulation","To appear in J. Phys.: Cond. Matter",,"10.1088/0953-8984/13/21/313",,"cond-mat.soft",,"  Coarse grained models of monolayers of amphiphiles (Langmuir monolayers) have
been studied theoretically and by computer simulations. We discuss some of the
insights obtained with this approach, and present new simulation results which
show that idealised models can successfully reproduce essential aspects of the
generic phase behaviour of Langmuir monolayers.
","[{""version"":""v1"",""created"":""Fri, 1 Jun 2001 17:48:20 GMT""}]","2009-11-07"
"cond-mat/0106023","Florian Merz","F. Merz and J. T. Chalker","The two-dimensional random-bond Ising model, free fermions and the
  network model","20 pages, 25 figures, figures corrected","Phys. Rev. B 65, 054425 (2002)","10.1103/PhysRevB.65.054425",,"cond-mat.dis-nn cond-mat.mes-hall cond-mat.stat-mech",,"  We develop a recently-proposed mapping of the two-dimensional Ising model
with random exchange (RBIM), via the transfer matrix, to a network model for a
disordered system of non-interacting fermions. The RBIM transforms in this way
to a localisation problem belonging to one of a set of non-standard symmetry
classes, known as class D; the transition between paramagnet and ferromagnet is
equivalent to a delocalisation transition between an insulator and a quantum
Hall conductor. We establish the mapping as an exact and efficient tool for
numerical analysis: using it, the computational effort required to study a
system of width $M$ is proportional to $M^{3}$, and not exponential in $M$ as
with conventional algorithms. We show how the approach may be used to calculate
for the RBIM: the free energy; typical correlation lengths in quasi-one
dimension for both the spin and the disorder operators; even powers of
spin-spin correlation functions and their disorder-averages. We examine in
detail the square-lattice, nearest-neighbour $\pm J$ RBIM, in which bonds are
independently antiferromagnetic with probability $p$, and ferromagnetic with
probability $1-p$. Studying temperatures $T\geq 0.4J$, we obtain precise
coordinates in the $p-T$ plane for points on the phase boundary between
ferromagnet and paramagnet, and for the multicritical (Nishimori) point. We
demonstrate scaling flow towards the pure Ising fixed point at small $p$, and
determine critical exponents at the multicritical point.
","[{""version"":""v1"",""created"":""Fri, 1 Jun 2001 18:08:28 GMT""},{""version"":""v2"",""created"":""Mon, 4 Jun 2001 14:54:22 GMT""},{""version"":""v3"",""created"":""Wed, 13 Jun 2001 17:02:21 GMT""}]","2011-08-05"
"cond-mat/0106024","Dan Ralph","Mandar M. Deshmukh, Edgar Bonet, A. N. Pasupathy and D. C. Ralph","Equilibrium and non-equilibrium electron tunneling via discrete quantum
  states","4 pages, 3 figures, some in color",,"10.1103/PhysRevB.65.073301",,"cond-mat.mes-hall",,"  Tunneling is measured via the quantum levels of a metal nanoparticle. We
analyze quantitatively the resonance energies, widths, and amplitudes, both in
the regime where only one state is accessible for tunneling and in the
non-equilibrium regime when additional states are made accessible one-by-one.
For tunneling through one state, our results agree with expectations for
sequential tunneling, but in the non-equilibrium regime the resonances are
broadened and shifted in ways that require taking into account electron
interactions and relaxation.
","[{""version"":""v1"",""created"":""Fri, 1 Jun 2001 20:48:04 GMT""}]","2009-11-07"
"cond-mat/0106025","Stavroula Foteinopoulou","S. Foteinopoulou and C. M. Soukoulis","Theoretical investigation of one-dimensional cavities in two-dimensional
  photonic crystals","25 pages, 8 figures","IEEE J. of Quant. Elec. 38, 844 (2002)","10.1109/JQE.2002.1017596",,"cond-mat",,"  We study numerically the features of the resonant peak of one-dimensional
(1-D) dielectric cavities in a two-dimensional (2-D) hexagonal lattice. We use
both the transfer matrix method and the finite difference time-domain (FDTD)
method to calculate the transmission coefficient. We compare the two methods
and discuss their results for the transmission and quality factor Q of the
resonant peak. We also examine the dependence of Q on absorption and losses,
the thickness of the sample and the lateral width of the cavity. The Q- factor
dependence on the width of the source in the FDTD calculations is also given.
","[{""version"":""v1"",""created"":""Fri, 1 Jun 2001 22:56:40 GMT""},{""version"":""v2"",""created"":""Fri, 1 Jun 2001 23:42:19 GMT""},{""version"":""v3"",""created"":""Tue, 28 Oct 2003 04:56:21 GMT""}]","2009-11-07"
"cond-mat/0106026","Daniel Sheehy","Daniel E. Sheehy, Inanc Adagideli, Paul M. Goldbart and Ali Yazdani","Probing d-wave pairing correlations in the pseudogap regime of the
  cuprate superconductors via low-energy states near impurities","8 pages, 2 figures","Phys. Rev. B 64, 224518 (2001)","10.1103/PhysRevB.64.224518",,"cond-mat.supr-con cond-mat.str-el",,"  The issue of probing the pseudogap regime of the cuprate superconductors,
specifically with regard to the existence and nature of superconducting pairing
correlations of d-wave symmetry, is explored theoretically. It is shown that if
the d-wave correlations believed to describe the superconducting state persist
into the pseudogap regime, but with pair-potential phase-fluctuations that
destroy their long-range nature, then the low-energy quasiparticle states
observed near extended impurities in the truly superconducting state should
also persist as resonances in the pseudogap regime. The scattering of
quasiparticles by these phase-fluctuations broadens what was (in the
superconducting state) a sharp peak in the single-particle spectral function at
low energy, as we demonstrate within the context of a simple model. This peak
and its broadening is, in principle, accessible via scanning tunneling
spectroscopy near extended impurities in the pseudogap regime. If so, such
experiments would provide a probe of the extent to which d-wave superconducting
correlations persist upon entering the pseudogap regime, thus providing a
stringent diagnostic of the phase-fluctuation scenario.
","[{""version"":""v1"",""created"":""Fri, 1 Jun 2001 22:23:15 GMT""}]","2009-11-07"
"gr-qc/0106002","Stefano Liberati","Carlos Barcelo, Matt Visser and Stefano Liberati","Einstein Gravity as an emergent phenomenon?","8 pages, Essay awarded an honorable mention in the year 2001 Gravity
  Research Foundation essay competition","Int.J.Mod.Phys.D10:799-806,2001","10.1142/S0218271801001591",,"gr-qc",,"  In this essay we marshal evidence suggesting that Einstein gravity may be an
emergent phenomenon, one that is not ``fundamental'' but rather is an almost
automatic low-energy long-distance consequence of a wide class of theories.
Specifically, the emergence of a curved spacetime ``effective Lorentzian
geometry'' is a common generic result of linearizing a classical scalar field
theory around some non-trivial background. This explains why so many different
``analog models'' of general relativity have recently been developed based on
condensed matter physics; there is something more fundamental going on. Upon
quantizing the linearized fluctuations around this background geometry, the
one-loop effective action is guaranteed to contain a term proportional to the
Einstein--Hilbert action of general relativity, suggesting that while classical
physics is responsible for generating an ``effective geometry'', quantum
physics can be argued to induce an ``effective dynamics''. This physical
picture suggests that Einstein gravity is an emergent low-energy long-distance
phenomenon that is insensitive to the details of the high-energy short-distance
physics.
","[{""version"":""v1"",""created"":""Fri, 1 Jun 2001 20:23:44 GMT""}]","2014-11-17"
"gr-qc/0106003","David Waite","David Waite","Inertia Manipulation through Metric Patching","6 pages",,,,"gr-qc",,"  This paper will present the exact solution for the stress-energy tensor of a
spherical matter shell of finite thickness that will patch together different
metrics at the boundaries of the shell. The choice of vacuum field solutions
for the shell exterior and hollow interior that we make will allow us to
manipulate the inertial state of an object within the shell. The choice will
cause it to be in a state of acceleration with the shell relative to an
external observer for an indefinite time. The stress-energy tensor's solution
results in zero ship frame energy requirements, and only finite stress
requirements, and we show how any WEC violation can be avoided.
","[{""version"":""v1"",""created"":""Sat, 2 Jun 2001 10:26:56 GMT""}]","2007-05-23"
"hep-ex/0106003","Frederick A. Harris","F. A. Harris","R Measurements at High Q^2","Invited talk at e^+ e^- Physics at Intermediate Energies Workshop,
  Stanford Linear Accelerator Center, Stanford, California, April 30 - May 2,
  2001, (M12) 7 pages, LaTeX, 10 ps figures","eConf C010430:M12,2001",,,"hep-ex",,"  Previous Measurements of R at high Q^2 are reviewed. Recent R measurement
results, including those from the Beijing Spectrometer Experiment, are
described. The present status of R measurements and future measurement
possiblities are summarized.
","[{""version"":""v1"",""created"":""Fri, 1 Jun 2001 19:00:10 GMT""}]","2014-11-17"
"hep-ex/0106009","Dmitry N. Grigoriev","D. Grigoriev (Budker Institute of Nuclear Physics, Novosibirsk,
  Russia), CMD-2M collaboration","CMD-2 Detector Upgrade","Presented at ""e+e- Physics at Intermediate Energies"" Workshop, SLAC,
  Stanford, CA, April 30 - May 2, 2001 (T09), 6 pages, 7 figures","eConf C010430 (2001) T09",,,"hep-ex",,"  The project of upgrading the detector CMD-2 is presented. The upgraded
detector is called CMD-2M and is going to take data with new collider VEPP-2000
at BINP. The general structure of the detector CMD-2 will remain as is but
major parameters of the detector, such as momentum and angular resolution for
charged particle and energy and spatial resolution for photons, will be
substantially improved.
","[{""version"":""v1"",""created"":""Fri, 1 Jun 2001 17:41:48 GMT""}]","2007-05-23"
