"hep-ex/0106010","Alex R. Dzierba","Alex R. Dzierba (Indiana University)","QCD Confinement and the Hall D Project at Jefferson Lab","5 pages, Invited paper at the e+e- Physics at Intermediate Energies
  Workshop (PSN T04)","eConf C010430 (2001) T04",,,"hep-ex",,"  An understanding of the confinement mechanism in QCD requires a detailed
mapping of the spectrum of hybrid mesons. Understanding confinement means
understanding the role of gluons and it is in hybrid mesons that the gluonic
degrees of freedom are manifest. High statistics searches for such states with
pion and p beams have resulted in some tantalizing signals. There is good
reason to expect beams of photons to yield hybrid mesons with J^{PC} quantum
numbers not possible within the conventional picture of mesons as qqbar bound
states. Meager data currently exist on the photoproduction of light quark
mesons. At Jefferson Lab in Newport News, VA plans are underway to upgrade the
energy of the electron accelerator to 12 GeV. Along with this energy upgrade, a
hermetic detector housed in new experimental hall (Hall D) will be used to
collect data on photoproduced mesons with unprecedented statistics. With 12 GeV
electrons, a 9 GeV linearly polarized photon beam will be produced using the
coherent bremsstrahlung technique.
","[{""version"":""v1"",""created"":""Sat, 2 Jun 2001 15:10:51 GMT""}]","2007-05-23"
"hep-lat/0106001","Tom Degrand","Thomas DeGrand","Short distance current correlators: Comparing lattice simulations to the
  instanton liquid","18 pages, Revtex, 11 postscript figures. Some changes. Version to
  appear in Phys. Rev. D","Phys.Rev. D64 (2001) 094508","10.1103/PhysRevD.64.094508","COLO-HEP-467","hep-lat hep-ph",,"  Point to point correlators of currents are computed in quenched QCD using a
chiral lattice fermion action, the overlap action. I compare correlators made
of exact quark propagators with correlators restricted to low (less than 500
MeV) eigenvalue eigenmodes of the Dirac operator. In many cases they show
qualitative resemblence (typically at small values of the quark mass and
distances larger than 0.4 fm) and they differ qualitatively at larger quark
masses or at very short distance. Lattice results are in qualitative agreement
(and in the difference of vector and axial vector channels, quantitative
agreement) with the expectations of instanton liquid models. The scalar channel
shows the effects of a quenched finite volume zero mode artifact, a negative
correlator.
","[{""version"":""v1"",""created"":""Fri, 1 Jun 2001 22:19:48 GMT""},{""version"":""v2"",""created"":""Wed, 1 Aug 2001 17:35:15 GMT""}]","2009-11-07"
"hep-ph/0106012","Marc Vanderhaeghen","K. Goeke, M.V. Polyakov, M. Vanderhaeghen","Hard Exclusive Reactions and the Structure of Hadrons","115 pages, 42 figures, typos corrected and minor changes","Prog.Part.Nucl.Phys.47:401-515,2001","10.1016/S0146-6410(01)00158-2",,"hep-ph",,"  We outline in detail the properties of generalized parton distributions
(GPDs), which contain new information on the structure of the nucleon and which
enter the description of hard exclusive reactions. We highlight the physics
content of the GPDs and discuss the quark GPDs in the large $N_c$ limit and
within the context of the chiral quark-soliton model. Guided by this physics,
we then present a general parametrization for these GPDs. Subsequently we
discuss how these GPDs enter in a wide variety of hard electroproduction
processes and how they can be accessed from them. We consider in detail deeply
virtual Compton scattering and the hard electroproduction of mesons. We
identify a list of key observables which are sensitive to the various nucleon
structure aspects contained in the GPDs and which can be addressed by present
and future experiments.
","[{""version"":""v1"",""created"":""Fri, 1 Jun 2001 16:00:41 GMT""},{""version"":""v2"",""created"":""Fri, 24 Aug 2001 16:35:08 GMT""}]","2016-09-06"
"hep-ph/0106014","Vadim Naumov","G. Fiorentini, V. A. Naumov, F. L. Villante (U & INFN, Ferrara)","Atmospheric neutrino flux and muon data","4 pages, 5 figures; to appear in the Proc. of the 27th International
  Cosmic Ray Conference (August 2001), Hamburg, Germany",,,,"hep-ph astro-ph hep-ex",,"  We present a new one-dimensional calculation of low and intermediate energy
atmospheric muon and neutrino fluxes, using up-to-date data on primary cosmic
rays and hadronic interactions. The existing agreement between calculated muon
fluxes and the data of the CAPRICE 94 muon experiment provides an evidence in
favor of the validity of our description of hadronic interactions and shower
development. This also supports our neutrino fluxes which are essentially lower
than those used for the standard analyses of the sub-GeV and multi-GeV neutrino
induced events in underground detectors.
","[{""version"":""v1"",""created"":""Fri, 1 Jun 2001 16:26:25 GMT""}]","2007-05-23"
"hep-ph/0106015","Vadim Naumov","V. A. Naumov (U & INFN, Ferrara and Irkutsk U), T. S. Sinegovskaya
  (Irkutsk U)","Atmospheric proton and neutron spectra at energies above 1 GeV","4 pages, 4 figures; to appear in the Proc. of the 27th International
  Cosmic Ray Conference (August 2001), Hamburg, Germany",,,,"hep-ph astro-ph hep-ex",,"  We discuss an effective numerical method for solving the transport equations
for cosmic ray nucleons in the atmosphere. It is demonstrated that the nucleon
attenuation lengths are strongly energy and depth dependent due to the
non-power-law behavior of the primary spectrum, growth of the total inelastic
cross sections with energy, and scaling violation in the nucleon-nucleus
interactions. The numerical results are compared with the available
experimental data.
","[{""version"":""v1"",""created"":""Fri, 1 Jun 2001 16:45:23 GMT""}]","2007-05-23"
"hep-ph/0106016","Takuya Mizoguchi","M. Biyajima (Shinshu University), T. Mizoguchi (Toba National
  College), N. Nakajima (Osaka University), A. Ohsawa (University of Tokyo) and
  N. Suzuki (Matsusho Gakuen Junior College)","Analyses of multiplicity distributions at Tevatron by a two-component
  stochastic model --- No leading particle effect in E735 Experiment ---","11 pages, 5 postscript figures, using elsart, epsfig","Phys.Lett. B515 (2001) 470-476","10.1016/S0370-2693(01)00874-7",,"hep-ph",,"  Comparisons of multiplicity distributions at sqrt(s) = 1.8 TeV (E735
Experiment and CDF Collaboration) with our predictions by a two-component
stochastic model have been made. This stochastic model is described by the
pure-birth and Poisson processes. It is found that there are discrepancies
among data at the CERN Sp-bar-pS collider and those at the Tevatron collider.
The latter data by E735 do not contain the leading particle effect described by
the Poisson process, providing that the view of the two-component stochastic
model is correct. The data by CDF contain small leading particle effect. The
reason is probably attributed to the correction made by E735, which is
necessary to make the data of the full phase space from the restricted rapidity
|eta|<3.25.
","[{""version"":""v1"",""created"":""Fri, 1 Jun 2001 16:48:15 GMT""},{""version"":""v2"",""created"":""Tue, 3 Jul 2001 14:27:25 GMT""}]","2009-11-07"
"hep-ph/0106017","Peter Petreczky","S. Digal, P. Petreczky and H. Satz","Quarkonium Feed-Down and Sequential Suppression","19 pages, LaTeX, 11 figures","Phys.Rev. D64 (2001) 094015","10.1103/PhysRevD.64.094015","BI-TP 2001/09","hep-ph hep-lat",,"  About 40-50 % of the quarkonium ground states J/psi(1S) and Upsilon(1S)
produced in hadronic collisions originate from the decay of higher excitations.
In a hot medium, these higher states are dissociated at lower temperatures than
the more tightly bound ground states, leading to a sequential suppression
pattern. Using new finite temperature lattice results, we specify the in-medium
potential between heavy quarks and determine the dissociation points of
different quarkonium states. On the basis of recent CDF data on bottomonium
production, we then obtain first predictions for sequential Upsilon suppression
in nuclear collisions.
","[{""version"":""v1"",""created"":""Fri, 1 Jun 2001 18:07:42 GMT""},{""version"":""v2"",""created"":""Mon, 11 Jun 2001 06:26:29 GMT""}]","2009-11-07"
"hep-ph/0106018","Vittorio Del Duca","M. Cacciari, V. Del Duca, S. Frixione and Z. Trocsanyi","Physics at Large Rapidities in $\gamma^*\gamma^* \to$ Hadrons at LEP2","5 pages, 1 figure, presented at the LEPTRE meeting, Roma 2001",,,,"hep-ph",,"  We compute the order-$\as$ corrections to the total cross section and to jet
rates in $\gamma^* \gamma^* \to$ hadrons for the process $\epem\to\epem +$
hadrons. We use a NLO order general-purpose partonic Monte Carlo event
generator that allows the computation of a rate differential in the produced
leptons and hadrons. We compare our results with the experimental data for
$\epem\to\epem +$ hadrons at LEP2.
","[{""version"":""v1"",""created"":""Fri, 1 Jun 2001 17:39:20 GMT""}]","2016-09-06"
"hep-ph/0106019","Pietro Faccioli","P.Faccioli, E.V. Shuryak","Systematic Study of the Single Instanton Approximation in QCD","11 pages, 4 figures, version submitted to Phys. Rev. D","Phys.Rev. D64 (2001) 114020","10.1103/PhysRevD.64.114020",,"hep-ph",,"  The Single-instanton approximation (SIA) is often used to evaluate
analytically instanton contribution to euclidean correlation functions in QCD,
at small distances. We discuss how this approximation can be consistently
derived from the theory of the instanton ensemble and give precise definitions
to a number of different ""effective masses"", generalizing the parameter $m*$,
which was introduced long ago to account for the collective contribution of the
whole ensemble.
  We test numerically the range of applicability of the SIA for different
quantities. Furthermore, we determine all the effective masses (for random and
interacting instanton liquid models) as well as from phenomenology, and discuss
to what extent those are universal.
","[{""version"":""v1"",""created"":""Fri, 1 Jun 2001 19:54:56 GMT""},{""version"":""v2"",""created"":""Tue, 31 Jul 2001 14:49:17 GMT""}]","2009-11-07"
"hep-ph/0106020","Adrian Ghinculov","A. Ghinculov, Y.-P. Yao","Electroweak radiative corrections:Towards a full two-loop analysis","Presented at the Fifth International Symposium on Radiative
  Corrections (RADCOR 2000), Carmel, CA, September 11-15, 2000",,,,"hep-ph",,"  In calculating electroweak radiative corrections at two-loop level, one
encounters Feynman graphs with several different masses on the internal
propagators and on the external legs, which lead to complicated scalar
functions. We describe a general analytic-numerical reduction scheme for
evaluating any two-loop diagrams with general kinematics and general
renormalizable interactions, whereby ten basic functions form a complete set
after tensor reduction. We illustrate this scheme by applying it to two- and
three-point functions. We discuss the treatment of infrared singularities
within this numerical approach.
","[{""version"":""v1"",""created"":""Fri, 1 Jun 2001 21:06:13 GMT""}]","2007-05-23"
"hep-ph/0106021","Neal Weiner","Neal Weiner (University of Washington)","Ineffective Supersymmetry: Electroweak Symmetry Breaking from Extra
  Dimensions","14 pages, Talk given at 36th Rencontres de Moriond on Electroweak
  Interactions and Unified Theories, Les Arcs, France, 10-17 Mar 2001",,,"UW-PT-01/14","hep-ph",,"  Recently, a mechanism for electroweak symmetry breaking (EWSB) was discussed,
in which the scale of EWSB is set by the scale of an additional dimension R ~
Tev^-1. The mechanism involves supersymmetry, but broken in such a fashion that
high (four-dimensional) momentum loops are cut off by the finite size of the
radius. In a Kaluza-Klein decomposition, a hard cutoff seems to give a strong
cutoff dependence, while summing the entire tower is not only cutoff
insensitive, but actually finite. Such behavior is easily understood in a
formulation that respects five-dimensional locality. Finally, we note that
certain models of this type naturally give operators which can ``fake'' the
presence of a light Higgs in precision electroweak observables.
","[{""version"":""v1"",""created"":""Fri, 1 Jun 2001 22:21:59 GMT""}]","2007-05-23"
"hep-ph/0106022","Silas R. Beane","S.R. Beane","Constraining Quark-Hadron Duality at Large-Nc","16 pages TeX, uses mtexsis.tex","Phys.Rev. D64 (2001) 116010","10.1103/PhysRevD.64.116010","NT@UW-01-012","hep-ph hep-th nucl-th",,"  Quark-meson duality for two-point functions of vector and axial-vector QCD
currents is investigated in the large-Nc approximation. We find that the joint
constraints of duality and chiral symmetry imply degeneracy of excited vector
and axial-vector mesons in the large-Nc limit. We compare model-independent
constraints with expectations based on the Veneziano-Lovelace-Shapiro string
model. Several models of duality are constructed, and phenomenological
implications are discussed.
","[{""version"":""v1"",""created"":""Fri, 1 Jun 2001 22:33:21 GMT""}]","2009-11-07"
"hep-ph/0106023","Oleg Lebedev","S. Khalil and O. Lebedev","Chargino Contributions to Epsilon and Epsilon-Prime","9 pages, 2 figures, to appear in PLB","Phys.Lett.B515:387-394,2001","10.1016/S0370-2693(01)00880-2","SUSX-TH/01-022","hep-ph",,"  We analyze the chargino contributions to the K-\bar K mixing and
epsilon-prime in the mass insertion approximation and derive the corresponding
bounds on the mass insertion parameters. We find that the chargino
contributions can significantly enlarge the regions of the parameter space
where CP violation can be fully supersymmetric. In principle, the observed
values of epsilon and epsilon-prime may be entirely due to the chargino --
up-squark loops.
","[{""version"":""v1"",""created"":""Sat, 2 Jun 2001 12:23:57 GMT""},{""version"":""v2"",""created"":""Thu, 19 Jul 2001 16:06:01 GMT""}]","2010-05-28"
"hep-ph/0106024","Cvetic","Gorazd Cvetic (UTFSM, Valparaiso), Claudio Dib (UTFSM), Taekoon Lee
  (KAIST, Taejon), and Ivan Schmidt (UTFSM)","Resummation of the hadronic tau decay width with the modified Borel
  transform method","32 pages, 2 eps-figures, revtex; minor changes in the formulations; a
  typo in Eq.(47) corrected; version as appearing in Phys. Rev. D","Phys.Rev. D64 (2001) 093016","10.1103/PhysRevD.64.093016",,"hep-ph",,"  A modified Borel transform of the Adler function is used to resum the
hadronic tau decay width ratio. In contrast to the ordinary Borel transform,
the integrand of the Borel integral is renormalization--scale invariant. We use
an ansatz which explicitly accounts for the structure of the leading infrared
renormalon. Further, we use judiciously chosen conformal transformations for
the Borel variable, in order to map sufficiently away from the origin the other
ultraviolet and infrared renormalon singularities. In addition, we apply Pade
approximants for the corresponding truncated perturbation series of the
modified Borel transform, in order to further accelerate the convergence.
Comparing the results with the presently available experimental data on the tau
hadronic decay width ratio, we obtain $\alpha_s(M^z) = 0.1192 +- 0.0007_{exp.}
+- 0.0010_{EW+CKM} +- 0.0009_{th.} +- 0.0003_{evol.}$. These predictions
virtually agree with those of our previous resummations where we used ordinary
Borel transforms instead.
","[{""version"":""v1"",""created"":""Sat, 2 Jun 2001 15:37:07 GMT""},{""version"":""v2"",""created"":""Wed, 21 Nov 2001 12:58:57 GMT""}]","2009-11-07"
"hep-th/0106001","Arkady Vainshtein","Cedric Deffayet, Gia Dvali, Gregory Gabadadze, and Arkady Vainshtein","Nonperturbative Continuity in Graviton Mass versus Perturbative
  Discontinuity","Phys Rev D version, 21 pages, 1 figure, a reference and some
  clarifications are added, typos corrected","Phys.Rev.D65:044026,2002","10.1103/PhysRevD.65.044026","NYU-TH/01/05/15, TPI-MIN-01/23, UMN-TH-2009/01","hep-th",,"  We address the question whether a graviton could have a small nonzero mass.
The issue is subtle for two reasons: there is a discontinuity in the mass in
the lowest tree-level approximation, and, moreover, the nonlinear
four-dimensional theory of a massive graviton is not defined unambiguously.
First, we reiterate the old argument that for the vanishing graviton mass the
lowest tree-level approximation breaks down since the higher order corrections
are singular in the graviton mass. However, there exist nonperturbative
solutions which correspond to the summation of the singular terms and these
solutions are continuous in the graviton mass. Furthermore, we study a
completely nonlinear and generally covariant five-dimensional model which
mimics the properties of the four-dimensional theory of massive gravity. We
show that the exact solutions of the model are continuous in the mass, yet the
perturbative expansion exhibits the discontinuity in the leading order and the
singularities in higher orders as in the four-dimensional case. Based on exact
cosmological solutions of the model we argue that the helicity-zero graviton
state which is responsible for the perturbative discontinuity decouples from
the matter in the limit of vanishing graviton mass in the full classical
theory.
","[{""version"":""v1"",""created"":""Fri, 1 Jun 2001 21:49:18 GMT""},{""version"":""v2"",""created"":""Fri, 19 Oct 2001 19:24:52 GMT""}]","2009-10-07"
"hep-th/0106006","Ciprian Acatrinei","Ciprian Acatrinei","Noncommutative radial waves","LaTeX, 8 pages, no figures; improved presentation, misprints
  corrected, references added","J.Phys.A41:215401,2008","10.1088/1751-8113/41/21/215401",,"hep-th",,"  We study radial waves in (2+1)-dimensional noncommutative scalar field
theory, using operatorial methods. The waves propagate along a discrete radial
coordinate and are described by finite series deformations of Bessel-type
functions. At radius much larger than the noncommutativity scale
$\sqrt{\theta}$, one recovers the usual commutative behaviour. At small
distances, classical divergences are smoothed out by noncommutativity.
","[{""version"":""v1"",""created"":""Fri, 1 Jun 2001 16:32:43 GMT""},{""version"":""v2"",""created"":""Thu, 14 Nov 2002 17:06:55 GMT""}]","2008-11-26"
"hep-th/0106007","Fermin Aceves de la Cruz","F. Aceves de la Cruz, J. J. Rosales, V. I. Tkach and J. Torres A","Susy Cosmological Models","6 pages, gc.sty; to appear in special issue of Gravitation and
  Cosmology (G@C) devoted to Quantum Gravity, Unified Models and Strings to
  mark 100th anniversary of Tomsk State Pedagogical University, Ed. Prof. S. D.
  Odintsov","Grav.Cosmol. 8 (2002) 101-106",,,"hep-th gr-qc",,"  In this work we consider the action for a set of complex scalar
supermultiplets interacting with the scale factor in the supersymmetric
cosmological models. We show that the local conformal supersymmetry leads to a
scalar field potential defined in terms of the K\""ahler potential and
superpotential. Using supersymmetry breaking we are able to obtain a
normalizable wave function for the FRW cosmological model.
","[{""version"":""v1"",""created"":""Fri, 1 Jun 2001 16:34:07 GMT""},{""version"":""v2"",""created"":""Tue, 3 Jul 2001 18:23:21 GMT""}]","2007-05-23"
"hep-th/0106008","Selena Ng","Selena Ng and Malcolm Perry","Brane Splitting via Quantum Tunneling","23 pages, 1 figure, LaTeX; v3: Minor clarifications and references
  added. Comments on self-dual field strengths added in Section 5.2, and on
  entropy in the final section. Version to appear in Nuclear Physics B","Nucl.Phys. B634 (2002) 209-229","10.1016/S0550-3213(02)00346-2","DAMTP-2001-52","hep-th gr-qc",,"  We study the two-centred AdS_7 x S^4 solution of eleven-dimensional
supergravity using the Euclidean path-integral approach, and find that it can
be interpreted as an instanton, signalling the splitting of the throat of the
M5 brane. The instanton is interpreted as indicating a coherent superposition
of the quantum states corresponding to classically distinct solutions. This is
a surprising result since it leads, through the AdS/CFT correspondence, to
contradictory implications for the dual (2,0) superconformal field theory on
the M5 brane. We also argue that similar instantons should exist for other
branes in ten- and eleven-dimensional supergravity. The counterterm subtraction
technique for gravitational instantons, which arose from the AdS/CFT
correspondence, is examined in terms of its applicability to our results.
Connections are also made to the work of Maldacena et al on anti-de Sitter
fragmentation.
","[{""version"":""v1"",""created"":""Fri, 1 Jun 2001 17:59:24 GMT""},{""version"":""v2"",""created"":""Fri, 22 Jun 2001 16:34:33 GMT""},{""version"":""v3"",""created"":""Fri, 26 Apr 2002 18:33:59 GMT""}]","2009-11-07"
"hep-th/0106009","Antti J. Niemi","Sazzad Nasir and Antti J. Niemi","Field Theories from Bundles of Strings","10 pages",,,,"hep-th",,"  We propose that at low energy four dimensional bosonic strings may form bound
states where they become bundled together much like the filaments in a cable.
We inspect the properties of these bundles in terms of their extrinsic
geometry. This involves both torsion and curvature contributions, and leads to
four dimensional field theories where the bundles appear as closed knotted
solitons. Field theories that allow for this interpretation include the Faddeev
model, the Skyrme model, the Yang-Mills theory, and a Hartree-type field theory
model of a two-component plasma.
","[{""version"":""v1"",""created"":""Fri, 1 Jun 2001 18:13:08 GMT""}]","2007-05-23"
"hep-th/0106010","Barton Zwiebach","Leonardo Rastelli, Ashoke Sen, and Barton Zwiebach","Vacuum String Field Theory","31 pages, 3 figures, LaTeX. Added references, a new subsection, and
  edited comments",,,"CTP-MIT-3151, PUPT-1992, NSF-ITP-01-53","hep-th",,"  This is a brief review of vacuum string field theory, a new approach to open
string field theory based on the stable vacuum of the tachyon. We discuss the
sliver state explaining its role as a projector in the space of half-string
functionals. We review the construction of D-brane solutions in vacuum string
field theory, both in the algebraic approach and in the more general
geometrical approach that emphasizes the role of boundary CFT. -- To appear in
the Proceedings of Strings 2001, Mumbai, India.
","[{""version"":""v1"",""created"":""Fri, 1 Jun 2001 20:08:50 GMT""},{""version"":""v2"",""created"":""Sun, 3 Jun 2001 20:10:17 GMT""},{""version"":""v3"",""created"":""Tue, 12 Jun 2001 16:27:16 GMT""}]","2007-05-23"
"hep-th/0106011",,"Alexios P. Polychronakos","Quantum Hall states on the cylinder as unitary matrix Chern-Simons
  theory","25 pages; final version to appear in JHEP","JHEP 0106:070,2001","10.1088/1126-6708/2001/06/070","CCNY-HEP-01-12, RU-01-8-B","hep-th cond-mat nlin.SI",,"  We propose a unitary matrix Chern-Simons model representing fractional
quantum Hall fluids of finite extent on the cylinder. A mapping between the
states of the two systems is established. Standard properties of Laughlin
theory, such as the quantization of the inverse filling fraction and of the
quasiparticle number, are reproduced by the quantum mechanics of the matrix
model. We also point out that this system is holographically described in terms
of the one-dimensional Sutherland integrable particle system.
","[{""version"":""v1"",""created"":""Fri, 1 Jun 2001 20:31:49 GMT""},{""version"":""v2"",""created"":""Mon, 27 Aug 2001 20:38:14 GMT""}]","2010-02-03"
"hep-th/0106012","David Mateos","Roberto Emparan, David Mateos and Paul Townsend","Supergravity Supertubes","v1: 1+16 pages, JHEP LaTeX; v2: Substantial revision (1+25 pages),
  with additional co-author. The asymptotic solution of the earlier version is
  extended to a solution displaying all essential features of the worldvolume
  supertube, including the tubular interior structure and the angular momentum
  bound","JHEP 0107 (2001) 011","10.1088/1126-6708/2001/07/011","CERN-TH/2001-159; DAMTP-2001-49","hep-th",,"  We find the supergravity solution sourced by a supertube: a
(1/4)-supersymmetric D0-charged IIA superstring that has been blown up to a
cylindrical D2-brane by angular momentum. The supergravity solution captures
all essential features of the supertube, including the D2-dipole moment and an
upper bound on the angular momentum: violation of this bound implies the
existence of closed timelike curves, with a consequent ghost-induced
instability of supertube probes.
","[{""version"":""v1"",""created"":""Fri, 1 Jun 2001 21:44:00 GMT""},{""version"":""v2"",""created"":""Tue, 26 Jun 2001 17:09:32 GMT""}]","2009-11-07"
"hep-th/0106013","Itzhak Bars","Itzhak Bars","U*(1,1) Noncommutative Gauge Theory As The Foundation of 2T-Physics in
  Field Theory","24 pages, LaTeX","Phys.Rev. D64 (2001) 126001","10.1103/PhysRevD.64.126001","CITUSC/00-015, NSF-ITP-01-54","hep-th",,"  A very simple field theory in noncommutative phase space X^{M},P^{M} in d+2
dimensions, with a gauge symmetry based on noncommutative u*(1,1), furnishes
the foundation for the field theoretic formulation of Two-Time Physics. This
leads to a remarkable unification of several gauge principles in d dimensions,
including Maxwell, Einstein and high spin gauge principles, packaged together
into one of the simplest fundamental gauge symmetries in noncommutative quantum
phase space in d+2 dimensions. A gauge invariant action is constructed and its
nonlinear equations of motion are analyzed. Besides elegantly reproducing the
first quantized worldline theory with all background fields, the field theory
prescribes unique interactions among the gauge fields. A matrix version of the
theory, with a large N limit, is also outlined
","[{""version"":""v1"",""created"":""Fri, 1 Jun 2001 22:45:43 GMT""}]","2009-11-07"
