"hep-th/0106014","Joe Polchinski","Mariana Gra\~na, Joseph Polchinski","Gauge/Gravity Duals with Holomorphic Dilaton","23 pages. Minor corrections to eqs. 2.6 and 4.8 v3: reference to
  non-Abelian BPS monopole solution corrected (Chamseddine-Volkov)","Phys.Rev.D65:126005,2002","10.1103/PhysRevD.65.126005","NSF-ITP-01-51","hep-th",,"  We consider configurations of D7-branes and whole and fractional D3-branes
with N=2 supersymmetry. On the supergravity side these have a warp factor,
three-form flux and a nonconstant dilaton. We discuss general IIB solutions of
this type and then obtain the specific solutions for the D7/D3 system. On the
gauge side the D7-branes add matter in the fundamental representation of the
D3-brane gauge theory. We find that the gauge and supergravity metrics on
moduli space agree. However, in many cases the supergravity curvature is large
even when the gauge theory is strongly coupled. In these cases we argue that
the useful supergravity dual must be a IIA configuration.
","[{""version"":""v1"",""created"":""Fri, 1 Jun 2001 23:50:39 GMT""},{""version"":""v2"",""created"":""Tue, 12 Feb 2002 23:40:08 GMT""},{""version"":""v3"",""created"":""Mon, 18 Jun 2007 14:43:52 GMT""}]","2009-10-09"
"hep-th/0106016","Dimitra Karabali","Dimitra Karabali and Bunji Sakita","Chern-Simons matrix model: coherent states and relation to Laughlin
  wavefunctions","15 pages, LaTeX; one reference added, abstract and section 5
  expanded, typos corrected","Phys.Rev. B64 (2001) 245316","10.1103/PhysRevB.64.245316","CCNY-HEP 01/03","hep-th cond-mat",,"  Using a coherent state representation we derive many-body probability
distributions and wavefunctions for the Chern-Simons matrix model proposed by
Polychronakos and compare them to the Laughlin ones. We analyze two different
coherent state representations, corresponding to different choices for electron
coordinate bases. In both cases we find that the resulting probability
distributions do not quite agree with the Laughlin ones. There is agreement on
the long distance behavior, but the short distance behavior is different.
","[{""version"":""v1"",""created"":""Sat, 2 Jun 2001 03:53:01 GMT""},{""version"":""v2"",""created"":""Sat, 22 Sep 2001 00:52:08 GMT""}]","2009-11-07"
"hep-th/0106017","Leonidas Sandoval Junior","Leonidas Sandoval Jr","The one loop measure in the Group Theoretic approach to String Theory:
  the case of two finite fixed points","LaTeX2e, 11 pages",,,,"hep-th",,"  The measure for the one loop scattering of one and $N$ bosonic strings is
calculated using the Group Theoretic approach to String Theory. The calculation
is done for the case when the projective transformation associated with the
loop can be parametrized in terms of two finite fixed points and the
multiplier.
","[{""version"":""v1"",""created"":""Sat, 2 Jun 2001 04:30:02 GMT""}]","2007-05-23"
"hep-th/0106018","Musongela Lubo","M.Lubo","Maximally localized states and causality in non commutative quantum
  theories","11 pages, Revtex. The presentation has been improved, the subsection
  on high dimensions has been modified. This version will appear in PRD","Phys.Rev. D65 (2002) 066003","10.1103/PhysRevD.65.066003","UMH-MG/01-02","hep-th",,"  We give simple representations for quantum theories in which the position
commutators are non vanishing constants. A particular representation reproduces
results found using the Moyal star product. The notion of exact localization
being meaningless in these theories, we adapt the notion of ``maximally
localized states'' developed in another context . We find that gaussian
functions play this role in a 2+1 dimensional model in which the non
commutation relations concern positions only. An interpretation of the wave
function in this non commutative geometry is suggested. We also analyze higher
dimensional cases. A possible incidence on the causality issue for a Q.F.T with
a non commuting time is sketched.
","[{""version"":""v1"",""created"":""Sat, 2 Jun 2001 13:28:18 GMT""},{""version"":""v2"",""created"":""Mon, 10 Dec 2001 08:45:13 GMT""}]","2009-11-07"
"hep-th/0106019","Maurizio Gasperini","V. Bozza, M. Gasperini and G. Veneziano","Localization of Scalar Fluctuations in a Dilatonic Brane-World Scenario","22 pages, latex","Nucl.Phys. B619 (2001) 191-210","10.1016/S0550-3213(01)00515-6","BA-TH/01-415, CERN/TH/2001-149","hep-th gr-qc",,"  We derive and solve the full set of scalar perturbation equations for a class
of $Z_2$-symmetric five-dimensional geometries generated by a bulk cosmological
constant and by a 3-brane non-minimally coupled to a bulk dilaton field. The
massless scalar modes, like their tensor analogues, are localized on the brane,
and provide long-range four-dimensional dilatonic interactions, which are
generically present even when matter on the brane carries no dilatonic charge.
The shorter-range corrections induced by the continuum of massive scalar modes
are always present: they persist even in the case of a trivial dilaton
background (the standard Randall--Sundrum configuration) and vanishing
dilatonic charges.
","[{""version"":""v1"",""created"":""Sat, 2 Jun 2001 15:42:15 GMT""}]","2009-11-07"
"math/0106003","F. Javier Thayer","F. Javier Thayer","Nonstandard Analysis of Graphs","31 pages. Added references. Corrected various errors (e.g. replaced
  an occurrence of ""reals"" with ""hyperreals"" and and several occurrences of the
  symbol for open ball with that for closed ball). Added details of some proofs",,,,"math.LO",,"  This paper shows certain classes of metric spaces characterized by volume
growth properties of balls can viewed as graphs with infinitesimal edges. Our
approach is based on nonstandard analysis.
","[{""version"":""v1"",""created"":""Fri, 1 Jun 2001 18:08:49 GMT""},{""version"":""v2"",""created"":""Sun, 3 Jun 2001 17:42:22 GMT""},{""version"":""v3"",""created"":""Thu, 27 Sep 2001 19:52:31 GMT""}]","2009-09-25"
"math/0106009","Van den Bergh, Michel","William Crawley-Boevey, Michel Van den Bergh","Absolutely indecomposable representations and Kac-Moody Lie algebras
  (with an appendix by Hiraku Nakajima)","The constant term conjecture is now true for indivisible dimension
  vectors",,,,"math.RA math.CO",,"  A conjecture of Kac states that the polynomial counting the number of
absolutely indecomposable representations of a quiver over a finite field with
given dimension vector has positive coefficients and furthermore that its
constant term is equal to the multiplicity of the corresponding root in the
associated Kac-Moody Lie algebra. In this paper we prove these conjectures for
indivisible dimension vectors.
","[{""version"":""v1"",""created"":""Fri, 1 Jun 2001 18:29:36 GMT""},{""version"":""v2"",""created"":""Tue, 12 Jun 2001 20:12:00 GMT""},{""version"":""v3"",""created"":""Mon, 19 Nov 2001 18:53:08 GMT""}]","2007-05-23"
"math/0106010","Dmitri Nikshych","Dmitri Nikshych","On the structure of weak Hopf algebras","Ams-latex, 21 page",,,,"math.QA",,"  We study the group of group-like elements of a weak Hopf algebra and derive
an analogue of Radford's formula for the fourth power of the antipode S, which
implies that the antipode has a finite order modulo a trivial automorphism. We
find a sufficient condition in terms of Tr(S^2) for a weak Hopf algebra to be
semisimple, discuss relation between semisimplicity and cosemisimplicity, and
apply our results to show that a dynamical twisting deformation of a semisimple
Hopf algebra is cosemisimple.
","[{""version"":""v1"",""created"":""Fri, 1 Jun 2001 23:06:50 GMT""}]","2007-05-23"
"math/0106011","Ostrik Viktor","Tanya Chmutova, Viktor Ostrik","Calculating canonical distinguished involutions in the affine Weyl
  groups","21 pages",,,,"math.RT",,"  Distinguished involutions in the affine Weyl groups, defined by G. Lusztig,
play an essential role in the Kazhdan-Lusztig combinatorics of these groups. A
distinguished involution is called canonical if it is the shortest element in
its double coset with respect to the finite Weyl group. Each two-sided cell in
the affine Weyl group contains precisely one canonical distinguished
involution. In this note we calculate the canonical distinguished involutions
in the affine Weyl groups of rank <8. We also prove some partial results
relating canonical distinguished involutions and Dynkin's diagrams of the
nilpotent orbits in the Langlands dual group.
","[{""version"":""v1"",""created"":""Sat, 2 Jun 2001 00:46:30 GMT""}]","2016-09-07"
"nucl-ex/0106003","Rivet Marie-France","M. Parlog, B. Borderie, M.F. Rivet, G. Tabacaru, A. Chbihi, M.
  Elouardi, N. Le Neindre, O. Lopez, E. Plagnol, L. Tassan-Got and the INDRA
  collaboration","Response of CsI(Tl) scintillators over a large range in energy and
  atomic number of ions (Part II): calibration and identification in the INDRA
  array","23 pages, 8 figures, submitted to Nucl. Inst. Meth. A","Nucl.Instrum.Meth. A482 (2002) 693-706","10.1016/S0168-9002(01)01712-0","IPNO-DR 01-013","nucl-ex",,"  The light output of the 324 CsI(Tl) scintillators of INDRA has been measured
over a large range both in energy: 1 - 80 AMeV and in atomic number of incident
ions: Z = 1 - 60. An analytical expression for the nonlinear total light
response as a function of the energy and the identity of the ion is proposed.
It depends on four parameters. For three of them, connected to CsI(Tl)
intrinsic characteristics, recommended fixed values are proposed. They are
issued from the comparative study of the forward scintillators of INDRA, based
on intermediate mass fragment data. The fourth one, related to light collection
and to the gain of the associated photomultiplier, is particular and may be
accurately obtained afterwards, from light charged particle data. Two
applications are presented: fragment identification in telescopes using a
CsI(Tl) crystal as residual energy detector and the scintillator energy
calibration. The results are successfully confronted to heavy fragment
experimental data.
","[{""version"":""v1"",""created"":""Fri, 1 Jun 2001 16:24:18 GMT""}]","2009-11-07"
"physics/0106004","Francesco Borghesani","A.F.Borghesani and M.Santini","High Temperature Electron Localization in dense He Gas","23 pages, 13 figures",,"10.1103/PhysRevE.65.056403",,"physics.plasm-ph physics.atom-ph",,"  We report new accurate mesasurements of the mobility of excess electrons in
high density Helium gas in extended ranges of temperature $[(26\leq T\leq 77) K
]$ and density $[ (0.05\leq N\leq 12.0) {atoms} \cdot {nm}^{-3}]$ to ascertain
the effect of temperature on the formation and dynamics of localized electron
states. The main result of the experiment is that the formation of localized
states essentially depends on the relative balance of fluid dilation energy,
repulsive electron-atom interaction energy, and thermal energy. As a
consequence, the onset of localization depends on the medium disorder through
gas temperature and density. It appears that the transition from delocalized to
localized states shifts to larger densities as the temperature is increased.
This behavior can be understood in terms of a simple model of electron
self-trapping in a spherically symmetric square well.
","[{""version"":""v1"",""created"":""Fri, 1 Jun 2001 18:31:41 GMT""}]","2016-09-08"
"physics/0106005","Michael Zeitlin","Antonina N. Fedorova, Michael G. Zeitlin","Quasiclassical Calculations of Wigner Functions in Nonlinear Beam
  Dynamics","3 pages, 2 figures, JAC2001.cls, submitted to Proc. Particle
  Accelerator Conference (PAC2001), Chicago, June 18-22, 2001",,,,"physics.acc-ph math-ph math.MP nlin.PS physics.comp-ph quant-ph",,"  We present the application of variational-wavelet analysis to
numerical/analytical calculations of Wigner functions in (nonlinear)
quasiclassical beam dynamics problems. (Naive) deformation quantization and
multiresolution representations are the key points. We construct the
representation via multiscale expansions in generalized coherent states or
high-localized nonlinear eigenmodes in the base of compactly supported wavelets
and wavelet packets.
","[{""version"":""v1"",""created"":""Sat, 2 Jun 2001 15:58:33 GMT""}]","2007-05-23"
"quant-ph/0106001","Horace P. Yuen","Horace P. Yuen","Unconditional security in quantum bit commitment","12 pages",,,,"quant-ph",,"  The commitment of bits between two mutually distrustful parties is a powerful
cryptographic primitive with which many cryptographic objectives can be
achieved. It is widely believed that unconditionally secure quantum bit
commitment is impossible due to quantum entanglement cheating, which is
codified in a general impossibility theorem. Gaps in the proof of this
impossibility theorem are found. An unconditionally secure bit commitment
protocol utilizing anonymous quantum states and the no-clone theorem is
presented below with a full security proof.
","[{""version"":""v1"",""created"":""Fri, 1 Jun 2001 17:03:53 GMT""}]","2007-05-23"
"quant-ph/0106008","Zhoudl","D.L.Zhou, G.R. Jin and C. P. Sun","Second Quantization of Cini Model for High Order Quantum Decoherence in
  Quantum Measurement","12 pages, revtex, 2 figures",,,,"quant-ph",,"  By making the second quantization for the Cini Model of quantum measurement
without wave function collapse [M. Cini, Nuovo Cimento, B73 27(1983)], the
second order quantum decoherence (SOQD) is studied with a two mode boson system
interacting with an idealized apparatus composed by two quantum oscillators. In
the classical limit that the apparatus is prepared in a Fock state with a very
large quantum number, or in a coherent state with average quantum numbers large
enough, the SOQD phenomenon appears similar to the first order case of quantum
decoherence.
","[{""version"":""v1"",""created"":""Sat, 2 Jun 2001 13:37:33 GMT""}]","2007-05-23"
