"cond-mat/0106045","Alexander Germanenko","G. M. Minkov, A. V. Germanenko, O. E. Rut, A. A. Sherstobitov, B. N.
  Zvonkov, E. A. Uskova, A. A. Birukov","Role of doped layers in dephasing of 2D electrons in quantum well
  structures","4 pages, 6 figures","Phys. Rev. B 64, 193309 (2001)","10.1103/PhysRevB.64.193309",,"cond-mat.soft",,"  The temperature and gate voltage dependences of the phase breaking time are
studied experimentally in GaAs/InGaAs heterostructures with single quantum
well. It is shown that appearance of states at the Fermi energy in the doped
layers leads to a significant decrease of the phase breaking time of the
carriers in quantum well and to saturation of the phase breaking time at low
temperature.
","[{""version"":""v1"",""created"":""Mon, 4 Jun 2001 15:18:33 GMT""}]","2009-11-07"
"gr-qc/0106008","Takashi Tamaki","Takashi Tamaki and Kei-ichi Maeda (Waseda University), Takashi Torii
  (University of Tokyo)","Internal structure of Skyrme black hole","5 pages, 4 figures, some contents added","Phys.Rev.D64:084019,2001","10.1103/PhysRevD.64.084019",,"gr-qc",,"  We consider the internal structure of the Skyrme black hole under a static
and spherically symmetric ansatz. $@u8(Be concentrate on solutions with the
node number one and with the ""winding"" number zero, where there exist two
solutions for each horizon radius; one solution is stable and the other is
unstable against linear perturbation. We find that a generic solution exhibits
an oscillating behavior near the sigularity, as similar to a solution in the
Einstein-Yang-Mills (EYM) system, independently to stability of the solution.
Comparing it with that in the EYM system, this oscillation becomes mild because
of the mass term of the Skyrme field. We also find Schwarzschild-like
exceptional solutions where no oscillating behavior is seen. Contrary to the
EYM system where there is one such solution branch if the node number is fixed,
there are two branches corresponding to the stable and the unstable ones.
","[{""version"":""v1"",""created"":""Mon, 4 Jun 2001 11:58:08 GMT""},{""version"":""v2"",""created"":""Mon, 2 Jul 2001 08:45:49 GMT""}]","2010-11-19"
"hep-ex/0106013","Vladimir Savinov","Vladimir Savinov (CLEO Collaboration, University of Pittsburgh)","QCD Studies in Two-Photon Collisions at CLEO","Contribution W03 to the SLAC Workshop on e+e- Physics at Intermediate
  Energies","eConf C010430:W03,2001",,,"hep-ex hep-ph",,"  We review QCD results of CLEO two-photon analyses and discuss the
measurements of two-photon partial widths of charmonium and cross sections for
hadron pairs production, antisearch for glueballs and the measurements of
$\gamma^*\gamma \to$ pseudoscalar meson transition form factors. We emphasize
the importance of other possible analyses, favorable trigger conditions and
selection criteria of the presently running experiment and the advantages of
CLEOc - the future $\tau$-charm factory at Cornell with the existing CLEO III
detector.
","[{""version"":""v1"",""created"":""Mon, 4 Jun 2001 14:45:40 GMT""}]","2014-11-17"
"hep-ex/0106014","Levonian Serguei","S. Levonian","F2p at low Q^2 and the total gamma-p cross section at HERA","3 pages, 4 figures, talk at ICHEP2000",,,,"hep-ex",,"  New precise measurements of the neutral current cross section at HERA are
presented in different Q^2 regimes. In the photoproduction limit the total
gamma-p cross section is found to be in agreement with the universal soft
Pomeron prediction. At medium scales 1.5 < Q^2 < 150 GeV^2 both the F_2 and the
F_L structure functions are determined. These data are well described by NLO
pQCD. The gluon density in the proton has been extracted from the scaling
violation of F_2 at low x. The transition between the two regimes occurs at
around Q^2=1 GeV^2.
","[{""version"":""v1"",""created"":""Mon, 4 Jun 2001 08:46:44 GMT""}]","2007-05-23"
"hep-ex/0106016","Sergey A. Kononov","M. Yu. Barnyakov, V. S. Bobrovnikov, A. R. Buzykaev, G. M. Kolachev,
  S. A. Kononov, E. A. Kravchenko, G. D. Minakov, A. P. Onuchin, A. F.
  Danilyuk, F. F. Guber, A. B. Kurepin, V. A. Krasnov","Proposal for the aerogel Cherenkov counters for the PEP-N detector","Talk at e+e- Physics at Intermediate Energies Workshop, SLAC,
  Stanford, USA, 30 April - 2 May 2001, (PSN T15), 6 pages, 14 figures, 2
  tables, a figure replaced, typos corrected","eConf C010430:T15,2001",,,"hep-ex",,"  The work is devoted to the development of the aerogel Cherenkov counters with
the light collection on wavelength shifters and PMTs (ASHIPH). The ASHIPH
system has been developed for the KEDR detector. Tests of the counters have
been carried out on the Dubna accelerator, the pi/K separation obtained is
about 4 sigma.
  The ASHIPH system is suggested for the PEP-N detector.
","[{""version"":""v1"",""created"":""Mon, 4 Jun 2001 13:56:12 GMT""},{""version"":""v2"",""created"":""Tue, 5 Jun 2001 10:53:03 GMT""}]","2014-11-17"
"hep-ph/0106027","Siannah Penaranda","Jaume Guasch, Wolfgang Hollik, Siannah Penaranda","Distinguishing Higgs models in H -> b b-bar / H -> tau^+ tau^-","LaTeX, 10 pages, 4 figures. Uses cite.sty. Comments and references
  added","Phys.Lett. B515 (2001) 367-374","10.1016/S0370-2693(01)00866-8","KA-TP-19-2001","hep-ph hep-ex hep-lat",,"  We analyze the ratio of branching ratios R=BR(H->b b-bar)/BR(H->tau^+ tau^-)
of Higgs boson decays as a discriminant quantity between supersymmetric and
non-supersymmetric models. This ratio receives large renormalization-scheme
independent radiative corrections in supersymmetric models at large \tan\beta,
which are absent in the Standard Model or Two-Higgs-doublet models. These
corrections are insensitive to the supersymmetric mass scale. A detailed
analysis in the effective Lagrangian approach shows that, with a measurement of
+-21% accuracy, the Large Hadron Collider can discriminate between models if
the CP-odd Higgs boson mass is below 900 GeV. An e+e- Linear Collider at 500
GeV center of mass energy can discriminate supersymmetric models up to a CP-odd
Higgs mass of ~ 1.8 TeV.
","[{""version"":""v1"",""created"":""Sun, 3 Jun 2001 18:08:52 GMT""},{""version"":""v2"",""created"":""Fri, 15 Jun 2001 15:21:51 GMT""}]","2009-11-07"
"hep-ph/0106028","Alex Kalloniatis","A.C. Kalloniatis (CSSM, University of Adelaide), S.N. Nedelko
  (University of Erlangen-Nuremberg)","Domain-like Structures in the QCD Vacuum, Confinement and Chiral
  Symmetry Breaking","8 pages, LaTeX. Talk given at the Workshop on Lepton-Scattering,
  Hadrons and QCD, Adelaide, 26 March-6 April, 2001",,"10.1142/9789812799708_0029","FAU-TP3-01/3","hep-ph",,"  We discuss how the inclusion of singular gauge fields in the partition
function for QCD can lead to a domain-like picture for the QCD vacuum by virtue
of specific conditions on quantum fluctuations at the singularities. With a
simplified model of hyperspherical domain regions with interiors of constant
field strength we calculate the basic parameters of the QCD vacuum, the gluon
condensate, topological susceptibility, string constant and quark condensate,
and briefly discuss confinement of dynamical quarks and gluons.
","[{""version"":""v1"",""created"":""Mon, 4 Jun 2001 08:38:20 GMT""}]","2017-08-23"
"hep-ph/0106029","Giovanni Ridolfi","G. Altarelli, F. Caravaglios, G.F. Giudice, P. Gambino, G. Ridolfi","Indication for Light Sneutrinos and Gauginos from Precision Electroweak
  Data","17 pages LaTex, 9 figures, uses epsfig","JHEP 0106:018,2001","10.1088/1126-6708/2001/06/018","CERN-TH/2001-145, GeF/TH/8-01, IFUM-689-FT","hep-ph",,"  The present Standard Model fit of precision data has a low confidence level,
and is characterized by a few inconsistencies. We look for supersymmetric
effects that could improve the agreement among the electroweak precision
measurements and with the direct lower bound on the Higgs mass. We find that
this is the case particularly if the 3.6 sigma discrepancy between sin^2
theta_eff from leptonic and hadronic asymmetries is finally settled more on the
side of the leptonic ones. After the inclusion of all experimental constraints,
our analysis selects light sneutrinos, with masses in the range 55-80 GeV, and
charged sleptons with masses just above their experimental limit, possibly with
additional effects from light gauginos. The phenomenological implications of
this scenario are discussed.
","[{""version"":""v1"",""created"":""Mon, 4 Jun 2001 09:00:58 GMT""}]","2010-02-03"
"hep-ph/0106030","Alexander Dolgov","A.D. Dolgov","Phase Transitions During Inflation and Chemically Inhomogeneous Universe","Lecture presented at Int. School Astrophysics ""D. Chalonge"", Erice,
  Italy, 6-17 Dec. 2000; 16 pages (to be published in the Proceedings)",,,,"hep-ph astro-ph",,"  Several models of baryo(lepto)-genesis that give rise to large
inhomogeneities in the composition of the universe are presented. In
particular, a variation of primordial abundances of light elements by the
factor 2-5 at large distances is predicted. A cosmological model of baryonic
island is considered. Creation of domains with very large baryon and antibaryon
number is described. Such domains mostly collapsed into primordial black holes
that could be the dominant part of (non-standard) cosmological cold dark matter
with a widely dispersed mass spectrum. A non-collapsed part of these bubbles
might make clouds of matter or antimatter with an enriched abundances of
metals. A mechanism for creation of such exotic objects can be realized by
mixed order phase transitions induced by the inflaton field.
","[{""version"":""v1"",""created"":""Mon, 4 Jun 2001 09:14:58 GMT""}]","2007-05-23"
"hep-ph/0106031","Jacques C. R. Bloch","J.C.R. Bloch","Multiplicative renormalizability of gluon and ghost propagators in QCD","13 pages, 1 figure, submitted to Phys. Rev. D","Phys.Rev.D64:116011,2001","10.1103/PhysRevD.64.116011","UNITU-THEP-14/01","hep-ph hep-th nucl-th",,"  We reformulate the coupled set of continuum equations for the renormalized
gluon and ghost propagators in QCD, such that the multiplicative
renormalizability of the solutions is manifest, independently of the specific
form of full vertices and renormalization constants. In the Landau gauge, the
equations are free of renormalization constants, and the renormalization point
dependence enters only through the renormalized coupling and the renormalized
propagator functions. The structure of the equations enables us to devise novel
truncations with solutions that are multiplicatively renormalizable and agree
with the leading order perturbative results. We show that, for infrared power
law behaved propagators, the leading infrared behavior of the gluon equation is
not solely determined by the ghost loop, as concluded in previous studies, but
that the gluon loop, the three-gluon loop, the four-gluon loop, and even
massless quarks also contribute to the infrared analysis. In our new Landau
gauge truncation, the combination of gluon and ghost loop contributions seems
to reject infrared power law solutions, but massless quark loops illustrate how
additional contributions to the gluon vacuum polarization could reinstate these
solutions. Moreover, a schematic study of the three-gluon and four-gluon loops
shows that they too need to be considered in more detail before a definite
conclusion about the existence of infrared power behaved gluon and ghost
propagators can be reached.
","[{""version"":""v1"",""created"":""Mon, 4 Jun 2001 09:26:02 GMT""}]","2009-01-14"
"hep-ph/0106032","Armando Perez","H. D. Sivak, A. Perez and Joaquin Diaz-Alonso","Complex poles and oscillatory screened potential in QED plasmas",,,,"IFIC/01-32","hep-ph",,"  We discuss the mechanism for the oscillatory behavior of the static
interparticle potential in a degenerate electron plasma. This behavior,
observed in metallic alloys, is commonly referred to as 'Friedel oscillations',
and its origin associated to the Kohn singularity. We show that, although this
interpretation is adequate for large distances, the oscillations at short
distances originate from a complex pole of the in-medium photon propagator in
the complex q-plane, which exists aside the (purely imaginary) Debye pole. Such
short-range oscillations can be physically discriminated if they remain at
temperatures for which Friedel oscillations have already disappeared. This is
suggested by finite temperature calculations in non-electromagnetic plasma
models showing a similar pole structure.
","[{""version"":""v1"",""created"":""Mon, 4 Jun 2001 09:34:13 GMT""}]","2007-05-23"
"hep-ph/0106033","George Zoupanos","P. Manousselis and G. Zoupanos","Soft Supersymmetry Breaking due to Dimensional Reduction over
  Non-Symmetric Coset Spaces","14 pages, Latex, Comments related to the Scherk-Schwarz mechanism and
  relevant references added","Phys.Lett.B518:171-180,2001","10.1016/S0370-2693(01)01040-1","NTUA-05/01","hep-ph hep-th",,"  A ten-dimensional supersymmetric $E_8$ gauge theory is compactified over
six-dimensional coset spaces, establishing further our earlier conjecture that
the resulting four dimensional theory is a softly broken supersymmetric gauge
theory in the case that the used coset space is non-symmetric. The specific
non-symmetric six-dimensional spaces examined in the present study are
$Sp(4)/(SU(2) \times U(1))_{non-max.}$ and $ SU(3)/U(1) \times U(1)$.
","[{""version"":""v1"",""created"":""Mon, 4 Jun 2001 13:23:57 GMT""},{""version"":""v2"",""created"":""Wed, 27 Jun 2001 15:09:49 GMT""},{""version"":""v3"",""created"":""Tue, 21 Aug 2001 15:23:22 GMT""}]","2011-07-19"
"hep-ph/0106035","George Lazarides","R. Jeannerot (SISSA, Trieste), S. Khalil (Sussex U. & Ain Shams U.,
  Cairo), G. Lazarides (Aristotle U. of Thessaloniki)","Monopole Problem and Extensions of Supersymmetric Hybrid Inflation","Talk given by G. Lazarides at Cairo International Conference on
  High-Energy Physics (CICHEP 2001), Cairo, Egypt, 9-14 January 2001 (to appear
  in the proceedings), 15 pages including 1 figure, uses Rinton-P9x6.cls",,,"UT-STPD-2/01","hep-ph",,"  We discuss, in the context of a concrete supersymmetric grand unified model
based on the Pati-Salam gauge group SU(4)_c x SU(2)_L x SU(2)_R, two ""natural""
extensions of supersymmetric hybrid inflation, which avoid the cosmological
disaster encountered in the standard hybrid inflationary scenario from the
overproduction of monopoles at the end of inflation. Successful ""reheating""
which satisfies the gravitino constraint takes place after the end of
inflation. Also, adequate baryogenesis via a primordial leptogenesis occurs
consistently with the solar and atmospheric neutrino oscillation data as well
as the SU(4)_c symmetry. Moreover, the mu-term is generated via a Peccei-Quinn
symmetry and proton is practically stable.
","[{""version"":""v1"",""created"":""Mon, 4 Jun 2001 15:47:46 GMT""}]","2007-05-23"
"hep-th/0106024","Sunil Mukhi","Sumit R. Das, Sunil Mukhi and Nemani V. Suryanarayana (Tata Institute,
  Mumbai)","Derivative Corrections from Noncommutativity","22 pages, harvmac (b), v3: typos corrected","JHEP 0108:039,2001","10.1088/1126-6708/2001/08/039","TIFR/TH/01-19","hep-th",,"  We show that an infinite subset of the higher-derivative alpha' corrections
to the DBI and Chern-Simons actions of ordinary commutative open-string theory
can be determined using noncommutativity. Our predictions are compared to some
lowest order alpha' corrections that have been computed explicitly by Wyllard
(hep-th/0008125), and shown to agree.
","[{""version"":""v1"",""created"":""Mon, 4 Jun 2001 11:04:23 GMT""},{""version"":""v2"",""created"":""Thu, 7 Jun 2001 16:32:46 GMT""},{""version"":""v3"",""created"":""Wed, 27 Jun 2001 05:57:45 GMT""}]","2010-05-28"
"hep-th/0106025","Michael A. Clayton","M. A. Clayton","Nonlocal regularization of abelian models with spontaneous symmetry
  breaking","11 pages, uses amsart. To appear in Mod. Phys. Lett A","Mod.Phys.Lett. A16 (2001) 1117-1127","10.1142/S0217732301004327",,"hep-th",,"  We demonstrate how nonlocal regularization is applied to gauge invariant
models with spontaneous symmetry breaking. Motivated by the ability to find a
nonlocal BRST invariance that leads to the decoupling of longitudinal gauge
bosons from physical amplitudes, we show that the original formulation of the
method leads to a nontrivial relationship between the nonlocal form factors
that can appear in the model.
","[{""version"":""v1"",""created"":""Sun, 3 Jun 2001 16:14:08 GMT""}]","2009-11-07"
"hep-th/0106026","Christopher Pope","M. Cvetic, G.W. Gibbons, H. Lu and C.N. Pope","Supersymmetric M3-branes and G_2 Manifolds","Latex, 29 pages. This corrects a previous version in which it was
  claimed that the M3-brane solutions were pseudo-supersymmetric rather than
  supersymmetric","Nucl.Phys.B620:3-28,2002","10.1016/S0550-3213(01)00534-X",,"hep-th",,"  We obtain a generalisation of the original complete Ricci-flat metric of G_2
holonomy on R^4\times S^3 to a family with a non-trivial parameter \lambda. For
generic \lambda the solution is singular, but it is regular when
\lambda={-1,0,+1}. The case \lambda=0 corresponds to the original G_2 metric,
and \lambda ={-1,1} are related to this by an S_3 automorphism of the SU(2)^3
isometry group that acts on the S^3\times S^3 principal orbits. We then
construct explicit supersymmetric M3-brane solutions in D=11 supergravity,
where the transverse space is a deformation of this class of G_2 metrics. These
are solutions of a system of first-order differential equations coming from a
superpotential. We also find M3-branes in the deformed backgrounds of new
G_2-holonomy metrics that include one found by A. Brandhuber, J. Gomis, S.
Gubser and S. Gukov, and show that they also are supersymmetric.
","[{""version"":""v1"",""created"":""Sun, 3 Jun 2001 17:03:52 GMT""},{""version"":""v2"",""created"":""Mon, 11 Jun 2001 20:23:38 GMT""}]","2008-11-26"
"hep-th/0106027","Yutaka Matsuo","Yutaka Matsuo","Identity Projector and D-brane in String Field Theory","Latex 11 pages 1 figure (v2) new references and comments, typo
  correction (v3) another comment, English correction","Phys.Lett. B514 (2001) 407-412","10.1016/S0370-2693(01)00841-3","UT-943","hep-th",,"  We study the identity projectors of the string field theory in the generic
BCFT background. We explain how it can be identified as the projector in the
linking algebra of the noncommutative geometry. We show that their
(regularized) trace is exactly given by the boundary entropy which is
proportional to the D-brane tension.
","[{""version"":""v1"",""created"":""Mon, 4 Jun 2001 01:24:18 GMT""},{""version"":""v2"",""created"":""Wed, 6 Jun 2001 02:27:03 GMT""},{""version"":""v3"",""created"":""Wed, 13 Jun 2001 21:11:50 GMT""}]","2009-11-07"
"hep-th/0106028","Euro Spallucci","S.Ansoldi, C.Castro, E.Spallucci","The QCD Membrane","14 pages, LaTeX, non figures; accepted for publication in
  Class.Quant. Grav","Class.Quant.Grav.18:2865-2876,2001","10.1088/0264-9381/18/15/302",,"hep-th hep-ph",,"  In this paper we study spatially quenched, SU(N) Yang-Mills theory in the
large-N limit. The resulting reduced action shows the same formal look as the
Banks-Fischler-Shenker-Susskind M-theory action. The Weyl-Wigner-Moyal symbol
of this matrix model is the Moyal deformation of a p(=2)-brane action. Thus,
the large-N limit of the spatially quenched SU(N) Yang-Mills is seen to
describe a dynamical membrane. By assuming spherical symmetry we compute the
mass spectrum of this object in the WKB approximation.
","[{""version"":""v1"",""created"":""Mon, 4 Jun 2001 13:57:14 GMT""}]","2014-11-18"
"hep-th/0106029","Hendryk Pfeiffer","Hendryk Pfeiffer (Cambridge)","Four-dimensional Lattice Gauge Theory with ribbon categories and the
  Crane-Yetter state sum","41 pages, LaTeX, postscript/PiCTeX figures; v2:typos corrected","J.Math.Phys.42:5272-5305,2001","10.1063/1.1398063","DAMTP-2001-37","hep-th",,"  Lattice Gauge Theory in 4-dimensional Euclidean space-time is generalized to
ribbon categories which replace the category of representations of the gauge
group. This provides a framework in which the gauge group becomes a quantum
group while space-time is still given by the `classical' lattice. At the
technical level, this construction generalizes the Spin Foam Model dual to
Lattice Gauge Theory and defines the partition function for a given
triangulation of a closed and oriented piecewise-linear 4-manifold. This
definition encompasses both the standard formulation of d=4 pure Yang-Mills
theory on a lattice and the Crane-Yetter invariant of 4-manifolds. The
construction also implies that a certain class of Spin Foam Models formulated
using ribbon categories are well-defined even if they do not correspond to a
Topological Quantum Field Theory.
","[{""version"":""v1"",""created"":""Mon, 4 Jun 2001 15:22:25 GMT""},{""version"":""v2"",""created"":""Thu, 6 Sep 2001 09:59:01 GMT""}]","2008-11-26"
"math-ph/0106002","Jan Wetzel","Davide Fattori, Victor G. Kac","Classification of finite simple Lie conformal superalgebras","29 pages, LaTex","J. Algebra 258 (2002), 23-59",,,"math-ph math.MP",,"  The notion of a Lie conformal superalgebra encodes an axiomatic descrption of
singular parts of the operator product expansions of chiral fields in conformal
field theory. In the paper we give a detailed proof of the classification of
all finite simple Lie conformal superalgebras. We also classify all their
central extensions.
","[{""version"":""v1"",""created"":""Mon, 4 Jun 2001 13:44:20 GMT""}]","2014-01-17"
"math/0106015","Steven G. Krantz","Kang-Tae Kim and Steven G. Krantz","Characterization of the Hilbert ball by its automorphism group",,,,,"math.CV math.FA",,"  Let $\Omega$ be a bounded, convex domain in a separable Hilbert space. The
authors prove a version of the theorem of Bun Wong, which asserts that if such
a domain admits an automorphism orbit accumulating at a strongly pseudoconvex
boundary point then it is biholomorphic to the ball. Key ingredients in the
proof are a new localization argument using holomorphic peaking functions and
the use of new ``normal families'' arguments in the construction of the limit
biholomorphism.
","[{""version"":""v1"",""created"":""Sun, 3 Jun 2001 21:24:54 GMT""}]","2007-05-23"
"math/0106016","Siman Wong","Siman Wong","`Abstract' homomorphisms of l-adic Galois groups and Abelian varieties","Revision, with a new section",,,,"math.NT math.AG",,"  Let $k$ be a totally real field, and let $A/k$ be an absolutely irreducible,
polarized Abelian variety of odd, prime dimension whose endomorphisms are all
defined over $k$. Then the only strictly compatible families of abstract,
absolutely irreducible representations of $\gal(\ov{k}/k)$ coming from $A$ are
tensor products of Tate twists of symmetric powers of two-dimensional
$\lambda$-adic representations plus field automorphisms. The main ingredients
of the proofs are the work of Borel and Tits on the `abstract' homomorphisms of
almost simple algebraic groups, plus the work of Shimura on the fields of
moduli of Abelian varieties.
","[{""version"":""v1"",""created"":""Sun, 3 Jun 2001 23:12:18 GMT""},{""version"":""v2"",""created"":""Wed, 4 Jul 2001 01:37:53 GMT""}]","2007-05-23"
"math/0106017","Martin Scharlemann","Martin Scharlemann","There are no unexpected tunnel number one knots of genus one","73 pp. including 30 figures",,,"UCSB Math 2001-7","math.GT",,"  The only knots that are tunnel number one and genus one are those that are
already known: 2-bridge knots obtained by plumbing together two unknotted
annuli and the satellite examples classified by Eudave-Munoz and by
Morimoto-Sakuma. This confirms a conjecture first made by Goda and Teragaito.
","[{""version"":""v1"",""created"":""Mon, 4 Jun 2001 00:48:11 GMT""}]","2007-05-23"
"math/0106018","Dr Danny Stevenson","Danny Stevenson","Bundle 2-gerbes","27 pages",,,,"math.DG",,"  We make the category BGrb_M of bundle gerbes on a manifold M into a
2-category by providing 2-cells in the form of transformations of bundle gerbe
morphisms. This description of BGrb_M as a 2-category is used to define the
notion of a bundle 2-gerbe. To every bundle 2-gerbe on M is associated a class
in H^4(M;Z). We define the notion of a bundle 2-gerbe connection and show how
this leads to a closed, integral differential 4-form on M which represents the
image in real cohomology of the class in H^4(M;Z). Some examples of bundle
2-gerbes are discussed, including the bundle 2-gerbe associated to a principal
G-bundle P \to M. It is shown that the class in H^4(M;Z) associated to this
bundle 2-gerbe coincides with the first Pontryagin class of P --- this example
was previously considered from the point of view of 2-gerbes by Brylinski and
McLaughlin.
","[{""version"":""v1"",""created"":""Mon, 4 Jun 2001 06:35:55 GMT""}]","2007-05-23"
"math/0106019","Marco Mackaay","Marco Mackaay","A note on the holonomy of connections in twisted bundles","LaTeX, 24 pages, 3 pictures",,,,"math.DG hep-th math.CT",,"  Recently twisted K-theory has received much attention due to its applications
in string theory and the announced result by Freed, Hopkins and Telemann
relating the twisted equivariant K-theory of a compact Lie group to its
Verlinde algebra. Rather than considering gerbes as separate objects, in
twisted K-theory one considers a gerbe as being part of the data for a twisted
vector bundle. There is also a notion of a connection in a twisted vector
bundle and Kapustin has studied some aspects of the holonomy of such
connections. In this note I study the holonomy of connections in twisted
principal bundles and show that it can best be defined as a functor rather than
a map. Even for the case which Kapustin studied the results in this paper give
a more general picture.
","[{""version"":""v1"",""created"":""Mon, 4 Jun 2001 11:44:11 GMT""},{""version"":""v2"",""created"":""Fri, 5 Oct 2001 14:11:20 GMT""},{""version"":""v3"",""created"":""Tue, 30 Jul 2002 15:51:21 GMT""}]","2007-05-23"
