"astro-ph/0106035","Mike Turner","Michael S. Turner (U. Chicago and Fermilab)","The Case for Omega_M = 0.33 +/- 0.035","4 ApJ LaTeX. Submitted to Astrophys J Lett. Less provocative title,
  same conclusions","Astrophys.J.576:L101-L104,2002","10.1086/343782",,"astro-ph hep-ph",,"  For decades, the determination of the mean density of matter(Omega_M) has
been tied to the distribution of light. This has led to a ``bias,'' perhaps as
large as a factor of 2, in determining a key cosmological parameter. Recent
measurements of the physical properties of clusters, cosmic microwave
background (CMB) anisotropy and the power spectrum of mass inhomogeneity now
allow a determination of Omega_M without ``visual bias.'' The early data lead
to a consistent picture of the matter and baryon densities, with Omega_B =
0.039 +/- 0.0075 and Omega_M = 0.33 +/- 0.035.
","[{""version"":""v1"",""created"":""Mon, 4 Jun 2001 15:28:33 GMT""},{""version"":""v2"",""created"":""Mon, 1 Jul 2002 17:41:23 GMT""}]","2011-05-12"
"astro-ph/0106039","Piotr Zycki","P.T. Zycki (CAMK, Warsaw), C. Done (Univ. of Durham), D.A. Smith
  (Univ. of Maryland)","On the complex disc-corona interactions in the soft spectral states of
  Soft X-ray Transients","MNRAS, in press, 15 pages","Mon.Not.Roy.Astron.Soc. 326 (2001) 1367","10.1111/j.1365-2966.2001.04698.x",,"astro-ph",,"  Accreting black holes show a complex and diverse behaviour in their soft
spectral states. Although these spectra are dominated by a soft, thermal
component which almost certainly arises from an accretion disc, there is also a
hard X-ray tail indicating that some fraction of the accretion power is instead
dissipated in hot, optically thin coronal material. During such states, best
observed in the early outburst of Soft X-ray Transients, the ratio of power
dissipated in the hot corona to that in the disc can vary from ~0 (pure disc
accretion) to ~1 (equal power in each). Here we present results of spectral
analyses of a number of sources, demonstrating the presence of complex features
in their energy spectra. Our main findings are: (1) the soft components are not
properly described by a thermal emission from accretion discs: they are
appreciably broader than can be described by disc blackbody models even
including relativistic effects, and (2) the spectral features near 5-9 keV
commonly seen in such spectra can be well described by reprocessing of hard
X-rays by optically thick, highly ionized, relativistically moving plasma.
","[{""version"":""v1"",""created"":""Sun, 3 Jun 2001 16:01:09 GMT""}]","2016-01-13"
"astro-ph/0106040","Duncan Forbes","Duncan A. Forbes (Swinburne University)","The Globular Cluster Systems of Ellipticals and Spirals","6 pages, Latex, 4 figures, To appear in the proceedings of IAU Symp.
  207, ""Extragalactic Star Clusters"", eds. Grebel, Geisler, Minniti",,,,"astro-ph",,"  In this overview of the key properties of globular cluster (GC) systems I
show that the GCs in elliptical and spiral host galaxies have more in common
than previously thought. After contrasting these properties I briefly comment
on GC formation.
","[{""version"":""v1"",""created"":""Mon, 4 Jun 2001 04:57:22 GMT""}]","2007-05-23"
"astro-ph/0106041","Robert C. Duncan","R. C. Duncan (Univ. of Texas at Austin)","Nature, Nurture or Not Sure? A Debate about SGRs and AXPs","To appear in Proc. of Rome Workshop on SGRs - AXPs, Oct. 2000, M.
  Feroci & S. Mereghetti, eds. [Submitted Feb. 2001] (8 pages)",,,,"astro-ph",,"  Marsden, Lingenfelter, Rothschild & Higdon have given arguments against the
magnetar model for Soft Gamma Repeaters (SGRs) and Anomalous X-ray Pulsars
(AXPs), as forcefully advocated by R. Rothschild at this meeting. We critique
these arguments, showing: (1) The claim that SGRs and AXPs are born in
unusually dense regions of the ISM is not supported in any compelling way by
observations. (2) Even if this claim were true, it would not argue against the
magnetar model. Moreover, all observations can be accounted for if magnetars
have shorter observable lifetimes than do radiopulsars, in agreement with
theoretical expectations, but no systematically different ambient ISM
densities. (3) The suggestion that accretion onto the neutron star is directly
influenced by the ISM in a way that explains the difference between SGRs/AXPs
and radiopulsars, is not possible. The mass inflow rate during later stages of
supernova remnant expansion when accretion can be influenced by backpressure
from the ISM is many orders of magnitude too small. (4) Accretion-based models
are unable to account for the hyper-Eddington bursts and flares which are the
defining characteristic of SGRs. (5) Accretion disk models also predict optical
and IR emission with higher luminosities than are observed.
","[{""version"":""v1"",""created"":""Mon, 4 Jun 2001 07:38:14 GMT""}]","2007-05-23"
"astro-ph/0106042","Shay Zucker","Shay Zucker and Tsevi Mazeh (Wise Observatory, Tel-Aviv University,
  Tel-Aviv, Israel)","Derivation of the Mass Distribution of Extrasolar Planets with MAXLIMA -
  a Maximum Likelihood Algorithm","19 pages, 3 figures, submitted to The Astrophysical Journal","Astrophys.J. 562 (2001) 1038-1044","10.1086/323866",,"astro-ph",,"  We construct a maximum-likelihood algorithm - MAXLIMA, to derive the mass
distribution of the extrasolar planets when only the minimum masses are
observed. The algorithm derives the distribution by solving a numerically
stable set of equations, and does not need any iteration or smoothing. Based on
50 minimum masses, MAXLIMA yields a distribution which is approximately flat in
log M, and might rise slightly towards lower masses. The frequency drops off
very sharply when going to masses higher than 10 Jupiter masses, although we
suspect there is still a higher mass tail that extends up to probably 20
Jupiter masses. We estimate that 5% of the G stars in the solar neighborhood
have planets in the range of 1-10 Jupiter masses with periods shorter than 1500
days. For comparison we present the mass distribution of stellar companions in
the range of 100--1000 Jupiter masses, which is also approximately flat in log
M. The two populations are separated by the ""brown-dwarf desert"", a fact that
strongly supports the idea that these are two distinct populations. Accepting
this definite separation, we point out the conundrum concerning the
similarities between the period, eccentricity and even mass distribution of the
two populations.
","[{""version"":""v1"",""created"":""Mon, 4 Jun 2001 08:59:17 GMT""}]","2007-05-23"
"astro-ph/0106043","Amanda Burston","A. J. Burston, M. J. Ward and R. I. Davies","Investigating the central engine and excitation mechanisms of
  ultraluminous infrared galaxies: near infrared spectroscopy","14 pages with 7 figures. To be published in MNRAS","Mon.Not.Roy.Astron.Soc. 326 (2001) 403","10.1046/j.1365-8711.2001.04623.x",,"astro-ph",,"  We present NIR observations of a sample of mainly interacting ULIRGs,
comprising H and K band spectra. Our main aims are to investigate the power
source of these extremely luminous objects and the various excitation
mechanisms of the strong molecular hydrogen emission often seen in such
objects. Broadened emission lines were only detected in one object, IRAS 23498,
consistent with previous results for this galaxy. The [SiVI] emission line was
detected in IRAS17179 and IRAS20210, both classified as Sy2s. Two of the sample
were unclassified, IRAS00150 and IRAS23420, which exhibit neither [SiVI]
emission or broadened HI emission. However this does not rule out the presence
of an obscured AGN. Analysis of the molecular hydrogen emission showed that the
major excitation mechanism for most objects was thermal. Modelling of the more
luminous objects indicate for IRAS20210 10 per cent, and for both IRAS23365 and
IRAS23420, 30 per cent of their 1-0S(1) line emission has a non-thermal origin.
","[{""version"":""v1"",""created"":""Mon, 4 Jun 2001 11:16:11 GMT""}]","2009-11-06"
"astro-ph/0106044","Sergio J. Sciutto","S. J. Sciutto","The AIRES system for air shower simulations. An update","Contribution to the 27th ICRC (Hamburg, August 7-15, 2001)",,,,"astro-ph hep-ph",,"  A report on the characteristics of ultra-high energy air showers simulated
with the current version of the AIRES program is presented. The AIRES system
includes a fast simulating program, originally designed on the basis of the
well-known MOCCA program, and progressively improved and tested. The AIRES
algorithms are briefly described and some results coming from the simulations
are analyzed.
","[{""version"":""v1"",""created"":""Mon, 4 Jun 2001 11:38:32 GMT""}]","2007-05-23"
"astro-ph/0106045","Mark L. McConnell","M. L. McConnell, K. Bennett, H. Bloemen, W. Collmar, W. Hermsen, L.
  Kuiper, W. Paciesas, B. Phlips, J. Poutanen, J. M. Ryan, V. Schoenfelder, H.
  Steinle, A. W. Strong, and A. A. Zdziarski","Gamma-Ray Spectral Variability of Cygnus X-1","5 pages, submitted to the proceedings of the GAMMA 2001 High Energy
  Astrophysics Symposium (Baltimore, April 4-6, 2001)",,"10.1063/1.1419379",,"astro-ph",,"  We have used observations from CGRO to study the variation in the MeV
emission of Cygnus X-1 between its low and high X-ray states. These data
provide a measurement of the spectral variability above 1 MeV. The high state
MeV spectrum is found to be much harder than that of the low state MeV
spectrum. In particular, the power-law emission seen at hard X-ray energies in
the high state spectrum (with a photon spectral index of 2.6) is found to
extend out to at least 5 MeV, with no evidence for any cutoff. Here we present
the data and describe our efforts to model both the low state and high state
spectra using a hybrid thermal/nonthermal model in which the emission results
from the Comptonization of an electron population that consists of both a
thermal and nonthermal component.
","[{""version"":""v1"",""created"":""Mon, 4 Jun 2001 12:18:57 GMT""}]","2009-11-06"
"astro-ph/0106046","Luke Drury","L O'C Drury, D C Ellison, F A Aharonian, E Berezhko, A Bykov, A
  Decourchelle, R Diehl, G Meynet, E Parizot, J Raymond, S Reynolds, S Spangler","Tests of Galactic Cosmic Ray Source Models","Report of working group number four at the ISSI workshop on
  Astrophysics of Galactic Cosmic Rays",,"10.1007/978-94-017-3239-0_28",,"astro-ph",,"  This report discusses the possibilities for observational tests of current
models and ideas regarding the origin of the Galactic Cosmic Rays using
facilities which are already available.
","[{""version"":""v1"",""created"":""Mon, 4 Jun 2001 13:14:29 GMT""}]","2022-03-30"
"astro-ph/0106047","Mark L. McConnell","M. L. McConnell, L. A. Hamel, J. R. Macri, M. McClish, and J. R. Ryan","The Development of Coplanar CZT Detectors for Gamma-Ray Astronomy","5 pages, submitted to the proceedings of the GAMMA 2001 High Energy
  Astrophysics Symposium (Baltimore, April 4-6, 2001)",,"10.1063/1.1419519",,"astro-ph",,"  The development of CdZnTe detectors with an orthogpnal coplanar anode
structure has important implications for future astrophysical instrumentation.
As electron-only devices, like pixel detectors, coplanar anode strip detectors
can be fabricated in the thickness required to be effective for photons with
energies in excess of 500 keV. Unlike conventional double-sided strip
detectors, the coplanar anode strip detectors require segmented contacts and
signal processing electronics on only one surface. This facilitates the
fabrication of closely-packed large area arrays that will be required for the
next generation of coded aperture imagers. These detectors provide both very
good energy resolution and sub-millimeter spatial resolution (in all three
spatial dimensions) with far fewer electronic channels than are required for
pixel detectors. Here we summarize results obtained from prototype detectors
having a thickness of 5 mm and outline a concept for large area applications.
","[{""version"":""v1"",""created"":""Mon, 4 Jun 2001 13:22:41 GMT""}]","2009-11-06"
"cond-mat/0106028","Thorsten Emig","Thorsten Emig, Andreas Hanke, Ramin Golestanian, Mehran Kardar","Probing the Strong Boundary Shape Dependence of the Casimir Force","4 pages, 3 figures, accepted for publication in Physical Review
  Letters","Phys.Rev.Lett. 87 (2001) 260402","10.1103/PhysRevLett.87.260402","NSF-ITP-01-52","cond-mat.stat-mech hep-th quant-ph",,"  We study the geometry dependence of the Casimir energy for deformed metal
plates by a path integral quantization of the electromagnetic field. For the
first time, we give a complete analytical result for the deformation induced
change in Casimir energy \delta\cal E in an experimentally testable, nontrivial
geometry, consisting of a flat and a corrugated plate. Our results show an
interesting crossover for \delta\cal E as a function of the ratio of the mean
plate distance H, to the corrugation length \lambda: For \lambda \ll H we find
a {\em slower} decay \sim H^{-4}, compared to the H^{-5} behavior predicted by
the commonly used pairwise summation of van der Waals forces, which is valid
only for \lambda \gg H.
","[{""version"":""v1"",""created"":""Sun, 3 Jun 2001 20:04:45 GMT""},{""version"":""v2"",""created"":""Thu, 8 Nov 2001 17:14:54 GMT""}]","2009-11-07"
"cond-mat/0106029","Ralf Bundschuh","R. Bundschuh and T. Hwa","Glass transition in secondary structures formed by random RNA sequences","4 pages, 2 figures",,,,"cond-mat.stat-mech cond-mat.soft physics.bio-ph q-bio.BM",,"  Formation of RNA secondary structures is an example of the sequence-structure
problem omnipresent in biopolymers. A theoretical question of recent interest
is whether a random RNA sequence undergoes a finite temperature glass
transition. We answer this question affirmatively by first establishing the
perturbative stability of the high temperature phase via a two replica
calculation. Subsequently, we show that this phase cannot persist down to zero
temperature by considering energetic contributions due to rare regions of
complementary subsequences.
","[{""version"":""v1"",""created"":""Mon, 4 Jun 2001 01:26:50 GMT""}]","2007-05-23"
"cond-mat/0106034","Yuri Pogorelov","Yu.G. Pogorelov and J.F. Polido","Transport processes in metal-insulator granular layers","14 pages, 13 figures. Figures were reformatted for better
  reproduction, some formulations were sharpened",,,,"cond-mat.mtrl-sci",,"  The non-equilibrium tunnel transport processes are considered in a square
lattice of metallic nanogranules embedded into insulating host. Based on a
simple model with three possible charging states (+,-, or 0) of a granule and
three kinetic processes (creation or recombination of a +- pair, and charge
transfer) between neighbor granules, the mean-field kinetic theory is
developed, which takes into account the interplay between the charging energy
and temperature and between the applied electric field and Coulomb fields by
non-compensated charge density. The resulting charge and current distributions
are found to depend essentially on the particular conditions in a granular
layer, namely, in a free area (FA) or in contact areas (CA) under macroscopic
metallic contacts. Thus, a steady state dc transport is only compatible with
zero charge density and ohmic resistivity within FA, but charge accumulation
and non-ohmic behavior are necessary for conduction over CA. The approximate
analytic solutions are obtained for characteristic regimes (low or high charge
density) of such conduction. Also non- stationary processes are considered,
displaying a peculiar combination of two strongly different relaxation times.
The comparison is done with the available transport data on similar
experimental systems.
","[{""version"":""v1"",""created"":""Sun, 3 Jun 2001 17:49:48 GMT""},{""version"":""v2"",""created"":""Thu, 14 Jun 2001 15:44:59 GMT""}]","2007-05-23"
"cond-mat/0106035","Wernsdorfer Wolfgang","W. Wernsdorfer, C. Thirion, N. Demoncy, H. Pascard, D. Mailly","Magnetization reversal by uniform rotation (Stoner-Wohlfarth model) in
  f.c.c. cobalt nanoparticles","9 pages, 10 figures; conference proceeding: 1st Joint European
  Magnetic Symposia (JEMS'01), Grenoble (France), 28th August - 1st September,
  2001",,"10.1016/S0304-8853(01)01153-2",,"cond-mat.mes-hall cond-mat.mtrl-sci",,"  The combination of high sensitive superconducting quantum interference device
(SQUID) with high quality nanoparticles allowed to check the simplest classical
model describing the magnetisation reversal by uniform rotation which were
proposed more than 50 years ago by Neel, Stoner and Wohlfarth. The micrometer
sized SQUIDs were elaborated by electron beam lithography and the nanoparticles
were synthesised by arc-discharge. The measured angular dependence of switching
fields of nearly all f.c.c. Co nanoparticles revealed a dominating uniaxial
magnetic anisotropy. This result suggests that twin boundaries and stacking
faults strongly alter the cubic magnetocrystalline anisotropy leading to
dominating uniaxial anisotropy. However, few particles were sufficiently
""perfect"" in order to show a more complex switching field surface and a field
path dependence of the switching field which is the important signature of the
cubic magnetocrystalline anisotropy.
","[{""version"":""v1"",""created"":""Sun, 3 Jun 2001 21:32:37 GMT""}]","2009-11-07"
"cond-mat/0106036","Olivier Cepas","O. Cepas, K. Kakurai, L.P. Regnault, T. Ziman, J.P. Boucher, N. Aso,
  M. Nishi, H. Kageyama, Y. Ueda","Dzyaloshinski-Moriya Interaction in the 2D Spin Gap System SrCu2(BO3)2","5 pages, 4 figures, symmetries clarified, added references, (v3)
  correct address","Phys. Rev. Lett. 87, 167205 (2001)","10.1103/PhysRevLett.87.167205",,"cond-mat.str-el",,"  The Dzyaloshinski-Moriya interaction partially lifts the magnetic frustration
of the spin-1/2 oxide SrCu2(BO3)2. It explains the fine structure of the
excited triplet state and its unusual magnetic field dependence, as observed in
previous ESR and new neutron inelastic scattering experiments. We claim that it
is mainly responsible for the dispersion. We propose also a new mechanism for
the observed ESR transitions forbidden by standard selection rules, that relies
on an instantaneous Dzyaloshinski-Moriya interaction induced by spin-phonon
couplings.
","[{""version"":""v1"",""created"":""Mon, 4 Jun 2001 04:55:48 GMT""},{""version"":""v2"",""created"":""Mon, 8 Oct 2001 05:06:52 GMT""},{""version"":""v3"",""created"":""Wed, 28 Nov 2001 01:06:06 GMT""}]","2009-11-07"
"cond-mat/0106039","Shunsuke Tsuda","A. Chainani, T. Yokoya, T. Kiss, S. Shin, T. Nishio, and H. Uwe","Electron-phonon coupling induced pseudogap and the superconducting
  transition in Ba0.67K0.33BiO3","5 pages with 4 figures, submitted to Phys. Rev. Lett",,"10.1103/PhysRevB.64.180509",,"cond-mat.supr-con",,"  We study the single particle density of states (DOS) across the
superconducting transition (Tc = 31 K) in single-crystal Ba0.67K0.33BiO3 using
ultrahigh resolution angle-integrated photoemission spectroscopy. The
superconducting gap opens with a pile-up in the DOS, Delta(5.3 K) = 5.2 meV and
2Delta(0)/kBTc = 3.9. In addition, we observe a pseudogap below and above Tc,
occurring as a suppression in intensity over an energy scale up to the
breathing mode phonon(~ 70 meV). The results indicate electron-phonon coupling
induces a pseudogap in Ba0.67K0.33BiO3.
","[{""version"":""v1"",""created"":""Mon, 4 Jun 2001 06:37:02 GMT""}]","2009-11-07"
"cond-mat/0106040","Ryo Tamura","Ryo Tamura (University of Tokyo)","Backward diode composed of a metallic and semiconducting nanotube","4 pages, RevTeX, uses epsf.sty",,"10.1103/PhysRevB.64.201404",,"cond-mat.mes-hall",,"  The conditions necessary for a nanotube junction connecting a metallic and
semiconducting nanotube to rectify the current are theoretically investigated.
A tight binding model is used for the analysis, which includes the Hartree-Fock
approximation and the Green's function method.
  It is found that the junction has a behavior similar to the backward diode if
the gate electrode is located nearby and the Fermi level of the semiconducting
tube is near the gap.
  Such a junction would be advantageous since the required length for the
rectification could be reduced.
","[{""version"":""v1"",""created"":""Mon, 4 Jun 2001 07:21:11 GMT""}]","2009-11-07"
"cond-mat/0106041","Hajime Tanaka","Hajime Tanaka","Physical Origin of the Boson Peak Deduced from a Two-Order-Parameter
  Model of Liquid","5 pages, 1 figure, An error in the reference (Ref. 7) was corrected","published in J. Phys. Soc. Jpn. 70, 1178 (2001)","10.1143/JPSJ.70.1178",,"cond-mat.mtrl-sci cond-mat.dis-nn",,"  We propose that the boson peak originates from the (quasi-) localized
vibrational modes associated with long-lived locally favored structures, which
are intrinsic to a liquid state and are randomly distributed in a sea of
normal-liquid structures. This tells us that the number density of locally
favored structures is an important physical factor determining the intensity of
the boson peak. In our two-order-parameter model of the liquid-glass
transition, the locally favored structures act as impurities disturbing
crystallization and thus lead to vitrification. This naturally explains the
dependence of the intensity of the boson peak on temperature, pressure, and
fragility, and also the close correlation between the boson peak and the first
sharp diffraction peak (or prepeak).
","[{""version"":""v1"",""created"":""Mon, 4 Jun 2001 08:13:04 GMT""},{""version"":""v2"",""created"":""Fri, 8 Jun 2001 04:09:57 GMT""}]","2009-11-07"
"cond-mat/0106042","Vladimir Konotop","F.Kh. Abdullaev, B.B. Baizakov, S.A. Darmanyan, V.V. Konotop, and M.
  Salerno","Nonlinear excitations in arrays of Bose-Einstein condensates","Submitted to Phys. Rev. A",,"10.1103/PhysRevA.64.043606",,"cond-mat.soft cond-mat.stat-mech",,"  The dynamics of localized excitations in array of Bose-Einstein condensates
is investigated in the framework of the nonlinear lattice theory. The existence
of temporarily stable ground states displaying an atomic population
distributions localized on very few lattice sites (intrinsic localized modes),
as well as, of atomic population distributions involving many lattice sites
(envelope solitons), is studied both numerically and analytically. The origin
and properties of these modes are shown to be inherently connected with the
interplay between macroscopic quantum tunnelling and nonlinearity induced
self-trapping of atoms in coupled BECs. The phenomenon of Bloch oscillations of
these excitations is studied both for zero and non zero backgrounds. We find
that in a definite range of parameters, homogeneous distributions can become
modulationally unstable. We also show that bright solitons and excitations of
shock wave type can exist in BEC arrays even in the case of positive scattering
length. Finally, we argue that BEC array with negative scattering length in
presence of linear potentials can display collapse.
","[{""version"":""v1"",""created"":""Mon, 4 Jun 2001 10:58:34 GMT""}]","2009-11-07"
"cond-mat/0106043","Masaaki Nakamura","Masaaki Nakamura (1) and Johannes Voit (2) ((1)MPIPKS Dresden,
  (2)Universitaet Bayreuth)","Lattice Twisting Operators and Vertex Operators in Sine-Gordon Theory in
  One Dimension","4 pages, 3 figures",,"10.1103/PhysRevB.65.153110",,"cond-mat.str-el cond-mat.stat-mech",,"  In one dimension, the exponential position operators introduced in a theory
of polarization are identified with the twisting operators appearing in the
Lieb-Schultz-Mattis argument, and their finite-size expectation values $z_L$
measure the overlap between the unique ground state and an excited state.
Insulators are characterized by $z_{\infty}\neq 0$. We identify $z_L$ with
ground-state expectation values of vertex operators in the sine-Gordon model.
This allows an accurate detection of quantum phase transitions in the
universality classes of the Gaussian model. We apply this theory to the
half-filled extended Hubbard model and obtain agreement with the level-crossing
approach.
","[{""version"":""v1"",""created"":""Mon, 4 Jun 2001 12:02:38 GMT""}]","2009-11-07"
"cond-mat/0106044","Shvaika Andrij","A.M. Shvaika","An analytical strong coupling approach in dynamical mean-field theory","6 pages, published in the Proceedings the XII-th School on Phase
  Transitions and Critical Phenomena, 21-24 June, 2001, Ladek Zdroj, Poland","Acta Physica Polonica B 32, 3415 (2001)",,,"cond-mat.str-el",,"  In the limit of infinite spatial dimensions a thermodynamically consistent
theory of the strongly correlated electron systems, which is valid for
arbitrary value of the Coulombic interaction ($U<\infty$), is built. For the
Hubbard model the total auxiliary single-site problem exactly splits into four
subspaces, which describe Fermi and non-Fermi liquid components. Such
analytical approach allows to construct different thermodynamically consistent
approximations: alloy-analogy approximation, Hartree-Fock approximation and
further, that describes the self-consistent renormalization of the bosonic
excitations (magnons and doublons).
","[{""version"":""v1"",""created"":""Mon, 4 Jun 2001 13:37:50 GMT""},{""version"":""v2"",""created"":""Mon, 12 Nov 2001 13:51:09 GMT""}]","2007-05-23"
