"math/0106020","Louis Funar","Dorin Andrica, Louis Funar","On smooth maps with finitely many critical points","revised version, 15 pages, to appear J.London Math.Soc","J. London Math.Soc. 69(2004), 783-800.",,,"math.GT math.AT math.DG",,"  We compute the minimum number of critical points of a small codimension
smooth map between two manifolds. We give as well some partial results for the
case of higher codimension when the manifolds are spheres.
","[{""version"":""v1"",""created"":""Mon, 4 Jun 2001 12:18:12 GMT""},{""version"":""v2"",""created"":""Wed, 9 Jan 2002 15:23:08 GMT""},{""version"":""v3"",""created"":""Wed, 28 Jan 2004 10:57:32 GMT""}]","2007-05-23"
"math/0106021","Tevian Dray","Tevian Dray, Corinne A Manogue, and Susumu Okubo","Orthonormal Eigenbases over the Octonions","LaTeX2e, 14 pages",,,,"math.RA",,"  We previously showed that the real eigenvalues of 3x3 octonionic Hermitian
matrices form two separate families, each containing 3 eigenvalues, and each
leading to an orthonormal decomposition of the identity matrix, which would
normally correspond to an orthonormal basis. We show here that it nevertheless
takes both families in order to decompose an arbitrary vector into components,
each of which is an eigenvector of the original matrix; each vector therefore
has 6 components, rather than 3.
","[{""version"":""v1"",""created"":""Mon, 4 Jun 2001 15:44:10 GMT""}]","2007-05-23"
"nlin/0106002","Henry S. Greenside","Shigeyuki Tajima and Henry Greenside","Microextensive Chaos of a Spatially Extended System","5 pages including 4 figures. Submitted to PRE",,"10.1103/PhysRevE.66.017205",,"nlin.PS nlin.CD",,"  By analyzing chaotic states of the one-dimensional Kuramoto-Sivashinsky
equation for system sizes L in the range 79 <= L <= 93, we show that the
Lyapunov fractal dimension D scales microextensively, increasing linearly with
L even for increments Delta{L} that are small compared to the average cell size
of 9 and to various correlation lengths. This suggests that a spatially
homogeneous chaotic system does not have to increase its size by some
characteristic amount to increase its dynamical complexity, nor is the increase
in dimension related to the increase in the number of linearly unstable modes.
","[{""version"":""v1"",""created"":""Mon, 4 Jun 2001 04:00:08 GMT""}]","2009-11-07"
"nucl-th/0106005","Eulogio Oset","J.C. Nacher and E. Oset","Study of polarization observables in double pion photoproduction on the
  proton","23 pages, 14 ps figures","Nucl.Phys. A697 (2002) 372-387","10.1016/S0375-9474(01)01251-9","FTUV-01-0604, IFIC-01-0604","nucl-th",,"  Using a model for two pion photoproduction on the proton previously tested in
total cross sections and invariant mass distributions, we evaluate here
polarization observables on which recent experiments are providing new
information. We evaluate cross sections for spin 1/2 and 3/2, which are
measured at Mainz and play an important role in tests of the GHD sum rule.
  We also evaluate the proton polarization asymmetry $\Sigma$ which is
currently under investigation at GRAAL in Grenoble.
","[{""version"":""v1"",""created"":""Mon, 4 Jun 2001 15:45:07 GMT""}]","2009-11-07"
"physics/0106011","Ruben Gevorkian","A.M. Gevorkian, R. A. Gevorkian","Four-dimensional Matter","3 pages, 1 figure",,,,"physics.gen-ph",,"  Four-dimensional mass is determined in four-dimensional pseudo-Euclidean
space as a physical invariant of that space. That invariant is discussed as an
invariant of electromagnetic type. Finally, equations of Maxwell type are
obtained for mass fields.
","[{""version"":""v1"",""created"":""Mon, 4 Jun 2001 06:44:58 GMT""}]","2007-05-23"
"physics/0106012","Javier R. Vazquez de Aldana","Javier R. Vazquez de Aldana and Luis Roso","Three-dimensional numerical simulation of 1GeV/Nucleon U92+ impact
  against atomic hydrogen","12 pages and 7 figures included in the text",,"10.1088/0953-4075/35/22/313",,"physics.atom-ph physics.gen-ph",,"  The impact of 1GeV/Nucleon U92+ projectiles against atomic hydrogen is
studied by direct numerical resolution of the time-dependent wave equation for
the atomic electron on a three-dimensional Cartesian lattice. We employ the
fully relativistic expressions to describe the electromagnetic fields created
by the incident ion. The wave equation for the atom interacting with the
projectile is carefully derived from the time-dependent Dirac equation in order
to retain all the relevant terms.
","[{""version"":""v1"",""created"":""Mon, 4 Jun 2001 07:40:02 GMT""}]","2009-11-07"
"physics/0106013","Ivan A. Koop","I. A. Koop (Budker Institute of Nuclear Physics)","VEPP-2000 Project","6 pages, 11 figures, talk given at the e+e- Physics at Intermediate
  Energies Workshop, SLAC April 30-May 2, 2001, T08","eConf C010430 (2001) T08",,,"physics.acc-ph",,"  The status of VEPP-2000 collider is presented. Implementation of Round
Colliding Beams (RCB) concept in the new collider VEPP-2000 is outlined,
potential advantages of RCB over the flat colliding beams are discussed. The
main design parameters and features of this VEPP-2000 collider are reported.
","[{""version"":""v1"",""created"":""Mon, 4 Jun 2001 13:05:40 GMT""}]","2007-05-23"
"quant-ph/0106011","P. Garbaczewski","Piotr Garbaczewski","Parametric Dynamics of Level Spacings in Quantum Chaos",,"Phys. Lett. A 293, (2002), 23-28","10.1016/S0375-9601(01)00826-X",,"quant-ph cond-mat nlin.CD",,"  We identify parametric (radial) Bessel-Ornstein-Uhlenbeck stochastic
processes as primitive dynamical models of energy level repulsion in irregular
quantum systems. Familiar GOE, GUE, GSE and non-Hermitian
  Ginibre universality classes of spacing distributions arise as special cases
in that formalism.
","[{""version"":""v1"",""created"":""Mon, 4 Jun 2001 09:30:26 GMT""}]","2016-09-08"
"quant-ph/0106012","Shigeru Furuichi","Shigeru Furuichi and Mahmoud Abdel-Aty","Entanglement in squeezed two-level atom","6 pages, 5 figures, to be published in J.Phys.A",,"10.1088/0305-4470/34/35/311",,"quant-ph",,"  In the previous paper, we adopted the method using quantum mutual entropy to
measure the degree of entanglement in the time development of the
Jaynes-Cummings model. In this paper, we formulate the entanglement in the time
development of the Jaynes-Cummings model with squeezed states, and then show
that the entanglement can be controlled by means of squeezing.
","[{""version"":""v1"",""created"":""Mon, 4 Jun 2001 09:58:10 GMT""}]","2009-11-07"
"quant-ph/0106013",,"M.Genovese, C. Novero and E. Predazzi","Conclusive tests of local realism and pseudoscalar mesons",,"Found.Phys.32:589-605,2002","10.1023/A:1015036400296","IENGF, may 2000","quant-ph",,"  Many beautiful experiments have been addressed to test standard quantum
mechanics against local realistic models. Even if a strong evidence favouring
standard quantum mechanics is emerged, a conclusive experiment is still
lacking, because of low detection efficiencies. Recently, experiments based on
pseudoscalar mesons have been proposed as a way for obtaining a conclusive
experiment. In this paper, we investigate if this result can effectively be
obtained. Our conclusions, based on a careful analysis of the proposed set ups,
are that this will not be possible due to intrinsic limitations of these kind
of experiments.
","[{""version"":""v1"",""created"":""Mon, 4 Jun 2001 10:05:55 GMT""}]","2014-11-18"
"quant-ph/0106015","A. G. Kofman","A. G. Kofman","Relaxation of a two-level system strongly coupled to a reservoir:
  Anomalously slow decoherence","12 pages, 3 figures, to be published in Phys. Rev. A","Phys. Rev. A 64, 033809 (2001)","10.1103/PhysRevA.64.033809",,"quant-ph",,"  Relaxation of a two-level system (TLS) into a resonant infinite-temperature
reservoir with a Lorentzian spectrum is studied. The reservoir is described by
a complex Gaussian-Markovian field coupled to the nondiagonal elements of the
TLS Hamiltonian. The theory can be relevant for electromagnetic interactions in
microwave high-$Q$ cavities and muon spin depolarization. Analytical results
are obtained for the strong-coupling regime, $\Omega_0\gg\nu$, where $\Omega_0$
is the rms coupling amplitude (Rabi frequency) and $\nu$ is the width of the
reservoir spectrum. In this regime, the population difference and half of the
initial coherence decay with two characteristic rates: the most part of the
decay occurs at $t\sim\Omega_0^{-1}$, the relaxation being reversible for
$t\ll(\Omega_0^2\nu)^{-1/3}$, whereas for $t\gg(\Omega_0^2\nu)^{-1/3}$ the
relaxation becomes irreversible and is practically over. The other half of the
coherence decays with the rate on the order of $\nu$, which may be slower by
orders of magnitude than the time scale of the population relaxation. The above
features are explained by the fact that at $t\ll\nu^{-1}$ the reservoir
temporal fluctuations are effectively one-dimensional (adiabatic). Moreover, we
identify the pointer basis, in which the reduction of the state vector occurs.
The pointer states are correlated with the reservoir, being dependent on the
reservoir phase.
","[{""version"":""v1"",""created"":""Mon, 4 Jun 2001 13:44:09 GMT""}]","2017-03-28"
