"cond-mat/0106388","Hitoshi Kitaguchi","H. Kitaguchi, H. Kumakura, and K. Togano","Strain Effect in MgB2/Stainless Steel Superconducting Tape","3 pages including 2 figures, submitted to Physica C",,"10.1016/S0921-4534(01)00960-1",,"cond-mat.supr-con cond-mat.mtrl-sci",,"  The influence of mechanical strain on the critical current (Ic) is
investigated for MgB2/stainless steel (SUS316) superconducting tapes. The tapes
are fabricated by using 'powder in tube' method and deformation process without
any heat treatment. The tensile axial strain along tape length is successfully
induced to the sample by using a U-shape holder made of stainless steel
(SUS304). Two samples are examined at 4.2 K in 5 T (B is applied perpendicular
to the tape surface). While the initial Ic at zero external strain state (Ic0)
varies (30.4 and 33.3 A), normalized Ic (Ic/Ic0) vs. external strain relations
fall on the same curve. Linear increase of Ic is observed from zero external
strain state to 0.5% strain (107% of Ic0). Rapid and large degradation occurs
at the strain exceeding 0.4-0.5%. High durability against stress can be
expected for MgB2/stainless steel superconducting tapes.
","[{""version"":""v1"",""created"":""Tue, 19 Jun 2001 21:41:08 GMT""}]","2009-11-07"
"cond-mat/0106389","Didier Poilblanc","Kenji Tsutsui, Didier Poilblanc and Sylvain Capponi","Low-frequency current fluctuations in doped ladders","4 pages, 5 figures",,"10.1103/PhysRevB.65.020406",,"cond-mat.str-el",,"  Charge current static and dynamical correlations are computed by exact
diagonalisation methods on a 2-leg t-t'-J ladder which exhibits a sharp
transition between a Luther-Emery (LE) phase of hole pairs and a phase with
deconfined holes. In the LE phase, we find short-range low-energy
incommensurate current fluctuations which are intrinsically connected to the
internal charge dynamics within one hole pair. On the contrary, when holes
unbind, the maximum of the current susceptibility moves abruptly to the
commensurate wavevector $\pi$ and strongly increases for decreasing doping
suggesting an instability towards a staggered flux state at sufficiently small
doping.
","[{""version"":""v1"",""created"":""Tue, 19 Jun 2001 21:42:45 GMT""}]","2009-11-07"
"cond-mat/0106390","Jon Links","H.-Q. Zhou, J. Links, R.H. McKenzie, M.D. Gould","Superconducting correlations in metallic nanoparticles: exact solution
  of the BCS model by the algebraic Bethe ansatz","revised version, 5 pages, revtex, no figures","Phys. Rev. B 56 (2002) 060502(R)","10.1103/PhysRevB.65.060502",,"cond-mat.supr-con",,"  Superconducting pairing of electrons in nanoscale metallic particles with
discrete energy levels and a fixed number of electrons is described by the
reduced BCS model Hamiltonian. We show that this model is integrable by the
algebraic Bethe ansatz. The eigenstates, spectrum, conserved operators,
integrals of motion, and norms of wave functions are obtained. Furthermore, the
quantum inverse problem is solved, meaning that form factors and correlation
functions can be explicitly evaluated. Closed form expressions are given for
the form factors that describe superconducting pairing.
","[{""version"":""v1"",""created"":""Wed, 20 Jun 2001 03:39:59 GMT""},{""version"":""v2"",""created"":""Mon, 1 Oct 2001 23:59:19 GMT""}]","2009-11-07"
"cond-mat/0106391","Sindhunil B. Roy","P. Chaddah","Comment on ``Critical current density from magnetization hysteresis data
  using the critical-state model''","4 pages of TeX file",,,,"cond-mat.supr-con",,"  A recent paper [Physical Review {\bf B 64} 014508 (2001)] claims to present
an exact method to extract the critical current density J$_C$ from the M-H
hysteresis curve. We show that this claim appears unjustified.
","[{""version"":""v1"",""created"":""Wed, 20 Jun 2001 06:22:40 GMT""}]","2007-05-23"
"cond-mat/0106393","Hsiu-Hau Lin","Hsiu-Hau Lin and Tzay-Ming Hong","Berry Phases of Classical Trajectories in the Presence of Hard-Wall
  Boundaries","REVTeX, 6 pages, 3 figures","Physica E 18, 85 (2003)","10.1016/S1386-9477(02)00988-8",,"cond-mat",,"  We study the quantum propagator in the semiclassical limit with hard-wall
potentials. We show that, upon each reflection by the hard wall, a Berry phase
$\pi$ is accumulated and leads to interferences between different classical
trajectories. Including the Berry phase caused by the hard walls, the modified
Van Vleck's formula is derived. We also discuss the close relations among
quantum statistics, discrete gauge symmetry, and hard-wall constraints. Most of
all, we formulate a new quantization rule that applies to {\it both} smooth and
sharp boundary potentials. It provides an easy way to compute quantized
energies in the semiclassical limit and is extremely useful for many physical
systems.
","[{""version"":""v1"",""created"":""Wed, 20 Jun 2001 07:23:47 GMT""}]","2015-06-24"
"cond-mat/0106394","Alain Junod","Alain Junod, Yuxing Wang, Frederic Bouquet, Pierre Toulemonde","Specific heat of the 38-K superconductor MgB_2 in the normal and
  superconducting state: bulk evidence for a double gap","27 pages, 11 figures, chapter for ""Studies of High Temperature
  Superconductors Vol. 38"", pdf format","Studies of High Temperature Superconductors Ed. A.V. Narlikar,
  Nova Science Publishers, Commack, N.Y. 38 (2002) 179",,,"cond-mat.supr-con",,"  The specific heat of two polycrystalline samples of MgB_2 is presented and
analyzed (2 - 300 K, 0 - 16 T), together with magnetic properties. The main
characteristics are a low density of states at the Fermi level, high phonon
frequencies, and an anomalous temperature- and field- dependence of the
specific heat at T < T_c. A two-gap model with a gap ratio of 3:1 fits the
specific heat in zero field. The smaller gap is washed out by a field of 0.5 T.
","[{""version"":""v1"",""created"":""Wed, 20 Jun 2001 07:43:42 GMT""}]","2007-05-23"
"cond-mat/0106395","Bart Partoens","Minghui Kong, B. Partoens, and F. M. Peeters","Transition Between Ground State and Metastable States in Classical 2D
  Atoms",,,"10.1103/PhysRevE.65.046602",,"cond-mat.str-el",,"  Structural and static properties of a classical two-dimensional (2D) system
consisting of a finite number of charged particles which are laterally confined
by a parabolic potential are investigated by Monte Carlo (MC) simulations and
the Newton optimization technique. This system is the classical analog of the
well-known quantum dot problem. The energies and configurations of the ground
and all metastable states are obtained. In order to investigate the barriers
and the transitions between the ground and all metastable states we first
locate the saddle points between them, then by walking downhill from the saddle
point to the different minima, we find the path in configurational space from
the ground state to the metastable states, from which the geometric properties
of the energy landscape are obtained. The sensitivity of the ground-state
configuration on the functional form of the inter-particle interaction and on
the confinement potential is also investigated.
","[{""version"":""v1"",""created"":""Wed, 20 Jun 2001 08:16:58 GMT""}]","2009-11-07"
"cond-mat/0106396","Stephan Markus Dammer","Stephan M Dammer, Silvio R Dahmen and Haye Hinrichsen","Directed Percolation and the Golden Ratio","LaTeX, IOP-style, 6 pages, 4 eps figures",,,,"cond-mat.stat-mech",,"  Applying the theory of Yang-Lee zeros to nonequilibrium critical phenomena,
we investigate the properties of a directed bond percolation process for a
complex percolation parameter p. It is shown that for the Golden Ratio
p=(1(+/-)sqrt(5))/2 and for p=2 the survival probability of a cluster can be
computed exactly.
","[{""version"":""v1"",""created"":""Wed, 20 Jun 2001 09:02:30 GMT""}]","2007-05-23"
"cond-mat/0106397","Olle Gunnarsson","M. Calandra and O. Gunnarsson (Max-Planck-Institut fur
  Festkorperforschung, Stuttgart)","Saturation of electrical resistivity in metals at large temperatures","4 page, RevTeX, 3 eps figures, additional material available at
  http://www.mpi-stuttgart.mpg.de/andersen/fullerene/","Phys. Rev. Lett. 87, 266601-1 (2001)","10.1103/PhysRevLett.87.266601",,"cond-mat.mtrl-sci cond-mat.str-el",,"  We present a microscopic model for systems showing resistivity saturation. An
essentially exact quantum Monte-Carlo calculation demonstrates that the model
describes saturation. We give a simple explanation for saturation, using charge
conservation and considering the limit where thermally excited phonons have
destroyed the periodicity. Crucial model features are phonons coupling to the
hopping matrix elements and a unit cell with several atoms. We demonstrate the
difference to a model of alkali-doped C60 with coupling to the level positions,
for which there is no saturation.
","[{""version"":""v1"",""created"":""Wed, 20 Jun 2001 11:58:36 GMT""},{""version"":""v2"",""created"":""Fri, 11 Jan 2002 08:06:11 GMT""}]","2009-11-07"
"cond-mat/0106398","Masaru Onoda","Masaru Onoda, Takahiro Mizusaki, Hideo Aoki","Effective mass staircase and the Fermi liquid parameters for the
  fractional quantum Hall composite fermions","4 pages, 3 figures, REVTeX","Phys. Rev. B 64, 235315 (2001)","10.1103/PhysRevB.64.235315",,"cond-mat.mes-hall",,"  Effective mass of the composite fermion in the fractional quantum Hall
system, which is of purely interaction originated, is shown, from a numerical
study, to exhibit a curious nonmonotonic behavior with a staircase correlated
with the number (=2,4,...) of attached flux quanta. This is surprising since
the usual composite-fermion picture predicts a smooth behavior. On top of that,
significant interactions are shown to exist between composite fermions, where
the excitation spectrum is accurately reproduced in terms of Landau's Fermi
liquid picture with negative (i.e., Hund's type) orbital and spin exchange
interactions.
","[{""version"":""v1"",""created"":""Wed, 20 Jun 2001 09:53:06 GMT""}]","2009-11-07"
"cond-mat/0106399","George Jackeli","G. Jackeli and J. Ranninger","Ground state properties and excitation spectra of non-Galilean invariant
  interacting Bose systems","6 pages, 2 figures, to appear in Phys. Rev. B","Phys.Rev.B 64,104513(2001)","10.1103/PhysRevB.64.104513",,"cond-mat.supr-con cond-mat.stat-mech",,"  We study the ground state properties and the excitation spectrum of bosons
which, in addition to a short-range repulsive two body potential, interact
through the exchange of some dispersionless bosonic modes. The latter induces a
time dependent (retarded) boson-boson interaction which is attractive in the
static limit. Moreover the coupling with dispersionless modes introduces a
reference frame for the moving boson system and hence breaks the Galilean
invariance of this system. The ground state of such a system is depleted {\it
linearly} in the boson density due to the zero point fluctuations driven by the
retarded part of the interaction. Both quasiparticle (microscopic) and
compressional (macroscopic) sound velocities of the system are studied. The
microscopic sound velocity is calculated up the second order in the effective
two body interaction in a perturbative treatment, similar to that of Beliaev
for the dilute weakly interacting Bose gas. The hydrodynamic equations are used
to obtain the macroscopic sound velocity. We show that these velocities are
identical within our perturbative approach. We present analytical results for
them in terms of two dimensional parameters -- an effective interaction
strength and an adiabaticity parameter -- which characterize the system. We
find that due the presence of several competing effects, which determine the
speed of the sound of the system, three qualitatively different regimes can be
in principle realized in the parameter space and discuss them on physical
grounds.
","[{""version"":""v1"",""created"":""Wed, 20 Jun 2001 09:46:12 GMT""}]","2009-11-07"
"cond-mat/0106400","Pi-Gang Luan","Pi-Gang Luan and Zhen Ye","Statistics of Lyapunov exponent in one-dimensional layered systems","6 pages revtex file, 6 eps figures",,"10.1103/PhysRevE.64.066609",,"cond-mat",,"  Localization of acoustic waves in a one dimensional water duct containing
many randomly distributed air filled blocks is studied. Both the Lyapunov
exponent and its variance are computed. Their statistical properties are also
explored extensively. The results reveal that in this system the single
parameter scaling is generally inadequate no matter whether the frequency we
consider is located in a pass band or in a band gap. This contradicts the
earlier observations in an optical case. We compare the results with two
optical cases and give a possible explanation of the origin of the different
behaviors.
","[{""version"":""v1"",""created"":""Wed, 20 Jun 2001 10:05:16 GMT""}]","2009-11-07"
"cond-mat/0106401","Ari Belenkiy","Ari Belenkiy","Inner Market as a ""Black Box""","6 pages",,,,"cond-mat.dis-nn q-fin.TR",,"  Each market has its singular characteristic. Its inner structure is directly
responsible for the observed distributions of returns though this fact is
widely overlooked. Big orders lead to doubling the tails. The behavior of a
market maker with many or few ``friends'' who can reliably loan money or stock
to him is quite different from the one without. After representing the inner
market ``case'' we suggest how to analyze its structure.
","[{""version"":""v1"",""created"":""Wed, 20 Jun 2001 10:56:16 GMT""}]","2008-12-02"
"cond-mat/0106402","Paolo Calvani","A. Lucarelli, S. Lupi, P. Calvani, and P. Maselli (Dip. Di Fisica,
  Universita' La Sapienza, Roma, Italy), G. De Marzi and P. Roy (LURE Orsay,
  France), N. L. Saini and A. Bianconi (Dip. Di Fisica, Universita' La
  Sapienza, Roma, Italy), T. Ito and K. Oka (National Institute of Advanced
  Industrial Science and Technology, Tsukuba, Japan)","Optical conductivity of the nonsuperconducting cuprate
  La(8-x)Sr(x)Cu(8)O(20)","Revised version submitted to Phys. Rev. B, including the elimination
  of Fig. 1 and changes to Figs. 4 and 5",,"10.1103/PhysRevB.65.054511",,"cond-mat.supr-con",,"  La(8-x)Sr(x)Cu(8)O(20) is a non-superconducting cuprate, which exhibits a
doubling of the elementary cell along the c axis. Its optical conductivity
sigma (omega) has been first measured here, down to 20 K, in two single
crystals with x = 1.56 and x = 2.24. Along c, sigma (omega) shows, in both
samples, bands due to strongly bound charges, thus confirming that the cell
doubling is due to charge ordering. In the ab plane, in addition to the Drude
term one observes an infrared peak at 0.1 eV and a midinfrared band at 0.7 eV.
The 0.1 eV peak hardens considerably below 200 K, in correspondence of an
anomalous increase in the sample dc resistivity, in agreement with its
polaronic origin. This study allows one to establish relevant similarities and
differences with respect to the spectrum of the ab plane of the superconducting
cuprates.
","[{""version"":""v1"",""created"":""Wed, 20 Jun 2001 11:21:51 GMT""},{""version"":""v2"",""created"":""Thu, 18 Oct 2001 10:25:18 GMT""}]","2009-11-07"
"cond-mat/0106403","B. J. Baelus","B. J. Baelus, S. V. Yampolskii, F. M. Peeters, E. Montevecchi and J.
  O. Indekeu","Superconducting properties of mesoscopic cylinders with enhanced surface
  superconductivity","submitted to Phys. Rev. B",,"10.1103/PhysRevB.65.024510",,"cond-mat.supr-con",,"  The superconducting state of an infinitely long superconducting cylinder
surrounded by a medium which enhances its superconductivity near the boundary
is studied within the nonlinear Ginzburg-Landau theory. This enhancement can be
due to the proximity of another superconductor or due to surface treatment.
Quantities like the free energy, the magnetization and the Cooper-pair density
are calculated. Phase diagrams are obtained to investigate how the critical
field and the critical temperature depend on this surface enhancement for
different values of the Ginzburg-Landau parameter \kappa. Increasing the
superconductivity near the surface leads to higher critical fields and critical
temperatures. For small cylinder diameters only giant vortex states nucleate,
while for larger cylinders multivortices can nucleate. The stability of these
multivortex states also depends on the surface enhancement. For type-I
superconductors we found the remarkable result that for a range of values of
the surface extrapolation length the superconductor can transit from the
Meissner state into superconducting states with vorticity L > 1. Such a
behaviour is not found for the case of large \kappa, i.e. type-II
superconductivity.
","[{""version"":""v1"",""created"":""Wed, 20 Jun 2001 12:03:59 GMT""}]","2009-11-07"
"cond-mat/0106404","A. Mourachkine","A. Mourachkine (Brussels)","Quasi-One-Dimensional Topological-Excitation Liquid in Bi2212 from
  Tunneling Spectroscopy","Supercond. Sci. Technol. (16 pages)","Supercond. Sci. Technol. 14 (2001) 329","10.1088/0953-2048/14/6/307",,"cond-mat.supr-con cond-mat.str-el",,"  Tunneling measurements have been carried out on heavily underdoped, slightly
overdoped and partially Ni-substituted Bi2212 single crystals by using a
break-junction technique. We find that in-plane tunneling spectra below Tc are
the combination of incoherent part from the pseudogap and coherent
quasiparticle peaks. There is a clear correlation between the magnitude of the
pseudogap and the magnitude of the superconducting gap in Bi2212. The analysis
of the data suggests that the tunneling pseudogap in Bi2212 is predominantly a
charge-density-wave gap on dynamical charge stripes. The tunneling
characteristics corresponding to the quasiparticle peaks are in excellent
agreement with theoretical predictions made for a quasi-one dimensional
topological-excitation liquid. In addition, the analysis of data measured by
different techniques shows that the phase coherence along the c-axis is
established at Tc due to spin fluctuations in local antiferromagnetic domains
of CuO2 planes.
","[{""version"":""v1"",""created"":""Wed, 20 Jun 2001 12:05:57 GMT""}]","2009-11-07"
"cs/0106041","Joerg Rothe","Andr\'e Grosse, Joerg Rothe, and Gerd Wechsung","Computing Complete Graph Isomorphisms and Hamiltonian Cycles from
  Partial Ones","12 pages, appears as part of a ICTCS 2001 paper of the same authors",,,,"cs.CC",,"  We prove that computing a single pair of vertices that are mapped onto each
other by an isomorphism $\phi$ between two isomorphic graphs is as hard as
computing $\phi$ itself. This result optimally improves upon a result of
G\'{a}l et al. We establish a similar, albeit slightly weaker, result about
computing complete Hamiltonian cycles of a graph from partial Hamiltonian
cycles.
","[{""version"":""v1"",""created"":""Tue, 19 Jun 2001 16:10:55 GMT""}]","2016-08-16"
"cs/0106042","Judith Beumer","William McCune","MACE 2.0 Reference Manual and Guide","10 pages",,,"ANL/MCS-TM-249","cs.LO cs.SC",,"  MACE is a program that searches for finite models of first-order statements.
The statement to be modeled is first translated to clauses, then to relational
clauses; finally for the given domain size, the ground instances are
constructed. A Davis-Putnam-Loveland-Logeman procedure decides the
propositional problem, and any models found are translated to first-order
models. MACE is a useful complement to the theorem prover Otter, with Otter
searching for proofs and MACE looking for countermodels.
","[{""version"":""v1"",""created"":""Tue, 19 Jun 2001 16:11:19 GMT""}]","2007-05-23"
"cs/0106043","Yuval Krymolowski","Yuval Krymolowski","Using the Distribution of Performance for Studying Statistical NLP
  Systems and Corpora","To be presented in ACL/EACL Workshop on Evaluation for Language and
  Dialogue Systems",,,,"cs.CL",,"  Statistical NLP systems are frequently evaluated and compared on the basis of
their performances on a single split of training and test data. Results
obtained using a single split are, however, subject to sampling noise. In this
paper we argue in favour of reporting a distribution of performance figures,
obtained by resampling the training data, rather than a single number. The
additional information from distributions can be used to make statistically
quantified statements about differences across parameter settings, systems, and
corpora.
","[{""version"":""v1"",""created"":""Wed, 20 Jun 2001 14:16:17 GMT""}]","2007-05-23"
"gr-qc/0106059","S. Antoci","S. Antoci and L. Mihich","One thing that general relativity says about photons in matter","13 pages, 1 figure. Text to appear in Nuovo Cimento B","Nuovo Cim.B116:801-812,2001",,,"gr-qc cond-mat quant-ph",,"  Let us abandon for a moment the strict epistemological standpoint of quantum
field theory, that eventually comes to declare nonsensical any question about
the photon posed outside the quantum theoretical framework. We can then avail
of the works by Whittaker et al. and by Synge about the particle and the wave
model of the photon in the vacuum of general relativity. We can also rely on
important results found by Gordon and by Pham Mau Quan: thanks to Gordon's
discovery of an effective metric these authors have been able to reduce to the
vacuum case several problems of the electromagnetic theory of dielectrics.
  The joint use of these old findings allows one to conclude that a quantum
theoretical photon in an isotropic dielectric has a classical simile only if
the dielectric is also homogeneous.
","[{""version"":""v1"",""created"":""Tue, 19 Jun 2001 16:01:31 GMT""},{""version"":""v2"",""created"":""Thu, 26 Jul 2001 16:45:37 GMT""}]","2010-11-11"
"gr-qc/0106060","SG Ghosh","S. G. Ghosh (Science College, Congress Nagar, Nagpur, India)","Charged null fluid collapse in anti-de Sitter spacetimes and naked
  singularities","8 pages, No figures","Phys.Rev.D62:127505,2000","10.1103/PhysRevD.62.127505",,"gr-qc",,"  We investigate the occurrence of naked singularities in the spherically
symmetric, plane symmetric and cylindrically symmetric collapse of charged null
fluid in an anti-de Sitter background. The naked singularities are found to be
strong in Tipler's sense and thus violate the cosmic censorship conjecture, but
not hoop conjecture.
","[{""version"":""v1"",""created"":""Wed, 20 Jun 2001 12:58:03 GMT""}]","2008-11-26"
"hep-ex/0106072","Obrant","V. M. Abazov, et al. (D0 Collaboration)","Multiple Jet Production at Low Transverse Energies in pbarp Collisions
  at sqrt(s) = 1.8 TeV","11 pages, 5 figures, Latex",,,,"hep-ex",,"  We present data on multiple jet production for transverse energies greater
than 20 GeV in pbarp collisions at sqrt(s) = 1.8 TeV. QCD calculations in the
parton shower approximation (PYTHIA) and in the next-to-leading order
approximation (JETRAD) show discrepancies with data for three and four-jet
production. This disagreement is especially apparent in multiple jet angular
and transverse momentum distributions.
","[{""version"":""v1"",""created"":""Wed, 20 Jun 2001 01:22:43 GMT""},{""version"":""v2"",""created"":""Wed, 11 Jul 2001 22:27:32 GMT""},{""version"":""v3"",""created"":""Mon, 23 Jul 2001 15:56:17 GMT""}]","2007-05-23"
"hep-ex/0106073","Renoult","A. Valassi","Measurements of Single W Production at LEP2","4 pages, 2 figures, presented at LEPTRE, XIII Convegno sulla Fisica
  al LEP, ROma, 2001",,,,"hep-ex",,"  In the energy region of LEP2 and above, four fermion final states in e+e-
collisions can be produced by Feynman diagrams involving two, one or zero
resonant bosons...
","[{""version"":""v1"",""created"":""Wed, 20 Jun 2001 09:35:40 GMT""}]","2007-05-23"
"hep-ex/0106075","Cvetan Cheshkov","NA48 Collaboration","Measurement of the quadratic slope parameter in the K_L -> 3\pi^0 decay
  Dalitz plot","13 pages, 3 figures, 2 tables","Phys.Lett.B515:261-268,2001","10.1016/S0370-2693(01)00861-9","CERN-EP-2001-041","hep-ex",,"  A value of (-6.1 +- 0.9_{stat} +- 0.5_{syst})*10^{-3} is obtained for the
quadratic slope parameter h in the K_L -> 3\pi^0 decay Dalitz plot at the NA48
experiment at the CERN SPS. The result is based on 14.7*10^6 fully
reconstructed K_L -> 3\pi^0 -> 6\gamma decays. This is the most precise
measurement of any of the Dalitz plot slope parameters in the charged and
neutral kaon decays so far.
","[{""version"":""v1"",""created"":""Wed, 20 Jun 2001 10:27:09 GMT""}]","2012-08-27"
"hep-ex/0106076","A. Sandacz","Andrzej Sandacz, Oleg A. Grajek, Murray Moinester, Eli Piasetzky","Color Transparency at COMPASS - Feasibility Study","Expanded version of the talk presented at the Workshop on ""Nucleon
  Structure and Meson Spectroscopy"", Dubna, Russia, 10-11 October 2000",,,"TAUP-2671-2001","hep-ex",,"  We examine the potential of the COMPASS experiment at CERN to study color
transparency via exclusive vector meson production in hard muon-nucleus
scattering. It is demonstrated that COMPASS has high sensitivity to test this
important prediction of perturbative QCD.
","[{""version"":""v1"",""created"":""Wed, 20 Jun 2001 13:53:08 GMT""},{""version"":""v2"",""created"":""Mon, 30 Jul 2001 11:49:22 GMT""}]","2007-05-23"
