"astro-ph/0106349","Grant J. Mathews","M. Yahiro, G. J. Mathews, K. Ichiki, T. Kajino, M. Orito","Constraints on Cosmic Quintessence and Quintessential Inflation","11 pages, 3 figures, PRD vol 65 (002) in press","Phys.Rev. D65 (2002) 063502","10.1103/PhysRevD.65.063502",,"astro-ph hep-th",,"  Recently, attempts have been made to understand the apparent near coincidence
of the present dark energy and matter energy in terms of a dynamical
attractor-like solution for the evolution of a scalar field. In these models
the field couples with the dominant constituent and only acts like a
cosmological constant after the onset of the matter-diminated epoch. A generic
feature of such solutions, however, is the possibility of significant energy
density in the scalar field during the radiation-dominated epoch. This
possibility is even greater if the quintessence field begins in a
kinetic-dominated regime generated at the end of quintessential inflation. As
such, these models can affect and be constrained by primordial nucleosynthesis
and the epoch of of photon decoupling. Here, we analyze one popular form of the
quintessence field (with and without a supergravity correction) and quantify
constraints on the allowed initial conditions and parameters for the effective
potential. We also deduce constraints on the epoch of matter creation at the
end of quintessential inflation.
","[{""version"":""v1"",""created"":""Wed, 20 Jun 2001 07:04:42 GMT""},{""version"":""v2"",""created"":""Sat, 15 Sep 2001 13:15:06 GMT""},{""version"":""v3"",""created"":""Thu, 3 Jan 2002 06:03:12 GMT""}]","2009-11-06"
"astro-ph/0106350","Vladimir A. Dubrovskiy","V.A.Dubrovskiy","Measurements of the Gravity Waves Velocity","6 pagers, 1 figure",,,,"astro-ph",,"  Some results are presented of the Earth's microseismic background. It is
assumed that background peaks should correspond to the resonance gravity-wave
exchange in the system of two gravity-connected bodies. The microseismic
spectrum is compared with the distribution of gravity potential of the nearest
stars. A close peak-to-peak correspondence is found. This correspondence and
resonance condition lead to an evaluation of the gravity-wave velocity. The
resulting value is nine orders of magnitude more than the velocity of light.
Some consequences of such result are discussed.
","[{""version"":""v1"",""created"":""Wed, 20 Jun 2001 07:54:06 GMT""}]","2007-05-23"
"astro-ph/0106351","Nicolai Bissantz","Nicolai Bissantz & Axel Munk","New statistical goodness of fit techniques in noisy inhomogeneous
  inverse problems - With application to the recovering of the luminosity
  distribution of the Milky Way","A&A, accepted",,"10.1051/0004-6361:20010984",,"astro-ph",,"  The assumption that a parametric class of functions fits the data structure
sufficiently well is common in fitting curves and surfaces to regression data.
One then derives a parameter estimate resulting from a least squares fit, say,
and in a second step various kinds of chi^2 goodness of fit measures, to assess
whether the deviation between data and estimated surface is due to random noise
and not to systematic departures from the model. In this paper we show that
commonly-used chi^2-measures are invalid in regression models, particularly
when inhomogeneous noise is present. Instead we present a bootstrap algorithm
which is applicable in problems described by noisy versions of Fredholm
integral equations. of the first kind. We apply the suggested method to the
problem of recovering the luminosity density in the Milky Way from data of the
DIRBE experiment on board the COBE satellite.
","[{""version"":""v1"",""created"":""Wed, 20 Jun 2001 08:33:52 GMT""}]","2009-11-06"
"astro-ph/0106352","Kimihiro Okumura","K. Okumura, R. Enomoto, A. Asahara, G.V. Bicknell, P.G. Edwards, S.
  Gunji, S. Hara, T. Hara, S. Hayashi, C. Itoh, S. Kabuki, F. Kajino, H.
  Katagiri, J. Kataoka, A. Kawachi, T. Kifune, H. Kubo, J. Kushida, S. Maeda,
  A. Maeshiro, Y. Matsubara, Y. Mizumoto, M. Mori, M. Moriya, H. Muraishi, Y.
  Muraki, T. Naito, T. Nakase, K. Nishijima, M. Ohishi, J.R. Patterson, K.
  Sakurazawa, R. Suzuki, D.L. Swaby, K. Takano, T. Takano, T. Tanimori, F.
  Tokanaia, K. Tsuchiya, H. Tsunoo, K. Uruma, A. Watanabe, S. Yanagita, T.
  Yoshida, T. Yoshikoshi","Search for gamma-rays above 10 TeV from Markarian 421 in a high state
  with the CANGAROO-II telescope","4 pages, 5 figures, to appear in Proc. 27th ICRC (Hamburg, Germany)",,,,"astro-ph",,"  A preliminary result from Markarian 421 observations in the energy region
above 10 TeV with the CANGAROO-II 10 m telescope is presented. In January 2001,
the HEGRA group reported that Markarian 421 had become very active, with flux
levels up to 4 times that of the Crab Nebula. As a result, we observed Mkn 421
during six nights from January 24th to February 1st, and four nights from March
1st to 4th. Observations were carried out using the very large zenith angle
technique ($\sim$70 degree) and the energy threshold is estimated from Monte
Carlo simulations to be around 10 TeV. We have detected gamma-ray emission in
this energy range.
","[{""version"":""v1"",""created"":""Wed, 20 Jun 2001 08:36:05 GMT""}]","2007-05-23"
"astro-ph/0106353","Russell Edwards","R. T. Edwards, W. van Straten and M. Bailes","A Search for Sub-Millisecond Pulsars","8 pages, 3 figures, to appear in ApJ",,"10.1086/322772",,"astro-ph",,"  We have conducted a search of 19 southern Galactic globular clusters for
sub-millisecond pulsars at 660 MHz with the Parkes 64-m radio telescope. To
minimize dispersion smearing we used the CPSR baseband recorder, which samples
the 20 MHz observing band at the Nyquist rate. By possessing a complete
description of the signal we could synthesize an optimal filterbank in
software, and in the case of globular clusters of known dispersion measure,
much of the dispersion could be removed using coherent techniques. This allowed
for very high time resolution (25.6 us in most cases), making our searches in
general sensitive to sub-millisecond pulsars with flux densities greater than
about 3 mJy at 50 cm. No new pulsars were discovered, placing important
constraints on the proportion of pulsars with very short spin periods in these
clusters.
","[{""version"":""v1"",""created"":""Wed, 20 Jun 2001 09:08:36 GMT""}]","2009-11-06"
"astro-ph/0106354","M. Beijersbergen","Marco Beijersbergen (1), Henk Hoekstra (2 and 3), Pieter G. van Dokkum
  (4), Thijs van der Hulst (1) ((1) Kapteyn Astronomical Institute, (2) CITA,
  (3) University of Toronto, (4) Caltech)","U, B and r band luminosity functions of galaxies in the Coma cluster","Accepted for publication in MNRAS","Mon.Not.Roy.Astron.Soc. 329 (2002) 385","10.1046/j.1365-8711.2002.05004.x",,"astro-ph",,"  We present a deep multi-colour CCD mosaic of the Coma cluster (Abell 1656),
covering 5.2 deg^2 in the B and r bands, and 1.3 deg^2 in the U band. This
large, homogeneous data set provides a valuable low redshift comparison sample
for studies of galaxies in distant clusters. In this paper we present our
survey, and study the dependence of the galaxy luminosity function (LF) on
passband and radial distance from the cluster centre. The U, B and r band LFs
of the complete sample cannot be represented by single Schechter functions. For
the central area, r<245 h_{100}^{-1} kpc, we find best-fitting Schechter
parameters of M^{*}_U=-18.60^{+0.13}_{-0.18} and
\alpha_U=-1.32^{+0.018}_{-0.028}, M^{*}_B=-19.79^{+0.18}_{-0.17} and
\alpha_B=-1.37^{+0.024}_{-0.016} and M^{*}_r=-20.87^{+0.12}_{-0.17} and
\alpha_r=-1.16^{+0.012}_{-0.019}. The LF becomes steeper at larger radial
distance from the cluster centre. The effect is most pronounced in the U band.
This result is consistent with the presence of a star forming dwarf population
at large distance from the cluster centre, which may be in the process of being
accreted by the cluster. The shapes of the LFs of the NGC 4839 group support a
scenario in which the group has already passed through the centre.
","[{""version"":""v1"",""created"":""Wed, 20 Jun 2001 10:37:44 GMT""},{""version"":""v2"",""created"":""Fri, 28 Sep 2001 11:05:02 GMT""}]","2009-11-06"
"astro-ph/0106355","Xiang-Ping Wu","Xiang-Ping Wu and Yan-Jie Xue","The X-ray background from groups and clusters of galaxies","6 pages, 3 figure, accepted for publication in ApJ",,"10.1086/322961",,"astro-ph",,"  We present an estimate of the X-ray background (XRB) spectrum from the
warm-hot intergalactic medium (IGM) associated with groups and clusters of
galaxies, using purely the observationally determined X-ray luminosity function
(XLF) and X-ray luminosity (Lx) - temperature (T) relations for groups and
clusters. As compared with previous semi-analytic models based on the
Press-Schechter mass function, our approach provides a much simpler and more
realistic way to evaluate the XRB from groups and clusters in the sense that we
make no assumption about the dynamical and heating properties of the IGM, and
the intrinsic dispersion in the Lx-T relations due to different physical
mechanisms among different groups and clusters can be also included. It shows
that the resulting 0.1-10 keV XRB spectrum by summing up the X-ray emission
from all groups and clusters is consistent with current upper limits placed on
the contribution from diffuse gas to the XRB. This may have profound
implications for our understanding of the missing baryons in the universe.
","[{""version"":""v1"",""created"":""Wed, 20 Jun 2001 12:38:37 GMT""}]","2009-11-06"
"astro-ph/0106356","Carles Badenes","Carles Badenes (1 and 2) and Eduardo Bravo (1 and 2) ((1) Dept. Fisica
  i Enginyeria Nuclear, Universitat Politecnica de Catalunya, (2) Institut
  d'Estudis Espacials de Catalunya)","The Imprint of Presupernova Evolution on Supernovae Remnants","18 pages, 5 figures, to be published in ApJL",,"10.1086/322933",,"astro-ph",,"  The evolution of type Ia supernova binary system progenitors is highly
uncertain. Several evolutionary models predict that the accretion of mass onto
the white dwarf is accompanied by mass ejection from the binary in the form of
a powerful wind, but very few observations have been made during the initial
phase of formation of supernovae remnants, when the interaction of supernova
ejecta with presupernova wind could be tested. Here we present hydrodynamical
simulations of supernova ejecta interaction with an ambient medium modified by
presupernova wind. The structure of the ambient medium when the supernova
explodes is very sensitive to the details of wind history, and the evolution of
the supernova remnant can be affected during several thousand years. We have
found that the forward shock expansion parameter is a good tool for
discriminating between several wind models. The evolution of the supernova
remnant in the presence of an ambient medium modified by interaction with
pre-supernova wind cannot be described by a similarity solution. We also rule
out simple models based on a circumstellar medium that merges smoothly with a
uniform density ambient medium.
","[{""version"":""v1"",""created"":""Wed, 20 Jun 2001 13:17:00 GMT""},{""version"":""v2"",""created"":""Thu, 21 Jun 2001 14:58:28 GMT""}]","2009-11-06"
"astro-ph/0106357","Stuart Littlefair","S.P. Littlefair, V.S. Dhillon, T.R. Marsh","K-band spectroscopy of the intermediate polar XY Ari","5 pages, 2 figures, to appear in Monthly Notices, accepted","Mon.Not.Roy.Astron.Soc. 327 (2001) 669","10.1046/j.1365-8711.2001.04766.x",,"astro-ph",,"  We present the K-band infrared spectrum of the intermediate polar XY Ari. The
spectrum confirms the cataclysmic binary nature of XY Ari, showing emission
lines of HeI (2.0587 microns) and the Brackett and Paschen series of HI. The
broad nature of these lines suggest an origin in an accretion disc. The
spectrum is strongly reddened by absorption within the molecular cloud Lynds
1457 and shows prominent absorption features from the secondary star, from
which we determine a spectral type for the secondary of M0V. The secondary
contributes 80 +/- 6% of the K-band light. We derive a visual extinction to XY
Ari of Av = 11.5 +/- 0.3 and a distance of d=270 +/- 100 pc, placing XY Ari
behind the molecular cloud.
","[{""version"":""v1"",""created"":""Wed, 20 Jun 2001 14:10:32 GMT""}]","2009-11-06"
"astro-ph/0106358","David Merritt","Fidel Cruz and David Merritt (Rutgers University)","Galactic Mergers with Supermassive Black Holes","4 pages, 2 postscript figures. To appear in ""The Central Kpc of
  Starbursts and AGN, ed. J. H. Knapen, J. E. Beckman, I. Shlosman & T. J.
  Mahoney",,,"Rutgers Astrophysics Preprint Series No. 319","astro-ph",,"  We present the results of N-body simulations of the accretion of high-density
dwarf galaxies by low-density giant galaxies. Both galaxies contain power-law
central density cusps and point masses representing supermassive black holes;
the ratio of galaxy masses is 3:1. The cusp of the dwarf galaxy is always
disrupted during the merger, leading to a remnant with a weak power law in the
intrinsic density and a ``core'' in the projected density. Removing both black
holes from the giant and dwarf galaxies allows the dwarf galaxy to remain
intact and leads to a remnant with a high central density, contrary to what is
observed. Our results support the hypothesis than the persistence of
low-density cores in giant galaxies following mergers is a consequence of the
existence of supermassive central black holes.
","[{""version"":""v1"",""created"":""Wed, 20 Jun 2001 14:21:19 GMT""}]","2007-05-23"
"astro-ph/0106359","Katia Ferriere","Katia M. Ferriere","The Interstellar Environment of our Galaxy","39 pages, 12 figures (including 3 figures in 2 parts)","Rev.Mod.Phys.73:1031-1066,2001","10.1103/RevModPhys.73.1031",,"astro-ph",,"  We review the current knowledge and understanding of the interstellar medium
of our galaxy. We first present each of the three basic constituents - ordinary
matter, cosmic rays, and magnetic fields - of the interstellar medium, laying
emphasis on their physical and chemical properties inferred from a broad range
of observations. We then position the different interstellar constituents, both
with respect to each other and with respect to stars, within the general
galactic ecosystem.
","[{""version"":""v1"",""created"":""Wed, 20 Jun 2001 15:10:37 GMT""}]","2008-11-26"
"astro-ph/0106360","Carlos Allende Prieto","Carlos Allende Prieto (1), David L. Lambert (1) and Martin Asplund (2)
  ((1) The University of Texas at Austin, (2) Uppsala Astronomiska
  Observatorium)","The 'Forbidden' Abundance of Oxygen in the Sun","16 pages, 3 eps figures included; a more compact PostScript version
  created using emulateapj.sty is available from
  http://hebe.as.utexas.edu/recent_publi.html; to appear in ApJL","Astrophys.J.556:L63,2001","10.1086/322874",,"astro-ph",,"  We reexamine closely the solar photospheric line at 6300 A, which is
attributed to a forbidden line of neutral oxygen, and is widely used in
analyses of other late-type stars.
  We use a three-dimensional time-dependent hydrodynamical model solar
atmosphere which has been tested successfully against observed granulation
patterns and an array of absorption lines. We show that the solar line is a
blend with a Ni I line, as previously suggested but oftentimes neglected.
Thanks to accurate atomic data on the [O I] and Ni I lines we are able to
derive an accurate oxygen abundance for the Sun: log epsilon (O) = 8.69 +/-
0.05 dex, a value at the lower end of the distribution of previously published
abundances, but in good agreement with estimates for the local interstellar
medium and hot stars in the solar neighborhood. We conclude by discussing the
implication of the Ni I blend on oxygen abundances derived from the [O I] 6300
A line in disk and halo stars.
","[{""version"":""v1"",""created"":""Wed, 20 Jun 2001 15:25:22 GMT""}]","2016-08-30"
"astro-ph/0106361","Giuseppina Fabbiano","Alice Shapley, G. Fabbiano and P. B. Eskridge","A multivariate statistical analysis of spiral galaxy luminosities. I.
  Data and results",,"Astrophys.J.Suppl. 137 (2001) 139-200","10.1086/322998",,"astro-ph",,"  We have performed a multiparametric analysis of luminosity data for a sample
of 234 normal spiral and irregular galaxies observed in X-rays with the {\it
Einstein Observatory}. This sample is representative of S and Irr galaxies,
with a good coverage of morphological types and absolute magnitudes. In
addition to X-ray and optical da ta, we have compiled H-band magnitudes, IRAS
near- and far-infrared, and 6cm radio co ntinuum observations for the sample
from the literature. We have also performed a carefu l compilation of distance
estimates. We have explored the effect of morphology by dividing the sample
into early (S0/a-Sab), intermediate (Sb-Sbc), and late-type (Sc-Irr)
subsamples. The data were analysed with bivariate and multiv ariate survival
analysis techniques that make full use of all the information available in both
detections and limits.
","[{""version"":""v1"",""created"":""Wed, 20 Jun 2001 15:30:27 GMT""},{""version"":""v2"",""created"":""Thu, 21 Jun 2001 13:54:25 GMT""}]","2009-11-06"
"cond-mat/0106381","Iaroslav Ispolatov","I. Ispolatov and E.G.D. Cohen (Rockefeller University)","Collapse in $1/r^\alpha$ interacting systems","9 pages, 5 figures",,,,"cond-mat.stat-mech astro-ph",,"  Collapse, or a gravitational-like phase transition is studied in a
microcanonical ensemble of particles with an attractive $1/r^{\alpha}$
potential. A mean field continuous integral equation is used to determine a
saddle-point density profile that extremizes the entropy functional. For all
$0<\alpha<3$, a critical energy is determined below which the entropy of the
system exhibits a discontinuous jump. If an effective short-range cutoff is
applied, the entropy jump is finite; if not, the entropy diverges to $+\infty$.
A stable integral equation solution represents a state with maximal entropy;
the reverse is always true only for a modified integral equation introduced
here.
","[{""version"":""v1"",""created"":""Tue, 19 Jun 2001 19:31:31 GMT""}]","2007-05-23"
"cond-mat/0106382","Edson Santos Caixeiro","E. S. Caixeiro and E.V.L. de Mello","The Hubbard model applied to the phase diagram and pressure effects in
  YBa_2Cu_3O_{7-\delta} superconductors","submitted to Phys. Rev. B",,,,"cond-mat.supr-con",,"  We apply a method based on a BCS-type approach to the extended Hubbard model
to deal with the YBa_2Cu_3O_{7-\delta} superconductor family under pressure.
The parameters of the tight-binding band are taken from experiments, and the
coupling strength U and V are estimated from the zero pressure phase diagram Tc
X n_h, where n_h is the hole content and Tc the critical temperature. With the
assumption that the pressure P modifies the magnitude V of the attractive
potential besides n_h, we obtain a general expansion of Tc in terms of the
pressure P, as Tc(P)=Tc(n_h(P),V(P)). With this we can distinguish the charge
transfer and the intrinsic contribution to Tc. We show that the changes of Tc
with P for YBa_2Cu_3O_{7-\delta} are almost due to the intrinsic term.
","[{""version"":""v1"",""created"":""Tue, 19 Jun 2001 17:59:06 GMT""}]","2007-05-23"
"cond-mat/0106383","Dimitri N. Argyriou","D. N. Argyriou, P.J. Brown, J.S. Gardner, R. H. Heffner","Magnetization Distribution in the layered CMR Manganite La1.2Sr1.8Mn2O7
  from Polarized Neutron Diffraction","5 pages, 2 figures. Physical Review B (in press)",,"10.1103/PhysRevB.65.214431",,"cond-mat.soft cond-mat.mtrl-sci cond-mat.str-el",,"  In the ferromagnetic metallic state of the colossal magnetoresistive (CMR)
manganite La1.2Sr1.8Mn2O7, the spin density distribution is essentially in
agreement with the standard picture in which the unpaired electrons occupy the
three t2g orbitals, dxy, dyz, and dxz. However we find a small spin density ~4%
of the total Mn spin) on the apical O(2) oxygen atom at both 100 K and 220 K
and we suggest that this is due to covalency effects. Surprisingly we find no
evidence of spin on the other apical oxygen O(1) suggesting that the Mn eg
electron distribution along the c-axis is highly anisotropic.
","[{""version"":""v1"",""created"":""Tue, 19 Jun 2001 20:41:06 GMT""},{""version"":""v2"",""created"":""Wed, 8 May 2002 10:24:23 GMT""}]","2009-11-07"
"cond-mat/0106384","Nai-Gong Zhang","N. G. Zhang, C. L. Henley, C. Rischel, K. Lefmann","Effective Hamiltonian and low-lying energy clustering patterns of
  four-sublattice antiferromagnets","17 pages, 4 tables",,"10.1103/PhysRevB.65.064427",,"cond-mat.str-el",,"  We study the low-lying energy clustering patterns of quantum antiferromagnets
with p sublattices (in particular p=4). We treat each sublattice as a large
spin, and using second-order degenerate perturbation theory, we derive the
effective (biquadratic) Hamiltonian coupling the p large spins. In order to
compare with exact diagonalizations, the Hamiltonian is explicitly written for
a finite-size lattice, and it contains information on energies of excited
states as well as the ground state. The result is applied to the
face-centered-cubic Type I antiferromagnet of spin 1/2, including
second-neighbor interactions. A 32-site system is exactly diagonalized, and the
energy spectrum of the low-lying singlets follows the analytically predicted
clustering pattern.
","[{""version"":""v1"",""created"":""Tue, 19 Jun 2001 20:17:48 GMT""},{""version"":""v2"",""created"":""Fri, 19 Oct 2001 14:51:44 GMT""}]","2009-11-07"
"cond-mat/0106385","Stefan Wessel","Stefan Wessel, and Stephan Haas","Redistribution of Spectral Weight in Spin-1/2-Doped Haldane Chains","RevTex, 4 pages with 4 figures","Phys. Rev. B. 65, 132402 (2002)","10.1103/PhysRevB.65.132402",,"cond-mat.str-el",,"  We study the evolution of the dynamical spin structure factor in a spin-1
antiferromagnetic Heisenberg chain which is randomly doped with spin-1/2
moments. Using stochastic series expansion Quantum Monte Carlo simulations
combined with the Maximum Entropy method, we monitor the crossover from the
spin-1 chain, dominated by a single resonance at the Haldane energy, to the
spin-1/2 chain with a continuum of spinon states which diverges at
zero-frequency. Upon increasing the doping level, spectral weight is rapidly
transferred from the Haldane peak to lower energies. If the exchange couplings
between the spin-1/2 substituents and the spin-1 sites of the host are
sufficiently small, finite-frequency bound states are observed below the spin
gap for small doping concentrations.
","[{""version"":""v1"",""created"":""Tue, 19 Jun 2001 20:36:01 GMT""}]","2009-11-07"
"cond-mat/0106386","Xin Wan","Xin Wan, Kun Yang, and E. H. Rezayi","Reconstruction of Fractional Quantum Hall Edges","Revised version. 5 papges RevTex with 5 eps figures embedded in the
  text","Phys. Rev. Lett. 88, 056802 (2002)","10.1103/PhysRevLett.88.056802",,"cond-mat.mes-hall",,"  We study the interplay of interaction, confining potential and effects of
finite temperature at the edge of a quantum Hall liquid. Our exact
diagonalization calculation indicates that edge reconstruction occurs in the
fractional quantum Hall regime for a variety of confining potential, including
ones that correspond to a ""sharp"" edge. Our finite temperature Hartree-Fock
calculation for integer quantum Hall edges indicates that reconstruction is
suppressed above certain temperature. We discuss the implication of our results
on recent edge tunneling and microwave absorption experiments.
","[{""version"":""v1"",""created"":""Tue, 19 Jun 2001 20:42:20 GMT""},{""version"":""v2"",""created"":""Sat, 19 Jan 2002 01:06:46 GMT""}]","2009-11-07"
"cond-mat/0106387","Joel E. Moore","Joel E. Moore, Xiao-Gang Wen","Critical points in edge tunneling between generic FQH states","23 pages, 6 figures. Xiao-Gang Wen: http://dao.mit.edu/~wen",,"10.1103/PhysRevB.66.115305",,"cond-mat.mes-hall",,"  A general description of weak and strong tunneling fixed points is developed
in the chiral-Luttinger-liquid model of quantum Hall edge states. Tunneling
fixed points are a subset of `termination' fixed points, which describe
boundary conditions on a multicomponent edge. The requirement of unitary time
evolution at the boundary gives a nontrivial consistency condition for possible
low-energy boundary conditions. The effect of interactions and random hopping
on fixed points is studied through a perturbative RG approach which generalizes
the Giamarchi-Schulz RG for disordered Luttinger liquids to broken left-right
symmetry and multiple modes. The allowed termination points of a multicomponent
edge are classified by a B-matrix with rational matrix elements. We apply our
approach to a number of examples, such as tunneling between a quantum Hall edge
and a superconductor and tunneling between two quantum Hall edges in the
presence of interactions. Interactions are shown to induce a continuous
renormalization of effective tunneling charge for the integrable case of
tunneling between two Laughlin states. The correlation functions of
electronlike operators across a junction are found from the B matrix using a
simple image-charge description, along with the induced lattice of boundary
operators. Many of the results obtained are also relevant to ordinary Luttinger
liquids.
","[{""version"":""v1"",""created"":""Tue, 19 Jun 2001 21:12:30 GMT""}]","2009-11-07"
