"astro-ph/0101077","I. Georgantopoulos","I. Georgantopoulos, K. Nandra, A. Ptak","SHEEP: the ASCA 5-10 keV survey","To appear in Proc. of ""X-ray astronomy 2000"",(Palermo Sep. 2000),
  Eds. R. Giacconi, L. Stella, S. Serio, ASP Conf. Series, in press (6 pages)",,,,"astro-ph",,"  We present the first results of the hard (5-10 keV) ASCA GIS survey SHEEP
(Search for the High Energy Extragalactic Population).
  We have analysed 149 fields covering an area of 39 sq. deg detecting 69
sources. Several of these appear to be associated with QSOs and Seyfert-1
galaxies but with hard X-ray spectra, probably due to high absorption. Indeed,
the hardness ratio analysis shows that the spectra of the majority of our
sources can be represented with a ``scatterer'' model similar to obscured
Seyfert galaxies locally.
  According to this model, our sources present high intrinsic absorption
(logN_H~23) but also significant amounts of soft X-ray emission coming from
scattered light.
","[{""version"":""v1"",""created"":""Fri, 5 Jan 2001 10:05:14 GMT""}]","2007-05-23"
"astro-ph/0101078","Pawel Ciecielag","P. Ciecielag, M. Chodorowski and A. Kudlicki","Local Group Velocity Versus Gravity: Nonlinear Effects","15 pages, 4 figures, submitted to Acta Astronomica",,,,"astro-ph",,"  We use numerical simulations to study the relation between the velocity of
the Local Group and its gravitational acceleration. This relation serves as a
test for the kinematic origin of the CMB dipole and as a method for estimating
beta. We calculate the misalignment angle between the two vectors and compare
it to the observed value for the PSCz survey. The latter value is near the
upper limit of the 95% confidence interval for the angle; therefore, the
nonlinear effects are unlikely to be responsible for the whole observed
misalignment. We also study the relation between the amplitudes of the LG
velocity and gravity vectors. In an Omega=1 Universe, the smoothed gravity of
the LG turns out to be a biased low estimator of the LG (unsmoothed) velocity.
In an Omega=0.3 Universe, the estimator is biased high. The discussed biases
are, however, only a few per cent, thus the linear theory works to good
accuracy. The gravity-based estimator of the LG velocity has also a scatter
that limits the precision of the estimate of beta in the LG velocity-gravity
comparisons. The random error of beta due to nonlinear effects amounts to
several per cent.
","[{""version"":""v1"",""created"":""Fri, 5 Jan 2001 11:06:20 GMT""}]","2007-05-23"
"astro-ph/0101079","I. Georgantopoulos","A. Akylas, I. Georgantopoulos (National Observatory of Athens), A.
  Comastri (Bologna Observatory)","BeppoSAX Observations of the Seyfert-2 Galaxies NGC 7172 and ESO 103-G35","9 pages, to appear in the MNRAS","Mon.Not.Roy.Astron.Soc. 324 (2001) 521","10.1046/j.1365-8711.2001.04375.x",,"astro-ph",,"  We investigate the X-ray spectra of the type-2 Seyfert galaxies NGC 7172 and
ESO 103-G35, using BeppoSAX observations, separated by approximately one year.
We find that the X-ray spectra of both NGC 7172 and ESO 103-G35 can be well
fitted using a power-law model with an Fe K emission line at 6.4 keV. We did
not find any statistically significant evidence for the existence of a
reflection component in the X-ray spectra of these two galaxies. The continuum
flux has decreased by a factor of approximately two during this period, in both
objects. However, the spectral index as well as the absorption column have
remained constant. We find weak evidence for the decrease of the normalization
of the Fe K emission line in a similar manner to the continuum in NGC7172. We
also report evidence for a broad Fe K confirming previous observations. In
contrast, in the case of ESO 103-G35 the line flux does not change while its
width remains unresolved.
","[{""version"":""v1"",""created"":""Fri, 5 Jan 2001 11:55:37 GMT""}]","2009-11-06"
"cond-mat/0101036","Ilya Eremin","M. Eremin, I. Eremin, and S. Varlamov","Dynamical charge susceptibility in layered cuprates: the influence of
  screened inter-site Coulomb repulsion",,"Phys. Rev. B 64, 214512 (2001)","10.1103/PhysRevB.64.214512",,"cond-mat.supr-con cond-mat.str-el",,"  The analytical expression for dynamical charge susceptibility in layered
cuprates has been derived in the frame of singlet-correlated band model beyond
random-phase-approximation (RPA) scheme. Our calculations performed near
optimal doping regime show that there is a peak in real part of the charge
susceptibility $\chi({\bf q},\omega)$ at {\bf Q} = ($\pi$, $\pi$) at strong
enough inter-site Coulomb repulsion. Together with the strong maximum in the Im
$\chi({\bf Q},\omega)$ at 15 meV it confirms the formation of low-energetic
plasmons or charge fluctuations. This provides a jsutification that these
excitations are important and together with a spin flcutuations can contribute
to the Cooper pairing in layered cuprates. Analysing the charge susceptibilitiy
with respect to an instability we obtain a new plasmon branch, $\omega_{\bf
q}$, along the Brillouin Zone. In particular, we have found that it goes to
zero near {\bf Q}$_{CDW} \approx (2\pi/3, 2\pi/3)$.
","[{""version"":""v1"",""created"":""Thu, 4 Jan 2001 19:42:51 GMT""}]","2009-11-07"
"cond-mat/0101048","Dmitri Klimov","D. Thirumalai and D. K. Klimov","Introducing Protein Folding Using Simple Models","latex, 32 pages, 10 Postscript figures, to be published in
  Encyclopedia of Chemical Physics and Protein Chemistry. IoP Publishing,
  Bristol, UK",,,,"cond-mat.soft q-bio",,"  We discuss recent theoretical developments in the study of simple lattice
models of proteins. Such models are designed to understand general features of
protein structures and mechanism of folding. Among the topics covered are (i)
the use of lattice models to understand the selection of the limited set of
viable protein folds; (ii) the relationship between structure and sequence
spaces; (iii) the application of lattice models for studying folding mechanisms
(topological frustration, kinetic partitioning mechanism). Classification of
folding scenarios based on the intrinsic thermodynamic properties of a sequence
(namely, the collapse and folding transition temperatures) is outlined. A brief
discussion of random heteropolymer model is also presented.
","[{""version"":""v1"",""created"":""Thu, 4 Jan 2001 20:33:29 GMT""}]","2007-05-23"
"cond-mat/0101049","Frank Schlesener","F. Schlesener, A. Hanke, R. Klimpel, S. Dietrich","Polymer depletion interaction between two parallel repulsive walls","17 pages, 3 figures. Final version as published","Phys. Rev. E 63, 041803 (2001)","10.1103/PhysRevE.63.041803",,"cond-mat.soft",,"  The depletion interaction between two parallel repulsive walls confining a
dilute solution of long and flexible polymer chains is studied by
field-theoretic methods. Special attention is paid to self-avoidance between
chain monomers relevant for polymers in a good solvent. Our direct approach
avoids the mapping of the actual polymer chains on effective hard or soft
spheres. We compare our results with recent Monte Carlo simulations [A. Milchev
and K. Binder, Eur. Phys. J. B 3, 477 (1998)] and with experimental results for
the depletion interaction between a spherical colloidal particle and a planar
wall in a dilute solution of nonionic polymers [D. Rudhardt, C. Bechinger, and
P. Leiderer, Phys. Rev. Lett. 81, 1330 (1998)].
","[{""version"":""v1"",""created"":""Thu, 4 Jan 2001 17:06:35 GMT""},{""version"":""v2"",""created"":""Thu, 1 Nov 2001 00:32:38 GMT""}]","2009-11-07"
"cond-mat/0101050","Falkovsky","L. A. Falkovsky","Coulomb effects in dynamics of polar lattices","9 pages, 1 figure, to be published in JETP, issue 5, 2001",,"10.1134/1.1378176",,"cond-mat.mtrl-sci",,"  Zone-center phonon frequencies of polar lattices are calculated for uniaxial
crystals from the symmetry arguments. Long-range Coulomb forces and crystal
anisotropy are explicitly taken into account. Free-carrier contributions into a
dielectric constant are included. The angular dispersion of optical-phonon
modes is compared with data for hexagonal 6H-SiC politype.
","[{""version"":""v1"",""created"":""Thu, 4 Jan 2001 18:45:39 GMT""}]","2009-11-07"
"cond-mat/0101051","Frederic Chevy","K. W. Madison, F. Chevy, V. Bretin, and J. Dalibard","Stationary states of a rotating Bose-Einstein condensate: routes to
  vortex nucleation","4 pages, 3 eps figures",,"10.1103/PhysRevLett.86.4443",,"cond-mat.stat-mech cond-mat.soft",,"  Using a focused laser beam we stir a $^{87}$Rb Bose-Einstein condensate
confined in a magnetic trap. We observe that the steady states of the
condensate correspond to an elliptic cloud, stationary in the rotating frame.
These steady states depend nonlinearly on the stirring parameters (amplitude
and frequency), and various solutions can be reached experimentally depending
on the path followed in this parameter space. These states can be dynamically
unstable and we observe that such instabilities lead to vortex nucleation in
the condensate.
","[{""version"":""v1"",""created"":""Thu, 4 Jan 2001 18:45:07 GMT""}]","2009-11-07"
"cond-mat/0101052","Tigran V. Shahbazyan","T. V. Shahbazyan, I. E. Perakis, M. E. Raikh","Luminescence from highly excited nanorings: Luttinger liquid description","10 pages including 2 figures",,"10.1103/PhysRevB.64.115317",,"cond-mat",,"  We study theoretically the luminescence from quantum dots of a ring geometry.
For high excitation intensities, photoexcited electrons and holes form Fermi
seas. Close to the emission threshold, the single-particle spectral lines
aquire weak many-body satellites. However, away from the threshold, the
discrete luminescence spectrum is completely dominated by many-body
transitions. We employ the Luttinger liquid approach to exactly calculate the
intensities of all many-body spectral lines. We find that the transition from
single-particle to many-body structure of the emission spectrum is governed by
a single parameter and that the distribution of peaks away from the threshold
is universal.
","[{""version"":""v1"",""created"":""Thu, 4 Jan 2001 23:47:21 GMT""},{""version"":""v2"",""created"":""Fri, 5 Jan 2001 05:47:14 GMT""},{""version"":""v3"",""created"":""Mon, 18 Jun 2001 19:57:16 GMT""},{""version"":""v4"",""created"":""Wed, 27 Jun 2001 19:52:31 GMT""}]","2009-11-07"
"cond-mat/0101053","Xiaoyu Xia","Xiaoyu Xia and Peter G. Wolynes","Diffusion and the Mesoscopic Hydrodynamics of Supercooled Liquids","5 pages including 4 eps figures",,,,"cond-mat.dis-nn",,"  The description of molecular motion by macroscopic hydrodynamics has a long
and continuing history. The Stokes-Einstein relation between the diffusion
coefficient of a solute and the solvent viscosity predicted using macroscopic
continuum hydrodynamics, is well satisfied for liquids under ordinary to high
temperature conditions, even for solutes as small as the solvent. Diffusion in
supercooled liquids near their glass transition temperature has been found to
deviate by as much as 3 orders of magnitude from that predicted by the
Stokes-Einstein Relation [1]. Based on the random first order transition theory
[2-4], supercooled liquids possess a mosaic structure. The size- and
temperature-dependence of the transport anomalies are quantitatively explained
with an effective medium hydrodynamics model based on the microscopic theory of
this mesoscale, mosaic structure.
","[{""version"":""v1"",""created"":""Fri, 5 Jan 2001 05:03:46 GMT""}]","2007-05-23"
"cond-mat/0101054","Yutaka Okabe","Kazuhisa Kaneda and Yutaka Okabe","Finite-size scaling for the Ising model on the Moebius strip and the
  Klein bottle","4 pages including 5 eps figures, RevTex, to appear in Phys. Rev. Lett","Phys. Rev. Lett. 86, 2134-2137 (2001)","10.1103/PhysRevLett.86.2134",,"cond-mat.stat-mech",,"  We study the finite-size scaling properties of the Ising model on the Moebius
strip and the Klein bottle. The results are compared with those of the Ising
model under different boundary conditions, that is, the free, cylindrical, and
toroidal boundary conditions. The difference in the magnetization distribution
function $p(m)$ for various boundary conditions is discussed in terms of the
number of the percolating clusters and the cluster size. We also find
interesting aspect-ratio dependence of the value of the Binder parameter at
$T=T_c$ for various boundary conditions. We discuss the relation to the
finite-size correction calculations for the dimer statistics.
","[{""version"":""v1"",""created"":""Fri, 5 Jan 2001 05:08:18 GMT""}]","2009-11-07"
"cond-mat/0101055","Walter Kob","Philippe Jund, Walter Kob, and Remi Jullien (Lab. des Verres,
  Universite Montpellier II)","Channel diffusion of sodium in a silicate glass","10 pages of Latex, 5 figures, one figure added, text expanded","Phys. Rev. B 64, 134303 (2001)","10.1103/PhysRevB.64.134303",,"cond-mat.stat-mech cond-mat.dis-nn",,"  We use classical molecular dynamics simulations to study the dynamics of
sodium atoms in amorphous Na$_2$O-4SiO$_2$. We find that the sodium
trajectories form a well connected network of pockets and channels. Inside
these channels the motion of the atoms is not cooperative but rather given by
independent thermally activated hops of individual atoms between the pockets.
By determining the probability that an atom returns to a given starting site,
we show that such events are not important for the dynamics of this system.
","[{""version"":""v1"",""created"":""Fri, 5 Jan 2001 07:50:27 GMT""},{""version"":""v2"",""created"":""Thu, 12 Jul 2001 10:26:11 GMT""}]","2009-11-07"
"cond-mat/0101056","Yuo-Hsien Shiau","Yuo-Hsien Shiau and Chin-Kun Hu","Pattern Competition in the Photorefractive Semiconductors",,,"10.1143/JPSJ.70.3636",,"cond-mat.soft cond-mat.mtrl-sci",,"  We analytically study the photorefractive Gunn effect in n-GaAs subjected to
two external laser beams which form a moving interference pattern (MIP) in the
semiconductor. When the intensity of the spatially independent part of the MIP,
denoted by $I_0$, is small, the system has a periodic domain train (PDT),
consistent with the results of linear stability analysis. When $I_0$ is large,
the space-charge field induced by the MIP will compete with the PDT and result
in complex dynamics, including driven chaos via quasiperiodic route.
","[{""version"":""v1"",""created"":""Fri, 5 Jan 2001 08:57:46 GMT""}]","2009-11-07"
"cond-mat/0101057","Karl Schulze","D. Jaksch, S.A. Gardiner, K. Schulze, J.I. Cirac, P. Zoller","Uniting Bose-Einstein condensates in optical resonators","4 pages, 3 figures",,"10.1103/PhysRevLett.86.4733",,"cond-mat",,"  The relative phase of two initially independent Bose-Einstein condensates can
be laser cooled to unite the two condensates by putting them into a ring cavity
and coupling them with an internal Josephson junction. First, we show that this
phase cooling process already appears within a semiclassical model. We
calculate the stationary states, find regions of bistable behavior and suggest
a Ramsey-type experiment to measure the build up of phase coherence between the
condensates. We also study quantum effects and imperfections of the system.
","[{""version"":""v1"",""created"":""Fri, 5 Jan 2001 09:27:40 GMT""},{""version"":""v2"",""created"":""Mon, 26 Feb 2001 10:20:56 GMT""},{""version"":""v3"",""created"":""Fri, 30 Mar 2001 09:52:00 GMT""}]","2009-11-07"
"cond-mat/0101058","Thomas Garel","T. Garel, C. Monthus (SPhT Saclay) and H. Orland (ITP Santa Barbara
  and SPhT Saclay)","A simple model for DNA denaturation","10 pages",,"10.1209/epl/i2001-00391-2","Preprint SphT/01-003","cond-mat.soft cond-mat.stat-mech q-bio",,"  Following Poland and Scheraga, we consider a simplified model for the
denaturation transition of DNA. The two strands are modeled as interacting
polymer chains. The attractive interactions, which mimic the pairing between
the four bases, are reduced to a single short range binding term. Furthermore,
base-pair misalignments are forbidden, implying that this binding term exists
only for corresponding (same curvilinear abscissae) monomers of the two chains.
We take into account the excluded volume repulsion between monomers of the two
chains, but neglect intra-chain repulsion. We find that the excluded volume
term generates an effective repulsive interaction between the chains, which
decays as $1/r^{d-2}$. Due to this long-range repulsion between the chains, the
denaturation transition is first order in any dimension, in agreement with
previous studies.
","[{""version"":""v1"",""created"":""Fri, 5 Jan 2001 09:25:23 GMT""}]","2009-11-07"
"cond-mat/0101059","Skipetrov Serguei E.","S. E. Skipetrov","Temporal fluctuations of waves in weakly nonlinear disordered media","RevTeX, 15 pages (including 5 figures), accepted for publication in
  Phys. Rev. E","Phys. Rev. E 63, 056614 (2001)","10.1103/PhysRevE.63.056614",,"cond-mat.dis-nn cond-mat.mes-hall cond-mat.soft nlin.CD physics.optics",,"  We consider the multiple scattering of a scalar wave in a disordered medium
with a weak nonlinearity of Kerr type. The perturbation theory, developed to
calculate the temporal autocorrelation function of scattered wave, fails at
short correlation times. A self-consistent calculation shows that for
nonlinearities exceeding a certain threshold value, the multiple-scattering
speckle pattern becomes unstable and exhibits spontaneous fluctuations even in
the absence of scatterer motion. The instability is due to a distributed
feedback in the system ""coherent wave + nonlinear disordered medium"". The
feedback is provided by the multiple scattering. The development of instability
is independent of the sign of nonlinearity.
","[{""version"":""v1"",""created"":""Fri, 5 Jan 2001 10:05:36 GMT""}]","2016-08-31"
"cond-mat/0101060","Georg Foltin","Georg Foltin","An alternative field theory for the Kosterlitz-Thouless transition","final version, extended discussion, appendix added, 8 pages, no
  figure, uses IOP documentclass iopart","J.Phys.A34:5327-5333,2001","10.1088/0305-4470/34/26/303",,"cond-mat.stat-mech",,"  We extend a Gaussian model for the internal electrical potential of a
two-dimensional Coulomb gas by a non-Gaussian measure term, which singles out
the physically relevant configurations of the potential. The resulting
Hamiltonian, expressed as a functional of the internal potential, has a
surprising large-scale limit: The additional term simply counts the number of
maxima and minima of the potential. The model allows for a transparent
derivation of the divergence of the correlation length upon lowering the
temperature down to the Kosterlitz-Thouless transition point.
","[{""version"":""v1"",""created"":""Fri, 5 Jan 2001 10:14:26 GMT""},{""version"":""v2"",""created"":""Thu, 28 Jun 2001 15:05:18 GMT""}]","2008-11-26"
"cond-mat/0101062","Yurii G. Naidyuk","Yu. G. Naidyuk, O. E. Kvitnitskaya, A. G. M. Jansen, C. Geibel, A. A.
  Menovsky, P. Wyder","Magnetic state in URu2Si2, UPd2Al3 and UNi2Al3 probed by point contacts","10 pages incl. 5 figures, LaTex 2e","Fiz. Nizk. Temp. (Low Temp. Phys.) 2001, V27, N6, p. 668-673","10.1063/1.1382993",,"cond-mat.str-el",,"  The antiferromagnetic (AFM) state has been investigated in the three
heavy-fermion compounds URu2Si2, UPd2Al3, and UNi2Al3 by measuring dV/dI(V)
curves of point contacts at different temperatures (1.5-20 K) and magnetic
fields (0-28 T). The zero-bias maximum in dV/dI(V) for URu2Si2 points to a
partially gapped Fermi-surface related to the itinerant nature of the AFM state
contrary to UPd2Al3 where analogous features have not been found. The AFM state
in UNi2Al3 has more similarities with URu2Si2. For URu2Si2, the same critical
field of about 40 T along the easy c axis is found for all features in dV/dI(V)
corresponding to the Neel temperature, the gap in the electronic density of
states, and presumably the ordered moments.
","[{""version"":""v1"",""created"":""Fri, 5 Jan 2001 13:03:54 GMT""}]","2009-11-07"
"cond-mat/0101063","Bumsoo Kyung","Bumsoo Kyung (University of Sherbrooke)","Induced local spin-singlet amplitude and pseudogap in high $T_{c}$
  cuprates","5 pages, 3 figures","Phys. Rev. B {\bf 64}, 104 512 (2001)","10.1103/PhysRevB.64.104512",,"cond-mat.str-el cond-mat.supr-con",,"  In this paper we show that local spin-singlet amplitude with d-wave symmetry,
$<|\Delta_{d}(0)|^{2}>$, can be induced by short-range spin correlations even
in the absence of pairing interactions. Fluctuation theory is formulated to
make connection between pseudogap temperature $T^{*}$, pseudogap size
$\Delta_{pg}$ and $<|\Delta_{d}(0)|^{2}>$. In the present scenario for the
pseudogap, the normal state pseudogap is caused by the induced local
spin-singlet amplitude due to short-range spin correlations, which compete in
the low energy sector with superconducting correlations to make $T_{c}$ go to
zero near half-filling. Calculated $T^{*}$ falls from a high value onto the
$T_{c}$ line and closely follows mean-field N\'{e}el temperature $T_{N}^{MF}$.
The calculated $\Delta_{pg}$ is in good agreement with experimental results. We
propose an experiment in which the present scenario can be critically tested.
","[{""version"":""v1"",""created"":""Fri, 5 Jan 2001 13:25:18 GMT""},{""version"":""v2"",""created"":""Mon, 26 Feb 2001 14:58:14 GMT""},{""version"":""v3"",""created"":""Wed, 28 Mar 2001 23:20:57 GMT""},{""version"":""v4"",""created"":""Fri, 8 Jun 2001 13:34:14 GMT""},{""version"":""v5"",""created"":""Fri, 24 Aug 2001 12:58:23 GMT""}]","2009-11-07"
"cond-mat/0101064","Christian Maes","Christian Maes","Entropy Production in Driven Spatially Extended Systems",,"In: Entropy, Princeton Uniiversity Press, Princeton and
  Oxford.Eds. A. Greven, G. Keller and G. Warnecke, pp. 251 (2003)",,,"cond-mat.stat-mech cond-mat.soft",,"  This is a short review of the statistical mechanical definition of entropy
production for systems composed of a large number of interacting components.
Emphasis is on open systems driven away from equilibrium where the entropy
production can be identified with a logarithmic ratio of microstate
multiplicities of the original macrostate with respect to the time-reversed
state. A special role is taken by Gibbs measures for the stationary
spatio-temporal distribution of trajectories. The mean entropy production is
always non-negative and it is zero only when the system is in equilibrium. The
fluctuations of the entropy production satisfy a (Gallavotti-Cohen)symmetry
first observed and then derived for the phase space contraction rate in a class
of strongly chaotic dynamical systems. Aspects of the general framework are
illustrated via a bulk driven diffusive lattice gas.
","[{""version"":""v1"",""created"":""Fri, 5 Jan 2001 13:30:35 GMT""}]","2015-06-02"
"cond-mat/0101065","Dr Mario Nicodemi","Henrik Jeldtoft Jensen and Mario Nicodemi","Memory effects in response functions of driven vortex matter",,"Europhys. Lett. 57, 348 (2002)","10.1209/epl/i2002-00466-6",,"cond-mat",,"  Vortex flow in driven type II superconductors shows strong memory and history
dependent effects. Here, we study a schematic microscopic model of driven
vortices to propose a scenario for a broad set of these kind of phenomena
ranging from ``rejuvenation'' and ``stiffening'' of the system response, to
``memory'' and ``irreversibility'' in I-V characteristics.
","[{""version"":""v1"",""created"":""Fri, 5 Jan 2001 15:56:40 GMT""}]","2009-11-07"
"cs/0101004","Kevin Cheung","Kevin K. H. Cheung and Michele Mosca","Decomposing Finite Abelian Groups","6 pages",,,,"cs.DS quant-ph",,"  This paper describes a quantum algorithm for efficiently decomposing finite
Abelian groups. Such a decomposition is needed in order to apply the Abelian
hidden subgroup algorithm. Such a decomposition (assuming the Generalized
Riemann Hypothesis) also leads to an efficient algorithm for computing class
numbers (known to be at least as difficult as factoring).
","[{""version"":""v1"",""created"":""Fri, 5 Jan 2001 15:32:16 GMT""}]","2007-05-23"
"gr-qc/0101016","Feng He","Liao Liu and Feng He","Bubbles created from vacuum fluctuation","6 pages","Chin.Phys.Lett. 18 (2001) 1007-1008","10.1088/0256-307X/18/8/303",,"gr-qc",,"  We show that the bubbles $S^2\times S^2$can be created from vacuum
fluctuation in certain De Sitter universe, so the space-time foam-like
structure might really be constructed from bubbles of $S^2\times S^2$ in the
very early inflating phase of our universe. But whether such foam-like
structure persisted during the later evolution of the universe is a problem
unsolved now.
","[{""version"":""v1"",""created"":""Fri, 5 Jan 2001 03:13:37 GMT""}]","2009-11-07"
"gr-qc/0101017","Gorbatsievich Alexander K.","A.A.Blinkouski and A.K.Gorbatsievich","Generation of exact solutions in cosmology on the basis of
  five-dimensional Projective Unified Field Theory","8 pages","Gravitation & Cosmology, Vol.7 (2001), No.4, pp. 281-285",,,"gr-qc",,"  A homogeneous and isotropic model of the Universe is considered in the
framework of the five-dimensional Projective Unified Field Theory in which the
gravitation is described by both space-time curvature and some hypothetical
scalar field (sigma-field). We propose a generation method for obtaining exact
solutions. New exact Friedmann-like solutions for a dust model and inflationary
solutions are found. It is shown that in the framework of exponential type
inflation we obtain a natural explanation of why at present we do not observe
sigma-field effects or why these effects are negligible.
","[{""version"":""v1"",""created"":""Fri, 5 Jan 2001 09:13:54 GMT""},{""version"":""v2"",""created"":""Thu, 27 Nov 2003 15:25:18 GMT""}]","2007-05-23"
