"gr-qc/0101018","Jonathan Wilson","J. A. Vickers and J. P. Wilson (Department of Mathematics, University
  of Southampton)","Generalised hyperbolicity: hypersurface singularities","9 pages, AmSTeX, 2 postscript figures",,,,"gr-qc",,"  Sufficient conditions for the well-posedness of the initial value problem for
the scalar wave equation are obtained in space-times with hypersurface
singularities
","[{""version"":""v1"",""created"":""Fri, 5 Jan 2001 10:16:34 GMT""}]","2009-09-25"
"gr-qc/0101019","Cyril Cartier","C.Cartier, E.J.Copeland and M.Gasperini","Gravitational waves in non-singular string cosmologies","24 pages, 7 figures","Nucl.Phys. B607 (2001) 406-428","10.1016/S0550-3213(01)00182-1",,"gr-qc astro-ph hep-th",,"  We study the evolution of tensor metric fluctuations in a class of
non-singular models based on the string effective action, by including in the
perturbation equation the higher-derivative and loop corrections needed to
regularise the background solutions. We discuss the effects of such
higher-order corrections on the final graviton spectrum, and we compare the
results of analytical and numerical computations.
","[{""version"":""v1"",""created"":""Fri, 5 Jan 2001 15:22:25 GMT""}]","2009-11-07"
"gr-qc/0101020","Marc Mars","Marc Mars","Spacetime Ehlers group: Transformation law for the Weyl tensor","LaTeX, 25 pages, no figures, uses Amstex. Accepted for publication in
  Classical and Quantum Gravity","Class.Quant.Grav. 18 (2001) 719-738","10.1088/0264-9381/18/4/311",,"gr-qc",,"  The spacetime Ehlers group, which is a symmetry of the Einstein vacuum field
equations for strictly stationary spacetimes, is defined and analyzed in a
purely spacetime context (without invoking the projection formalism). In this
setting, the Ehlers group finds its natural description within an infinite
dimensional group of transformations that maps Lorentz metrics into Lorentz
metrics and which may be of independent interest. The Ehlers group is shown to
be well defined independently of the causal character of the Killing vector
(which may become null on arbitrary regions). We analyze which global
conditions are required on the spacetime for the existence of the Ehlers group.
The transformation law for the Weyl tensor under Ehlers transformations is
explicitly obtained. This allows us to study where, and under which
circumstances, curvature singularities in the transformed spacetime will arise.
The results of the paper are applied to obtain a local characterization of the
Kerr-NUT metric.
","[{""version"":""v1"",""created"":""Fri, 5 Jan 2001 14:58:58 GMT""}]","2009-11-07"
"gr-qc/0101021","Marc Mars","Marc Mars","The Wahlquist-Newman solution","LaTeX, 18 pages, no figures. Accepted for publication in Phys. Rev. D","Phys.Rev. D63 (2001) 064022","10.1103/PhysRevD.63.064022",,"gr-qc",,"  Based on a geometrical property which holds both for the Kerr metric and for
the Wahlquist metric we argue that the Kerr metric is a vacuum subcase of the
Wahlquist perfect-fluid solution. The Kerr-Newman metric is a physically
preferred charged generalization of the Kerr metric. We discuss which geometric
property makes this metric so special and claim that a charged generalization
of the Wahlquist metric satisfying a similar property should exist. This is the
Wahlquist-Newman metric, which we present explicitly in this paper. This family
of metrics has eight essential parameters and contains the Kerr-Newman-de
Sitter and the Wahlquist metrics, as well as the whole Pleba\'nski limit of the
rotating C-metric, as particular cases. We describe the basic geometric
properties of the Wahlquist-Newman metric, including the electromagnetic field
and its sources, the static limit of the family and the extension of the
spacetime across the horizon.
","[{""version"":""v1"",""created"":""Fri, 5 Jan 2001 15:29:35 GMT""}]","2009-11-07"
"hep-ex/0101001","Paul Grannis","P.D. Grannis","Linear Collider Workshop 2000 Summary","16 pp, Summary of Linear Collider Workshop, FNAL Oct. 2000",,"10.1063/1.1394308",,"hep-ex",,"  We summarize some of the main physics questions that will serve to define the
linear e+e- collider program, and comment on issues that confront the world
community in making such a collider a reality.
","[{""version"":""v1"",""created"":""Thu, 4 Jan 2001 17:24:40 GMT""}]","2009-11-07"
"hep-ex/0101002","Valery Telnov","Valery Telnov","Photon collider at TESLA: parameters and interaction region issues","4 pages, 1 figures, to appear in the proceedings of the 5th Int.
  Linear Colliders Workshop - LCWS2000, Fermilab, October 2000",,"10.1063/1.1394409",,"hep-ex",,"  Photon colliders (gamma-gamma, gamma-e) are based on backward Compton
scattering of laser light off the high energy electrons of linear colliders.
Recent study has shown that the gamma-gamma luminosity in the high energy peak
can reach 0.3--0.5 L (e+e-). Typical cross sections of interesting processes in
gamma-gamma collisions are higher than those in e+e- collisions by about one
order of magnitude, so the number of events in gamma-gamma collisions will be
more than that in e+e- collisions. In this paper possible parameters of a
photon collider at TESLA and a laser scheme are briefly discussed.
","[{""version"":""v1"",""created"":""Thu, 4 Jan 2001 18:01:32 GMT""}]","2009-11-07"
"hep-ex/0101003","Milind V. Diwan","Milind V. Diwan, Hong Ma","Tests of the Standard Model Using Muon Polarization Asymmetries in Kaon
  Decays","24 pages, 3 figures, To be published in the International Journal of
  Modern Physics A","Int.J.Mod.Phys. A16 (2001) 2449-2471","10.1142/S0217751X01003330","BNL-67916","hep-ex",,"  We have examined the physics and the experimental feasibility of studying
various kaon decay processes in which the polarization of a muon in the final
state is measured. Valuable information on CP violation, the quark mixing (CKM)
matrix, and new physics can be obtained from such measurements. We have
considered muon polarization in K_L to mu+ mu- and K to pi mu+ mu- decays.
Although the effects are small, or difficult to measure because of the small
branching ratios involved, these studies could provide clean measurements of
the CKM parameters. The experimental difficulty appears comparable to the
observation of K to pi nu barnu. New sources of physics, involving non-standard
CP violation, could produce effects observable in these measurements. Limits
from new results on the neutron and electron electric dipole moment, and
epsilon-prime over epsilon in neutral kaon decays, do not eliminate certain
models that could contribute to the signal. A detailed examination of muon
polarization out of the decay plane in KMU3 and radiative KMU2 decays also
appears to be of interest. With current kaon beams and detector techniques, it
is possible to measure the T-violating polarization for KMU3 with uncertainties
approaching 0.0001. This level of sensitivity would provide an interesting
probe of new physics.
","[{""version"":""v1"",""created"":""Thu, 4 Jan 2001 20:00:33 GMT""}]","2009-11-07"
"hep-ph/0101039","Ara Ioannisian","A.Ioannisian","Phenomenology of neutrino physics in the Kaluza-Klein theories of low
  scale gravity","5 pages, Talk given at the EuroConference on Frontiers in Particle
  Astrophysics and Cosmology, San Feliu de Guixols, Spain, 30 September - 5
  October, 2000","Nucl.Phys.Proc.Suppl. 95 (2001) 276-280","10.1016/S0920-5632(01)01094-5",,"hep-ph",,"  We discuss the phenomenological consequences of theories which describe
sterile neutrinos in large extra dimensions. We show that the Kaluza-Klein
tower of the singlet neutrinos, albeit tiny individual contribution in
electroweak processes, act cumulatively, giving rise to non-universality of the
weak interactions of the light neutrinos and to flavour-violating radiative
processes. Owing to these non-decoupling effects of th Kaluza--Klein neutrinos,
we derive strong constraints on the parameters of the theory that originates
from the non-observation of flavour-violating and universality-breaking
phenomena. In this theory we propose a four-neutrino model which can reconcile
the existing data coming from underground experiments in terms of neutrino
oscillations, together with the hint from the LSND experiment and a possible
neutrino contribution to the hot dark matter of the Universe.
","[{""version"":""v1"",""created"":""Thu, 4 Jan 2001 17:46:26 GMT""}]","2009-11-07"
"hep-ph/0101040","Bayram Tekin","Ian I. Kogan, Alex Kovner and Bayram Tekin","The chicken or the egg; or Who ordered the chiral phase transition?","22 pages, 7 figures, comments about chiral symmetry at finite nuclear
  density are added","Phys.Rev. D63 (2001) 116007","10.1103/PhysRevD.63.116007","OUTP-01-02P","hep-ph hep-lat hep-th",,"  We draw an analogy between the deconfining transition in the 2+1 dimensional
Georgi-Glashow model and the chiral phase transition in 3+1 dimensional QCD.
Based on the detailed analysis of the former (hep-th/0010201) we suggest that
the chiral symmetry restoration in QCD at high temperature is driven by the
thermal ensemble of baryons and anti-baryons. The chiral symmetry is restored
when roughly half of the volume is occupied by the baryons. Surprisingly
enough, even though baryons are rather heavy, a crude estimate for the critical
temperature gives $T_c=180$ Mev. In this scenario the binding of the instantons
is not the cause but rather a consequence of the chiral symmetry restoration.
","[{""version"":""v1"",""created"":""Thu, 4 Jan 2001 18:01:49 GMT""},{""version"":""v2"",""created"":""Tue, 17 Apr 2001 14:33:59 GMT""}]","2009-11-07"
"hep-ph/0101041","Ina Sarcevic","Jamal Jalilian-Marian (University of Arizona), Kostas Orginos
  (University of Arizona and RIKEN-BNL) and Ina Sarcevic (University of
  Arizona)","Nuclear Effects in Prompt Photon Production at the Large Hadron Collider","version accepted for publication in Nucl. Phys. A","Nucl.Phys. A700 (2002) 523-538","10.1016/S0375-9474(01)01309-4",,"hep-ph nucl-th",,"  We present a detailed study of prompt photon production cross section in
heavy-ion collisions in the central rapidity region at energy of $\sqrt{s}=5.5$
TeV, appropriate to LHC experiment. We include the next-to-leading order
radiative corrections, $O(\alpha_{em}\alpha_s^2)$, nuclear shadowing and the
parton energy loss effects. We find that the nuclear effects can reduce the
invariant cross section for prompt photon production by an order of magnitude
at $p_t=3$ GeV. We discuss theoretical uncertainties due to parton energy loss
and nuclear shadowing parameters. We show that the K-factor, which signifies
the importance of next-to-leading order corrections, is large and has a strong
$p_t$ dependence.
","[{""version"":""v1"",""created"":""Thu, 4 Jan 2001 23:01:25 GMT""},{""version"":""v2"",""created"":""Mon, 24 Sep 2001 22:00:44 GMT""}]","2009-11-07"
"hep-ph/0101042","Ian Balitsky","I. Balitsky","High-Energy QCD and Wilson Lines","110 pages, Latex, 40 eps figures, sprocl.sty. To be published in the
  Boris Ioffe Festschrift ``At the Frontier of Particle Physics/Handbook of
  QCD'', edited by M. Shifman (World Scientific, Singapore, 2001)",,"10.1142/9789812810458_0030","JLAB-THY-00-44","hep-ph",,"  At high energies the particles move very fast so their trajectories can be
approximated by straight lines collinear to their velocities. The proper
degrees of freedom for the fast gluons moving along the straight lines are the
Wilson-line operators -- infinite gauge factors ordered along the straight
line. I review the study of the high-energy scattering in terms of Wilson-line
degrees of freedom.
","[{""version"":""v1"",""created"":""Fri, 5 Jan 2001 03:36:59 GMT""}]","2016-11-23"
"hep-ph/0101043",,"D. O. Caldwell, R. N. Mohapatra and S. J. Yellin","Neutrinos, Large Extra Dimensions and Solar Neutrino Puzzle","8 pages, Latex, two figures; Invited talk presented at the workshop
  on Lepton Flavor Violation, Honolulu, October (2000)",,,,"hep-ph",,"  A desirable feature of models with large extra dimensions and a TeV range
string scale is the possibility to understand an ultralight sterile neutrino
needed for a simultaneous understanding of solar, atmospheric and LSND results
as a Kaluza-Klein state of a bulk neutrino. How these oscillation data are
understood in quantitative detail is still not clear. We have recently
suggested a new way to understand the solar neutrino data in this framework by
a combination of vacuum and small angle MSW transition of $\nu_e$ to sterile KK
modes of the bulk neutrino. This mechanism can be embedded into an economical
extension of the standard model in the brane to understand the atmospheric and
LSND data. After a brief discussion of how small neutrino masses arise
naturally in extra dimensional models, we review this new suggestion.
","[{""version"":""v1"",""created"":""Fri, 5 Jan 2001 12:48:37 GMT""}]","2007-05-23"
"hep-ph/0101044","Gordon Ramsey","Gordon P. Ramsey (Loyola U and ANL)","The Shape and Experimental Tests of the Q^2-Invariant Polarized Gluon
  Asymmetry","5 pages, 1 figure. Talk given at Spin 2000, 16-21 October, 2000,
  Osaka, Japan. To be published in the proceedings",,"10.1063/1.1384097","ANL-HEP-CP-00-127","hep-ph",,"  The absence of ""valence-gluon"" degrees of freedom combined with an
examination of radiative QCD diagrams leads to an implication that the gluon
spin asymmetry in a proton, defined as A_G(x,Q^2) = (Delta G)/G, should be
approximately Q^2 invariant. The condition for scale invariance completely
determines the x-dependence of this asymmetry, which satisfies the constituent
counting rules and reproduces the basic results of the Bremsstrahlung model
originated by Close and Sivers. This asymmetry can be combined with the
measured unpolarized gluon density, G(x,Q^2) to provide a prediction for Delta
G(x,Q^2). Existing and proposed experiments can test both the prediction of
scale invariance for A_G and the nature of Delta G itself.
","[{""version"":""v1"",""created"":""Fri, 5 Jan 2001 01:35:56 GMT""}]","2009-11-07"
"hep-ph/0101045","Dan Pirjol","Dan Pirjol","Rare radiative B decays in perturbative QCD","11 pages, 3 included figures. Invited talk given at the 5th
  International Workshop on Particle Physics Phenomenology, Chi-Pen, Taitung,
  Taiwan, 8-11 Nov 2000",,"10.1142/9789812799982_0010","UCSD/PTH 01-01","hep-ph",,"  We report on recent progress on perturbative QCD calculations of certain
exclusive rare weak $B$ meson decays involving hard photons. In the limit of a
photon energy $E_\gamma$ much larger than $\Lambda_{QCD}$, the amplitudes for
such processes can be analyzed in a twist expansion in powers of
$\Lambda/E_\gamma$. The leading twist amplitude is given by the convolution of
a hard scattering amplitude with the $B$ meson light-cone wavefunction. This
approach is applied to a calculation of the leptonic radiative $B\to \gamma
\ell \nu_\ell$ formfactors and to an estimate of the weak annihilation
contribution to the penguin decays $B\to \rho(\omega)\gamma$. As an application
we discuss a few methods for constraining the unitarity triangle with exclusive
radiative B decays.
","[{""version"":""v1"",""created"":""Fri, 5 Jan 2001 01:36:14 GMT""},{""version"":""v2"",""created"":""Sat, 6 Jan 2001 02:50:36 GMT""}]","2017-08-23"
"hep-ph/0101046","Yukihiro Mimura","K.S. Babu (Oklahoma State University) and Yukihiro Mimura (Oklahoma
  State University)","Solving the mu problem in gauge mediated supersymmetry breaking models
  with flavor symmetry","12 pages in LaTeX",,,"OSU-HEP-01-01","hep-ph",,"  We suggest a solution to the \mu problem of gauge mediated supersymmtery
breaking models based on flavor symmetries. In this scenario the \mu term
arises through the vacuum expectation value of a singlet scalar field which is
suppressed by a flavor symmetry factor relative to the scale of dynamical SUSY
breaking. The same flavor symmetry also ensures that the soft SUSY breaking
parameter B\mu is not much larger than \mu^2, a necessary condition for the
stability of electroweak symmetry breaking. Explicit examples where B\mu ~
\mu^2 and B\mu << \mu^2 are presented. The latter case provides a natural
solution to the supersymmetric CP problem. We show that the same flavor
symmetry that suppresses the \mu and the B\mu parameters can also play a role
in explaining the fermion mass and mixing hierarchy puzzle.
","[{""version"":""v1"",""created"":""Fri, 5 Jan 2001 02:55:36 GMT""}]","2007-05-23"
"hep-ph/0101047","Jean-Marc Laget","J.-M. Laget","Strangeness Production by Electromagnetic and Hadronic Probes","10 pages, 9 figures; Invited talk at HYP2000 Conference, Torino,
  Italy, 23-27 October 2000. To appear in Nucl. Phys. A","Nucl.Phys. A691 (2001) 11-20","10.1016/S0375-9474(01)00996-4",,"hep-ph",,"  After pioneering works on hypernuclei, strangeness production mechanisms have
been studied in hadron collisions and photoreactions in the sixties. Recent
experiments at SATURNE and COSY, in the hadronic sector, as well as ELSA and
JLab, in the electromagnetic sector, have confirmed our basic ideas on the
reaction mechanisms. In the near future, strangeness production at JLab, HERMES
and COMPASS may prove to be a powerful tool to study hadronic matter.
","[{""version"":""v1"",""created"":""Fri, 5 Jan 2001 10:49:57 GMT""}]","2009-11-07"
"hep-ph/0101048","Andre Gusso","E. M. Gregores (Madison, U. of Winsconsin), A. Gusso (Valencia U.), S.
  F. Novaes (Sao Paulo, IFT)","New Limits on Doubly Charged Bileptons from CERN LEP Data and the Search
  at Future Electron-Positron and Electron-Photon Colliders","Revised version with 14 pages, 7 figures, RevTex. To appear in Phys.
  Rev. D","Phys.Rev. D64 (2001) 015004","10.1103/PhysRevD.64.015004","IFT-P.097/2000, IFIC/00-84, MADPH-00-1209","hep-ph",,"  We show that the accumulated LEP-II data taken at $\sqrt{s} =$ 130 to 206 GeV
can establish more restrictive bounds on doubly charged bileptons couplings and
masses than any other experiment so far. We also analyze the discovery
potential of a prospective linear collider operating in both $e^+ e^-$ and $e
\gamma$ modes.
","[{""version"":""v1"",""created"":""Fri, 5 Jan 2001 12:11:47 GMT""},{""version"":""v2"",""created"":""Thu, 31 May 2001 11:46:01 GMT""}]","2009-11-07"
"hep-ph/0101049","Rudnei O. Ramos","Arjun Berera and Rudnei O. Ramos","Affinity for Scalar Fields to Dissipate","21 pages, 4 figures (uses epsf, RevTeX). Just minor changes. Version
  in press Physical Review D (2001)","Phys.Rev. D63 (2001) 103509","10.1103/PhysRevD.63.103509",,"hep-ph astro-ph cond-mat.soft gr-qc hep-th",,"  The zero temperature effective equation of motion is derived for a scalar
field interacting with other fields. For a broad range of cases, involving
interaction with as few as one or two fields, dissipative regimes are found for
the scalar field system. The zero temperature limit constitutes a baseline
effect that will be prevalent in any general statistical state. Thus, the
results found here provide strong evidence that dissipation is the norm not
exception for an interacting scalar field system. For application to
inflationary cosmology, this provides convincing evidence that warm inflation
could be a natural dynamics once proper treatment of interactions is done. The
results found here also may have applicability to entropy production during the
chiral phase transition in heavy ion collision.
","[{""version"":""v1"",""created"":""Fri, 5 Jan 2001 13:57:16 GMT""},{""version"":""v2"",""created"":""Thu, 1 Mar 2001 15:07:41 GMT""}]","2009-11-07"
"hep-ph/0101050","Leonardo Cosmai","P. Cea, M. Consoli, and L. Cosmai","Lattice measurement of the scalar propagator near the symmetry breaking
  phase transition","15 pages, 5 figures",,,"BARI-TH 405/2001","hep-ph hep-lat hep-th",,"  Recent lattice simulations of $(\lambda \Phi^4)_4$ theories in the broken
phase show that : a) the shifted field propagator is well reproduced by the
simple 2-parameter form ${{Z_{\rm prop}}\over{p^2 + M^2_h}}$ at finite momenta
but strongly differs for $p \to 0$ b) the bare zero-momentum two-point function
$\Gamma_2(0)= \frac{d^2 V_{\rm eff}}{d \phi^2_B}|_{\phi_B= \pm v_B}$ gives a
value of $Z_\phi \equiv {{M^2_h}\over{\Gamma_2(0)}}$ that increases when
approaching the continuum limit. This supports theoretical expectations where
$v_B$ is related by an infinite re-scaling to the `physical Higgs condensate'
$v_R$ defined through $\frac{d^2 V_{\rm eff}}{d \phi^2_R}|_{\phi_R= \pm
v_R}=M^2_h$. New lattice data collected around the phase transition confirm
this scenario. By denoting $M_{\rm SB} \equiv M_h ={\cal O} (v_R)$ the scale of
the broken phase, our results suggest the existence of a `hierarchy' of scales
$\Gamma_2(0) \ll M^2_{\rm SB} \ll v^2_B$ that become infinitely far in the
continuum limit. This may open unexpected possibilities to reconcile an
infinitesimal slope of the effective potential with finite values of $M_h$ and
accomodate very different mass scales in the framework of a spontaneously
broken theory.
","[{""version"":""v1"",""created"":""Fri, 5 Jan 2001 14:33:28 GMT""}]","2007-05-23"
"hep-ph/0101051","Daniel R. Stump","D. Stump, J. Pumplin, R. Brock, D. Casey, J. Huston, J. Kalk, H.L.
  Lai, W.K. Tung","Uncertainties of Predictions from Parton Distribution Functions I: the
  Lagrange Multiplier Method","36 pages, 12 figures, LaTeX; CERN preprint number added. Tables in
  Appendix C have been corrected; the calculation of W production at the LHC
  has been replaced by one with fixed normalization factors","Phys.Rev.D65:014012,2001","10.1103/PhysRevD.65.014012","MSU-HEP-07102","hep-ph",,"  We apply the Lagrange Multiplier method to study the uncertainties of
physical predictions due to the uncertainties of parton distribution functions
(PDFs), using the cross section for W production at a hadron collider as an
archetypal example. An effective chi-squared function based on the CTEQ global
QCD analysis is used to generate a series of PDFs, each of which represents the
best fit to the global data for some specified value of the cross section. By
analyzing the likelihood of these ""alterative hypotheses"", using available
information on errors from the individual experiments, we estimate that the
fractional uncertainty of the cross section due to current experimental input
to the PDF analysis is approximately 4% at the Tevatron, and 8-10% at the LHC.
We give sets of PDFs corresponding to these up and down variations of the cross
section. We also present similar results on Z production at the colliders. Our
method can be applied to any combination of physical variables in precision QCD
phenomenology, and it can be used to generate benchmarks for testing the
accuracy of approximate methods based on the error matrix.
","[{""version"":""v1"",""created"":""Fri, 5 Jan 2001 14:38:22 GMT""},{""version"":""v2"",""created"":""Wed, 17 Jan 2001 19:02:21 GMT""},{""version"":""v3"",""created"":""Mon, 5 Feb 2001 14:24:30 GMT""}]","2009-09-25"
"hep-ph/0101052","Esteban Calzetta","Esteban Calzetta, Albert Roura, Enric Verdaguer","Dissipation, noise and vacuum decay in quantum field theory","5 pages","Phys.Rev.Lett. 88 (2002) 010403","10.1103/PhysRevLett.88.010403",,"hep-ph",,"  We study the process of vacuum decay in quantum field theory focusing on the
stochastic aspects of the interaction between long and short-wavelength modes.
This interaction results in a diffusive behavior of the reduced Wigner function
describing the state of the long-wavelength modes, and thereby to a finite
activation rate even at zero temperature. This effect can make a substantial
contribution to the total decay rate.
","[{""version"":""v1"",""created"":""Fri, 5 Jan 2001 14:51:19 GMT""},{""version"":""v2"",""created"":""Thu, 2 Aug 2001 19:40:26 GMT""}]","2009-11-07"
"hep-th/0101028","Jussi Kalkkinen","Jussi Kalkkinen, Dario Martelli","Holographic Renormalization Group and Fermionic Boundary Data","7 pages, LaTeX, contribution to the proceedings of the RTN-workshop
  ""The Quantum Structure of Spacetime and the Geometric Nature of Fundamental
  Interactions,"" Berlin, October 2000","Fortsch.Phys. 49 (2001) 565-571","10.1002/1521-3978(200105)49:4/6<565::AID-PROP565>3.0.CO;2-6",,"hep-th",,"  We discuss Holographic Renormalization Group equations in the presence of
fermions and form fields in the bulk. The existence of a holographically dual
quantum field theory for a given bulk gravity theory imposes consistency
conditions on the ranks of the form fields, the fermion - form field couplings,
and leads to a novel Ward identity.
","[{""version"":""v1"",""created"":""Thu, 4 Jan 2001 17:50:59 GMT""}]","2015-06-25"
"hep-th/0101029","Leonard Susskind","L. Susskind (Stanford U.)","The Quantum Hall Fluid and Non-Commutative Chern Simons Theory","25 pages, references added, quasiparticle solutions given for
  arbitrary filling fraction",,,"SU-ITP/01-","hep-th",,"  The first part of this paper is a review of the author's work with S. Bahcall
which gave an elementary derivation of the Chern Simons description of the
Quantum Hall effect for filling fraction $1/n$. The notation has been
modernized to conform with standard gauge theory conventions.
  In the second part arguments are given to support the claim that abelian
non-commutative Chern Simons theory at level $n$ is exactly equivalent to the
Laughlin theory at filling fraction $1/n$. The theory may also be formulated as
a matrix theory similar to that describing D0-branes in string theory. Finally
it can also be thought of as the quantum theory of mappings between two
non-commutative spaces, the first being the target space and the second being
the base space.
","[{""version"":""v1"",""created"":""Thu, 4 Jan 2001 23:58:29 GMT""},{""version"":""v2"",""created"":""Fri, 5 Jan 2001 18:57:46 GMT""},{""version"":""v3"",""created"":""Sun, 14 Jan 2001 01:40:57 GMT""}]","2007-05-23"
