"hep-ph/0101201","Chuan Hung Chen","Chuan-Hung Chen and C.Q. Geng","Lepton Asymmetries in Heavy Baryon Decays of $\Lambda_b\to\Lambda
  l^+l^-$","10 pages, 9 figures, revised version","Phys.Lett. B516 (2001) 327-336","10.1016/S0370-2693(01)00937-6",,"hep-ph",,"  We study the dilepton forward-backward and the longitudinal, normal and
transverse lepton polarization asymmetries in the heavy baryon decays of
$\Lambda_b\to\Lambda l^+l^-$. We show that the asymmetries have a less
dependence on the non-perturbative QCD effects. In the standard model, we find
that the integrated forward-backward asymmetries (FBAs) and three components of
the polarizations in the QCD sum rule approach (pole model) are $-0.13\
(-0.12)$ and $(58.3,-9.4,-0.07)%$ ($(58.3,-12.6,-0.07)%$) for
$\Lambda_b\to\Lambda\mu^+\mu^-$ and $-0.04 (-0.03)$ and $(10.9,-10.0,-0.39)%$
($(10.9,-0.2,-0.34)%$) for $\Lambda_b\to\Lambda\tau^+\tau^-$, respectively.
","[{""version"":""v1"",""created"":""Thu, 18 Jan 2001 03:35:34 GMT""},{""version"":""v2"",""created"":""Mon, 19 Mar 2001 10:11:21 GMT""}]","2010-06-02"
"hep-ph/0101202","E. Manfredini","E. Manfredini (Physics Department ""G. Occhialini"", University of
  Milan-Bicocca)","Aspects of Non-Equilibrium Dynamics in Quantum Field Theory","Doctoral thesis. 170 pages, 47 figures. Some references and comments
  added. Minor errors corrected. 1 figure added",,,"Bicocca-FT-01-03","hep-ph",,"  This work is devoted to the study of relaxation--dissipation processes in
systems described by Quantum Field Theory. In the first part, I focus on the
phi^4 scalar quantum field theory in finite volume in the large N limit. I find
that the zero-mode quantum fluctuations cannot grow macroscopically large
starting from microscopic initial conditions, while the long-wavelength
fluctuations do scale with the linear size of the system, signalling dynamical
infrared properties quite different from the equilibrium ones. I also introduce
a non-gaussian Hartree-Fock approximation (tdHF) and I derive the mean-field
coupled time-dependent Schroedinger equations for the modes of the scalar
field. The dynamical evolution of a uniform condensate is studied in a further
controlled gaussian approximation, for N=1. Results similar to the large N case
show an internal inconsistency of this approximation. I also study the dynamics
of the system in infinite volume in the broken symmetry phase. The data show
that the fixed points of the evolution cover at most the classically metastable
part of the static effective potential. I finally study the dynamical evolution
for the O(N+1) nonlinear sigma model in 1+1 dimensions in the large N limit. I
first of all verify that the large coupling limit of the O(N+1) phi^4 model,
which renders the model non linear, commutes with the large N limit, so that
the O(infty) nonlinear sigma model is uniquely defined. I then study the
evolution of several observables, like the spectrum of produced particles,
finding no evidence for parametric resonance. I conclude with some remarks on
the ``state of art'' in gauge theories and some comments about the open issues
in the subject.
","[{""version"":""v1"",""created"":""Thu, 18 Jan 2001 15:07:03 GMT""},{""version"":""v2"",""created"":""Wed, 21 Mar 2001 17:01:18 GMT""}]","2007-05-23"
"hep-ph/0101203","Thorsten Renk","Thorsten Renk","Note on the Impact Parameter Analysis of High Energy Proton Proton
  Collisions","8 pages, 5 figures, accepted for publication EPJA, revised version","Eur.Phys.J. A11 (2001) 251-255","10.1007/s100500170061","TUM/T39-01-01","hep-ph",,"  Following prior analysis for measured pp elastic differential cross section,
the impact parameter representation in terms of profile functions is calculated
from two different parameterizations on single diffractive dissociation data.
The derivative of this quantity with respect to the collision energy squared s
measures the growth rate of the reaction's blackness. Its distribution in
impact parameter space allows detailed insight into the growth pattern of the
total cross section and the approaching unitarity limit. Comparing the results
with the elastic case, the different mechanisms of unitarization of the two
parametrizations are discussed.
","[{""version"":""v1"",""created"":""Thu, 18 Jan 2001 14:42:04 GMT""},{""version"":""v2"",""created"":""Fri, 13 Jul 2001 09:04:53 GMT""}]","2009-11-07"
"hep-th/0101113","J. A. de Azcarraga","Igor A. Bandos, Jose A. de Azcarraga, Jose M. Izquierdo and Jerzy
  Lukierski","BPS states in M-theory and twistorial constituents","4 pages. Refs. updated, two cosmetic changes, to appear in PRL","Phys.Rev.Lett.86:4451-4454,2001","10.1103/PhysRevLett.86.4451","FTUV/01-0116, IFIC/01-03, 17 Jan 2001","hep-th",,"  We provide a complete algebraic description of BPS states in M-theory in
terms of primary constituents that we call BPS preons. We argue that any BPS
state preserving $k$ of the 32 supersymmetries is a composite of (32-k) BPS
preons. In particular, the BPS states corresponding to the basic M2 and M5
branes are composed of 16 BPS preons. By extending the M-algebra to a
generalized D=11 conformal superalgebra $osp(1|64)$ we relate the BPS preons
with its fundamental representation, the D=11 supertwistors.
","[{""version"":""v1"",""created"":""Wed, 17 Jan 2001 16:06:02 GMT""},{""version"":""v2"",""created"":""Tue, 24 Apr 2001 10:52:37 GMT""}]","2008-11-26"
"hep-th/0101114","Philip C. Argyres","Philip C. Argyres and K. Narayan","String Webs from Field Theory","53 pages, 6 figures; more references added","JHEP 0103 (2001) 047","10.1088/1126-6708/2001/03/047","CLNS-00/1704","hep-th",,"  The spectrum of stable electrically and magnetically charged supersymmetric
particles can change discontinuously as one changes the vacuum on the Coulomb
branch of gauge theories with extended supersymmetry in four dimensions. We
show that this decay process can be understood and is well described by
semiclassical field configurations purely in terms of the low energy effective
action on the Coulomb branch even when it occurs at strong coupling. The
resulting picture of the stable supersymmetric spectrum is a generalization of
the ``string web'' picture of these states found in string constructions for
certain theories.
","[{""version"":""v1"",""created"":""Wed, 17 Jan 2001 17:20:06 GMT""},{""version"":""v2"",""created"":""Sun, 21 Jan 2001 23:53:59 GMT""},{""version"":""v3"",""created"":""Tue, 30 Jan 2001 02:51:00 GMT""}]","2009-11-07"
"hep-th/0101115","John H. Brodie","John H. Brodie","On Mediating Supersymmetry Breaking in D-brane Models","33 pages, 12 figures, uses tables.tex",,,"SLAC-PUB-8706","hep-th",,"  We consider the 3+1 visible sector to live on a Hanany-Witten D-brane
construction in type IIA string theory. The messenger sector consists of
stretched strings from the visible brane to a hidden D6-brane in the extra
spatial dimensions. In the open string channel supersymmetry is broken by gauge
mediation while in the closed string channel supersymmetry is broken by gravity
mediation. Hence, we call this kind of mediation ``string mediation''. We
propose an extension of the Dimopoulos-Georgi theorem to brane models: only
detached probe branes can break supersymmetry without generating a tachyon.
Fermion masses are generated at one loop if the branes break a sufficient
amount of the ten dimensional Lorentz group while scalar potentials are
generated if there is a force between the visible brane and the hidden brane.
Scalars can be lifted at two loops through a combination of brane bending and
brane forces. We find a large class of stable non-supersymmetric brane
configurations of ten dimensinoal string theory.
","[{""version"":""v1"",""created"":""Wed, 17 Jan 2001 17:20:43 GMT""}]","2007-05-23"
"hep-th/0101116","Boris Noyvert","Doron Gepner and Boris Noyvert","Unitary representations of SW(3/2,2) superconformal algebra","latex2e, 37 pages, 2 figures; v2: published version, introduction
  extended","Nucl.Phys. B610 (2001) 545-577","10.1016/S0550-3213(01)00299-1",,"hep-th math-ph math.MP",,"  SW(3/2,2) superconformal algebra is W algebra with two Virasoro operators.
The Kac determinant is calculated and the complete list of unitary
representations is determined. Two types of extensions of SW(3/2,2) algebra are
discussed. A new approach to construction of W algebras from rational conformal
field theories is proposed.
","[{""version"":""v1"",""created"":""Wed, 17 Jan 2001 20:19:56 GMT""},{""version"":""v2"",""created"":""Thu, 6 Sep 2001 14:01:37 GMT""}]","2009-01-20"
"hep-th/0101117","Amit Ghosh","Olaf Dreyer, Amit Ghosh and Jacek Wisniewski","Black hole entropy calculations based on symmetries","14 pages, Latex, CGPG-01/1-1","Class.Quant.Grav. 18 (2001) 1929-1938","10.1088/0264-9381/18/10/308",,"hep-th gr-qc",,"  Symmetry based approaches to the black hole entropy problem have a number of
attractive features; in particular they are very general and do not depend on
the details of the quantization method. However we point out that, of the two
available approaches, one faces conceptual problems (also emphasized by
others), while the second contains certain technical flaws. We correct these
errors and, within the new, improved scheme, calculate the entropy of
3-dimensional black holes. We find that, while the new symmetry vector fields
are well-defined on the ``stretched horizon,'' and lead to well-defined
Hamiltonians satisfying the expected Lie algebra, they fail to admit a
well-defined limit to the horizon. This suggests that, although the formal
calculation can be carried out at the classical level, its real, conceptual
origin probably lies in the quantum theory.
","[{""version"":""v1"",""created"":""Wed, 17 Jan 2001 21:58:02 GMT""}]","2009-11-07"
"hep-th/0101118","Samir Mathur","Samir D. Mathur","Gravity on $AdS_3$ and flat connections in the boundary CFT","35 pages, harvmac, references added",,,"OHSTPY-HEP-T-00-033","hep-th",,"  We consider the CFT that arises from the D1-D5 system in the presence of a
constant background gauge potential which couples to the R-charge of the
theory: this potential effectively changes the periodicities of the fermions.
By the AdS/CFT correspondence, the effect of this connnection should be
obtained by finding a smooth solution to the vector field in AdS space which
couples to the constant mode of the R-current in the CFT. We investigate such
solutions for small values of the connection, and contrast these with
spacetimes which have `Wilson lines for the bulk ' -- spacetimes that are
locally AdS times a sphere but have a global deformation. The latter class are
in general singular spacetimes. We comment on some aspects of the recently
found geometries corresponding to the D1-D5 state with angular momentum,
observing relations between scales in the microscopic theory and scales in the
geometry.
","[{""version"":""v1"",""created"":""Wed, 17 Jan 2001 23:12:46 GMT""},{""version"":""v2"",""created"":""Fri, 13 Jul 2001 18:22:49 GMT""}]","2007-05-23"
"hep-th/0101119","Gukov Sergei Gennodievich","Klaus Behrndt, Sergei Gukov, Marina Shmakova","Domain Walls, Black Holes, and Supersymmetric Quantum Mechanics","35 pages, added references and corrections, version to appear in NPB","Nucl.Phys. B601 (2001) 49-76","10.1016/S0550-3213(01)00052-9","ITEP-TH-71/00, CALT 68-2306, CITUSC/00-062, HU-EP-00/54,
  SLAC-PUB-8749","hep-th",,"  Supersymmetric solutions, such as BPS domain walls or black holes, in four-
and five-dimensional supergravity theories with eight supercharges can be
described by effective quantum mechanics with a potential term. We show how
properties of the latter theory can help us to learn about the physics of
supersymmetric vacua and BPS solutions in these supergravity theories. The
general approach is illustrated in a number of specific examples where scalar
fields of matter multiplets take values in symmetric coset spaces.
","[{""version"":""v1"",""created"":""Wed, 17 Jan 2001 23:53:14 GMT""},{""version"":""v2"",""created"":""Thu, 18 Jan 2001 00:02:28 GMT""},{""version"":""v3"",""created"":""Mon, 12 Mar 2001 07:36:48 GMT""}]","2009-11-07"
"hep-th/0101120","Uwe Trittmann","J.R. Hiller, S. Pinsky, and U. Trittmann","Two-Point Stress-Tensor Correlator in N=1 SYM(2+1)","16 pp., 9 figures","Phys.Rev. D63 (2001) 105017","10.1103/PhysRevD.63.105017",,"hep-th hep-ph",,"  Recent advances in string theory have highlighted the need for reliable
numerical methods to calculate correlators at strong coupling in supersymmetric
theories. We present a calculation of the correlator <0|T^{++}(r)T^{++}(0)|0>
in N=1 SYM theory in 2+1 dimensions. The numerical method we use is
supersymmetric discrete light-cone quantization (SDLCQ), which preserves the
supersymmetry at every order of the approximation and treats fermions and
bosons on the same footing. This calculation is done at large $N_c$. For small
and intermediate r the correlator converges rapidly for all couplings. At small
r the correlator behaves like 1/r^6, as expected from conformal field theory.
At large r the correlator is dominated by the BPS states of the theory. There
is, however, a critical value of the coupling where the large-r correlator goes
to zero, suggesting that the large-r correlator can only be trusted to some
finite coupling which depends on the transverse resolution. We find that this
critical coupling grows linearly with the square root of the transverse
momentum resolution.
","[{""version"":""v1"",""created"":""Wed, 17 Jan 2001 23:38:52 GMT""}]","2009-11-07"
"hep-th/0101121","Arno Bohm","A.R.Bohm, R.de la Madrid, B.A.Tay, P.Kielanowski","Time Asymmetric Boundary Conditions and the Definition of Mass and Width
  for Relativistic Resonances","21 pages revtex file",,,,"hep-th math-ph math.MP quant-ph",,"  The definition of mass and width of relativistic resonances and in particular
of the $Z$-boson is discussed. For this we use the theory based on time
asymmetric boundary conditions given by Hardy class spaces ${\mathbf \Phi}_-$
and ${\mathbf \Phi}_+$ for prepared in-states and detected out-states
respectively, rather than time symmetric Hilbert space theory. This Hardy class
boundary condition is a mathematically rigorous form of the singular
Lippmann-Schwinger equation. In addition to the rigorous definition of the
Lippmann-Schwinger kets $|[j,{\mathsf s}]^{\pm}>$ as functionals on the spaces
${\mathbf \Phi}_{\mp}$, one obtains Gamow kets $|[j,{\mathsf s}_R]^- >$ with
complex centre-of-mass energy value ${\mathsf s}_R=(M_R-i\Gamma_R/2)^2$. The
Gamow kets have an exponential time evolution given by
$\exp{(-iM_Rt-\Gamma_Rt/2)}$ which suggests that $(M_R,\Gamma_R)$ is the right
definition of the mass and width of a resonance. This is different from the two
definitions of the $Z$-boson mass and width used in the Particle Data Table and
leads to a numerical value of $M_R=(91.1626\pm 0.0031) {\rm GeV}$ from the
$Z$-boson lineshape data.
","[{""version"":""v1"",""created"":""Thu, 18 Jan 2001 01:01:17 GMT""}]","2007-05-23"
"hep-th/0101122","Niels Obers","N.A. Obers (Spinoza, ITF), B. Pioline (Harvard, LPTHE)","Exact Thresholds and Instanton Effects in String Theory","24 pages, latex, contribution to the proceedings of the First
  Workshop of the RTN Network ""The Quantum Structure of Spacetime and the
  Geometric Nature of Fundamental Interactions"", Berlin, Germany, 4-10 October
  2000","Fortsch.Phys. 49 (2001) 359-375","10.1002/1521-3978(200105)49:4/6<359::AID-PROP359>3.3.CO;2-U","SPIN-01/01, ITP-UU-01/01, HUTP-00/A053, LPTHE-01-51","hep-th",,"  In this lecture we summarize some recent work on the understanding of
instanton effects in string theories with 16 supersymmetries. In particular, we
consider F^4 couplings using the duality between the heterotic string on T^4
and type IIA on K_3 at an orbifold point, as well as higher and lower
dimensional versions of this string-string duality. At the perturbative level a
non-trivial test of the duality, requiring several miraculous identities, is
presented by matching a purely one-loop heterotic amplitude to a purely
tree-level type II result. A wide variety of non-perturbative effects is shown
to occur in this setting, including D-brane instantons for type IIA on K_3 x
S^1 and NS5-brane instantons for type IIA on K_3 x T^2. Moreover, the analysis
of the three-dimensional case, which possesses a non-perturbative SO(8,24,Z)
U-duality, reveals the presence of Kaluza-Klein 5-brane instanton effects, both
on the heterotic and the type II side.
","[{""version"":""v1"",""created"":""Thu, 18 Jan 2001 14:03:56 GMT""}]","2015-06-25"
"hep-th/0101123","Sergio Ferrara","S. Ferrara","Spinors, superalgebras and the signature of space-time","18 pages, Based on talks given at the ``XIV Sigrav Congress on
  Recents Developments in General Relativity"", Genoa, Italy, September 2000
  Workshop on ""30 years of Supersymmetry"", Minneapolis, U.S.A., October 2000
  ""Dirac Anniversary Meeting"", ICTP, Trieste, Italy, November 2000",,"10.1142/9789812777386_0006","CERN-TH/2001-008","hep-th",,"  Superconformal algebras embedding space-time in any dimension and signature
are considered. Different real forms of the $R$-symmetries arise both for usual
space-time signature (one time) and for Euclidean or exotic signatures (more
than one times). Application of these superalgebras are found in the context of
supergravities with 32 supersymmetries, in any dimension $D \leq 11$. These
theories are related to $D = 11, M, M^*$ and $M^\prime$ theories or $D = 10$,
IIB, IIB$^*$ theories when compactified on Lorentzian tori. All dimensionally
reduced theories fall in three distinct phases specified by the number of (128
bosonic) positive and negative norm states: $(n^+,n^-) = (128,0), (64,64),
(72,56)$.
","[{""version"":""v1"",""created"":""Thu, 18 Jan 2001 14:16:52 GMT""}]","2017-08-23"
"math-ph/0101020","Gerhard Rein","Peter A. Markowich, Gerhard Rein, Gershon Wolansky","Existence and nonlinear stability of steady states of the
  Schr\""odinger-Poisson system","16 pages","Journal of Statistical Physics, 106 (5-6), 1221-1239 (2002)",,,"math-ph math.AP math.MP",,"  We consider the Schr\""odinger-Poisson system in the attractive (plasma
physics) Coulomb case. Given a steady state from a certain class we prove its
nonlinear stability, using an appropriately defined energy-Casimir functional
as Lyapunov function. To obtain such steady states we start with a given
Casimir functional and construct a new functional which is in some sense dual
to the corresponding energy-Casimir functional. This dual functional has a
unique maximizer which is a steady state of the Schr\""odinger-Poisson system
and lies in the stability class. The steady states are parametrized by the
equation of state, giving the occupation probabilities of the quantum states as
a strictly decreasing function of their energy levels.
","[{""version"":""v1"",""created"":""Thu, 18 Jan 2001 10:32:02 GMT""}]","2007-05-23"
"math/0101143","Marat Rovinsky","M.Rovinsky","The Gauss-Manin connection on the Hodge structures",,"CRAS 333 (2001), no. 4, 333--337","10.1016/S0764-4442(01)02064-X",,"math.AG",,"  Pour tout sch\'ema simplicial complexe $X_{\bullet}$ il existe une
application canonique $\nabla:H^{\ast}(X_{\bullet})\longrightarrow
\Omega^1_{{\mathbb C}/{\mathbb Q}}\otimes H^{\ast}(X_{\bullet})$, appel\'ee la
connexion de Gau\ss-Manin. Nous montrons qu'il existe une unique connexion
fonctorielle sur toute structure de Hodge-Tate mixte ayant certaines
propri\'et\'es de la connexion de Gau\ss-Manin. Cette connexion n'est pas
int\'egrable en g\'en\'eral, et alors son int\'egrabilit\'e est une condition
non triviale pour qu'une structure de Hodge soit g\'eom\'etrique.
  Dans des cas particuliers, je donne des formules explicites pour la connexion
de Gau\ss-Manin sur la cohomologie singuli\`ere des vari\'et\'es alg\'ebriques
sur ${\mathbb C}$ dans les termes de la structure de Hodge.
","[{""version"":""v1"",""created"":""Wed, 17 Jan 2001 20:04:53 GMT""},{""version"":""v2"",""created"":""Thu, 18 Jan 2001 17:56:14 GMT""}]","2009-11-07"
"math/0101144","Michael T. Anderson","Michael T. Anderson","Scalar curvature, metric degenerations and the static vacuum Einstein
  equations on 3-manifolds, II","76 pages. to appear in GAFA",,,,"math.DG math.GT",,"  This paper is a continuation of I, (same title), and is concerned with the
existence, regularity and degeneration of metrics minimizing natural curvature
functionals on the space of metrics on 3-manifolds. The functionals chosen are
designed to be optimal w.r.t. the issue of geometrization of the underlying
3-manifold, in the sense of Thurston. Two of the main results are Theorems B
and C, in comparison with Theorem A of I.
","[{""version"":""v1"",""created"":""Wed, 17 Jan 2001 19:20:08 GMT""}]","2009-09-25"
"math/0101145","Joshua M. Sabloff","John B. Etnyre, Lenhard L. Ng, and Joshua M. Sabloff","Invariants of Legendrian Knots and Coherent Orientations","32 pages, 17 figures; small technical corrections to proof of Thm 3.7
  and example 4.3","J. Symplectic Geom. 1 (2002), 321-367",,"AIM 2001-2","math.SG math.GT",,"  We provide a translation between Chekanov's combinatorial theory for
invariants of Legendrian knots in the standard contact R^3 and a relative
version of Eliashberg and Hofer's Contact Homology. We use this translation to
transport the idea of ``coherent orientations'' from the Contact Homology world
to Chekanov's combinatorial setting. As a result, we obtain a lifting of
Chekanov's differential graded algebra invariant to an algebra over Z[t,t^{-1}]
with a full Z grading.
","[{""version"":""v1"",""created"":""Wed, 17 Jan 2001 23:51:21 GMT""},{""version"":""v2"",""created"":""Fri, 11 May 2001 20:28:33 GMT""},{""version"":""v3"",""created"":""Fri, 19 Dec 2003 16:11:06 GMT""}]","2007-05-23"
"math/0101146","Dimitri Shlyakhtenko","Alexandru Nica, Dimitri Shlyakhtenko and Roland Speicher","A Characterization of Freeness by a Factorization Property of
  R-transform",,,,,"math.OA",,"  Let M be a B-probability space. Assume that B itself is a D-probability
space; then M can be viewed as a D-probability space as well. Let X be in M. We
characterize freeness of X from B with amalgamation over D in terms of a
certain factorization condition linking the B-valued and D-valued R-transforms
of X. We give an application to random matrices.
","[{""version"":""v1"",""created"":""Wed, 17 Jan 2001 21:51:19 GMT""}]","2016-09-07"
"math/0101147","Andrei Okounkov","Andrei Okounkov and Rahul Pandharipande","Gromov-Witten theory, Hurwitz numbers, and Matrix models, I","Latex, 107 pages, 9 figures, updated version",,,,"math.AG hep-th math-ph math.CO math.MP",,"  The main goal of the paper is to present a new approach via Hurwitz numbers
to Kontsevich's combinatorial/matrix model for the intersection theory of the
moduli space of curves. A secondary goal is to present an exposition of the
circle of ideas involved: Hurwitz numbers, Gromov-Witten theory of the
projective line, matrix integrals, and the theory of random trees. Further
topics will be treated in a sequel.
","[{""version"":""v1"",""created"":""Wed, 17 Jan 2001 22:00:46 GMT""},{""version"":""v2"",""created"":""Thu, 22 Mar 2001 21:03:30 GMT""}]","2007-05-23"
"math/0101148","Tsuyoshi Kobayashi","Tsuyoshi Kobayashi","Heegaard splittings of exteriors of, two bridge knots","Published by Geometry and Topology at
  http://www.maths.warwick.ac.uk/gt/GTVol5/paper20.abs.html","Geom. Topol. 5 (2001) 609-650","10.2140/gt.2001.5.609",,"math.GT",,"  In this paper, we show that, for each non-trivial two bridge knot K and for
each g > 2, every genus g Heegaard splitting of the exterior E(K) of K is
reducible.
","[{""version"":""v1"",""created"":""Thu, 18 Jan 2001 06:50:03 GMT""},{""version"":""v2"",""created"":""Thu, 28 Jun 2001 19:33:52 GMT""}]","2014-11-11"
"math/0101149","Stefano Marmi","Stefano Marmi and David Sauzin","Quasianalytic monogenic solutions of a cohomological equation","76 pages, 10 figures",,,,"math.DS math.CV math.NT",,"  We prove that the solutions of a cohomological equation of complex dimension
one and in the analytic category have a monogenic dependence on the parameter,
and we investigate the question of their quasianalyticity. This equation is the
standard linearized conjugacy equation for germs of holomorphic maps in a
neighborhood of a fixed point. The parameter is the eigenvalue $q$ of the
linear part. This problem has been first investigated by Arnol'd and Herman.
Herman raised the question whether the solutions of the cohomological equation
had a quasianalytic dependence on the parameter. Indeed they are analytic
outside $\S^1$ which is a natural boundary but the solutions are still defined
at points of $\S^1$ which lie ``far enough from resonances''. We adapt to our
case Herman's construction of an increasing sequence of compacts which avoid
resonances and prove that the solutions belong to the associated space of
monogenic functions. The solutions admit asymptotic expansions at the points of
$\S^1$ which satisfy some arithmetical condition, and Carleman's Theorem allows
us to answer negatively to the question of quasianalyticity at these points.
But resonances (roots of unity) lead to asymptotic expansions, for which
quasianalyticity is obtained as a particular case of \'Ecalle's theory of
resurgent functions. At constant-type points one can still recover the
solutions from their asymptotic expansions and obtain a special kind of
quasianalyticity. Our results are obtained by reducing the problem to the study
of a fundamental solution (which is the ``quantum logarithm''). We deduce as a
corollary of our work the proof of a conjecture of Gammel on the monogenic and
quasianalytic properties of a certain number-theoretical Borel-Wolff-Denjoy
series.
","[{""version"":""v1"",""created"":""Thu, 18 Jan 2001 08:26:32 GMT""}]","2007-05-23"
