"astro-ph/0101313","Steven Tingay","S.J. Tingay, et al","Measuring the brightness temperature distribution of extragalactic radio
  sources with space VLBI","4 pages + 1 figure, ApJ letters, accepted",,"10.1086/319148",,"astro-ph",,"  We have used VSOP space very long baseline interferometry observations to
measure the brightness temperature distribution of a well-defined sub-set of
the Pearson-Readhead sample of extragalactic radio sources. VLBI which is
restricted to Earth-diameter baselines is not generally sensitive to emitting
regions with brightness temperatures greater than approximately $10^{12}$ K,
coincidentally close to theoretical estimates of brightness temperature limits,
$10^{11} - 10^{12}$ K. We find that a significant proportion of our sample have
brightness temperatures greater than $10^{12}$ K; many have unresolved
components on the longest baselines, and some remain completely unresolved.
These observations begin to bridge the gap between the extended jets seen with
ground-based VLBI and the microarcsecond structures inferred from intraday
variability, evidenced here by the discovery of a relationship between intraday
variability and VSOP-measured brightness temperature, likely due to the effects
of relativistic beaming. Also, lower limits on jet Lorentz factors, estimated
from space VLBI observations, are starting to challenge numerical simulations
that predict low Lorentz factor jets.
","[{""version"":""v1"",""created"":""Thu, 18 Jan 2001 00:30:26 GMT""}]","2009-11-06"
"astro-ph/0101314","Sarbani Basu","Sarbani Basu (Yale), H.M. Antia (TIFR, Mumbai)","A study of possible temporal and latitudinal variations in the
  properties of the solar tachocline","To appear in MNRAS","Mon.Not.Roy.Astron.Soc. 324 (2001) 498","10.1046/j.1365-8711.2001.04364.x",,"astro-ph",,"  Temporal variations of the structure and the rotation rate of the solar
tachocline region are studied using helioseismic data from the Global
Oscillation Network Group (GONG) and the Michelson Doppler Imager (MDI)
obtained during the period 1995--2000. We do not find any significant temporal
variation in the depth of the convection zone, the position of the tachocline
or the extent of overshoot below the convection zone. No systematic variation
in any other properties of the tachocline, like width, etc., is found either.
Possibility of periodic variations in these properties is also investigated.
Time-averaged results show that the tachocline is prolate with a variation by
about 0.02R_sun in its position. The depth of the convection zone or the extent
of overshoot does not show any significant variation with latitude.
","[{""version"":""v1"",""created"":""Thu, 18 Jan 2001 01:07:37 GMT""}]","2009-11-06"
"astro-ph/0101315","Soebur Razzaque","Soebur Razzaque, Surujhdeo Seunarine, David Z. Besson and Douglas W.
  McKay","Signal Characteristics from Electromagnetic Cascades in Ice","8 pages, 6 figures","AIP Conf.Proc. 579 (2001) 139-146","10.1063/1.1398167",,"astro-ph",,"  We investigate the development of electromagnetic cascades in ice using a
GEANT Monte Carlo simulation. We examine the Cherenkov pulse that is generated
by the charge excess that develops and propagates with the shower. This study
is important for the RICE experiment at the South Pole, as well as any test
beam experiment which seeks to measure coherent Cherenkov radiation from an
electromagnetic shower.
","[{""version"":""v1"",""created"":""Thu, 18 Jan 2001 01:56:45 GMT""},{""version"":""v2"",""created"":""Tue, 26 Feb 2002 00:02:22 GMT""}]","2009-11-06"
"astro-ph/0101316","Stanton J. Peale","S. J. Peale","Probability of Detecting a Planetary Companion during a Microlensing
  Event","32 pages, 20 figures, In Press, ApJ, Latex format with aas2pp4 format",,"10.1086/320562",,"astro-ph",,"  The probability of detecting a planetary companion of a lensing star during a
microlensing event toward the Galactic center, averaged over all relevant event
and galactic parameters, when the planet-star mass ratio $q=0.001$ has a
maximum exceeding 10% at an orbit semimajor axis $a$ near 1.5 AU for a uniform
distribution of impact parameters. The maximum probability is raised to more
than 20% for a distribution of source-lens impact parameters that is determined
by the efficiency of event detection. The averaging procedures are carefully
defined, and they determinine the dependence of the detection probabilities on
several properties of the Galaxy. The probabilities scale approximately as
$\sqrt{q}$. A planet is assumed detectable if the perturbation of the single
lens light curve exceeds $2/(S/N)$ for at least 20 consecutive photometric
points sometime during the event. Two meter telescopes with 60 second
integrations in I-band with high time resolution photometry throughout the
duration of an ongoing event are assumed. The probabilities are derived as a
function of $a$, where they remain significant for $0.6<a<10$ AU. Dependence of
the detection probabilities on the lens mass function, luminosity function of
the source stars as modified by extinction, distribution of source-lens impact
parameters, and the line of sight to the source are also determined, and the
probabilities are averaged over the distribution of the projected planet
position, the lens mass function, the distribution of impact parameters, the
lens and source distances as weighted by their distributions along the line of
sight and over the $I$-band apparent luminosity function of the sources. The
extraction of the probabilility as a function of $a$ for a particular $q$ from
empirical data is indicated.
","[{""version"":""v1"",""created"":""Thu, 18 Jan 2001 02:42:49 GMT""}]","2009-11-06"
"astro-ph/0101317","Sergey Silich","Sergiy Silich & Guillermo Tenorio-Tagle","On the Energy Required to Eject Processed Matter from Galaxies","7 pages, 4 figures, 1 table, Accepted for publication in ApJ",,"10.1086/320455",,"astro-ph",,"  We evaluate the minimum energy input rate that starbursts require for
expelling their newly processed matter from their host galaxies. Special
attention is given to the pressure caused by the environment in which a galaxy
is situated, as well as to the intrinsic rotation of the gaseous component. We
account for these factors and for a massive dark matter distribution, and
develop a self-consistent solution for the interstellar matter gas
distribution. Our results are in excellent agreement with the results of Mac
Low & Ferrara (1999) for galaxies with a flattened disk-like ISM density
distribution and a low intergalactic gas pressure ($P_{IGM}/k$ $\leq $ 1
cm$^{-3}$ K). However, our solution also requires a much larger energy input
rate threshold when one takes into consideration both a larger intergalactic
pressure and the possible existence of a low-density, non-rotating, extended
gaseous halo component.
","[{""version"":""v1"",""created"":""Thu, 18 Jan 2001 04:36:36 GMT""}]","2009-11-06"
"astro-ph/0101318","Werner Hofmann","B.M. Schaefer, W. Hofmann, H. Lampeitl, M. Hemberger","Particle Identification by Multifractal Parameters in Gamma-Astronomy
  with the HEGRA-Cherenkov-Telescopes","16 Pages, 6 figures; Nucl. Instr. Meth., in press","Nucl.Instrum.Meth. A465 (2001) 394-403","10.1016/S0168-9002(01)00701-X",,"astro-ph",,"  Cherenkov images of air showers can also be classified using multifractal and
wavelet parameters, as compared to the conventional Hillas image parameters.
This technique was applied to the images recorded by the cameras of the
stereoscopic imaging air Cherenkov-telescopes operated by the HEGRA
collaboration. With respect to the identification of particles, the performance
of multifractal and wavelet parameters was examined using a data sample from
the observation of the active galaxy Mkn 501 that showed a high gamma-ray flux.
The multifractal parameters were also combined with the Hillas parameters using
a neural network approach in order to further improve the
gamma/hadron-separation.
","[{""version"":""v1"",""created"":""Thu, 18 Jan 2001 06:28:38 GMT""}]","2015-06-24"
"astro-ph/0101319","Ute Lisenfeld","U. Lisenfeld, J. Braine, O. Vallejo, P.-A. Duc, S. Leon, E. Brinks, V.
  Charmandaris","Star Formation in Tidal Dwarf Galaxies","Contribution to proceedings of ""Modes of Star Formation and the
  Origin of Field Population"", eds. E.K. Grebel & W. Brandner, 7 pages, 4
  figures",,,,"astro-ph",,"  Tidal Dwarf Galaxies (TDGs) are objects presently forming from gas which has
been expelled from their parent galaxies during an interaction. We observed the
CO emission of a sample of 11 TDGs, of which 8 were detected. The CO is found
at the peak of the HI observations and has the same line velocity and width,
indicating that the molecular gas is forming in situ instead of being torn from
the parent galaxies. The presence of H$\alpha$ emission furthermore shows that
stars are forming from this molecular gas. In order to investigate star
formation in TDGs further, we compared their molecular gas content and star
formation rate (SFR), traced by H$\alpha$, to those of spiral galaxies and
classical dwarfs. The major difference between TDGs and classical dwarfs is the
lower metallicity of the latter. The star formation efficiency (SFR per
molecular gas mass) of TDGs lies in the range typical of spiral galaxies
indicating that star formation is proceeding in a normal fashion from molecular
gas.
","[{""version"":""v1"",""created"":""Thu, 18 Jan 2001 08:34:50 GMT""}]","2007-05-23"
"astro-ph/0101320","Ben R. Oppenheimer","B. R. Oppenheimer, D. A. Golimowski, S. R. Kulkarni, K. Matthews, T.
  Nakajima, M. Creech-Eakman, S. T. Durrance","Coronagraphic Survey for Companions of Stars within 8 pc","Accepted for publication in the Astronomical Journal. 58 pages, 19
  figures, 14 tables",,"10.1086/319941",,"astro-ph",,"  We present the technique and results of a survey of stars within 8 pc of the
Sun with declinations $\bf\delta > -35\arcdeg$ (J2000.00). The survey, designed
to find without color bias faint companions, consists of optical coronagraphic
images of the 1\arcmin field of view centered on each star and infrared direct
images with a 32\asc field of view. The images were obtained through the
optical Gunn $r$ and $z$ filters and the infrared J and K filters. The survey
achieves sensitivities up to four absolute magnitudes fainter than the
prototype brown dwarf, Gliese 229B. However, this sensitivity varies with the
seeing conditions, the intrinsic brightness of the star observed and the
angular distance from the star. As a result we tabulate sensitivity limits for
each star in the survey. We used the criterion of common proper motion to
distinguish companions and to determine their luminosities. In addition to the
brown dwarf Gliese 229B, we have identified 6 new stellar companions of the
sample stars. Since the survey began, accurate trigonometric parallax
measurements for most of the stars have become available. As a result some of
the stars we originally included should no longer be included in the 8 pc
sample. In addition, the 8 pc sample is incomplete at the faint end of the main
sequence complicating our calculation of the binary fraction of brown dwarfs.
We assess the sensitivity of the survey to stellar companions and to brown
dwarf companions of various masses and ages.
","[{""version"":""v1"",""created"":""Thu, 18 Jan 2001 08:42:46 GMT""}]","2009-11-06"
"astro-ph/0101321","Frank Eisenhauer","Frank Eisenhauer","Evidence in Favour of IMF Variations","10 pages, 1 figure, invited review, to appear in the conference
  proceedings of ""Starbursts: Near and Far"", Ringberg Castle, Germany, 10-15
  September 2000 (eds. L.J. Tacconi and D. Lutz)",,,,"astro-ph",,"  The stellar initial mass function (IMF) determines the relative number of
stars born at a given mass. Despite the tremendous effort to establish a
universal IMF, the astronomical literature offers a wealth of diverse evidence
for IMF variations. This review was prepared for a controversial debate at the
conference ``Starbursts -- Near and Far'' at Ringberg Castle, 2000, and gives a
one-sided portrayal in favour of IMF variations. I will summarise the empirical
evidence that the IMF varies with time, with environment, and for all stellar
masses. While I see no obvious systematic trend in most regions of our Galaxy,
there is at least an indication that the IMF is biased towards more massive
stars in the early universe and in starbursts.
","[{""version"":""v1"",""created"":""Thu, 18 Jan 2001 09:38:17 GMT""}]","2007-05-23"
"astro-ph/0101322","Gabriele Breuer","J.C. Testori (1), P. Reich (2), J.A. Bava (1), F. R. Colomb (1), E.E.
  Hurrel (1), J.J. Larrarte (1), W. Reich (2), and A.J. Sanz (1) ((1) Instituto
  Argentino de Radioastronomia, Argentina, (2) MPI fuer Radioastronomie, Bonn,
  Germany)","A radio continuum survey of the southern sky at 1420 MHz. Observations
  and data reduction","9 pages with 9 figures, A&A, in press",,"10.1051/0004-6361:20010088",,"astro-ph",,"  We describe the equipment, observational method and reduction procedure of an
absolutely calibrated radio continuum survey of the South Celestial Hemisphere
at a frequency of 1420 MHz. These observations cover the area 0h < R.A. < 24h
for declinations less than -10 degree. The sensitivity is about 50 mK T_B (full
beam brightness) and the angular resolution (HPBW) is 35.4', which matches the
existing northern sky survey at the same frequency.
","[{""version"":""v1"",""created"":""Thu, 18 Jan 2001 09:47:01 GMT""}]","2009-11-06"
"astro-ph/0101323","Vangioni-Flam Elisabeth","M. Casse, E. Vangioni-Flam and J. Audouze","Lithium-Beryllium-Boron Evolution: From Meneguzzi, Audouze and Reeves
  1971 Up to Now","6 pages, no figure, invited talk, to be published in World
  Scientific, Proceedings of the conference ""Cosmic Evolution"" in the honor of
  Jean Audouze and James W. Truran, held at the Institut d'Astrophysique de
  Paris, France",,"10.1142/9789812810830_0025",,"astro-ph",,"  We review the main sources of LiBeB production and show that a primary
mechanism is at work in the early Galaxy involving both ejection and
acceleration of He, C and O at moderate energy, which by nuclear interaction
with
  H and He produce light isotopes. The precise measurement of the Be abundance
at [Fe/H] = -3.3 and of $^6Li$ in halo stars find an explanation in this
framework. Thus, the preservation of $^6Li$ in the atmosphere of metal poor
stars implied, points toward the fact the Spite plateau reflects the primordial
value of Li. Consequently, it can be used as a baryodensitometer.
","[{""version"":""v1"",""created"":""Thu, 18 Jan 2001 10:26:39 GMT""}]","2016-11-03"
"astro-ph/0101324","Mauro Dadina","M. Dadina, L. Bassani, M. Cappi, G.G.C. Palumbo, L. Piro, M.
  Guainazzi, G. Malaguti, G. Di Cocco, M. Trifoglio","On the Origin of the FeK$\alpha$ Line in the Seyfert 2 Galaxy NGC 7172","9 pages, 11 figures, accepted for publication on A&A",,"10.1051/0004-6361:20010132",,"astro-ph",,"  The Seyfert 2 Galaxy NGC 7172 was observed twice by BeppoSAX narrow field
instruments approximately one year apart. As found in previous observations,
the source is variable on short time scales (hours) by a factor of $\sim$30%,
confirming the presence of a type 1 nucleus at the center. A strong flux
variability (by a factor of 2) on a longer time scale was observed between the
two observations. Indeed, in November 1997, the lowest flux ever recorded was
detected by BeppoSAX. The broad band spectra obtained with the BeppoSAX narrow
field instruments show marginal evidence of a reflection component. This
structure could explain the very flat spectra previously observed in the 2-10
keV band. An FeK$\alpha$ line was also detected in both observations. The line
intensity appears to remain almost constant between the two observations even
if the associated large errors cannot exclude some variability. In order to
understand the problem of the origin of the line, data from previous
observations, performed with other satellites, were also used. The scenario
favored is one where the line is produced at a distance of approximatively 8
light years from the continuum source region, rather than having its origin in
the accretion disk. In the framework of the standard unified models for AGN,
this suggests that its origin is located in the molecular torus.
","[{""version"":""v1"",""created"":""Thu, 18 Jan 2001 10:37:20 GMT""}]","2009-11-06"
"astro-ph/0101325","Lucas Lara","L. Lara, A. Alberdi, J.M. Marcaide","Variability and polarization in the inner jet of 3C395","7 pages, 4 figures, A&A in press",,"10.1051/0004-6361:20010059",,"astro-ph",,"  We present new results on the parsec-scale jet of the quasar 3C395, derived
from VLBI polarization sensitive observations made in 1995.91 and 1998.50 at
8.4, 15.4 and 22.2 GHz. The observations show a complex one-sided jet extending
up to 20 mas, with a projected magnetic field essentially aligned with the
radio jet. The emission is strongly dominated, in total intensity and
polarization, by the core and the inner jet region (of ~3 mas length). We have
studied the details of this dominant region finding clear structural variations
during this ~2.5 years period, in contrast with the apparent quietness of the
jet structure inferred from lower resolution VLBI observations. We observe the
ejection of a new component from the core and variations in the degree of
polarization of the inner jet components. We estimate a high Faraday Rotation
Measure close to the core, with a strong decrease along the inner jet.
","[{""version"":""v1"",""created"":""Thu, 18 Jan 2001 11:48:02 GMT""}]","2009-11-06"
"astro-ph/0101326","Lucio Chiappetti","G. Conti, E. Mattaini, L. Chiappetti, D. Maccagni, E. Sant'Ambrogio,
  D. Bottini, B. Garilli, O. Le F\`evre, M. Saisse, C. Vo\""et, O. Caputi, E.
  Cascone, D. Mancini, G. Mancini, F. Perrotta, P. Schipani, G. Vettolani","The VLT-VIRMOS Mask Manufacturing Unit","Accepted for publication in PASP April 2001 PASP Latex preprint
  style, 31 pages including 9 figures (5 jpg2eps compressed)",,"10.1086/319548",,"astro-ph",,"  The VIRMOS Consortium has the task to design and manufacture two
spectrographs for ESO VLT, VIMOS (Visible Multi-Object Spectrograph) and NIRMOS
(Near Infrared Multi-Object Spectrograph). This paper describes how the Mask
Manufacturing Unit (MMU), which cuts the slit masks to be used with both
instruments, meets the scientific requirements and manages the storage and the
insertion of the masks into the instrument. The components and the software of
the two main parts of the MMU, the Mask Manufacturing Machine and the Mask
Handling System, are illustrated together with the mask material and with the
slit properties. Slit positioning is accurate within 15 micron, equivalent to
0.03 arcsec on the sky, while the slit edge roughness has an rms on the order
of 0.03 pixels on scales of a slit 5 arcsec long and of 0.01 pixels on the
pixel scale (0.205 arcsec). The MMU has been successfully installed during
July/August 2000 at the Paranal Observatory and is now operational for
spectroscopic mask cutting, compliant with the requested specifications.
","[{""version"":""v1"",""created"":""Thu, 18 Jan 2001 13:26:43 GMT""}]","2009-11-06"
"astro-ph/0101327","Ariane Lancon","Ariane Lancon (Observ. de Strasbourg, France), Jeff D. Goldader (Univ.
  of Pennsylvania, USA), Claus Leitherer (Space Telescope Science Institute,
  USA), Rosa M. Gonzalez Delgado (Inst. de Astrofisica de Andalucia, Spain)","Multiwavelength Study of the Starburst Galaxy NGC 7714. II: The Balance
  between Young, Intermediate Age and Old Stars","29 pages (+20 figures and tables), Latex2e (figs. included), uses
  aastex.cls. To be published in ApJ (May 2001 issue)",,"10.1086/320456",,"astro-ph",,"  We combine existing multiwavelength data (incl. an HST/GHRS UV spectrum, an
optical spectrum, far-IR, Xray and radio fluxes) with new HST/WFPC2 images,
near-IR photometry and K band spectroscopy. We use these data to constrain the
young, the intermediate age and the old stellar populations in the central 330
pc of the starburst galaxy NGC 7714. [...]
  We find that the young burst responsible for the UV light is only a small
part of an extended episode of enhanced star formation (SF) [...]. The mass of
young and intermediate age stars thus formed equals at least 10% of the mass
locked in pre-existing stars of the underlying galaxy nucleus [...]. The
spectrophotometric SF timescale is long compared to the ~110 Myr elapsed since
closest contact with NGC 7715. The trigger of the starburst remains elusive.
  NGC 7714 owes its brightness in the UV to a few low extinction lines of sight
towards young stars. [...] The different extinction estimates obtained from
different indicators result naturally from the coexistence of populations with
various ages and obscurations. The near-IR continuum image looks smoothest, as
a consequence of lower sensitivity to extinction and of a larger contribution
of old stars. We compare the nuclear properties of NGC 7714 with results from
studies in larger apertures. We emphasize that the global properties of
starburst galaxies are the result of the averaging over many lines of sight
with diverse properties in terms of obscuration and stellar ages.
","[{""version"":""v1"",""created"":""Thu, 18 Jan 2001 13:39:36 GMT""}]","2016-08-30"
"astro-ph/0101328","Peter Wilkinson","P.N. Wilkinson (1), D.R. Henstock (1), I.W.A. Browne (1), A.G.
  Polatidis (1,2), P. Augusto (1,3), A.C.S. Readhead (4), T.J. Pearson (4), W.
  Xu (4), G.B. Taylor (4,5), R.C. Vermeulen (4,6) ((1) University of
  Manchester, Jodrell Bank Observatory, (2) Onsala Space Observatory, (3)
  Universidade da Madeira., (4) California Institute of Technology, (5)
  National Radio Astronomy Observatory, (6) Netherlands Foundation for
  Radioastronomy)","Limits on the cosmological abundance of supermassive compact objects
  from a search for multiple imaging in compact radio sources","2 figures","Phys.Rev.Lett.86:584-587,2001","10.1103/PhysRevLett.86.584",,"astro-ph",,"  Using Very Long Baseline Interferometry we have searched a sample of 300
compact radio sources for examples of multiple imaging produced by
gravitational lensing; no multiple images were found with separations in the
angular range 1.5--50 milliarcsec. This null result allows us to place a limit
on the cosmological abundance of intergalactic supermassive compact objects in
the mass range $\sim 10^{6}$ to $\sim 10^{8}$M$_{\odot}$; such objects cannot
make up more than $\sim 1%$ of the closure density (95% confidence). A
uniformly distributed population of supermassive black holes forming soon after
the Big Bang do not, therefore, contribute significantly to the dark matter
content of the Universe.
","[{""version"":""v1"",""created"":""Thu, 18 Jan 2001 13:57:08 GMT""}]","2008-11-26"
"astro-ph/0101329","Hameury","V. Buat-Menard, J.-M. Hameury & J.-P. Lasota","Z Cam stars: a particular response to a general phenomenon","submitted to Astronomy & Astrophysics, 8 pages, 4 figures",,"10.1051/0004-6361:20010176",,"astro-ph",,"  We show that the disc instability model can reproduce all the observed
properties of Z Cam stars if the energy equation includes heating of the outer
disc by the mass-transfer stream impact and by tidal torques and if the
mass-transfer rate from the secondary varies by about 30% around the value
critical for stability. In particular the magnitude difference between outburst
maxima and standstills corresponds to observations, all outbursts are of the
inside-out type and can be divided into two classes: long (wide) and short
(narrow) outbursts, as observed. Mass transfer rate fluctuations should occur
in other dwarf novae but one can exclude variations similar to those observed
in magnetic systems (AM Her's and some DQ Her's) and some nova-like systems (VY
Scl's), in which \dot{M} become very small during low states; these would
produce mini-outburst which, although detectable, have never been observed.
","[{""version"":""v1"",""created"":""Thu, 18 Jan 2001 14:55:05 GMT""}]","2009-11-06"
