"astro-ph/0101279","Takamitsu Miyaji","Takamitsu Miyaji, Guenther Hasinger, Maarten Schmidt","Soft X-ray AGN Luminosity Function from ROSAT Surveys II. Table of the
  binned Soft X-ray Luminosity Function","8 pages, 2 figures, 6 ASCII Tables with a ReadMe file. To appear in
  A&A. Replaced for an insignificant minor fix","Astron.Astrophys.369:49-56,2001","10.1051/0004-6361:20010102",,"astro-ph",,"  This is the second paper of our investigation of the 0.5-2 keV soft X-ray
luminosity function (SXLF) of active galactic nuclei (AGN) using results from
ROSAT surveys of various depth. The large dynamic range of the combined sample,
from shallow large-area ROSAT All-Sky Survey (RASS)-based samples to the
satellite's deepest pointed observation on the Lockman Hole, enabled us to
trace the behavior of the SXLF. While the first paper (Miyaji, Hasinger,
Schmidt 2000, hereafter paper I) emphasized the global behavior of the SXLF,
cosmological evolution and contribution to the soft X-ray background, this
paper presents actual numerical values for practical use of our results.
  To present the binned SXLF, we have used an improved estimator, which is free
from biases associated with the conventional 1/Va estimator.
","[{""version"":""v1"",""created"":""Wed, 17 Jan 2001 17:05:45 GMT""},{""version"":""v2"",""created"":""Thu, 18 Jan 2001 22:05:57 GMT""}]","2016-08-30"
"astro-ph/0101285","Seppo Laine","S. Laine, J. H. Knapen, D. Perez-Ramirez, P. Englmaier, M. Matthias","Circumnuclear kinematics in NGC 5248: the origin of nuclear spiral arms","Accepted for publication in MNRAS","Mon.Not.Roy.Astron.Soc.324:891,2001","10.1046/j.1365-8711.2001.04338.x",,"astro-ph",,"  We present for the first time a two-dimensional velocity field of the central
region of the grand-design spiral galaxy NGC 5248, at 0.9 arcsec spatial
resolution. The H-alpha velocity field is dominated by circular rotation. While
no systematic streaming motions are seen in the area of the nuclear
grand-design spiral or the circumnuclear ring, the amplitude of residual
velocities, after subtracting a model circular velocity field, reaches 20 km/s
in projection. The rotation curve levels out at around 140 km/s, after a
well-resolved and rather shallow rise. We have generated an analytical model
for the nuclear spiral and fitted it to our observations to obtain estimates of
the pattern speed of the spiral and the sound speed in the central region of
NGC 5248. Our results are consistent with a low pattern speed, suggesting that
the nuclear spiral rotates with the same rate as the main spiral structure in
NGC 5248, and thus that the spiral structure is coupled from scales of a few
hundred parsecs to several kiloparsecs. We have also compared the observed
structure and kinematics between the nuclear regions of NGC 5248 and M100.
Several similarities and differences are discussed, including the location of
the peak emission regions on major and minor axes, and the spiral arm streaming
motions. We find no kinematic evidence for a presence of a nuclear bar in NGC
5248.
","[{""version"":""v1"",""created"":""Wed, 17 Jan 2001 23:49:56 GMT""}]","2008-11-26"
"astro-ph/0101297","James Dunlop","James S. Dunlop (University of Edinburgh)","The redshifts of bright sub-mm sources","11 pages, 5 figures, FIRSED2000 conference proceedings, eds. I.M. van
  Bemmel, B. Wilkes, & P. Barthel Elsevier New Astronomy Reviews",,"10.1016/S1387-6473(01)00143-9",,"astro-ph",,"  One of the key goals in observational cosmology over the next few years will
be to establish the redshift distribution of the recently-discovered sub-mm
source population. In this brief review I discuss and summarize the redshift
information which has been gleaned to date for the ~ 50 bright sub-mm sources
which have been uncovered via the six main classes of survey performed with
SCUBA on the JCMT over the last 2-3 years. Despite the biases inherent in some
of these surveys, and the crudeness of the redshift information available in
others, I conclude that all current information suggests that only 10-15 % of
luminous sub-mm sources lie at z < 2, and that the median redshift of this
population is z ~ 3. I suggest that such a high median redshift is arguably not
unexpected given current theories designed to explain the correlation between
black-hole mass and spheroid mass found at low redshift. In such scenarios,
peak AGN emission is expected to correspond to, or even to cause termination of
major star-formation activity in the host spheroid. In contrast, maximum dust
emission is expected to occur roughly half-way through the star-formation
process. Given that optical emission from bright quasars peaks at z = 2.5,
dust-emission from massive ellipticals might be reasonably expected to peak at
some point in the preceding ~ 1 Gyr, at z ~ 3. Confirmation or refutation of
this picture requires significantly-improved redshift information on bright
samples of SCUBA sources.
","[{""version"":""v1"",""created"":""Wed, 17 Jan 2001 16:15:45 GMT""}]","2009-11-06"
"astro-ph/0101298","Uriel Frisch","J. Bec, U. Frisch, K. Khanin and B. Villone","A universal law for tails of density pdf's in multi-dimensional Burgers
  turbulence","4 pages, 3 figures, Proceedings ETC-8, Barcelona, June 2000","Advances in Turbulence VIII, C. Dopazo et al., eds., CIMNE,
  Barcelona, 2000",,,"astro-ph",,"  Extending work of E, Khanin, Mazel and Sinai (1997 PRL 78:1904-1907) on the
one-dimensional Burgers equation, we show that density pdf's have universal
power-law tails with exponent -7/2. This behavior stems from singularities,
other than shocks, whose nature is quite different in one and several
dimensions. We briefly discuss the possibility of detecting singularities of
Navier-Stokes turbulence using pdf tails.
","[{""version"":""v1"",""created"":""Wed, 17 Jan 2001 16:38:45 GMT""}]","2007-05-23"
"astro-ph/0101299","Rita M. Sambruna","Rita M. Sambruna, C. Megan Urry, F. Tavecchio, L. Maraschi, R. Scarpa,
  G. Chartas, and T. Muxlow","Chandra Observations of the X-Ray Jet of 3C273","3 figures; Figure 1 in color. Accepted for publication by ApJ Letters",,"10.1086/319157",,"astro-ph",,"  We report results from Chandra observations of the X-ray jet of 3C~273 during
the calibration phase in 2000 January. The zeroeth-order images and spectra
from two 40-ks exposures with the HETG and LETG+ACIS-S show a complex X-ray
structure. The brightest optical knots are detected and resolved in the 0.2-8
keV energy band. The X-ray morphology tracks well the optical. However, while
the X-ray brightness decreases along the jet, the outer parts of the jet tend
to be increasingly bright with increasing wavelength. The spectral energy
distributions of four selected regions can best be explained by inverse Compton
scattering of (beamed) cosmic microwave background photons. The model
parameters are compatible with equipartition and a moderate Doppler factor,
which is consistent with the one-sidedness of the jet. Alternative models
either imply implausible physical conditions and energetics (the synchrotron
self-Compton model) or are sufficiently ad hoc to be unconstrained by the
present data (synchrotron radiation from a spatially or temporally distinct
particle population).
","[{""version"":""v1"",""created"":""Wed, 17 Jan 2001 16:40:34 GMT""}]","2009-11-06"
"astro-ph/0101300","Eric J. Korpela","Stuart Bowyer, Eric Korpela, Thomas Berghoefer (Space Sciences
  Laboratory, UC Berkeley)","Extreme Ultraviolet Emission in the Fornax Cluster of Galaxies","6 pages, 3 eps figures, aastex5, Accepted to ApJL",,"10.1086/319093",,"astro-ph",,"  We present studies of the Extreme Ultraviolet (EUV) emission in the Fornax
cluster of galaxies; a relatively nearby well-studied cluster with X-ray
emitting cluster gas and a very large radio source. We examine both the
large-scale (~size of the X-ray emitting cluster gas), and the small-scale
(<arcmin) emission.
  We find that this cluster has large-scale diffuse EUV emission. However, at
the sensitivity level of the existing EUVE data, this emission is due entirely
to the low energy tail of the X-ray emitting gas. We have also examined
small-scale structures in raw EUVE images of this cluster. We find that
small-scale irregularities are present in all raw Deep Survey images as a
result of small-scale detector effects. These effects can be removed by
appropriate flat-fielding. After flat-fielding, the Fornax cluster still shows
a few significant regions of small-scale EUV enhancement. We find that these
are emission from stars and galaxies in the field. We find that at existing
levels of sensitivity, there is no excess EUV emission in the cluster on either
large or small scales.
","[{""version"":""v1"",""created"":""Wed, 17 Jan 2001 17:42:18 GMT""}]","2009-11-06"
"astro-ph/0101301","Reshmi Mukherjee","R. Mukherjee","Egret (GeV) Blazars","Invited review paper, to appear in the proceedings of the
  International Symposium on High Energy Gamma-Ray Astronomy, Heidelberg, June
  2000, AIP Conference Proc. 14 pages, 5 figures","AIP Conf.Proc. 558 (2001) 324-337","10.1063/1.1370801",,"astro-ph",,"  The EGRET instrument on the Compton Gamma Ray Observatory (1991-2000) has
positively detected high energy gamma-ray emission from more than 67 active
galaxies of the blazar class. The majority of the EGRET blazars are
flat-spectrum radio quasars, which are characterized by inferred isotropic
luminosities often as high as 3E49 ergs/s. The remainder are BL Lac objects,
some of which have been detected at TeV energies (> 250 GeV) by ground-based
atmospheric Cherenkov telescopes. One of the remarkable characteristics
observed in blazars is that the gamma-ray luminosity often dominates the
bolometric power in these sources. The detection of blazars by EGRET has
undoubtedly been one of the highlights of the mission, and has forever impacted
upon our understanding of the emission mechanisms in these objects. In this
article, we summarize the properties of EGRET blazars, and review the
constraints that the EGRET observations place on the various models of
gamma-ray production in these sources.
","[{""version"":""v1"",""created"":""Wed, 17 Jan 2001 17:57:48 GMT""}]","2009-11-06"
"astro-ph/0101302","Klaus Dolag","Klaus Dolag, August Evrard and Matthias Bartelmann","The temperature-mass relation in magnetized galaxy clusters","Accepted for publication in A&A",,"10.1051/0004-6361:20010094",,"astro-ph",,"  We use cosmological, magneto-hydrodynamic simulations of galaxy clusters to
quantify the dynamical importance of magnetic fields in these clusters. The
set-up of initial magnetic field strengths at high redshifts is chosen such
that observed Faraday-rotation measurements in low-redshift clusters are well
reproduced in the simulations. We compute the radial profiles of the
intracluster gas temperature and of the thermal and magnetic pressure in a set
of clusters simulated in the framework of an Einstein-de Sitter and a
low-density, spatially-flat CDM cosmological model. We find that, for a
realistic range of initial magnetic field strengths, the temperature of the
intracluster gas changes by less than $\approx5%$.
","[{""version"":""v1"",""created"":""Wed, 17 Jan 2001 18:05:18 GMT""}]","2009-11-06"
"astro-ph/0101303","Lex Kaper","Lex Kaper (Astronomical Institute, University of Amsterdam)","High-mass X-ray binaries and OB-runaway stars","15 pages, latex (sty file included) with 5 embedded figures (one in
  jpg format), to appear in Proc. ""Influence of binaries on stellar population
  studies"", Eds. Vanbeveren, Van Rensbergen",,"10.1007/978-94-015-9723-4_10",,"astro-ph",,"  High-mass X-ray binaries (HMXBs) represent an important phase in the
evolution of massive binary systems. HMXBs provide unique diagnostics to test
massive-star evolution, to probe the physics of radiation-driven winds, to
study the process of mass accretion, and to measure fundamental parameters of
compact objects. As a consequence of the supernova explosion that produced the
neutron star (or black hole) in these systems, HMXBs have high space velocities
and thus are runaways. Alternatively, OB-runaway stars can be ejected from a
cluster through dynamical interactions. Observations obtained with the
Hipparcos satellite indicate that both scenarios are at work. Only for a
minority of the OB runaways (and HMXBs) a wind bow shock has been detected.
This might be explained by the varying local conditions of the interstellar
medium.
","[{""version"":""v1"",""created"":""Wed, 17 Jan 2001 18:05:54 GMT""}]","2015-05-20"
"astro-ph/0101304","Chris Laws","Chris Laws and Guillermo Gonzalez","A Differential Spectroscopic Analysis of 16 Cygni A and B",,,"10.1086/320669",,"astro-ph",,"  We utilize high-resolution, high signal-to-noise spectra to perform a
differential analysis of Fe abundances in the common proper-motion pair 16 Cyg
A and B. We confirm that both stars are slightly metal-rich compared to the
Sun, and we show for the first time that the primary is enhanced in Fe relative
to the secondary by a significant amount. We find Delta[Fe/H]=+0.025\pm0.009.
This tends to support the ``self-pollution'' scenario proposed by Gonzalez
(1998), though lack of a complete understanding of small primordial metallicity
variations among binaries and open cluster members prevents a definitive
conclusion.
","[{""version"":""v1"",""created"":""Wed, 17 Jan 2001 18:08:55 GMT""}]","2009-11-06"
"astro-ph/0101305","Roberto Soria","Roberto Soria (MSSL)","The optical emission lines as a probe of state transitions in black-hole
  candidates","Talk presented at the IX Marcel Grossmann Meeting, Rome 2000--to
  appear in the Conference proceedings",,"10.1142/9789812777386_0547",,"astro-ph",,"  Optical spectroscopic studies of emission lines in black-hole candidates can
help us investigate state transitions in those systems. Changes in the optical
line profiles reflect changes in the geometry of the accretion flow, usually
associated with X-ray state transitions in the inner region. We identify at
least four optical states in the black-hole candidate GRO J1655-40 in outburst,
and two optical states in GX339-4.
","[{""version"":""v1"",""created"":""Wed, 17 Jan 2001 19:38:38 GMT""}]","2017-08-23"
"astro-ph/0101306","Kristy K. Dyer","Kristy Dyer, Stephen Reynolds, Kazik Borkowski, Rob Petre","Spatially Varying X-ray Synchrotron Emission in SN 1006","4 pages, 4 figures. To appear in ""Young Supernova Remnants"" the 11th
  Annual October Maryland Astrophysics Conference AIP eds. Steve Holt and Una
  Hwang",,"10.1063/1.1377125",,"astro-ph",,"  A growing number of both galactic and extragalactic supernova remnants show
non-thermal (non-plerionic) emission in the X-ray band. New synchrotron models,
realized as SRESC and SRCUT in XSPEC 11, which use the radio spectral index and
flux as inputs and include the full single-particle emissivity, have
demonstrated that synchrotron emission is capable of producing the spectra of
dominantly non-thermal supernova remnants with interesting consequences for
residual thermal abundances and acceleration of particles. In addition, these
models deliver a much better-constrained separation between the thermal and
non-thermal components, whereas combining an unconstrained powerlaw with modern
thermal models can produce a range of acceptable fits. While synchrotron
emission can be approximated by a powerlaw over small ranges of energy, the
synchrotron spectrum is in fact steepening over the X-ray band. Having
demonstrated that the integrated spectrum of SN 1006, a remnant dominated by
non-thermal emission, is well described by synchrotron models I now turn to
spatially resolved observations of this well studied remnant. The synchrotron
models make both spectral and spatial predictions, describing how the
non-thermal emission varies across the remnant. Armed with spatially resolved
non-thermal models and new thermal models such as VPSHOCK we can now dissect
the inner workings of SN 1006.
","[{""version"":""v1"",""created"":""Wed, 17 Jan 2001 19:55:15 GMT""}]","2009-11-06"
"astro-ph/0101307","Timothy M. Brown","Timothy M. Brown","Transmission Spectra as Diagnostics of Extrasolar Giant Planet
  Atmospheres","57 pages, 22 figures. To be published in the Astrophysical Journal",,"10.1086/320950",,"astro-ph",,"  Atmospheres of transiting extrasolar giant planets (EGPs) such as HD 209458 b
must impose features on the spectra of their parent stars during transits;
these features contain information about the physical conditions and chemical
composition of the atmospheres. The most convenient observational index showing
these features is the ``spectrum ratio'', defined as the wavelength-dependent
ratio of spectra taken in and out of transit. I describe a model that estimates
this ratio and its dependence upon parameters of the planetary atmosphere,
including its cloud structure, temperature, chemical composition, and wind
fields. For giant planets in close orbits, the depths of atomic and molecular
features in the spectrum ratio may be as large as 0.001. Observations in
visible and near-IR wavelengths using existing and planned spectrographs should
be adequate to detect these features, and to provide some diagnostics of the
conditions within the planetary atmosphere. I give numerous examples of such
diagnostics, and I discuss their practicality.
","[{""version"":""v1"",""created"":""Wed, 17 Jan 2001 21:38:46 GMT""}]","2009-11-06"
"astro-ph/0101308",,"A.S. Evans (SUNY, Stony Brook), D.T. Frayer, J.A. Surace, D.B. Sanders","Molecular Gas in Infrared-Excess, Optically-Selected QSOs and the
  Connection with Infrared Luminous Galaxies","LaTex, 16 pages, including 7 postscript figures, AJ, in press (April,
  2001)",,"10.1086/319972",,"astro-ph",,"  The initial results of a millimeter (CO) survey of infrared-excess,
optically-selected quasars from the Palomar-Green (PG) Bright Quasar Survey
(BQS) with redshifts in the range 0.04 < z < 0.17 are presented. These
observations represent the first step towards establishing with a complete
sample whether or not quasi-stellar objects (QSOs) reside in molecular gas-rich
galaxies, as well as towards determining how the infrared and molecular gas
properties of QSOs compare with those of ultraluminous infrared galaxies
(ULIGs), which are a possible evolutionary precursor of QSOs. The sample
consists of QSOs having absolute blue magnitudes, M_B <~ -22.0, and infrared
excesses, L_IR (8-1000 um) /L_bbb (0.1-1.0 um) >0.36, where the contribution to
the bolometric luminosity of infrared thermal dust emission for all PG QSOs is
typically 20--40%. Six out of 10 of the QSOs observed are detected in the
CO(1-0) emission line; two detections confirm previous, less sensitive
detections of CO(1-0) in PG 1613+658 and PG 0838+770, and four additional QSOs
are detected for the first time (PG 1119+120, PG 1351+640, PG 1415+451, and PG
1440+356). These six detections, plus two previous detections of CO in IZw1 and
Mrk 1014, bring the total number of 0.04 < z < 0.17 infrared-excess PG QSOs
detected in CO to date to eight, and provide possible evidence that, in
addition to fueling star formation, molecular gas may also serve as a primary
source of fuel for QSO activity...
","[{""version"":""v1"",""created"":""Wed, 17 Jan 2001 22:34:59 GMT""}]","2009-11-06"
"astro-ph/0101309","Scott J. Kenyon","Scott J. Kenyon and Mercedes Gomez","A Three Micron Survey of the Chamaeleon I Dark Cloud","12 pages of text, 4 figures, and 1 three page table of data modified
  version adds reference and acknowledgement",,"10.1086/320409",,"astro-ph",,"  We describe an L-band photometric survey of 0.5 square deg of the Cha I dark
cloud. The survey has a completeness limit of L < 11.0. Our survey detects 124
sources, including all known pre-main sequence stars with L < 11. The fraction
of sources with near-IR excess emission is 58% +- 4% for K = 9-11. Cha I
sources have bluer H-K and K-L colors than pre-main sequence stars in
Taurus-Auriga. These sources also have a strong correlation between EW(H-alpha)
and K-L. Stars with K-L < 0.6 have weak H-alpha emission; stars with K-L > 0.6
have strong H-alpha emission. Because many Cha I sources are heavily reddened,
this division between weak emission T Tauri stars and classical T Tauri stars
occurs at a redder K-L than in Taurus-Auriga.
","[{""version"":""v1"",""created"":""Wed, 17 Jan 2001 22:53:28 GMT""},{""version"":""v2"",""created"":""Fri, 19 Jan 2001 16:14:39 GMT""}]","2009-11-06"
"astro-ph/0101310","Jes\'us Ma\'iz-Apell\'aniz","Jes\'us Ma\'iz-Apell\'aniz (Space Telescope Science Institute)","The spatial distribution of O-B5 stars in the solar neighborhood as
  measured by Hipparcos","14 pages, 3 figures, to appear in the May 2001 issue of the
  Astronomical Journal","Astron.J.121:2737-2742,2001","10.1086/320399",,"astro-ph",,"  We have developed a method to calculate the fundamental parameters of the
vertical structure of the Galaxy in the solar neighborhood from trigonometric
parallaxes alone. The method takes into account Lutz-Kelker-type biases in a
self-consistent way and has been applied to a sample of O-B5 stars obtained
from the Hipparcos catalog. We find that the Sun is located 24.2 +/- 1.7
(random) +/- 0.4 (systematic) pc above the galactic plane and that the disk
O-B5 stellar population is distributed with a scale height of 34.2 +/- 0.8
(random) +/- 2.5 (systematic) pc and an integrated surface density of (1.62 +/-
0.04 (random) +/- 0.14 (systematic)) 10^{-3} stars pc^{-2}. A halo component is
also detected in the distribution and constitutes at least ~5% of the total
O-B5 population. The O-B5 stellar population within ~100 pc of the Sun has an
anomalous spatial distribution, with a less-than-average number density. This
local disturbance is probably associated with the expansion of Gould's belt.
","[{""version"":""v1"",""created"":""Wed, 17 Jan 2001 23:19:49 GMT""},{""version"":""v2"",""created"":""Thu, 18 Jan 2001 15:44:35 GMT""}]","2016-08-16"
"astro-ph/0101311","Simon Ellingsen","D.M. Cragg (1), A.M. Sobolev (2), S.P. Ellingsen (3), J.L. Caswell
  (4), P.D. Godfrey (1), S.V. Salii (2), R.G. Dodson (3) ((1) Monash
  University, (2) Ural State University, (3) University of Tasmania, (4)
  Australia Telescope National Facility)","Multi-transition study and new detections of class II methanol masers","13 pages, 6 figures, Accepted for publication in MNRAS","Mon.Not.Roy.Astron.Soc. 323 (2001) 939","10.1046/j.1365-8711.2001.04294.x",,"astro-ph",,"  We have used the ATNF Mopra antenna and the SEST antenna to search in the
directions of several class II methanol maser sources for emission from six
methanol transitions in the frequency range 85-115 GHz. The transitions were
selected from excitation studies as potential maser candidates. Methanol
emission at one or more frequencies was detected from five of the maser
sources, as well as from Orion KL. Although the lines are weak, we find
evidence of maser origin for three new lines in G345.01+1.79, and possibly one
new line in G9.62+0.20.
  The observations, together with published maser observations at other
frequencies, are compared with methanol maser modelling for G345.01+1.79 and
NGC6334F. We find that the majority of observations in both sources are
consistent with a warm dust (175 K) pumping model at hydrogen density ~10^6
cm^-3 and methanol column density ~5 x 10^17 cm^-2. The substantial differences
between the maser spectra in the two sources can be attributed to the geometry
of the maser region.
","[{""version"":""v1"",""created"":""Wed, 17 Jan 2001 23:35:26 GMT""}]","2015-06-24"
"astro-ph/0101312","Sergei Nayakshin","Sergei Nayakshin and Demosthenes Kazanas (NASA/GSFC)","Narrow Moving Fe K-alpha lines from magnetic flares in AGN","Revised; no major changes in conclusions",,"10.1086/320684",,"astro-ph",,"  We point out that luminous magnetic flares, thought to occur in standard AGN
accretion disks, cannot be located much higher than few pressure scale heights
above the disk. Using this fact, we estimate the fraction of the disk surface
illuminated by a typical flare. This fraction turns out to be very small for
geometrically thin disks, which implies that the instantaneous Fe K-alpha
emission line from a specific magnetic flare is narrow. The line is red- or
blue-shifted depending on the position of the observer relative to the flare
and sweeps across the line band with time. We present several examples of
theoretical time-resolved line profiles from such flares for a non-rotating
black hole. The observations of such moving features with future X-ray
telescopes will present a powerful test of the accretion disk geometry and may
also test General Relativity in the strong field limit.
","[{""version"":""v1"",""created"":""Wed, 17 Jan 2001 23:47:35 GMT""},{""version"":""v2"",""created"":""Fri, 9 Feb 2001 22:09:56 GMT""}]","2009-11-06"
