"astro-ph/0101330","Siming Liu","Siming Liu and Fulvio Melia","Accretion Processes in the Nucleus of M31","14 pages, 2 figures","The Astrophysical Journal, Vol.550,Issue 2, pp.L151-L154","10.1086/319643",,"astro-ph",,"  The hypothesized supermassive black hole in the nucleus of M31 (which we
shall hereafter call M31*) has many features in common with Sgr A* at the
Galactic Center, yet they differ in several significant and important ways.
Though M31* is probably ten times heavier, its radio luminosity at 3.6 cm is
only one third that of Sgr A*. At the same time, M31* is apparently thousands
of times more luminous in X-rays than its Galactic Center counterpart. Thus, a
comparative study of these objects can be valuable in helping us to understand
the underlying physical basis for their activity. We show here that the
accretion model being developed for Sgr A* comprises two branches of solutions,
distinguished by the relative importance of cooling compared to compressional
heating at the radius $r_C$ where the ambient gas is captured by the black
hole. For typical conditions in the ISM, the initial temperature ($T[r_C]\sim
10^6-10^7$ K) sits on the unstable branch of the cooling function.
  Depending on the actual value of $T(r_C)$ and the accretion rate, the plasma
settles either onto a hot branch (attaining a temperature as high as $10^{10}
K$ or so at small radii) or a cold branch, in which $T$ drops to $\sim 10^4$ K.
Sgr A* is presumably a `hot' black hole. We show here that the VLA, UV and {\it
Chandra} observations of M31* reveal it to be a member of the `cold' black hole
family. We discuss several predicted features in the spectrum of M31* that may
be testable by future multi-wavelength observations, including the presence of
a prominent UV spike (from hydrogen line emission) that would be absent on the
hot branch.
","[{""version"":""v1"",""created"":""Thu, 18 Jan 2001 15:51:45 GMT""},{""version"":""v2"",""created"":""Thu, 12 Apr 2001 04:53:52 GMT""}]","2016-08-30"
"cond-mat/0101251","Craig Howald","C. Howald, P. Fournier, and A. Kapitulnik","Inherent Inhomogeneities in Tunneling Spectra of BSCCO Crystals in the
  Superconducting State","4 pages, 4 figures",,"10.1103/PhysRevB.64.100504",,"cond-mat.supr-con cond-mat.str-el",,"  Scanning Tunneling Spectroscopy on cleaved BSCCO(2212) single crystals reveal
inhomogeneities on length-scales of $\sim$30 $\AA$. While most of the surface
yields spectra consistent with a d-wave superconductor, small regions show a
doubly gapped structure with both gaps lacking coherence peaks and the larger
gap having a size typical of the respective pseudo-gap for the same sample.
","[{""version"":""v1"",""created"":""Wed, 17 Jan 2001 19:53:50 GMT""}]","2009-11-07"
"cond-mat/0101263","Rene Messina","Ren\'e Messina, Christian Holm, and Kurt Kremer","Strong electrostatic interactions in spherical colloidal systems","30 pages and 17 PS figures. REVTEX. Minor changes. To appear in Phys
  Rev E","Phys. Rev. E, VOL 64, 021405 (2001)","10.1103/PhysRevE.64.021405",,"cond-mat.soft cond-mat.str-el",,"  We investigate spherical macroions in the strong Coulomb coupling regime
within the primitive model in salt-free environment. We first show that the
ground state of an isolated colloid is naturally overcharged by simple
electrostatic arguments illustrated by the Gillespie rule. We furthermore
demonstrate that in the strong Coulomb coupling this mechanism leads to ionized
states and thus to long range attractions between like-charged spheres. We use
molecular dynamics simulations to study in detail the counterion distribution
for one and two highly charged colloids for the ground state as well as for
finite temperatures. We compare our results in terms of a simple version of a
Wigner crystal theory and find excellent qualitative and quantitative
agreement.
","[{""version"":""v1"",""created"":""Wed, 17 Jan 2001 16:30:13 GMT""},{""version"":""v2"",""created"":""Thu, 26 Apr 2001 17:23:41 GMT""}]","2016-08-16"
"cond-mat/0101264","David P. Belanger","J. Satooka, K. Katsumata and D.P. Belanger","Far infrared spectroscopy on the three-dimensional dilute
  antiferromagnet Fe(x)Zn(1-x)F2","10 pages, 3 figures",,"10.1063/1.1358339",,"cond-mat.dis-nn cond-mat.stat-mech",,"  Fourier-transform Infrared (FT-IR) Spectroscopy measurements have been
performed on the three-dimensional dilute antiferromagnet Fe(x)Zn(1-x)F2 with
x=0.99 ~ 0.58 in far infrared (FIR) region. The FIR spectra are analyzed taking
into account the ligand field and the local exchange interaction probability
with J1 ~ J3; |J1|,|J3|<<|J2|, where J1, J2 and J3 are the nearest neighbor,
second nearest neighbor and third nearest neighbor exchange interaction
constants, respectively. The concentration dependence of the FIR spectra at low
temperature is qualitatively well reproduced by our analysis, though some
detailed structure remains unexplained.
","[{""version"":""v1"",""created"":""Wed, 17 Jan 2001 16:48:59 GMT""}]","2009-11-07"
"cond-mat/0101265","Jose Lages","J. Lages, G. Benenti, D. L. Shepelyansky (CNRS, Toulouse and Univ. of
  Insubria, Como)","Disordered Hubbard Model with Attraction: Coupling Energy of Cooper
  Pairs in Small Clusters","revtex, 5 pages, 6 figures","Phys. Rev. B 63, 214516 (2001)","10.1103/PhysRevB.63.214516",,"cond-mat",,"  We generalize the Cooper problem to the case of many interacting particles in
the vicinity of the Fermi level in the presence of disorder. On the basis of
this approach we study numerically the variation of the pair coupling energy in
small clusters as a function of disorder. We show that the Cooper pair energy
is strongly enhanced by disorder, which at the same time leads to the
localization of pairs.
","[{""version"":""v1"",""created"":""Wed, 17 Jan 2001 17:00:33 GMT""}]","2009-11-07"
"cond-mat/0101266","Adan","Adan Garriga, Felix Ritort","Heat transfer and Fourier's law in off-equilibrium systems","7 pages, REVTeX, 4 eps figures","Eur. Phys. J.B, Vol.21, 115 (2001).","10.1007/BF01315082",,"cond-mat.dis-nn cond-mat.stat-mech",,"  We study the most suitable procedure to measure the effective temperature in
off-equilibrium systems. We analyze the stationary current established between
an off-equilibrium system and a thermometer and the necessary conditions for
that current to vanish. We find that the thermometer must have a short
characteristic time-scale compared to the typical decorrelation time of the
glassy system to correctly measure the effective temperature. This general
conclusion is confirmed analyzing an ensemble of harmonic oscillators with
Monte Carlo dynamics as an illustrative example of a solvable model of a glass.
We also find that the current defined allows to extend Fourier's law to the
off-equilibrium regime by consistently defining effective transport
coefficients. Our results for the oscillator model explain why thermal
conductivities between thermalized and frozen degrees of freedom in structural
glasses are extremely small.
","[{""version"":""v1"",""created"":""Wed, 17 Jan 2001 17:29:22 GMT""}]","2015-06-24"
"cond-mat/0101267","Jennifer I. Brand","S. Adenwalla, P. Welsch, A. Harken, J. I. Brand, A. Sezer, and B. W.
  Robertson","Fabrication and Characterization of Boron Carbide / n-Silicon Carbide
  Heterojunction Diodes","8 pages, 2 figures, 1 table",,,,"cond-mat.mtrl-sci",,"  The fabrication, initial structural characterization and diode measurements
are reported for the first boron carbide / silicon carbide heterojunction
diode. Current-voltage curves obtained for operation at temperatures from 24 C
to 388 C. PECVD-deposited undoped boron carbide material is highly crystalline
and consists of a variety of polytypes of B-C with crystal sizes as large as
110 nm. Crystal phases are similar to those for PECVD B-C on Si but only
partially match known boron and boron-rich B-C phases.
","[{""version"":""v1"",""created"":""Wed, 17 Jan 2001 17:51:23 GMT""}]","2007-05-23"
"cond-mat/0101268","Sergey V. Barabash","Sergey V. Barabash and D. Stroud","Negative Magnetoresistance Produced by Hall Fluctuations in a
  Ferromagnetic Domain Structure","3 pages, submitted to Appl. Phys. Lett","Appl. Phys. Lett. 79, 979 (2001).","10.1063/1.1392978",,"cond-mat.mtrl-sci",,"  We present a model for a negative magnetoresistance (MR) that would develop
in a material with many ferromagnetic domains even if the individual domains
have no magnetoresistance and even if there is no boundary resistance. The
negative MR is due to a classical current-distortion effect arising from
spatial variations in the Hall conductivity, combined with a change in domain
structure due to an applied magnetic field. The negative MR can exceed 1000% if
the product of the carrier relaxation time and the internal magnetic field due
to spontaneous magnetization is sufficiently large.
","[{""version"":""v1"",""created"":""Wed, 17 Jan 2001 18:32:12 GMT""},{""version"":""v2"",""created"":""Mon, 16 Apr 2001 19:55:33 GMT""}]","2009-11-07"
"cond-mat/0101269","Simon Bogner","Simon Bogner and Stefan Scheidl","Pinning of stripes in cuprate superconductors","10 pages latex and 3 eps figures","Phys. Rev. B 64, 054517 (2001)","10.1103/PhysRevB.64.054517",,"cond-mat.supr-con cond-mat.stat-mech",,"  We examine the effects of disorder on striped phases in high-temperature
superconductors and related materials. In the presence of quenched disorder,
pinning by the atomic lattice - which might give rise to commensuration effects
- is irrelevant for the stripe array on large length scales. As a consequence,
the stripes have divergent displacement fluctuations and topological defects
are present at all temperatures. Therefore the positional order of the stripe
array is short ranged, with a finite correlation length even at zero
temperature. Thus lock-in phenomena can exist only as crossovers but not as
transitions. In addition, this implies the glassy nature of stripes observed in
recent experiments.
","[{""version"":""v1"",""created"":""Wed, 17 Jan 2001 19:14:40 GMT""}]","2009-11-07"
"cond-mat/0101270","Randall","Igor Bluestein, Randall D. Kamien and T.C. Lubensky","Dislocation Geometry in the TGB-A Phase: Linear Theory","11 pages, 5 included figures, RevTeX","Phys. Rev. E 63 (2001) 061702","10.1103/PhysRevE.63.061702",,"cond-mat.soft cond-mat.supr-con",,"  We demonstrate that an arbitrary system of screw dislocations in a smectic-A
liquid crystal may be consistently treated within harmonic elasticity theory,
provided that the angles between dislocations are sufficiently small. Using
this theory, we calculate the ground state configuration of the TGB-A phase. We
obtain an estimate of the twist-grain-boundary spacing and screw dislocation
spacing in a boundary in terms of the macroscopic parameters, in reasonable
agreement with experimental results.
","[{""version"":""v1"",""created"":""Wed, 17 Jan 2001 21:09:02 GMT""}]","2009-11-07"
"cond-mat/0101271","Gianaurelio Cuniberti","G. Cuniberti, G. Fagas, K. Richter","Conductance of a molecular wire attached to mesoscopic leads: contact
  effects","5 pages, 1 figure, to appear in Acta Physica Polonica B","Acta Phys. Pol. 32, 437-442 (2001)",,"mpi-pks/0011005","cond-mat.mes-hall cond-mat.mtrl-sci",,"  We study linear electron transport through a molecular wire sandwiched
between nanotube leads. We show that the presence of such electrodes strongly
influences the calculated conductance. We find that depending on the quality
and geometry of the contacts between the molecule and the tubular reservoirs,
linear transport can be tuned between an effective Newns spectral behavior and
a more structured one. The latter strongly depends on the topology of the
leads. We also provide analytical evidence for an anomalous behavior of the
conductance as a function of the contact strength.
","[{""version"":""v1"",""created"":""Wed, 17 Jan 2001 21:07:54 GMT""}]","2007-05-23"
"cond-mat/0101272","Keith Slevin","Keith Slevin and Tomi Ohtsuki","Numerical verification of universality for the Anderson transition",,"Physical Review B 63, 45108 (2001)","10.1103/PhysRevB.63.045108",,"cond-mat.dis-nn cond-mat.mes-hall",,"  We analyze the scaling behavior of the higher Lyapunov exponents at the
Anderson transition. We estimate the critical exponent and verify its
universality and that of the critical conductance distribution for box,
Gaussian and Lorentzian distributions of the random potential.
","[{""version"":""v1"",""created"":""Thu, 18 Jan 2001 01:09:11 GMT""}]","2009-11-07"
"cond-mat/0101273","Zheng Weihong","Weihong Zheng and J. Oitmaa (School of Physics, University of New
  South Wales, Sydney NSW, Australia)","Series study of the One-dimensional S-T Spin-Orbital Model","9 pages, 9 figures",,"10.1103/PhysRevB.64.014410",,"cond-mat.str-el cond-mat.stat-mech",,"  We use perturbative series expansions about a staggered dimerized ground
state to compute the ground state energy, triplet excitation spectra and
spectral weight for a one-dimensional model in which each site has an $S=\case
1/2$ spin ${\bf S}_i$ and a pseudospin ${\bf T}_i$, representing a doubly
degenerate orbital. An explicit dimerization is introduced to allow study of
the confinement of spinon excitations. The elementary triplet represents a
bound state of two spinons, and is stable over much of the Brillouine zone. A
special line is found in the gapped spin-liquid phase, on which the triplet
excitation is dispersionless. The formation of triplet bound states is also
investigated.
","[{""version"":""v1"",""created"":""Thu, 18 Jan 2001 03:39:56 GMT""}]","2009-11-07"
"cond-mat/0101274","Diptiman Sen","C. Raghu, Indranil Rudra, Diptiman Sen, S. Ramasesha (Indian Institute
  of Science, Bangalore)","Properties of low-lying states in some high-nuclearity Mn, Fe and V
  clusters: Exact studies of Heisenberg models","Revtex, 12 pages, 16 eps figures; this is the final published version","Phys. Rev. B 64 (2001) 064419","10.1103/PhysRevB.64.064419",,"cond-mat.mes-hall",,"  Using an efficient numerical scheme that exploits spatial symmetries and spin
parity, we have obtained the exact low-lying eigenstates of exchange
Hamiltonians for the high nuclearity spin clusters, Mn_{12}, Fe_8 and V_{15}.
The largest calculation involves the Mn_{12} cluster which spans a Fock space
of a hundred million. Our results show that the earlier estimates of the
exchange constants need to be revised for the Mn_{12} cluster to explain the
level ordering of low-lying eigenstates. In the case of the Fe_8 cluster,
correct level ordering can be obtained which is consistent with the exchange
constants for the already known clusters with butterfly structure. In the
V_{15} cluster, we obtain an effective Hamiltonian that reproduces exactly, the
eight low-lying eigenvalues of the full Hamiltonian.
","[{""version"":""v1"",""created"":""Thu, 18 Jan 2001 04:20:07 GMT""},{""version"":""v2"",""created"":""Tue, 20 May 2003 09:54:02 GMT""}]","2009-11-07"
"cond-mat/0101275","Maxim Olshanii","Maxim Olshanii (1) and Ludovic Pricoupenko (2) ((1) University of
  Southern California, (2) Universite Pierre et Marie Curie)","Rigorous approach to the problem of ultraviolet divergencies in dilute
  Bose gases","RevTex, 4 pages, no figures; identical copy of the published version","Phys. Rev. Lett. 88, 010402 (2002)","10.1103/PhysRevLett.88.010402",,"cond-mat quant-ph",,"  We have found an expression for the full many-body Green's function of N
pairwise finite-range interacting atoms, in a form of a chain fraction
involving two-body T-matrices only, with no explicit presence of the
interaction potentials themselves. We show that in the limit of infinitely
small potential range, this expression reduces to the Green's function for N
atoms interacting via a generalized pseudo-potential, function of a free
parameter \Lambda. Using this \Lambda-freedom we resolve all inconsistensies of
the Hartree-Fock-Bogoliubov formalism known so far, with no ad hoc
modifications of the theory.
","[{""version"":""v1"",""created"":""Thu, 18 Jan 2001 04:57:16 GMT""},{""version"":""v2"",""created"":""Thu, 25 Jan 2001 03:02:43 GMT""},{""version"":""v3"",""created"":""Fri, 11 Jan 2002 21:57:15 GMT""}]","2009-11-07"
"cond-mat/0101276","Tanaka Hidekazu","H. Tanaka, A. Oosawa, T. Kato, H. Uekusa, Y. Ohashi, K. Kakurai, A.
  Hoser","Observation of Field-Induced Transverse N\'{e}el Ordering in the Spin
  Gap System TlCuCl$_3$","4 pages, 5 eps figures, jpsj style",,"10.1143/JPSJ.70.939",,"cond-mat.str-el",,"  Neutron elastic scattering experiments have been performed on the spin gap
system TlCuCl$_3$ in magnetic fields parallel to the $b$-axis. The magnetic
Bragg peaks which indicate the field-induced N\'{e}el ordering were observed
for magnetic field higher than the gap field $H_{\rm g}\approx 5.5$ T at $Q=(h,
0, l)$ with odd $l$ in the $a^*-c^*$ plane. The spin structure in the ordered
phase was determined. The temperature and field dependence of the Bragg peak
intensities and the phase boundary obtained were discussed in connection with a
recent theory which describes the field-induced N\'{e}el ordering as a
Bose-Einstein condensation of magnons.
","[{""version"":""v1"",""created"":""Thu, 18 Jan 2001 05:57:56 GMT""},{""version"":""v2"",""created"":""Fri, 19 Jan 2001 03:04:58 GMT""}]","2009-11-07"
"cond-mat/0101277","Yukio Tanaka","Y. Tanaka, Y. Tanuma (Nagoya Univ.) and S. Kashiwaya (ETL)","Influence of impurity scattering on tunneling conductance in normal
  metal- d -wave superconductor junctions","14 pages, 5 figures",,"10.1103/PhysRevB.64.054510",,"cond-mat.supr-con",,"  Tunneling conductance spectra between a normal metal / d-wave superconductor
junction under the presence of bulk impurities in the superconductor are
studied. The quasiclassical theory has been applied to calculate the spatial
variation of the pair potential and the effect of impurity scattering has been
introduced by t-matrix approximation. The magnitude of a subdominant s-wave
component at the interface is shown to robust against the impurity scattering
while that for a subdominant $d_{xy}$-wave component is largely suppressed with
the increase of the impurity scattering rate. The zero-bias conductance peak
due to the zero-energy Andreev bound states is significantly broadened for the
case of Born limit impurity compared with that of unitary limit impurity.
","[{""version"":""v1"",""created"":""Thu, 18 Jan 2001 05:52:39 GMT""}]","2009-11-07"
"cond-mat/0101278","Sergey Matveenko","S. I. Matveenko (Landau Institute) and S. A. Brazovskii (LPTMS, Orsay)","A theory of the subgap photoemission in one - dimensional electron -
  phonon systems. An instanton approach to pseudogaps","RevTex, 17 pages, 3 Postscript figures, added a theory of ARPES",,"10.1103/PhysRevB.65.245108",,"cond-mat.str-el",,"  For a one-dimensional electron-phonon system we consider the photon
absorption involving electronic excitations within the pseudogap energy range.
Within the adiabatic approximation for the electron - phonon interactions these
processes are described by nonlinear configurations of an instanton type. We
calculate intensities of the photoelectron spectroscopy PES including the
momentum resolved one ARPES and supplement to known results for the optical
subgap absorption. We start with the generic case of a one dimensional
semiconductor with pronounced polaronic effect. In details we consider the
Peierls model for a half-filled band of electrons coupled to the lattice which
describes the polyacethylene and some commensurate Charge Density Waves.
Particular attention was required for studies of momentum dependencies for the
ARPES where we face an intriguing interference between the time evolution and
the translational motion of the instantons.
","[{""version"":""v1"",""created"":""Thu, 18 Jan 2001 09:40:09 GMT""},{""version"":""v2"",""created"":""Mon, 7 Jan 2002 12:28:10 GMT""}]","2009-11-07"
"cond-mat/0101279","Castelnovo","Martin Castelnovo, Jean-Francois Joanny","Complexation between oppositely charged polyelectrolytes: beyond the
  Random Phase Approximation","18 pages, 4 figures. Submitted to EPJ-E",,,,"cond-mat.soft",,"  We consider the phase behavior of polymeric systems by calculating the
structure factors beyond the Random Phase Approximation. The effect of this
correction to the mean-field RPA structure factor is shown to be important in
the case of coulombic systems. Two examples are given: simple electrolytes and
mixtures of incompatible oppositely charged polyelectrolytes. In this last
case, all former studies predicted an enhancement of compatibility for
increasing charge densities; we also describe the complexation transition
between the polyelectrolytes. We determine a phase diagram of the
polyelectrolyte mixture that includes both complexation and incompatibility.
","[{""version"":""v1"",""created"":""Thu, 18 Jan 2001 10:09:48 GMT""},{""version"":""v2"",""created"":""Thu, 5 Apr 2001 16:03:07 GMT""}]","2007-05-23"
"cond-mat/0101280","Markus Bernhard Zoelfl","M.B. Z\""olfl, I.A. Nekrasov, Th. Pruschke, V.I. Anisimov, and J.
  Keller","The spectral and magnetic properties of $\alpha$- and $\gamma$-Ce from
  the Dynamical Mean-Field Theory and Local Density Approximation","7 pages, 4 figures",,"10.1103/PhysRevLett.87.276403",,"cond-mat.str-el",,"  We have calculated ground state properties and excitation spectra for Ce
metal with the {\it ab initio} computational scheme combining local density
approximation and dynamical mean-field theory (LDA+DMFT). We considered all
electronic states, i.e. correlated f-states and non-correlated s-, p- and
d-states. The strong local correlations (Coulomb interaction) among the
f-states lead to typical many-body resonances in the partial f-density, such as
lower and upper Hubbard band. Additionally the well known Kondo resonance is
observed. The s-, p- and d-densities show small to mediate renormalization
effects due to hybridization. We observe different Kondo temperatures for
$\alpha$- and $\gamma$-Ce ($T_{K,\alpha}\approx 1000 K$ and
$T_{K,\gamma}\approx 30 K$), due to strong volume dependence of the effective
hybridization strength for the localized f-electrons. Finally we compare our
results with a variety of experimental data, i.e. from photoemission
spectroscopy (PES), inverse photoemission spectroscopy (BIS), resonant inverse
photoemission spectroscopy (RIPES) and magnetic susceptibility measurements.
","[{""version"":""v1"",""created"":""Thu, 18 Jan 2001 10:17:19 GMT""}]","2009-11-07"
"cond-mat/0101281","D. H. E. Gross","D.H.E.Gross","Second Law of Thermodynamics, Macroscopic Observables within Boltzmann's
  Principle but without Thermodynamic Limit","Latex,2 figures, 7 pages",,,,"cond-mat.stat-mech nlin.CD nucl-th",,"  Boltzmann's principle S=k ln W allows to extend equilibrium thermo-statistics
to ``Small'' systems without invoking the thermodynamic limit. The clue is to
base statistical probability on ensemble averaging and not on time averaging.
It is argued that due to the incomplete information obtained by macroscopic
measurements thermodynamics handles ensembles or finite-sized sub-manifolds in
phase space and not single time-dependent trajectories. Therefore, ensemble
averages are the natural objects of statistical probabilities. This is the
physical origin of coarse-graining which is not anymore a mathematical ad hoc
assumption. From this concept all equilibrium thermodynamics can be deduced
quite naturally including the most sophisticated phenomena of phase transitions
for ``Small'' systems. Boltzmann's principle is generalized to non-equilibrium
Hamiltonian systems with possibly fractal distributions ${\cal{M}}$ in 6N-dim.
phase space by replacing the conventional Riemann integral for the volume in
phase space by its corresponding box-counting volume. This is equal to the
volume of the closure $\bar{\cal{M}}$. With this extension the Second Law is
derived without invoking the thermodynamic limit. The irreversibility in this
approach is due to the replacement of the phase-space volume by the volume of
its closure $\bar{\cal{M}}$. The physical reason for this replacement is that
macroscopic measurements cannot distinguish ${\cal{M}}$ from $\bar{\cal{M}}$.
Whereas the former is not changing in time due to Liouville's theorem, the
volume of the closure can be larger. In contrast to conventional coarse
graining the box-counting volume is defined in the limit of infinite
resolution. I.e. there is no artificial loss of information.
","[{""version"":""v1"",""created"":""Thu, 18 Jan 2001 11:03:24 GMT""}]","2007-05-23"
"cond-mat/0101282","Roser Valenti","R. Valenti (1), T. Saha-Dasgupta (2), J.V. Alvarez (1), K. Pozgajcic
  (1), and C. Gros(1) ((1) University des Saarlandes, Theor. Physics, Germany,
  (2) Bose Nat. Lab., Kolkata, India)","Modeling the electronic behavior of $\gamma$-LiV2O5: a microscopic study","Final version. To appear in Phys. Rev. Lett","Phys. Rev. Lett., 86 (2001) 5381","10.1103/PhysRevLett.86.5381",,"cond-mat",,"  We determine the electronic structure of the one-dimensional spin-1/2
Heisenberg compound $\gamma$-LiV$_2$O$_5$, which has two inequivalent vanadium
ions, V(1) and V(2), via density-functional calculations. We find a relative
V(1)-V(2) charge ordering of roughly $70:30$. We discuss the influence of the
charge ordering on the electronic structure and the magnetic behavior. We give
estimates of the basic hopping matrix elements and compare with the most
studied $\alpha '$-NaV$_2$O$_5$.
","[{""version"":""v1"",""created"":""Thu, 18 Jan 2001 11:08:55 GMT""},{""version"":""v2"",""created"":""Mon, 12 Feb 2001 11:36:20 GMT""},{""version"":""v3"",""created"":""Fri, 6 Apr 2001 10:11:13 GMT""}]","2009-11-07"
