"astro-ph/0101451","Jens C. Niemeyer","J.C. Niemeyer and R. Parentani","Trans-Planckian dispersion and scale-invariance of inflationary
  perturbations","4 pages; v.2: minor modifications, added references","Phys.Rev. D64 (2001) 101301","10.1103/PhysRevD.64.101301",,"astro-ph gr-qc hep-th",,"  We investigate the insensitivity of the predictions of inflationary models
with respect to modifications of Planck energy physics. The modification we
consider consists in replacing the usual dispersion relation by nonlinear ones.
This way of addressing the problem has recently recieved attention and
contradictory results were found. Our main result is to show that the
adiabaticity of the mode propagation and the separation of two scales of
interest, the Planck scale and the cosmological horizon scale, are sufficient
conditions for the predictions to be unchanged. We then show that almost all
models satisfy the first condition if the second is met. Therefore the
introduction of a nonlinear dispersion is unlikely to have any discernable
effects on the power spectrum of cosmological perturbations.
","[{""version"":""v1"",""created"":""Thu, 25 Jan 2001 15:51:33 GMT""},{""version"":""v2"",""created"":""Fri, 2 Feb 2001 10:41:27 GMT""}]","2009-11-06"
"astro-ph/0101452","Hale Bradt","Hale Bradt & Ronald A. Remillard","An All-sky Advanced X-ray Monitor (AXM) Mission","Proceedings of ""X-ray Astronomy 2000"", Sept. 2000, Palermo Italy,
  Eds. Riccardo Giacconi, Luigi Stella & Salvatore Serio, PASP Conference
  Series. 6 pages, 4 figures",,,,"astro-ph",,"  A concept for an all-sky monitor mission substantially more powerful than the
RXTE ASM is presented in brief. It makes use of 31 Gas Electron Multiplier
(GEM) proportional counters to provide continuous monitoring of the entire
x-ray sky, except for earth occultations and a small region around the sun.
This coverage would allow the study of a wide variety of short duration cosmic
outbursts. At time scales longer than a few minutes, the sensitivity for the
monitoring of x-ray sources (1.5 - 15 keV) would be greatly improved over the
RXTE ASM, a factor of 6 in one day. This mission concept, the Advanced X-ray
Monitor (AXM), is described in more detail in Remillard et al. (2000).
","[{""version"":""v1"",""created"":""Thu, 25 Jan 2001 15:54:41 GMT""}]","2007-05-23"
"cond-mat/0101363","Antonio C. Cancio","A. C. Cancio, M. Y. Chou, and Randolph Q. Hood","Comparative study of density functional theories of the
  exchange-correlation hole and energy in silicon","16 pages, 5 figures, RevTeX, added content",,"10.1103/PhysRevB.64.115112",,"cond-mat.mtrl-sci",,"  We present a detailed study of the exchange-correlation hole and
exchange-correlation energy per particle in the Si crystal as calculated by the
Variational Monte Carlo method and predicted by various density functional
models. Nonlocal density averaging methods prove to be successful in correcting
severe errors in the local density approximation (LDA) at low densities where
the density changes dramatically over the correlation length of the LDA hole,
but fail to provide systematic improvements at higher densities where the
effects of density inhomogeneity are more subtle. Exchange and correlation
considered separately show a sensitivity to the nonlocal semiconductor crystal
environment, particularly within the Si bond, which is not predicted by the
nonlocal approaches based on density averaging. The exchange hole is well
described by a bonding orbital picture, while the correlation hole has a
significant component due to the polarization of the nearby bonds, which
partially screens out the anisotropy in the exchange hole.
","[{""version"":""v1"",""created"":""Wed, 24 Jan 2001 23:29:21 GMT""},{""version"":""v2"",""created"":""Thu, 17 May 2001 20:59:23 GMT""}]","2009-11-07"
"cond-mat/0101375","Wolfgang Haeusler","Wolfgang H\""ausler (Universit\""at Hamburg, Germany)","Rashba precession in quantum wires with interaction","now replaced by published version","Phys. Rev. B 63, 121310 (2001)","10.1103/PhysRevB.63.121310",,"cond-mat.mes-hall",,"  Rashba precession of spins moving along a one-dimensional quantum channel is
calculated, accounting for Coulomb interactions. The Tomonaga--Luttinger model
is formulated in the presence of spin-orbit scattering and solved by
Bosonization. Increasing interaction strength at decreasing carrier density is
found to {\sl enhance} spin precession and the nominal Rashba parameter due to
the decreasing spin velocity compared with the Fermi velocity. This result can
elucidate the observed pronounced changes of the spin splitting on applied gate
voltages which are estimated to influence the interface electric field in
heterostructures only little.
","[{""version"":""v1"",""created"":""Wed, 24 Jan 2001 16:25:47 GMT""},{""version"":""v2"",""created"":""Fri, 2 Nov 2001 21:24:08 GMT""}]","2009-11-07"
"cond-mat/0101376","A. Crepieux","A. Cr\'epieux and P. Bruno","Theory of the anomalous Hall effect from the Kubo formula and the Dirac
  equation",,"Phys. Rev. B 64, 014416 (2001)","10.1103/PhysRevB.64.014416",,"cond-mat",,"  A model to treat the anomalous Hall effect is developed. Based on the Kubo
formalism and on the Dirac equation, this model allows the simultaneous
calculation of the skew-scattering and side-jump contributions to the anomalous
Hall conductivity. The continuity and the consistency with the
weak-relativistic limit described by the Pauli Hamiltonian is shown. For both
approaches, Dirac and Pauli, the Feynman diagrams, which lead to the
skew-scattering and the side-jump contributions, are underlined. In order to
illustrate this method, we apply it to a particular case: a ferromagnetic bulk
compound in the limit of weak-scattering and free-electrons approximation.
Explicit expressions for the anomalous Hall conductivity for both
skew-scattering and side-jump mechanisms are obtained. Within this model, the
recently predicted ''spin Hall effect'' appears naturally.
","[{""version"":""v1"",""created"":""Wed, 24 Jan 2001 16:12:54 GMT""},{""version"":""v2"",""created"":""Fri, 16 Mar 2001 14:52:53 GMT""},{""version"":""v3"",""created"":""Thu, 16 Aug 2001 08:16:29 GMT""}]","2009-11-07"
"cond-mat/0101377","Gerd Sauermann","G. Sauermann, K. Kroy and H. J. Herrmann","A Continuum Saltation Model for Sand Dunes","11 pages, 7 figures",,"10.1103/PhysRevE.64.031305",,"cond-mat.mtrl-sci",,"  We derive a phenomenological continuum saltation model for aeolian sand
transport that can serve as an efficient tool for geomorphological
applications. The coupled differential equations for the average density and
velocity of sand in the saltation layer reproduce both known equilibrium
relations for the sand flux and the time evolution of the sand flux as
predicted by microscopic saltation models. The three phenomenological
parameters of the model are a reference height for the grain-air interaction,
an effective restitution coefficient for the grain-bed interaction, and a
multiplication factor characterizing the chain reaction caused by the impacts
leading to a typical time or length scale of the saturation transients. We
determine the values of these parameters by comparing our model with wind
tunnel measurements. Our main interest are out of equilibrium situations where
saturation transients are important, for instance at phase boundaries
(ground/sand) or under unsteady wind conditions. We point out that saturation
transients are indispensable for a proper description of sand flux over
structured terrain, by applying the model to the windward side of an isolated
dune, thereby resolving recently reported discrepancies between field
measurements and theoretical predictions.
","[{""version"":""v1"",""created"":""Wed, 24 Jan 2001 16:59:44 GMT""},{""version"":""v2"",""created"":""Mon, 29 Jan 2001 16:27:53 GMT""}]","2009-11-07"
"cond-mat/0101378","Enrique Abad","E. Abad, P. Grosfils and G. Nicolis","Nonlinear reactive systems viewed as Boolean dynamical systems","30 pages, 9 figures","Phys. Rev. E63, 041102","10.1103/PhysRevE.63.041102",,"cond-mat.stat-mech",,"  We present a stochastic, time-discrete boolean model which mimics the
mesoscopic dynamics of the desorption reactions $A+A\to A+S$ and $A+A\to S+S$
in a 1D lattice. In the continuous-time limit, we derive a hierarchy of
dynamical equations for the subset of moments involving contiguous lattice
sites. The solution of the hierarchy allows to compute the exact dynamics of
the mean coverage for both microscopic and coarse-grained initial conditions,
which turn out to be different from the mean field predictions. The evolution
equations for the mean coverage and the second order moments are shown to be
equivalent to those provided by a time-continuous Master equation. The
important role of higher order fluctuations is brought out by the failure of a
truncation scheme retaining only two-particle fluctuation correlations.
","[{""version"":""v1"",""created"":""Wed, 24 Jan 2001 18:09:33 GMT""},{""version"":""v2"",""created"":""Thu, 25 Jan 2001 13:25:18 GMT""}]","2009-11-07"
"cond-mat/0101379","Maziar Nekovee","Maziar Nekovee and Peter V. Coveney","Lattice-Boltzmann simulations of self-assembly of a binary amphiphilic
  fluid into ordered bicontinuous cubic and lamellar phases","2 pages, 2 figures",,,,"cond-mat.soft cond-mat.stat-mech",,"  We report the first results of our three-dimensional, mesoscopic, amphiphilic
lattice-Boltzmann model, which has been used to simulate the dynamics of
self-assembly of ordered cubic and lamellar phases in binary water-surfactant
systems. Our results provide insight into the mechanism of ordering of such
mesophases in terms of various molecular forces acting between water and
surfactant molecules and the mechanism driving the transition from the lamellar
to the cubic phase.
","[{""version"":""v1"",""created"":""Wed, 24 Jan 2001 18:46:53 GMT""}]","2007-05-23"
"cond-mat/0101380","Klaus Kroy","Klaus Kroy, Gerd Sauermann, and Hans J. Herrmann","Minimal Model for Sand Dunes","4 pages, 4 figures, replaced with publishd version","Phys. Rev. Lett. 88, 054301 (2002)","10.1103/PhysRevLett.88.054301",,"cond-mat.soft physics.geo-ph",,"  We propose a minimal model for aeolian sand dunes. It combines an analytical
description of the turbulent wind velocity field above the dune with a
continuum saltation model that allows for saturation transients in the sand
flux. The model provides a qualitative understanding of important features of
real dunes, such as their longitudinal shape and aspect ratio, the formation of
a slip face, the breaking of scale invariance, and the existence of a minimum
dune size.
","[{""version"":""v1"",""created"":""Wed, 24 Jan 2001 20:12:12 GMT""},{""version"":""v2"",""created"":""Sat, 2 Mar 2002 20:56:05 GMT""}]","2009-11-07"
"cond-mat/0101381","Ronald Dickman","Ronald Dickman, Mikko Alava, Miguel A. Munoz, Jarkko Peltola,
  Alessandro Vespignani, and Stefano Zapperi","Critical behavior of a one-dimensional fixed-energy stochastic sandpile","15 pages, 11 figures","Phys. Rev. E64, 056104 (2001)","10.1103/PhysRevE.64.056104",,"cond-mat.stat-mech",,"  We study a one-dimensional fixed-energy version (that is, with no input or
loss of particles), of Manna's stochastic sandpile model. The system has a
continuous transition to an absorbing state at a critical value $\zeta_c$ of
the particle density. Critical exponents are obtained from extensive
simulations, which treat both stationary and transient properties. In contrast
with other one-dimensional sandpiles, the model appears to exhibit finite-size
scaling, though anomalies exist in the scaling of relaxation times and in the
approach to the stationary state. The latter appear to depend strongly on the
nature of the initial configuration. The critical exponents differ from those
expected at a linear interface depinning transition in a medium with point
disorder, and from those of directed percolation.
","[{""version"":""v1"",""created"":""Wed, 24 Jan 2001 21:05:14 GMT""}]","2009-11-07"
"cond-mat/0101382","Jorge Simoes de Sa Martins","Paul B. Rundle, John B. Rundle, Kristy F. Tiampo, Jorge S. Sa Martins,
  Seth McGinnis, W. Klein","Nonlinear Network Dynamics on Earthquake Fault Systems","12 pages, 4 figures",,"10.1103/PhysRevLett.87.148501",,"cond-mat.stat-mech cond-mat.dis-nn",,"  Earthquake faults occur in networks that have dynamical modes not displayed
by single isolated faults. Using simulations of the network of strike-slip
faults in southern California, we find that the physics depends critically on
both the interactions among the faults, which are determined by the geometry of
the fault network, as well as on the stress dissipation properties of the
nonlinear frictional physics, similar to the dynamics of integrate-and-fire
neural networks.
","[{""version"":""v1"",""created"":""Wed, 24 Jan 2001 22:02:20 GMT""}]","2009-11-07"
"cond-mat/0101383","Sohrab Ismail-Beigi","Sohrab Ismail-Beigi, Eric K. Chang, Steven G. Louie","Coupling of Nonlocal Potentials to Electromagnetic Fields","1 figure, 1 table",,"10.1103/PhysRevLett.87.087402",,"cond-mat.mtrl-sci",,"  Nonlocal Hamiltonians are used widely in first-principles quantum
calculations; the nonlocality stems from eliminating undesired degrees of
freedom, e.g. core electrons. To date, attempts to couple nonlocal systems to
external electromagnetic (EM) fields have been heuristic or limited to weak or
long wavelength fields. Using Feynman path integrals, we derive an exact,
closed-form coupling of arbitrary EM fields to nonlocal systems. Our results
justify and clarify the couplings used to date and are essential for systematic
computation of linear and especially nonlinear response.
","[{""version"":""v1"",""created"":""Wed, 24 Jan 2001 22:15:51 GMT""},{""version"":""v2"",""created"":""Tue, 15 May 2001 20:57:38 GMT""},{""version"":""v3"",""created"":""Wed, 20 Jun 2001 07:06:02 GMT""}]","2009-11-07"
"cond-mat/0101386","Chiara Fort","C. Fort, P. Maddaloni, F. Minardi, M. Modugno and M. Inguscio","Spatial interference of coherent atomic waves by manipulation of the
  internal quantum state",,"Optics Letters 26, 1039 (2001)","10.1364/OL.26.001039",,"cond-mat.soft",,"  A trapped 87Rb Bose-Einstein condensate is initially put into a superposition
of two internal states. Under the effect of gravity and by means of a second
transition, we prepare two vertically displaced condensates in the same
internal state. These constitute two coherent sources of matter waves with
adjustable spatial separation. Fringe patterns, observed after free expansion,
are associated with the interplay between internal and external degrees of
freedom and substantially agree with those for a double slit experiment.
","[{""version"":""v1"",""created"":""Thu, 25 Jan 2001 08:41:26 GMT""}]","2015-02-27"
"cond-mat/0101387","Kent B. Lauritsen","P. Frojdh, M. Howard, K. B. Lauritsen","Directed Percolation and Systems with Absorbing States: Impact of
  Boundaries","37 pages (including figures); journal-ref + ref added","Int. J. Mod. Phys. B 15, 1761-1797 (2001)","10.1142/S0217979201004526",,"cond-mat.stat-mech",,"  We review the critical behavior of nonequilibrium systems, such as directed
percolation (DP) and branching-annihilating random walks (BARW), which possess
phase transitions into absorbing states. After reviewing the bulk scaling
behavior of these models, we devote the main part of this review to analyzing
the impact of walls on their critical behavior. We discuss the possible
boundary universality classes for the DP and BARW models, which can be
described by a general scaling theory which allows for two independent surface
exponents in addition to the bulk critical exponents. Above the upper critical
dimension $d_c$, we review the use of mean field theories, whereas in the
regime $d<d_c$, where fluctuations are important, we examine the application of
field theoretic methods. Of particular interest is the situation in $d=1$,
which has been extensively investigated using numerical simulations and series
expansions. Although DP and BARW fit into the same scaling theory, they can
still show very different surface behavior: for DP some exponents are
degenerate, a property not shared with the BARW model. Moreover, a ``hidden''
duality symmetry of BARW in $d=1$ is broken by the boundary and this relates
exponents and boundary conditions in an intricate way.
","[{""version"":""v1"",""created"":""Thu, 25 Jan 2001 08:46:32 GMT""},{""version"":""v2"",""created"":""Mon, 23 Jul 2001 08:59:35 GMT""}]","2009-11-07"
"cond-mat/0101388","Andras Suto","J. L. van Hemmen and A. Suto","Semiclassical quantization and resonance in spin tunnelling","15 pages, 2 eps figures","J.Phys. A: Math. Gen. 31 (1998) 10029-43 and ibid. 32 (1999) 4321",,,"cond-mat.mes-hall",,"  We derive a semiclassical quantization for a spin, study it for not too small
a spin quantum number (S>5), and compute the 2S+1 eigenvalues of a Hamiltonian
exhibiting resonant tunnelling as the magnetic field parallel to the anisotropy
axis is increased. Special attention is paid to the resonance condition. As a
corollary we prove that semiclassical quantization and quantum-mechanical
perturbation theory agree there where they should.
","[{""version"":""v1"",""created"":""Thu, 25 Jan 2001 09:52:08 GMT""}]","2007-05-23"
"cond-mat/0101389","Vitalii Dugaev","V. I. Litvinov, V. K. Dugaev","Ferromagnetism in magnetically doped III-V semiconductors","4 pages with 3 figures",,"10.1103/PhysRevLett.86.5593",,"cond-mat.mtrl-sci",,"  The origin of ferromagnetism in semimagnetic III-V materials is discussed.
The indirect exchange interaction caused by virtual electron excitations from
magnetic impurity level in the bandgap to the valence band can explain
ferromagnetism in GaAs(Mn) no matter samples are degenerated or not. Formation
of ferromagnetic clusters and percolation picture of phase transition describes
well all available experimental data and allows to predict the Mn-composition
dependence of transition temperature in wurtzite (Ga,In,Al)N epitaxial layers.
","[{""version"":""v1"",""created"":""Thu, 25 Jan 2001 09:52:32 GMT""}]","2009-11-07"
"cond-mat/0101391","Mircea Crisan","M. Crisan, D. Bodea, I. Grosu, and I. Tifrea","Renormalization - group analysis of dilute Bose system in d - dimension
  at finite temperature","18 pages",,"10.1088/0305-4470/35/2/305",,"cond-mat",,"  We study the d - dimensional Bose gas at finite temperature using the
renormalization group method. The flow - equations and the free energy have
been obtained for dimension d, and the cases d<2 and d=2 have been analysed in
the limit of low and high temperatures. The critical temperature, the coherence
length and the specific heat of a two dimensional Bose gas have been obtained
using a solution for the coupling constant which does not present a singular
behavior.
","[{""version"":""v1"",""created"":""Thu, 25 Jan 2001 10:36:37 GMT""}]","2009-11-07"
"cond-mat/0101392","Mircea Crisan","I. Grosu, D. Bodea and M. Crisan","Specific heat of a Fermi system near ferromagnetic quantum phase
  transition","14 pages",,,,"cond-mat",,"  We calculate the specific heat for an interacting Fermi system near the
ferromagnetic phase transition using the Renormalization Group method. The
temperature dependence of the specific heat present for dimension D=3 a
logarithmic dependence which shows that the fermionic excitations reaches a non
- Fermi behavior. The result is in good agreement with the experimental data
obtained recently for $Ni_x Pd_{1-x}$ alloys.
","[{""version"":""v1"",""created"":""Thu, 25 Jan 2001 10:40:01 GMT""}]","2007-05-23"
"cond-mat/0101393","Kajari Kargupta","K. Kargupta (I.I.T., Kanpur) and A. Sharma (I.I.T., Kanpur)","Templeting of Thin Films Induced by Dewetting on Patterned Surfaces","5 pages TeX (REVTeX 4), other comments: submitted to Phys. Rev.Lett",,"10.1103/PhysRevLett.86.4536",,"cond-mat.soft",,"  The instability, dynamics and morphological transitions of patterns in thin
liquid films on periodic striped surfaces (consisting of alternating less and
more wettable stripes) are investigated based on 3-D nonlinear simulations that
account for the inter-site hydrodynamic and surface-energetic interactions. The
film breakup is suppressed on some potentially destabilizing nonwettable sites
when their spacing is below a characteristic lengthscale of the instability,
the upper bound for which is close to the spinodal lengthscale. The thin film
pattern replicates the substrate surface energy pattern closely only when, (a)
the periodicity of substrate pattern matches closely with the characteristic
lengthscale, and (b) the stripe-width is within a range bounded by a lower
critical length, below which no heterogeneous rupture occurs, and an upper
transition length above which complex morphological features bearing little
resemblance to the substrate pattern are formed.
","[{""version"":""v1"",""created"":""Thu, 25 Jan 2001 11:02:23 GMT""}]","2009-11-07"
"cond-mat/0101395","Adelchi Fabrocini","A.Fabrocini and A.Polls","Bose-Einstein Condensates in the Large Gas Parameter Regime","4 LaTeX pages, 2 figures",,"10.1103/PhysRevA.64.063610",,"cond-mat.soft",,"  Bose-Einstein condensates of 10$^4$ $^{85}$Rb atoms in a cylindrical trap are
studied using a recently proposed modified Gross-Pitaevskii equation. The
existence of a Feshbach resonance allows for widely tuning the scattering
length of the atoms, and values of the peak gas parameter, $x_{pk}$, of the
order of 10$^{-2}$ can be attained. We find large differences between the
results of the modified Gross-Pitaevskii and of the standard Thomas-Fermi, and
Gross-Pitaevskii equations in this region. The column densities at $z=0$ may
differ by as much as $\sim 30%$ and the half maximum radius by $\sim 20%$. The
scattering lengths estimated by fitting the half maximum radius within
different approaches can differ by $\sim 40%$.
","[{""version"":""v1"",""created"":""Thu, 25 Jan 2001 14:43:28 GMT""}]","2009-11-07"
"cond-mat/0101396","Vito Latora","Vito Latora and Massimo Marchiori","Efficient Behavior of Small-World Networks","1 figure, 2 tables. Revised version. Accepted for publication in
  Phys. Rev. Lett",,"10.1103/PhysRevLett.87.198701",,"cond-mat",,"  We introduce the concept of efficiency of a network, measuring how
efficiently it exchanges information. By using this simple measure small-world
networks are seen as systems that are both globally and locally efficient. This
allows to give a clear physical meaning to the concept of small-world, and also
to perform a precise quantitative a nalysis of both weighted and unweighted
networks. We study neural networks and man-made communication and
transportation systems and we show that the underlying general principle of
their construction is in fact a small-world principle of high efficiency.
","[{""version"":""v1"",""created"":""Thu, 25 Jan 2001 15:02:18 GMT""},{""version"":""v2"",""created"":""Fri, 12 Oct 2001 16:50:30 GMT""}]","2009-11-07"
"cs/0101026","Peter Gacs","Peter Gacs","Deterministic computations whose history is independent of the order of
  asynchronous updating",,,,,"cs.DC cs.CC",,"  Consider a network of processors (sites) in which each site x has a finite
set N(x) of neighbors. There is a transition function f that for each site x
computes the next state \xi(x) from the states in N(x). But these transitions
(updates) are applied in arbitrary order, one or many at a time. If the state
of site x at time t is \eta(x,t) then let us define the sequence \zeta(x,0),
\zeta(x,1), ... by taking the sequence \eta(x,0), \eta(x,1), ..., and deleting
repetitions. The function f is said to have invariant histories if the sequence
\zeta(x,i), (while it lasts, in case it is finite) depends only on the initial
configuration, not on the order of updates.
  This paper shows that though the invariant history property is typically
undecidable, there is a useful simple sufficient condition, called
commutativity: For any configuration, for any pair x,y of neighbors, if the
updating would change both \xi(x) and \xi(y) then the result of updating first
x and then y is the same as the result of doing this in the reverse order.
","[{""version"":""v1"",""created"":""Wed, 24 Jan 2001 20:33:21 GMT""}]","2007-05-23"
"gr-qc/0101096","Masayuki Tanimoto","Masayuki Tanimoto","Symmetries of the Gowdy Equations and Spatial Topologies","6 pages, 2 figures, LaTeX. To appear in the proceedings of JGRG10,
  Osaka, Sept. 11-14, 2000",,,,"gr-qc",,"  We examine some kinds of discrete symmetries which are dynamically preserved,
using the (generalized) Gowdy models of the first kind.
","[{""version"":""v1"",""created"":""Thu, 25 Jan 2001 14:49:21 GMT""}]","2007-05-23"
