"hep-ex/0101041","Sergei Gninenko","NOMAD Collaboration, P. Astier, et al","Search for heavy neutrinos mixing with tau neutrinos","20 pages, 7 figures, a few comments added","Phys.Lett.B506:27-38,2001","10.1016/S0370-2693(01)00362-8","CERN-EP/2001-005","hep-ex",,"  We report on a search for heavy neutrinos ($\nus$) produced in the decay
$D_s\to \tau \nus$ at the SPS proton target followed by the decay $\nudecay$ in
the NOMAD detector. Both decays are expected to occur if $\nus$ is a component
of $\nu_{\tau}$.\
  From the analysis of the data collected during the 1996-1998 runs with
$4.1\times10^{19}$ protons on target, a single candidate event consistent with
background expectations was found. This allows to derive an upper limit on the
mixing strength between the heavy neutrino and the tau neutrino in the $\nus$
mass range from 10 to 190 $\rm MeV$. Windows between the SN1987a and Big Bang
Nucleosynthesis lower limits and our result are still open for future
experimental searches. The results obtained are used to constrain an
interpretation of the time anomaly observed in the KARMEN1 detector.\
","[{""version"":""v1"",""created"":""Wed, 24 Jan 2001 17:26:58 GMT""},{""version"":""v2"",""created"":""Mon, 19 Mar 2001 12:26:51 GMT""}]","2008-11-26"
"hep-ex/0101042","Ralf Prigl","R. Prigl, Muon g-2 Collaboration","Status of the BNL Muon g-2 Experiment","9 pages, 5 figures, contribution to the proceedings of RADCOR2000,
  the 5th International Symposium on Radiative Corrections, Carmel (USA), 11-15
  September, 2000",,,,"hep-ex",,"  The muon g-2 experiment at Brookhaven has been taking data since 1997.
Analyses of the data taken in 1997 and 1998, which include about 2% of the data
taken so far, have improved the experimental accuracy in the muon anomalous
magnetic moment to a(mu,expt) = 1 165 921(5) x 10**(-9) (4 ppm). The value
agrees with standard theory. Analysis of the 1999 data, about 25% of the
existing data set, is nearing completion and analysis of the 2000 data has
started. The experiment is preparing for another major data taking run, this
time storing negative instead of positive muon beams.
","[{""version"":""v1"",""created"":""Wed, 24 Jan 2001 21:44:07 GMT""}]","2007-05-23"
"hep-ex/0101043","Zurab Silagadze","M.N. Achasov, K.I. Beloborodov, A.V. Berdyugin, A.V. Bozhenok, A.G.
  Bogdanchikov, D.A. Bukin, S.V. Burdin, T.V. Dimova, A.A. Drozdetsky, V.P.
  Druzhinin, D.I. Ganyushin, V.B. Golubev, V.N. Ivanchenko, I.A. Koop, A.A.
  Korol, S.V. Koshuba, A.V. Otboev, E.V. Pakhtusova, A.A. Salnikov, V.V. Shary,
  S.I. Serednyakov, Yu.M. Shatunov, V.A. Sidorov, Z.K. Silagadze, A.G.
  Skripkin, A.A. Valishev, A.V. Vasiljev and Yu.S. Velikzhanin","Search for the radiative decay $\eta \to \pi^0 \gamma \gamma$ in the SND
  experiment at VEPP-2M","24 pages, 6 figures, LaTex. To be published in Nucl. Phys. B","Nucl.Phys.B600:3-20,2001","10.1016/S0550-3213(01)00040-2",,"hep-ex hep-ph",,"  The $\eta \to \pi^0 \gamma \gamma$ decay was investigated by the SND detector
at VEPP-2M $e^+e^-$ collider in the reaction $e^+e^-\to\phi\to \eta\gamma$.
Here we present the results and some details of this study. We report an upper
limit (90% c.l.) $Br(\eta \to \pi^0 \gamma \gamma)<8.4\times 10^{-4}$ as our
final result. Our upper limit does not contradict the earlier measurement by
GAMS spectrometer. To facilitate future studies a rather detailed review of the
problem is also given.
","[{""version"":""v1"",""created"":""Thu, 25 Jan 2001 08:22:09 GMT""}]","2008-11-26"
"hep-ex/0101044","McPherson","The OPAL collaboration, G. Abbiendi, et al","A Simultaneous Measurement of the QCD Colour Factors and the Strong
  Coupling","29 pages, 4 figures, Submitted to Eur. Phys. J. C","Eur.Phys.J.C20:601-615,2001","10.1007/s100520100699","CERN-EP-2001-001","hep-ex",,"  Using data from e+e- annihilation into hadrons, taken with the OPAL detector
at LEP at the Z pole between 1991 and 1995, we performed a simultaneous
measurement of the colour factors of the underlying gauge group of the strong
interaction, CF and CA, and the strong coupling, alpha(s). The measurement was
carried out by fitting next-to-leading order perturbative predictions to
measured angular correlations of 4-jet events together with multi-jet related
variables. Our results,
  CA = 3.02 +/- 0.25 (stat.) +/- 0.49 (syst.),
  CF = 1.34 +/- 0.13 (stat.) +/- 0.22 (syst.), alpha(s)(M_Z) = 0.120 +/- 0.011
(stat.) +/- 0.020 (syst.), provide a test of perturbative QCD in which the only
assumptions are non-abelian gauge symmetry and standard hadronization models.
The measurements are in agreement with SU(3) expectations for CF and CA and the
world average of alpha(s)(M_Z).
","[{""version"":""v1"",""created"":""Thu, 25 Jan 2001 09:21:39 GMT""}]","2008-11-07"
"hep-ex/0101045","McPherson","The OPAL collaboration, G. Abbiendi, et al","A Search for a Narrow Radial Excitation of the D*+/- Meson","20 pages, 6 figures, Accepted by Eur. Phys. J. C","Eur.Phys.J.C20:445-454,2001","10.1007/s100520100696","CERN-EP-2001-003","hep-ex",,"  A sample of 3.73 million hadronic Z decays, recorded with the OPAL detector
at LEP in the years 1991-95, has been used to search for a narrow resonance
corresponding to the decay of the D*'+/-(2629) meson into D*+/- pi+ pi-. The
D*+ mesons are reconstructed in the decay channel D*+ -> D0 pi+ with D0 -> K-
pi+. No evidence for a narrow D*'+/-(2629) resonance is found. A limit on the
production of D*'+/-(2629) in hadronic Z decays is derived: f(Z ->
D*'+/-(2629)) x Br(D*'+ -> D*+ pi+ pi-) < 3.1 x 10^{-3} (95% C.L.)
","[{""version"":""v1"",""created"":""Thu, 25 Jan 2001 10:24:11 GMT""},{""version"":""v2"",""created"":""Wed, 9 May 2001 11:42:30 GMT""}]","2008-11-07"
"hep-lat/0101015","Leonardo Giusti","Leonardo Giusti, Christian Hoelbling, Claudio Rebbi","Schwinger Model with the Overlap-Dirac Operator: exact results versus a
  physics motivated approximation","minor corrections, to appear on Phys. Rev. D","Phys.Rev. D64 (2001) 054501","10.1103/PhysRevD.64.054501",,"hep-lat",,"  We propose new techniques for the numerical implementation of the
overlap-Dirac operator, which exploit the physical properties of the underlying
theory to avoid nested algorithms. We test these procedures in the
two-dimensional Schwinger model and the results are very promising. These
techniques can be directly applied to QCD simulations. We also present a
detailed computation of the spectrum and the chiral properties of the Schwinger
model in the overlap lattice formulation.
","[{""version"":""v1"",""created"":""Wed, 24 Jan 2001 22:46:51 GMT""},{""version"":""v2"",""created"":""Fri, 8 Jun 2001 17:56:22 GMT""}]","2009-11-07"
"hep-lat/0101016","Jan Budczies","J. Budczies and Y. Shnir","Color-Flavor Transformation for the Special Unitary Group and
  Application to Low Energy QCD","7 pages, no figures, LaTeX2e, to be published in the Proceedings of
  15th International Workshop on High Energy Physics and Quantum Field Theory
  (QFTHEP 2000), Tver, Russia, 14th - 20th September 2000",,,,"hep-lat",,"  The color-flavor transformation for the unitary group (Zirnbauer 1996) is
extended to the special unitary group. The resulting partition function is
represented as sum over disconnected sectors characterized by a U(1)-charge.
Application to low energy QCD on a lattice leads to a theory where the inverse
number of colors appears as expansion parameter. We use a saddle point
approximation to estimate the partition function both in the pure mesonic
sector and in the case of a single baryon on a mesonic background.
","[{""version"":""v1"",""created"":""Thu, 25 Jan 2001 14:31:58 GMT""},{""version"":""v2"",""created"":""Fri, 13 Apr 2001 11:27:56 GMT""}]","2007-05-23"
"hep-ph/0101277","Elvio Disalvo","Elvio Di Salvo","Transverse Spin Asymmetries in Drell-Yan Processes: $\mathbf
  p^{\uparrow} p \to \mu^+ \mu^- X$}",,"Eur.Phys.J.C19:503-515,2001","10.1007/s100520100619","GEF-Th-2/00","hep-ph",,"  We consider two different spin asymmetries in Drell-Yan processes generated
by the collisions of an unpolarized proton beam on transversely polarized
protons: the muon helicity asymmetry and the left-right asymmetry. We calculate
the asymmetries in the framework of the QCD improved parton model, taking into
account the parton transverse momentum and considering the first order QCD
corrections. The muon helicity asymmetry is sensitive to the quark transversity
distribution and is nonvanishing even at zero order. On the contrary the
left-right asymmetry vanishes at zero order but not at first order in the QCD
coupling constant, as a result of gluon contribution.
","[{""version"":""v1"",""created"":""Wed, 24 Jan 2001 17:23:47 GMT""}]","2009-01-07"
"hep-ph/0101278","Thomas G. Rizzo","Thomas G. Rizzo","Cartography with Accelerators: Locating Fermions in Extra Dimensions at
  Future Lepton Colliders","32 pages, 10 figs, LaTex","Phys.Rev. D64 (2001) 015003","10.1103/PhysRevD.64.015003","SLAC-PUB-8746","hep-ph hep-ex",,"  In the model of Arkani-Hamed and Schmaltz the various chiral fermions of the
Standard Model(SM) are localized at different points on a thick wall which
forms an extra dimension. Such a scenario provides a way of understanding the
absence of proton decay and the fermion mass hierarchy in models with extra
dimensions. In this paper we explore the capability of future lepton colliders
to determine the location of these fermions in the extra dimension through
precision measurements of conventional scattering processes both below and on
top of the lowest lying Kaluza-Klein gauge boson resonance. We show that for
some classes of models the locations of these fermions can be very precisely
determined while in others only their relative positions can be well measured.
","[{""version"":""v1"",""created"":""Wed, 24 Jan 2001 18:35:19 GMT""}]","2009-11-07"
"hep-ph/0101279","Maxim Polyakov","P.V. Pobylitsa, M.V. Polyakov, M. Strikman","Soft pion theorem for hard near threshold pion production","9 pages, revised version, more general analysis","Phys.Rev.Lett. 87 (2001) 022001","10.1103/PhysRevLett.87.022001","RUB-TP2-01/01","hep-ph hep-ex nucl-th",,"  We prove new soft pion theorem for the near threshold pion production by a
hard electromagnetic probe. This theorem relates various near threshold pion
production amplitudes to the nucleon distribution amplitudes. The new soft pion
theorem is in a good agreement with the SLAC data for F_2^p(W,Q^2) for W^2 <
1.4 GeV^2 and 7 < Q^2 < 30.7 GeV^2.
","[{""version"":""v1"",""created"":""Wed, 24 Jan 2001 19:57:58 GMT""},{""version"":""v2"",""created"":""Thu, 25 Jan 2001 13:46:31 GMT""},{""version"":""v3"",""created"":""Wed, 7 Feb 2001 13:02:26 GMT""}]","2009-11-07"
"hep-ph/0101280","Marty Stock","Robert L. Jaffe","SPIN - Progress and Prospects","A Talk Presented at SPIN2000, October 30, 2000; 21 pages, 13 figures,
  using aiproc.sty, BoxedEPS macros; email correspondence to jaffe@mit.edu",,"10.1063/1.1384048","MIT-CTP#3075","hep-ph hep-ex hep-th nucl-ex nucl-th",,"  I review the progress in fundamental spin physics over the past several years
and the prospects for the future. The progress is striking and the prospects
are excellent.
","[{""version"":""v1"",""created"":""Wed, 24 Jan 2001 23:21:51 GMT""}]","2009-11-07"
"hep-ph/0101281","Katrin Heitmann","Katrin Heitmann","Gauge Fields Out-Of-Equilibrium: A Gauge Invariant Formulation and the
  Coulomb Gauge","32 pages, 8 figures","Phys.Rev. D64 (2001) 045003","10.1103/PhysRevD.64.045003","DO-TH 01/02, LA-01-356","hep-ph",,"  We study the abelian Higgs model out-of-equilibrium in two different
approaches, a gauge invariant formulation, proposed by Boyanovsky et al.
\cite{Boyanovsky:1996dc} and in the Coulomb gauge. We show that both approaches
become equivalent in a consistent one loop approximation. Furthermore, we carry
out a proper renormalization for the model in order to prepare the equations
for a numerical implementation. The additional degrees of freedom, which arise
in gauge theories, influence the behavior of the system dramatically. A
comparison with results in the 't Hooft-Feynman background gauge found by us
recently, shows very good agreement.
","[{""version"":""v1"",""created"":""Thu, 25 Jan 2001 00:15:06 GMT""}]","2009-11-07"
"hep-ph/0101282","Hooman Davoudiasl","Hooman Davoudiasl (SLAC)","Probing the Geometry of the Universe at the NLC","Latex, 5 pages. Talk presented at the 5th International Linear
  Collider Workshop (LCWS 2000), Batavia, Illinois, October 24-28, 2000",,"10.1063/1.1394386","SLAC--PUB--8767","hep-ph",,"  The hierarchy problem in particle physics has recently been approached from a
geometric point of view in different models. These approaches postulate the
existence of extra dimensions with various geometric properties, to explain how
the hierarchy between the apparent scale of gravity ${\bar M}_P \sim 10^{18}$
GeV and the weak scale $m_W \sim 100$ GeV can be generated. Generally, these
models predict that the effects of gravity mediated interactions become strong
at the weak scale. This fact makes the NLC a promising tool for testing such
extra dimensional models.
","[{""version"":""v1"",""created"":""Thu, 25 Jan 2001 03:09:52 GMT""}]","2009-11-07"
"hep-ph/0101283","H. C. G. Caldas","H.C. de Godoy Caldas (FUNREI)","The Fermion Boson Interaction Within the Linear Sigma Model at Finite
  Temperature","14 pages, RevTeX, 1 eps figure; one reference added, to appear in
  Nucl. Phys. B","Nucl.Phys. B623 (2002) 503-512","10.1016/S0550-3213(01)00633-2",,"hep-ph",,"  We reinvestigate the interaction of massless fermions with massless bosons at
finite temperature. Specifically, we calculate the self-energy of massless
fermions due the interaction with massless bosons at high temperature, which is
the region where thermal effects are maximal. The calculations are concentrated
in the limit of vanishing fermion three momentum and after considering the
effective fermion and boson dressed masses, we obtain the damping rate of the
fermion up to order $g^3$. It is shown that in the limit $k_0 \ll T$ the
fermion acquire a thermal mass of order $gT$ and the leading term of the
fermion damping rate is of order $g^2T+g^3T$.
","[{""version"":""v1"",""created"":""Thu, 25 Jan 2001 05:49:32 GMT""},{""version"":""v2"",""created"":""Wed, 6 Jun 2001 01:21:02 GMT""},{""version"":""v3"",""created"":""Wed, 12 Dec 2001 23:10:19 GMT""}]","2015-06-25"
"hep-ph/0101284",,"A. Ni\'egawa","Gauge-boson propagator in out of equilibrium quantum-field system and
  the Boltzmann equation","28 pages","Phys.Rev.D64:036004,2001","10.1103/PhysRevD.64.036004","OCU-PHYS-180","hep-ph hep-th",,"  We construct from first principles a perturbative framework for studying
nonequilibrium quantum-field systems that include gauge bosons. The system of
our concern is quasiuniform system near equilibrium or nonequilibrium
quasistationary system. We employ the closed-time-path formalism and use the
so-called gradient approximation. No further approximation is introduced. We
construct a gauge-boson propagator, with which a well-defined perturbative
framework is formulated. In the course of construction of the framework, we
obtain the generalized Boltzmann equation (GBE) that describes the evolution of
the number-density functions of gauge-bosonic quasiparticles. The framework
allows us to compute the reaction rate for any process taking place in the
system. Various processes, in turn, cause an evolution of the systems, which is
described by the GBE.
","[{""version"":""v1"",""created"":""Thu, 25 Jan 2001 06:38:18 GMT""}]","2016-08-16"
"hep-ph/0101285","Eduard Masso","Eduard Masso (UAB, Barcelona)","Pseudoscalar production in electromagnetic fields by a Schwinger-like
  mechanism","5 pages, Invited talk at QED2000, 2nd Workshop on Frontier Tests of
  Quantum Electrodynamics and Physics of the Vacuum, Trieste (October 2000)",,"10.1063/1.1374971","UAB-FT-507","hep-ph hep-th",,"  In this talk I report on some recent calculations on the production of
pseudoscalars from intense electromagnetic fields.
","[{""version"":""v1"",""created"":""Thu, 25 Jan 2001 07:30:09 GMT""}]","2009-11-07"
"hep-ph/0101286","Grigori Volovik","G.E. Volovik","Reentrant violation of special relativity in the low-energy corner","RevTeX file, 5 pages, one figure, submitted to JETP Lett","Pisma Zh.Eksp.Teor.Fiz. 73 (2001) 182-185; JETP Lett. 73 (2001)
  162-165","10.1134/1.1368706",,"hep-ph cond-mat gr-qc",,"  In the effective relativistic quantum field theories the energy region, where
the special relativity holds, can be sandwiched from both the high and low
energies sides by domains where the special relativity is violated. An example
is provided by 3He-A where the relativistic quantum field theory emerges as the
effective theory. The reentrant violation of the special relativity in the
ultralow energy corner is accompanied by the redistribution of the
momentum-space topological charges between the fermionic flavors. At this
ultralow energy an exotic massless fermion with the topological charge $N_3=2$
arises, whose energy spectrum mixes the classical and relativistic behavior.
This effect can lead to neutrino oscillations if neutrino flavors are still
massless at this energy scale.
","[{""version"":""v1"",""created"":""Thu, 25 Jan 2001 09:43:02 GMT""}]","2009-11-07"
"hep-ph/0101287","Chris Michael","Chris Michael","Glueballs, hybrid and exotic mesons","11 pages, LATEX, 2 figures, talk presented at Workshop on Structure
  of Hadrons, Hirschegg, Jan 2001",,,"LTH493","hep-ph",,"  We review lattice QCD results for glueballs (including a discussion of mixing
with scalar mesons), hybrid mesons and exotic mesons (such as $B_s B_s$
molecules).
","[{""version"":""v1"",""created"":""Thu, 25 Jan 2001 10:17:57 GMT""}]","2007-05-23"
"hep-ph/0101288","Guennady Kozlov","G.A. Kozlov","Thermal ratio of the disorder deviation and the space-time deconfined
  phase size","8 pages, LaTeX, no figures, no tables; the talk presented at the XV
  Int. Seminar on High Energy Physics Problems ""Relativistic Nuclear Physics
  and Quantum Chromodynamics"", Dubna, Russia, 25-29.09.2000; to appear in the
  Proceedings",,,,"hep-ph",,"  A systematic study of the strongly interacting matter under extreme
conditions via the form of the thermal ratio of the disorder deviation is
presented. The evolution of fermi- and bose- particles (quarks and gluons) is
studied in the framework of multi-particle correlation and distribution
functions to predict the size of the finite-temperature deconfined phase.
","[{""version"":""v1"",""created"":""Thu, 25 Jan 2001 13:38:07 GMT""}]","2007-05-23"
"hep-ph/0101289","Aichelin","F. Gastineau, R. nebauer and J.Aichelin","Thermodynamics of the 3-flavor NJL model : chiral symmetry breaking and
  color superconductivity","27 pages, 7 figures","Phys.Rev. C65 (2002) 045204","10.1103/PhysRevC.65.045204",,"hep-ph",,"  Employing an extended three flavor version of the NJL model we discuss in
detail the phase diagram of quark matter. The presence of quark as well as of
diquark condensates gives raise to a rich structure of the phase diagram. We
study in detail the chiral phase transition and the color superconductivity as
well as color flavor locking as a function of the temperature and chemical
potentials of the system.
","[{""version"":""v1"",""created"":""Thu, 25 Jan 2001 13:52:26 GMT""},{""version"":""v2"",""created"":""Fri, 29 Jun 2001 12:04:47 GMT""},{""version"":""v3"",""created"":""Tue, 20 Nov 2001 14:48:33 GMT""}]","2009-11-07"
"hep-th/0101159","Marcelo Gomes","H.O. Girotti, Marcelo Gomes, A. Y. Petrov, Victor O. Rivelles, A.J. da
  Silva","The low energy limit of the non-commutative Wess-Zumino model","14 pages, 2 figures, minor corrections","JHEP0205:040,2002","10.1088/1126-6708/2002/05/040",,"hep-th",,"  The non-commutative Wess-Zumino model is used as a prototype for studying the
low energy behaviour of a renormalizable non-commutative field theory. We start
by deriving the potential mediating the fermion-fermion and boson-boson
interactions in the non-relativistic regime. The quantum counterparts of these
potentials are afflicted by irdering ambiguities but we show that there exists
an ordering prescription which makes them hermitean. For space/space
noncommutativity it turns out that Majorana fermions may be pictured as rods
oriented perpendicularly to the direction of motion showing a lack of
localituy, while bosons remain insensitive to the effects of noncommutativity.
For time/space noncommutativity bosopns and fermions can be regarded as rods
oriented along the direction of motion. For both cases of noncommutativity the
scattering state described scattered waves, with at least one wave having
negative time delay signalizing the underlying nonlocality. The superfield
formulation of the model is used to compute the corresponding effective action
in the one- and two-loop approximations. In the case of time/space
noncommutativity, unitarity is violated in the relativistic regime. However,
this does not preclude the existence of the unitary low energy limit.
","[{""version"":""v1"",""created"":""Wed, 24 Jan 2001 19:06:57 GMT""},{""version"":""v2"",""created"":""Fri, 2 Feb 2001 17:34:02 GMT""},{""version"":""v3"",""created"":""Mon, 25 Jun 2001 15:51:01 GMT""},{""version"":""v4"",""created"":""Fri, 7 Jun 2002 19:56:55 GMT""}]","2009-11-07"
"hep-th/0101160","Tigran Tchrakian","A. Chakrabarti and D.H. Tchrakian","Gravitation with superposed Gauss--Bonnet terms in higher dimensions:
  Black hole metrics and maximal extensions","13 pages, REVTEX. References and Note Added","Phys.Rev. D65 (2002) 024029","10.1103/PhysRevD.65.024029",,"hep-th gr-qc",,"  Our starting point is an iterative construction suited to combinatorics in
arbitarary dimensions d, of totally anisymmetrised p-Riemann 2p-forms (2p\le d)
generalising the (1-)Riemann curvature 2-forms. Superposition of p-Ricci
scalars obtained from the p-Riemann forms defines the maximally Gauss--Bonnet
extended gravitational Lagrangian. Metrics, spherically symmetric in the (d-1)
space dimensions are constructed for the general case. The problem is directly
reduced to solving polynomial equations. For some black hole type metrics the
horizons are obtained by solving polynomial equations. Corresponding Kruskal
type maximal extensions are obtained explicitly in complete generality, as is
also the periodicity of time for Euclidean signature. We show how to include a
cosmological constant and a point charge. Possible further developments and
applications are indicated.
","[{""version"":""v1"",""created"":""Wed, 24 Jan 2001 16:18:59 GMT""},{""version"":""v2"",""created"":""Wed, 18 Apr 2001 09:31:56 GMT""}]","2009-11-07"
"hep-th/0101161","Stefan Vandoren","Bernard de Wit, Martin Rocek and Stefan Vandoren","Hypermultiplets, Hyperkahler Cones and Quaternion-Kahler Geometry","52 pages, no figures, typos corrected, some references added","JHEP 0102 (2001) 039","10.1088/1126-6708/2001/02/039","ITP-UU-01/02, SPIN-01/02, YITP-01/04","hep-th math.DG",,"  We study hyperkahler cones and their corresponding quaternion-Kahler spaces.
We present a classification of 4(n-1)-dimensional quaternion-Kahler spaces with
n abelian quaternionic isometries, based on dualizing superconformal tensor
multiplets. These manifolds characterize the geometry of the hypermultiplet
sector of perturbative moduli spaces of type-II strings compactified on a
Calabi-Yau manifold. As an example of our construction, we study the universal
hypermultiplet in detail, and give three inequivalent tensor multiplet
descriptions. We also comment on the construction of quaternion-Kahler
manifolds that may describe instanton corrections to the moduli space.
","[{""version"":""v1"",""created"":""Wed, 24 Jan 2001 22:01:40 GMT""},{""version"":""v2"",""created"":""Sun, 25 Feb 2001 20:14:03 GMT""}]","2009-11-07"
"hep-th/0101162","Hiroyuki Hata","Hiroyuki Hata and Shunsuke Teraguchi (Kyoto Univ.)","Test of the Absence of Kinetic Terms around the Tachyon Vacuum in Cubic
  String Field Theory","21 pages, 7 figures, latex2e, v4:typos corrected","JHEP 0105 (2001) 045","10.1088/1126-6708/2001/05/045","KUNS-1705","hep-th",,"  It has been conjectured that the bosonic open string theory around the
non-perturbative tachyon vacuum has no open string dynamics at all. We explore,
in the cubic open string field theory with level truncation approximation, the
possibility that this conjecture is realized by the absence of kinetic terms of
the string field fluctuations. We study the kinetic terms with two and four
derivatives for the lower level scalar modes as well as their BRST
transformation properties. The behavior of the coefficients of the kinetic
terms in the neighborhood of the non-perturbative vacuum supports our
expectation that the BRST invariant scalar component lacks its kinetic term.
","[{""version"":""v1"",""created"":""Thu, 25 Jan 2001 08:30:59 GMT""},{""version"":""v2"",""created"":""Sat, 27 Jan 2001 07:42:25 GMT""},{""version"":""v3"",""created"":""Wed, 31 Jan 2001 00:42:31 GMT""},{""version"":""v4"",""created"":""Thu, 8 Feb 2001 07:50:36 GMT""}]","2009-11-07"
