"hep-th/0101163","Mihai Visinescu","Ion I. Cot\u{a}escu and Mihai Visinescu","Runge-Lenz operator for Dirac field in Taub-NUT background","10 pages, latex, no figures. Version to appear in Phys.Lett.B","Phys.Lett. B502 (2001) 229-234","10.1016/S0370-2693(01)00184-8",,"hep-th gr-qc",,"  Fermions in D=4 self-dual Euclidean Taub-NUT space are investigated.
Dirac-type operators involving Killing-Yano tensors of the Taub-NUT geometry
are explicitly given showing that they anticommute with the standard Dirac
operator and commute with the Hamiltonian as it is expected. They are connected
with the hidden symmetries of the space allowing the construction of a
conserved vector operator analogous to the Runge-Lenz vector of the Kepler
problem. This operator is written down pointing out its algebraic properties.
","[{""version"":""v1"",""created"":""Thu, 25 Jan 2001 08:49:09 GMT""},{""version"":""v2"",""created"":""Mon, 29 Jan 2001 10:37:20 GMT""}]","2009-11-07"
"hep-th/0101164","Kazuya Koyama","Kazuya Koyama and Jiro Soda","Strongly Coupled CFT in FRW Universe from AdS/CFT Correspondence","23 pages, no figure, version to appear in JHEP","JHEP 0105:027,2001","10.1088/1126-6708/2001/05/027",,"hep-th astro-ph gr-qc",,"  We develop a formalism to calculate the effective action of the strongly
coupled conformal field theory (CFT) in curved spacetime. The effective action
of the CFT is obtained from AdS/CFT correspondence. The anti de-Sitter (AdS)
spacetime has various slicing which give various curved spacetime on its
boundary. We show the de Sitter spacetime and the Friedmann-Robertson-Walker
(FRW) universe can be embedded in the AdS spacetime and derive the scalar
two-point function of the conformal fields in those spacetime. In curved
spacetime, the two-point function depends on the vacuum state of the CFT. A
method to specify the vacuum state in AdS/CFT calculations is shown. Because
the classical action in AdS spacetime diverges near the boundary, we need the
counter terms to regulate the result. The simple derivation of the counter
terms using the Hamilton-Jacobi equation is also presented in the appendix.
","[{""version"":""v1"",""created"":""Thu, 25 Jan 2001 10:06:12 GMT""},{""version"":""v2"",""created"":""Mon, 28 May 2001 07:11:57 GMT""}]","2010-02-03"
"hep-th/0101165","Christian Rupp","Christian Rupp, Klaus Sibold","Supersymmetry Transformation of Quantum Fields II: Supersymmetric
  Yang-Mills Theory","11 pages","Nucl.Phys. B612 (2001) 313-339","10.1016/S0550-3213(01)00329-7",,"hep-th",,"  We study the transformation law of quantum fields in super Yang-Mills theory
quantized in the Wess-Zumino gauge. It can be derived from a local version of
generalized Slavnov-Taylor identities for general Green functions. Under
suitable normalization conditions the transformations are local. Within the
vector multiplet anomalous dimensions become equal. The breaking of susy shows
up in Fock but not in Hilbert space and is not reflected in the transformation
law for the fields.
","[{""version"":""v1"",""created"":""Thu, 25 Jan 2001 11:31:54 GMT""}]","2009-11-07"
"hep-th/0101166","Muneto Nitta","Muneto Nitta (Tokyo Inst. Tech.)","A Note on Supersymmetric WZW term in Four Dimensions","LaTeX, 10 pages, no figures, typos corrected, references added,
  accepted for publication in Modern Physics Letters A","Mod.Phys.Lett. A15 (2000) 2327-2334","10.1142/S0217732300002917","TIT/HEP-463","hep-th hep-ph",,"  We reconsider the supersymmetric Wess-Zumino-Witten (SWZW) term in four
dimensions. It has been known that the manifestly supersymmetric form of the
SWZW term includes derivative terms on auxiliary fields, the highest components
of chiral superfields, and then we cannot eliminate them by their equations of
motion. We discuss a possibility for the elimination of such derivative terms
by adding total derivative terms. Although the most of derivative terms can be
eliminated as in this way, we find that all the derivative terms can be
canceled, if and only if an anomalous term in SWZW term vanishes. As a
byproduct, we find the first example of a higher derivative term free from such
a problem.
","[{""version"":""v1"",""created"":""Thu, 25 Jan 2001 12:51:36 GMT""},{""version"":""v2"",""created"":""Sun, 4 Feb 2001 12:52:47 GMT""}]","2009-11-07"
"hep-th/0101167","Marco Picariello","Marco Picariello and Andrea Quadri","Refined chiral Slavnov-Taylor identities: Renormalization and Local
  Physics","14 pages","Int.J.Theor.Phys. 41 (2002) 393-408","10.1023/A:1014289003308","IFUM 680/FT","hep-th",,"  We study the quantization of chiral QED by means of an extended
Slavnov-Taylor (ST) identity under which an external source and the ghost field
form a doublet. This ST identity incorporates the Adler-Bardeen anomaly. We
prove that the cohomology classes of the extended classical linearized ST
operator ${\cal S}'_0$ are modified with respect to the ones of the classical
BRST differential in the FP neutral sector (physical observables). This
provides a counterexample showing that the introduction of a doublet can modify
the cohomology of the model, as a consequence of the fact that the counting
operator for the doublet does not commute with ${\cal S}'_0$.
","[{""version"":""v1"",""created"":""Thu, 25 Jan 2001 13:43:31 GMT""}]","2007-06-22"
"math-ph/0101028","Baranovsky S. P.","I.V. Shirokov","Darboux Coordinates on K-Orbits and the Spectra of Casimir Operators on
  Lie Groups","LaTeX2e, 15pp, no figures","Theoretical and Mathematical Physics, Vol. 123, No. 3, 2000",,,"math-ph math.AP math.MP",,"  We propose an algorithm for obtaining the spectra of Casimir (Laplace)
operators on Lie groups. We prove that the existence of the normal polarization
associated with a linear functional on the Lie algebra is necessary and
sufficient for the transition to local canonical Darboux coordinates $(p,q)$ on
the coadjoint representation orbit that is linear in the ""momenta."" We show
that the $\la$-representations of Lie algebras (which are used, in particular,
in integrating differential equations) result from the quantization of the
Poisson bracket on the coalgebra in canonical coordinates.
","[{""version"":""v1"",""created"":""Thu, 25 Jan 2001 09:21:58 GMT""}]","2007-05-23"
"math/0101200","Stefan Ronn","Stefan R\""onn","Bicomplex algebra and function theory","71 pages",,,,"math.CV",,"  This treatise investigates holomorphic functions defined on the space of
bicomplex numbers introduced by Segre. The theory of these functions is
associated with Fueter's theory of regular, quaternionic functions. The
algebras of quaternions and bicomplex numbers are developed by making use of
so-called complex pairs. Special attention is paid to singular bicomplex
numbers that lack an inverse. The elementary bicomplex functions are defined
and their properties studied. The derivative of a bicomplex function is defined
as the limit of a fraction with nonsingular denominator. The existence of the
derivative amounts to the validity of the complexified Cauchy-Riemann
equations, which characterize the holomorphic bicomplex functions. It is proved
that such a function has derivatives of all orders. The bicomplex integral is
defined as a line integral. The condition for path independence and the
bicomplex generalizations of Cauchy's theorem and integral formula are given.
Finally, the relationship between the bicomplex functions and different forms
of the Laplace equation is considered. In particular, the four-dimensional
Laplace equation is factorized using quaternionic differential operators. The
outcome is new classes of bicomplex functions including Fueter's regular
functions. It is shown that each class contains differentiable functions.
","[{""version"":""v1"",""created"":""Wed, 24 Jan 2001 17:23:21 GMT""}]","2007-05-23"
"math/0101201","Andrei Okounkov","Andrei Okounkov","Generating functions for intersection numbers on moduli spaces of curves","Latex, 27 pages, 2 figures",,,,"math.AG math-ph math.CO math.MP",,"  Using the connection between intersection theory on the Deligne-Mumford
spaces and the edge scaling of the GUE matrix model (see math.CO/9903176,
math.AG/0101147), we express the n-point functions for the intersection numbers
as n-dimensional error-function-type integrals and also give a derivation of
Witten's KdV equations using the higher Fay identities of Adler, Shiota, and
van Moerbeke.
","[{""version"":""v1"",""created"":""Wed, 24 Jan 2001 18:32:24 GMT""},{""version"":""v2"",""created"":""Thu, 25 Jan 2001 19:37:32 GMT""}]","2007-05-23"
"math/0101202","Nikolaj Glazunov","Nikolaj M. Glazunov","Computer Algebra of Vector Bundles, Foliations and Zeta Functions and a
  Context of Noncommutative Geometry","20 pages",,,,"math.AG math.NT",,"  We present some methods and results in the application of algebraic geometry
and computer algebra to the study of algebraic vector bundles, foliations and
zeta functions. A connection of the methods and results with noncommutative
geometry will be consider.
","[{""version"":""v1"",""created"":""Wed, 24 Jan 2001 19:39:47 GMT""}]","2007-05-23"
"math/0101203","Steve Shkoller","Steve Shkoller","Well-posedness and global attractors for liquid crystals on Riemannian
  manifolds",,,,"UC Davis Math 2001-1","math.AP",,"  We study the coupled Navier-Stokes Ginzburg-Landau model of nematic liquid
crystals introduced by F.H. Lin, which is a simplified version of the
Ericksen-Leslie system. We generalize the model to compact n-dimensional
Riemannian manifolds, and show that the system comes from a variational
principle. We present a new simple proof for the local well-posedness of this
coupled system without using the higher-order energy law. We then prove that
this system is globally well-posed and has compact global attractors when the
dimension of the manifold M is two.Finally, we introduce the Lagrangian
averaged liquid crystal equations, which arise from averaging the Navier-Stokes
fluid motion over small spatial scales in the variational principle. We show
that this averaged system is globally well-posed and has compact global
attractors even when M is three-dimensional.
","[{""version"":""v1"",""created"":""Wed, 24 Jan 2001 22:02:29 GMT""}]","2007-05-23"
"math/0101204","Toshiyuki Abe","Toshiyuki Abe","The charge conjugation orbifold $V_{Z\alpha}^{+}$ is rational when
  $<\alpha,\alpha>/2$ is prime","18 pages, Latex",,,,"math.QA",,"  We prove that the vertex operator algebra $V_{Z\alpha}^{+}$ is rational if
$<\alpha,\alpha>/2$ is a prime integer.
","[{""version"":""v1"",""created"":""Thu, 25 Jan 2001 02:36:01 GMT""}]","2007-05-23"
"math/0101205","Tony Roberts","A.J. Roberts (University of Southern Queensland)","Holistic projection of initial conditions onto a finite difference
  approximation","8 pages, LaTeX",,"10.1016/S0010-4655(01)00359-9",,"math.NA",,"  Modern dynamical systems theory has previously had little to say about finite
difference and finite element approximations of partial differential equations
(Archilla, 1998). However, recently I have shown one way that centre manifold
theory may be used to create and support the spatial discretisation of \pde{}s
such as Burgers' equation (Roberts, 1998a) and the Kuramoto-Sivashinsky
equation (MacKenzie, 2000). In this paper the geometric view of a centre
manifold is used to provide correct initial conditions for numerical
discretisations (Roberts, 1997). The derived projection of initial conditions
follows from the physical processes expressed in the PDEs and so is
appropriately conservative. This rational approach increases the accuracy of
forecasts made with finite difference models.
","[{""version"":""v1"",""created"":""Thu, 25 Jan 2001 04:44:48 GMT""}]","2009-11-07"
"math/0101206","Peter Steven Ozsvath","Peter Ozsvath and Zoltan Szabo","Holomorphic disks and topological invariants for closed three-manifolds","118 pages, 10 figures, to appear in Annals of Mathematics.
  Reorganized both this paper and its sequel: the first paper now gives the
  definitions for closed, oriented three-manifolds. Properties and examples are
  given in the second paper",,,,"math.SG math.DG math.GT",,"  The aim of this article is to introduce and study certain topological
invariants for closed, oriented three-manifolds Y. These groups are relatively
Z-graded Abelian groups associated to SpinC structures over Y. Given a genus g
Heegaard splitting of Y, these theories are variants of the Lagrangian Floer
homology for the g-fold symmetric product of the surface relative to certain
totally real subspaces associated to the handlebodies.
","[{""version"":""v1"",""created"":""Thu, 25 Jan 2001 04:49:51 GMT""},{""version"":""v2"",""created"":""Tue, 16 Oct 2001 19:50:38 GMT""},{""version"":""v3"",""created"":""Tue, 24 Sep 2002 18:40:23 GMT""},{""version"":""v4"",""created"":""Tue, 11 Mar 2003 20:09:00 GMT""}]","2009-09-25"
"math/0101207","Mircea Neagu","Constantin Udriste and Mircea Neagu","From PDE Systems and Metrics to Generalized Field Theories","The authors express their sincere thanks to Professors V. Balan, V.
  Obadeanu and D. Opris for their critical reading of an earlier version of
  this paper","M. Neagu, C. Udriste: ""From PDE systems and metrics to multi-time
  field theories and geometric dynamics"", Seminarul de Mecanica 79 (2001), 1-33",,,"math.DG math.AP",,"  The paper proved that every $C^2$-solution of a given first order PDEs
system, regarded on the jet fibre bundle of order one $J^1(T,M)$, may be viewed
as a ""generalized harmonic map"", via the least squares variational method. Our
ideas are structured in the following way:
  1) we find a suitable geometrical structure on $J^1(T,M)$ that convert the
solutions of the given PDEs system into ""generalized harmonic maps"";
  2) we build a natural geometry induced by a such PDEs system;
  3) we construct a field theory, in a general setting, naturally attached to
this PDEs system.
","[{""version"":""v1"",""created"":""Thu, 25 Jan 2001 09:57:40 GMT""}]","2010-07-30"
"math/0101208","S. Encinas","S. Encinas, O. Villamayor","A Proof of Desingularization over fields of characteristic zero","In accordance to the suggestions of referee: Title has changed and
  the structure of the paper is different. Proof of main theorem is clarified.
  Latex document, 11pages","Revista Matematica Iberoamericana 19, 339-353 (2003)",,,"math.AG",,"  We present a proof of embedded desingularization for closed subschemes which
does not make use of Hilbert-Samuel function and avoids Hironaka's notion of
normal flatness.
  This proof, already sketched in [A course on constructive desingularization
and equivariance. In {\em Resolution of singularities (Obergurgl, 1997)}, vol.
181 {\em Progr. Math.}, Birkh\""auser, 2000.] page 224, is done by showing that
desingularization of a closed subscheme $X$, in a smooth sheme W, is achieved
by taking an algorithmic principalization for the ideal $I(X)$, associated to
the embedded scheme $X$.
","[{""version"":""v1"",""created"":""Thu, 25 Jan 2001 10:38:32 GMT""},{""version"":""v2"",""created"":""Mon, 4 Mar 2002 18:30:11 GMT""},{""version"":""v3"",""created"":""Mon, 30 Sep 2002 10:07:24 GMT""}]","2007-05-23"
"nlin/0101044","Michael Tribelsky","Guo-Dong Li, Atsushi Ogawa, Yoshifumi Harada, and Michael I.Tribelsky","Nonlinear Pattern Selection in Binary Mixture Convection with
  Through-Flow","9 pages and 2 figures",,"10.1143/PTP.106.293",,"nlin.PS physics.class-ph physics.flu-dyn",,"  The pattern selection problem in binary-mixture convection in an extended
channel with a lateral through-flow is presented. The through-flow breaks
left--right parity and changes pattern dynamics dramatically. The problem is
studied based on computer simulation of the complete set of hydrodynamic
equations (Oberbeck-Boussinesq approximation) in the two-dimensional
rectangular channel with aspect ratio $\Gamma = 12$ and convection-suppressing
lateral boundary conditions. A wide variety of new dynamical patterns is
obtained, discussed and classified.
","[{""version"":""v1"",""created"":""Thu, 25 Jan 2001 11:12:15 GMT""},{""version"":""v2"",""created"":""Fri, 26 Jan 2001 03:15:49 GMT""}]","2009-12-18"
"nlin/0101045","Gergely Palla","Gergely Palla, Gabor Vattay, Andre Voros, Niels Sondergaard and Carl
  Philip Dettmann","Noise corrections to stochastic trace formulas","21 pages, 4 figures,corrected typos","Foundations of Physics, Vol. 31, No. 4 641-657 (2001)","10.1023/A:1017569010085","T00/181","nlin.CD",,"  We review studies of an evolution operator L for a discrete Langevin equation
with a strongly hyperbolic classical dynamics and a Gaussian noise. The leading
eigenvalue of L yields a physically measurable property of the dynamical
system, the escape rate from the repeller. The spectrum of the evolution
operator L in the weak noise limit can be computed in several ways. A method
using a local matrix representation of the operator allows to push the
corrections to the escape rate up to order eight in the noise expansion
parameter. These corrections then appear to form a divergent series. Actually,
via a cumulant expansion, they relate to analogous divergent series for other
quantities, the traces of the evolution operators L^n. Using an integral
representation of the evolution operator L, we then investigate the high order
corrections to the latter traces. Their asymptotic behavior is found to be
controlled by sub-dominant saddle points previously neglected in the
perturbative expansion, and to be ultimately described by a kind of trace
formula.
","[{""version"":""v1"",""created"":""Thu, 25 Jan 2001 15:47:40 GMT""},{""version"":""v2"",""created"":""Fri, 26 Jan 2001 17:51:52 GMT""},{""version"":""v3"",""created"":""Mon, 15 Oct 2001 12:20:54 GMT""}]","2022-10-12"
"nucl-ex/0101010","Barry Davids","B. Davids, D. W. Anthony, T. Aumann, Sam M. Austin, T. Baumann, D.
  Bazin, R. R. C. Clement, C. N. Davids, H. Esbensen, P. A. Lofy, T. Nakamura,
  B. M. Sherrill, and J. Yurkon","S17(0) Determined from the Coulomb Breakup of 83 MeV/nucleon 8B",,"Phys.Rev.Lett. 86 (2001) 2750-2753","10.1103/PhysRevLett.86.2750",,"nucl-ex astro-ph nucl-th",,"  A kinematically complete measurement was made of the Coulomb dissociation of
8B nuclei on a Pb target at 83 MeV/nucleon. The cross section was measured at
low relative energies in order to infer the astrophysical S factor for the
7Be(p,gamma)8B reaction. A first-order perturbation theory analysis of the
reaction dynamics including E1, E2, and M1 transitions was employed to extract
the E1 strength relevant to neutrino-producing reactions in the solar interior.
By fitting the measured cross section from Erel = 130 keV to 400 keV, we find
S17(0) = 17.8 (+1.4, -1.2) eV b.
","[{""version"":""v1"",""created"":""Thu, 25 Jan 2001 00:48:00 GMT""}]","2009-11-07"
"nucl-ex/0101011","Belov","A.D.Avesov (2), M.A.Belov (2), V.Chaloupka (4), W.M.Dougherty (4),
  A.A.Gafarov (2), D.Hutcheson (3), A.V.Khugaev (2), B.Khurelbaatar (1),
  Yu.N.Koblik (2), R.Kh.Kutuev (1), G.Liang (4), H.Lubatti (4), V.V.Mialkovski
  (1), D.A.Mirkarimov (2), G.A.Mkrtchyan (2), G.Musulmanbekov (1), V.A.Nikitin
  (1), P.V.Nomokonov (1), A.V.Pavlyuk (1), G.A.Radyuk (2), I.A.Rufanov (1),
  W.G.Weitkamp (4), S.Yen (3), B.S.Yuldashev (2), T.C.Zhao (4), R.Ya.
  Zulkarneev (1) ((1) The Joint Institute of Nuclear Research, Russia, (2) The
  Institute of Nuclear Physics, Uzbekistan, (3) The Nuclear Center ''TRIUMF'',
  Canada, (4) University of Washington, USA)","Mass spectra measurement in the reaction (p,2p) at protons energy 500
  MeV on nuclei C,Al,Cu and Pb","12 pages, including figures",,,,"nucl-ex",,"  Mass spectra of the reaction (p,2p) at the beam energy 500 MeV on nuclei
C,Al,Cu and Pb were measured on two-armed nonmagnetic scintillation
spectrometer (candlepower - 0.2 sr, mass allowance - 4 MeV), which is lokated
on the TRIUMF cyclotron (Canada). Observable anomalies in these spectra can be
stipulated by forming of two-nucleon resonance states.
","[{""version"":""v1"",""created"":""Thu, 25 Jan 2001 15:18:40 GMT""}]","2007-05-23"
"nucl-th/0101054","Thomas Hemmert","Thomas R. Hemmert (TU Muenchen)","Nucleon Compton Scattering in Chiral Effective Field Theories","10 pages, 2 figures, uses World Scientific style ws-p8-50x6-00.cls;
  plenary talk given at Chiral Dynamics 2000 meeting, Newport News, VA",,"10.1142/9789812810977_0019","TUM/T-39-00-25","nucl-th hep-ph",,"  Chiral effective field theories have a long history studying the process of
Compton scattering on the nucleon. In this contribution I want to focus on the
new developments that have occured since the last Chiral Dynamics conference in
Mainz 1997. I will focus exclusively on the spin-dependent sector, where most
of the recent work has been done.
","[{""version"":""v1"",""created"":""Wed, 24 Jan 2001 18:00:33 GMT""}]","2017-08-23"
"nucl-th/0101055","Thomas Hemmert","Thomas R. Hemmert (TU Muenchen)","Theory of the Nucleon Spin-Polarizabilities II","4 pages, uses World Scientific style ws-p8-50x6-00.cls; talk given at
  GDH2000 meeting, Mainz, Germany",,"10.1142/9789812811448_0023",,"nucl-th hep-ph",,"  Following up on the plenary talk given by Ulf Mei{\ss}ner, I discuss a
generalization of the concept of nucleon spin-polarizabilities in terms of
multipole excitation/de-excitation and present an overview of the available
theoretical predictions for these elusive but interesting structure parameters
of the nucleon.
","[{""version"":""v1"",""created"":""Wed, 24 Jan 2001 18:23:55 GMT""}]","2017-08-23"
"nucl-th/0101056","Ruprecht Machleidt","R. Machleidt and I. Slaus","The nucleon-nucleon interaction","42 pages, 12 figures, iopart.cls style; Topical Review prepared for
  J. Phys. G: Nucl. Part. Phys","J.Phys.G27:R69-R108,2001","10.1088/0954-3899/27/5/201",,"nucl-th nucl-ex",,"  We review the major progress of the past decade concerning our understanding
of the nucleon-nucleon interaction. The focus is on the low-energy region
(below pion production threshold), but a brief outlook towards higher energies
is also given. The items discussed include charge-dependence, the precise value
of the $\pi NN$ coupling constant, phase shift analysis and high-precision NN
data and potentials. We also address the issue of a proper theory of nuclear
forces. Finally, we summarize the essential open questions that future research
should be devoted to.
","[{""version"":""v1"",""created"":""Thu, 25 Jan 2001 02:17:45 GMT""}]","2009-11-07"
"physics/0101085","Jolu","M. Dorado","Equations of Motion of Systems with Internal Angular Momentum","Latex, 15 postscript figures",,,"FTUAM 00-65","physics.class-ph physics.gen-ph",,"  Using Euler's equations of motion and the Hamiltonian formulation, we obtain
the equations of motion of systems with internal angular momentum that are
moving with respect to a given reference frame, when subjected to a torque
which is permanently perpendicular to the angular momentum vector.
","[{""version"":""v1"",""created"":""Wed, 24 Jan 2001 16:44:02 GMT""}]","2007-05-23"
"physics/0101086","A. R. P. Rau","Howard S. Cohl, A.R.P. Rau, Joel E. Tohline, Dana A. Browne, John E.
  Cazes, and Eric I. Barnes","Alternative Fourier Expansions for Inverse Square Law Forces","10 pages, latex/Revtex4, 1 figures",,"10.1103/PhysRevA.64.052509",,"physics.atom-ph physics.gen-ph",,"  Few-body problems involving Coulomb or gravitational interactions between
pairs of particles, whether in classical or quantum physics, are generally
handled through a standard multipole expansion of the two-body potentials. We
discuss an alternative based on a compact, cylindrical Green's function
expansion that should have wide applicability throughout physics. Two-electron
""direct"" and ""exchange"" integrals in many-electron quantum systems are
evaluated to illustrate the procedure which is more compact than the standard
one using Wigner coefficients and Slater integrals.
","[{""version"":""v1"",""created"":""Wed, 24 Jan 2001 21:41:20 GMT""},{""version"":""v2"",""created"":""Thu, 19 Jul 2001 19:41:13 GMT""}]","2013-05-29"
"physics/0101087","John Bechhoefer","John Herrick, Suckjoon Jun, John Bechhoefer, Aaron Bensimon","Kinetic model of DNA replication in eukaryotic organisms","10 pages, 6 figures: see also cond-mat/0306546 & physics/0306156","J.Mol.Biol., 320, 741-750 (2002)","10.1016/S0022-2836(02)00522-3",,"physics.bio-ph q-bio.OT q-bio.QM",,"  We formulate a kinetic model of DNA replication that quantitatively describes
recent results on DNA replication in the in vitro system of Xenopus laevis
prior to the mid-blastula transition. The model describes well a large amount
of different data within a simple theoretical framework. This allows one, for
the first time, to determine the parameters governing the DNA replication
program in a eukaryote on a genome-wide basis. In particular, we have
determined the frequency of origin activation in time and space during the cell
cycle. Although we focus on a specific stage of development, this model can
easily be adapted to describe replication in many other organisms, including
budding yeast.
","[{""version"":""v1"",""created"":""Thu, 25 Jan 2001 13:44:05 GMT""},{""version"":""v2"",""created"":""Wed, 17 Sep 2003 06:26:27 GMT""}]","2018-11-06"
