"cond-mat/0108407","Chetan Nayak","Xiao Yang and Chetan Nayak (UCLA)","Electrical and Thermal Transport by Nodal Quasiparticles in the DDW
  State",,,"10.1103/PhysRevB.65.064523",,"cond-mat.str-el cond-mat.supr-con",,"  We compute the electrical and thermal conductivities and Hall conductivities
of the $d$-density wave (DDW) state in the low-temperature
impurity-scattering-dominated regime for low-dopings, at which they are
dominated by nodal quasiparticles. We show that the longitudinal conductivity
in this limit in the DDW state is not Drude-like. However, the thermal
conductivty is Drude-like; this is a reflection of the discrepancy between
electrical and thermal transport at finite frequency in the DDW state. An
extreme example of this occurs in the $\mu=0$, $\tau\to\infty$ limit, where
there is a strong violation of the Wiedemann-Franz law:
${\kappa_{xx}}/{\sigma_{xx}} \propto {T^2}$ at $\omega=0$ and
${\kappa_{xx}}/{\sigma_{xx}}=0$ at finite frequency. The DDW electrical and
thermal Hall conductivities are linear in the magnetic field, $B$, for weak
fields. The formation of Landau levels at the nodes leads to the quantization
of these Hall conductivities at high fields. In all of these ways, the
quasiparticles of the DDW state differ from those of the $d_{{x^2}-{y^2}}$
superconducting (DSC) state.
","[{""version"":""v1"",""created"":""Sat, 25 Aug 2001 01:59:06 GMT""}]","2016-08-31"
"cond-mat/0108408","Junji Ito","Junji Ito and Kunihiko Kaneko","Spontaneous structure formation in a network of chaotic units with
  variable connection strengths","4 pages, 3 figures, REVTeX",,"10.1103/PhysRevLett.88.028701",,"cond-mat.dis-nn",,"  As a model of temporally evolving networks, we consider a globally coupled
logistic map with variable connection weights. The model exhibits
self-organization of network structure, reflected by the collective behavior of
units. Structural order emerges even without any inter-unit synchronization of
dynamics. Within this structure, units spontaneously separate into two groups
whose distinguishing feature is that the first group possesses many
outwardly-directed connections to the second group, while the second group
possesses only few outwardly-directed connections to the first. The relevance
of the results to structure formation in neural networks is briefly discussed.
","[{""version"":""v1"",""created"":""Sat, 25 Aug 2001 07:22:36 GMT""}]","2009-11-07"
"cs/0108016","Shaz Qadeer","Shaz Qadeer","Verifying Sequential Consistency on Shared-Memory Multiprocessors by
  Model Checking","29 pages",,,,"cs.DC cs.AR",,"  The memory model of a shared-memory multiprocessor is a contract between the
designer and programmer of the multiprocessor. The sequential consistency
memory model specifies a total order among the memory (read and write) events
performed at each processor. A trace of a memory system satisfies sequential
consistency if there exists a total order of all memory events in the trace
that is both consistent with the total order at each processor and has the
property that every read event to a location returns the value of the last
write to that location.
  Descriptions of shared-memory systems are typically parameterized by the
number of processors, the number of memory locations, and the number of data
values. It has been shown that even for finite parameter values, verifying
sequential consistency on general shared-memory systems is undecidable. We
observe that, in practice, shared-memory systems satisfy the properties of
causality and data independence. Causality is the property that values of read
events flow from values of write events. Data independence is the property that
all traces can be generated by renaming data values from traces where the
written values are distinct from each other. If a causal and data independent
system also has the property that the logical order of write events to each
location is identical to their temporal order, then sequential consistency can
be verified algorithmically. Specifically, we present a model checking
algorithm to verify sequential consistency on such systems for a finite number
of processors and memory locations and an arbitrary number of data values.
","[{""version"":""v1"",""created"":""Sat, 25 Aug 2001 00:58:27 GMT""}]","2007-05-23"
"gr-qc/0108058","Kayll Lake","Mustapha Ishak and Kayll Lake","Stability of Transparent Spherically Symmetric Thin Shells and Wormholes","12 pages, 7 figures, revtex. Final form to appear in Phys. Rev. D","Phys.Rev. D65 (2002) 044011","10.1103/PhysRevD.65.044011",,"gr-qc",,"  The stability of transparent spherically symmetric thin shells (and
wormholes) to linearized spherically symmetric perturbations about static
equilibrium is examined. This work generalizes and systematizes previous
studies and explores the consequences of including the cosmological constant.
The approach shows how the existence (or not) of a domain wall dominates the
landscape of possible equilibrium configurations.
","[{""version"":""v1"",""created"":""Fri, 24 Aug 2001 17:16:28 GMT""},{""version"":""v2"",""created"":""Tue, 11 Dec 2001 15:24:01 GMT""}]","2009-11-07"
"gr-qc/0108062","Jorge Pullin","Rodolfo Gambini and Jorge Pullin","Consistent discretizations for classical and quantum general relativity","4 pages, RevTeX, no figures","In ""Gravity, astrophysics and strings @ the Black Sea"", P. Fiziev,
  M. Todorov editors, St Kliment Ohridski University Press (2003)",,"LSU-GRG-082401","gr-qc",,"  We consider discretizations of the Einstein action of general relativity such
that the resulting discrete equations of motion form a consistent constrained
system. Upon ``spin foam'' quantization of the system, consistency allows a
natural way of recovering the correct semi-classical theory. A consistent set
of approximations to the Einstein equations could also have implications for
numerical relativity and for the construction of approximate classical
observables for the theory.
","[{""version"":""v1"",""created"":""Fri, 24 Aug 2001 20:10:56 GMT""}]","2007-05-23"
"gr-qc/0108063","L. C. Garcia de Andrade","L.C.Garcia de Andrade","Teleparallel orthonormal frames constraints on torsion detection?","Latex file",,,,"gr-qc",,"  Spin-polarised cylindrically symmetric solution are shown not to be
compatible with teleparallel gravity.This can be done in two distinct
manners.The first is to show that not all components of the orthonormal tetrad
(OT).It is argue however that this result maybe done by a bad choice of the
spin distribution along the cylinder.A cylindrically symmetric Riemannian
solution is obtained which represents a conical geometry of defects.
","[{""version"":""v1"",""created"":""Fri, 24 Aug 2001 23:14:33 GMT""}]","2007-05-23"
"gr-qc/0108064","Pantelis S. Apostolopoulos","Pantelis S. Apostolopoulos and Michael Tsamparlis","Comment on Ricci Collineations for spherically symmetric space-times","3 pages. Accepted for publication in General Relativity and
  Gravitation","Gen.Rel.Grav. 34 (2002) 49-52","10.1023/A:1015214404912",,"gr-qc",,"  It is shown that the results of the paper by Contreras et al. [Contreras, G.,
Nunez, L. A., Percoco, U. ""Ricci Collineations for Non-degenerate, Diagonal and
Spherically Symmetric Ricci Tensors"" (2000) Gen. Rel. Grav. 32, 285-294]
concerning the Ricci Collineations in spherically symmetric space-times with
non-degenerate and diagonal Ricci tensor do not cover all possible cases.
Furthermore the complete algebra of Ricci Collineations of certain
Robertson-Walker metrics of vanishing spatial curvature are given.
","[{""version"":""v1"",""created"":""Sat, 25 Aug 2001 15:00:03 GMT""}]","2021-10-20"
"gr-qc/0108065","Pantelis S. Apostolopoulos","Pantelis S. Apostolopoulos and Michael Tsamparlis","Hypersurface homogeneous locally rotationally symmetric spacetimes
  admitting conformal symmetries","15 pages; to appear in Classical Quantum Gravity; some misprints in
  Tables 3,5 and in section 4 corrected","Class.Quant.Grav. 18 (2001) 3775-3790","10.1088/0264-9381/18/18/301",,"gr-qc",,"  All hypersurface homogeneous locally rotationally symmetric spacetimes which
admit conformal symmetries are determined and the symmetry vectors are given
explicitly. It is shown that these spacetimes must be considered in two sets.
One set containing Ellis Class II and the other containing Ellis Class I, III
LRS spacetimes. The determination of the conformal algebra in the first set is
achieved by systematizing and completing results on the determination of CKVs
in 2+2 decomposable spacetimes. In the second set new methods are developed.
The results are applied to obtain the classification of the conformal algebra
of all static LRS spacetimes in terms of geometrical variables. Furthermore all
perfect fluid nontilted LRS spacetimes which admit proper conformal symmetries
are determined and the physical properties some of them are discussed.
","[{""version"":""v1"",""created"":""Sat, 25 Aug 2001 15:13:17 GMT""},{""version"":""v2"",""created"":""Sat, 14 Jun 2003 07:34:22 GMT""}]","2009-11-07"
"hep-ph/0108207","Peter Zeiler Skands","P. Z. Skands","L-Violating Supersymmetry - Implementation in PYTHIA and study of LHC
  discovery potential","Master's thesis",,,,"hep-ph",,"  In the Minimal Supersymmetric Standard Model (MSSM), the simultaneous
appearance of lepton and baryon number violation causes the proton to decay
much faster than the experimental bound allows. Customarily, a discrete
symmetry known as R-parity is imposed to forbid these dangerous interactions.
This work begins by arguing that there is no deep theoretical motivation for
preferring R-parity over other discrete symmetries and continues by adopting
the MSSM with baryon number conservation replacing R-parity conservation. For
the purpose of studying the influence of the consequent lepton number violating
interactions, 1278 new decay channels of supersymmetric particles into Standard
Model particles have been included in the PYTHIA event generator. The augmented
event generator is then used in combination with the atlfast detector
simulation to study the impact of lepton number violation on event topologies
in the ATLAS detector, and trigger menus designed for LV-SUSY are proposed
based on very general conclusions. The subsequent analysis uses a combination
of primitive cuts and neural networks to optimize the discriminating power
between signal and background events. In all scenarios studied, it is found
that a $5\sigma$ discovery is possible for cross sections down to $10^{-10}$ mb
with an integrated luminosity of 30 fb$^{-1}$.
","[{""version"":""v1"",""created"":""Fri, 24 Aug 2001 17:06:17 GMT""}]","2007-05-23"
"hep-ph/0108208","German Sharov","V. P. Petrov, G. S. Sharov","Special Classes of Solutions for Linear String Baryon Configuration","6 pages, no figures, LaTeX",,,"TSU-01-21","hep-ph",,"  For the linear string baryon model with three material points (three quarks)
joined sequentially by the relativistic strings, the class of motions admitting
linearizable boundary conditions is investigated. These motions may be
represented as the Fourier series with eigenfunctions of some boundary-value
problem. The two types of rotational motions are found among the mentioned
class of solutions.
","[{""version"":""v1"",""created"":""Fri, 24 Aug 2001 17:16:50 GMT""}]","2007-05-23"
"hep-ph/0108209","Ernest Ma","Ernest Ma (UC Riverside)","Unified Supersymmetric Model of Naturally Small Dirac Neutrino Masses
  and the Axionic Solution of the Strong CP Problem","10 pages, no figure, Eqs.(16)-(20) are corrected","Nucl.Phys. B623 (2002) 126-132","10.1016/S0550-3213(01)00625-3","UCRHEP-T314 (November 2001)","hep-ph",,"  Using the particle content of the fundamental {27} supermultiplet of E_6,
naturally small Dirac neutrino masses are obtained in the context of SU(3)_C
times SU(2)_L times U(1)_Y times U(1)_{chi}, where U(1)_{chi} comes from the
decomposition E_6 to SO(10) times U(1)_{psi}, then SO(10) to SU(5) times
U(1)_{chi}. New observable consequences are predicted at the TeV scale. An
axionic solution of the strong CP problem may be included at no extra cost.
","[{""version"":""v1"",""created"":""Fri, 24 Aug 2001 20:06:33 GMT""},{""version"":""v2"",""created"":""Mon, 12 Nov 2001 22:04:15 GMT""}]","2009-11-07"
"hep-ph/0108210","D. Toublan","T. Schaefer, D.T. Son, M.A. Stephanov, D. Toublan and J.J.M.
  Verbaarschot","Kaon Condensation and Goldstone's Theorem","13 pages, 1 figure, Latex","Phys.Lett. B522 (2001) 67-75","10.1016/S0370-2693(01)01265-5","SUNY-NTG/00-21","hep-ph cond-mat hep-lat hep-th",,"  We consider QCD at a nonzero chemical potential for strangeness. At a
critical value of the chemical potential equal to the kaon mass, kaon
condensation occurs through a continuous phase transition. We show that, when
the isospin symmetry is exact in the Lagrangian, a Goldstone boson with a
dispersion relation $E \sim p^2$ appears in the kaon condensed phase. At the
same time, the number of the Goldstone bosons is less than the number of broken
generators. Both phenomena are familiar in non-relativistic systems. We
interpret our results in terms of a Goldstone boson counting rule found
previously by Nielsen and Chadha. We also formulate a criterion sufficient for
the equality between the number of Goldstone bosons and the number of broken
generators.
","[{""version"":""v1"",""created"":""Fri, 24 Aug 2001 22:03:26 GMT""},{""version"":""v2"",""created"":""Fri, 14 Sep 2001 22:42:40 GMT""}]","2007-05-23"
"hep-ph/0108212","Francesco Becattini","F. Becattini, G. Pettini (University of Florence)","Strangeness production in a statistical effective model of hadronisation","7 pages, 2 .eps figures. Talk given at QCD@work, MartinaFranca
  (Italy) June 16-20 2001, to be published in the Proceedings","AIP Conf.Proc. 602 (2001) 333-338","10.1063/1.1435944",,"hep-ph",,"  We suppose that overall strangeness production in both high energy elementary
and heavy ion collisions can be described within the framework of an
equilibrium statistical model in which the effective degrees of freedom are
constituent quarks as used in effective lagrangian models. In this picture, the
excess of relative strangeness production in heavy ion collisions with respect
to elementary particle collisions arises from the unbalance between initial
non-strange matter and antimatter and from the exact colour and flavour quantum
number conservation over different finite volumes. The comparison with the data
and the possible sources of model dependence are discussed.
","[{""version"":""v1"",""created"":""Sat, 25 Aug 2001 09:41:11 GMT""}]","2009-11-07"
"hep-ph/0108213","Peter Schweitzer","A.V. Efremov (Dubna, JINR), K. Goeke, P. Schweitzer (Ruhr U., Bochum)","Azimuthal asymmetry in electro-production of neutral pions in SIDIS","12 pages, 10 figures. Fig.3c, Fig.4a updated, conclusions added","Phys.Lett.B522:37-48,2001; Erratum-ibid.B544:389-392,2002","10.1016/S0370-2693(01)01258-8","RUB/TP2-08/01","hep-ph",,"  Recently HERMES has observed an azimuthal asymmetry in electro-production of
neutral pions in semi-inclusive deep-inelastic scattering of unpolarized
positrons off longitudinally polarized protons. This asymmetry (like those
observed in the production of charged pions) is well reproduced theoretically
by using the non-perturbative calculation of the proton transversity
distribution in the effective chiral quark-soliton model combined with
experimental DELPHI-data on the new T-odd Collins fragmentation function. There
are no free, adjustable parameters in the analysis. Using the $z$-dependence of
the HERMES azimuthal asymmetry and the calculated transversity distributions
the z-dependence of the Collins fragmentation function is obtained. The value
obtained from HERMES data is consistent with the DELPHI result, even though
these results refer to different scales.
","[{""version"":""v1"",""created"":""Sat, 25 Aug 2001 15:17:49 GMT""},{""version"":""v2"",""created"":""Thu, 27 Sep 2001 10:59:51 GMT""}]","2008-11-26"
"hep-th/0108186","Joao Barcelos Neto","R. Amorim and J. Barcelos-Neto","Remarks on the canonical quantization of noncommutative theories","6 pages, Revtex (multicol)","J.Phys.A34:8851-8858,2001","10.1088/0305-4470/34/42/309",,"hep-th",,"  Free noncommutative fields constitute a natural and interesting example of
constrained theories with higher derivatives. The quantization methods
involving constraints in the higher derivative formalism can be nicely applied
to these systems. We study real and complex free noncommutative scalar fields
where momenta have an infinite number of terms. We show that these expressions
can be summed in a closed way and lead to a set of Dirac brackets which matches
the usual corresponding brackets of the commutative case.
","[{""version"":""v1"",""created"":""Fri, 24 Aug 2001 16:45:51 GMT""}]","2008-11-26"
"hep-th/0108187",,"Justin Khoury, Burt A. Ovrut, Nathan Seiberg, Paul J. Steinhardt and
  Neil Turok","From Big Crunch to Big Bang","16 pages, compressed and RevTex file, including three postscript
  figure files. Minor changes, version to appear in Physical Review D","Phys.Rev.D65:086007,2002","10.1103/PhysRevD.65.086007",,"hep-th astro-ph",,"  We consider conditions under which a universe contracting towards a big
crunch can make a transition to an expanding big bang universe. A promising
example is 11-dimensional M-theory in which the eleventh dimension collapses,
bounces, and re-expands. At the bounce, the model can reduce to a weakly
coupled heterotic string theory and, we conjecture, it may be possible to
follow the transition from contraction to expansion. The possibility opens the
door to new classes of cosmological models. For example, we discuss how it
suggests a major simplification and modification of the recently proposed
ekpyrotic scenario.
","[{""version"":""v1"",""created"":""Fri, 24 Aug 2001 17:59:58 GMT""},{""version"":""v2"",""created"":""Sun, 26 Aug 2001 20:38:52 GMT""},{""version"":""v3"",""created"":""Thu, 13 Sep 2001 06:48:27 GMT""},{""version"":""v4"",""created"":""Sat, 2 Mar 2002 17:17:00 GMT""}]","2009-09-15"
"hep-th/0108188","Masaru Kamata","Masaru Kamata and Atsushi Nakamula","A q-analog of the ADHMN construction and axisymmetric multi-instantons","11pages, Latex2e, to appear in Journal of Physics A: Mathematical and
  General as a `Special Issue/Difference Equations'","J.Phys.A34:10441-10452,2001","10.1088/0305-4470/34/48/309",,"hep-th",,"  In the preceding paper (Phys. Lett. B463 (1999) 257), the authors presented a
q-analog of the ADHMN construction and obtained a family of anti-selfdual
configurations with a parameter q for classical SU(2) Yang-Mills theory in
four-dimensional Euclidean space. The family of solutions can be seen as a
q-analog of the single BPS monopole preserving (anti-)selfduality. Further
discussion is made on the relation to axisymmetric ansatz on anti-selfdual
equation given by Witten in the late seventies. It is found that the
q-exponential functions familiar in q-analysis appear as analytic functions
categorizing the anti-selfdual configurations yielded by axisymmetric ansatz.
","[{""version"":""v1"",""created"":""Sat, 25 Aug 2001 12:00:03 GMT""}]","2008-11-26"
"math-ph/0108019","Alexander Mazurenko","A. S. Mazurenko, V. A. Savva","N-Level Quantum Systems and Legendre Functions","6 pages, latex, no figures, see also
  http://www.geocities.com/amazurenko/papers.html","Proceedings of Third Annual Seminar ""Nonlinear phenomena in
  complex systems"", Minsk: Institute of Physics, 1995, 328",,,"math-ph math.MP",,"  An excitation dynamics of new quantum systems of N equidistant energy levels
in a monochromatic field has been investigated. To obtain exact analytical
solutions of dynamic equations an analytical method based on orthogonal
functions of a real argument has been proposed. Using the orthogonal Legendre
functions we have found an exact analytical expression for a population
probability amplitude of the level n. Various initial conditions for the
excitation of N-level quantum systems have been considered.
","[{""version"":""v1"",""created"":""Fri, 24 Aug 2001 16:31:56 GMT""}]","2007-05-23"
"math-ph/0108020","Gennadi Sardanashvily","G.Sardanashvily","Differential geometry of fibre bundles over foliated manifolds","5 pages",,,,"math-ph math.DG math.MP",,"  Any leafwise connection on a fibre bundle over a foliated manifold is proved
to come from a connection on this fibre bundle.
","[{""version"":""v1"",""created"":""Fri, 24 Aug 2001 17:02:48 GMT""}]","2007-05-23"
"math-ph/0108021","Thomas Chen","Thomas Chen","Operator-theoretic infrared renormalization and construction of dressed
  1-particle states in non-relativistic QED","139 pages, slightly modified preprint version of ETH-Diss 14203","Please refer to the revised and extended work in T. Chen,
  ""Infrared renormalization in non-relativistic QED and scaling criticality"",
  J. Funct. Anal., 254 (10), 2555 - 2647, 2008",,,"math-ph math.MP",,"  We consider the infrared problem in a model of a freely propagating,
nonrelativistic charged particle of mass 1 in interaction with the quantized
electromagnetic field. The hamiltonian of the system is regularized by an
infrared cutoff $\ssig\ll 1$ and an ultraviolet cutoff $\Lambda\sim 1$ in the
interaction term, in units of the mass of the charged particle. Due to
translation invariance, it suffices to study $\Hps$, the restriction of the
hamiltonian to the fibre Hilbert space of the conserved momentum operator
associated to total momentum $p\in\R^3$. Under the condition that the coupling
constant $g$ and the conserved momentum $p$ are sufficiently small, the
following statements hold: (1) For every $\ssig>0$, $E_0:=inf spec \Hps$ is an
eigenvalue with corresponding eigenvector $\Omega[p,\ssig]\in\Hp$. (2) For all
$\ssig\geq0$, the first and second derivatives of $(\Egrd-\frac{|p|^2}{2})$ are
$O(g^\delta)$ for some $\delta>0$. (3) $\Omega[p,\ssig]$ is not an element of
the Fock space $\Hp$ in the limit $\ssig\to0$, if $|p|>0$. Our proofs are based
on the operator-theoretic renormalization group of V. Bach, J. Fr\""ohlich, and
I.M. Sigal. The key difficulty in the analysis of this system is connected to
the strictly marginal nature of the leading interaction term, and a main issue
in our exposition is to develop analytic tools to control its renormalization
flow.
","[{""version"":""v1"",""created"":""Fri, 24 Aug 2001 22:10:31 GMT""}]","2009-11-28"
"math/0108165","Robert Travis Kowalski","R. Travis Kowalski","Rational jet dependence of formal equivalences between real-analytic
  hypersurfaces in \C^2","27 pages, LaTeX2e. Some minor notational changes and typographical
  errors have been replaced",,,,"math.CV",,"  Let (M,p) and (M',p') be the germs of real-analytic 1-infinite type
hypersurfaces in \C^2. We prove that any formal equivalence sending (M,p) into
(M',p') is formally parametrized (and hence uniquely determined by) its jet at
p of a predetermined order depending only on (M,p). As an application, we use
this to examine the local formal transformation groups of such hypersurfaces.
","[{""version"":""v1"",""created"":""Fri, 24 Aug 2001 19:14:54 GMT""},{""version"":""v2"",""created"":""Sun, 16 Feb 2003 02:53:57 GMT""}]","2007-05-23"
"math/0108170","Lorenzo Nicolodi","Emilio Musso, Lorenzo Nicolodi","Special Isothermic Surfaces and Solitons","18 pages, 5 figures, to appear in the AMS Contemporary Mathematics
  Series, ""Proceedings of the Congress in memory of Alfred Gray"" (eds. M.
  Fernandez, J.A. Wolf)","Contemp. Math. 288 (2001), 129-148",,,"math.DG",,"  We establish a correspondence between Darboux's special isothermic surfaces
of type (A,0,C,D) and the solutions of the second order PDE :
u\Delta(u)-|\nabla(u)|^{2}+\Phi^{4}=s, s \in R. We then use the classical
Darboux transformation for isothermic surfaces to construct a B\""acklund
transformation for this equation and prove a superposition formula for its
solutions. As an application we discuss 1 and 2-soliton solutions and the
corresponding surfaces.
","[{""version"":""v1"",""created"":""Fri, 24 Aug 2001 17:58:24 GMT""}]","2007-12-06"
"math/0108171","Timo Seppalainen","Timo Seppalainen and Sunder Sethuraman","Transience of second-class particles and diffusive bounds for additive
  functionals in one-dimensional asymmetric exclusion processes","22 pages","Ann. Probab. 31 (2003), 148-169",,,"math.PR",,"  Consider a one-dimensional exclusion process with finite-range
translation-invariant jump rates with non-zero drift. Let the process be
stationary with product Bernoulli invariant distribution at density \rho. Place
a second class particle initially at the origin. For the case \rho different
from 1/2 we show that the time spent by the second class particle at the origin
has finite expectation. This strong transience is then used to prove that
variances of additive functionals of local mean-zero functions are diffusive
when \rho is not 1/2. As a corollary to previous work, we deduce the invariance
principle for these functionals. The main arguments are comparisons of H_{-1}
norms, a large deviation estimate for second-class particles, and a relation
between occupation times of second-class particles and additive functional
variances.
","[{""version"":""v1"",""created"":""Fri, 24 Aug 2001 17:28:31 GMT""}]","2007-05-23"
"math/0108172","George Lusztig","G. Lusztig","Lectures on affine Hecke algebras with unequal parameters","82 pages",,,,"math.RT",,"  These are notes for lectures given at MIT in 1999 (Fall). They contain a
discussion of affine Hecke algebras with possibly unequal parameters including
a theory of cells and a partly conjectural theory of J-rings.
","[{""version"":""v1"",""created"":""Fri, 24 Aug 2001 18:31:10 GMT""}]","2007-05-23"
