"math/0108173","George Lusztig","G. Lusztig","Cuspidal local systems and graded Hecke algebras,III","45 pages",,,,"math.RT",,"  We prove a strong induction theorem for graded Hecke algebras and we classify
the tempered and square integrable representations of such algebras using
methods of equivariant homology.
","[{""version"":""v1"",""created"":""Fri, 24 Aug 2001 18:40:08 GMT""}]","2007-05-23"
"math/0108174","Timo Seppalainen","Timo Seppalainen","Diffusive fluctuations for one-dimensional totally asymmetric
  interacting random dynamics","70 pages","Comm. Math. Phys. 229 (2002), 141-182 (shortened version)","10.1007/s002200200660",,"math.PR math-ph math.MP",,"  We study central limit theorems for a totally asymmetric, one-dimensional
interacting random system. The models we work with are the
Aldous-Diaconis-Hammersley process and the related stick model. The A-D-H
process represents a particle configuration on the line, or a 1-dimensional
interface on the plane which moves in one fixed direction through random local
jumps. The stick model is the process of local slopes of the A-D-H process, and
has a conserved quantity. The results describe the fluctuations of these
systems around the deterministic evolution to which the random system converges
under hydrodynamic scaling. We look at diffusive fluctuations, by which we mean
fluctuations on the scale of the classical central limit theorem. In the
scaling limit these fluctuations obey deterministic equations with random
initial conditions given by the initial fluctuations. Of particular interest is
the effect of macroscopic shocks, which play a dominant role because dynamical
noise is suppressed on the scale we are working.
","[{""version"":""v1"",""created"":""Fri, 24 Aug 2001 20:17:35 GMT""}]","2009-11-07"
"math/0108175","Christopher J. Pappacena","Christopher J. Pappacena","The injective spectrum of a noncommutative space","35 pages",,,,"math.QA math.RA",,"  For a noncommutative space X, we study Inj(X), the set of isomorphism classes
of indecomposable injective X-modules. In particular, we look at how this set,
suitably topologized, can be viewed as an underlying ""spectrum"" for X. As
applications we discuss noncommutative notions of irreducibility and
integrality, and a way of associating an integral subspace of X to each element
of Inj(X) which behaves like a ""weak point.""
","[{""version"":""v1"",""created"":""Fri, 24 Aug 2001 20:53:17 GMT""}]","2007-05-23"
"nlin/0108047","Eli Ben-Naim","E. Ben-Naim, P.L. Krapivsky","Parity and Ruin in a Stochastic Game","4 pages, 1 figure","Eur. Phys. Jour. B 25, 239 (2002)","10.1140/epjb/e20020027",,"nlin.AO cond-mat.stat-mech nlin.CG",,"  We study an elementary two-player card game where in each round players
compare cards and the holder of the smallest card wins. Using the rate
equations approach, we treat the stochastic version of the game in which cards
are drawn randomly. We obtain an exact solution for arbitrary initial
conditions. In general, the game approaches a steady state where the card
densities of the two players are proportional to each other. The leading small
size behavior of the initial card densities determines the corresponding
proportionality constant, while the next correction governs the asymptotic time
dependence. The relaxation towards the steady state exhibits a rich behavior,
e.g., it may be algebraically slow or exponentially fast. Moreover, in ruin
situations where one player eventually wins all cards, the game may even end in
a finite time.
","[{""version"":""v1"",""created"":""Sat, 25 Aug 2001 00:07:00 GMT""}]","2007-05-23"
"nucl-ex/0108024","Nigel Orr","N.A. Orr","Haloes and Clustering in Light, Neutron-Rich Nuclei","5 pages, 5 figures Extended version of written contribution of
  invited talk to ENAM2001","Eur.Phys.J.A15:109-113,2002","10.1140/epja/i2001-10236-6",,"nucl-ex",,"  Clustering is a relatively widespread phenomena which takes on many guises
across the nuclear landscape. Selected topics concerning the study of halo
systems and clustering in light, neutron-rich nuclei are discussed here through
illustrative examples taken from the Be isotopic chain.
","[{""version"":""v1"",""created"":""Fri, 24 Aug 2001 16:00:06 GMT""}]","2011-07-19"
"nucl-th/0108057","Ruprecht Machleidt","D. R. Entem and R. Machleidt (University of Idaho)","Accurate Nucleon-Nucleon Potential Based upon Chiral Perturbation Theory","7 pages RevTex, 3 figures, 1 table","Phys.Lett.B524:93-98,2002","10.1016/S0370-2693(01)01363-6",,"nucl-th nucl-ex",,"  We present an accurate nucleon-nucleon ($NN$) potential based upon chiral
effective Lagrangians. The model includes one- and two-pion exchange
contributions up to chiral order three. We show that a quantitative fit of the
$NN$ $D$-wave phase shifts requires contact terms (which represent the short
range force) of order four. Within this framework, the $NN$ phase shifts below
300 MeV lab. energy and the properties of the deuteron are reproduced with
high-precision. This chiral $NN$ potential represents a reliable starting point
for testing the chiral effective field theory approach in exact few-nucleon and
microscopic nuclear many-body calculations. An important implication of the
present work is that the chiral $2\pi$ exchange at order four is of crucial
interest for future chiral $NN$ potential development.
","[{""version"":""v1"",""created"":""Fri, 24 Aug 2001 18:46:29 GMT""}]","2010-04-06"
"nucl-th/0108058","Debora Peres Menezes","C. Providencia, D.P.Menezes and L. Brito","Relativistic Thomas-Fermi description of Sm isotopes at finite
  temperature","24 pages, 5 figures, 9 tables","Nucl.Phys. A703 (2002) 188-201","10.1016/S0375-9474(01)01334-3",,"nucl-th",,"  The caloric curve (excitation energy per particle as a function of
temperature) for finite nuclei is calculated within the non-linear Walecka
model for different proton fractions and different parameterizations. The
results obtained are compared with published experimental data and other
theoretical results. Other properties related with the droplet formation as the
surface energy, neutron skin thickness and binding energy per nucleon are also
displayed as a function of temperature and their behaviours are discussed. It
is shown that the caloric curve is sensitive to the proton fraction and to the
Coulomb interaction. At T=0 the droplet properties do not depend on the
parameterization used. At finite temperature however, the sensitivity appears.
","[{""version"":""v1"",""created"":""Fri, 24 Aug 2001 20:02:31 GMT""}]","2009-11-07"
"nucl-th/0108059","Gautam Rupak","Gautam Rupak and Xin-wei Kong","Quartet S-wave p-d scattering in EFT","17 pages LaTeX2e with 6 figures; appendix added, typos corrected","Nucl.Phys. A717 (2003) 73-90","10.1016/S0375-9474(03)00638-9","TRI-PP-01-13","nucl-th nucl-ex",,"  We present a power counting to include Coulomb effects in the three-nucleon
system in a low-energy pionless effective field theory (EFT). With this power
counting, the quartet S-wave proton-deuteron elastic scattering amplitude is
calculated. The calculation includes next-to-leading order (NLO) Coulomb
effects and next-to-next-to-leading order (NNLO) strong interaction effects,
with an estimated theoretical error of about 7 %. The EFT results agree with
potential model calculations and phase shift analysis of experimental data
within the estimated errors.
","[{""version"":""v1"",""created"":""Fri, 24 Aug 2001 21:48:45 GMT""},{""version"":""v2"",""created"":""Mon, 13 Jan 2003 22:39:18 GMT""}]","2009-11-07"
"physics/0108047","Sergey Porsev","Sergey Porsev and Andrei Derevianko","High-accuracy relativistic many-body calculations of van der Waals
  coefficients C_6 for alkaline-earth atoms","5 pages, submitted to Phys. Rev. A","Phys. Rev. A. 65, 020701(R) (2002)","10.1103/PhysRevA.65.020701",,"physics.atom-ph",,"  Relativistic many-body calculations of van der Waals coefficients C_6 for
dimers correlating to two ground state alkaline-earth atoms at large
internuclear separations are reported. The following values and uncertainties
were determined : C_6 = 214(3) for Be, 627(12) for Mg, 2221(15) for Ca,
3170(196) for Sr, and 5160(74) for Ba in atomic units.
","[{""version"":""v1"",""created"":""Fri, 24 Aug 2001 21:09:41 GMT""}]","2009-11-07"
"physics/0108048","J. E. Clendenin","P.R. Bolton, J.E. Clendenin, D.H. Dowell, M. Ferrario, A.S. Fisher,
  S.M. Gierman, R.E. Kirby, P. Krejcik, C.G. Limborg, G.A. Mulhollan, D.
  Nguyen, D.T. Palmer, J.B. Rosenzweig, J.F. Schmerge, L. Serafini, X.-J. Wang","Photoinjector design for the LCLS","13 pages (double spaced), 4 figures, contributed to The 23rd
  International Free Electron Laser Conference, Darmstadt, Germany, 20-24
  August 2001","Nucl.Instrum.Meth. A483 (2002) 296-300","10.1016/S0168-9002(02)00331-5","SLAC-PUB-8962","physics.acc-ph",,"  The design of the Linac Coherent Light Source assumes that a low-emittance,
1-nC, 10-ps beam will be available for injection into the 15-GeV linac. The
proposed rf photocathode injector that will provide a 150-MeV beam with rms
normalized emittances of 1 mm in both the transverse and longitudinal
dimensions is based on a 1.6-cell S-band rf gun that is equipped with an
emittance compensating solenoid. The booster accelerator is positioned at the
beam waist coinciding with the first emittance maximum and is provided with an
accelerating gradient of ~25 MeV/m, i.e., the ""new working point."" The uv
pulses required for cathode excitation will be generated by tripling the output
of a Ti:sapphire laser system consisting of a highly stable cw mode-locked
oscillator and two bow-tie amplifiers pumped by a pair of Q-switched Nd:YAG
lasers. The large bandwidth of the Ti:sapphire system accommodates the desired
temporal pulse shaping. Details of the design and the supporting simulations
are presented.
","[{""version"":""v1"",""created"":""Fri, 24 Aug 2001 22:57:41 GMT""},{""version"":""v2"",""created"":""Mon, 5 Nov 2001 00:26:39 GMT""},{""version"":""v3"",""created"":""Tue, 6 Nov 2001 01:45:13 GMT""}]","2009-11-07"
"quant-ph/0108111","Xiang-Bin Wang","Wang Xiang-Bin and Matsumoto Keiji","On the nonadiabatic geometric quantum gates",,,,,"quant-ph",,"  Motivated for the fault tolerant quantum computation, quantum gate by
adiabatic geometric phase shift is extensively investigated. In this paper, we
demonstrate the nonadiabatic scheme for the geometric phase shift and
conditional geometric phase shift. Essentially, the new scheme is simply to add
an appropriate additional field. With this additional field, the state
evolution can be controlled exactly on a dynamical phase free path. Geometric
quantum gates for single qubit and the controlled NOT gate for two qubits are
given.
","[{""version"":""v1"",""created"":""Fri, 24 Aug 2001 17:14:35 GMT""},{""version"":""v2"",""created"":""Sun, 26 Aug 2001 05:04:57 GMT""}]","2007-05-23"
